title,price,dateMarvel Comics Frankenstein Monster # 6 w/ Last Of Franken Vintage Old Comic,19.99,2020-11-03 00:00:00
"1963 Marx Universal Monsters 6"" figure of Frankenstein in teal blue plastic",36.8,2020-11-03 00:00:00
Marvel Comics Frankenstein Monster # 7 W/ Fiend & Fury 1973 Vintage Old Comic,19.99,2020-11-03 00:00:00
Universal Monsters FRANKENSTEIN & BRIDE OF FRANKENSTEIN Animated Cloche NEW 2020,25.0,2020-11-03 00:00:00
Marvel Comics Frankenstein Monster # 13 w/ Runs Amok 1974 Vintage Old Comic Book,19.99,2020-11-03 00:00:00
Funko Pop Frankenstein #607 Walgreens Exclusive Glow In The Dark,15.5,2020-11-03 00:00:00
Marvel Comics Frankenstein Monster # 10 w/ Death STR 1974 Vintage Old Comic Book,20.24,2020-11-03 00:00:00
Frankenstein #1 and #2 (Ploog cover),32.4,2020-11-03 00:00:00
Universal Studios Monsters Boris Karloff Frakenstein Series One *NEW*,59.17,2020-11-03 00:00:00
"Sideshow Universal Monsters Bride of Frankenstein Elsa Lanchester 8"" Series Two",33.0,2020-11-03 00:00:00
EVH Striped Series Frankie Frankenstein Relic Electric Guitar Red/Black/White,2926.7,2020-11-03 00:00:00
eddie van halen red frankenstein high tops size 10,282.77,2020-11-03 00:00:00
MARVEL TEAM-UP #36 (1975) Spider-Man & The Frankenstein Monster VG,0.99,2020-11-03 00:00:00
"Young Frankenstein, Mel Brooks, Special Edition DVD, 20th Century Fox, 1998",3.15,2020-11-03 00:00:00
The Bride of Frankenstein: Alex Ross SteelBook Art [Blu-ray] - NEW & SEALED,24.49,2020-11-03 00:00:00
Frankenstein #3 Sketch Card Limited 41/50 Edward Vela Signed,2.99,2020-11-03 00:00:00
Gorgeous Frankenstein Doyle Cancerslug Glow In The Dark Size L Sweatshirt,34.99,2020-11-03 00:00:00
Monster High Doll Frankie Stein Ghouls Rule Daughter Of Frankenstein EUC,5.0,2020-11-03 00:00:00
Frankenstein Mask Universal Monsters Boris Karloff Halloween Costume Accessory,20.51,2020-11-03 00:00:00
"Universal Monsters Silver Screen Frankenstein Karloff Sideshow Toys 7.5"" 2000",39.99,2020-11-03 00:00:00
"Frankenstein Underground by Mike Mignola (2015, Trade Paperback)",7.49,2020-11-03 00:00:00
VAN HALEN FRANKENSTEIN BAR STOOL * HEAVY DUTY & LIGHT USE * SOLD OUT VERY RARE,345.0,2020-11-03 00:00:00
NIB McFarlane Toys Mcfarlane Monsters Series 1 Frankenstein Action Figure,17.5,2020-11-03 00:00:00
Frankenstein Agent of SHADE Volume 1 War of the Monsters DC New 52 TPB BRAND NEW,1.25,2020-11-03 00:00:00
The Creature Commandos Complete DC TPB BRAND NEW J.M. DeMatteis Frankenstein,5.06,2020-11-03 00:00:00
VINTAGE COLGATE PALMOLIVE FRANKENSTEIN MONSTER SOAKY UNIVERSAL PICTURES 1960'S,100.0,2020-11-03 00:00:00
"Victor Frankenstein (DVD, 2016)Victor Frankenstein Dolby, Dubbed Subt like new",0.99,2020-11-03 00:00:00
Amazon Employee PECCY HALLOWEEN FRANKENSTEIN PIN 2020,50.0,2020-11-03 00:00:00
The Monster of Frankenstein Complete Marvel Deluxe TPB NEW RARE Dracula Werewolf,5.06,2020-11-03 00:00:00
"Schylling Sock Monkey ""Franken Sock""  Frankenstein Stuffed Plush toy Halloween ",25.77,2020-11-03 00:00:00
Avengers Legion of the Unliving Complete Marvel TPB BRAND NEW Frankenstein Thor,2.49,2020-11-03 00:00:00
Faded glory Newborn Blue Jeans  Baby Boy Pants Sz Newborn,20.99,2020-11-03 00:00:00
Horror VHS Tapes Dracula Frankenstein Phantom of The Opera Vampires The Devils,31.0,2020-11-03 00:00:00
OLD 1960s VINTAGE HAND PAINTED FRANKENSTEIN HEAD PENCIL TOPPER GUM BALL PREMIUM,9.99,2020-11-03 00:00:00
"MONSTER OF FRANKENSTEIN Lot #3,4,10 (May 1973, Marvel) - NICE!",12.99,2020-11-03 00:00:00
Anita Page Autograph Silent Movie Actress In Frankenstein Rising Signed Page,35.24,2020-11-03 00:00:00
INVADERS #31 (1978) About VF Frankenstein Monster,6.75,2020-11-03 00:00:00
CLASSIC MONSTERS  POSTERZINE #1 FRANKENSTEIN MEETS THE WOLF MAN,5.0,2020-11-03 00:00:00
Parade Collector's Edition Frankenstein 200th Anniversary ,6.0,2020-11-03 00:00:00
 8X10 B & W PHOTO OF-CLOSE UP- ELSA LANCHESTER - BRIDE OF FRANKENSTEIN,5.02,2020-11-03 00:00:00
UNIVERSAL STUDIOS MONSTERS LITTLE BIG HEADS LOT SERIES ONE 1 1998 FRANKENSTEIN ,94.25,2020-11-04 00:00:00
"VIGOR Animated FRANKENSTEIN'S Monster HALLOWEEN Doll-1997 14""",44.49,2020-11-04 00:00:00
Frankenstein by Mary Shelley (English) Hardcover Book Free Shipping!,9.5,2020-11-04 00:00:00
Frankenstein by Francesco Francavilla Mondo Red edition,382.0,2020-11-04 00:00:00
Thor #8 - Frankensteins Thor Horror Variant Cover by Leinil Frances Yu,0.99,2020-11-04 00:00:00
"Castle of Frankenstein, #13, Dark Shadows, 2001, Planet of the Apes, VG cond.",9.99,2020-11-04 00:00:00
BRUYERE EXTRA FRANKENSTEIN TOBACCO PIPE,12.5,2020-11-04 00:00:00
(14) Frankenstein #1-18 RUN with Super KEYS #1 and 2! Origin & Bride! NO RESERVE,61.0,2020-11-04 00:00:00
sl08 Original Slide 1973 Frankenstein Convertible Car Universal Studios 909a,21.5,2020-11-04 00:00:00
UNIVERSAL STUDIOS MONSTERS LITTLE BIG HEADS LOT SERIES ONE 1 1998 FRANKENSTEIN ,81.25,2020-11-04 00:00:00
Funko Pop - Franken Freddy Funko Shop Exclusive Frankenstein Funkoween,46.0,2020-11-04 00:00:00
NEW BURGER KING 2003 HAMTARO HALLOWEEN FRANKENSTEIN HAMSTER ,17.99,2020-11-04 00:00:00
Bride of Frankenstein Original Artwork 11x17,33.0,2020-11-04 00:00:00
2002 Jack in the Box Frankenstein,2.99,2020-11-04 00:00:00
"Victor , Creepy OOAK Horror Baby Doll. Frankenstein Demon Reborn. Scary Doll",155.0,2020-11-04 00:00:00
Monster High Doll Ever After lot 4 Ooak Spectra Cat Nile Luna Frankenstein Parts,39.5,2020-11-04 00:00:00
" Vintage Frankenstein, Ghost,Dracula and Scarecrow Blowmold ",24.99,2020-11-04 00:00:00
Boris Karloff by lake Frankenstein RARE Photo,50.49,2020-11-04 00:00:00
Primitive Halloween Frankenstein Doll  With Pumpkin ~ Handmade,130.0,2020-11-04 00:00:00
Bernie Wrightson Frankenstein HC Hardcover Dark Horse Comics,97.69,2020-11-04 00:00:00
Funko POP Freddy Funko as Frankenstein Freaky Tiki Fundays SDCC 2019 SE (350 LE),560.0,2020-11-04 00:00:00
"Tattoo,Frankenstein, Frankenstein’s Monster, Kustom Kulture,Universal Monster",54.0,2020-11-04 00:00:00
"UNIVERSAL SIDESHOW MONSTERS ""BRIDE OF FRANKENSTEIN"" 12"" FIGURE, NEW IN BOX",122.0,2020-11-04 00:00:00
Mcfarlane Toys Dr frankenstein Playset Series 2,30.3,2020-11-04 00:00:00
Burger King 1997 Frankenstein Universal Studios Monsters Figure Kids Meal Toy,5.0,2020-11-04 00:00:00
Vintage 1974 Mego Frankenstein Original Mad Monsters Action Figure 8”,54.5,2020-11-04 00:00:00
Funko Pop - Franken Freddy Funko Shop Exclusive Frankenstein Funkoween,25.0,2020-11-04 00:00:00
"DVD 4 MOVIE COLLECTION, RETURN OF THE VAMPIRE, REVENGE OF FRANKENSTEIN, OOP",19.99,2020-11-04 00:00:00
RARE VIOLENT J FRANKENSTEIN FOOTBALL JERSEY HALLOWICKED (XXXL),150.0,2020-11-04 00:00:00
 CASTLE FILMS # 1013 BRIDE OF FRANKENSTEIN SUPER 8 MM B&W FILM,21.5,2020-11-04 00:00:00
Universal Monsters Vintage Squishy Frankenstein Mummy Talking Heads,13.5,2020-11-04 00:00:00
Criminal Macabre The Eyes of Frankenstein Dark Horse TPB BRAND NEW Steve Niles,0.99,2020-11-04 00:00:00
Famous Monsters of Filmland #100: 100th Great Issue/Frankenstein,13.0,2020-11-04 00:00:00
1997 Burger King Universal Studios Monster Frankenstein    MIP  A,24.0,2020-11-04 00:00:00
Reader scene Mats To be used as Ad Mats-Frankenstein Asylum Of Horrors ,50.0,2020-11-04 00:00:00
MISFITS Doyle Wolfgang Von Frankenstein Vinyl Figure Toy Medicom DANZIG,90.0,2020-11-04 00:00:00
FUNKO POP UNIVERSAL MONSTERS BRIDE OF FRANKENSTEIN #113GITD HotTopic W/PROTECTOR,81.0,2020-11-04 00:00:00
Vintage 1960s MPC mini Monsters 7 Mummy Witch Dracula Frankenstein 2”,64.0,2020-11-04 00:00:00
FRANKENSTEIN #13 MARVEL COMICS 11/74 FN- THE UNDYING FIEND! MOENCH & MAYERIK! ,19.75,2020-11-04 00:00:00
"Flesh For Frankenstein (Andy Warhol, 1973) original Aussie VHS on Roadshow!",44.35,2020-11-04 00:00:00
GENE WILDER signed YOUNG FRANKENSTEIN 8x10 w/ coa CLASSIC SCENE CREATING MONSTER,51.0,2020-11-05 00:00:00
"Remco Frankenstein Monster 8"" Figure Loose Incomplete",25.0,2020-11-05 00:00:00
The MONSTER of FRANKENSTEIN issue 1 (1973) MIKE PLOOG Cover and Art!,0.99,2020-11-05 00:00:00
Frankenstein #2 Dell Comic (Frankenstein Meets Mr.Freek),5.0,2020-11-05 00:00:00
Bernie Wrightson lifesize 1/1 resin sideshow recast  bust HUGE display ,430.0,2020-11-05 00:00:00
Funko Pop! Frankenstein GITD Walgreens Exclusive,6.7,2020-11-05 00:00:00
Universal Studios Monsters FRANKENSTEIN Doll Kenner 1998 ,15.5,2020-11-05 00:00:00
Famous Monsters of Filmland #49 FN/VF Warren Publishing Dracula Frankenstein,25.5,2020-11-05 00:00:00
Famous Films #2 Curse of Frankenstein VF- Horror Monster Magazine Cushing Lee,25.95,2020-11-05 00:00:00
Official EVH Van Halen Low Top Frankenstein Sneakers Size 12,125.0,2020-11-05 00:00:00
Francavilla Bride of Frankenstein Reg xx/275 ORDER CONFIRMED,77.0,2020-11-05 00:00:00
"Abbott & Costello Meet Frankenstein...original, acrylic paint/ink illustration",47.0,2020-11-05 00:00:00
"original 1930's Boris Karloff ""Frankenstein""  publicity photo",41.46,2020-11-05 00:00:00
Funko Pop! Universal Studios Monsters Frankenstein #607 Walgreens Exclusive,10.5,2020-11-05 00:00:00
Frankenstein Troll Doll Russ,17.5,2020-11-05 00:00:00
Young Frankenstein,14.0,2020-11-05 00:00:00
"Vintage Imperial 1986 Universial Monsters Dracula, The Wolfman, Frankenstein",19.77,2020-11-06 00:00:00
RARE MOEBIUS GIGANTIC FRANKENSTEIN PLASTIC ASSEMBLY KIT NO. 470 NIB,53.0,2020-11-06 00:00:00
Universal Monsters glass Creature Lagoon Bride of Frankenstein Dracula Wolfman ,3.95,2020-11-06 00:00:00
Universal Monsters Animated Reel Movie Projector w/Sound Frankenstein Halloween,20.0,2020-11-06 00:00:00
Universal Monsters Talking Light Up Frankenstein Head Under Dome Cloche NWT,38.0,2020-11-06 00:00:00
1994 Monogram FRANKENSTEIN Aurora Reissue Model Kit with Glow Paint Bonus Pack,38.0,2020-11-06 00:00:00
1999 Stuffins CVS Universal Studios Monster 8 Inch FRANKENSTEIN Plush Beanie NEW,5.5,2020-11-06 00:00:00
Halloween Wind Up Frankenstein ,3.3,2020-11-06 00:00:00
16mm Film---ABBOTT-COSTELLO MEET FRANKENSTEIN----400'  LIKE NEW PRINT,150.0,2020-11-07 00:00:00
THOR #8 2020 LEINIL FRANCIS YU FRANKENSTEIN HORROR VARIANT MARVEL COMICS,1.29,2020-11-07 00:00:00
Monster High 2014 Coffin Bean FRANKIE STEIN Daughter of Frankenstein,14.99,2020-11-07 00:00:00
Vintage Aurora Frankenstein Monster Model 1961,37.0,2020-11-07 00:00:00
Vintage 1980 Remco Frankenstein Monster Universal Studios Action Figure.  ,13.5,2020-11-07 00:00:00
Vintage 1990s TOMY Game BOLT N STEIN Frankenstein Monster Game,15.0,2020-11-07 00:00:00
FRANKENSTEIN SOAKY BUBBLE BATH TOY UNIVERSAL PICTURES MONSTER,88.88,2020-11-07 00:00:00
Polar Lights The Bride of Frankenstein 1997 Praying Mantis,35.0,2020-11-07 00:00:00
"BRIDE of FRANKENSTEIN Universal Studios Monster 1999 Stuffins 8"" Plush Doll CVS ",9.95,2020-11-07 00:00:00
AURORA 1969 FRIGHTENING LIGHTNING STRIKES FRANKENSTEIN Model Kit Rare!!,560.0,2020-11-07 00:00:00
MARX 1965 Frankenstein Monster Wind-Up Toy,362.51,2020-11-07 00:00:00
Vintage Monster Men FRANKENSTEIN Toy Hong Kong 60s NIk Troll Doll Figure NEW,283.1,2020-11-07 00:00:00
Louis Marx And Company Inc. Frankenstein 5“ X 2.5“,15.83,2020-11-07 00:00:00
Funko Pop! The Bride Of Frankenstein GITD Hot Topic Exclusive,75.0,2020-11-07 00:00:00
Funko Pop! Frankenstein GITD Hot Topic Exclusive,55.0,2020-11-07 00:00:00
Cute Frankenstein Costume Baby Boys 12-18 Months ,5.36,2020-11-07 00:00:00
"Vintage Monster Nik King Kong, brown, no clothes. Monster Men",199.0,2020-11-07 00:00:00
"Vintage Monster Nik Frankenstein, blue, original outfit. Monster Men",225.0,2020-11-07 00:00:00
"De Luxe FRANKENSTEIN FIGURE – Monster Slayer Van Helsing Series, Jakks Pacific 2",4.03,2020-11-07 00:00:00
"Vintage Monster Nik Frankenstein, green, original clothes, Monster Men",227.5,2020-11-07 00:00:00
"Vintage Monster Nik Frankenstein, white, no clothes. Monster Men",199.0,2020-11-07 00:00:00
"Sideshow Frankenstein Fritz Figure 12"" NIB Universal Monsters 2001 Carl Laemmle",20.5,2020-11-07 00:00:00
Funko Pop Animation Hanna Barbera Frankenstein Jr 03 (Refer To Box Condition),28.29,2020-11-07 00:00:00
RALPH BELLAMY - SIGNED BOOK PAGE PHOTO - GHOST OF FRANKENSTEIN / WOLFMAN STAR!,25.0,2020-11-07 00:00:00
Frankenstein - Commodore 64 C64 Cassette - Zeppelin Games 1992 - VGC,4.69,2020-11-07 00:00:00
SIDESHOW MONSTERS LEGACY FRANKENSTEIN DRACULA WOLFMAN POLYSTONE BUST SET EX,131.87,2020-11-07 00:00:00
Scotty Cameron Halloween Release NEW Shankenstein Head Cover RARE! ,300.0,2020-11-07 00:00:00
Funko Pop! Frankenstein GITD Walgreens Exclusive,10.5,2020-11-07 00:00:00
"Norton Critical Editions Ser.: Frankenstein by Mary Shelley (2011, Trade Paperb…",1.54,2020-11-07 00:00:00
Abbott and Costello Meet Frankenstein: (Universal Filmscripts Series Classic ...,15.5,2020-11-07 00:00:00
"Universal Studios Monsters - Frankenstein Sideshow Toys 12"" Figure 1/6 Scale",50.0,2020-11-07 00:00:00
Monster High Dolls X 3 Franken Stein,15.46,2020-11-07 00:00:00
Gothic Handbag Frankenstein’s Bride Whitby Halloween ,26.88,2020-11-07 00:00:00
LOT # 9: 12 REPRODUCTION HORROR MOVIE LOBBY CARDS~FRANKENSTEIN~BAT~WOLF MAN~,81.26,2020-11-08 00:00:00
"FRITZ 12"" Figure Frankenstein Sideshow Universal Monsters NIB! ZQ/L",88.36,2020-11-08 00:00:00
Japanese Tin Wind Up Mystery Bank 1960s Frankenstein Nomura Toy Co Quarters ,40.0,2020-11-08 00:00:00
Black White Movie Still  Frankenstein Meets Wolf Man,11.99,2020-11-08 00:00:00
Funko POP #606 Frankenstein GITD Special Edition U.K. Based In Hand,56.45,2020-11-08 00:00:00
Nike Classic Cortez Leather Womens AV4618-200 Smokey Mauve Beige Shoes Size 7.5 ,15.4,2020-11-08 00:00:00
CPSM cinema universal studio frankenstein non voyagee,4.82,2020-11-08 00:00:00
VTG 1960s Frankenstein Soaky Soap Container Character Figure Halloween Monster,62.0,2020-11-08 00:00:00
"FRANKENSTEIN 12"" Sideshow Universal Monsters 2000 ",51.0,2020-11-08 00:00:00
UNIVERSAL MONSTERS SCARE FRESHENERS (FRANKENSTEIN+CREATURE BLACK LAGOON) Car blu,11.9,2020-11-08 00:00:00
World Market Frankenstein / Bride Set of 2 Plates 8 inch,26.0,2020-11-08 00:00:00
✨ Frankenstein (1931) - Boris Karloff - Movie Theater Poster Mylar - 5x25,44.99,2020-11-08 00:00:00
BRIDE OF FRANKENSTEIN Universal Monsters Hasbro Signature Series 12” Figure,40.0,2020-11-08 00:00:00
"FRITZ 12"" Figure Frankenstein Sideshow Universal Monsters NIB! ZQ/L",92.91,2020-11-08 00:00:00
"VINTAGE BRASS KNIFE SWITCH - STEAMPUNK/FRANKENSTEIN , STONE - SLATE BASE",25.9,2020-11-08 00:00:00
"VINTAGE 1980 REMCO 3.75"" ""FRANKENSTEIN"" UNIVERSAL MONSTERS GLOW MINT FIGURE MOC",107.5,2020-11-08 00:00:00
Decorative Goose Halloween Outfit Eunice Bride Of Frankenstein,66.1,2020-11-08 00:00:00
Decorative goose Frankenstein Halloween Outfit,27.14,2020-11-08 00:00:00
Resurrection of Monstress Franken Steela Action Figure MOC Yellow Submarine B1,7.0,2020-11-08 00:00:00
GPK Garbage Gang 1986 Garbage Pail Kids PSA Graded FRANKENSTEIN Sticker HORROR,20.17,2020-11-08 00:00:00
"Lot (10) 8mm Movies Film  Monster,Horror,Frankenstein,Abbott & Costello titles",66.0,2020-11-08 00:00:00
Vintage 18 Inch Frankenstein Pl. Street Sign Halloween Decoration,7.99,2020-11-08 00:00:00
Vintage Heroes Of The Horrors Book Old Movies Dracula Frankenstein Chaney Price ,10.0,2020-11-08 00:00:00
HALLOWEEN MARIO CHIODO STUDIOS FRANKENSTEIN FULL HEAD MASK-MONSTER-RUBBER-RARE**,39.0,2020-11-08 00:00:00
"Frankenstein Monster Figure, Bride of Frankenstein, NR",1.99,2020-11-08 00:00:00
"Sideshow Toys, Young Frankenstein 12 In Igor Action Figure",119.0,2020-11-08 00:00:00
"Vintage 1978 Ideal Frankenstein on his Chopper Cycle Frankencycle, Glow, Rare.",247.39,2020-11-08 00:00:00
Vtg Russ Trolls 5” Halloween Dracula One Eye Frankenstein Witch Skeleton Pumpkin,50.0,2020-11-08 00:00:00
ANTIQUE QUACK MEDICAL DYNAMOTHERM ELECTRIC SHOCK MACHINE FRANKENSTEIN MAN CAVE,416.79,2020-11-08 00:00:00
Imperial Stretchable Universal Monsters Frankenstein Figure,6.99,2020-11-08 00:00:00
Lego Minifigures Series 4 Frankenstein Monster,2.68,2020-11-08 00:00:00
Mel Brooks' Annotated Young Frankenstein : The Behind the Scenes Story of the...,9.99,2020-11-08 00:00:00
Movie Posters Sci-fi Horror 2 Sketch Bride of Frankenstein - Art by Unknown?,13.04,2020-11-08 00:00:00
"Universal Monsters Silver Screen Frankenstein Karloff Sideshow Toys 7.5"" 2000",28.0,2020-11-08 00:00:00
Frankenstein Mary Wollstonecraft Shelley 1818 text Bobbs Merrill 1974,4.99,2020-11-08 00:00:00
RARE 2007 EDDIE VAN HALEN FRANKENSTEIN BUILD GUITAR PICK (300) ONLY PACK OF 5 IN,127.5,2020-11-08 00:00:00
RARE 2007 EDDIE VAN HALEN FRANKENSTEIN GUITAR BUILT CERTIFIED AUTOGRAPHED INSERT,1076.51,2020-11-08 00:00:00
1987-88 Ghostbusters Figures Dracula Frankenstein Eek Venkman Hard Hat Sickness,9.99,2020-11-08 00:00:00
Frankenstein: Through the Monster's Eyes *Interplay* USA PC CD Big Box complete,48.99,2020-11-08 00:00:00
1992 Vintage Frankenstein McDonalds McNugget Buddies Happy Meal Halloween Nugget,12.5,2020-11-08 00:00:00
Aurora Frankenstein Model Kit B/U From 1961,69.0,2020-11-08 00:00:00
VTG 2006 Giant Frankenstein Pez Candy Dispenser ~ Makes Noise & Lights Up ~ New,15.5,2020-11-08 00:00:00
"Scooby - Doo jigsaw puzzle ""The case of Frankenstein's Monster""",3.36,2020-11-08 00:00:00
Lego Minifigures Series 4 Frankenstein Monster,3.9,2020-11-08 00:00:00
Tu Light Up frankenstein  Halloween Costume Age 9-10 Years,4.02,2020-11-08 00:00:00
Funko Pop! MONSTERS Frankenstein #607 The Invisible Man #608 Walgreens Exclusive,10.5,2020-11-08 00:00:00
Lularoe Leggings TC 12-22 The Bride Of Frankenstein Excellent Condition ,12.99,2020-11-08 00:00:00
Genuine Lego minifigures Series 4 Frankenstein Monster   minifig,8.73,2020-11-08 00:00:00
T Shirt Frankenstein Joe Post Arockalypse Tour Large Black Short Sleeves,4.95,2020-11-08 00:00:00
Halloween Frankenstein Gothic Horror Anatomical Teddy Bear Art Sculpture,37.65,2020-11-08 00:00:00
"Vintage Monster Men King Kong, Monster Nik",99.0,2020-11-08 00:00:00
"Vintage Monster Men King Kong, Monster Nik",99.0,2020-11-08 00:00:00
"Vintage Monster Men Frankenstein, Monster Nik",99.0,2020-11-08 00:00:00
"Vintage Monster Men Frankenstein, Monster Nik",99.0,2020-11-08 00:00:00
"Vintage Monster Men King Kong, Monster Nik",99.0,2020-11-08 00:00:00
"Papo Fantasy Figures ghost, Frankenstein, vampire, swamp monster, executioner",13.38,2020-11-08 00:00:00
"Universal Monsters Horror Movies MUMMY 7"" Figure",29.58,2020-11-08 00:00:00
Funko Pop! Universal Monsters - Bride of Frankenstein Action FigureNIB,71.0,2020-11-09 00:00:00
Universal Monsters Movies Frankenstein Funko Pop #112 Vaulted / Retired 2014,41.0,2020-11-09 00:00:00
1997  Burger King Universal Monsters Frankenstein Monster Kids Meal Toy,3.99,2020-11-09 00:00:00
Frankenstein’s Monster • Hallmark Keepsake Ornament • Brand New In Original Box,19.95,2020-11-09 00:00:00
"1989 Real Ghostbusters The Frankenstein, Zombie & Dracula Figures Kenner",15.5,2020-11-09 00:00:00
1st Issue Azrak Hamway AHI Frankenstein Figure World Famous Super Monsters MOC,755.0,2020-11-09 00:00:00
Vintage Halloween Frankenstein Wind Up Walker Toy Excellent Condition,57.33,2020-11-09 00:00:00
He's MAD! Remco Frankenstein Near MINT Toy Figure 1980 +11x14 Sigd Art FREE Ship,34.31,2020-11-09 00:00:00
Revell Monsters of the Movies Frankenstein Model Kit Terry Ryan 1/12th Sealed,23.0,2020-11-09 00:00:00
Soaky TAG BOX bubble bath Colgate-Palmalove UNIVERSAL MONSTERS Frankenstein tag ,31.39,2020-11-09 00:00:00
Vintage 1980 Remco Frankenstein Monster Universal Studios Action Figure,25.0,2020-11-09 00:00:00
VINTAGE 60'S FRANKENSTEIN UNIVERSAL STUDIOS CALIFORNIA CA USA SOUVENIR POSTCARD,0.99,2020-11-09 00:00:00
Vintage 1991 Halloween Pencil Toppers Lot Dracula Werewolf Frankenstein,10.0,2020-11-09 00:00:00
DOCTOR WHO ORIGINAL ART DALEK VS FRANKENSTEIN MONSTER B&W LINE ART BY SCOTT GRAY,123.69,2020-11-09 00:00:00
Burger King Frankenstein's monster toy 1997 Complete,24.87,2020-11-09 00:00:00
Carded Lincoln International Frankenstein Vintage Monster Grail Rare Toy,1157.0,2020-11-09 00:00:00
DVDS Mel Brooks' Blazing Saddles And Young Frankenstein Both New In Box,8.0,2020-11-09 00:00:00
 Frankenstein Must Be Destroyed-T.Fisher-Horror-Hammer-Italian 2sh (39x55 inch),86.0,2020-11-09 00:00:00
Vxx EC ZOMBIE Mask frankenstein  comics Vxx-Fx,275.0,2020-11-09 00:00:00
1997 UNIVERSAL MONSTERS BURGER KING KID'S MEAL TOY - FRANKENSTEIN ,2.0,2020-11-09 00:00:00
TMNT Turtles Universal Studios Monsters BRIDE OF FRANKENSTEIN April MOC 1994,36.0,2020-11-09 00:00:00
Frankenstein Caricature Style resin Figurine Comes Unpainted About 10 inch Tall ,60.5,2020-11-09 00:00:00
Vintage Frank 151 MF Doom Tshirt Frankenstein,26.0,2020-11-09 00:00:00
Living Dead Dolls - Frankenstein and the Bride - Boxed,170.75,2020-11-09 00:00:00
halloween Frankenstein Kids Costume BNWT,1.33,2020-11-09 00:00:00
ALEX ROSS WOLFMAN Frankenstein Dracula Monsters giclee paper SIGNED Set Of Three,516.0,2020-11-09 00:00:00
HORROR MOVIE PROMO BADGES X 4 PINS CANDYMAN FRANKENSTEIN  MOUTH OF MADNESS RARE,5.3,2020-11-09 00:00:00
 1997 Polar Lights The Bride Of Frankenstein Model Kit # 5005 New Open Box,50.0,2020-11-10 00:00:00
Halloween Frankenstein Horror VHS Tape Lot Mix,54.35,2020-11-10 00:00:00
1998 UNIVERSAL MONSTERS SIDESHOW FRANKENSTEIN WOLFMAN MUMMY FAO SCHWARZ MIB,86.0,2020-11-10 00:00:00
THE BRIDE OF FRANKENSTEIN. UNIVERSAL. T-SHIRT. SIZE. L,1.01,2020-11-10 00:00:00
"1998 UNIVERSAL MONSTERS BRIDE FRANKENSTEIN 12"" HASBRO MIB",16.5,2020-11-10 00:00:00
1966 Monster Calendar Excellent Wolfman Frankenstein Dracula Creature ,57.56,2020-11-10 00:00:00
1980 REMCO FRANKENSTEIN POSEABLE DOLL W/RING AND PATCH MIB STORE STOCK,98.0,2020-11-10 00:00:00
New 12 Ft Gemmy Inflatable Green Monster Halloween Airblown Blow Up Frankenstein,125.0,2020-11-10 00:00:00
"Frankenstein Created Woman (DVD, 2000) The Hammer Collection Anchor Bay Rare ",14.99,2020-11-10 00:00:00
THE CURSE OF FRANKENSTEIN NEW REGION B BLU-RAY Peter Cushing Hammer Horror ,14.99,2020-11-10 00:00:00
Mighty Max Doom Zone Skull Dungeon Playset 100% Complete Frankenstein 1992,45.0,2020-11-10 00:00:00
Home Interiors Frankenstein Votive Candle Holders ,13.0,2020-11-10 00:00:00
New Womens Grey Bride of Frankenstein Snap Back Baseball Cap Hat Rockabilly,14.76,2020-11-10 00:00:00
Genuine Lego minifigures Series 4 Frankenstein Monster   minifig,9.01,2020-11-10 00:00:00
LEMAX SPOOKY TOWN/HALLOWEEN/UNIVERSAL MONSTER*FRANKENSTEIN*FIGURE/W*STEIN! NEW,6.0,2020-11-10 00:00:00
AK-wartha/Bardo-panelling at the River Neisse UM 1930,8.43,2020-11-10 00:00:00
Eddie Van Halen guitar 5150 Frankenstein Kramer ,790.0,2020-11-10 00:00:00
"Beer Mug Stein Mug, kronacher FREE Shoot 2012, Upper Franconia Bavaria, NEW",4.87,2020-11-10 00:00:00
"Vintage Enesco GARFIELD 1978 Figure 3"" Frankenstein ",23.5,2020-11-11 00:00:00
"Mego TEENAGE WEREWOLF and FRANKENSTEIN 2-PK Box for 8"" Action Figures (BOX ONLY)",27.0,2020-11-11 00:00:00
VINTAGE 1961 AURORA FRANKENSTEIN MODEL KIT ,69.0,2020-11-11 00:00:00
EVH Mesh Shoe Eddie Van Halen Stripes 5150 New Lightweight  Frankenstein,150.0,2020-11-11 00:00:00
Vtg 80's Original TELCO MOTION-ETTE Frankenstein Monster - 24 inches ,85.0,2020-11-11 00:00:00
Skelanimals Pumpkin Kit and Frankenstein Dax,1.5,2020-11-11 00:00:00
"Sideshow Universal Monsters Bride of Frankenstein Elsa Lanchester 8"" Series Two",28.0,2020-11-11 00:00:00
Gigantic Frankenstein - Rare Limited Edition - Frightening Lightening,99.0,2020-11-11 00:00:00
FRANKENSTEIN CREATED WOMAN Hammer - BLU-RAY + SLIPCOVER + COLLECTIBLE CARDS,22.67,2020-11-11 00:00:00
"Young Frankenstein (DVD, 2006) - Like New!",3.26,2020-11-11 00:00:00
YOUNG FRANKENSTEIN 12 Inch Figure IGOR,100.77,2020-11-11 00:00:00
Frankenstein Universal Studios Super 7 ReAction Figure ,75.11,2020-11-11 00:00:00
eddie van halen evh frankenstein mens light weight mesh shoes size 9.5,134.01,2020-11-11 00:00:00
SIDESHOW TOYS FRANKENSTEIN FIGURE UNIVERSAL MONSTERS 8” KARLOFF,95.09,2020-11-11 00:00:00
"FREAKY FRANKY TOY by Games  MONSTER FRANKENSTEIN, ",4.03,2020-11-11 00:00:00
MONSTER HIGH FRANKIE STEIN DOLL 2010 NEW IN BOX DAUGHTER OF FRANKENSTEIN RETIRED,36.5,2020-11-11 00:00:00
Universal Studios Monsters Action Figures WOLFMAN Series 1 Build Frankenstein,29.9,2020-11-11 00:00:00
Danecraft vintage/nos gold tone Frankenstein enamel pin,36.98,2020-11-11 00:00:00
Gemmy 1998 Animated Hip Swinging Monster Mash Frankenstein Halloween w? BOX,20.0,2020-11-11 00:00:00
Frankenstein Mary Shelley Norton Critical edition,1.5,2020-11-11 00:00:00
Vintage 80's Life's a Beach Surfgear Shirt Limited Wanna Bone? Frankenstein Rare,29.99,2020-11-11 00:00:00
Dracula vs. Frankenstein (1970) Cult Horror movie poster print ,20.98,2020-11-11 00:00:00
Frankenstein Diecast Car 1997 Kellogg's Spooky Froot Loops 1:18 Scale,9.99,2020-11-11 00:00:00
KENNER THE REAL GHOSTBUSTERS 1989 MONSTERS FRANKENSTEIN FIGURE COMPLETE ,12.1,2020-11-11 00:00:00
Super 8mm BRIDE OF FRANKENSTEIN 200 ft reel film ,16.5,2020-11-11 00:00:00
Universal Monsters Frankenstein Funko Pop Walgreens Exc. GITD,5.5,2020-11-11 00:00:00
CORE Spatula Halloween Black Cat Frankenstein Heat Resistant Silicon Spoon,5.0,2020-11-11 00:00:00
"Vintage Doritos Universal Monsters 2"" Sticker Frankenstein- New Condition",3.0,2020-11-12 00:00:00
WIND-UP WALKING GREEN-FACED FRANKENSTEIN MONSTER 3-1/2” x 2-3/8” x 1-1/2”,22.1,2020-11-12 00:00:00
Frankenstein Funko Pop! Glow In The Dark Walgreens Exclusive With Protector,12.5,2020-11-12 00:00:00
Universal Studios Monsters Frankenstein #607 Walgreens WITHOUT GITD Excl.sticker,7.5,2020-11-12 00:00:00
