title,price,date
Fujifilm X-T30 26.1MP Mirrorless Camera - Silver (with 18-55mm Lens),850.0,2020-11-08 00:00:00
Fujifilm X-T30 26.1MP Mirrorless Camera - Silver (with 18-55mm Lens),949.0,2020-11-09 00:00:00
Fujifilm X-T30 Camera with XC 15-45mm f/3.5-5.6 OIS PZ Lens - Charcoal Silver,756.99,2020-11-11 00:00:00
Fujifilm FinePix X Series XP70 16.4MP Digital Camera - Yellow,30.0,2020-11-11 00:00:00
Fujifilm FinePix S Series S2950 14.0MP Digital Camera 18x Zoom FREE SHIPING,15.0,2020-11-12 00:00:00
Fujifilm FinePix S Series S8600 16.0MP Digital Camera 36x Optical Zoom-Black,75.99,2020-11-12 00:00:00
Fujifilm FinePix JX Series JX680 16.0MP 5x Wide Digital Camera - Black - NEW,59.99,2020-11-12 00:00:00
Fujifilm FinePix X Series X-E2 16.3MP Digital Camera - Black Kit w/ XF R LM,415.0,2020-11-13 00:00:00
Fuji Fujifilm X-T1 Kit XT1 XT-1 Mirrorless Camera - 16-50mm OIS II & 35mm Lenses,499.0,2020-11-13 00:00:00
Fujifilm FinePix S Series S8630 16.0mp 36x 25-900 DIGITAL CAMERA Black,85.0,2020-11-14 00:00:00
Fujifilm FinePix X Series XP70 16.4MP Digital Camera - Blue H13,49.82,2020-11-15 00:00:00
Fujifilm FinePix X Series XP70 16.4MP Digital WATERPROOF Camera VG Cond.,54.0,2020-11-17 00:00:00
Fujifilm FinePix S Series S4300 26X Zoom 14.0MP Digital Camera - Tested,39.99,2020-11-17 00:00:00
Fujifilm Fuji X-T1 16.3MP Mirrorless Digital Camera Body (Black),329.99,2020-11-21 00:00:00
Fujifilm X-T30 26.1MP Mirrorless Camera - Charcoal Silver (with 15-45mm Lens),838.32,2020-11-22 00:00:00
Fujifilm X-T30 26.1MP Mirrorless Camera - Charcoal Silver (with 15-45mm Lens),800.0,2020-11-23 00:00:00
Fujifilm FinePix S Series S8630 16.0mp 36x 25-900mm DIGITAL CAMERA,67.0,2020-11-25 00:00:00
Fujifilm Fuji X-T10 16.3MP Mirrorless Digital Camera Body ONLY,381.0,2020-11-26 00:00:00
NEW Fujifilm X-T30 Mirrorless Digital Camera Body Only (Charcoal Silver) ,799.0,2020-11-26 00:00:00
FUJIFILM FINEPIX XP100 14.4MP 5X ZOOM 1080P WATERPROOF  DIGITAL CAMERA - BLACK,56.99,2020-11-27 00:00:00
[EXC++] Fujifilm FinePix S Series S4500 14.0MP Digital Camera 30x Zoom (3908),85.99,2020-11-29 00:00:00
Fujifilm FinePix XP100 14.4 MP (XP100) Orange Water & Shock proof TESTED WORKS,44.99,2020-11-30 00:00:00
Fujifilm FinePix X Series XP70 16.4MP Digital Camera - Yellow,10.0,2020-11-30 00:00:00
Fujifilm FinePix Series S3280 14mp 24x Super Wide DIGITAL CAMERA Black Excellent,64.0,2020-12-01 00:00:00
FUJIFILM FINEPIX S1800 ,20.0,2020-12-01 00:00:00
"Fuji X100F Digital Camera - Silver, Original box and accessories, with Extras. ",775.0,2020-12-01 00:00:00
Fujifilm Fuji FinePix XP60 HD 16MP Blue Digital Camera W/ 2 Batteries USB WORKS,66.95,2020-12-01 00:00:00
Fujifilm Fuji X-T20 24.3MP Mirrorless Digital Camera Body (Silver) Extra Battery,458.0,2020-12-01 00:00:00
Fujifilm FinePix Series S3280 14mp 24x Super Wide DIGITAL CAMERA -Black - 410,52.0,2020-12-02 00:00:00
Neewer 1500mAh Battery and Dual USB Charger for Fujifilm FinePix X Series,24.99,2020-12-02 00:00:00
Fujifilm FinePix X Series XP70 16.4MP Digital Camera - Yellow + SD Card,61.99,2020-12-02 00:00:00
Fujifilm X Series X100 Black - Limited Edition Premium 12.3MP Digital Camera,300.0,2020-12-03 00:00:00
Fujifilm X-T30 26.1MP Mirrorless APS-C Camera Charcoal Silver with 18-55mm Lens,800.0,2020-12-03 00:00:00
Genuine OEM Fuji Fujifilm AC-3VW AC Power Adapter 3V Charger/ Fine Pix X series,20.99,2020-12-03 00:00:00
FUJIFILM X70 Black Color Ex+++ Condition With Extras,460.0,2020-12-04 00:00:00
Fujifilm X-T3 - Silver (with 18-55mm Lens)+Many Accessories,1500.0,2020-12-05 00:00:00
Fujifilm FinePix T Series T350 14.0 MP Digital Camera in BLACK w/ 10X Zoom Lens,22.0,2020-12-05 00:00:00
Fujifilm X-T3 - Silver (with 18-55mm Lens)+Many Accessories,1500.0,2020-12-06 00:00:00
Fujifilm FinePix S Series S4300 26X Zoom 14.0MP Digital Camera Fuji Fine Pix,52.99,2020-12-07 00:00:00
Fujifilm X20 camera - battery charger & manual In Original Box,200.85,2020-12-07 00:00:00
New Fujifilm FinePix A Series Digital Camera AX650 16.0 MP 5X Zoom Black Compact,51.97,2020-12-07 00:00:00
FUJIFILM FINEPIX S1800 ,25.0,2020-12-07 00:00:00
Fujifilm FinePix X Series XP10 Digital Camera: Black- Used Without Original Box,20.0,2020-12-08 00:00:00
Fujifilm FinePix X Series XP10 / 12.2MP Digital Camera - Green WATERPROOF ,25.0,2020-12-08 00:00:00
OPEN-BOX Fujifilm X-T20 Mirrorless Camera Body [Black],468.99,2020-12-09 00:00:00
Fujifilm FinePix XP10SE Water/Dust/Shock/Freezeproof 12MP Digital Camera,22.49,2020-12-09 00:00:00
Fujifilm FinePix S Series S3280 14.0MP 24X Optical Zoom Digital Camera - Black,41.99,2020-12-09 00:00:00
Fujifilm FinePix X Series X100s 16MP Digital Camera - Silver,350.0,2020-12-09 00:00:00
"Fujifilm FinePix S Series S3280 14.0MP 24X Optical Zoom Camera, W/ 8GB SD Card",52.0,2020-12-13 00:00:00
Fujifilm X100 12MP Fuji X FinePix Digital Rangefinder,350.0,2020-12-14 00:00:00
Fujifilm X-T30 26.1MP Mirrorless Camera - Charcoal Silver (Body Only) W/ Extras,609.99,2020-12-16 00:00:00
Fujifilm FinePix X Series XP51   14.4MP Digital Camera - blue,15.99,2020-12-16 00:00:00
"Fujifilm/Fuji X series X30/X-30 12.0 MP Digital Camera - Silver, EVF",391.18,2020-12-16 00:00:00
Fuji Fujifilm X-T1 Kit XT1 XT-1 Mirrorless Camera (Body Only) Black * Excellent!,299.0,2020-12-17 00:00:00
Fujifilm FinePix X Series XP70 16.4MP Digital Camera - Blue,98.0,2020-12-18 00:00:00
Fujifilm X-T30 Mirrorless Digital Camera w/XF18-55mm Kit - Silver,985.0,2020-12-19 00:00:00
Fujifilm FinePix X Series X20 Digital 12Mp Black Camera For Parts or Repair,137.26,2020-12-19 00:00:00
Fujifilm X-T30 26.1MP Mirrorless Camera - Charcoal (BODY ONLY) WITH EXTRAS!! ,650.0,2020-12-22 00:00:00
Fujifilm FinePix S700 S Series 7.1MP Digital Camera 10x Optical Zoom Black,21.58,2020-12-22 00:00:00
FUJIFILM Fuji XF10 Champagne Gold CAMERA,279.0,2020-12-23 00:00:00
Fujifilm FinePix S Series S4300 26X Zoom 14.0MP Digital Camera Fuji Fine Pix,65.9,2020-12-23 00:00:00
"MINT Fujifilm X-T30 Digital Camera Kit Bundle w/ XF 18-55mm, 27mm lens + EXTRAS ",1185.0,2020-12-24 00:00:00
Fujifilm FinePix XP70 16.4MP Water Proof Shock Proof Camera w/ 16GB SD Card ,60.99,2020-12-26 00:00:00
++ MAKE OFFER ++ Fujifilm FinePix X10 12.0MP Digital Camera - Black,109.8,2020-12-26 00:00:00
Fujifilm X10  Digital Camera + Case & Extras,277.94,2020-12-27 00:00:00
NR Mint Fuji Fujifilm X100T 16.3MP Digital Camera w/23mm f2 Lens. Rangefinder,600.0,2020-12-27 00:00:00
Near Mint!! Fujifilm X-T1 Black 16.3MP Digital Mirrorless Camera Body,422.0,2020-12-27 00:00:00
Fujifilm FinePix X Series X100 Digital Camera + JnK Leather Case + Thumb Grip,300.0,2020-12-29 00:00:00
Fujifilm Finepix E Series E550 6.3MP HD Digital Camera 4x Optical Zoom Lens Case,53.95,2020-12-29 00:00:00
 Fujifilm FinePix X Series X20 Digital Camera *Next Day Delivery*,282.72,2020-12-30 00:00:00
Fujifilm FinePix X Series X100 Digital Camera + JnK Leather Case + Thumb Grip,300.0,2020-12-31 00:00:00
2Fujifilm FinePix X Series XP10 / 12.2MP Digital Camera - ,29.9,2020-12-31 00:00:00
Fujifilm FinePix S Series SL1000 16.2MP Digital Camera 50x zoom- Black ,55.0,2021-01-01 00:00:00
Fujifilm Finepix E Series E550 6.3MP HD Digital Camera 4x Optical Zoom Lens Box,51.5,2021-01-01 00:00:00
Fuji X-T100 Body (Champagne Gold) with accessories,370.0,2021-01-02 00:00:00
Fujifilm FinePix X Series X100 12.3MP Digital Camera - Silver,299.0,2021-01-02 00:00:00
Fujifilm Digital Camera Finepix Xp10 Series Purchased 2011,26.0,2021-01-02 00:00:00
"Fujifilm Finepix 6900 Zoom Digital Camera - 3.3MP, 6X zoom",124.99,2021-01-03 00:00:00
Fujifilm X-T30 Mirrorless Digital Camera - XF 35mm F/2 R WR Lens - Combo Bundle,1130.99,2021-01-04 00:00:00
Fujifilm FinePix JX Series JX680 16.0MP 5x Wide Digital Camera - Black - NEW,48.99,2021-01-04 00:00:00
FUJIFILM FINEPIX X SERIES XP20 14MP WIDE ZOOM LCD DIGITAL CAMERA - Silver,47.99,2021-01-05 00:00:00
Fujifilm FinePix XP50 14MP Waterproof Tough Digital Camera - Orange *Fine/tested,45.99,2021-01-05 00:00:00
Fujifilm FinePix X Series XP10 12.2MP Digital Camera - Green,34.0,2021-01-05 00:00:00
Fujifilm FinePix XP 20 Series Digital Camera - Black Tested and Working w/ Box,38.95,2021-01-06 00:00:00
Fujifilm FinePix S Series S8630 16.0mp 36x 25-900mm DIGITAL CAMERA Bundle,86.99,2021-01-06 00:00:00
FUJIFILM X-T20 (VP2031408),499.99,2021-01-06 00:00:00
Fujifilm X-T30 Mirrorless Digital Camera w/XF18-55mm Kit - Silver,1099.0,2021-01-07 00:00:00
Fujifilm FinePix X Series X20 Digital 12Mp Black Camera For Parts or Repair,123.53,2021-01-07 00:00:00
NEW Fujifilm X-T30 26.1MP Mirrorless Camera Charcoal Silver (with 15-45mm Lens),850.0,2021-01-08 00:00:00
New in box  FUJIFILM FINEPIX XP20 WATER/SHOCK/DUST/FREEZE  14 MP DIGITAL CAMERA!,25.99,2021-01-08 00:00:00
Fujifilm Fuji Film X100 Original digital Camera Silver,320.0,2021-01-08 00:00:00
Fujifilm FinePix X Series XP70 16.4MP Digital Camera - Orange NWOB,25.0,2021-01-08 00:00:00
Fujifilm FinePix S Series S8630 16.0mp 36x 25-900mm DIGITAL CAMERA,62.0,2021-01-09 00:00:00
Fujifilm FinePix X Series XP75 16.4MP Digital Camera - Blue,30.99,2021-01-10 00:00:00
"Fuji Fujifilm, X70, 1yr old, Repairable",105.0,2021-01-12 00:00:00
Fujifilm X-T2 24.3MP Digital Camera (Body Only) - Shutter Count: 126  #P1304,614.99,2021-01-15 00:00:00
Fujifilm X-T30 26.1MP Mirrorless Camera - Charcoal Silver (with 15-45mm & 35mm),1000.0,2021-01-15 00:00:00
Fujifilm Fuji X-T30 Camera - Charcoal (with 18-55mm & 23mm Lens) -Unique Bundle!,1350.0,2021-01-15 00:00:00
Blue Fujifilm FinePix X Series XP20 14.2MP Digital Camera With CHARGER,39.0,2021-01-16 00:00:00
"Fujifilm FinePix X Series XP20 Digital Camera 14.2MP 2.7"" Orange Waterproof",20.0,2021-01-16 00:00:00
Fujifilm FinePix X Series XP20 14.2MP Digital Camera Orange great condition,56.99,2021-01-18 00:00:00
"NEW! FUJIFILM X-T30 Mirrorless Digital Camera (Body Only, Silver) #16618380",926.0,2021-01-18 00:00:00
Fujifilm FinePix XP10 12MP Waterproof Digital Camera with 5x Optical Zoom-Green,34.99,2021-01-19 00:00:00
Fujifilm X-T30 26.1MP Mirrorless Camera - Black (with 18-55mm Lens) KIT,900.0,2021-01-20 00:00:00
Fujifilm Fuji FinePix X Series X100 12.3MP Fixed Lens Digital Camera Silver,338.99,2021-01-20 00:00:00
Fujifilm Fuji FinePix X Series X100 12.3MP Fixed Lens Digital Camera Silver,338.99,2021-01-20 00:00:00
Fujifilm Fuji X-T1 Graphite Silver Edition Body,310.0,2021-01-21 00:00:00
Fujifilm X-T30 Mirrorless 4K WiFi Camera Charcoal Backpack Bundle Travel Kit,899.0,2021-01-21 00:00:00
Fujifilm FinePix S Series S6800 16MP 30x Zoom white Digital Camera 3A,69.97,2021-01-22 00:00:00
USED Fujifilm FinePix X Series X100 12.3 MP Digital Camera,283.0,2021-01-22 00:00:00
Genuine Fuji Finepix Camera Case - JV & JX Series Cameras - Int Dimns 92x55x20mm,30.22,2021-01-23 00:00:00
Fujifilm Fuji X-T1 16.3MP Mirrorless Digital Camera (Black) MINT,360.0,2021-01-23 00:00:00
Fujifilm X-T30 26.1MP Mirrorless Camera - Charcoal Silver (Body),825.0,2021-01-25 00:00:00
Fujifilm FinePix XP20 14.2MP Green Digital Camera Water/Shock/Dust/Freeze Proof,96.25,2021-01-26 00:00:00
FUJIFILM Fuji X100V Camera Black PLEASE  READ DESCRIPTION! NON Working HDMI Port,1199.0,2021-01-26 00:00:00
Fujifilm X-T2 24.3MP Digital Camera (Body Only) w/ Fuji EF-X8 Flash   #P6356,620.99,2021-01-27 00:00:00
FUJIFILM Fuji XF10 Champagne Gold CAMERA,279.0,2021-01-27 00:00:00
Fujifilm FinePix S Series S8630 16.0mp 36x 25-900 DIGITAL CAMERA Black w/ Strap,69.99,2021-01-27 00:00:00
Fujifilm FinePix X Series XP10 Digital Camera Waterproof 5x optical zoom,22.0,2021-01-27 00:00:00
Fujifilm Fuji X-T10 16.3MP Mirrorless Digital Camera Body (Black) ,350.0,2021-01-27 00:00:00
Fujifilm X-T30,379.0,2021-01-31 00:00:00
FUJIFILM Fuji X100V Digital Camera Black ,1175.0,2021-01-31 00:00:00
FUJIFILM Fuji X100V Digital Camera Black + Bonus stuff,1539.45,2021-01-31 00:00:00
Fujifilm FinePix X Series X100 12.3MP Digital Camera - Silver,349.99,2021-02-01 00:00:00
"Fujifilm FinePix S Series S1 16.4MP Digital Camera, Black, 24mm Wide Angle, 50x",157.95,2021-02-01 00:00:00
Fujifilm Digital Camera Finepix Xp10 Series 12 MP 5x Optical Zoom Waterproof ,40.1,2021-02-02 00:00:00
Fuji Finepix S Series S1600 12.0mp 15x Zoom Digital Camera #32,57.65,2021-02-02 00:00:00
Fujifilm FinePix S Series S8600 16 MP Digital Camera - Black + 8GB Card 36x zoom,69.99,2021-02-03 00:00:00
Fujifilm X-T30 26.1MP Mirrorless Camera - Silver (with 15-45mm Lens),869.0,2021-02-03 00:00:00
Fujifilm X-T30 26.1MP Mirrorless Camera - Charcoal Silver (Body) With Box,615.0,2021-02-04 00:00:00
Fujifilm FinePix S Series S4300 26X Zoom 14.0MP Digital Camera Fuji Fine Pix,53.2,2021-02-05 00:00:00
Fujifilm X-T30 26.1MP Mirrorless Camera - Silver (with XF35mmF2 R WR Lens),976.95,2021-02-05 00:00:00
Fujifilm X-T30 26.1MP Mirrorless Camera - Silver (with XF35mmF2 R WR Lens),976.95,2021-02-05 00:00:00
