title,price,date
"Ready Player One: A Novel  Cline, Ernest  Good  Book  0 Paperback",5.02,2020-08-10 00:00:00
"Ready Player One by Cline, Ernest Book The Fast Free Shipping",22.44,2020-08-08 00:00:00
"Armada: A novel by the author of Ready Player One  Cline, Ernest  Good  Book  0 ",5.96,2020-08-07 00:00:00
Cline Ernest-Ready Player One BOOK NEW,29.0,2020-08-06 00:00:00
READY PLAYER ONE by Ernest Cline - 2015 paperback book,7.5,2020-08-04 00:00:00
Ready Player One by Ernest Cline (English) Hardcover Book Free Shipping!,21.0,2020-08-03 00:00:00
"CLINE,ERNEST-READY PLAYER ONE (FILM TIE-IN) (UK IMPORT) BOOK NEW",15.98,2020-08-02 00:00:00
Ready player one by Ernest Cline Paperback Sci-fi Science Fiction book,6.3,2020-07-31 00:00:00
(bb46m) ready player one book Ernest Cline Paperback,5.8,2020-07-27 00:00:00
"CLINE,ERNEST-READY PLAYER ONE (UK IMPORT) BOOK NEW",15.81,2020-07-27 00:00:00
"Ready Player One by Cline, Ernest Book The Fast Free Shipping",10.53,2020-07-21 00:00:00
Ready Player One : A Novel by Ernest Cline Book and Mug Lot,13.99,2020-07-20 00:00:00
(bb46m) ready player one book Ernest Cline Paperback,3.0,2020-07-19 00:00:00
"CLINE,ERNEST-READY PLAYER ONE (FILM TIE-IN) (UK IMPORT) BOOK NEW",14.03,2020-07-15 00:00:00
"Armada: A novel by the author of Ready Player One  Cline, Ernest  Good  Book  0 ",5.26,2020-07-14 00:00:00
Ready Player One CD Set Book Unabridged by Ernest Cline,12.98,2020-07-11 00:00:00
Ready Player One Ernest Cline Book Novel Paperback Paper Back Used Soft 2012,10.0,2020-07-10 00:00:00
Ready Player One Book - Signed Copy - Ernest Cline - HC - 1st Edition,131.08,2020-07-09 00:00:00
"Ready Player One : A Novel by Ernest Cline (2011, Trade Paperback) Book",5.79,2020-07-09 00:00:00
Ready player one Ernest Cline Book,10.0,2020-07-08 00:00:00
ARMADA by Ernest Cline ~1st/1ST~HC/DJ~SIGNED   (Author of READY PLAYER ONE) book,34.9,2020-07-04 00:00:00
Ready Player One by Ernest Cline Lot Of 10 Class Set Book Club Used,22.91,2020-06-27 00:00:00
"Ready Player One: A Novel  Cline, Ernest  Good  Book  0 Paperback",5.09,2020-06-14 00:00:00
Ready Player One Film Book By Ernest Cline New Mint Condition (2012 Paperback),4.98,2020-06-10 00:00:00
Ready Player One Ernest Cline Rare UK Edition Beautiful Great Book Free Postage,89.72,2020-06-10 00:00:00
"Ready Player One: A Novel, Cline, Ernest, Good Book",7.99,2020-06-08 00:00:00
"Ready Player One: A Novel  Cline, Ernest  Good  Book  0 Paperback",4.78,2020-06-07 00:00:00
"Ready Player One by Ernest Cline (2018, Paperback) Movie Tie In Book",10.79,2020-06-03 00:00:00
"Ready Player One: A Novel  Cline, Ernest  Acceptable  Book  0 Paperback",5.01,2020-05-31 00:00:00
ERNEST CLINE SIGNED READY PLAYER ONE BOOK EXCLUSIVE AUTOGRAPHED NOVEL,63.99,2020-05-25 00:00:00
Ernest Cline Ready player one soft cover book,7.55,2020-05-20 00:00:00
Ready Player One by Ernest Cline Hardcover Novel First Edition Book,17.0,2020-05-19 00:00:00
ERNEST CLINE   HAND SIGNED BOOK - READY PLAYER ONE ,27.88,2020-05-19 00:00:00
READY PLAYER ONE by Ernest Cline (2012 Paperback Book) NEW,9.0,2020-05-14 00:00:00
"Ready Player One  Cline, Ernest  Acceptable  Book  0 Audio CD",18.99,2020-05-11 00:00:00
