title,price,date
"The Giver by Lowry Lois (2014, Paperback, Movie Tie-In) Good Book",5.04,2020-08-11 00:00:00
HARDBACK BOOK THE GIVER LOIS LOWRY,4.99,2020-08-11 00:00:00
"The Giver (Giver Quartet, Book 1) by Lowry Lois (1993, P-D-F)",2.5,2020-08-10 00:00:00
"The Giver (Giver Quartet, Book 1) by Lowry Lois (1993, Digitaldown)",2.99,2020-08-09 00:00:00
"The Giver (Giver Quartet, Book 1) by Lowry Lois (1993, P-D-F)",2.5,2020-08-07 00:00:00
"The Giver (Giver Quartet, Book 1) by Lowry Lois (1993, Digitaldown)",2.99,2020-08-07 00:00:00
"Lois Lowry The Giver, Gathering Blue, Son, And Messenger 4 Book Set",19.86,2020-07-30 00:00:00
"The Giver Quartet Omnibus  Lowry, Lois  Acceptable  Book  0 Hardcover",6.92,2020-07-26 00:00:00
"The Giver (Giver Quartet, Book 1) by Lowry Lois (1993, Digitaldown)",4.99,2020-07-25 00:00:00
"The Giver [Newberry Medal Book] , Lois Lowry",5.06,2020-07-24 00:00:00
"The Giver by Lois Lowry, Softcover Book,Good-Shape,1994.",6.56,2020-07-23 00:00:00
"The Giver Quartet Omnibus  Lowry, Lois  Good  Book  0 Hardcover",7.72,2020-07-22 00:00:00
The Giver by Lois Lowry book in good condition! required school reading,3.79,2020-07-21 00:00:00
The Giver Quartet Boxed Set by Lois Lowry (English) Hardcover Book Free Shipping,27.84,2020-07-20 00:00:00
"Lois Lowry The Giver quartet book set Messenger, Son, Gathering Blue Lot Of 4 HC",20.36,2020-07-18 00:00:00
The Giver (Newberry Medal Book) by Lois Lowry,5.61,2020-07-15 00:00:00
The Giver Quartet by Lois Lowry (English) Hardcover Book ,18.0,2020-07-13 00:00:00
"Lois Lowry The Giver quartet book set Messenger, Son, Gathering Blue Lot Of 4 HC",19.36,2020-07-11 00:00:00
THE GIVER LOIS LOWRY SUMMER READING PAPERBACK BOOK,4.99,2020-07-11 00:00:00
"THE GIVER QUARTET - LOWRY, LOIS - NEW HARDCOVER BOOK",23.79,2020-07-10 00:00:00
Guided Reading: Set of 8 The Giver by Lois Lowry- Newbery Medal book,14.84,2020-07-07 00:00:00
Lois Lowry Messenger The Giver Quartet Book 3 Paperback 2006,7.7,2020-07-06 00:00:00
"Lois Lowry The Giver quartet book set Messenger, Son, Gathering Blue Lot Of 4 HC",8.86,2020-07-04 00:00:00
"BRAND NEW - THE GIVER - LOWRY, LOIS - PAPERBACK BOOK",7.99,2020-07-03 00:00:00
"Lois Lowry ""The Giver"" quartet book set",23.81,2020-06-27 00:00:00
The Giver By Lois Lowry Paperback Chapter Book,3.79,2020-06-26 00:00:00
"Lowry, Lois-The Giver BOOK NEW",11.19,2020-06-24 00:00:00
"The Giver Quartet Omnibus, Lowry, Lois  Book",8.87,2020-06-20 00:00:00
MESSENGER by Lois Lowry a young adult paperback book FREE USA SHIPPING the giver,7.25,2020-06-13 00:00:00
Lois Lowry book The Giver Paperback 1994,4.5,2020-06-12 00:00:00
The Giver by Lois Lowry (English) Paperback Book Free Shipping!,14.48,2020-06-11 00:00:00
The Giver Quartet by Lois Lowry (English) Hardcover Book Free Shipping!,23.78,2020-06-05 00:00:00
"The Giver [1] [Giver Quartet]  Lowry, Lois  Acceptable  Book  0 Paperback",4.55,2020-06-03 00:00:00
The Giver Audio book Unabridged Lois Lowry 4 cds,7.8,2020-06-01 00:00:00
The Giver (Newbery Medal Book) by Lois Lowry,3.99,2020-05-30 00:00:00
"The Giver (Giver Quartet, Book 1) by Lowry Lois (2018, Digitaldown)",3.99,2020-05-30 00:00:00
The Giver Quartet Boxed Set by Lois Lowry Hardcover Book New,33.86,2020-05-30 00:00:00
The Giver Quartet by Lois Lowry (English) Hardcover Book ,22.85,2020-05-23 00:00:00
The Giver Lois Lowry Playaway Audio Book,4.99,2020-05-23 00:00:00
"The Giver Quartet boxed set  Lowry, Lois  VeryGood  Book  0 Hardcover",23.4,2020-05-22 00:00:00
"The Giver Quartet boxed set  Lowry, Lois  Acceptable  Book  0 Hardcover",23.25,2020-05-21 00:00:00
Giver Quartet : Book 1 : The Giver by Lowry Lois (Hardcover) FREE shipping $35,16.48,2020-05-21 00:00:00
New The Giver Quartet by Lois Lowry (English) Hardcover Book Free Shipping!,22.95,2020-05-19 00:00:00
"The Giver Quartet by Lowry Lois (2014, Hardcover) 4 novels in 1 book/ MINT COND",18.86,2020-05-19 00:00:00
"The Giver by Lois Lowry, Good Book",4.25,2020-05-18 00:00:00
"Lois Lowry ""The Giver"" quartet book box set",19.99,2020-05-17 00:00:00
The Giver Quartet Boxed Set by Lois Lowry (English) Hardcover Book Free Shipping,33.01,2020-05-16 00:00:00
The Giver (Newbery Medal Book) by Lois Lowry,3.99,2020-05-11 00:00:00
