title,price,date
"An Inspector Calls (Heinemann Plays) by Priestley, J.B.",22.3,2020-08-04 00:00:00
VINTAGE ORIGINAL ROYALE THEATRE AN INSPECTOR CALLS WINDOW CARD POSTER SIGNED,22.84,2020-07-25 00:00:00
An Inspector Calls (1954) - Blu-ray - Vintage Classics w/ slipcover - 60th Anniv,13.3,2020-07-12 00:00:00
"An Inspector Calls (1954) - Kino Lorber Studio Classics (Blu-ray, 2020)",9.51,2020-07-06 00:00:00
Vintage actor ARTHUR YOUNG Signed pic -An Inspector Calls Mr. Birling (1954) etc,14.62,2020-05-30 00:00:00
An Inspector Calls Blu-ray,16.66,2020-05-24 00:00:00
"Cast signed Playbill AN INSPECTOR CALLS Sian Phillips, Nicholas Woodeson,Roy Coo",9.95,2020-05-17 00:00:00
an inspector calls Cottage To Let Green For Danger Dvds,38.0,2020-08-15 00:00:00
An Inspector Calls GCSE for AQA student book,35.59,2020-08-15 00:00:00
an inspector calls paperback book,39.1,2020-08-15 00:00:00
"An Inspector Calls by J. B. Priestley (Hardback, 1993)",38.48,2020-08-15 00:00:00
"An Inspector Calls: York Notes Study Guide ""New For GCSE (9-1)""",38.24,2020-08-13 00:00:00
The Quotation Bank: An Inspector Calls.,37.29,2020-08-12 00:00:00
An Inspector Calls GCSE books,41.1,2020-08-10 00:00:00
Theatre Programme - An Inspector Calls -2001,24.66,2020-08-04 00:00:00
"An Inspector Calls GCSE Bundle-includes Book, DVD and York Notes Study Guide.",55.1,2020-08-02 00:00:00
J B Priestley An Inspector Calls Book,40.18,2020-08-02 00:00:00
"CGP Macbeth, An Inspector Calls, A Christmas Carol Text Guide",44.96,2020-08-02 00:00:00
Penguin classics: An inspector calls and other plays by J. B. Priestley,42.52,2020-08-01 00:00:00
An Inspector Calls the Graphic Novel: Original Text by J. B. Priestley...,38.58,2020-07-30 00:00:00
GCSE An Inspector Calls text guide ,39.09,2020-07-30 00:00:00
An Inspector Calls paperback copy by JB Priestley,38.31,2020-07-24 00:00:00
An inspector calls hardback copy,39.06,2020-07-23 00:00:00
"An inspector calls text guide for grade 9-1, CGP",36.39,2020-07-23 00:00:00
An Inspector calls paperback copy,35.84,2020-07-23 00:00:00
York Notes For GCSE Study Guide An Inspector Calls,37.52,2020-07-23 00:00:00
GCSE ENGLISH - AN INSPECTOR CALLS - THE TEXT GUIDE - C G P - WRITTEN IN,10.48,2020-07-23 00:00:00
"GCSE ""An Inspector Calls"" (Letts Explore), J B Priestley, Used; Good Book",38.87,2020-07-21 00:00:00
An Inspector Calls The Text Guide,39.01,2020-07-20 00:00:00
An Inspector Calls (Heinemann Plays For 14-16+) by J.B. Priestley Hardback Book,41.78,2020-07-20 00:00:00
An Inspector Calls: AQA GCSE English Literature Text Guide (Collins Snap...,36.39,2020-07-19 00:00:00
CGP GCSE English . An Inspector Calls .  The Text Guide ,36.64,2020-07-18 00:00:00
An inspector calls j b priestley,42.04,2020-07-18 00:00:00
"An Inspector Calls by J. B. Priestley (Hardback, 1993)",40.17,2020-07-18 00:00:00
"GCSE English Text Guide - An Inspector Calls by CGP Books (Paperback, 2002)",39.4,2020-07-18 00:00:00
"An Inspector Calls (DVD, 2015)",37.2,2020-07-16 00:00:00
CGP GCSE ENGLISH AN INSPECTOR CALLS THE TEXT GUIDE,38.92,2020-07-15 00:00:00
GCSE An inspector calls revision Flash Cards,9.43,2020-07-15 00:00:00
GCSE An Inspector Calls Full Text/Play,39.36,2020-07-15 00:00:00
"GCSE English Literature for AQA An Inspector Calls Student Book, Seal, Jon, Good",38.32,2020-07-15 00:00:00
"An Inspector Calls by J. B. Priestley (Hardback, 1993)",40.17,2020-07-14 00:00:00
"An Inspector Calls by J. B. Priestley (Hardback, 1993)",41.1,2020-07-14 00:00:00
CGP GCSE English An inspector Calls The Text Guide For the Grade 9-1 Course,39.31,2020-07-14 00:00:00
COLLINS SNAP REVISION AN INSPECTOR CALLS - AQA GCSE ENGLISH LITERATURE,36.22,2020-07-13 00:00:00
An Inspector Montalbano Mystery Ser.: Death in Sicily : The Shape of Water - The,10.83,2020-06-23 00:00:00
The Dance of the Seagull - An Inspector Montalbano Mystery by Camilleri MINT CON,7.98,2020-07-03 00:00:00
A Long Shadow: An Inspector Ian Rutledge Mystery (Inspector Ian Rutl - VERY GOOD,6.8,2020-07-17 00:00:00
"An Inspector Wexford Mystery: Death Notes Bk. 11 by Ruth Rendell (1981,...",7.75,2020-07-02 00:00:00
A Monster Calls : Inspired by an Idea from Siobhan Dowd by Patrick Ness...,2.25,2020-06-30 00:00:00
an original handpainted Joe Bucher Heritage Calls Brand Duck Call Collectible,107.75,2020-07-02 00:00:00
LIGHT THICKENS*by Ngaio Marsh (1982 Hdbk)An Inspector Alleyn Mystery*,4.32,2020-05-23 00:00:00
Duck Calls: An Enduring American Folk Art book by Howard L. Harlan & W. Crew And,16.44,2020-07-16 00:00:00
Dark Horse 2012 Mike Mignola HELLBOY vol 8 DARKNESS CALLS  tpb reg $18 an,8.98,2020-05-31 00:00:00
A Monster Calls : Inspired by an Idea from Siobhan Dowd by Patrick Ness...,4.58,2020-08-13 00:00:00
Collecting Antique Bird Decoys and Duck Calls : An Identification and Value...,20.0,2020-07-28 00:00:00
