title,price,date
A Monster Calls : Inspired by an Idea from Siobhan Dowd by Patrick Ness...,4.58,2020-08-13 00:00:00
The Gate Keeper : An Inspector Ian Rutledge Mystery  (ExLib) by Charles Todd,5.53,2020-08-17 00:00:00
1872 Romance Of The Harem By Anna Leonowens Illustrated The Emerald Isle,7.98,2020-09-07 00:00:00
The Beautiful Mystery Louise Penny An Inspector Gamache Mystery PB,8.4,2020-09-11 00:00:00
1872 Romance Of The Harem By Anna Leonowens Illustrated The Emerald Isle,7.98,2020-09-18 00:00:00
An Inspector Wexford Mystery Ser.: Kissing the Gunner's Daughter by Ruth Rendell,6.83,2020-09-30 00:00:00
"PERDEW, An Illinois Tradition-1993 H/B Book-Great Photos Of Duck Calls & Decoys",31.65,2020-10-03 00:00:00
"An Inspector Calls DVD (2015) David Thewlis, Walsh ",32.5,2020-10-13 00:00:00
gcse english text guide - an inspector calls The Text Guide School Revision Book,31.31,2020-10-14 00:00:00
gcse english text guide - an inspector calls And 3 Others,40.86,2020-10-14 00:00:00
An Inspector Calls (Heinemann Plays For 14-16+) J.B. Priestley Good Book,31.29,2020-10-15 00:00:00
An Inspector Calls revision guide duo,38.76,2020-10-16 00:00:00
An Inspector Calls - 60th Anniversary Edition - Alastair Sim - DVD NEW & Sealed,22.91,2020-10-16 00:00:00
An Inspector Calls: York Notes and CGP Text Guide for English Lit GCSE (9-1) ,32.89,2020-10-17 00:00:00
Collins AQA GCSE English Literature SNAP Revision AN INSPECTOR CALLS. As new,29.91,2020-10-17 00:00:00
Grade 9-1 GCSE An Inspector Calls English Shakespeare Text & Revision Guide KS3,29.96,2020-10-17 00:00:00
"CPG GCSE English An Inspector Calls Text Guides, Workbook And Two DVDs Grade 9-1",58.59,2020-10-17 00:00:00
GCSE An Inspector Calls revision bundle (two books),37.57,2020-10-18 00:00:00
Melvin Newman Turkey Call Calls Purpelheart & Sycamore made for Highlands 4th An,73.5,2020-10-18 00:00:00
GCSE English Literature CGP Revision Guide An Inspector Calls,32.29,2020-10-19 00:00:00
An Inspector Calls book,33.52,2020-10-19 00:00:00
2. York GCSE + DVDs - An Inspector Calls + Of Mice And Men + Design & Technology,42.5,2020-10-21 00:00:00
GCSE ENGLISH AN INSPECTOR CALLS REVISION GUIDE & WORKBOOK 3 BOOK BUNDLE,38.36,2020-10-21 00:00:00
"An Inspector Calls (DVD, 2010)",10.49,2020-10-22 00:00:00
An inspector Calls CPG Text Guide,30.47,2020-10-23 00:00:00
An Inspector Calls Heinemann English GCSE Text,33.11,2020-10-24 00:00:00
"3 X GCSE English An Inspector Calls, The Text Guide, York Notes & Snap Revision",39.89,2020-10-25 00:00:00
an inspector calls hardback book,32.58,2020-10-25 00:00:00
An Inspector Calls AQA GCSE 9-1 Snap Revision Guide,29.94,2020-10-25 00:00:00
CGP An Inspector Calls GCSE English Grade 9-1,32.31,2020-10-26 00:00:00
"CGP 11+ English GL, Romeo & Juliet, An Inspector Calls Practice Cards -Grade 9-1",33.89,2020-10-26 00:00:00
"An Inspector Calls (DVD, 2015)",31.62,2020-10-26 00:00:00
"An Inspector Calls and Other Plays by J. B. Priestley (Paperback, 2001)",35.97,2020-10-27 00:00:00
AN INSPECTOR CALLS GCSE ENGLISH STUDY GUIDE CGP,30.97,2020-10-27 00:00:00
An Inspector Calls hardback book GCSE English,31.89,2020-10-28 00:00:00
An Inspector Calls by J.B Priestley for GCSE revision ,35.34,2020-10-29 00:00:00
GCSE English “An Inspector Calls” Revision Bundle,39.54,2020-10-30 00:00:00
CGP An Inspector Calls The Text Guide,30.31,2020-11-01 00:00:00
J.B. Priestley's AN INSPECTOR CALLS Alastair Sim DVD,12.8,2020-11-01 00:00:00
Grade 9-1 GCSE An Inspector Calls English Shakespeare Text & Revision Guide KS3,29.96,2020-11-02 00:00:00
"An Inspector Calls and Other Plays by J. B. Priestley (Paperback, 2001)",35.97,2020-11-02 00:00:00
an inspector calls j b priestley,32.3,2020-11-02 00:00:00
"An Inspector Calls (DVD, 2005) reg 2",24.62,2020-11-03 00:00:00
GCSE AQA An Inspector Calls Text Guide,29.3,2020-11-03 00:00:00
AN INSPECTOR CALLS - HB - J B PRIESTLEY,12.81,2020-11-05 00:00:00
An Inspector Calls DVD Alistair Sim Forbes Lindo Moore Young JB Priestley Play,20.89,2020-11-06 00:00:00
Gcse English Literature “An Inspector Calls” CGP Text Guide And York Notes,32.3,2020-11-08 00:00:00
GCSE English Literature Snap Revision Guide An Inspector Calls,34.26,2020-11-09 00:00:00
