title,price,date
William W Johnstone Cat's Cradle 1986 Zebra Horror,5.0,2020-08-13 00:00:00
Doctor Who New Adventures 5-7 Cats Cradle Time's Crucible Warhead Witch Mark,39.43,2020-08-14 00:00:00
Doctor Who New Adventure Cat’s Cradle series 3 paperback books very good,26.0,2020-08-15 00:00:00
"Cat's Cradle, Slaughterhouse-Five, Breakfast of Champions 3 books Kurt Vonnegut",12.0,2020-08-17 00:00:00
"Cat's Cradle by Kurt Vonnegut (1969, Mass Market) - Pre-Owned - EXCELLENT BOOK",4.25,2020-08-18 00:00:00
Secret Six Volume 3 Cat's Cradle DC Deluxe TPB RARE OOP Deadshot Catman,6.0,2020-08-18 00:00:00
"Harry Chapin PROMO 45 CAT'S IN THE CRADLE, Elektra 1974",20.75,2020-08-18 00:00:00
Rose & Sandy - Cat's Cradle CD (Moving Furniture 010) Like new,3.93,2020-08-18 00:00:00
"K&H PET PRODUCTS 9555 Tan EZ MOUNT CAT SCRATCHER KITTY SILL CRADLE TAN 11"" X ...",22.0,2020-08-20 00:00:00
"RARE Parkwest Exclusive Harmony Kingdom ""Cats Cradle"" #:579/1,000 MIB",24.95,2020-08-22 00:00:00
CAT KITTEN HANGING RADIATOR PET BED WARM FLEECE BASKET CRADLE HAMMOCK PLUSH ,9.19,2020-08-22 00:00:00
Kurt Vonnegut Jr. Cat’s Cradle. Delta 1963 Second Printing PB,30.0,2020-08-25 00:00:00
"1914 POSTCARD BOY CARRYING BABY & CAT,CRADLE ROLL- LET NO BABY STAY AWAY",3.59,2020-08-26 00:00:00
Cat's Cradle by Kurt Vonnegut (Paperback),7.27,2020-08-27 00:00:00
"Kurt Vonnegut Jr. Books Novel Lot of of 6 Cat's Cradle, Man Without A Country...",17.49,2020-08-30 00:00:00
"Cat's Cradle by Kurt Vonnegut (1998, Trade Paperback)",5.8,2020-08-31 00:00:00
"Cat's Cradle by Kurt Vonnegut (1998, Trade Paperback)",1.2,2020-08-31 00:00:00
Harry Chapin Oakbrook Studios Cats in the Cradle Cut Glass Suncatcher,32.99,2020-09-01 00:00:00
CAT KITTEN HANGING RADIATOR PET BED WARM FLEECE BASKET CRADLE HAMMOCK PLUSH ,9.19,2020-09-03 00:00:00
Klutz Cat's Cradle: A Book of String Figures Brand New Anne Akers Johnson 2009,3.0,2020-09-04 00:00:00
Lladro Figurine Girl with A Cradle of Kittens & Mom Cat # 5784,110.0,2020-09-05 00:00:00
Ugly Kid Joe - Cats In The Cradle (1993) 4 Track CD Single,13.81,2020-09-06 00:00:00
Kurt Vonnegut 1976 Dell 5 Paperback Box Set: Sirens/Cat's Cradle/Monkey House +,50.0,2020-09-09 00:00:00
4 x RAINBOW MAGIC FINGER STRING Rope Art Cats Cradle Kids Retro Fidget Game Toy,11.8,2020-09-10 00:00:00
CAT KITTEN HANGING RADIATOR PET BED WARM FLEECE BASKET CRADLE HAMMOCK PLUSH ,9.19,2020-09-14 00:00:00
Dolls Layette/blanket/bedding for cradle/cot/pram or IKEA dolls/cat bed/Duktig,15.27,2020-09-17 00:00:00
Cat's Cradle Children's Story 1890's Illustrated Nister Dutton juvenile book,62.0,2020-09-17 00:00:00
Neoregelia Cats Cradle “Vinzant”,15.0,2020-09-20 00:00:00
Suction Cup Window Mounted Cat Bed Hanging Pet Kitten Sunshine Hammock Cradle UK,4.63,2020-09-22 00:00:00
Cat Kitten Hanging Radiator Pet Bed Warm Fleece Basket Cradle Hammock,5.26,2020-09-29 00:00:00
Cat Kitten Hanging Radiator Pet Bed Warm Fleece Basket Cradle Hammock,4.86,2020-09-29 00:00:00
"Kurt Vonnegut VTG Paperback Lot of 5 Slaughterhouse Five, Cat's Cradle +",29.14,2020-09-30 00:00:00
Optimago Mini Box Hand Cut Wooden Jigsaw Puzzle “Cats Cradle” By Pat Scott Used,47.84,2020-10-01 00:00:00
HOUSE OF MARBLES CATS CRADLE - TRADITIONAL STRING GAME VICTORIAN CLASSIC,3.81,2020-10-02 00:00:00
"Doctor Who New Adventures -Cat's Cradle:Warhead,Timewyrm:Apocalypse & Revelation",31.52,2020-10-02 00:00:00
"4 Kurt Vonnegut Paperbacks - Monkey, Slaughterhouse 5, God Bless, & Cat's Cradle",19.0,2020-10-03 00:00:00
Kurt Vonnegut 6 Books! Slaughterhouse-Five Cat's Cradle Breakfast of Champions ,26.05,2020-10-03 00:00:00
"Cat's In The Cradle, 1974, the group Ugly Kid Joe on cover, by H and S Chapin",4.99,2020-10-03 00:00:00
WINDSTONE EDITIONS CATS CRADLE CAT WITH KITTEN SCULPTURE,21.0,2020-10-03 00:00:00
Lladro Figurine Girl with A Cradle of Kittens & Mom Cat # 5784,135.0,2020-10-04 00:00:00
"CAT STEVENS, ‘Cat’s In The Cradle’ Singer - Signed 8X10 Photo With COA",15.0,2020-10-04 00:00:00
"Cat's Cradle by Kurt Vonnegut (1998, Trade Paperback)",5.05,2020-10-04 00:00:00
COMIC Humor KITTENS AT PLAY Kitten Cradle CATS FIRESIDE Cauldron POSTCARD Antics,17.05,2020-10-05 00:00:00
"UGLY KID JOE, CATS IN THE CRADLE , 7"" SINGLE VINYL 1991, ",31.68,2020-10-05 00:00:00
Cat Kitten Hanging Radiator Pet Bed Warm Fleece Basket Cradle Hammock. ,7.89,2020-10-06 00:00:00
Harry Chapin Verities & Balderdash Record Vinyl Album Cat’s In The Cradle,5.5,2020-10-06 00:00:00
"Cat's Cradles, And Other String Figures by Schuyt, Michael Paperback Book The",9.83,2020-10-09 00:00:00
CAT'S CRADLE: TIME'S CRUCIBLE ( NEW DOCTOR WHO ADVENTURES) By Marc Platt,15.0,2020-10-10 00:00:00
CAT'S CRADLE: TIME'S CRUCIBLE ( NEW DOCTOR WHO ADVENTURES) By Marc Platt,18.33,2020-10-10 00:00:00
Kurt Vonnegut 1976 Dell 5 Paperback Box Set: Sirens/Cat's Cradle/Monkey House...,39.99,2020-10-12 00:00:00
"Kurt Vonnegut VTG Paperback Lot of 7 Slaughterhouse Five, Cat's Cradle plus more",35.2,2020-10-13 00:00:00
"Billy Bragg Poster Cat's Cradle, Carrboro, North Carolina 2010  18"" x 12""",64.88,2020-10-17 00:00:00
"Billy Bragg Poster Cat's Cradle, Carrboro, North Carolina 2010  18"" x 12""",68.89,2020-10-17 00:00:00
"Billy Bragg Poster Cat's Cradle, Carrboro, North Carolina 2010  18"" x 12""",69.65,2020-10-17 00:00:00
Cat’s Cradle Playground Game And How-to Book,1.3,2020-10-18 00:00:00
"Cat's Cradle by Kurt Vonnegut (1998, Trade Paperback)",6.05,2020-10-18 00:00:00
Lot x 3 Kurt Vonnegut Jr  Cat's Cradle x 2 AND Slaughterhouse Five Paperbacks,11.45,2020-10-18 00:00:00
"Cat's Cradle, By Kurt Vonnecut",4.1,2020-10-18 00:00:00
As Ugly as They Wanna Be- SIGNED COVER ONLY (No CD)+Cats In The Cradle CD Single,17.78,2020-10-19 00:00:00
As Ugly as They Wanna Be- SIGNED COVER ONLY (No CD)+Cats In The Cradle CD Single,18.29,2020-10-19 00:00:00
"KURT VONNEGUT paperback lot of 5 books CAT'S CRADLE, S-5, BREAKFAST",31.86,2020-10-22 00:00:00
"Lot of 3 Kurt Vonnegut~ Slaughterhouse-Five, Cat's Cradle, Look At The Birdie",10.5,2020-10-25 00:00:00
"Kurt Vonnegut Jr. Cat’s Cradle. Vintage Delta c.1963, 13th Printing. Paperback. ",18.5,2020-10-26 00:00:00
"The Archers of Loaf: What Did You Expect - Live at Cats Cradle (DVD, 2012)",5.0,2020-10-26 00:00:00
"Kurt Vonnegut Jr. Cat’s Cradle. Vintage Delta c.1963, 13th Printing. Paperback. ",21.3,2020-10-26 00:00:00
"The Archers of Loaf: What Did You Expect - Live at Cats Cradle (DVD, 2012)",7.8,2020-10-26 00:00:00
"Cat's Cradle by Kurt Vonnegut (2006, Trade Paperback)",3.0,2020-10-29 00:00:00
"Cat's Cradle by Kurt Vonnegut (2006, Trade Paperback)",5.8,2020-10-29 00:00:00
Cats Cradle - House of Marbles NEW,2.67,2020-10-31 00:00:00
"Cat’s Cradle, Kurt Vonnegut Jr., 1975, Paperback",7.0,2020-10-31 00:00:00
Girls Xmas Stocking Fillers -Cats Cradle Game & Lexi Wooden Bracelet. New!✨,1.3,2020-11-01 00:00:00
Doctor Who Cat's Cradle: Witch Mark novel by Andrew Hunt,34.04,2020-11-01 00:00:00
Doctor Who Cat's Cradle: Warhead novel by Andrew Cartmel,49.93,2020-11-01 00:00:00
Doctor Who Cat's Cradle: Time's Crucible novel by Marc Platt,49.93,2020-11-01 00:00:00
Lot of 10 Vintage Kurt Vonnegut Breakfast/Slaughterhouse 5/Cats Cradle and more,45.0,2020-11-01 00:00:00
Doctor Who Cat's Cradle: Witch Mark novel by Andrew Hunt,35.02,2020-11-01 00:00:00
Doctor Who Cat's Cradle: Warhead novel by Andrew Cartmel,51.36,2020-11-01 00:00:00
Doctor Who Cat's Cradle: Time's Crucible novel by Marc Platt,51.36,2020-11-01 00:00:00
1st Kurt Vonnegut Slaughterhouse-Five Player Piano Mother Night Cat's Cradle HC,82.17,2020-11-03 00:00:00
CAT KITTEN HANGING RADIATOR PET DOG BED WARM FLEECE BASKET CRADLE HAMMOCK PLUSH,7.62,2020-11-03 00:00:00
1st Kurt Vonnegut Slaughterhouse-Five Player Piano Mother Night Cat's Cradle HC,45.71,2020-11-03 00:00:00
Cat's Cradle Book & Kit,4.99,2020-11-04 00:00:00
Cat's Cradle Book & Kit,8.32,2020-11-04 00:00:00
Border Fine Arts Comic And Curious Cats ‘Cats Cradle’ Boxed,19.72,2020-11-06 00:00:00
Cat's Cradle by Kurt Vonnegut- Paperback,4.05,2020-11-06 00:00:00
"Kurt Vonnegut PB Book Lot - Cat's Cradle 1st (1970), Player Piano 2nd (1974)",19.53,2020-11-07 00:00:00
Retro Cat's Cradle Magic String Kids Fumble Finger Game Party Bag Gift ,9.78,2020-11-09 00:00:00
Retro Cat's Cradle Magic String Kids Fumble Finger Game Party Bag Gift ,9.89,2020-11-09 00:00:00
Harry Chapin 45 RPM - Cat's In The Cradle - Elektra E - 45203. 1974. Elektra Slv,7.92,2020-11-11 00:00:00
Kurt Vonnegut 9 Novel Lot Collection Player Piano Sirens Rosewater Cats Cradle ,45.0,2020-11-15 00:00:00
Kurt Vonnegut Book Lot Slaughterhouse Five Cats Cradle And More,20.33,2020-11-16 00:00:00
"Cat's Cradle by Kurt Vonnegut, Jr. Vintage Hardcover 1963",15.83,2020-11-18 00:00:00
"Cat's Cradle by Kurt Vonnegut, Jr. Vintage Hardcover 1963",39.99,2020-11-19 00:00:00
1974 HARRY CHAPIN CAT'S IN THE CRADLE SHEET MUSIC ,3.42,2020-11-19 00:00:00
Kurt Vonnegut Cats Cradle Paperback ,4.1,2020-11-19 00:00:00
"Ugly Kid Joe - Cats In The Cradle - 7"" Vinyl Single - MER 385 [Play Tested] |NM|",18.8,2020-11-19 00:00:00
"Ugly Kid Joe - Cats In The Cradle - 7"" Vinyl Single - MER 385 [Play Tested] |NM|",19.0,2020-11-19 00:00:00
12 LOT OF HARRY CHAPIN RECORD ALBUMS CATS IN TH CRADLE HEAD & TALES L@@K!,22.99,2020-11-20 00:00:00
Cat's Cradle by Cat Stevens LP Record VG+ LC 50010,7.33,2020-11-21 00:00:00
"Ugly Kid Joe - Cat`s In The Cradle - 7"" Black Vinyl Picture Sleeve Mercury 1992",31.33,2020-11-22 00:00:00
"Ugly Kid Joe - Cat`s In The Cradle - 7"" Black Vinyl Picture Sleeve Mercury 1992",31.35,2020-11-22 00:00:00
HARRY CHAPIN CATS IN THE CRADLE 2 LP LIVE VINYL FOLK 1976,17.5,2020-11-24 00:00:00
"real photo Cat Kitten In Cradle Sleeping ""SH-H-H!"" mailed 1909 antique pc RPPC",22.95,2020-11-24 00:00:00
Great Eastern UN-X-LD Cuban Knife Cats Cradle 2007 Issue Only 71 Made MIB NR,187.95,2020-11-26 00:00:00
"Dell 1149 Paperback Cat's Cradle Signed ""For Bill Lowden Kurt Vonnegut""",82.75,2020-11-26 00:00:00
Cat's Cradle by Kurt Vonnegut * BCE * 1963 * VINTAGE * Masterpiece,44.0,2020-11-26 00:00:00
"Dell 1149 Paperback Cat's Cradle Signed ""For Bill Lowden Kurt Vonnegut""",82.3,2020-11-26 00:00:00
"Secret Six Cats in The Cradle tpb, Gail Simone, J. Calafiore ",15.6,2020-11-29 00:00:00
"Klutz Ser.: Cat's Cradle by Anne Johnson (2009, Spiral)",6.45,2020-11-29 00:00:00
"Cat's Cradle by Kurt Vonnegut, Jr 1st UK BCE/1st ptg (1964) hardcover in dj",39.99,2020-11-29 00:00:00
Snowbabies 2007 Cats cradle On A Cloud + Snowbabies Department Celebrations X2,48.39,2020-11-29 00:00:00
"Klutz Ser.: Cat's Cradle by Anne Johnson (2009, Spiral)",6.75,2020-11-29 00:00:00
Snowbabies 2007 Cats cradle On A Cloud + Snowbabies Department Celebrations X2,48.92,2020-11-29 00:00:00
"Cat's Cradle by Kurt Vonnegut (1998, Trade Paperback)",6.8,2020-11-30 00:00:00
"Klutz Series: Cat's Cradle by Anne Johnson (2009, Spiral) Old School Fun",7.79,2020-12-01 00:00:00
"KURT VONNEGUT | Lot of 4 | Cat's Cradle, Sirens of Titan, Monkeyhouse, Wampeters",20.83,2020-12-04 00:00:00
"The New Doctor Who Adventures Bundle (2 ""Cats Cradle""s & ""Warlock"")",9.33,2020-12-04 00:00:00
"Bears, Dog & Cat Patchwork Calico Cradle Fabric Panel, Soft Watercolor Pastels",5.75,2020-12-04 00:00:00
"Cat's Cradle by Kurt Vonnegut (1969, Mass Market)",9.1,2020-12-07 00:00:00
"Cat's Cradle by Kurt Vonnegut, Jr. - Book Club Edition - 1963",25.64,2020-12-07 00:00:00
Cats in the Cradle Collector plate,13.0,2020-12-07 00:00:00
Dept 56 Snowbabies CAT'S CRADLE ON A CLOUD Brand New No Box,12.4,2020-12-08 00:00:00
Dept 56 Snowbabies CAT'S CRADLE ON A CLOUD Brand New No Box,14.0,2020-12-08 00:00:00
2 Antique  Japanese woodblock Prints By Chikanobu Geisha Playing Cat’s Cradle,71.02,2020-12-09 00:00:00
Cat’s Cradle By Kurt Vonnegut Jr.,8.3,2020-12-10 00:00:00
XXS SOFT Brushed Cotton Blend CATS CRADLE Sweater dog apparel,9.45,2020-12-11 00:00:00
Harry Chapin - Greatest Stories Live (1976) 2-LP Vinyl • Cats in the Cradle EX,8.83,2020-12-13 00:00:00
Catry Cat Tree Cradle Bed with Natural Sisal Scratching Posts and Teasing Rope ,26.05,2020-12-13 00:00:00
Southern Culture On The Skids SCOTS Cat's Cradle 1997 Poster #24/75 Liberty ,20.5,2020-12-13 00:00:00
UGLY KID JOE  -  CATS IN THE CRADLE / BUSY BEE  -  YELLOW VINYL,11.41,2020-12-18 00:00:00
UGLY KID JOE  -  CATS IN THE CRADLE / BUSY BEE  -  YELLOW VINYL,11.54,2020-12-18 00:00:00
HARRY CHAPIN 2 CD SET - THE GOLD MEDAL COLLECTION  32 TRACKS TAXI CATS IN CRADLE,7.79,2020-12-19 00:00:00
"KURT VONNEGUT-9 PB lot-CAT'S CRADLE,SLAUGHTERHOUSE FIVE,SIRENS OF TITAN++",60.39,2020-12-20 00:00:00
Harmony Kingdom - Parkwest Exclusive - Cat's Cradle #412/1000,30.5,2020-12-20 00:00:00
Harmony Kingdom - Parkwest Exclusive - Cat's Cradle #412/1000,32.1,2020-12-20 00:00:00
"Klutz Ser.: Cat's Cradle by Anne Johnson (2009, Spiral)",3.79,2020-12-22 00:00:00
Dept. 56 Snowbabies Snowbaby Porcelain Figure - Cat's Cradle On A Cloud,17.0,2020-12-25 00:00:00
Dept. 56 Snowbabies Snowbaby Porcelain Figure - Cat's Cradle On A Cloud,18.6,2020-12-25 00:00:00
Harry Chapin. Verities & Balderdash. 1974. with Lyric Sheet. Cat's In The Cradle,6.5,2020-12-26 00:00:00
Cats cradle kurt vonnegut,5.4,2020-12-27 00:00:00
"DANNY GATTON ""Live At Cat's Cradle, Carrboro, NC 5-23-80"" TRIPLE CD-R",31.0,2020-12-29 00:00:00
Great Eastern UN-X-LD Cuban Knife Cats Cradle 2007 Issue Only 71 Made MIB NR,167.34,2020-12-30 00:00:00
"DC Comics SECRET SIX Cats in the Cradle TPB, Gail Simone Jim Calafiore, Used",3.79,2020-12-31 00:00:00
"Cat's Cradle by Kurt Vonnegut (1998, Trade Paperback)",4.05,2020-12-31 00:00:00
Kurt vonnegut Cat’s Cradle,6.3,2021-01-01 00:00:00
Eames Herman Miller Fiberglass shell chair Cats Cradle Base,266.0,2021-01-04 00:00:00
"Cat's Cradle by Kurt Vonnegut (1998, Trade Paperback)",6.8,2021-01-05 00:00:00
"Vonnegut Lot: Cat’s Cradle, Slaughterhouse Five, Monkey House, Mr. Rosewater",12.16,2021-01-07 00:00:00
"CRADLE-""BABA YAGA"" *ON 11-TRACK CD* CAT.NO; TOPP CD 042 1996. ",25.7,2021-01-09 00:00:00
