title,price,date
"EAST OF EDEN JOHN STEINBECK 1952  FIRST EDITION, 1ST HARD BACK, VIKING",169.43,2020-08-12 00:00:00
EAST OF EDEN First Edition Library Facsimile  John Steinbeck with BITE Error ,33.28,2020-08-12 00:00:00
"East of Eden by John Steinbeck (2003, Trade Paperback, Anniversary)",4.32,2020-08-14 00:00:00
"East of Eden by John Steinbeck, Sears Readers Club, Bite error HB with DJ.",15.33,2020-08-14 00:00:00
"Vinyl Record East of Eden - Snafu 12""",48.21,2020-08-14 00:00:00
john steinbeck east of eden Complete Unabridged Bantam Fifty Paperback,8.86,2020-08-15 00:00:00
EAST OF EDEN**KING OF SIAM**DEMO**MOD**PSYCH**LISTEN TO IT,260.92,2020-08-15 00:00:00
East of Eden-Jig-A-Jig UK prog cd Repertoire,16.0,2020-08-15 00:00:00
East of Eden - Jig-A-Jig (Deram DMA-9513) Aussie A-LABEL 45,18.54,2020-08-15 00:00:00
"East of Eden by John Steinbeck (2003, Trade Paperback, Anniversary)",4.32,2020-08-16 00:00:00
EAST OF EDEN - LP - THE WORLD OF EAST OF EDEN- DERAM - UK - SPA 157 - YEAR 1971 ,27.59,2020-08-16 00:00:00
James Dean & Julie Harris East of Eden movie stars 8x10 photo (JDZ-18),15.9,2020-08-17 00:00:00
"Prog Rock Job Lot 5 vinyl LPs Bumpers, Pallas, East of Eden, Tangerine Dream, AM",56.96,2020-08-19 00:00:00
James Dean & Julie Harris East of Eden promo movie stars 8x10 photo (JDZ-512),15.9,2020-08-21 00:00:00
James Dean & Julie Harris East of Eden promo movie star 8x10 photo (JDZ-506),15.9,2020-08-21 00:00:00
"East of Eden (Penguin Modern Classics) by Steinbeck, John Paperback Book The",11.6,2020-08-22 00:00:00
East Of Eden by John Steinbeck (P/B 1959 Bantam),5.54,2020-08-22 00:00:00
JULIE HARRIS THE HAUNTING & EAST OF EDEN ACTRESS SP 8X10 INS 9x344),10.0,2020-08-22 00:00:00
John Steinbeck East of Eden 1992 Penguin Classics Paperback Classic Literature,5.98,2020-08-23 00:00:00
East Of Eden Mercator Projected Mini LP CD JAPAN UICY-9036,26.65,2020-08-23 00:00:00
East Of Eden Giant Rebel Without A Cause Book Collection James Dean Films,23.0,2020-08-23 00:00:00
East of Eden Japan Movie Program 1955 Julie Harris Elia Kazan James Dean,11.49,2020-08-24 00:00:00
"East of Eden by John Steinbeck (2002, Trade Paperback, Centennial Edition)",4.33,2020-08-26 00:00:00
East of Eden by John Steinbeck Hardcover 1952 Sears Readers Club Edition,9.57,2020-08-26 00:00:00
Far East of Eden for Neo Geo CD AMAZING CONDITION ORIGINAL RARE,49.0,2020-08-27 00:00:00
"East of Eden (DVD, 2005, 2-Disc Set, Special Edition), James Dean",5.55,2020-08-27 00:00:00
"East of Eden by John Steinbeck (2003, Trade Paperback, Anniversary)",4.32,2020-08-27 00:00:00
James Dean & Julie Harris East of Eden test movie star 8x10 photo (JDZ-523),15.9,2020-08-27 00:00:00
John Steinbeck East Of Eden,5.32,2020-08-28 00:00:00
EAST OF EDEN SNAFU DERAM K16P-9082 Japan VINYL LP,50.0,2020-08-29 00:00:00
"VINYL 7"" SINGLE BIG COUNTRY EAST OF EDEN    VINYL NR MINT",9.85,2020-08-29 00:00:00
East Of Eden Snafu Deram SL 285 Japan  VINYL LP OBI,70.99,2020-08-30 00:00:00
"CLASSIC LITERATURE BOOK LOT-23 BOOKS-TREASURE ISLAND, EAST OF EDEN, ROOTS + MORE",14.0,2020-08-30 00:00:00
"CLASSIC LITERATURE BOOK LOT-24 BOOKS-A TALE OF TWO CITIES, EAST OF EDEN, CANDIDE",33.5,2020-08-30 00:00:00
John Steinbeck East Of Eden HC 1995 Book of The Month Club ,19.83,2020-08-30 00:00:00
East Of Eden ‎– Snafu (CD 2008 Esoteric Recordings ‎– ECLEC 2034 Bonus Tracks),15.84,2020-08-30 00:00:00
"James Dean on the Movie Set of ""East of Eden"" Photo",14.99,2020-08-31 00:00:00
JAMES DEAN IN MENDOCINO - Filming of EAST OF EDEN,21.5,2020-09-01 00:00:00
"James DEAN, Julie Harris, Richard Davalos Lobby Card EAST of EDEN (1955) #4 orig",27.88,2020-09-02 00:00:00
East of Eden: John Steinbeck Centennial Edition Trade Paperback Anniversary,4.32,2020-09-04 00:00:00
"East of Eden (DVD, 2005, 2-Disc Set, Special Edition) and Rebel Without a Cause",9.15,2020-09-04 00:00:00
John Steinbeck EAST OF EDEN hardcover mid-century book club edition BCE,11.6,2020-09-05 00:00:00
James Dean East of Eden  - his first behind the scene photo 1955,33.0,2020-09-05 00:00:00
EAST OF EDEN BY JOHN STEINBECK 1986,30.0,2020-09-05 00:00:00
"John Steinbeck 3 Hardcover Books ~ Grapes of Wrath, Moon is Down, East of Eden",70.92,2020-09-05 00:00:00
JULIE HARRIS - SIGNED 8 X 10 GLOSSY PHOTO - EAST OF EDEN STAR - VG CONDITION,21.0,2020-09-06 00:00:00
"James Dean, Richard Davalos, Jo Van Fleet ~ ORIG 1955 photo ~ East of Eden",13.98,2020-09-06 00:00:00
"East of Eden (Blu-ray Disc, 2014)Brand new still sealed",4.99,2020-09-07 00:00:00
EAST OF EDEN~John Steinbeck 1952~First Edition - First Printing - Fine!,197.5,2020-09-07 00:00:00
EAST OF EDEN=BOOGIE WOOGIE (DEMO)  VG++,12.1,2020-09-07 00:00:00
"East of Eden (DVD, 2005, 2-Disc Set, Special Edition) ~Brand New~",8.5,2020-09-08 00:00:00
"East of Eden by John Steinbeck (2003, Trade Paperback, Anniversary)",5.83,2020-09-08 00:00:00
The Grapes of Wrath / the Moon Is Down / Cannery Row / East of Eden / of Mice...,5.0,2020-09-09 00:00:00
East Of Eden John Steinbeck Rare Cover Paperback Book,4.58,2020-09-09 00:00:00
Good! East of Eden: by John Steinbeck (1992 PB) - Free Shipping!,5.73,2020-09-10 00:00:00
"Used Book- ""EAST OF EDEN"" By John Steinbeck",7.39,2020-09-11 00:00:00
"East Of Eden (Two-Disc Special Edition) by James Dean, Raymond Massey NEW",4.14,2020-09-11 00:00:00
East of Eden - Blu-ray - James Dean Classic Steinbeck Warner EXTRAS HTF,6.19,2020-09-11 00:00:00
MINT DVD ~ EAST OF EDEN 2-Disc SPECIAL EDITION James Dean MANY Extras Commentary,6.05,2020-09-12 00:00:00
1952 First Edition John Steinbeck East Of Eden Bite Error Page 281 DJ Viking,93.45,2020-09-13 00:00:00
Penguin Orange Collection: East of Eden : (Penguin Orange Collection) by John...,6.86,2020-09-13 00:00:00
"2 DVDs-2005-EAST OF EDEN-JAMES DEAN,JULIE HARRIS-1954-NEW,SEALED",7.27,2020-09-13 00:00:00
John Steinbeck East of Eden Hardcover Book Viking 1952,17.83,2020-09-14 00:00:00
1955 Vintage Paperback Copy Steinbeck's EAST OF EDEN - Bantam  (F1267) ,8.29,2020-09-15 00:00:00
"EAST OF EDEN James Dean Lobby Card 11"" x 14"" Reproduced Copy",16.5,2020-09-15 00:00:00
"James Dean East of Eden 11 "" x 14 "" photo copy",14.0,2020-09-15 00:00:00
"East of Eden by John Steinbeck (2003, Trade Paperback, Anniversary)",5.29,2020-09-16 00:00:00
"East of Eden/Rebel Without a Cause/Giant (DVD, 2015, 3-Disc Set)",7.25,2020-09-16 00:00:00
East Of Eden & The Wayward Bus by John Steinbeck HC/DJ BCE 1952,13.24,2020-09-16 00:00:00
1995 BOOK OF THE MONTH CLUB JOHN STEINBECK EAST OF EDEN UNREAD COPY ,30.0,2020-09-18 00:00:00
John Steinbeck East Of Eden HC 1995 Book of The Month Club ,18.98,2020-09-19 00:00:00
East Of Eden John Steinbeck : Easton Press,63.0,2020-09-19 00:00:00
EAST OF EDEN (1954) in Cinemascope 2 Disc DVD Special Edition James Dean Movie,8.58,2020-09-20 00:00:00
"**JAMES DEAN** 3 DVD LOT - East of Eden, Rebel Without A Cause & Giant (1956)",26.0,2020-09-20 00:00:00
"East of Eden (Blu-ray Disc, 2013, DigiBook)",8.8,2020-09-23 00:00:00
East Of Eden John Steinbeck 1st Trade Edition 1952 pg 281 Bite Error ID#273,17.98,2020-09-23 00:00:00
East Of Eden VHS James Dean WCI Home Video 1979 release over sized box,14.49,2020-09-23 00:00:00
BRIGHTON - EAST OF EDEN HANDMADE EYEGLASS FRAMES 48-18 ,21.75,2020-09-26 00:00:00
MIKHAIL BARYSHNIKOV Signed/Autographed 8x10 Photograph,30.0,2020-09-27 00:00:00
REDUCED!  John Steinbeck East Of Eden First Ed & Print DJ Has Page 281 ‘Bite’,38.32,2020-09-27 00:00:00
"East of Eden by John Steinbeck (2002, Paperback)",3.79,2020-09-27 00:00:00
"John Steinbeck: The Grapes Of Wrath, The Moon Is Down, Cannery Row, East Of Eden",30.69,2020-09-29 00:00:00
"East of Eden, Centennial Edition, John Steinbeck",4.1,2020-09-29 00:00:00
Far East Of Eden Ziria PC Engine Super CD Complete,10.99,2020-09-29 00:00:00
"James Dean as Cal Trask-""East of Eden""-27"" x 40"" Original B & W Poster-1970s",15.34,2020-09-29 00:00:00
Theme From “ Rebel Without A Cause” Theme From “east Of Eden” Art Mooney 45 Rpm,4.0,2020-10-02 00:00:00
East of Eden John Steinbeck Original First Edition 1952 HC/DJ $4.50 281 Bite,253.81,2020-10-03 00:00:00
James Dean candid on East of Eden set movie star 5x7 photo JDY18,13.9,2020-10-04 00:00:00
East of Eden by John Steinbeck- First Ed First Printing Viking Press Sept 1952,52.33,2020-10-05 00:00:00
James Dean  Digi Book Lot East of Eden + Rebel Without a Cause + Giant Blu-Ray,69.99,2020-10-06 00:00:00
East of Eden by John Steinbeck,4.33,2020-10-07 00:00:00
East Of Eden By John Steinbeck 1959 Paperback Bantam ,5.05,2020-10-09 00:00:00
"James Dean- East of Eden + Rebel Without a Cause, 2 DVDs (SEALED)",10.76,2020-10-10 00:00:00
The Complete James Dean Collection East of Eden / Giant / Rebel Without a Cause,13.32,2020-10-10 00:00:00
PlayStation 2 Working FAR EAST of EDEN MANJIMARU,2.0,2020-10-11 00:00:00
1952 First Edition John Steinbeck East Of Eden Bite Error Page 281,83.33,2020-10-11 00:00:00
"1952 Edition "" EAST OF EDEN """,18.95,2020-10-11 00:00:00
Japan 1955 Meter Cover Kyobashi Warner Bros First National Pictures East of Eden,12.84,2020-10-11 00:00:00
"1970 MINTY Orig ● EAST OF EDEN ● ""SNAFU"" EXOTIC PROG PSYCH UK HEADS LP Hawkwind",43.0,2020-10-11 00:00:00
John Steinbeck East Of Eden First Ed & 10th Print DJ  Page 281 ‘Bite’,28.86,2020-10-11 00:00:00
Ziria Far East of Eden Turbografx 16 / Japan PC Engine CD-Rom,19.98,2020-10-12 00:00:00
"Eden of the East: The Complete Series (DVD, 2010, 2-Disc Set)",12.25,2020-10-12 00:00:00
E55 Nintendo Super Famicom Far East of Eden Zero Japan SFC SNES w/box,27.5,2020-10-13 00:00:00
East of Eden by John Steinbeck 9780142004234 |,4.33,2020-10-13 00:00:00
THE WORLD OF EAST OF EDEN DERAM SPA 157 GEOFF NICHOLSON RON CAINES FOLK PROG ,28.91,2020-10-13 00:00:00
"East of Eden (Blu-ray Disc, 2014)",6.64,2020-10-13 00:00:00
East Of Eden VHS James Dean WCI Home Video 1979 BOOK BOX RARE RELEASE,13.84,2020-10-13 00:00:00
John Steinbeck The Grapes Of Wrath/East Of Eden/Of Mice And Men/Cannery Row,13.1,2020-10-13 00:00:00
THE WORLD OF EAST OF EDEN DERAM SPA 157 GEOFF NICHOLSON RON CAINES FOLK PROG ,29.57,2020-10-13 00:00:00
"East of Eden (Blu-ray Disc, 2014)",6.49,2020-10-13 00:00:00
E1180 Sega Saturn Far East of Eden Apocalypse IV Guide Book Japanese SS,27.0,2020-10-17 00:00:00
Far East of Eden ZERO Japan Super Famicom SNES BOX and Manual US Seller,25.74,2020-10-17 00:00:00
Far East of Eden ZERO Japan Super Famicom SNES BOX and Manual US Seller,25.64,2020-10-17 00:00:00
Eden of the East complete series collection boxset anime Bluray,13.0,2020-10-17 00:00:00
Vintage Actor Photograph: James Dean Richard Davalos East of Eden c. 1955,162.9,2020-10-18 00:00:00
Vintage Actor Photograph: James Dean Julie Harris East of Eden c. 1955,60.4,2020-10-18 00:00:00
East of Eden - Self-Titled Album - Vinyl LP - SW 806,19.5,2020-10-18 00:00:00
EAST OF EDEN TWO-DISC SPECIAL EDITION DVD,4.5,2020-10-20 00:00:00
East of Eden - 2-Disc Special Edition - DVD - 2005,9.4,2020-10-21 00:00:00
EAST OF EDEN By JOHN STEINBECK,2.25,2020-10-21 00:00:00
"Big Country -4 7"" Singles Wonderland, East Of Eden,King Of Emotion,Broken Heart ",32.9,2020-10-21 00:00:00
"Eden of the East:Complete Series/Movies LTD ED (Blu-ray Disc, 2016, 4-Disc Set)",75.25,2020-10-21 00:00:00
East of Eden - 2-Disc Special Edition - DVD - 2005,9.5,2020-10-21 00:00:00
"Big Country -4 7"" Singles Wonderland, East Of Eden,King Of Emotion,Broken Heart ",33.04,2020-10-21 00:00:00
"Vintage Editions "" EAST OF EDEN and THE WAYWARD BUS "" By Steinbeck, in one book.",5.99,2020-10-22 00:00:00
Brighton East Of  Eden Sunglassses With Case,24.9,2020-10-22 00:00:00
"Eden of the East: The Complete Series + Movies (Blu-ray Disc, 2016, 4-Disc Set)",39.0,2020-10-22 00:00:00
Brighton East Of  Eden Sunglassses With Case,25.9,2020-10-22 00:00:00
East of Eden Original 1955 Lobby Card James Dean Julie Harris Richard Davalos,49.98,2020-10-23 00:00:00
East of Eden Original British Lobby Card James Dean hugs Julie Harris 1955 ,49.98,2020-10-23 00:00:00
East Of Eden VHS James Dean WCI Home Video 1979 BOOK BOX RARE RELEASE,13.84,2020-10-23 00:00:00
East Of Eden - Original UK Harvest Vinyl LP (1971) Prog Jazz  A4/B4,53.04,2020-10-24 00:00:00
East Of Eden - Original UK Harvest Vinyl LP (1971) Prog Jazz  A4/B4,54.53,2020-10-24 00:00:00
"East of Eden by John Steinbeck (2003, Trade Paperback, Anniversary)",4.32,2020-10-25 00:00:00
"East Of Eden, Snafu, Orig UK Deram LP, Cover Only, VG+, 1st Press.",31.21,2020-10-25 00:00:00
John Steinbeck East of Eden 1st  HB no DJ September 1952,14.5,2020-10-25 00:00:00
TAKEN BY TREES-east of eden/9 trax/digipak/vg con cd/2009,9.2,2020-10-25 00:00:00
"East Of Eden, Snafu, Orig UK Deram LP, Cover Only, VG+, 1st Press.",31.94,2020-10-25 00:00:00
TAKEN BY TREES-east of eden/9 trax/digipak/vg con cd/2009,9.41,2020-10-25 00:00:00
East of Eden by John Steinbeck Sears Readers Club HB DJ 1952,9.99,2020-10-26 00:00:00
EASTON PRESS LEATHER & GOLD 1988 EAST OF EDEN BY JOHN STEINBECK,80.5,2020-10-27 00:00:00
James Dean and Julie Harris Kissing in the Movie 'East of Eden' Photo,14.99,2020-10-27 00:00:00
Big Country East Of Eden 12” Extended Version On Vinyl Plus Poster,56.29,2020-10-29 00:00:00
Big Country East Of Eden 12” Extended Version On Vinyl Plus Poster,56.89,2020-10-29 00:00:00
East of Eden by John Steinbeck- Printing Viking Press Sept 1953,13.85,2020-10-30 00:00:00
"VHS JAMES DEAN, East Of Eden; Rebel Without A Cause; 1954, 1955, NR, Warner Bros",6.99,2020-10-31 00:00:00
James Dean  during  East of Eden filming photo 1954 2,183.5,2020-10-31 00:00:00
James Dean  Leonard Rosenman during  East of Eden filming photo 1954 3,150.49,2020-10-31 00:00:00
James Dean  Leonard Rosenman during  East of Eden filming photo 1954 2,84.0,2020-10-31 00:00:00
James Dean  Leonard Rosenman during  East of Eden filming photo 1954 1,81.0,2020-10-31 00:00:00
James Dean  during the time of East of Eden filming photo 1954,81.0,2020-10-31 00:00:00
MIKHAIL BARYSHNIKOV Signed/Autographed 8x10 Photograph,30.0,2020-11-01 00:00:00
First Printed Edition East Of Eden Steinbeck,21.99,2020-11-01 00:00:00
James Dean  during  East of Eden filming photo 1954 4,33.0,2020-11-01 00:00:00
James Dean  during  East of Eden filming photo 1954 3,33.0,2020-11-01 00:00:00
"East of Eden (Penguin Audio Classics) - Audio CD By Steinbeck, John  22 DISCS",6.8,2020-11-03 00:00:00
John Steinbeck ~ East of Eden ~ First Editions Library ~ Slipcase/Dust Cover,44.0,2020-11-04 00:00:00
"East of Eden by John Steinbeck (2003, Hardcover)",9.83,2020-11-04 00:00:00
"East of Eden (Blu-ray Disc, 2013, DigiBook)",9.38,2020-11-05 00:00:00
East of Eden Centennial Edition by John Steinbeck - Penguin Paperback,4.43,2020-11-05 00:00:00
"James Dean, Elia Kazan EAST OF EDEN 1970 Japanese Movie Poster Rebellion UNUSED!",53.0,2020-11-06 00:00:00
East Of Eden - Snafu. CD,15.38,2020-11-07 00:00:00
"Eden of the East: The Complete Series (Blu-ray Disc, 2013, 2-Disc Set)",18.3,2020-11-07 00:00:00
"POSTCARD of strone on Paradise Bay, looking east. in good condition, not posted.",20.27,2020-11-07 00:00:00
East Of Eden - Snafu. CD,15.74,2020-11-07 00:00:00
"EAST OF EDEN by STEINBECK FIRST EDITION FIRST PRINTING, HC, BITE ERROR, RED BOX",54.42,2020-11-08 00:00:00
"East of Eden (DVD, 2005, 2-Disc Set, Special Edition)",3.79,2020-11-08 00:00:00
"EAST OF EDEN by STEINBECK FIRST EDITION FIRST PRINTING, HC, BITE ERROR, RED BOX",55.79,2020-11-08 00:00:00
"East of Eden (DVD, 2005, 2-Disc Set, Special Edition)",4.46,2020-11-11 00:00:00
Paradise Pres: Afrikali – Out Of The Jungle - East Street 12” VG++/VG+ Listen,12.99,2020-11-11 00:00:00
D136 Nintendo Super Famicom Far East of Eden Japan SFC SNES w/box bx,15.99,2020-11-12 00:00:00
EAST OF EDEN.  THE WAYWARD BUS. By John Steinbeck,6.83,2020-11-13 00:00:00
Far East of Eden & Gowcaizer for Neo Geo CD ORIGINAL RARE,33.5,2020-11-13 00:00:00
Vintage James Dean Mens T Shirt Movie 1990’s East Of Eden Big Graphic,134.64,2020-11-14 00:00:00
East Of Eden Mercator Projected Mini LP CD JAPAN UICY-9036 D. Dufort Angel Witch,28.7,2020-11-14 00:00:00
East Of eden,4.32,2020-11-14 00:00:00
Easton Press EAST OF EDEN Steinbeck SEALED,100.0,2020-11-14 00:00:00
RARE EAST OF EDEN BY JOHN STEINBECK 1952 TRUE 1ST FIRST EDITION VIKING PRESS OLD,20.0,2020-11-15 00:00:00
John Steinbeck BOMC Set of 6 Grapes of Wrath East of Eden Of Mice & Men HB DJ,73.0,2020-11-15 00:00:00
K2-EAST OF EDEN –THE WORLD OF EAST OF EDEN–UK LP-NM-1971-Jig-A-Jig,33.6,2020-11-15 00:00:00
Lot 2 John Steinbeck SB bks-East of Eden & The Pearl-Centennial Editions-2002,7.81,2020-11-16 00:00:00
Post-Punk New Wave 45 - East Of Eden - Mystik Mood - Moon - VG++ mp3,13.5,2020-11-16 00:00:00
"East of Eden John Steinbeck first edition ""Bite"" on P 281 - w DJ; Fair/Poor Cond",37.33,2020-11-16 00:00:00
100 Plus Paperback Books Up For Auction Includes John Steinbeck Harper Lee,14.0,2020-11-17 00:00:00
JAMES DEAN - Paiting (Metamorphic Style) by Octavio Ocampo - RARE - East of Eden,19.49,2020-11-17 00:00:00
1952 First Edition John Steinbeck East Of Eden Bite Error Page 281 DJ Viking,13.99,2020-11-17 00:00:00
RARE 16mm Feature: EAST OF EDEN (JAMES DEAN / JULIE HARRIS) DIR. ELIA KAZAN,103.34,2020-11-18 00:00:00
EAST OF EDEN~ John Steinbeck~ 1ST EDITION 1952~Bite Error,48.86,2020-11-20 00:00:00
East Of Eden Centennial Edition John Steinbeck VG+,4.83,2020-11-22 00:00:00
"EAST OF EDEN John Steinbeck 1952 1st Edition, 1st Printing ""bite"" error Salinas",82.33,2020-11-22 00:00:00
EAST OF EDEN**NORTHERN HEMISPHERE**DEMO**PSYCH**DERAM LABEL**LISTEN,53.56,2020-11-22 00:00:00
East Of Eden Centennial Edition John Steinbeck VG+,4.83,2020-11-23 00:00:00
James Dean in the Movie 'East of Eden' Photo,14.99,2020-11-25 00:00:00
"East of Eden by John Steinbeck (2003, Trade Paperback, Anniversary)",7.78,2020-11-25 00:00:00
Easton Press EAST OF EDEN Steinbeck  LIMITED EDITION HARDCOVER,56.65,2020-11-25 00:00:00
East of Eden & The Wayward Bus by John Steinbeck HB Viking Press EX-Library,10.33,2020-11-25 00:00:00
"EAST OF EDEN, John Steinbeck, 1st ed, 1st state, no dj",48.33,2020-11-26 00:00:00
BIG COUNTRY East Of Eden (extended Version) SEALED Vinyl 12” Vinyl Lilywhite UK,8.99,2020-11-26 00:00:00
1957 James Dean Japan Photo Book 2 EAST OF EDEN Elizabeth Taylor VERY RARE,32.5,2020-11-27 00:00:00
East Of Eden  New Leaf    UK Press    Prog; Folk/Country Rock; Psych,106.5,2020-11-27 00:00:00
East Of Eden  Self-Titled    Promo  Prog,38.0,2020-11-27 00:00:00
East Of Eden  Snafu   Prog,57.0,2020-11-27 00:00:00
F970 Sega Saturn Far East of Eden The Apocalypse IV Japan SS n,18.5,2020-11-28 00:00:00
"John Steinbeck East of Eden 1st edition page error ""bite"" pge.281 GREAT COND.",110.0,2020-11-28 00:00:00
John Steinbeck's EAST OF EDEN-Bottoms/Seymour/Oates/Bochner/Bridges/Duff-3 DVDs,24.0,2020-11-29 00:00:00
East Of Eden First Edition Library John Steinbeck Facsimile HB/DC Slip Cover,36.86,2020-11-29 00:00:00
EAST OF EDEN the world of east of eden VG-/VG+ 1971 Deram LP,33.34,2020-11-29 00:00:00
"John Steinbeck - East Of Eden - 1st Edition, 1st printing ",56.0,2020-11-30 00:00:00
East Of Eden - Jig A Jig / Marcus Junior 7” Deram 1970 Breaks Samples,30.33,2020-12-02 00:00:00
"Eden of the East: The Complete Series (Blu-ray Disc, 2010, 2-Disc Set)",9.38,2020-12-03 00:00:00
"James Dean Laserdisc Box Set with East of Eden, Giant & Rebel Without a Cause",11.45,2020-12-03 00:00:00
EAST OF EDEN   JANE SEYMOUR  TIMMOTHY BOTTOMS   RARE 3 DVD SET,22.34,2020-12-03 00:00:00
Eden of the East: The Complete Anime Series And Movies DVD/Blu-ray,37.73,2020-12-04 00:00:00
John Steinbeck East of Eden  Book of the Month Club Edition Hard Cover/DJ 1995 ,31.05,2020-12-05 00:00:00
B106 Nintendo Super Famicom Far East of Eden Zero Japan SFC SNES w/box bx,15.99,2020-12-06 00:00:00
East Of Eden James Dean 2 Original Color Stills 1955,17.17,2020-12-06 00:00:00
CRY CIN -East Of Eden 1994 Dokken/Lynch Mob/Romeo/Shy Tiger/The Burnpool CD,59.0,2020-12-06 00:00:00
East of Eden by John Steinbeck - First Edition Second Printing Sept 1952,39.0,2020-12-06 00:00:00
"vtg. Trade Token Erie County Hamlet of EAST EDEN, NEW YORK SCHWANZ RESTARANT 5c",12.45,2020-12-07 00:00:00
FIRST Edition 1952 EAST OF EDEN John Steinbeck Bite Error Page 281 Dust Jacket,283.0,2020-12-07 00:00:00
East of Eden by John Steinbeck 2003 Paperback Steinbeck Centennial Edition OOP,4.33,2020-12-08 00:00:00
John Steinbeck 1952 East of Eden Multi Generational Epic Hardcover w/Dustjacket,20.52,2020-12-09 00:00:00
"East of Eden by John Steinbeck (Penguin Twentieth Century Classics, Paperback)",3.79,2020-12-09 00:00:00
"First Edition Library, Facsimile ""EAST OF EDEN"" John Steinbeck ",36.0,2020-12-10 00:00:00
kh0925 Gamecube Far East of Eden II MANJI MARU JP import Japan,7.0,2020-12-11 00:00:00
"John Steinbeck East of Eden, Sears Readers Club, 1952, ERROR Page 281 bite/bight",13.83,2020-12-11 00:00:00
East of Eden by John Steinbeck (hardcover),33.33,2020-12-11 00:00:00
East of Eden,6.13,2020-12-12 00:00:00
James DEAN COLOR still EAST of EDEN 1955 mini lobby card #3/studio VintOrig Lois,34.06,2020-12-12 00:00:00
James DEAN COLOR still EAST of EDEN 1955 mini lobby card #5/studio VinOrg Massey,44.06,2020-12-12 00:00:00
James DEAN COLOR still EAST of EDEN 1955 mini lobby card #4/studio VintOrig Ives,24.06,2020-12-12 00:00:00
James DEAN COLOR still EAST of EDEN 1955 mini lobby card #10/studio Vintage & Or,44.06,2020-12-12 00:00:00
"East of Eden John Steinbeck 1952 ""bite"" error pg 281",41.99,2020-12-13 00:00:00
LOIS SMITH EAST OF EDEN & 5 EASY PIECES ACTRESS S ENVELOPE 1956 (J406),7.0,2020-12-13 00:00:00
"East Of Eden, New Leaf, Orig UK Harvest G/fld LP, EX/EX+, A-3 B-3 1st Press.",95.67,2020-12-13 00:00:00
EAST OF EDEN ORIG HARVEST 1971 LP TEXTURED SLEEVE A4 / B4 VINYL EX SHVL 792,44.36,2020-12-14 00:00:00
John Steinbeck 1952 East of Eden Multi Generational Epic Hardcover w/Dustjacket,68.89,2020-12-16 00:00:00
"Steinbeck, East of Eden, Photoplay Band, James Dean, Dust Jacket VG",95.88,2020-12-16 00:00:00
EAST OF EDEN by John Steinbeck Viking Press 1952 with Typo hc dj ,47.5,2020-12-18 00:00:00
EAST OF EDEN Another Eden LP Harvest TC06297101 GM 1975 VG++,32.95,2020-12-19 00:00:00
Mercator Projected By The East Of Eden - Deram SML 1038 - 12” LP Stereo - VG,53.88,2020-12-19 00:00:00
East Of Eden LP Same UK Harvest 1st Press A-4 B-4 BRILLIANT AUDIO $$,87.39,2020-12-20 00:00:00
East of Eden by John Steinbeck - First Edition Second Printing Sept 1952,42.0,2020-12-21 00:00:00
East Of Eden - Snafu. CD,16.02,2020-12-21 00:00:00
D935 Sega Saturn Far East of Eden The Apocalypse IV Japan SS cx,15.99,2020-12-22 00:00:00
FANTASTIC FOUR # 9 EAST OF EDEN PART 1 2014 VERY FINE,5.99,2020-12-23 00:00:00
FANTASTIC FOUR # 12 EAST OF EDEN PART 4 2014 VERY FINE,5.99,2020-12-23 00:00:00
john steinbeck East Of Eden,6.58,2020-12-25 00:00:00
"East of Eden by John Steinbeck (2003, Trade Paperback, Anniversary)",2.25,2020-12-25 00:00:00
James DEAN Julie Harris Davalos COLOR still EAST of EDEN 1955 mini lobbyCard #12,23.07,2020-12-26 00:00:00
James DEAN Julie Harris COLOR still EAST of EDEN 1955 mini lobby card #11 studio,23.07,2020-12-26 00:00:00
James DEAN COLOR still EAST of EDEN 1955 mini lobby card #9/studio Vintage & Ori,23.07,2020-12-26 00:00:00
"East Of Eden with Julie Harris, James Dean CED RCA Selectavision VideoDisc",12.16,2020-12-26 00:00:00
"East of Eden (DVD, 2005, 2-Disc Set, Special Edition) - James Dean - Elia Kazan",3.94,2020-12-27 00:00:00
East Of Eden - Here We Go Again Vinyl Album,34.69,2020-12-27 00:00:00
2 Stills of James Dean on the EAST OF EDEN set,40.25,2020-12-27 00:00:00
EAST OF EDEN - MERCATOR PROJECTED. JAPAN.MINI-LP SLEEVE.REMASTER,21.99,2020-12-28 00:00:00
E893 PC Engine Super CD Rom 2 Far East of Eden FuunKabukiden PCE w/spine card cx,15.99,2020-12-28 00:00:00
E868 PC Engine Super CD Rom 2 Far East of Eden II Manji Maru Japan PCE cx,15.99,2020-12-28 00:00:00
"EAST OF EDEN Mercator Projected RARE EARLY UK 1969 EX++ DERAM LP, SUPERB SOUND.",235.22,2020-12-28 00:00:00
"1st Ed. 1st Printing. 1st State. East of Eden, John Steinbeck. 1952. Hardcover.",40.86,2020-12-28 00:00:00
