title,price,date
NEVER OPENED BUNDLE - Fujifilm FinePix XP130 16.4 MP Digital Camera + Extras,85.99,2020-08-15 00:00:00
Fujifilm FinePix XP130 16.4 MP Digital Camera - Yellow (XR40),43.0,2020-08-08 00:00:00
"Fujifilm FinePix XP130 Digital Camera, Dark Silver WATERPROOF UNDERWATER CAMERA",73.19,2020-08-01 00:00:00
Fujifilm FinePix XP130 16.4 MP Digital Camera,44.0,2020-07-30 00:00:00
Fujifilm FinePix XP130 16.4 MP Digital Camera - Blue (XH31),35.4,2020-07-20 00:00:00
Fujifilm FinePix XP130 Waterproof Action Camera,49.06,2020-07-16 00:00:00
"Fujifilm FinePix XP130 Waterproof Action Camera, Sky Blue ",64.15,2020-07-13 00:00:00
Fujifilm FinePix XP130 Waterproof Action Camera,52.83,2020-07-12 00:00:00
Fujifilm 16573619 FinePix XP130 Waterproof Digital Camera - Blue (44),40.99,2020-07-12 00:00:00
Fujifilm FinePix XP130 Waterproof Action Camera,81.51,2020-07-11 00:00:00
Fujifilm FinePix XP130 Waterproof Action Camera,74.72,2020-07-10 00:00:00
Fujifilm FinePix XP130 16.4 MP Digital Point & Shoot Camera ,49.25,2020-07-02 00:00:00
Fujifilm FinePix XP130 Waterproof Action Camera,64.15,2020-06-30 00:00:00
"Fujifilm FinePix XP130 Waterproof Action Camera, Sky Blue ",50.57,2020-06-23 00:00:00
Fujifilm - FinePix XP130 16.4-Megapixel Digital Camera - Yellow,47.9,2020-06-21 00:00:00
Fujifilm FinePix XP130 - 16MP - Waterproof Digital Camera - Blue,59.65,2020-06-11 00:00:00
"Fujifilm FinePix XP130 Digital Camera, White , Free 16GB SD, Brand New With Case",101.0,2020-06-06 00:00:00
"NEVER USED: Fujifilm FinePix XP130 16.4MP Digital Camera, 5X Optical Zoom,  1080",64.9,2020-05-30 00:00:00
FinePix XP130 Fujifilm Digital Camera Bluetooth,51.0,2020-05-23 00:00:00
"Fujifilm FinePix XP130 Outdoor Camera 16,4 MP Yellow-Excellent Condition",257.88,2020-07-10 00:00:00
Fuji FinePix XP200 Waterproof Digital Camera,61.0,2020-08-09 00:00:00
Fujifil Finepix XP95,27.75,2020-07-28 00:00:00
Fujifilm FinePix XP90 - Stylish and tough waterproof digital camera - MSRP $200,46.9,2020-07-19 00:00:00
Fujifilm FinePix XP135 16.4 MP Digital Action Camera - Black,62.75,2020-06-02 00:00:00
Fujifilm FinePix XP120 Digital Camera - Black/Lime Green,44.64,2020-06-09 00:00:00
Fujifilm FinePix XP60 16.4 MP Digital Waterproof Camera (Blue),62.0,2020-08-06 00:00:00
Fujifilm FinePix XP Series XP60 16.4MP Digital Camera - Red,43.27,2020-08-08 00:00:00
Open Box - Fujifilm Finepix XP95 16M Waterproof Camera - 074101027594 - BLUE,54.99,2020-08-01 00:00:00
Fujifilm Finepix XP140 16.4MP Point & Shoot Camera - Sky Blue (Body Only),58.39,2020-08-02 00:00:00
Fujifilm FinePix X Series XP200 16.4MP Digital Camera ,65.0,2020-07-22 00:00:00
Fuji Film FinePix XP120 Digital Compact Camera - Sky Blue,53.0,2020-05-23 00:00:00
Fujifilm FinePix XP85 Digital Camera WiFi Waterproof Shockproof Yellow Fuji ,33.5,2020-07-30 00:00:00
"Fujifilm XP120 Finepix Waterproof Shock proof Digital Camera, Blue",52.0,2020-06-22 00:00:00
Fujifilm Finepix XP120  Yellow Underwater Camera - In Box and Never Used!,60.0,2020-07-27 00:00:00
Fujifilm FinePix XP120 Digital Compact Camera - Sky Blue,57.45,2020-05-29 00:00:00
Fujifilm Finepix XP140 16.4MP Point & Shoot Camera - Sky Blue  *NEW*,90.99,2020-07-09 00:00:00
Fujifilm FinePix xp90 Waterproof Camera,36.0,2020-05-31 00:00:00
Fujifilm Finepix XP120  Yellow  Camera - New / Charger Included,101.95,2020-07-22 00:00:00
FUJIFILM FinePix XP95 16.4MP WATERPROOF DIGITAL CAMERA - BLUE,30.25,2020-05-30 00:00:00
Fujifilm FinePix XP Series XP80 16.4MP Digital Camera (GREAT CONDITION),37.4,2020-07-31 00:00:00
FUJI FINEPIX XP140 WATERPROOF 16.4MP DIGITAL CAMERA WITH CHARGER,100.57,2020-05-20 00:00:00
Fujifilm FinePix XP125 Waterproof Camera - Lime Green - 16MP 5x Zoom,58.75,2020-05-30 00:00:00
 Fujifilm FinePix XP90 Waterproof Digital Camera Black Lime Green w/ charger ,44.9,2020-08-06 00:00:00
Fujifilm FinePix XP90 16.4MP Waterproof Shockproof Digital Camera Yellow,45.22,2020-07-12 00:00:00
FujiFilm FinePix XP50 Underwater Camera Orange,34.6,2020-08-12 00:00:00
Fujifilm FinePix XP Series XP60 16.4MP Digital Camera - Black,33.6,2020-07-15 00:00:00
Underwater Fujifilm FinePix X Series XP70 16.4MP Digital Camera - Blue,66.9,2020-06-29 00:00:00
Fujifilm FINEPIX XP50 Waterproof Camera Excellent Condition,36.6,2020-07-07 00:00:00
Fujifilm FinePix XP100 14MP Waterproof digital Camera green fuji film xp 100,50.0,2020-08-02 00:00:00
Fujifilm FinePix XP90 Yellow Waterproof digital camera (Yellow),66.0,2020-08-01 00:00:00
Fujifilm FinePix XP Series XP60 16.4MP Digital Camera - Green,27.0,2020-08-01 00:00:00
