title,price,date1/1 print ACEO sketch card FRANKENSTEIN'S MONSTER Boris Karloff ,12.16,2020-09-13 00:00:00
MTG - The Dark - N1268 - Frankenstein's Monster  X2,11.79,2020-09-13 00:00:00
"CIRCA. 1970 GROOVY GHOULIES CEREAL PREMIUM DECAL SHEET 3"" X 5 1/2"" FRANKENSTEIN",26.38,2020-09-13 00:00:00
Frankenstein and The Monster From Hell DVD,10.5,2020-09-13 00:00:00
2018 Royal Mint Mary Shelley Frankenstein £2 Two Pound Coin Pack Uncirculated,38.12,2020-09-13 00:00:00
YOUNG FRANKENSTEIN 8 x L.C French 1974 MEL BROOKS,28.3,2020-09-13 00:00:00
"LuLaRoe TC2 Halloween Leggings Lot Of 3 * Witch, Skulls, Frankenstein* VGUC",33.4,2020-09-13 00:00:00
baby gap orange black skeleton scare halloween top frankenstein boy size 2T,10.24,2020-09-13 00:00:00
The Bride Of Frankenstein Universal Monsters The Classic Collection VHS,10.3,2020-09-13 00:00:00
"Frankenstein Meets the Wolfman (VHS) Universal Monsters, Bela Lugosi, Lon Chaney",5.04,2020-09-13 00:00:00
House of Frankenstein (VHS) The Classic Collection,3.79,2020-09-13 00:00:00
Frankenstein Vintage Comic 1951 British Edition No 4 Great condition,59.97,2020-09-13 00:00:00
Universal Monsters Frankenstein BAF Build a Figure Action Figure Arm Toy Island ,21.0,2020-09-13 00:00:00
1966 CASTLE OF FRANKENSTEIN ISSUE #8 MAGAZINE w BATMAN AND ROBIN NICE ,21.62,2020-09-13 00:00:00
MONSTER Under My Bed - Frankenstein Boris Karloff ONE:12 Figure NEW n Box PLUS..,74.95,2020-09-14 00:00:00
PHOTOPLAY NOV. 1931 INA CLAIRE EARL CHRISTY COVER GARBO LUPE VELEZ FRANKENSTEIN ,75.49,2020-09-14 00:00:00
🚨🔥Frankenstein Hot Topic Exclusive Hikari LE 1200 Pieces Japanese Vinyl🔥🔑,24.3,2020-09-14 00:00:00
1973 Frankenstein PENDULUM PRESS INC.  book by Mary W. Shelley VINTAGE,37.0,2020-09-14 00:00:00
Handmade greeting card Halloween Frankenstein Witch Spider Trick Or Treat 3-D,2.99,2020-09-14 00:00:00
Bath And Bidy Works Frankenstein Halloween Candle Holders,25.0,2020-09-14 00:00:00
Frankenstein Figure With Base By Yanoman Silver Screen Version MIB Cool In USA!,16.0,2020-09-14 00:00:00
FRANKENSTEIN-CRAFT HOUSE PAINT BY NUMBER PAINTING-1975-UNIVERSAL MONSTERS-GROOVY,153.99,2020-09-14 00:00:00
MONSTER Under My Bed - Frankenstein Boris Karloff ONE:12 Figure NEW n Box PLUS..,74.95,2020-09-14 00:00:00
Primitive FRANKENSTEIN and his BRIDE Halloween Doll Pattern SALE,6.5,2020-09-14 00:00:00
ASKING ALEXANDRIA Shirt M Frankenstein Design Reckless & Relentless OOP HTF RARE,4.0,2020-09-14 00:00:00
Universal Studios Monsters Electronic Talking Head Crusher Frankenstein Karloff,38.99,2020-09-14 00:00:00
Universal Monsters Bride of Frankenstein Jakks Pacific - minty,24.0,2020-09-14 00:00:00
Lularoe original Classic T Shirt XL Halloween Frankenstein Green Black Purple ,7.5,2020-09-14 00:00:00
Silent Screamers Reel Masters Edison's Frankenstein 1910 Action Figure Mezco,6.9,2020-09-14 00:00:00
TMNT Universal Monsters Frankenstein Unpunched Rare Purple Weapons!,76.0,2020-09-14 00:00:00
"vintage palmer yellow Frankenstein Dracula Wolfman Universal Monsters 3"" figures",81.0,2020-09-14 00:00:00
"HALLOWEEN SNOW GLOBE - FRANKENSTEIN MONSTER - 3 1/2"" TALL - NEW",31.99,2020-09-14 00:00:00
Hello Kitty Halloween 2020 Frankenstein Plush,51.0,2020-09-14 00:00:00
FRANKENSTEIN MARY SHELLEY £2 POUND COIN BUNC 2018. ROYAL MINT SEALED PACK,21.75,2020-09-14 00:00:00
Funko POP Halloween Exclusives Corpse bride Skeleton And Frankenstein Freddy,40.0,2020-09-14 00:00:00
2018 Mary Shelley’s Frankenstein £2 Coin Brilliant Uncirculated Certified,21.03,2020-09-14 00:00:00
Lularoe Tc2 leggings NWT  Frankenstein Colorful! So Soft!,40.0,2020-09-14 00:00:00
Baby Halloween F&F 🎃 Frankenstein Baby Grow Age 9-12 Months,1.45,2020-09-14 00:00:00
"Funko Pop! Frankenstein with Flower 607, Special Edition, Glow in the Dark, New",26.72,2020-09-14 00:00:00
"VTG 2003 DEPT 56 FRANKENSTEIN'S MONSTER, SET OF 1, CERAMIC WINDMILL HOUSE, ONLY ",89.5,2020-09-14 00:00:00
Frankenstein - Power Records - 33 1/3 RPM EP - 1970s *Halloween* Mini Record,17.5,2020-09-14 00:00:00
Annalee Dolls Halloween 4 Pack Pirate Nurse Frankenstein Devil Collectable ,132.0,2020-09-14 00:00:00
Young Frankenstein / Spaceballs English French or Spanish Options  DVD Flat Ship,0.75,2020-09-14 00:00:00
Prize Comics #66 Featuring Frankenstein The Merry Monster 1947.,102.5,2020-09-14 00:00:00
"Vintage 1980's RUSS Halloween 5"" One-Eyed Frankenstein Troll w Foot Tag #18018",35.24,2020-09-14 00:00:00
RARE Dan Dee Monster Mash Dancing and Singing Frankenstein,43.99,2020-09-14 00:00:00
(Toys R Us Exclusive) Universal Monster Minimates: Frankenstein & Dracula,10.0,2020-09-14 00:00:00
PHOTOPLAY NOV. 1931 INA CLAIRE EARL CHRISTY COVER GARBO LUPE VELEZ FRANKENSTEIN ,75.49,2020-09-14 00:00:00
Hammer Horror: the curse of Frankenstein signed Freddie Jones,8.1,2020-09-14 00:00:00
UNIVERSAL MONSTERS RARE SON OF RANKENSTEIN STATUE HORROR FIGURE ,40.75,2020-09-14 00:00:00
UNIVERSAL MONSTERS RARE FRANKENSTEIN figure set RARE HORROR FIGURE 9 inch ,22.35,2020-09-14 00:00:00
UNIVERSAL MONSTERS RARE FRANKENSTEIN statue RARE HORROR FIGURE 18 inch,76.24,2020-09-14 00:00:00
"VERY RARE, FRANKENSTEIN--1891--MARY SHELLEY-- HARDBACK--",240.55,2020-09-14 00:00:00
B428 japanese anime figure Used Fate Grand Order Ichibankuji Frankenstein,27.99,2020-09-14 00:00:00
"MEGO FRANKENSTEIN 8"" EXCLUSIVE ACTION FIGURE 2018 BRAND NEW CLASSIC 8 INCH",42.73,2020-09-14 00:00:00
🚨🔥Frankenstein Hot Topic Exclusive Hikari LE 1200 Pieces Japanese Vinyl🔥🔑,39.2,2020-09-14 00:00:00
1973 Frankenstein PENDULUM PRESS INC.  book by Mary W. Shelley VINTAGE,7.0,2020-09-14 00:00:00
Handmade greeting card Halloween Frankenstein Witch Spider Trick Or Treat 3-D,3.84,2020-09-14 00:00:00
Bath And Bidy Works Frankenstein Halloween Candle Holders,34.0,2020-09-14 00:00:00
Frankenstein Figure With Base By Yanoman Silver Screen Version MIB Cool In USA!,24.0,2020-09-14 00:00:00
8MM FILM FRANKENSTEIN MUST BE DESTROYED,26.98,2020-09-14 00:00:00
Vintage Universal Monsters Frankenstein Drinking Glass 60s,107.25,2020-09-14 00:00:00
Vintage Telco Wolfman Frankenstein  Monsters Toy motionette famous universal,21.05,2020-09-14 00:00:00
AMAZING Figure Modeler Magazine #10 Aurora Creature Black Lagoon Frankenstein,28.5,2020-09-14 00:00:00
FRANKENSTEIN-CRAFT HOUSE PAINT BY NUMBER PAINTING-1975-UNIVERSAL MONSTERS-GROOVY,126.49,2020-09-14 00:00:00
MONSTER Under My Bed - Frankenstein Boris Karloff ONE:12 Figure NEW n Box PLUS..,68.95,2020-09-14 00:00:00
Primitive FRANKENSTEIN and his BRIDE Halloween Doll Pattern SALE,7.8,2020-09-14 00:00:00
"Young Frankenstein (Blu-ray Disc, 2014, 40th Anniversary)",7.45,2020-09-14 00:00:00
Vintage 1960's Frankenstein Soaky Colgate IMCO Universal Bubble Bath Bottle Toy,70.75,2020-09-14 00:00:00
ASKING ALEXANDRIA Shirt M Frankenstein Design Reckless & Relentless OOP HTF RARE,9.0,2020-09-14 00:00:00
Universal Studios Monsters Electronic Talking Head Crusher Frankenstein Karloff,17.49,2020-09-14 00:00:00
Universal Monsters Bride of Frankenstein Jakks Pacific - minty,39.0,2020-09-14 00:00:00
"Vtg Frankenstein 8"" Figure Hands & eyes Glow with Black Light Made in India rare",28.0,2020-09-14 00:00:00
TMNT Universal Monsters Mike As Frankenstein 1993,82.7,2020-09-14 00:00:00
Lularoe original Classic T Shirt XL Halloween Frankenstein Green Black Purple ,12.3,2020-09-14 00:00:00
LuLaRoe Bones Skeleton TC Leggings Halloween Creepin It Real HTF NWT Rare,25.2,2020-09-14 00:00:00
Silent Screamers Reel Masters Edison's Frankenstein 1910 Action Figure Mezco,19.45,2020-09-14 00:00:00
TMNT Universal Monsters Frankenstein Unpunched Rare Purple Weapons!,86.0,2020-09-14 00:00:00
FAMOUS MONSTERS SPEAK: Dracula & Frankenstein Horror GOLDEN Vinyl LP Album,21.83,2020-09-14 00:00:00
"vintage palmer yellow Frankenstein Dracula Wolfman Universal Monsters 3"" figures",50.0,2020-09-14 00:00:00
FRANKENSTEIN SILESIA GOTT HILF 1861 GERMAN COMMEMORATIVE MEDAL TOWN HALL FIRE⭐🌈,14.94,2020-09-14 00:00:00
"HALLOWEEN SNOW GLOBE - FRANKENSTEIN MONSTER - 3 1/2"" TALL - NEW",5.99,2020-09-14 00:00:00
The Monster of Frankenstein Book and Record Set.  Power Records 14,29.65,2020-09-14 00:00:00
Aurora Frankenstein Glow Kit #449-150 Very Rare,115.0,2020-09-14 00:00:00
NWT Disney Store Goofenstein Goofy Frankenstein 8” Plush Halloween Bean Bag,9.69,2020-09-14 00:00:00
Hello Kitty Halloween 2020 Frankenstein Plush,24.6,2020-09-14 00:00:00
Funko POP Halloween Exclusives Corpse bride Skeleton And Frankenstein Freddy,50.0,2020-09-14 00:00:00
Lularoe Tc2 leggings NWT  Frankenstein Colorful! So Soft!,12.75,2020-09-14 00:00:00
"VTG 2003 DEPT 56 FRANKENSTEIN'S MONSTER, SET OF 1, CERAMIC WINDMILL HOUSE, ONLY ",32.62,2020-09-14 00:00:00
Frankenstein - Power Records - 33 1/3 RPM EP - 1970s *Halloween* Mini Record,20.3,2020-09-14 00:00:00
1968 Silver X-Men #40 Origin Of Cyclops Frankenstein CGC Graded 9.0 Rare Hot Key,190.0,2020-09-14 00:00:00
1992 MCDONALDS MCNUGGET BUDDIES FRANKENSTEIN HAPPY MEAL HALLOWEEN CHICKEN NUGGET,13.25,2020-09-14 00:00:00
"The Monster of Frankenstein #1 - #5, VG+ to VG/F",35.49,2020-09-14 00:00:00
Annalee Dolls Halloween 4 Pack Pirate Nurse Frankenstein Devil Collectable ,104.4,2020-09-14 00:00:00
Young Frankenstein / Spaceballs English French or Spanish Options  DVD Flat Ship,5.55,2020-09-14 00:00:00
Friendly's Halloween Frankenstein Ice Cream Sundae Dish Bowl 2011,20.05,2020-09-14 00:00:00
Prize Comics #66 Featuring Frankenstein The Merry Monster 1947.,107.25,2020-09-14 00:00:00
"Vintage 1980's RUSS Halloween 5"" One-Eyed Frankenstein Troll w Foot Tag #18018",19.99,2020-09-14 00:00:00
RARE Dan Dee Monster Mash Dancing and Singing Frankenstein,66.99,2020-09-14 00:00:00
(Toys R Us Exclusive) Universal Monster Minimates: Frankenstein & Dracula,16.0,2020-09-14 00:00:00
"Vintage 1999 CVS Stuffins Inc Universal Studios Monsters 9"" Stuffed Frankenstein",31.75,2020-09-14 00:00:00
"Kenner Universal Studios "" Frankenstein ""  Signature Series Action Figure. NIB",37.7,2020-09-14 00:00:00
SET OF 5 UNIVERSAL MONSTERS CVS CANDLES FRANKENSTEIN Mummy WOLFMAN CREATURE,16.75,2020-09-14 00:00:00
"DISNEY HALLOWEEN Mickey Mouse Frankenstein Minnie Bride Garden Statue Figure 7""",62.98,2020-09-14 00:00:00
PHOTOPLAY NOV. 1931 INA CLAIRE EARL CHRISTY COVER GARBO LUPE VELEZ FRANKENSTEIN ,38.85,2020-09-14 00:00:00
Womens Frankenstein & Bride Halloween Crew Socks-Black/Green/Purple One Size NWT,6.99,2020-09-14 00:00:00
"VERY RARE, FRANKENSTEIN--1891--MARY SHELLEY-- HARDBACK--",240.55,2020-09-14 00:00:00
MTG 🔥 THE DARK 🔥 FRANKENSTEIN'S MONSTER *NM/MINT* Vintage Magic The Gathering,43.51,2020-09-15 00:00:00
Castle Films Son Of Frankenstein Vintage Horror Super 8mm Film In Original Box,25.0,2020-09-15 00:00:00
The Ghost of Frankenstein-Universal Monsters-Bela Lugosi-Cedric Hardwicke,25.7,2020-09-15 00:00:00
Frankenstein Official Licensed Bendable Universal Monsters  23” Side Show Toys,28.0,2020-09-15 00:00:00
1998~Series ONE~FRANKENSTEIN &  WOLFMAN *UNIVERSAL STUDIOS MONSTERS**NRFB**,94.0,2020-09-15 00:00:00
Marvel Comics The Monster Of Frankenstein #4 July 1973,19.0,2020-09-15 00:00:00
Halloween Large 38” Flocked Jointed Die Cut Out FRANKENSTEIN Decoration vtg  NOS,24.99,2020-09-15 00:00:00
Animatronic Crawling Frankenstein Monster Hand Halloween Horror Decor Prop WORKS,13.1,2020-09-15 00:00:00
Frankenstein Model Kit - Polar Lights - Aurora,42.0,2020-09-15 00:00:00
Frankenstein Luminators Neon Monsters Model Monogram 1991 ,25.99,2020-09-15 00:00:00
Electric Frankenstein - Live at WFMU Picture Disc Vinyl LP 210/3000 1996,40.0,2020-09-15 00:00:00
Giant-Size Werewolf #2 VF 8.0 Frankenstein!,39.51,2020-09-15 00:00:00
LEMAX SPOOKY TOWN/HALLOWEEN/UNIVERSAL MONSTERS *THE MUMMY/ FRANKENSTEIN*FIGURES-,41.0,2020-09-15 00:00:00
Women's Green/Black Summer Gothic Large Dress! Frankenstein Embroidery! Spooky! ,4.37,2020-09-15 00:00:00
FUNKO POP UNIVERSAL STUDIOS MONSTERS FRANKENSTEIN #607 GITD-WALGREENS EXCLUSIVE,16.0,2020-09-15 00:00:00
AirBlown Inflatable Happy Frankenstein Outdoor Halloween Decoration  8 Feet,70.0,2020-09-15 00:00:00
"Vampirella, Famous Monsters, Castle Of Frankenstein And More Lot Of 11 Magazines",36.0,2020-09-15 00:00:00
Frankenstein Monster Ring Size 13,55.2,2020-09-15 00:00:00
* 2018 Strike Your Own FRANKENSTEIN. Frankenstien 2 Pound Coin BU Sealed,26.29,2020-09-15 00:00:00
Hammer Horror of Frankenstein Commemorative Cover,1.3,2020-09-15 00:00:00
El Gato Gomez Original Horror Painting Frankenstein Halloween Mid Century Modern,124.5,2020-09-15 00:00:00
Gaint 8 foot Airblown Blow up inflatable Happy Halloween Frankenstein lights up ,174.0,2020-09-15 00:00:00
Frankenstein Lon Chaney Jr #3 Horror movie poster print,20.98,2020-09-15 00:00:00
Frankenstein vs Godzilla Japanese Horror movie poster print 3,20.98,2020-09-15 00:00:00
Animal Man Vol 1-3 & Frankenstein Agent Of S.H.A.D.E. Vol 1 By Jeff Lemire Lot,39.99,2020-09-15 00:00:00
Universal Monsters Frankenstein With Flower GITD Exclusive Funko Pop!,7.28,2020-09-15 00:00:00
Aurora Frankenstein Glow In The Dark 1969 Model Kit 449-150 Box & Instructions,50.0,2020-09-15 00:00:00
Frankenstein Halloween Costume 10-11 Years,55.23,2020-09-15 00:00:00
2018 Mary Shelley's Frankenstein 2 Pound Coin with hologram,23.58,2020-09-15 00:00:00
Ooak UNIVERSAL MONSTERS artist made x4 lot  HORROR FIGURE HALLOWEEn ,6.57,2020-09-15 00:00:00
Trinkets Treasures Oddities Frankenstein Tools Spider-Man Cigars,16.0,2020-09-15 00:00:00
Hello Kitty Halloween Frankenstein Plush,26.0,2020-09-15 00:00:00
MTG 🔥 THE DARK 🔥 FRANKENSTEIN'S MONSTER *NM/MINT* Vintage Magic The Gathering,21.5,2020-09-15 00:00:00
Castle Films Son Of Frankenstein Vintage Horror Super 8mm Film In Original Box,30.3,2020-09-15 00:00:00
The Ghost of Frankenstein-Universal Monsters-Bela Lugosi-Cedric Hardwicke,4.5,2020-09-15 00:00:00
Frankenstein Official Licensed Bendable Universal Monsters  23” Side Show Toys,41.95,2020-09-15 00:00:00
1998~Series ONE~FRANKENSTEIN &  WOLFMAN *UNIVERSAL STUDIOS MONSTERS**NRFB**,69.9,2020-09-15 00:00:00
"1983 FRANKENSTEIN SIGNED STEPHEN KING & ARTIST, 480/500 ORNATE 44 ILLUSTRATIONS",700.0,2020-09-15 00:00:00
Vintage Gravedale High Frankenstein Action Figure 1991 NBC Monster,8.5,2020-09-15 00:00:00
Frankenstein Dracula Werewolf red plastic figures nos in bags giveaways? Vintage,76.0,2020-09-15 00:00:00
Marvel Comics The Monster Of Frankenstein #4 July 1973,24.99,2020-09-15 00:00:00
BATMAN FRANKENSTEIN MONSTER MASKS SCHOOL WALK! vtg 60's HALLOWEEN COSTUMES photo,20.74,2020-09-15 00:00:00
Halloween Large 38” Flocked Jointed Die Cut Out FRANKENSTEIN Decoration vtg  NOS,34.25,2020-09-15 00:00:00
Vintage '70's Rosko Battery Operated Frankenstein Monster Japanese Boxed!,180.69,2020-09-15 00:00:00
ORIGINAL SET OF 4 VINTAGE CHARACTER GLASSES - UNIVERSAL MONSTERS SET 1960s,387.55,2020-09-15 00:00:00
Animatronic Crawling Frankenstein Monster Hand Halloween Horror Decor Prop WORKS,21.8,2020-09-15 00:00:00
Frankenstein Model Kit - Polar Lights - Aurora,51.95,2020-09-15 00:00:00
Frankenstein Luminators Neon Monsters Model Monogram 1991 ,40.98,2020-09-15 00:00:00
"Frankenstein,Jr       # 1       (1966)  Comics",11.01,2020-09-15 00:00:00
THE INVADERS #31 (1978) VF/NM HIGH GRADE BEAUTY * NAZI FRANKENSTEIN APPEARANCE,12.49,2020-09-15 00:00:00
Frankenstein The Monster Returns NES game Bandai Cartridge Only Tested Working,51.15,2020-09-15 00:00:00
Electric Frankenstein - Live at WFMU Picture Disc Vinyl LP 210/3000 1996,16.8,2020-09-15 00:00:00
Frankenstein Blow Mold Halloween Prop Indoor /Outdoor 36 Inch Tall,138.28,2020-09-15 00:00:00
Giant-Size Werewolf #2 VF 8.0 Frankenstein!,18.46,2020-09-15 00:00:00
LEMAX SPOOKY TOWN/HALLOWEEN/UNIVERSAL MONSTERS *THE MUMMY/ FRANKENSTEIN*FIGURES-,18.0,2020-09-15 00:00:00
Women's Green/Black Summer Gothic Large Dress! Frankenstein Embroidery! Spooky! ,13.97,2020-09-15 00:00:00
FUNKO POP UNIVERSAL STUDIOS MONSTERS FRANKENSTEIN #607 GITD-WALGREENS EXCLUSIVE,24.25,2020-09-15 00:00:00
Vintage 1961 Aurora Model FRANKENSTEIN Built & Painted ,61.28,2020-09-15 00:00:00
AirBlown Inflatable Happy Frankenstein Outdoor Halloween Decoration  8 Feet,85.15,2020-09-15 00:00:00
Funko Pop! Universal Monsters  #112 Frankenstein VAULTED Pre Owned,46.0,2020-09-15 00:00:00
"Vampirella, Famous Monsters, Castle Of Frankenstein And More Lot Of 11 Magazines",36.0,2020-09-15 00:00:00
El Gato Gomez Original Horror Painting Frankenstein Halloween Mid Century Modern,135.4,2020-09-15 00:00:00
Gaint 8 foot Airblown Blow up inflatable Happy Halloween Frankenstein lights up ,113.79,2020-09-15 00:00:00
Frankenstein Lon Chaney Jr #3 Horror movie poster print,10.97,2020-09-15 00:00:00
Frankenstein vs Godzilla Japanese Horror movie poster print 3,10.97,2020-09-15 00:00:00
Mel Brooks DVD Lot Spaceballs/ Young Frankenstein/Robin Hood Men/Blazing Saddles,14.98,2020-09-15 00:00:00
Halloween Frankenstein Bear with Ghost bear  trick or treat hand painted ceramic,51.9,2020-09-15 00:00:00
Funko Pop Franken Freddy Funkoween Exclusive Frankenstein Funko Shop Exclusive,35.3,2020-09-15 00:00:00
Frankenstein By Ian Thorne (Crestwood Monster Series),61.9,2020-09-15 00:00:00
Universal Studio Monsters Bride of Frankenstein Collectible Animated Figure/Box,36.75,2020-09-15 00:00:00
NWT Disney Store Exclusive Goof N Stein 22” Frankenstein Goofy Plush,45.0,2020-09-15 00:00:00
"Dept 56 Halloween 2 pcs. Capt. Black Bart's Ghost, Treat for Kids Frankenstein ",19.99,2020-09-15 00:00:00
Animal Man Vol 1-3 & Frankenstein Agent Of S.H.A.D.E. Vol 1 By Jeff Lemire Lot,18.98,2020-09-15 00:00:00
The Haunting-The thing-Bone Daddy-Frankenstein-Werewolf  5 x VHS Video Tapes,15.0,2020-09-15 00:00:00
Aurora Frankenstein Glow In The Dark 1969 Model Kit 449-150 Box & Instructions,64.0,2020-09-15 00:00:00
Monster High Frankie Stein Coffin Bean NIB. Daughter of Frankenstein Mattel Doll,14.99,2020-09-15 00:00:00
Trinkets Treasures Oddities Frankenstein Tools Spider-Man Cigars,24.3,2020-09-15 00:00:00
Hello Kitty Halloween Frankenstein Plush,32.0,2020-09-15 00:00:00
PETER BOYLE signed YOUNG FRANKENSTEIN 8x10 w/ coa CREATING MONSTER MINI-POSTER,44.79,2020-09-16 00:00:00
ROLLED ELECTRIC FRANKENSTEIN LOCAL BAND CONCERT POSTER JERMAINE ART NUMBERED,40.0,2020-09-16 00:00:00
Monogram Luminators Neon Monsters Frankenstein Model Kit MIB,77.24,2020-09-16 00:00:00
LuLaRoe OS Floral Skeleton Skull Bones Leggings Purple Black Creepin It Real NWT,28.0,2020-09-16 00:00:00
"Vintage ""Frankenstein"" Halloween Black Felt Hat! KOOL!    ",106.02,2020-09-16 00:00:00
Invincible Iron Man 101 Frankenstein Monster 1st app Dreadknight VF+,3.99,2020-09-16 00:00:00
Gene Wilder Willy Wonka Young Frankenstein four signed 3x5 index cards,23.5,2020-09-16 00:00:00
Hello Kitty Halloween Frankenstein Plush,26.0,2020-09-16 00:00:00
Frankenstein Prada T-Shirt F/W 2019 M,150.0,2020-09-16 00:00:00
New Mego head lot of three Frankenstein monster 8 inch heads,10.5,2020-09-16 00:00:00
Frankenstein Enamel Pin Double Backing GLOW IN THE DARK Rare Horror Halloween ,15.5,2020-09-16 00:00:00
Universal Monsters Classic Movie Monster Mashers - set of 4 - New in packs 1990,31.0,2020-09-16 00:00:00
Primitive Grungy BIG Frankenstein Monster Mash Halloween Doll,90.23,2020-09-16 00:00:00
"Nwot Lootwear ""Bride Of Frankenstein"" Tee Size L**",41.49,2020-09-16 00:00:00
PETER BOYLE signed YOUNG FRANKENSTEIN 8x10 w/ coa CREATING MONSTER MINI-POSTER,44.79,2020-09-16 00:00:00
Primitive Grungy Frankenstein Monster Halloween Doll,53.77,2020-09-16 00:00:00
Bride Of Frankenstein And Frankenstein (walgreens) Funko Pop,110.5,2020-09-16 00:00:00
FRANKENSTEIN Burger King 1997 UNIVERSAL STUDIOS MONSTERS Happy Meal Toy Compl,0.99,2020-09-16 00:00:00
Vtg HalloWeen Taper Candles Dracula And Frankenstein 10” NIB,6.5,2020-09-16 00:00:00
1973 MARVEL COMICS FRANKENSTEIN # 7 w/ DRACULA  ( 2 STORIES),3.99,2020-09-16 00:00:00
The Monster of Frankenstein Complete Marvel Deluxe TPB NEW RARE Dracula Werewolf,10.5,2020-09-16 00:00:00
EVH Eddie Van Halen Frankenstein Humbucker Guitar Pickup - Black,75.0,2020-09-16 00:00:00
Franken Freddy Funko Pop - Funko Exclusive Frankenstein Halloween,25.0,2020-09-16 00:00:00
Retired Lemax Spooky Town Caged Frankenstein Monster Animated Halloween 44106,45.72,2020-09-16 00:00:00
RARE Department 56 FRANKENSTEINS LAB google eye Bride of Frankenstein candy bowl,448.0,2020-09-16 00:00:00
Universal Frankenstein Stamp NEW Mouse Pad ,7.5,2020-09-16 00:00:00
"ANNALEE 13"" 2005 FRANKENSTEIN HALLOWEEN ",91.99,2020-09-16 00:00:00
"MEGO HORROR SET OF 5 !  PHANTOM, FRANKENSTEIN, DRACULA, FREDDIE & WEREWOLF",83.0,2020-09-16 00:00:00
Ceramic Halloween Tea Light Holder Frankenstein Votive tea light Candle included,3.99,2020-09-16 00:00:00
"3x Halloween Sleepsuits, Skeleton, Pumpkin And Frankenstein 3-6 Months",3.55,2020-09-16 00:00:00
ROLLED ELECTRIC FRANKENSTEIN LOCAL BAND CONCERT POSTER JERMAINE ART NUMBERED,40.0,2020-09-16 00:00:00
RARE Cline Art Limited Edition * Boris Karloff as Frankenstein * Bust ~ Must See,275.0,2020-09-16 00:00:00
Monogram Luminators Neon Monsters Frankenstein Model Kit MIB,77.24,2020-09-16 00:00:00
Funko Pop Universal Studios Monsters Frankenstein #607 Walgreens Exclusive GITD,48.5,2020-09-16 00:00:00
VINTAGE 1980'S  TELCO FRANKENSTEIN MOTION-ETTES IN ORIGINAL BOX HALLOWEEN-WORKS!,96.0,2020-09-16 00:00:00
LADY FRANKENSTEIN (1972) 16mm horror.  Joseph Cotten,187.0,2020-09-16 00:00:00
Rare 1980s Vintage Erasers Rubbers - Frankenstein & Dr Jekyll/Hyde - Vintage,9.59,2020-09-16 00:00:00
The Bride of Frankenstein #2 Lobby Card Movie Poster Boris Karloff Colin Clive,16.0,2020-09-16 00:00:00
Frankenstein Lobby Card Movie Poster Colin Clive #4,16.0,2020-09-16 00:00:00
RARE Finnish Superman Comic Book Teräsmies 1979 Vampires Frankenstein Werewolves,32.37,2020-09-16 00:00:00
toddler halloween Frankenstein baby grow outfit 12-18 months. Worn once. F&F,1.3,2020-09-16 00:00:00
Whole thing German REICH POST POSTCARD P12 Stamp Frankenstein 1880,1.19,2020-09-16 00:00:00
"STUNNING COPY OF  FRANKENSTEIN--LEATHER, GILT EDGES, FINE PAPER, RIBBON MARKER",39.42,2020-09-16 00:00:00
Frankenstein Created Woman (  2 disc - Blu Ray & DVD) ,31.99,2020-09-16 00:00:00
"PATTERN - PRIMITIVE - HALLOWEEN FRANKENSTEIN DOLL 41"" - TENDERBERRY STITCHES",13.01,2020-09-16 00:00:00
LuLaRoe OS Floral Skeleton Skull Bones Leggings Purple Black Creepin It Real NWT,36.4,2020-09-16 00:00:00
Pathtag  28006  -  Frankenstein  Airplane  -geocaching/geocoin/Extagz  *Retired*,8.62,2020-09-16 00:00:00
"Vintage ""Frankenstein"" Halloween Black Felt Hat! KOOL!    ",77.62,2020-09-16 00:00:00
Invincible Iron Man 101 Frankenstein Monster 1st app Dreadknight VF+,7.49,2020-09-16 00:00:00
FRANKENSTEIN Charm HALLOWEEN Pendant Monster Sterling Silver 925 .925,18.34,2020-09-16 00:00:00
Gene Wilder Willy Wonka Young Frankenstein four signed 3x5 index cards,27.0,2020-09-16 00:00:00
Hello Kitty Halloween Frankenstein Plush,32.0,2020-09-16 00:00:00
Frankenstein Prada T-Shirt F/W 2019 M,154.05,2020-09-16 00:00:00
New Mego head lot of three Frankenstein monster 8 inch heads,14.5,2020-09-16 00:00:00
Frankenstein Enamel Pin Double Backing GLOW IN THE DARK Rare Horror Halloween ,19.35,2020-09-16 00:00:00
Universal Monsters Classic Movie Monster Mashers - set of 4 - New in packs 1990,42.99,2020-09-16 00:00:00
"Young Frankenstein (VHS), Comedy Classic, Great condition!",4.3,2020-09-16 00:00:00
MONSTER OF FRANKENSTEIN #3 1973 F/VF+,10.88,2020-09-16 00:00:00
Primitive Grungy BIG Frankenstein Monster Mash Halloween Doll,71.95,2020-09-16 00:00:00
"Nwot Lootwear ""Bride Of Frankenstein"" Tee Size L**",15.49,2020-09-16 00:00:00
PETER BOYLE signed YOUNG FRANKENSTEIN 8x10 w/ coa CREATING MONSTER MINI-POSTER,37.54,2020-09-16 00:00:00
Primitive Grungy Frankenstein Monster Halloween Doll,48.1,2020-09-16 00:00:00
"BRIDE of FRANKENSTEIN Universal Studios Monster 1999 Stuffins 8"" Plush Doll CVS ",13.94,2020-09-16 00:00:00
Bride Of Frankenstein And Frankenstein (walgreens) Funko Pop,119.2,2020-09-16 00:00:00
The Curse of Frankenstein DVD,22.8,2020-09-16 00:00:00
FRANKENSTEIN Burger King 1997 UNIVERSAL STUDIOS MONSTERS Happy Meal Toy Compl,5.74,2020-09-16 00:00:00
Vtg HalloWeen Taper Candles Dracula And Frankenstein 10” NIB,16.4,2020-09-16 00:00:00
1973 MARVEL COMICS FRANKENSTEIN # 7 w/ DRACULA  ( 2 STORIES),7.94,2020-09-16 00:00:00
"Set 8 Universal Studios Monsters 1999 Plush Dracula Frankenstein Halloween 8"" 9""",43.24,2020-09-16 00:00:00
The Monster of Frankenstein Complete Marvel Deluxe TPB NEW RARE Dracula Werewolf,16.49,2020-09-16 00:00:00
EVH Eddie Van Halen Frankenstein Humbucker Guitar Pickup - Black,79.0,2020-09-16 00:00:00
Franken Freddy Funko Pop - Funko Exclusive Frankenstein Halloween,32.0,2020-09-16 00:00:00
PRADA FRANKENSTEIN KEYRING | BRAND NEW | RRP $460,300.0,2020-09-16 00:00:00
1960s Original Tin Japan ROSKO FRANKENSTEIN MONSTER Battery Operated ,55.0,2020-09-16 00:00:00
Gund Pusheen Blind Box - Frankenstein Series 4 Halloween Trick Treats Mini Plush,15.5,2020-09-16 00:00:00
Vintage 80's Original TELCO MOTION-ETTE Frankenstein Monster 17” RARE Halloween,50.0,2020-09-16 00:00:00
Retired Lemax Spooky Town Caged Frankenstein Monster Animated Halloween 44106,30.65,2020-09-16 00:00:00
RARE Department 56 FRANKENSTEINS LAB google eye Bride of Frankenstein candy bowl,457.2,2020-09-16 00:00:00
Universal Frankenstein Stamp NEW Mouse Pad ,10.3,2020-09-16 00:00:00
FRANKENSTEIN MEETS THE WOLFMAN   1 X 200' Super 8 SOUND (NEW & SEALED),83.81,2020-09-16 00:00:00
