title,price,date
FUJIFILM Finepix A820 Digital Camera works great  fuji film silver ,29.99,2020-08-11 00:00:00
Fujifilm Finepix A345 4.1mp Digital Camera With 3x Optical Zoom,14.8,2020-08-11 00:00:00
Fujifilm FinePix A Series A345 4.1MP Digital Camera - Silver Tested Works,15.49,2020-08-11 00:00:00
"Fujifilm FinePix A600 6.3MP Digital Camera - Silver - w Software, Manual",19.19,2020-08-11 00:00:00
Fujifilm FinePix A235 12.0MP Digital Camera - Good Condition - Fully Working,31.86,2020-08-11 00:00:00
"Fujifilm Finepix AX655 (Black) 16MP Digital Camera, Clean, Complete",39.0,2020-08-12 00:00:00
Fujifilm FinePix A Series A805 8.3MP Digital Blue Camera~~Nr Mint~~Bundle~~ ,29.99,2020-08-13 00:00:00
FUJI FINEPIX S1000 10 MP Digital Camera 12X Optical Zoom Excellent Hardly Used ~,58.95,2020-08-14 00:00:00
Fuji FinePix A Series A610 6.3 MP Digital Camera Silver w/ Memory Card,21.14,2020-08-14 00:00:00
Fujifilm Finepix A303 Digital Camera 3.24 MP 3.0x Zoom Great Shape Oriignal Box,19.68,2020-08-15 00:00:00
FujiFilm FinePix A330 3.2MP Digital Camera with 3x Optical Zoom Complete -WORKS,25.9,2020-08-16 00:00:00
FUJI FINEPIX S1000 10 MP Digital Camera 12X Optical Zoom Excellent Hardly Used ~,39.98,2020-08-17 00:00:00
FUJIFILM Finepix A820 Digital Camera Silver,32.31,2020-08-18 00:00:00
Fujifilm FinePix A Series AX560 16.0MP Digital Camera~Black~~Excellent~~Bundle~ ,39.99,2020-08-19 00:00:00
Fujifilm FinePix A Series A605 3.1MP Digital Camera with case - VGC and Tested,34.04,2020-08-20 00:00:00
Fujifilm FinePix 2650 2.0MP Digital Camera - Metallic Silver Case Instructions,16.88,2020-08-21 00:00:00
Fujifilm FinePix AX300 14 MP Digital Camera 5x Wide Angle Optical Zoom,19.8,2020-08-22 00:00:00
Fujifilm FinePix A Series A825 8.3MP Digital Camera - Silver,14.99,2020-08-22 00:00:00
"FUJIFILM A210 3.2 MP, 3X OPTICAL ZOOM FINEPIX DIGITAL CAMERA WITH BOX AND EXTRAS",24.85,2020-08-24 00:00:00
Fujifilm FinePix A Series A900 9.0MP Digital Camera - Silver,11.07,2020-08-25 00:00:00
Mint w/ Warranty Fujifilm FinePix A Series A820 8.3MP Digital Camera bundle,24.75,2020-08-25 00:00:00
Fujifilm FinePix A Series AV200 14.0MP Digital Camera - Black,17.99,2020-08-27 00:00:00
Fujifilm FinePix A Series A825 8.3MP Digital Camera  4 X optical zoom Grey #728,38.12,2020-08-29 00:00:00
Fujifilm FinePix A Series AX560 16.0MP Digital Camera - Black,41.04,2020-08-29 00:00:00
"Fujifilm FinePix A Series A500 5.1MP Digital Camera - Silver, Bundle with Case",17.99,2020-08-31 00:00:00
Fujifilm FinePix A Series A850 8.1MP Digital Camera - Silver,15.99,2020-09-01 00:00:00
Fujifilm FinePix A Series A820 Digital Camera Point and Shoot 8.3MP,20.95,2020-09-02 00:00:00
Fujifilm FinePix A Series AV200 14.0MP Digital Camera - Black,22.75,2020-09-02 00:00:00
Fujifilm FinePix AX250 14.0 MP Digital Camera - silver works,26.25,2020-09-03 00:00:00
Fujifilm Finepix AX655 digital camera 16 MP HD With Memory Card Preowned,26.0,2020-09-04 00:00:00
Fujifilm FinePix A Series A360 4.1MP Digital Camera - Silver👀,13.75,2020-09-05 00:00:00
Fujifilm FinePix A Series A820 8.3MP Digital Camera - Silver,20.31,2020-09-07 00:00:00
"Fujifilm FinePix A345 4.1MP Digital Camera With Cable,Software Manual And Case",25.0,2020-09-08 00:00:00
Fujifilm FinePix AV200 14.0MP Digital Camera TESTED In Working condition #779,27.6,2020-09-08 00:00:00
Fujifilm FinePix A Series AX550 16.0MP Digital Camera - Black,21.15,2020-09-09 00:00:00
FUJIFILM FINEPIX A400  4.1 Mega Pixels 3x Digital Camera,15.8,2020-09-10 00:00:00
Fujifilm FinePix A Series A310 3.1MP Digital Camera - Silver,25.33,2020-09-10 00:00:00
Fujifilm FinePix A Series A340 4.0MP Digital Camera - TESTED - Silver,21.39,2020-09-11 00:00:00
Fujifilm FinePix A Series A500 5.1MP Digital Camera used,22.5,2020-09-11 00:00:00
Fujifilm FinePix A210 3.2MP Digital Camera - Silver,18.54,2020-09-13 00:00:00
FujiFilm FinePix A Series - A205 Silver 2.0MP,19.54,2020-09-13 00:00:00
Fujifilm FinePix A403 2.1MP Digital Camera - Good Condition - Fully Working.,25.94,2020-09-13 00:00:00
Fujifilm FinePix A Series AX660 16.0MP Digital Camera - Black,40.94,2020-09-13 00:00:00
"Fujifilm Finepix JV100 Digital Camera, Black w/Case and Rechargeable Battery",17.94,2020-09-15 00:00:00
FujiFilm FinePix A303 Silver 3.2MP Digital Camera takes 2 AA BATTERIES,18.99,2020-09-15 00:00:00
Fujifilm Finepix A220 12.2MP Digital Camera - Silver w/ Box Manual & Case,29.95,2020-09-17 00:00:00
FUJI AX650 Fine pix 16 MP 5x Zoom HD Movie super clean give away,25.0,2020-09-17 00:00:00
Fujifilm FinePix A Series A180 10.2MP Digital Camera - Red,20.07,2020-09-17 00:00:00
Fujifilm Finepix JX Black Digital Camera JX370 14MP ,23.94,2020-09-18 00:00:00
Fujifilm FinePix A Series AX650 16.0MP Digital Camera - Black,30.9,2020-09-21 00:00:00
Fujifilm FinePix A160 10.2MP Digital Camera + Case - Good Condition - Working,29.23,2020-09-22 00:00:00
"Fujifilm FinePix A Series A330 3.2MP Digital Camera w/ 256MB Card ""Works Great""",18.0,2020-09-22 00:00:00
Fujifilm FinePix A Series A210 3.2MP Digital Camera - Silver,19.9,2020-09-23 00:00:00
Fujifilm FinePix A600 6.3MP Digital Camera,16.59,2020-09-25 00:00:00
FujiFilm Finepix A900 AA Battery 9MP 4x Zoom Digital Compact Camera & 1GB XD,31.52,2020-09-25 00:00:00
"Fujifilm FinePix A600 Digital Camera Point & Shoot 6.3MP 2.4"" 3x OZ 6x DZ Silver",32.84,2020-09-26 00:00:00
Fujifilm Finepix A700 7.3MP 3x Zoom AA Battery Digital Camera & 512MB XD Card,26.27,2020-09-29 00:00:00
Fujifilm FinePix AX330 14.0 MP Digital Camera With SD Card - Black,20.0,2020-09-30 00:00:00
FUJIFILM FinePix A345 4.1MP silver Digital Camera & bag  TESTED #973,31.67,2020-10-01 00:00:00
FUJIFILM FinePix A805 Blue AA Battery 8.3 MP 3x Zoom Digital Camera NOT WORKING,5.99,2020-10-02 00:00:00
Fujifilm FinePix A Series A360 4.1MP Digital Camera - Silver,30.89,2020-10-05 00:00:00
Fujifilm Finepix AX655 16 Mega Pixels HD Movie Optical Zoom,17.4,2020-10-06 00:00:00
Fujifilm FinePix A Series AX560 16.0 MP Megapixel Digital Camera Tested - Works,34.87,2020-10-07 00:00:00
Fujifilm FinePix AX-300 14 MP HD Digital Camera - Black ,29.95,2020-10-08 00:00:00
Fujifilm FinePix A Series AX550 16.0MP Camera - Black 074101016963 new sealed,65.0,2020-10-08 00:00:00
Fujifilm FinePix A Series AX560 16.0 MP Megapixel Digital Camera Tested - Works,34.87,2020-10-08 00:00:00
Fujifilm FinePix A Series A340 4.0MP Digital Camera - Silver Deluxe Cradle Kit,77.5,2020-10-10 00:00:00
Fujifilm Finepix AX655 digital camera 16 MP HD ,29.31,2020-10-10 00:00:00
Fujifilm FinePix A Series A360 4.1MP Digital Camera - BLUE Tripod Charger Case,18.98,2020-10-10 00:00:00
Fujifilm FinePix A Series A210 3.2MP Digital Camera - Silver,10.79,2020-10-12 00:00:00
Fuji Finepix S1000fd 10 MP Digital Camera 12X Optical Zoom w/ Manual ,33.9,2020-10-13 00:00:00
Fujifilm Finepix  A Series A500 5.1-MP Point & Shoot Digital Camera Excellent,39.99,2020-10-14 00:00:00
Fujifilm FinePix A Series A500 5.1MP Digital Camera - Silver,39.8,2020-10-15 00:00:00
Fujifilm FinePix A Series A805 8.3MP Digital Camera - Blue *Good/tested*,18.99,2020-10-16 00:00:00
Fujifilm FinePix A Series A340 4.0MP Digital Camera - Silver ~ VERY NICE CAMERA,10.0,2020-10-17 00:00:00
FujiFilm FinePix A600 Camera w/ Memory Card & Hard Case 6.3 Mega Pixels Mint,18.0,2020-10-17 00:00:00
Fuji Finepix S1000fd 10 MP Digital Camera 12X Optical Zoom w/ Manual ,33.9,2020-10-17 00:00:00
Fujifilm FinePix A Series AX560 16.0MP Digital Camera - Black ,22.49,2020-10-18 00:00:00
NEW Sealed - Fujifilm FinePix A Series AX550 16.0MP Camera - Black 074101016963,74.99,2020-10-18 00:00:00
Fujifilm FinePix A Series A360 4.1MP Digital Camera Silver/Blue US Seller Tested,18.2,2020-10-19 00:00:00
"Fujifilm FinePix A Series A820 Digital Camera 8.3MP 2.5"" Silver~~MINT~~Bundle~~",34.87,2020-10-20 00:00:00
"Fujifilm FinePix A Series A850 8.1MP Digital Camera, case, SD card, booklet, cds",48.7,2020-10-20 00:00:00
Fujifilm FinePix A Series AX550 16.0MP Camera - Black 074101016963 new sealed,113.09,2020-10-21 00:00:00
Fujifilm FinePix A Series AX560 16.0MP Digital Camera - Black,64.59,2020-10-22 00:00:00
NEW in Box - Fujifilm Finepix AX560 16M Camera - BLACK - 074101015737,82.49,2020-10-22 00:00:00
Fujifilm FinePix A Series A500 5.1MP Digital Camera - Silver Tested/Works,15.95,2020-10-23 00:00:00
Fujifilm FinePix  A Series A360 4.1 MP Digital Camera ,14.59,2020-10-23 00:00:00
FUJIFILM Finepix A820 Digital Camera Tested box manual cord fuji film silver ,40.9,2020-10-24 00:00:00
Fujifilm FinePix A Series AX550 16.0MP Digital Camera w/Fuji Case EX,16.0,2020-10-24 00:00:00
Vintage Fujifilm FinePix A Series A101 1.3MP Digital Camera *TESTED WORKING*,20.72,2020-10-24 00:00:00
CAMERA  Fujifilm 3.2 mega pixels FinePix  MODEL # A210 with carry case and box,26.32,2020-10-25 00:00:00
Fujifilm FinePix A Series AX560 16.0MP Digital Camera Black Tested and Working ,25.23,2020-10-29 00:00:00
Fujifilm Finepix AX660 Digital Camera F FX-AX660B-US C,54.0,2020-10-31 00:00:00
Fujifilm FinePix A Series AX560 16.0MP Digital Camera - Black,19.99,2020-10-31 00:00:00
"FUJI AX650 Fine pix 16 MP 5x Zoom HD Movie 2.7"" LCD",19.99,2020-11-01 00:00:00
Fuji Film FinePix A 600   (USED),14.99,2020-11-02 00:00:00
Fujifilm FinePix A Series A330 3.2MP Digital Camera - Silver,11.65,2020-11-02 00:00:00
Fujifilm FinePix A Series AX550 16.0MP Digital Camera 5X Optical Case SD Card ,27.95,2020-11-04 00:00:00
Fujifilm FinePix A Series A201 2.0MP Digital Camera Great Condition Hardly Used,22.4,2020-11-05 00:00:00
Fujifilm FinePix A Series A500 5.1MP Digital Camera - Silver,24.99,2020-11-06 00:00:00
