title,price,date
Fujifilm X-T30 26.1MP Mirrorless Camera - Black (Body Only),703.15,2020-08-14 00:00:00
FUJIFILM Fuji X100F Digital Camera Black shutter count 1300 shots ,719.0,2020-08-12 00:00:00
Fujifilm X-T30 26.1MP Mirrorless Camera - Black (with 15-45mm Lens) MINT PLUS,762.0,2020-08-12 00:00:00
FujiFilm FinePix XP50 Underwater Camera Orange,34.6,2020-08-12 00:00:00
Fujifilm Finepix S1800 Camera 18x zoom 12.2MP 3.0 LCD Serial #2208,24.9,2020-08-12 00:00:00
FUJIFILM Fuji X100F Digital Camera Black shutter count 1300 shots ,719.0,2020-08-11 00:00:00
Fujifilm FinePix X Series XP70 16.4MP Digital Camera - Yellow FOR PARTS ONLY,29.9,2020-08-10 00:00:00
Fujifilm X-T30 26.1MP Mirrorless Camera - Silver (Body Only),611.75,2020-08-09 00:00:00
"Fuji X30 Digital 12MP Camera - 4X Zoom, f2.0-2.8 lens, classic retro style",270.57,2020-08-09 00:00:00
Fujifilm FinePix S2550HD 12.2mp 18x High Definition DIGITAL CAMERA Black,22.89,2020-08-09 00:00:00
Fuji Fujifilm FinePix X Series XP70 16.4MP Digital Camera w/5x Zoom Yellow  #357,45.0,2020-08-08 00:00:00
FUJIFILM Fuji X30 Black Excellent Condition,328.25,2020-08-07 00:00:00
Fujifilm X-T30 Mirrorless Camera Silver (Body Only) Original Fujifilm Packaging.,623.99,2020-08-06 00:00:00
Fujifilm X-T30 26.1MP Mirrorless Camera - Charcoal Silver (with 18-55mm Lens),1010.0,2020-08-04 00:00:00
Fujifilm FinePix X100 12.3MP Mirrorless Digital Camera - Silver w/ accessories,359.9,2020-08-03 00:00:00
Fujifilm X-E3 With 25mm F1.8 Lens,455.0,2020-08-02 00:00:00
"Fuji XF10 body, black boxed c/w UK & European charger - Ricoh GR style for less!",391.96,2020-08-02 00:00:00
Fujifilm X-T30 26.1MP Mirrorless Camera - Black with 35mm f1.4 lens and handgrip,765.0,2020-08-01 00:00:00
Fujifilm X-T30 Mirrorless Camera - Black (+ 15-45mm Lens) + Grip + Audio Cable,769.99,2020-08-01 00:00:00
FUJIFILM X70 Black Color Ex++ Condition W Original Packaging,566.9,2020-07-31 00:00:00
FujiFilm Finepix S8200 S Series Digital Camera 40X 16m Strap Bag USB WORKS,154.37,2020-07-29 00:00:00
FujiFilm FinePix XP50 Underwater Camera Orange,34.6,2020-07-28 00:00:00
Fujifilm Finepix XP120  Yellow Underwater Camera - In Box and Never Used!,60.0,2020-07-27 00:00:00
Fujifilm Fuji X-T10 16.3MP Mirrorless Digital Camera Silver Body Only,164.2,2020-07-26 00:00:00
Fujifilm FinePix S Series S8630 16.0mp 36x 24-900 DIGITL CAMERA - Black - 449,41.0,2020-07-25 00:00:00
Fujifilm X-T30 26.1MP Mirrorless Camera - Silver (Body Only) *with metal grip*,628.85,2020-07-24 00:00:00
Fujifilm FinePix X Series XP200 16.4MP Digital Camera ,65.0,2020-07-22 00:00:00
Fujifilm X-T30 26.1MP Mirrorless Camera - Charcoal Silver (with 18-55mm Lens),1019.0,2020-07-21 00:00:00
Fujifilm FinePix X Series XP50 14.4MP Digital Camera - Green,17.0,2020-07-20 00:00:00
"FUJIFILM Fuji X70 Silver W/ Leather Grip, 2 Extra Batteries & Hood. Missing Box",470.0,2020-07-19 00:00:00
Fujifilm FinePix X Series X100 12.3MP Digital Camera - Silver - Great Condition,306.9,2020-07-16 00:00:00
Fujifilm X-A3 Mirrorless Digital Camera 24.2 MP (body only),151.85,2020-07-15 00:00:00
Fujifilm FinePix X Series X100 12.3MP Digital Camera - Silver,270.0,2020-07-15 00:00:00
Fujifilm XSeries X-T2 24.3MP Mirrorless UltraHD Digital Camera4K 18-55mm OISLens,611.75,2020-07-14 00:00:00
Fujifilm FinePix X100,272.0,2020-07-14 00:00:00
Fujifilm FinePix X Series XP70 16.4MP Digital Camera - Yellow,27.94,2020-07-13 00:00:00
"FUJIFILM Fuji X100T Black - shutter count 15,100",431.45,2020-07-12 00:00:00
Fujifilm x100t 16.3mp Camera w/23mm f2 lens & Extra Batteries | USA,529.0,2020-07-12 00:00:00
Fujifilm FinePix X Series XP10 / XP11 12.2MP Digital Camera - Green,11.0,2020-07-10 00:00:00
Fujifilm X20 12 MP Digital SLR Camera - Black (Body + Charger + SanDisk 64gb),301.5,2020-07-10 00:00:00
Fujifilm X-T30 26.1MP Mirrorless Camera - Silver (with 15-45mm Lens),780.0,2020-07-08 00:00:00
Fujifilm X-A3 Mirrorless Digital Camera 24.2 MP (body only),170.8,2020-07-08 00:00:00
Fujifilm FinePix X Series XP70 16.4MP Digital Camera - Yellow,41.9,2020-07-06 00:00:00
"Fuji X100t works GREAT w/ memory card, strap & 2x batteries *no reserve*",418.9,2020-07-05 00:00:00
Fujifilm FinePix X Series X100 12.3MP Digital Camera - Silver No battery/charger,320.8,2020-07-05 00:00:00
Fujifilm FinePix X Series X100 12.3MP Digital Camera - Silver,314.4,2020-07-05 00:00:00
Fujifilm FinePix X Series XP10 12.2MP Digital Camera - Blue,15.49,2020-07-01 00:00:00
Fujifilm X-T30 26.1MP Mirrorless Camera - Charcoal Silver (with 15-45mm Lens),805.0,2020-06-30 00:00:00
Underwater Fujifilm FinePix X Series XP70 16.4MP Digital Camera - Blue,66.9,2020-06-29 00:00:00
"Fujifilm XP20 Blue 14.2 MP Digital Camera WATER, SHOCK, FREEZE PROOF ",26.9,2020-06-28 00:00:00
Fujifilm FinePix X Series XP70 16.4MP Digital Camera - Yellow,24.0,2020-06-28 00:00:00
Fujifilm X100 Pro  Black Digital Fuji Camera xtra batts strap new charger,344.99,2020-06-27 00:00:00
Fujifilm X-T30 26.1MP Mirrorless Camera - Silver (Body Only),714.94,2020-06-25 00:00:00
FUJIFILM Fuji X100F Digital Camera Black shutter count 6100 shots W/ Box Charger,684.9,2020-06-25 00:00:00
Fujifilm FinePix X Series X100 12.3MP Digital Camera and Canon 430EX II Flash,326.7,2020-06-24 00:00:00
"Fuji Fujifilm FinePix X100 12.3MP Digital Camera w/23mm f2 Lens, Hood, Strap",338.64,2020-06-23 00:00:00
"Fujifilm X-T30, mirrorless camera, silver - body only with accessories ",635.0,2020-06-21 00:00:00
Fujifilm X-T30 26.1MP Mirrorless Camera - Silver (with 35mm Lens & extras!),781.55,2020-06-20 00:00:00
Fujifilm X-T30 26.1MP Mirrorless Camera - Silver (with 18-55mm Lens) and more,1025.9,2020-06-20 00:00:00
FUJIFILM X-T100 Mirrorless Digital Camera (Body Only),232.5,2020-06-19 00:00:00
Fujifilm X100 Camera,409.9,2020-06-16 00:00:00
Fujifilm X-T30 26.1MP Mirrorless Camera - Silver (Body Only) unopened in box ,684.9,2020-06-16 00:00:00
"FujiFilm Finepix S1800 Digital Camera, ",40.0,2020-06-16 00:00:00
"Fujifilm FinePix  X100 Limited Edition Black 12.3MP, lightly used with battery ",325.0,2020-06-15 00:00:00
FUJIFILM Fuji X100T Silver [Shutter count 5200],505.99,2020-06-14 00:00:00
Fujifilm FinePix X Series XP200 16.4MP Digital Camera - Black,65.0,2020-06-13 00:00:00
Fuji Fujifilm X-T10 16.3MP Camera w/ 50mm Lens +64GB SD Card+extra Battery,256.6,2020-06-13 00:00:00
Fujifilm Finepix XP20 Digital Camera - water proof  14.2 MP,22.25,2020-06-13 00:00:00
Fuji FUJIFILM XF1 XF-1 Digital Camera Spares / Repair Parts v. good cosmetic ,56.31,2020-06-10 00:00:00
Gently Used Fujifilm X-T30 26.1MP XT30 Mirrorless Digital camera. Perfect shape!,654.0,2020-06-10 00:00:00
Fujifilm FinePix X Series XP100 14.4MP Digital Camera Blue needs battery,10.1,2020-06-09 00:00:00
"Fujifilm FinePix  X100 Limited Edition Black 12.3MP, lightly used with battery ",320.0,2020-06-08 00:00:00
Fujifilm X-T30 26.1MP Mirrorless Camera - Black (Body Only),683.15,2020-06-08 00:00:00
"Fujifilm FinePix X Series XP10 12.2MP Digital Camera - Black, Charger, Case",19.99,2020-06-08 00:00:00
Fujifilm FinePix X Series XP70 16.4MP Digital Camera - Yellow (GREAT CONDITION),31.5,2020-06-02 00:00:00
Fujifilm X100 12.3MP Digital Camera (Japan Made) + 32 GB Transcend  SD Card,273.0,2020-05-31 00:00:00
Fujifilm X-S1 - 12MP -  26 x Zoom - digital Camera - Faulty - ,57.66,2020-05-31 00:00:00
Fujifilm FinePix X Series X100 12.3MP Digital Camera - Silver,307.8,2020-05-29 00:00:00
Fujifilm X-T30 26.1MP Mirrorless Camera - Silver With 27mm lens and extras,883.15,2020-05-28 00:00:00
[Exc Condition] Fuji Fujifilm X-T10 16.3MP Camera w/ Fuji 35mm WR Lens + Extras,392.8,2020-05-28 00:00:00
Fujifilm FinePix X Series X100 12.3MP Digital Camera - Silver,230.05,2020-05-27 00:00:00
Fujifilm X-T2 24.3MP Digital Camera (Body Only)  with flash and extra battery,550.0,2020-05-25 00:00:00
Fujifilm Charcoal Fuji X-T30 26.1MP Mirrorless Digital Camera Body with Extras!,818.14,2020-05-25 00:00:00
Fujifilm Fuji X100T Black - 400 Shutter Count w/ Extras,571.1,2020-05-24 00:00:00
Fujifilm FinePix X Series X100 12.3MP Digital Camera - Silver,304.0,2020-05-23 00:00:00
Fujifilm X-T2 24.3MP Digital Camera (Body Only) w/ 5 Batteries + L-Bracket,549.29,2020-05-22 00:00:00
Fujifilm X-T30 26.1MP Mirrorless Camera - Silver (Body Only With Extras),624.9,2020-05-21 00:00:00
Fujifilm FinePix X Series XP10 Digital Camera - Blue,20.9,2020-05-17 00:00:00
"Fujifilm X-T30 - Silver - With Box and Extras (leather case, thumb grip, straps)",555.05,2020-05-17 00:00:00
Fujifilm Charcoal Fuji X-T30 26.1MP Mirrorless Digital Camera Body with Extras!,738.14,2020-05-17 00:00:00
