title,price,date
Fujifilm X100T 16 MP Digital Camera - Black,470.0,2020-08-11 00:00:00
Fujifilm X Series X100T 16.3MP Digital Camera - Silver,580.05,2020-08-15 00:00:00
"Fujifilm X100T fuji Camera  Black Used w/ uv filter 20,000 shutter count",605.9,2020-08-15 00:00:00
Fujifilm X100T Compact Digital Camera Silver Body from Japan,699.89,2020-08-16 00:00:00
Fujifilm X100T Digital Camera - Silver,599.0,2020-08-19 00:00:00
Fujifilm X100T 16.3MP Digital Camera Excellent,513.25,2020-08-19 00:00:00
"FujiFilm Real3DW3 3.5"" 10MP 3D Digital Camera In Box",279.99,2020-08-20 00:00:00
Fujifilm X100T 16.3MP Digital Camera Full HD Wi-Fi Silver,899.95,2020-08-28 00:00:00
"Fujifilm X100T Digital Camera, Black {16.3 M/P} with Battery & Charger - EX",568.56,2020-08-28 00:00:00
Fuji Fujifilm X100T 16.3MP Digital Camera w/23mm f2                         #563,599.0,2020-09-05 00:00:00
Silver Fujifilm X100T 16MP Fuji X XTrans Digital Rangefinder Camera- In Box,559.0,2020-09-05 00:00:00
FUJIFILM Fuji X100T Black Shutter Count 20000 shots,546.0,2020-09-10 00:00:00
"Fujifilm Fuji X100T BLACK w/Case, lens hood, thumb+ more 7300 Shutter count",610.0,2020-09-12 00:00:00
Fujifilm X100T black Color Excellent ++ Condition W/extras,599.9,2020-09-13 00:00:00
Fujifilm X Series X100T 16.3MP Digital Camera - Silver Fuji W/ Nissin i400 flash,449.99,2020-09-17 00:00:00
Beautiful Fujifilm X100T Black 7900 Shutter Count + Many Bonus Accessories ,565.0,2020-09-17 00:00:00
Fujifilm X Series X100T Digital Camera - Silver - plus LC-X100F Leather Case A2,751.95,2020-09-22 00:00:00
"READ: replaced screen Fujifilm X100T Camera - Silver. Low Shutter 7500, extras",404.95,2020-09-28 00:00:00
Fujifilm X Series X100T 16.3MP Digital Camera - Silver,625.0,2020-10-06 00:00:00
Fuji Fujifilm X100T 16.3MP Digital Camera w/23mm f2 #781,670.95,2020-10-07 00:00:00
++ MAKE OFFER  ++ Fujifilm X Series X100T 16.3MP Digital Camera - Black,400.91,2020-10-12 00:00:00
Fujifilm X100T Compact Digital Camera Silver Body Excellent Condition from Japan,569.99,2020-10-19 00:00:00
Fujifilm Fuji X100T - Black FOR PARTS OR REPAIR ONLY! FREE SHIPPING! ,299.99,2020-10-20 00:00:00
Fujifilm X Series X100T 16.3MP Digital Camera - Silver,565.0,2020-10-23 00:00:00
FUJI X100T Black + 2 Batteries/charger/leather Case 5200 SHOTS. Great Condition,575.0,2020-10-24 00:00:00
Fujifilm X100T - Black with extra ECL-100 wide angle conversion lens & accessory,615.0,2020-10-26 00:00:00
FUJIFILM Fuji X100T Black shutter count 11900 shots,672.0,2020-11-03 00:00:00
Fujifilm X Series X100T 16.3MP Digital Camera - Silver,459.69,2020-11-05 00:00:00
