title,price,date
DRAMA-Gone With The Wind (US IMPORT) Blu-Ray NEW,15.48,2020-08-11 00:00:00
Gone With The Wind 3-Disc 70th Anniversary Limited Edition Box Blu-ray+DVD+CD ,79.99,2020-08-11 00:00:00
"NEW Hawthorne Sculpture Gone With the Wind ""Hope...For a New Tomorrow IOB w COA",67.0,2020-08-11 00:00:00
Hawthorne Village Gone With The Wind “Tara… Scarlett’s Pride” Retired 1994 COA,66.0,2020-08-11 00:00:00
"Beautiful ""Scarlett O'Hara  Barbie Doll ""Gone With The Wind"" 1994",22.99,2020-08-11 00:00:00
Kurt Adler Komozja Glass Ornament - Gone With the Wind  Rhett Butler,75.99,2020-08-11 00:00:00
"1996 Hallmark QXM4211 ""Gone with the Wind"" Ornament",74.99,2020-08-11 00:00:00
San Francisco Music Box - Gone With The Wind - Rhett Butler Figurine ,54.99,2020-08-11 00:00:00
Gone with the Wind Signed Film Script X15 Vivien Leigh Clark Gable Keyes Jory RP,51.99,2020-08-11 00:00:00
Rhett & Scarlett O'Hara Gone with the Wind metal street sign,29.9,2020-08-11 00:00:00
DRAMA-Gone With The Wind Blu-Ray NEW,17.34,2020-08-11 00:00:00
GONE WITH the WIND by Margaret Mitchell June 1936 2nd Printing HC & DJ Fragment,138.95,2020-08-11 00:00:00
Barbie Loves Tweety  Barbie Doll Warner Bros. 1998 Studio Store  #21632 ,71.5,2020-08-11 00:00:00
Gone With The Wind Margaret Mitchell hardcover MACMAILLAN COMPANY New York 1937,57.99,2020-08-11 00:00:00
Rhett Forrester ‎– Gone With The Wind CD RIOT-member,13.0,2020-08-11 00:00:00
"Shelia's Collectibles - Home of Ashley Wilkes - Gone with the Wind Series, GWW08",53.5,2020-08-11 00:00:00
Gone With the Wind [70th Anniversary Edition],41.74,2020-08-11 00:00:00
Gone With the Wind [70th Anniversary Edition],42.0,2020-08-11 00:00:00
Gone With The Wind Collector's Edition DVD 2004 sealed,19.99,2020-08-11 00:00:00
"Gone With the Wind (Blu-ray Disc, 2010, 70th Anniversary Edition)",12.99,2020-08-11 00:00:00
"Gone With the Wind (DVD, 2009, 2-Disc Set, 70th Anniversary Edition)",45.49,2020-08-11 00:00:00
Vintage  Gone With the Wind  December 1936 Numbered Edition ,73.0,2020-08-11 00:00:00
MATTEL 1994 SCARLETT O'HARA Hollywood Legends Barbie Doll Red Velvet Gown IN BOX,100.55,2020-08-11 00:00:00
1940's Gone With The Wind By Margaret Mitchell Complete Red Hardback,12.0,2020-08-11 00:00:00
GONE WITH THE WIND Rhett Butler Clark Gable Timeless Treasures Barbie Ken Doll,142.24,2020-08-11 00:00:00
SCARLET O'HARA DOLL [GONE WITH THE WIND] FRANKLIN HEIRLOOM DOLLS,71.5,2020-08-11 00:00:00
GONE WITH THE WIND 1964 Book Club Edition by Margaret Mitchell HC/DJ  (NoDust),43.99,2020-08-11 00:00:00
Shelias 1995 Gone With the Wind Twelve Oaks Wilkes Plantation #GWW02 A1P2,7.15,2020-08-11 00:00:00
NIB Barbie as Scarlett O'Hara Gone with the Wind Doll Hollywood Legends #13254,83.0,2020-08-11 00:00:00
"GONE WITH THE WIND Margaret Mitchell  December Edition ,1936. HC.",117.95,2020-08-11 00:00:00
Gone With The Wind Pork Miniature Figurine Dave Grossman Cameo Studio No Box,57.99,2020-08-11 00:00:00
1994 Gone With the Wind Red Birthday Party Dress Barbie as Scarlett O'Hara  NRFB,83.99,2020-08-11 00:00:00
"Scarlett: The Sequel to Margaret Mitchell's Gone With the Wind, Alexandra Ripley",9.99,2020-08-11 00:00:00
Gone With the Wind Blu-ray 70th Anniversary Edition NEW SEALED ,51.99,2020-08-11 00:00:00
Ken as Rhett 1994 Barbie Doll,71.99,2020-08-11 00:00:00
Gone with the Wind (DVD Video),22.89,2020-08-11 00:00:00
Scarlett-green 1994 Barbie Doll,18.0,2020-08-11 00:00:00
GONE WITH THE WIND - LIMITED EDITION BLU-RAY STEELBOOK - CANADIAN EXCLUSIVE NEW!,69.99,2020-08-11 00:00:00
2005 HALLMARK GONE WITH THE WIND ORNAMENT SCARLETT O'HARA WHITE BLACK DRESS NIB,67.92,2020-08-11 00:00:00
2008 Hallmark Scarlett O'Hara Gone With the Wind Porcelain Christmas Ornament,57.0,2020-08-11 00:00:00
Vintage Gone With The Wind Hurricane Table Lamp Ivy Leaf Painted Milk Glass,81.95,2020-08-11 00:00:00
Gone With The Wind Blu-Ray 70th Anniversary Brand New & Factory Sealed,46.9,2020-08-11 00:00:00
GONE WITH THE WIND SOUNDTRACK OST SEALED STEREO VINYL LP WB 1322 GWTW,53.99,2020-08-11 00:00:00
RARE LARGE VINTAGE FLORAL HURRICANE LAMP Gone With The Wind  LAMP,250.0,2020-08-11 00:00:00
 Barbie Scarlett O' Hara gone with the wind barbie doll mattel 1994,73.99,2020-08-11 00:00:00
"Gone with the Wind, Paperback by Mitchell, Margaret; Conroy, Pat (FRW), Brand...",30.5,2020-08-11 00:00:00
1989 World Doll Gone With the Wind Melanie & Ashley Pre-owned with Boxes,38.0,2020-08-11 00:00:00
"Andersonville & Gone With The Wind (DVD, 2003, 2-Disc Set) NEW Sealed",22.0,2020-08-11 00:00:00
CHARLES GERHARDT & NPO - GONE WITH THE WIND - CLASSIC FILM SCORE 🎼💿,2.63,2020-08-11 00:00:00
1936 Gone With The Wind Book Margaret Mitchell Hardcover,68.0,2020-08-11 00:00:00
"Vintage  Gone With The Wind Lamp Soft and Elegang 15"" x 9"" x 9"" desk/table lamp",119.99,2020-08-11 00:00:00
"Gone With the Wind (DVD, 2009, 2-Disc Set, 70th Anniversary Edition)",61.78,2020-08-11 00:00:00
Gone With the Wind the Music the Music Box & Gift Co,128.99,2020-08-11 00:00:00
"Hallmark Keepsake Ornament ""Rhett Butler"" Gone With The Wind Handcrafted 2000",45.8,2020-08-11 00:00:00
"SIGNED PHOTO THE LATE ANN RUTHERFORD FROM 1939 CLASSIC ""GONE WITH THE WIND"" COA",33.0,2020-08-11 00:00:00
DVD Disc - GONE WITH THE WIND - ,10.91,2020-08-11 00:00:00
"(4) ""Gone With The Wind"" Color Heavy Stock Photographs 11"" x 14"" #2",45.49,2020-08-11 00:00:00
2x VHS Movie Classics (Tapes Sealed) Cassablanca (SE) and Gone with the Wind ,49.69,2020-08-11 00:00:00
"Pictorial History of Gone with the Wind,Gardner,Gable,De Havilland,Leigh,Yankee",8.0,2020-08-11 00:00:00
GLORIA JONES  GONE WITH THE WIND IS MY LOVE / TIARAS LOVE'S MADE A CONNECTION RI,25.62,2020-08-12 00:00:00
Margaret Mitchell GONE WITH THE WIND International Collectors Library (1964),67.99,2020-08-12 00:00:00
"Gone with the Wind [Four-Disc Collector's Edition] ~ BUY 2, GET 1 FREE",41.29,2020-08-12 00:00:00
HOLLYWOOD LEGENDS Gone With The Wind 1994 BARBIE Doll Set Of 3 Scarlett O’Hara ,141.91,2020-08-12 00:00:00
Gone With the Wind-CD-ORIGINAL MGM Soundtrack 1990,23.24,2020-08-12 00:00:00
Thomas Kinkade Gone With The Wind 18x27 Artist Proof Limited Edition Lithograph,346.0,2020-08-12 00:00:00
1994 Barbie Doll Hollywood Legends Collection Ken as Rhett Butler No. 12741,87.94,2020-08-12 00:00:00
1994~ Barbie as Scarlett O'Hara ~ Hollywood Legends ☆ Gone with the Wind ☆12815,19.95,2020-08-12 00:00:00
Gone with the Wind Barbie-Scarlett O'Hara Peachtree Street the Drapery Dress,178.0,2020-08-12 00:00:00
GONE WITH THE WIND Collector Plate By Howard Roger SCARLETT AND HER SUITORS 1988,7.0,2020-08-12 00:00:00
"GONE WITH THE WIND DVD 2 disc 1939 CLARK GABLE, VIVIEN LEIGH, HATTIE McDANIEL ",44.0,2020-08-12 00:00:00
"San Francisco Music Box Co GONE WITH THE WIND, Scarlett At Tara",119.0,2020-08-12 00:00:00
GONE WITH THE WIND Mr. O'Hara FIGURINE FRANKLIN MINT Painted Resin 1990,55.21,2020-08-12 00:00:00
"Vintage Table Lamps PAIR Hurricane or Gone with the Wind Blue Pink Flowers 18"" T",211.99,2020-08-12 00:00:00
"GONE WITH THE WIND Dave Grossman Figurine MRS.ELLEN O'HARA Cast Marble 8"" SALE",70.0,2020-08-12 00:00:00
Gone With the Wind DVD 2009  2-Disc Set 70th Anniversary Edition New sealed,8.99,2020-08-12 00:00:00
"The Dave Brubeck Quartet Gone With The Wind LP Never Played XSM 47119-2CE,XSM 47",111.0,2020-08-12 00:00:00
Gone With The Wind Scarlett O'Hara Barbie Collector 75th Anniversary ,125.0,2020-08-12 00:00:00
Vintage 1st Printing 1967 The Story Of Gone With The Wind Movie Behind Scenes,40.99,2020-08-12 00:00:00
TV GUIDE-12/2000-GONE WITH THE WIND-CLARK GABLE-VIVIEN LEIGH-OLIVIA DE HAVILLAND,17.99,2020-08-12 00:00:00
"Gone With the Wind (DVD, 2010, 5-Disc Set, The Scarlett Edition) Brand New",100.99,2020-08-12 00:00:00
"Gone with the Wind, Marry me Scarlett Plate w/ Wooden Frame Clark Gable & Vivian",59.0,2020-08-12 00:00:00
"GONE WITH THE WIND ,THE END OF AN ERA ",50.59,2020-08-12 00:00:00
Gone with the Wind by Margaret Mitchell (75th Anniversary Edition),16.0,2020-08-12 00:00:00
Last Chance 2 Buy!! Success Pittsburgh Gone With The Wind Lamp Unelectrified,199.0,2020-08-12 00:00:00
Plate Collector's W S George 1990 Gone with the Wind Toast to Bonnie Blue Rhett,57.99,2020-08-12 00:00:00
Gone With The Wind Scarlett O'hara & Rhett Clark Gable By Dolls of the World ,89.0,2020-08-12 00:00:00
"Gone With The Wind, Scarlet O’Hara, By World Doll, NRFB",49.99,2020-08-12 00:00:00
Hallmark Keepsake Gone With the Wind 60th Anniversary Ornaments 3 Pc Set 1996,24.0,2020-08-12 00:00:00
"Lynyrd Skynyrd - Gone With The Wind, New DVDs",27.85,2020-08-12 00:00:00
KEN DOLL Gone With The Wind  Rhett Butler 1994 ,73.99,2020-08-12 00:00:00
"Gone With the Wind by Margaret Mitchell 1964, Paperback 10th Printing (Vintage)",49.0,2020-08-12 00:00:00
GONE WITH THE WIND Georgia Quarter & JFK Half Dollar US 2-Coin Set * LICENSED *,22.9,2020-08-12 00:00:00
75TH ANNIVERSARY GONE WITH THE WIND SCARLETT O'HARA DOLL WHITE RUFFLE 877,140.95,2020-08-12 00:00:00
Rare DOULTON Classic Movies Figure - SCARLETT O'HARA Gone with the Wind HN4200,319.34,2020-08-12 00:00:00
PRICE REDUCED! PREMIUM Gone With the Wind Scarlett O'Hara Green Dress Costume,193.2,2020-08-12 00:00:00
Scarlett - Sequel to Margaret Mitchell's Gone with the Wind by Alexandra Ripley,9.95,2020-08-12 00:00:00
2019 Hallmark Keepsake Gone With The Wind One Door Closes Magic Ornament New!,52.99,2020-08-12 00:00:00
TONNER HEARTBROKEN SCARLETT VIVIEN LEIGH GWTW GONE WITH THE WIND DOLL NRFB,493.99,2020-08-12 00:00:00
"Gone With the Wind Fabric, Fat Quarter, Scarlett & Rhett. Realistic Picture RARE",19.0,2020-08-12 00:00:00
"Gone With The Wind, Scarlett O'Hara On Peachtree Street- 2001 Barbie Doll",85.0,2020-08-12 00:00:00
"Fenton White Satin Pink Inside Puff Rose Gone with the Wind Lamp 16.5"" Tall ",672.5,2020-08-12 00:00:00
Gone with the Wind DUST JACKET ONLY ,52.0,2020-08-12 00:00:00
1994~ Barbie as Scarlett O'Hara ~ Hollywood Legends ☆ Gone with the Wind ☆12045,71.69,2020-08-12 00:00:00
"Bradford Exchange ""Gone With The Wind"" New Set Of 10 Porcelain Figurines  ",392.25,2020-08-12 00:00:00
"Gone with the Wind Scarlett O'Hara 12"" World Doll Vintage 1995 Doll",60.0,2020-08-12 00:00:00
"GONE WITH THE WIND BOOK CLUB EDITION, 1964 edition.",58.75,2020-08-12 00:00:00
San Francisco Music Box Company Gone With The Wind Scarlett Red Dress ,80.99,2020-08-12 00:00:00
Scarlett at Twelve Oaks Music Box Gone with the Wind Collection #2173E Tara’s,59.99,2020-08-12 00:00:00
Gone With the Wind Collector's Edition DVD 2004 4-Disc Set +Souvenir Booklet OOP,56.99,2020-08-13 00:00:00
RELEASE OF GONE WITH THE WIND EVENTS OF THE 20th CENTURY STAMP SHEETLET,4.46,2020-08-13 00:00:00
"Gone With The Wind 1st EDITION December 1936 Printing HC, Margaret Mitchell",75.0,2020-08-13 00:00:00
Tonner Scarlett Christmas In Atlanta Dress ,149.0,2020-08-13 00:00:00
GONE WITH THE WIND Barbie Hollywood Legends Collection Scarlett Rhett EXTRAS NIB,253.99,2020-08-13 00:00:00
Scarlett Ohara 1994 Barbie Doll,72.67,2020-08-13 00:00:00
Barbie as Scarlett O’Hara - Hollywood Legends Collection,76.5,2020-08-13 00:00:00
MATTEL Hollywood Legends Collection Barbie As Scarlett O' Hara Barbie Doll,76.0,2020-08-13 00:00:00
GORGEOUS HAND PAINTED FLOWERS GONE WITH THE WIND LAMP,154.99,2020-08-13 00:00:00
Barbie Scarlett O'Hara Hollywood Legends Collection Dresses For BBQ NIB 1994,72.22,2020-08-13 00:00:00
Clark Gable Barbie Doll Gone With The Wind 1994 Ken As Rhett Butler Mattel 12741,81.33,2020-08-13 00:00:00
Hallmark Keepsake 2008 Scarlett O'Hara Gone With The Wind GWTW Ornament J008,33.99,2020-08-13 00:00:00
Mitchell M. Gone With The Wind. Macmillan 1936 (November),59.37,2020-08-13 00:00:00
HALLMARK Keepsake 2007 SCARLETT O'HARA AND RHETT BUTLER Gone With The Wind NIB,61.0,2020-08-13 00:00:00
TONNER  Scarlett Gone With The Wind Return to TARA  New In Box,648.74,2020-08-13 00:00:00
Gone with The Wind Atlanta setting a creation by Dave Grossman. It is a music bo,21.0,2020-08-13 00:00:00
Victorian old Brass Gone with the Wind Oil Lamp Connector Ring c1880,39.5,2020-08-15 00:00:00
ANTIQUE GLASS GONE WITH THE WIND LAMP ~ HANDPAINTED NOT ELECTRIFIED,380.0,2020-08-15 00:00:00
Gone With The Wind Limited Edition RHETT BUTLER by World Doll 1989,24.99,2020-08-15 00:00:00
"Rhett Beartler (Gone with the Wind) North American Bear VIB Blue Plush  21"" ",84.0,2020-08-15 00:00:00
GWTW GONE WITH THE WIND AUTHOR MARGARET MITCHELL 1986 ATLANTA PCS CACHET FDC,2.8,2020-08-15 00:00:00
"Hallmark Keepsake Orn, Gone With the Wind Series,""Scarlett O'Hara""-Revisits Tara",47.0,2020-08-15 00:00:00
Scarlett O'Hara in BBQ Dress 1995 Barbie Doll NIB,18.0,2020-08-15 00:00:00
GONE WITH THE WIND SCARLET WITH BLUE VELVET JACKET 1989,64.0,2020-08-15 00:00:00
"GONE WITH THE WIND MOVIE BOOK,1940-GREAT PHOTOS",66.39,2020-08-15 00:00:00
Butterfly McQueen Signed Letter Autograph Personal Letter Gone With The Wind,108.99,2020-08-15 00:00:00
"VTG Hurricane Gone With The Wind GWTW Light Parlor Lamp Double Globe PINK 15""",230.99,2020-08-15 00:00:00
Gone with the Wind Blu-ray,48.2,2020-08-16 00:00:00
"Scarlett O'Hara BBQ 16"" NUDE Doll Tonner NRFB BRAND NEW Gone With The Wind ",137.99,2020-08-16 00:00:00
"Seymour Mann Porcelain Doll Scarlett O'Hara ""Gone With The Wind"" Green Velvet LE",102.5,2020-08-16 00:00:00
"Gone With the Wind (DVD, 2000)",40.99,2020-08-16 00:00:00
1997 Hallmark Keepsake Gone With the Wind Scarlett O'Hara Red Dress Ornament,51.99,2020-08-16 00:00:00
VTG MILK GLASS W LG PINK YELLOW CABBAGE ROSES GONE W THE WIND GLOBE LAMP SHADE,188.0,2020-08-16 00:00:00
"Gone With the Wind (DVD, 2004, 4-Disc Set) RARE 4 DISC COLLECTORS EDITION ",9.0,2020-08-16 00:00:00
"Collectible Gone With the Wind Plate ""Scarlet's Heart is With Tara"" *NEW",47.99,2020-08-16 00:00:00
"Gone With the Wind Fabric, Fat Quarter, Scarlett & Rhett. Realistic Picture RARE",19.0,2020-08-16 00:00:00
Gone with the Wind [70th Anniversary Edition] [Blu-ray],42.99,2020-08-16 00:00:00
GONE WITH THE WIND-SIGNED-CAMMIE KING-8X10-BONNIE BLUE BUTLER-WITH CLARK GABLE,66.99,2020-08-16 00:00:00
"CLARK GABLE 8X10 Lab Photo 1939 ""GONE WITH THE WIND"" GWTW w/ Bonnie Blue Rare ",30.49,2020-08-16 00:00:00
O.S.P. Vintage Gone With The Wind Special Collectors Edition Print 1995,13.99,2020-08-16 00:00:00
(cc3j) Ruth's Journey Authorized Mammy Margaret Mitchell's Gone With The Wind,44.0,2020-08-16 00:00:00
Gone With the Wind Blu-ray 70th Anniversary Edition NEW SEALED ,15.98,2020-08-16 00:00:00
Gone with the wind blu-ray dvd Scarlett Edition Includes Slipcover F/Shipping***,74.0,2020-08-16 00:00:00
NEW without Box Gone With The Wind 20” Rhett Butler World Dolls NO BOX 1967,82.24,2020-08-16 00:00:00
HARRY PARRY : GONE WITH THE WIND : CD Album : Empress : RAJCD 840,6.95,2020-08-16 00:00:00
"Scarlett O'Hara Green Dress Barbie 1994, NRFB Mint w/LN box - 12045",72.22,2020-08-16 00:00:00
The Story of Gone With The Wind-1967 Movie Program-Full Color Souvenir Book,39.95,2020-08-16 00:00:00
Scarlett OHara Gone With The Wind Hallmark Christmas Ornament 2005 QXI6002,62.99,2020-08-16 00:00:00
"Film Classics Puzzles GONE WITH THE WIND  250 Piece Puzzle  12 1/4"" x 10 3/8""",54.95,2020-08-16 00:00:00
GONE WITH THE WIND -  Rhett Butler - Clark Gable 10 inch Figurine Music Box,100.99,2020-08-16 00:00:00
Gone With The Wind Blu Ray Warner Brothers Drama SEALED,49.99,2020-08-16 00:00:00
"Gone With the Wind (DVD, 1998, Digitally Re-Mastered)",10.0,2020-08-16 00:00:00
5 Franklin Mint Gone with the Wind Collector Eggs! Scarlett of Tara ETC! 127 ,100.49,2020-08-16 00:00:00
Scarlett OHara Rhett Butler Gone With The Wind Hallmark Christmas Ornament 2003,48.99,2020-08-16 00:00:00
Gone With The Wind by Margaret Mitchell Hardcover 1964,9.99,2020-08-16 00:00:00
"Gone With the Wind DVD, 2009, 2-Disc Set, 70th Anniversary Edition Sealed",44.0,2020-08-16 00:00:00
"Gone with the Wind Movie POSTER 27 x 40 Clark Gable, Vivien Leigh, A1",53.83,2020-08-16 00:00:00
Gone With the Wind by Margaret Mitchell 1961 Paperback Perma Book Vintage 6th Pr,59.0,2020-08-16 00:00:00
GONE WITH THE WIND GWTW 'AS GOD IS MY WITNESS' SCARLETT 2015 HALLMARK ORNAMENT ,46.71,2020-08-16 00:00:00
" Madame Alexander Vintage Doll 13"" Gone with the Wind Scarlet O'Hara 1590 mint",65.0,2020-08-16 00:00:00
"Gone With the Wind (Blu-ray Disc, 2010, 70th Anniversary Edition) Brand NEW",49.99,2020-08-16 00:00:00
"Gone With the Wind (DVD, 2009, 2-Disc Set, 70th Anniversary Edition) New Sealed!",44.36,2020-08-16 00:00:00
"GONE WITH THE WIND (DVD, 2000) Vivien Leigh Clark Gable SNAPCASE",39.99,2020-08-16 00:00:00
1990 Franklin Mint Gone with the Wind Figurine Ashley Wilkes W Booklet,20.0,2020-08-16 00:00:00
Gone With The Wind Blu-Ray NEW 70th Anniversary Edition Clark Gable Vivien Leigh,52.77,2020-08-16 00:00:00
Vintage Rare 1994 Hollywood Legends Barbie Scarlett O Hara,72.0,2020-08-16 00:00:00
"Gone With the Wind DVD, 2009, 2-Disc Set, 70th Anniversary Edition Sealed",43.65,2020-08-16 00:00:00
1989 The Franklin Mint Gone with the Wind Figurine Scarlett O-Hara Turner Ent.,42.49,2020-08-16 00:00:00
Vintage GONE WITH THE WIND Mitchell 1936 1st Edition 3rd Printing HC,72.75,2020-08-16 00:00:00
Original vintage movie posters,36.35,2020-08-16 00:00:00
Gone with the Wind Official Collector Plate Rack Holds set12 Wooden Inscribed ,103.99,2020-08-16 00:00:00
"Gone With the Wind (DVD, 1999)",40.8,2020-08-16 00:00:00
1992 Gone With The Wind Critic's Choice SCARLETT'S SHOPPING SPREE  Ltd Ed Plate,58.0,2020-08-16 00:00:00
Gone With the Wind (1 DVD) - Region 4 - Brand New - Free Postage,10.11,2020-08-16 00:00:00
Dave Brubeck Quartet ‎– Gone With The Wind LP Vinyl Record Jazz Orig 1959,46.99,2020-08-17 00:00:00
Gone With The Wind Collector Plate 1988 WS George A TOAST TO BONNIE BLUE,54.39,2020-08-17 00:00:00
"Ken As Rhett Butler / Clark Gable In The Movie ""Gone With The Wind"" NIB (1994)",76.66,2020-08-17 00:00:00
HALLMARK CHRISTMAS ORNAMENT - Gone With The Wind SCARLETT O'HARA 1998,27.98,2020-08-17 00:00:00
Gone With the Wind Mammy Lacing Scarlett Plate Kursar,40.5,2020-08-17 00:00:00
RARE OUTSTANDING PITTSBURGH PLB&G GONE WITH THE WIND SHADE GWTW BANQUET OIL LAMP,949.99,2020-08-17 00:00:00
Scarlett OHara Rhett Butler Gone With The Wind Hallmark Christmas Ornament 2004,55.99,2020-08-17 00:00:00
"GONE WITH THE WIND Japanese Souvenir Program 1976, Clark Gable, Vivien Leigh",12.5,2020-08-17 00:00:00
(1993) GONE WITH THE WIND TRIVIA CARD BOARD GAME~SCARLETT O'HARA~RHETT BUTLER~,53.99,2020-08-17 00:00:00
"Gone with the Wind (1939) - Clark Gable, Vivien Leigh - BLU-RAY DVD (Region All)",29.07,2020-08-17 00:00:00
Gone With The Wind MGM Cinema Classics 800 Piece Jigsaw Puzzle F.X Schmid 1989,62.0,2020-08-17 00:00:00
Gone with the Wind DVD - Brand New Sealed!,9.89,2020-08-17 00:00:00
Gone With The Wind Neck Tie Brittania Imported Polyet EUC,50.99,2020-08-17 00:00:00
"Antique PiTTSBURGH HURRICANE LAMP, Hand painted Flower Shade Brass Embossed Base",196.0,2020-08-17 00:00:00
Gone with the Wind - DVD,17.48,2020-08-17 00:00:00
Hallmark 2015 As God as My Witness Gone With the Wind Scarlett Magic Ornament ,71.84,2020-08-17 00:00:00
"Gone With the Wind (DVD, 2009, 2-Disc Set, 70th Anniversary Edition) ",15.0,2020-08-17 00:00:00
Vintage Gone with the Wind Plate WS George The Burning of Atlanta,8.79,2020-08-17 00:00:00
"NEW SEALED Gone with the Wind 75th Ann Edition 4-Disc Blu-ray, DVD & Digital HD ",78.99,2020-08-17 00:00:00
Butterfly McQueen Autograph Actress Prissy In Gone With The Wind Signed 8.5x11,83.88,2020-08-17 00:00:00
"GONE WITH THE WIND ANTIQUE BOOK 1ST EDITION AUGUST 1936 BY MITCHELL, CLASSIC",33.0,2020-08-17 00:00:00
Vintage Antique Gone With The Wind GWTW Autumn Brown Flowers Hurricane Lamp,99.99,2020-08-17 00:00:00
2016 Hallmark An Honorable Proposal-Gone With The Wind-Magic,55.99,2020-08-17 00:00:00
2019 Hallmark Keepsake Gone With The Wind One Door Closes Magic Ornament New!,51.99,2020-08-17 00:00:00
"Gone With The Wind by Margaret Mitchell (1964, Hardcover)",9.49,2020-08-17 00:00:00
Gone With the Wind 4 Disc DVD Box Set With Booklet Program VERY GOOD,54.99,2020-08-17 00:00:00
Hallmark Keepsake 2007 Scarlett and Rhett Gone with the Wind Sound & Wind up,67.95,2020-08-17 00:00:00
GONE WITH THE WIND Region 4 DVD OOP RARE Classic 1939 Drama Romance UNCUT,30.53,2020-08-17 00:00:00
Vintage Antique Frosted To Clear Gone With The Wind Ball Glass Shade Globe GWTW,89.35,2020-08-17 00:00:00
Gone With the Wind Collectible Watch In Tin Avon 2007 ,48.8,2020-08-17 00:00:00
GONE WITH THE WIND MURRAY FEISS FANCY VINTAGE HANDMADE IN ITALY HURRICANE LAMP ,142.54,2020-08-17 00:00:00
"Rhett Butler, Clark Gable Doll",60.0,2020-08-17 00:00:00
MIB 1967 SCARLETT O’HARA Doll Gone With The Wind Franklin Heirloom Mint Cond.,140.95,2020-08-17 00:00:00
"DVD- ""GONE WITH THE WIND"" WINNER OF 10 ACADEMY AWARDS -  BRAND NEW, SEALED",46.75,2020-08-17 00:00:00
"Madame Alexander Scarlett Ohara Doll #1590 14"" Gone With The Wind - Gorgeous!!",111.0,2020-08-17 00:00:00
"1939 GONE WITH THE WIND Clark Gable Original Mexican Movie Lobby Card 16""x12""",42.99,2020-08-17 00:00:00
Gone with the Wind from Original motion picture soundtrack CD,5.0,2020-08-17 00:00:00
"Gone With the Wind (VHS, 1998, Digitally Re-Mastered) New Sealed ",40.0,2020-08-17 00:00:00
Rare Gone With The Wind Mamey Doll Limited Edition By World Doll No/Box,57.0,2020-08-17 00:00:00
Vtg Painted Puffy Rose Milk Glass Hurricane Lamp Shade Gone with The Wind GWTW,109.99,2020-08-17 00:00:00
2007 Hallmark Magic Ornament Scarlett O'Hara & Rhett Butler Gone w/the Wind NIB,61.99,2020-08-17 00:00:00
Gone With the Wind (Blu-ray) New OOP Classic/ Epic/ Masterpiece Clark Gable,17.0,2020-08-17 00:00:00
Gone with the Wind Victorian Hurricane Lamp,49.99,2020-08-17 00:00:00
HALLMARK ORNAMENT SCARLETT MEETS HER MATCH GONE WITH THE WIND DATED 2012,29.99,2020-08-17 00:00:00
Vintage Hurricane Lamp Glass Shade GWTW Handpainted Floral ,50.0,2020-08-17 00:00:00
GONE WITH THE WIND by Mitchell from Easton Press 1968 Two Volumes,195.05,2020-08-17 00:00:00
"Franklin LIbrary Leather GONE WITH THE WIND by Margaret Mitchell 1st thus, ",137.99,2020-08-17 00:00:00
Franklin Heirloom 1993 Gone With The Wind PRISSY Porcelain Doll Rare!,125.0,2020-08-17 00:00:00
Lot Of 10 Gone With The Wind 6X6 Quilting Squares With 1/4 Inch Border ,26.98,2020-08-17 00:00:00
Mattel Ken as Rhett Butler 1994 - Hollywood Legends Collection 12741,76.95,2020-08-17 00:00:00
CLARK GABLE ca 1950s Studio Portrait Vintage Photo GONE WITH THE WIND nb,30.21,2020-08-17 00:00:00
CLARK GABLE ca 1950s Studio Portrait Vintage Photo GONE WITH THE WIND nb,30.21,2020-08-17 00:00:00
Gone With The Wind Scarlett and Rhett The Finale 1986 Collector Plate Knowles,11.69,2020-08-17 00:00:00
DRAMA-Gone With The Wind Blu-Ray NEW,16.3,2020-08-17 00:00:00
Gone With the Wind Blu-ray Disc 70th Anniversary Edition SHIPS NOW IN HAND Slip,47.0,2020-08-17 00:00:00
Gone With the Wind [Four-Disc Collector's Edition] New! Sealed,52.99,2020-08-17 00:00:00
Gone With The Wind:Domed Scarlett's Deception Figurine,47.45,2020-08-17 00:00:00
2018 Hallmark Scarlett’s Christmas Dress: Gone With The Wind Ornament New In Box,53.99,2020-08-17 00:00:00
Remember When GONE WITH THE WIND Retro Movie Poster 1000 Pc Puzzle ,48.0,2020-08-17 00:00:00
Click Magazine January 1940 Gone With the Wind Brenda Joyce Ann Miller Lacrosse,100.7,2020-08-17 00:00:00
1988 GONE WITH THE WIND Collector Plate W J George China,88.45,2020-08-17 00:00:00
GONE WITH THE WIND R67 #2 Lobby Card 533,25.99,2020-08-17 00:00:00
Hand made book clutch Gone With The Wind(Olympia Le Tan inspired),160.0,2020-08-17 00:00:00
"Gone with the Wind Postcards Lot Of 3  Scarlett, Tara & Dance 50th Anniversary",43.95,2020-08-17 00:00:00
Hollywood legends collection barbie,68.5,2020-08-17 00:00:00
Scarlett's Deception Gone With The Wind Figurine 1993 Limited Edition #A7536,53.99,2020-08-17 00:00:00
Gone With the Wind 2 Disc Edition DVD - Brand New and Unopened!,43.89,2020-08-17 00:00:00
Eric Linden signed autograph book page Swedish–American actor Gone with the Wind,42.69,2020-08-17 00:00:00
Scarlett - Sequel to Gone with the Wind - New/Sealed - ALL REGIONS (AUS),12.36,2020-08-17 00:00:00
2001 Scarlett O'hara Barbie Doll Gone With The Wind 29771 Green Dress Damaged,137.0,2020-08-18 00:00:00
"Vintage Huge 25"" Blue Roses Floral Hurricane ""Gone With the Wind"" Brass Lamp  ",212.99,2020-08-18 00:00:00
Gone With the Wind by Margaret Mitchell (English) Paperback Book Free Shipping!,20.8,2020-08-18 00:00:00
Margaret Mitchell GONE WITH THE WIND book International Collectors Library LN,99.95,2020-08-18 00:00:00
"Vintage 1992 MATTEL ""PEACH BLOSSOM"" BARBIE DOLL #7009 NRFB Limited Edition NIB",90.99,2020-08-18 00:00:00
GONE WITH THE WIND DVD R4 CLARK GABLE VIVIEN LEIGH,53.66,2020-08-18 00:00:00
Blue Satin Gone With The Wind Parlor Lamp Embossed Floral ,805.0,2020-08-18 00:00:00
"""GONE WITH THE WIND""  DOLL-RHETT BUTLER-CLARK GABLE 2001 MATTEL",143.0,2020-08-18 00:00:00
Scarlett: Sequel to Margaret Mitchells Gone With the Wind by Alexandra Ripley,53.58,2020-08-18 00:00:00
Franklin Library GONE WITH THE WIND Margaret Mitchell LIMITED Collectors Edition,290.99,2020-08-18 00:00:00
 Barbie-Ken-Rhett-Butler-Hollywood-Legends-Collection-Gone-with-the-Wind  Barbie,75.13,2020-08-18 00:00:00
"Vintage Hurricane Lamp, Gone with the Wind Lamp, Large Size, 26” Inches High",149.0,2020-08-18 00:00:00
GONE WITH THE WIND 50TH ANNIVERSARY EDITION PORTRAIT ASHLEY&MELANIE. WORLD DOLL ,45.0,2020-08-18 00:00:00
