title,price,date
8x10 Print Clark Gable Vivien Leigh State Theater Gone with the Wind 1939 201673,20.68,2020-09-13 00:00:00
8x10 Print Clark Gable Vivien Leigh Gone with the Wind at the Astor 1939 #1450,20.68,2020-09-13 00:00:00
The Wind Done Gone: A Novel,4.04,2020-09-13 00:00:00
1998 Gone With The Wind Metal Round Christmas Ornament Brass,10.0,2020-09-13 00:00:00
"LOT #4:  GONE WITH THE WIND FIGURINE: GWTW: ""SCARLETT'S BETROTHAL"": W GLASS DOME",33.11,2020-09-13 00:00:00
Gone With the Wind DVD 4-Disc Set TESTED VERY GOOD 1939 Color ,14.88,2020-09-13 00:00:00
"VTG SCARLETT & RHETT KISSING ""GONE WITH THE WIND"" SPOON MARKED MADE BY FORT 5""L",13.08,2020-09-13 00:00:00
 Vintage Hand Painted Gone With The Wind Globe Lamp With Floral Motif Green/Whit,240.0,2020-09-13 00:00:00
"Scarlett O'Hara Barbie Doll Gone with the Wind Peachtree Street Drapery Dress""",64.76,2020-09-13 00:00:00
“SCARLETT RADIANCE”~Plate One~STAINED GLASS~GONE WITH THE WIND #D112~Bradford Ex,28.5,2020-09-13 00:00:00
"Antique Gone with The Wind GWTW 10"" Oil Lamp Shade Round Ball Globe Hand Painted",82.25,2020-09-13 00:00:00
Bradford ~ REFLECTIONS OF SCARLETT PLATE ~ Gone With The Wind ~ CHANCE ENCOUNTER,29.85,2020-09-13 00:00:00
Gone With The Wind Dolls/Purse Read Description,71.4,2020-09-13 00:00:00
"1988 Gone With The Wind Collector Plate - ""The Proposal"" With COA",20.5,2020-09-13 00:00:00
"TURNER ENTERTAINMENT  SCARLETT'S DECEPTION  ""GONE WITH THE WIND""  FIGURINE globe",23.75,2020-09-13 00:00:00
"Gone With The Wind by Margaret Mitchell 1979, Hardcover 1 Page W/ Marks Good-VG",15.0,2020-09-13 00:00:00
NIB Vintage 1989 “Bonnie Blue” Doll 70882 Gone With The Wind By World Doll ,40.89,2020-09-13 00:00:00
"Gone With The Wind movie poster (a) Clark Gable, Vivien Leigh -  11 x 17 inches",11.99,2020-09-13 00:00:00
1996 GONE WITH THE WIND FACTORY SEALED BOX COMPLETE BASIC TRADING CARDS ET,17.4,2020-09-13 00:00:00
"10"" Gone With The Wind Lamp Shade Globe Milk Glass Hobnail Ruffled Top",46.33,2020-09-13 00:00:00
QRS 9133 piano roll My Own True Love (Gone with the Wind) play by Walter Redding,8.0,2020-09-13 00:00:00
HALLMARK KEEPSAKE ORNAMENT - GONE WITH THE WIND - SCARLETT'S CHRISTMAS DRESS,19.5,2020-09-13 00:00:00
2004 Hallmark Keepsake Gone With The Wind Scarlett & Rhett Christmas Ornament,24.99,2020-09-13 00:00:00
Gone with the Wind The Proposal Golden Anniversary Series ,19.89,2020-09-13 00:00:00
Antique Victorian Gone with the Wind Banquet Parlor Lamp with PInk Flowers,175.0,2020-09-13 00:00:00
Gone With The Wind By Margaret Mitchell 1964 Book Club Edition,16.58,2020-09-13 00:00:00
DVD Gone With the Wind: 70th Anniversary Edition (2-Disc Set) NEW,15.89,2020-09-13 00:00:00
Gone With The Wind 70th anniversary blu-ray Box Set Limited Edition New Sealed,215.05,2020-09-13 00:00:00
2007 Gone With the Wind Rhett Butler Bonnie Blue Hallmark Keepsake Ornament ,35.74,2020-09-13 00:00:00
Gone With The Wind by Mitchell - Franklin Library - Limited Edition - 1978,120.0,2020-09-13 00:00:00
Hawthorne Village Gone With The Wind “Tara… Scarlett’s Pride” Retired 1994 COA  ,43.0,2020-09-13 00:00:00
Gone With the Wind 70th Anniversary Edition Blu-Ray DVD Clark Gable New Sealed,17.99,2020-09-13 00:00:00
NRFB BARBIE AS SCARLETT O'HARA HOLLYWOOD LEGENDS COLLECTION MATTEL 12815 1994,21.49,2020-09-13 00:00:00
THOMAS MITCHELL movie photo GONE WITH THE WIND,14.73,2020-09-13 00:00:00
"OLIVIA DE HAVILLAND, LESLIE HOWARD movie photo GONE WITH THE WIND",14.73,2020-09-13 00:00:00
THOMAS MITCHELL movie photo GONE WITH THE WIND,14.73,2020-09-13 00:00:00
Gone With The Wind Repro Postcard Unused,4.48,2020-09-13 00:00:00
"GONE WITH THE WIND, Motion Picture mag cover POSTCARDS~Vivien Leigh,Clark Gable",3.55,2020-09-13 00:00:00
"Gone With the Wind (DVD, 2004, 4-Disc Set Collectors Edition) New Still Sealed",25.25,2020-09-13 00:00:00
Gone With the Wind [Autant en emporte le vent] - DVD,6.48,2020-09-13 00:00:00
"SAN FRANCISCO MUSIC BOX Gone With the Wind SCARLETT AT TARA Opening Scene 7 1/2""",149.95,2020-09-13 00:00:00
"HURRICANE GWTW GONE WITH THE WIND LAMP - PUFFY ROSE w/ PICK ROSE- 3-WAY 21""(AK1)",164.23,2020-09-13 00:00:00
"Madame Alexander Doll 8"" Bonnie Blue Gone with the Wind series 629",75.95,2020-09-13 00:00:00
"1994 Barbie Gone With the Wind Folding Backdrop Board , Mattel",14.41,2020-09-13 00:00:00
San Francisco Music Box Gone With The Wind Scarlett O'Hara Red Dress,43.95,2020-09-13 00:00:00
Gone With the Wind RHETT BUTLER+ Scarlett  Dave Grossman Creations  Figurines,11.3,2020-09-13 00:00:00
"21 1/2"" Rhett Butler Clark Gable Doll - Gone With The Wind - MIB by World Doll",77.94,2020-09-13 00:00:00
"Scarlett O'hara 20"" vintage big large world doll gone with the wind mint in box",71.94,2020-09-13 00:00:00
GONE WITH THE WIND - 1959 VG+ GRADED CANADA MONOPHONIC VINYL LP RELEASE,13.81,2020-09-13 00:00:00
Gone With the Wind - 1939/1940 Souvenir Program,24.74,2020-09-13 00:00:00
gone with the wind book paperback,7.8,2020-09-13 00:00:00
Vintage 3 Way Hand Painted Hurricane Lamp Gone with the Wind Frosted Floral,78.95,2020-09-13 00:00:00
"Barbie As Scarlett O’Hare In Gone W The Wind, Hollywood Legends Collection",28.0,2020-09-13 00:00:00
Gone with the Wind,9.9,2020-09-13 00:00:00
Gone with the Wind,6.49,2020-09-13 00:00:00
 NEW THOMAS KINKADE GONE WITH THE WIND 1000 PIECE PUZZLE,30.9,2020-09-13 00:00:00
Gone with the Wind By Margaret Mitchell - International Collectors Library ICL,23.32,2020-09-13 00:00:00
Gone with the Wind Complete EGG SET Franklin Mint With Display,160.0,2020-09-13 00:00:00
Gone With The Wind Margaret Mitchell Copyright 1936 Renewed 1964 Hardcover Book,65.98,2020-09-13 00:00:00
Jim Shore Gone With The Wind Scarlett O'Hara After All Tomorrow Is Another Day,92.55,2020-09-13 00:00:00
"Tara's Theme from Gone With The Wind/Jealousy By Percy Faith (CD, Mar-2006,...",9.2,2020-09-13 00:00:00
"Hawthorne “Gone With The Wind The Burning of Atlanta"" Sculpture 1994 656A/10,000",35.0,2020-09-13 00:00:00
Franklin Mint Scarlett O'Hara vinyl doll Shanty Town Gone With The Wind Doll,169.0,2020-09-13 00:00:00
"""Pearls and Promises"" #7 Scarlett O'Hara And White Lace, Gone With The Wind",29.89,2020-09-13 00:00:00
OOP Barbie Gone With The Wind Scarlet Gown Pattern,26.0,2020-09-13 00:00:00
"Madame Alexander 8"" Prissy Doll 1990 Gone With The Wind No. 630 AA NEW",40.99,2020-09-13 00:00:00
"Gone with the Wind Scarlett O'Hara Mattel, Barbecue at Twelve Oaks NRFB",105.9,2020-09-13 00:00:00
Max Steiner - Gone With the Wind (Original Motion Picture Soundtrack) [New Vinyl,13.98,2020-09-14 00:00:00
1999 Hallmark Ornament GWTW Scarlett O'Hara Series #3 Scarlett O'Hara,15.75,2020-09-14 00:00:00
"Gone With The Wind - Edible Cake Topper OR Cupcake Topper, Decor",13.94,2020-09-14 00:00:00
Margaret Mitchell GONE WITH THE WIND Hardcover 1964 International Library ,28.33,2020-09-14 00:00:00
Dave Grossman Limited Edition Gone With The Wind Ashley Ornament With Box,13.49,2020-09-14 00:00:00
"Scarlett O'Hara On Peachtree Street ""Gone with the Wind"" 2001 Barbie Doll. NIB",83.69,2020-09-14 00:00:00
ANTIQUE PAINTED CAST IRON PINK LADY SOUTHERN BELLE DOOR STOP GONE WITH THE WIND,75.0,2020-09-14 00:00:00
"Gone With the Wind (DVD, 1939) ",6.94,2020-09-14 00:00:00
Gone with the Wind [Four-Disc Collector's Edition],6.99,2020-09-14 00:00:00
Hattie Mcdaniel As Mammy In Gone With The Wind 11x17 Mini Poster,17.98,2020-09-14 00:00:00
Gone With the Wind Blu-ray 75th Anniversary Limited Edition RARE OOP MINT 4 Disk,86.49,2020-09-14 00:00:00
GONE WITH THE WIND 2 VOLUME SET IN ORIG SLIPCASES MARGARET MITCHELL 1968,60.0,2020-09-14 00:00:00
"1989 GONE WITH THE WIND  "" CAST FROM THE MOVIE""  BY WORLD DOLL - 5  DOLLS- NEW",103.94,2020-09-14 00:00:00
1994~ Barbie as Scarlett O'Hara ~ Hollywood Legends ☆ Gone with the Wind ☆,33.7,2020-09-14 00:00:00
"1994 GONE WITH THE WIND ""BARBIE AS SCARLETTE O'HARA MATTEL GREEN DRESS",45.85,2020-09-14 00:00:00
"Rare 1st Edition 5th Printing 1936 "" GONE  WITH THE WIND "" Margaret Mitchell",79.38,2020-09-14 00:00:00
gone with the wind 70th anniversary edition Blu Ray ***SEAL IS RIPPED***,9.99,2020-09-14 00:00:00
"1999 The San Fransico Music Box Company Gone With The Wind ""Tara's Theme"" Rhett",149.25,2020-09-14 00:00:00
OUR GONE WITH THE WIND DOLLAR BILL (2 Bills),1.5,2020-09-14 00:00:00
"Gone With the Wind 1936 by Margaret Mitchell, 1st Ed, Nov printing",34.38,2020-09-14 00:00:00
White Columns In Hollywood By Susan Myrick HCDJ 1984 ,22.0,2020-09-14 00:00:00
Steel Magnolia Gone With The Wind Cameo Memories Collectors Plate,19.95,2020-09-14 00:00:00
"Gone With the Wind (Blu-ray Disc, 2014, 75th Anniversary)",48.86,2020-09-14 00:00:00
"Fenton Burmese GWTW Gone With The Wind Lamp Shade Bird, Flowers Berries Artist",233.23,2020-09-14 00:00:00
"Barbie Doll as Scarlett O’Hara in BBQ Dress, 12997 NRFB",34.9,2020-09-14 00:00:00
"Gone With The Wind, Margaret Mitchell, Macmillan, May 1936, First / First",2062.68,2020-09-14 00:00:00
"Gone With the Wind (DVD, 2005, 2-Disc Set) ",10.74,2020-09-14 00:00:00
"""Gone with the Wind"", Barbie Collection, set of 5 1994 NRFB",165.0,2020-09-14 00:00:00
"Gone With the Wind Book w/Dust Jacket: Margaret Mitchell, 1st Edition, 1937",50.98,2020-09-14 00:00:00
Vintage PRETTY WILD ROSE Hurricane Gone With The Wind Table Lamp,164.95,2020-09-14 00:00:00
"Gone with the Wind by Margaret Mitchell (2011, Trade Paperback, Anniversary)",16.0,2020-09-14 00:00:00
"December 25, 1939 Time Magazine Vivien Leigh Scarlett O'Hara Gone With the Wind",127.8,2020-09-14 00:00:00
"Vintage Milk Glass 3-Way Double Hurricane Table Lamp ""Gone with the Wind"" Style",87.78,2020-09-14 00:00:00
Hollywood Legends Collection Barbie Scarlett O'Hara Gone w/ Wind 12045 1994 New,43.55,2020-09-14 00:00:00
Barbie As Scarlett O'Hara Hollywood Legends Collection Gone With The Wind NEW,60.3,2020-09-14 00:00:00
Hallmark 2008 Scarlett O’Hara Gone With The Wind Keepsake Ornament Porcelain,19.6,2020-09-14 00:00:00
Scarlett-green print 1994 Barbie Doll Hollywood legends collection,39.98,2020-09-14 00:00:00
GONE WITH THE WIND (1939) Butterfly McQueen  original Selznick Intl photo E788,27.42,2020-09-14 00:00:00
Mattel Gone with the Wind Scarlett & Rhett - Barbie & Ken - 2004 - Drapes Gown,56.4,2020-09-14 00:00:00
VINTAGE White Glazed GONE WITH THE WIND Style Three Way HURRICANE LAMP 19” TALL,91.97,2020-09-14 00:00:00
CLARK GABLE VIVIEN LEIGH GONE WITH THE WIND MOVIE 1939 8X10 GREAT RARE PHOTO,13.94,2020-09-14 00:00:00
"Franklin Mint Scarlett O'Hara's Gone with the Wind ""Pride and Vanity"" NRFB",63.7,2020-09-14 00:00:00
Gone With the Wind [70th Anniversary Edition],2.51,2020-09-14 00:00:00
"1995 - ""GONE WITH THE WIND"" CHROMIUM CHASE CARD SET (6) BY DUOCARDS",9.2,2020-09-14 00:00:00
 THE PROPOSAL Gone With The Wind Fine China Plate 1988 WS George New in Box ,12.9,2020-09-14 00:00:00
Маргарет Митчелл: Унесенные ветром 2 тома Gone with the Wind  RUSSIAN BOOK,30.98,2020-09-14 00:00:00
Маргарет Митчелл: Унесенные ветром Все в одном томе M. Mitchell  RUSSIAN BOOK,31.98,2020-09-14 00:00:00
Митчелл: Унесенные ветром в Четырёх книгах  Margaret Mitchell Russian Book,49.98,2020-09-14 00:00:00
Митчелл: Унесенные ветром  в Четырёх книгах  Margaret Mitchell Russian Book,54.98,2020-09-14 00:00:00
Митчелл: Унесенные ветром  Mitchell Russian Book Всемирная литература,30.98,2020-09-14 00:00:00
Митчелл: Унесенные ветром 2 Тома  Mitchell GONE WITH THE WIND Russian Book,26.98,2020-09-14 00:00:00
New Arrival 2 pcs/set Gone With The Wind: English book student,55.16,2020-09-14 00:00:00
2Pcs/set Gone With the Wind by Margaret Mitchell Original English Edition A,56.41,2020-09-14 00:00:00
Gone with the Wind  Chinese Reading Book with Pinyin for Chinese Students or,21.27,2020-09-14 00:00:00
""" Gone With The Wind ""   Rhett Butler Spoon ",16.98,2020-09-14 00:00:00
Ruth's Journey: A Novel of Mammy from Margaret Mitchell's Gone with the Wind,5.34,2020-09-14 00:00:00
Gone With the Wind Portrait Scarlett O Hara - Hollywood Photo Archive,39.99,2020-09-14 00:00:00
franklin mint gone with the wind porcelain mrs ohara hard to find with coa,185.98,2020-09-14 00:00:00
"2013  RED DRESS 16"" DRESSED DOLL TONNER SCARLETT O'HARA VIVIEN LEIGH FREE SHIP",292.49,2020-09-14 00:00:00
5 Gone With the Wind Dave Grossman Figures W/box Belle Watling Scarlett Rhett,85.0,2020-09-14 00:00:00
2009 Frankly My Dear Hallmark Ornament Gone with the Wind Butler O'Hara,94.98,2020-09-14 00:00:00
"Gone with the Wind by Mitchell, Margaret Book The Fast Free Shipping",9.99,2020-09-14 00:00:00
"Gone with the Wind Style Hurricane Lamp Yellow & White Embossed Floral 16.5"" H",118.55,2020-09-14 00:00:00
"Franklin Library Patron’s Edition, Gone With The Wind, Margaret Mitchel",129.99,2020-09-15 00:00:00
"*Rare* The Making of a Legend: Gone With the Wind (DVD, 2010)",63.95,2020-09-15 00:00:00
Gone With The Wind Hallmark Ornaments-4 Scarlett & 1 Rett,54.31,2020-09-15 00:00:00
Vintage GONE WITH THE WIND SCARF Lightly Used - SCARLETT & RHETT & BONNIE,29.97,2020-09-15 00:00:00
" GWTW Gone with the wind style Gold floral painted Table lamp Light 15"" tall ",143.07,2020-09-15 00:00:00
raymond karsar gone with the wind scarlett,14.68,2020-09-15 00:00:00
"Vintage Floral Painted Milk Glass Gone With The Wind Table LAMP 19” Tall, 3-Way",102.1,2020-09-15 00:00:00
Gone With the Wind [70th Anniversary Edition],2.51,2020-09-15 00:00:00
"Barbie Doll as Scarlett O’Hara in Black and White Dress, 13254",32.5,2020-09-15 00:00:00
Hallmark Lot of 6 Gone with the Wind Scarlett O’Hara & Rhett Butler Ornaments,67.9,2020-09-15 00:00:00
"Gone With the Wind (Blu-ray Disc, 2009)",12.49,2020-09-15 00:00:00
OLIVIA de HAVILLAND vintage signed Letter 1967   ACTRESS   Gone With the Wind ,54.0,2020-09-15 00:00:00
Dave Grossman Creation Rhett Bulter Figure Gone With The Wind,17.6,2020-09-15 00:00:00
Gone with the Wind 4 disc collector's edition DVD box set Gable Leigh ,14.0,2020-09-15 00:00:00
"VTG Floral Glass ""Gone With the Wind"" 3 way Hurricane  Floral Table Lamp",81.11,2020-09-15 00:00:00
SHELIA'S 1998 HOME OF ASHLEY WILKES Gone With The Wind  GWW08 NIB (818E),20.65,2020-09-15 00:00:00
SHELIA'S 1995 GENERAL STORE Gone With The Wind  GWW04  NEW (C219),17.65,2020-09-15 00:00:00
GONE WITH THE WIND Volumes 1 & 2 Easton Press HC Set Collectors Edition Color ,28.99,2020-09-15 00:00:00
Margaret Mitchell GONE WITH THE WIND Signed Autograph Auto Greeting Card JSA LOA,902.99,2020-09-15 00:00:00
Bradford Exchange collector's plate 1994  Gone With The Wind Scarlett Radiance ,15.0,2020-09-15 00:00:00
1994 Gone With the Wind Drapery Dress Barbie as Scarlett O'Hara - MIB - NRFB !,27.98,2020-09-15 00:00:00
1994 Gone With the Wind White Shopping Spree Dress Barbie as Scarlett O'Hara ,25.98,2020-09-15 00:00:00
1994 Gone With the Wind Green/White Barbeque Dress Barbie Scarlett O'Hara NRFB !,38.98,2020-09-15 00:00:00
1994 Gone With the Wind Red Birthday Party Dress Barbie as Scarlett O'Hara  NRFB,28.98,2020-09-15 00:00:00
1994 Ken as Rhett Butler in Gone With the Wind Barbie Hollywood Legends - NRFB !,29.98,2020-09-15 00:00:00
HATTIE MCDANIEL GONE WITH THE WIND FAN WITH WOODEN HANDLE,20.85,2020-09-15 00:00:00
"Madame Alexander Gone with the Wind - Portrait Scarlett 14980, NRFB",87.9,2020-09-15 00:00:00
RHETT BUTLER (Clark Gable) PORCELAIN DOLL ~ Gone With The Wind ~Franklin Mint,34.85,2020-09-15 00:00:00
1994 Ken as Rhett Butler in Gone With the Wind Barbie Hollywood Legends - NRFB !,29.98,2020-09-15 00:00:00
"Gone With the Wind (DVD, 2009, 70th Anniversary Edition 2 DISC) BRAND NEW SEALED",13.32,2020-09-15 00:00:00
"MARGARET MITCHELL ""GONE WITH THE WIND"" 1st EDITION / NOVEMBER 1936 EDITION BOOK",126.47,2020-09-15 00:00:00
GONE WITH THE WIND by Margaret Mitchell 1964 International Collectors Library HC,25.99,2020-09-15 00:00:00
Large GWTW Antique Handpainted Floral Pink White Oil Lamp Converted Three-Way,214.25,2020-09-15 00:00:00
Scarlett: The Sequel to Margaret Mitchell's Gone With the Wind [ Alexandra Riple,3.95,2020-09-15 00:00:00
"NEW BRADFORD EXCHANGE GONE WITH THE WIND COLLECTIBLE PLATE, NUMBERED,NRFB",39.99,2020-09-15 00:00:00
Scarlett Ohara 1994 Barbie Doll - New In Box,41.99,2020-09-15 00:00:00
GREASE/ GREASE 2    DVD LOT OF 2,9.95,2020-09-15 00:00:00
"GONE WITH THE WIND - scarlett o'hara  - METAL REFRIDGERATOR MAGNET 2x3"" NEW",4.75,2020-09-15 00:00:00
GONE WITH THE WIND New Blu-ray 70th Anniversary Ed,11.49,2020-09-15 00:00:00
(9)1980s Gone With The Wind Collectors Plates In Wooden Hanging Frames And COA’s,157.19,2020-09-15 00:00:00
"Gone With The Wind Vintage Movie Poster - A1, A2, A3, A4 available",28.79,2020-09-15 00:00:00
"8"" Madame Alexander Doll “Scarlett” Gone With The Wind 626 Floral Dress W/ Box",28.0,2020-09-15 00:00:00
GONE WITH THE WIND 1994 DOLL SCARLETT O’HARA BARBIE NEW SEALED,30.44,2020-09-15 00:00:00
"Percy Faith & His Orchestra 8 Track, Tara's Theme From Gone With The Wind,Exodus",12.73,2020-09-15 00:00:00
Ford Vs Ferrari (DVD 2019),16.99,2020-09-15 00:00:00
Gone With The Wind Col Vivien Leigh By Tara 16x20 Canvas Giclee,69.99,2020-09-15 00:00:00
#phs.011078 photo olivia de havilland (gone with the wind),11.83,2020-09-15 00:00:00
"Gone With the Wind (VHS, 2-Tape Set) Deluxe Edition Box Set with Booklet - NICE!",13.99,2020-09-15 00:00:00
Hallmark Gone With The Wind Scarlett Meets Her Match 2012 Ornament,21.94,2020-09-15 00:00:00
"Gone With the Wind (Blu-ray Disc, 2010, 70th Anniversary Edition)",12.95,2020-09-15 00:00:00
"Set of 3 Hollywood Legends Collection, Gone with the Wind Barbies and Ken",95.0,2020-09-15 00:00:00
"1936  ""S""  Walking Liberty Half Dollar--""Gone With the Wind"" Published",11.53,2020-09-15 00:00:00
Antique Pittsburgh Regal Iris Red Satin Gone With the Wind Chamber Lamp in Book,1360.0,2020-09-15 00:00:00
"HALLMARK KEEPSAKE - GONE WITH THE WIND - ""AS GOD IS MY WITNESS"" - LIGHT & SOUND",19.5,2020-09-15 00:00:00
Hallmark Christmas Ornament Scarlett O'Hara and Rhett Butler Gone With The Wind,24.9,2020-09-15 00:00:00
 Gone with the Wind Clark Gable and Vivien Leigh MGM  Avon Images of Hollywood,30.84,2020-09-15 00:00:00
World Doll Gone with the Wind 50th Anniversary Prissy,48.69,2020-09-15 00:00:00
Gone with the wind hurricane lamp - pink satin with flowers - full table lamp ,203.0,2020-09-15 00:00:00
"Gone with the Wind - Mass Market Paperback By Mitchell, Margaret - GOOD",5.0,2020-09-15 00:00:00
Fenton Art Glass French Opalescent Coin Dot Lamp Gone with the Wind Perfect,304.99,2020-09-15 00:00:00
SCARLETT O'HARA AND WHITE LACE PLATE GONE WITH THE WIND VIXEN IN VELVET ,36.42,2020-09-16 00:00:00
Ruth's Journey: A Novel of Mammy from Margaret Mitchell's Gone with the Wind,5.97,2020-09-16 00:00:00
Gone With The Wind BCE,7.33,2020-09-16 00:00:00
1994 Gone With the Wind Red Birthday Party Dress Barbie as Scarlett O'Hara  NRFB,27.98,2020-09-16 00:00:00
Ken as Rhett 1994 Barbie Doll,28.9,2020-09-16 00:00:00
Barbie New Clothes: FRENCH QUARTER Collector’s Club RARE 2002 #B2518 *NRFB*,130.0,2020-09-16 00:00:00
Gone With The Wind Rhett & Scarlett Carriage Figurine VTG Music Box Tara’s Theme,100.78,2020-09-16 00:00:00
Hallmark Ornament Portrait Of Scarlett Gone With The Wind 2001 Scarlett O’Hara,28.33,2020-09-16 00:00:00
Ruth's Journey: A Novel of Mammy from Margaret Mitchell's Gone with the Wind,5.97,2020-09-16 00:00:00
"Gone With the Wind (DVD, 2000)",6.98,2020-09-16 00:00:00
WORLD DOLL ~ RHETT BUTLER DOLL ~ GONE WITH THE WIND ~ NIB ~ Limited Edition,23.14,2020-09-16 00:00:00
Gone With the Wind [Original Motion Picture Soundtrack] by Max Steiner 2 CD Box,17.0,2020-09-16 00:00:00
Gone With the Wind figurines- Franklin mint 15,125.0,2020-09-16 00:00:00
"14"" Madame Alexander Gone with the Wind Scarlett O'Hara Doll #1590 ",33.0,2020-09-16 00:00:00
Gone With The Wind By World Doll Bonnie Blue,30.0,2020-09-16 00:00:00
"50th ANNIVERSARY GONE WITH THE WIND, Franklin Mint Porcelain  JEWELRY MUSIC BOX",64.65,2020-09-16 00:00:00
GONE WITH THE WIND PAIR VINTAGE 3-WAY FROSTED GLASS ROSE THEMED HURRICANE LAMPS,171.27,2020-09-16 00:00:00
"Laurent Durieux Art Print ""Gone With The Wind"" Variant Movie Poster",260.0,2020-09-16 00:00:00
VINTAGE GONE WITH THE WIND ORIGINAL MOVIE PLAYBILL PROGRAM,67.96,2020-09-16 00:00:00
Vintage Gone With The Wind Hurricane Table Lamp White Satin Globe Painted Flower,126.51,2020-09-16 00:00:00
SCARLETT & RHETT William Chambers Music Box Gone With The Wind Limited Ed 1992,30.0,2020-09-16 00:00:00
Madame Alexander Scarlett 1997 Vintage Gone With the Wind Picnic 21 inch Doll,223.44,2020-09-16 00:00:00
Gone With The Wind “Aunt PIttypat Doll By World Doll,24.69,2020-09-16 00:00:00
A3 SIZE FILM POSTER  ' GONE WITH THE WIND' GAUMONT CINEMA  LEEDS,11.3,2020-09-16 00:00:00
GONE WITH THE WIND VINTAGE 3-WAY THICK MILK-GLASS COUNTRY THEMED HURRICANE LAMP,119.75,2020-09-16 00:00:00
Antique Gone with The Wind GWTW Oil Lamp Shade Ball Globe Hand Painted ROSES,100.3,2020-09-16 00:00:00
"Gone with the Wind : Trivia, Secrets, and Behind-The-Scenes Stories of America's",10.93,2020-09-16 00:00:00
Scarlett O’Hara Gone With The Wind Peachtree Drapery Dress Timeless Treasures,90.0,2020-09-16 00:00:00
"VINYL - GONE WITH THE WIND musical - DISC = MINT , JACKET = VG+ - RARE ",29.98,2020-09-16 00:00:00
MOVIE GREAT COLLECTIONS 1967 World Doll Gone w/ the Wind Scarlett O'Hara 71153,50.85,2020-09-16 00:00:00
"Gone With the Wind Fabric, Fat Quarter, Scarlett & Rhett. Realistic Picture RARE",22.95,2020-09-16 00:00:00
"Gone With The Wind Margaret Mitchell, International Collectors Library - Exec!",23.98,2020-09-16 00:00:00
GONE WITH THE WIND 3-WAY FROSTED GLASS WHITE ETCHED ROSE FLORAL  HURRICANE LAMP,117.49,2020-09-16 00:00:00
Gone With The Wind Working Book Clock,20.75,2020-09-16 00:00:00
1999 Hallmark Ornament Rhett Butler Gone with the Wind QX6467 NEW NRFB,16.7,2020-09-16 00:00:00
Vintage Knowles “Melanie Gives Birth” Gone With The Wind Collector Plate,22.0,2020-09-16 00:00:00
GWTW Gone with Wind Screenplay Margaret Mitchell Howard Harwell Book 1980 Illus,10.99,2020-09-16 00:00:00
Scarlett Ohara 1994 Barbie Doll,23.7,2020-09-16 00:00:00
2005 HALLMARK GONE WITH THE WIND ORNAMENT SCARLETT O'HARA WHITE BLACK DRESS NIB,37.8,2020-09-16 00:00:00
2000 Hallmark Keepsake Ornament - Rhett Butler Gone With The Wind,11.0,2020-09-16 00:00:00
Gone With the Wind Home to Tara Collectible Plate Golden Anniversary Certifica,18.25,2020-09-16 00:00:00
"Gone with the Wind by Margaret Mitchell (1936, Hardcover, Reprint)",18.0,2020-09-16 00:00:00
"GONE WITH THE WIND - Margaret Mitchell, 1961 hc, The Macmillan Company",12.51,2020-09-16 00:00:00
"Gone With the Wind (DVD, 2004, 4-Disc Set) + Booklet",20.0,2020-09-16 00:00:00
Gone With The Wind Collector Envelope Original Period 1939 Stamp OP1197,8.0,2020-09-16 00:00:00
Puzzle Clementoni 750 pieces Collection Cinema : Gone With The Wind *NEW SEALED*,41.91,2020-09-16 00:00:00
 Barbie Doll as Scarlett o'Hara Gone With The Wind Hollywood Legends Collection,29.99,2020-09-16 00:00:00
"ANTIQUE GONE WITH THE WIND  OIL LAMP  HAND PAINTED GLOBE 4 "" BASE / 1831",81.45,2020-09-16 00:00:00
Percy Faith: Tara's Theme From Gone With The Wind / Jealousy NEW CD,13.45,2020-09-16 00:00:00
Vintage Large Green Fabric Feather Ribbon Hat Brooch Gone with the Wind Style,13.6,2020-09-16 00:00:00
Gone With The Wind - Margaret Mitchell - 1st Avon Printing 1973 -,16.98,2020-09-16 00:00:00
Gone With The Wind Collectible Book By Margaret Mitchell Macmillan 1964,23.86,2020-09-16 00:00:00
Scarlett Audio Sequel To Gone With The Wind 4 Cassette Tapes By Alexandra Ripley,5.79,2020-09-16 00:00:00
New Gone With the Wind Blu-ray with Gold Academy Awards Slipcover,20.0,2020-09-16 00:00:00
"GONE WITH THE WIND by Margaret Mitchell, International Collectors Library Vtg HB",34.94,2020-09-16 00:00:00
Vintage FENTON Cranberry Hurricane 3-Way Parlor Lamp Gone with the Wind Lamp,458.99,2020-09-17 00:00:00
Dirt from Margrett Mitchell’s grandparents property  Tara  Gone with the Wind,17.0,2020-09-17 00:00:00
"Mcm vintage Hand Painted Scene 60s Girl Reading Gone With The Wind 7""H x 5.25""W",29.99,2020-09-17 00:00:00
R.F.D. America by Lowell Davis Miss Private Time Figurine #225517 EUC,11.99,2020-09-17 00:00:00
1996 Gone With The Wind Franklin Mint Faberge Egg w/o Stand,22.7,2020-09-17 00:00:00
GONE WITH THE WIND original FIRST EDITION *RARE* Blu-Ray SteelBook Vivien Leigh,78.98,2020-09-17 00:00:00
Avon Images of Hollywood Gone with the Wind Clark Gable and Vivien Leigh MGM Set,29.75,2020-09-17 00:00:00
LOT OF 2 1000 PIECE JIGSAW PUZZLES THOMAS KINKADE Gone with the Wind,18.95,2020-09-17 00:00:00
Scarlet O'Hara ~Gone With The Wind~ 22” Wedding Doll By Franklin Heirloom VHTF,108.0,2020-09-17 00:00:00
"Gone With the Wind, MGM (Video & DVD), DVD",5.12,2020-09-17 00:00:00
"Barbie Doll as Scarlett O’Hara in BBQ Dress, 12997",37.99,2020-09-17 00:00:00
Gone With The Wind - The Game - NIB - Trivia - Factory Sealed,24.99,2020-09-17 00:00:00
Collectible GONE WITH THE WIND Margaret Mitchell Hardcover Book 1937,45.99,2020-09-17 00:00:00
Gone With The Wind Book June 1936,39.99,2020-09-17 00:00:00
Wembley Tie Gone With The Wind Blue Green Red Silk 57 x 4 USA 1800 Ties 4 Sale,12.15,2020-09-17 00:00:00
"Gone With The Wind: 70th Ann. Ed. (Blu-ray, 2009)Margaret Mitchell/Clark Gable",16.95,2020-09-17 00:00:00
