title,price,date
"Capote / In Cold Blood (DVD, 2010, 2-Disc Set)",48.69,2020-09-30 00:00:00
DVD Capote / In Cold Blood (2010) RARE OOP Truman Capote 2-Disc Double Feature ,47.9,2020-09-30 00:00:00
"In Cold Blood, Truman Capote, Easton Press, Full Leather, 2000",121.99,2020-10-01 00:00:00
DVD Capote In Cold Blood RARE Truman Capote 2-Disc Double Feature Robert Blake,51.99,2020-10-01 00:00:00
In Cold Blood by Truman Capote 1965 Book of the Month Edition Hardcover w/ DJ,59.99,2020-10-01 00:00:00
"In Cold Blood , Truman Capote",40.4,2020-10-03 00:00:00
In Cold Blood by Truman Capote 1965 rare Signed First Edition First Printing,425.0,2020-10-03 00:00:00
"In Cold Blood by Truman Capote (Paperback, 1994)",10.0,2020-10-04 00:00:00
In Cold Blood by Truman Capote The Easton Press (BRAND NEW CONDITION AND SEALED),84.93,2020-10-04 00:00:00
IN COLD BLOOD / THE PROFESSIONALS Double Feature 1970 ONE SHEET MOVIE POSTER  ,55.99,2020-10-04 00:00:00
In Cold Blood by Truman Capote  PB  3rd printing Signet,6.0,2020-10-05 00:00:00
Modern Library 100 Best Nonfiction Bks In Cold Blood by Truman Capote (2002) DJ,48.99,2020-10-05 00:00:00
"Lot of 6 Rare 45 RPM Records in Sleeves w/ Cold Blood 3 Versions, Da-Da  M40",54.99,2020-10-05 00:00:00
"In Cold Blood (Blu-ray Disc, 2015, Criterion Collection)",18.3,2020-10-05 00:00:00
"In Cold Blood (DVD, 2003)",44.1,2020-10-05 00:00:00
"In Cold Blood , Truman Capote",38.69,2020-10-06 00:00:00
In Cold Blood - Criterion Collection - Blu-ray - New,24.95,2020-10-06 00:00:00
"BRAND NEW In Cold Blood (DVD, 2003) MINI-SERIES CRIME Sam Neil",22.04,2020-10-06 00:00:00
PlayStation One PS1 Games (no manual) £ Multi-Buy Discount £,22.68,2020-10-06 00:00:00
"Johnny Thunders-In Cold Blood (UK IMPORT) Vinyl / 7"" Single NEW",18.72,2020-10-08 00:00:00
"Capote / In Cold Blood (DVD, 2010, 2-Disc Set)",42.95,2020-10-08 00:00:00
In Cold Blood: A True Account of a Multiple Murder and Its Consequences by Truma,26.66,2020-10-08 00:00:00
"In Cold Blood , Truman Capote",38.69,2020-10-08 00:00:00
Truman Capote IN COLD BLOOD Random House 1965 Early Book Club Edition,59.95,2020-10-08 00:00:00
1965 In Cold Blood by Truman Capote. Stated 1st. HB/DJ Original Price Intact.,76.99,2020-10-08 00:00:00
"In Cold Blood (PC, 2001) Game",28.15,2020-10-09 00:00:00
Brand New And Sealed Capote / In Cold Blood (DVD),49.99,2020-10-10 00:00:00
"LIFE IN COLD BLOOD - COMPLETE SERIES-DVD, 2-DISC BOX SET - R-4, LIKE NEW ",33.28,2020-10-10 00:00:00
Johnny Thunders In Cold Blood. NEW 1997 ESM CD,52.99,2020-10-11 00:00:00
"In Cold Blood (DVD, 2003) Richard Brooks Robert Blake Scott Wilson Truman Capote",6.0,2020-10-12 00:00:00
"In Cold Blood , Truman Capote",38.69,2020-10-12 00:00:00
In Cold Blood Capote 1965 Hardback with Dust Cover Anniversary Dedication,45.49,2020-10-12 00:00:00
IN COLD BLOOD ~ TRUMAN CAPOTE ~ FIRST UK ED 1966 ~ HAMISH HAMILTON ~ HB in DJ,80.44,2020-10-13 00:00:00
Johnny Thunders - In Cold Blood [7 VINYL],43.99,2020-10-13 00:00:00
Dragonball Super Card Game Universal Onslaught R SR SPR SCR Choose Your Cards,10.0,2020-10-13 00:00:00
In Cold Blood Truman Capote International Collectors Library 1965,51.6,2020-10-15 00:00:00
In Cold Blood - Truman Capote - 1965 - hardcover - Stated first printing - no DJ,70.0,2020-10-15 00:00:00
"Modern Library 100 Best Nonfiction; In Cold Blood by Truman Capote (HC, 2002) RH",9.99,2020-10-15 00:00:00
"In Cold Blood (DVD, 1967) ROBERT BLAKE",41.75,2020-10-15 00:00:00
"Vintage International Ser.: In Cold Blood by Truman Capote (1994, Trade...",5.25,2020-10-15 00:00:00
In Cold Blood DVD ) Truman Capote R4 Australian Release Robert Blake,10.97,2020-10-15 00:00:00
In Cold Blood by Truman Capote Internatioanl Collector's Library,14.95,2020-10-16 00:00:00
IN COLD BLOOD FIRST edition FIRST Printing TRUMAN CAPOTE 1965 DJ HB 1st HARDBACK,10.0,2020-10-16 00:00:00
In Cold Blood  (NoDust) by Truman Capote 1993,46.5,2020-10-18 00:00:00
"Taught In Cold Blood (DVD, 2014) Usually ships within 12 hours!!!",43.49,2020-10-18 00:00:00
"In Cold Blood (DVD, 2004)",38.45,2020-10-18 00:00:00
"In Cold Blood , Truman Capote",38.69,2020-10-19 00:00:00
"NEWSWEEK Magazine January 24 1966 Author TRUMAN CAPOTE ""In Cold Blood""",8.99,2020-10-20 00:00:00
"Capote, In Cold Blood Double Feature Blu Ray, Lot H4. ",52.99,2020-10-20 00:00:00
Vintage 'In Cold Blood' Hackback Book Truman Capote with Dust Jacket 1965 ,38.95,2020-10-20 00:00:00
In Cold Blood Truman Capote Book Club Edition 1965 Hardcover Dust Jacket First,75.0,2020-10-20 00:00:00
In Cold Blood/Capote/Biography/Crime/Drama/Robert Blake/Philip Seymour Hoffman!!,14.99,2020-10-20 00:00:00
"In Cold Blood (DVD, 2003) Robert Blake FREE SHIPPING",7.5,2020-10-21 00:00:00
"In Cold Blood (DVD, 2003) Scott Wilson, Robert Blake, John Forsythe",12.99,2020-10-21 00:00:00
Truman Capote In Cold Blood ,6.77,2020-10-21 00:00:00
1965 IN COLD BLOOD Truman Capote FIRST EDITION FIRST PRINTING SIGNED,875.0,2020-10-22 00:00:00
In Cold Blood ~ CAPOTE ~ Easton Press ~ Great Books of the 20th Centuryk,125.5,2020-10-22 00:00:00
In Cold Blood by Truman Capote 1965 Hardcover 1st Edition 1st Printing,14.99,2020-10-22 00:00:00
RARE Saturday Review January 22 1966 Truman Capote In Cold Blood Alfred Balk,36.05,2020-10-22 00:00:00
1965 IN COLD BLOOD Hardcover by Truman Capote 1st Edition/1st Printing,54.99,2020-10-23 00:00:00
"""In Cold Blood"" by Truman Capote, 1st Edition 1st Printing",86.0,2020-10-23 00:00:00
In Cold Blood By Truman Capote 1965 Hardcover Book,49.0,2020-10-23 00:00:00
In Cold Blood By Truman Capote Paperback Great Condition,38.5,2020-10-23 00:00:00
Johnny Thunders: In Cold Blood/ Nina Antonia - First Edition 1st /1st  Rare Punk,111.51,2020-10-24 00:00:00
D&D D20 WOTC Campaigns Legacy of the Green Regent In Cold Blood,30.0,2020-10-24 00:00:00
In Cold Blood - Truman Capote - 1st Printing / 1st Edition - Book Club Edition? ,110.95,2020-10-24 00:00:00
In Cold Blood - Truman Capote 2011  Folio Society,52.2,2020-10-25 00:00:00
"In Cold Blood by Truman Capote , Paperback",43.87,2020-10-25 00:00:00
In Cold Blood Complete Black Label Sony PlayStation 1 Pal ,8.07,2020-10-25 00:00:00
In Cold Blood DVD,6.22,2020-10-25 00:00:00
In Cold Blood [Region 2] - Dutch Import DVD NEW,11.49,2020-10-25 00:00:00
Vintage Book - In Cold Blood By Truman Capote - c1965 - A Signet Book,43.0,2020-10-26 00:00:00
In Cold Blood PS1 Playstation One Platinum Video Game PAL Complete Manual,29.72,2020-10-26 00:00:00
"In Cold Blood (1967) DVD R0 - Robert Blake, John Forsythe, Classic Murder Drama",18.56,2020-10-26 00:00:00
"Truman Capote ""In Cold Blood"" 1965 BCE HC/DJ ",58.99,2020-10-26 00:00:00
playstation 1 ps1 in cold blood the discs are perfect no scratches or marks,22.16,2020-10-26 00:00:00
IN COLD BLOOD --- (DVD),11.31,2020-10-26 00:00:00
"In Cold Blood by Truman Capote 5th Printing (1965, Hardcover)",13.99,2020-10-26 00:00:00
Malevolent Creation  - In Cold Blood  - CD  - Limited Edition ,25.01,2020-10-26 00:00:00
"Vintage International Ser.: In Cold Blood by Truman Capote (1994, Trade...",2.6,2020-10-27 00:00:00
"Johnny Thunders, In Cold Blood 2X's VINYL (VG) NEW ROSE, COVER GOOD READ DESC.",62.99,2020-10-27 00:00:00
In Cold Blood By Truman Capote 1965 Book Club 1st Edition 1st Printing with DJ,50.0,2020-10-27 00:00:00
"In Cold Blood (DVD, 2013)",8.0,2020-10-28 00:00:00
In Cold Blood -Truman Capote,25.0,2020-10-28 00:00:00
"twinings Cold Infuse Tea Bags Packed In Bottle Jar Passion fruit,mango & Blood",8.99,2020-10-28 00:00:00
"In Cold Blood, Truman Capote, 1965, 5th Printing, HC/DJ",55.0,2020-10-28 00:00:00
"In Cold Blood DVD Region All New & Sealed Truman Capote, Robert Blake",22.66,2020-10-28 00:00:00
"In Cold Blood (DVD, 2003)",5.0,2020-10-28 00:00:00
>> time crisis // Playstation 1-Platinum - // VERY GOOD CONDITION! <<,9.76,2020-10-28 00:00:00
Truman Capote In Cold Blood Penguin Books Paperback 1966 True Crime Classic,23.0,2020-10-29 00:00:00
In Cold Blood by Truman Capote (Paperback),10.25,2020-10-29 00:00:00
LIFE Magazine May 12 1967 5/12/67 Truman Capote In Cold Blood Rudolf Nureyev ,48.7,2020-10-29 00:00:00
"In Cold Blood by Truman Capote, First Edition/Sixth Print (1965, Random House)",54.0,2020-10-29 00:00:00
1965 IN COLD BLOOD TRUMAN CAPOTE TRUE CRIME CLASSIC MOVIE BASIS FIRST EDITION,85.99,2020-10-30 00:00:00
"In Cold Blood , Truman Capote",38.69,2020-10-30 00:00:00
IN COLD BLOOD SOUNDTRACK QUINCY JONES ON COLGEMS  RECORDS,52.15,2020-10-31 00:00:00
Truman Capote In Cold Blood Modern Library Edition HC,47.0,2020-10-31 00:00:00
IN COLD BLOOD by TRUMAN CAPOTE - FIRST EDITION - FIRST PRINTING in DUST JACKET,111.0,2020-10-31 00:00:00
In Cold Blood,14.92,2020-11-01 00:00:00
"Vintage International Ser.: In Cold Blood by Truman Capote (1994, Trade...",2.2,2020-11-01 00:00:00
In Cold Blood Complete In Box Playstation PS1,53.95,2020-11-02 00:00:00
"In Cold Blood (VHS, 1998) oop",38.72,2020-11-02 00:00:00
Kapka´s Flava The Barber alle Sorten 50ml Liquid in 60ml Flasche Premium Liquid ,15.87,2020-11-02 00:00:00
In Cold Blood Boxed And Complete Sony PlayStation 1 PS1 Game,26.02,2020-11-02 00:00:00
In Cold Blood For The Ps1 Complete Black Label Mint Disks,22.66,2020-11-03 00:00:00
"Vintage International Ser.: In Cold Blood by Truman Capote (1994, Trade...",2.6,2020-11-03 00:00:00
"In Cold Blood , Truman Capote",38.69,2020-11-04 00:00:00
Johnny Thunders: In Cold Blood/ Nina Antonia - First Edition 1st /1st  Rare Punk,66.32,2020-11-04 00:00:00
"Vintage International Ser.: In Cold Blood by Truman Capote (1994, Trade...",1.0,2020-11-05 00:00:00
"In Cold Blood by Truman Capote (Paperback, 2008) Popular Penguins",5.29,2020-11-05 00:00:00
In Cold Blood by Truman Capote.  Vintage International trade paperback 1994,4.0,2020-11-05 00:00:00
First edition IN COLD BLOOD best seller 1965 TRUMAN CAPOTE hardcover jacket NF,38.08,2020-11-06 00:00:00
In cold blood truman capote,9.0,2020-11-06 00:00:00
Truman CAPOTE Widescreen DVD Philip Seymour Hoffman IN COLD BLOOD Sealed/New,39.99,2020-11-07 00:00:00
"In Cold Blood , Truman Capote",38.69,2020-11-07 00:00:00
COLD PLAY - A SUDDEN RUSH OF BLOOD TO THE HEAD & PARACHUTES both cds in VGC ,27.69,2020-11-08 00:00:00
Audiobook In Cold Blood,9.0,2020-11-08 00:00:00
In Cold Blood PS1 With Manual /Pal Complete 2-Disc Set ,15.13,2020-11-08 00:00:00
In Cold Blood  By  Truman Capote  1965 1st Printing.,76.99,2020-11-08 00:00:00
In Cold Blood By Truman Capote 1966 1st UK Edition fantastic condition,115.39,2020-11-08 00:00:00
In Cold Blood by Truman Capote (English) Hardcover Book Free Shipping!,36.62,2020-11-09 00:00:00
"Blood Cold:: Fame, Sex, and Murder in Hollywood [Onyx True Crime] , McDougal, De",44.85,2020-11-09 00:00:00
"Vintage International Ser.: In Cold Blood by Truman Capote (1994, Trade...",37.5,2020-11-11 00:00:00
5 x Playstation 1 PS1 Games Bundle - In Cold Blood/Spec Ops/Fade To Black/Colony,59.09,2020-11-11 00:00:00
ATAR Notes Text Guide: In Cold Blood,12.86,2020-11-11 00:00:00
In Cold Blood By Truman Capote 1st Edition 1st Printing Hardcover No DJ Vintage,59.97,2020-11-13 00:00:00
Truman Capote's IN COLD BLOOD The COMPLETE MINI-SERIES (1996) Sam Neill SEALED,29.98,2020-11-13 00:00:00
"In Cold Blood (DVD, 2003) Richard Brooks Robert Blake Scott Wilson Truman Capote",46.49,2020-11-13 00:00:00
"In Cold Blood (DVD, 2003) Robert Blake,John Forsythe B602",43.74,2020-11-13 00:00:00
IN COLD BLOOD ROBERT BLAKE DVD BRAND NEW SEALED,43.99,2020-11-13 00:00:00
PlayStation 1 PS1 Games £4.99 MULTI-BUY DISCOUNT££,26.71,2020-11-13 00:00:00
In Cold Blood Truman Capote 1965 Book Club Edition HC/DJ Random House,59.0,2020-11-13 00:00:00
ROBERT BLAKE SIGNED BOOK - IN COLD BLOOD - NOT INSCRIBED - W/ PHOTO SIGNING,125.0,2020-11-13 00:00:00
"Vintage International Ser.: In Cold Blood by Truman Capote (1994, Trade Paperba…",5.6,2020-11-13 00:00:00
1965 1st Ed. / IN COLD BLOOD  / Capote / DJ,90.0,2020-11-13 00:00:00
Truman CAPOTE Widescreen DVD Philip Seymour Hoffman IN COLD BLOOD ,36.99,2020-11-13 00:00:00
In Cold Blood [Region 2] - Dutch Import DVD NEW,11.41,2020-11-13 00:00:00
1965 IN COLD BLOOD TRUMAN CAPOTE TRUE CRIME CLASSIC MOVIE BASIS FIRST EDITION,85.99,2020-11-14 00:00:00
"In Cold Blood by Truman Capote (1994, Paperback)",4.0,2020-11-14 00:00:00
In Cold Blood 7th printing. Truman Capote 1965,54.0,2020-11-14 00:00:00
"Vintage International Series: In Cold Blood by Truman Capote (1994, hardcover)",2.5,2020-11-14 00:00:00
In Cold Blood HC Book Truman Capote 1965 1ST PRINTING Murder,40.45,2020-11-15 00:00:00
LIFE May 12 1967 vintage magazine IN COLD BLOOD TRUMAN CAPOTE,4.75,2020-11-15 00:00:00
Vtg 1965 1st/3rd Hardcover with Dust Jacket In Cold Blood by Truman Capote,62.72,2020-11-15 00:00:00
"Vintage International Ser.: In Cold Blood by Truman Capote (1994, Trade...",38.6,2020-11-15 00:00:00
In Cold Blood by Truman Capote,37.99,2020-11-15 00:00:00
Truman Capote ~ In Cold Blood ~ BCE ~ 1965 ~ HC/DJ Random House,57.0,2020-11-16 00:00:00
"FOLIO BOOK ""IN COLD BLOOD"" TRUMAN CAPOTE  2011 EXCELLENT",33.61,2020-11-16 00:00:00
Johnny Thunders Book 1987 In Cold Blood,118.0,2020-11-17 00:00:00
In Cold Blood by Truman Capote FIRST PRINTING 1965,25.0,2020-11-17 00:00:00
In Cold Blood - Truman Capote - Criterion Collection -  2 Disc DVD - Excellent!,53.98,2020-11-17 00:00:00
