title,price,date
Charlotte Bronte - Jane Eyre  with etchings by Fritz Eichenberg,16.28,2020-08-15 00:00:00
G.B Presentation Pack “Jane Eyre” Pk No.369 24/02/05,6.88,2020-08-15 00:00:00
Jane Eyre & Wuthering Heights Box Set Charlotte/Emily Bronte 1943 Random House,52.8,2020-08-15 00:00:00
The Bronte Sisters Three Novels: Jane Eyre - Wuthering Heights - Agnes Grey by C,24.39,2020-08-14 00:00:00
 A&E JANE EYRE  DVD BY CHARLOTTE BRONTE'S FAMILY NIGHT VIEWING CLEAN FUN,5.79,2020-08-14 00:00:00
"Progeny Press ""Jane Eyre Study Guide"" Very Good Condition Wilson Gr. 9-12",9.8,2020-08-13 00:00:00
2005 Jane Eyre Royal Mail FDC Lowton Warrington CDS,7.33,2020-08-13 00:00:00
"JANE EYRE by CHARLOTTE BRONTE, EASTON PRESS",22.36,2020-08-13 00:00:00
Beautiful Vintage Jane Eyre Charlotte Bronte Book 1946 with Colour Illustrations,56.87,2020-08-13 00:00:00
CHANDOS CHAN 9983 RAFFERTY ~ BERKELEY ~ JANE EYRE,11.42,2020-08-13 00:00:00
Jane Eyre - 1996 Film Version (DVD),11.2,2020-08-12 00:00:00
"Jane Eyre (De Luxe Classics) by Bronte, Charlotte,  Purnell Pub. 1976",18.28,2020-08-12 00:00:00
Jane Eyre A & E,6.4,2020-08-12 00:00:00
JANE EYRE DVD,3.26,2020-08-11 00:00:00
"Jane Eyre (DVD, 2011)",6.5,2020-08-10 00:00:00
Les Miserables Jane Eyre Little Women Book Set Modern Binding English,15.5,2020-08-10 00:00:00
Classics Illustrated #39 Jane Eyre Golden Age 1947 1st Edition,7.34,2020-08-09 00:00:00
Twilight Time Jane Eyre Blu-Ray Orson Welles,56.0,2020-08-09 00:00:00
"Jane Eyre, Charlotte Bronte, Franklin Library 100 Greatest Books",43.24,2020-08-09 00:00:00
Jane Eyre by Charlotte Brontë (Fourth Norton Critical Edition) Paperback,13.4,2020-08-09 00:00:00
" GULLIVERS TRAVELS, INGOLDSBY LEGENDS, JANE EYRE, WUTHERING HEIGHTS, AGNES GREY",50.34,2020-08-09 00:00:00
1943 BOOK JANE EYRE BY CHAROLETTE BRONTE WOOD ENGRAVINGS BY FRITZ EICHENBURG,14.89,2020-08-09 00:00:00
"The Bronte Collection (DVD, 2009, 3-Disc Set)-Jane Eyre, Wuthering Heights +",12.44,2020-08-09 00:00:00
GB STAMPS MINI SHEET FIRST DAY COVER 2005 JANE EYRE RARES COLLECTION,5.23,2020-08-09 00:00:00
Two volumes of the heritage series Bronte sisters Jane Eyre and Wuthering height,14.97,2020-08-07 00:00:00
Wuthering Heights and Jane Eyre: Two Volume Box Set with Slip Case,25.0,2020-08-07 00:00:00
JANE EYRE by Charlotte Bronte  Easton Press Leather 100 GREATEST BOOKS EVER,27.34,2020-08-07 00:00:00
Bronte Sisters: Wuthering Heights & Jane Eyre - Longmeadow Press 4th Print 1984,8.33,2020-08-06 00:00:00
"Jane Eyre by Charlotte Bronte, 1886",64.33,2020-08-06 00:00:00
New Jane Eyre silver plated birdcage chain necklace Literary Emporium,30.8,2020-08-06 00:00:00
JANE EYRE BRONTE  HC,11.98,2020-08-05 00:00:00
1943 Jane Eyre by Charlotte Bronte with Fritz Eichenberg Engraving Art HC Random,14.99,2020-08-05 00:00:00
GB STAMPS FIRST DAY COVER 2005 JANE EYRE UNADDRESSED RARES COLLECTION,5.77,2020-08-05 00:00:00
Vintage Jane Eyre 1950 Nelson Doubleday & Daphne du Maurier The Kings General,9.61,2020-08-04 00:00:00
Charlotte Bronte Jane Eyre,5.85,2020-08-04 00:00:00
 JOHN WILLIAMS   JANE EYRE   SIGNED LP,95.68,2020-08-04 00:00:00
"Jane Eyre (DVD, 2007, 2-Disc Set)",30.8,2020-08-03 00:00:00
"Jane Eyre by Charlotte Brontë (2008, Signet Classic)",3.99,2020-08-03 00:00:00
GB STAMPS FIRST DAY COVER 2005 JANE EYRE PRESTIGE BOOK COLLECTION,9.4,2020-08-03 00:00:00
Easton Press JANE EYRE Charlotte Bronte Leather Bound Collectors Edition CLASSIC,31.99,2020-08-02 00:00:00
JANE EYRE & WUTHERING HEIGHTS By CHARLOTTE/EMILY BRONTE SET 1943,22.38,2020-08-02 00:00:00
jane eyre hardcover 1943 Random House Engravings by Fritz Eichenberg,10.79,2020-08-02 00:00:00
"Jane Eyre by Charlotte Brontë (Mass Market, Reprint)",3.3,2020-08-01 00:00:00
Jane Eyre By Charlotte Bronte-Dover Thrift Ed.  Paperback book,6.08,2020-08-01 00:00:00
"Jane Eyre ( DVD, 2007, 2-Disc Set ) Rare  - Masterpiece Theatre - Out of Print ",20.5,2020-07-31 00:00:00
"Jane Eyre by Charlotte Brontë (UK-B Format Paperback, Revised edition)",5.1,2020-07-31 00:00:00
JANE EYRE---PENQUIN ORANGE BOOK,47.82,2020-07-31 00:00:00
Jane Eyre Bronte 1890 T.Y. Crowell,13.32,2020-07-31 00:00:00
Jane Eyre by Charlotte Bronte - Airmont Classic - CL17 - 1963,7.24,2020-07-31 00:00:00
Norton Critical Edition Jane Eyre Charlotte Brontë Paperback,6.33,2020-07-30 00:00:00
2 x Emily Charlotte Bronte Wuthering Heights Jane Eyre Nelson Doubleday New York,50.01,2020-07-30 00:00:00
JANE EYRE Charlotte Bronte 1943 Random House Art by Fritz Eichenberg,27.51,2020-07-30 00:00:00
Jane Eyre By Charlotte Bronte,6.92,2020-07-29 00:00:00
JANE EYRE CHARLOTTE BRONTE  Vintage BOOK COLLECTOR,6.32,2020-07-29 00:00:00
JANE EYRE EASTON PRESS 1978 CHARLOTTE BRONTE RED LEATHER BOUND BOOK COLLECTOR,32.0,2020-07-28 00:00:00
"2 HB Books, 1944 Wuthering Heights, Jane Eyre, Fritz Eichenberg Woodcuts",24.38,2020-07-27 00:00:00
1920 BRONTË SISTERS Life Works 7 Vols Jane Eyre Shirley Wuthering Heights Plates,168.54,2020-07-27 00:00:00
PEGGY ANN GARNER - BATMAN - JANE EYRE (1943) - A TREE GROWS IN BROOKLYN -,37.5,2020-07-26 00:00:00
CLASSICS ILLUSTRATED #39 JANE EYRE    (HRN 154) VG CONDITION,6.95,2020-07-26 00:00:00
CLASSICS ILLUSTRATED #39 JANE EYRE    (HRN 118) VG CONDITION,13.0,2020-07-26 00:00:00
"The Collectors Library of Classics lot of 7,RED BADGE OF COURAGE, JANE EYRE,WILD",35.92,2020-07-26 00:00:00
"dvd lot - Pride and Prejudice, Becoming Jane, Jane eyre",12.33,2020-07-24 00:00:00
Jane Eyre & Wuthering Heights Set 1943 Random House Charlotte Bronte,24.92,2020-07-24 00:00:00
"Jane Eyre (DVD, 2007, 2-Disc Set)",13.4,2020-07-24 00:00:00
ANTIQUE - JANE EYRE - CHARLOTTE BRONTE - 1898 - GEORGE NEWNES BOOK,70.46,2020-07-24 00:00:00
Vintage Lot Classics Illustrated Comic Books (7) JANE EYRE DAVID COPPERFIELD++++,14.99,2020-07-23 00:00:00
Jane Eyre & Wuthering Heights Set 1943 Random House Charlotte Bronte,30.89,2020-07-23 00:00:00
Jane Eyre Charlotte Bronte The Easton Press 1978 Greatest Books Ever Written,31.39,2020-07-23 00:00:00
2 Vtg 1943 - JANE EYRE by Charlotte Bronte & WUTHERING HEIGHTS by Emily. Bronte,26.36,2020-07-23 00:00:00
"Jane Eyre (DVD, 2007, 2-Disc Set)",18.5,2020-07-23 00:00:00
"Jane Eyre (DVD, 2006, 2-Disc Set) Masterpiece Theater",17.99,2020-07-22 00:00:00
1950s Edition- Jane Eyre - Charlotte Bronte ,44.66,2020-07-22 00:00:00
"Jane Eyre By Charlotte Bronte.  Hardcover book, gently used. ",6.38,2020-07-22 00:00:00
"Classics Illustrated 37,37,39 *3 Books* The Pioneers! Jane Eyre! Brontë!",8.49,2020-07-21 00:00:00
"Jane Eyre - Charlotte Bronte, Hardback, C1980+ - Heron Books.",43.83,2020-07-21 00:00:00
Easton Press leather bound gold gilt book Jane Eyre 1978 Charlotte Bronte,30.95,2020-07-20 00:00:00
"Jane Eyre (Barnes & Noble Classics) by Bronte, Charlotte NEW",8.0,2020-07-20 00:00:00
"Bantam Classics: Jane Eyre by Charlotte Brontë (1983, Paperback, Reprint)",3.79,2020-07-20 00:00:00
THE SECRET HISTORY OF JANE EYRE BY JOHN PFORDRESHER (2020) ARC SOFTCOVER ,9.98,2020-07-20 00:00:00
Jane Eyre Charlotte Bronte Easton Press 100 Greatest Leather Collectors Edition,32.85,2020-07-20 00:00:00
"Jane Eyre, Classic Movie Collection",7.2,2020-07-19 00:00:00
Norton Critical Editions Ser.: Jane Eyre by Richard J. Dunn and Charlotte Brontë,4.32,2020-07-19 00:00:00
Jane Eyre by Charlotte Bronte 2nd Edition Antique (box c),19.32,2020-07-19 00:00:00
JANE EYRE OST John Williams  SILVA SCREEN CD 1999,20.97,2020-07-19 00:00:00
Jane Eyre by Charlotte Bronte. 1930s. Hardback Book. Odhams Press Edition.,51.1,2020-07-19 00:00:00
2013 JANE EYRE USED SET.,5.24,2020-07-19 00:00:00
Vtg Set 2 Books Random House Wuthering Heights Jane Eyre Bronte Eichenberg 1943,28.41,2020-07-18 00:00:00
GB STAMP FIRST DAY COVER 2005 JANE EYRE MINI SHEET RARE UNADDRESSED,12.46,2020-07-18 00:00:00
"Jane Eyre, Withering Heights, Charlotte Bronte, Random House 1943, 2 Vol Set",30.39,2020-07-17 00:00:00
Scarce Franklin Mint Charlotte Bronte's 'Jane Eyre' Porcelain Figurine - Perfect,86.22,2020-07-17 00:00:00
"Jane Eyre ( DVD, 2007, 2-Disc Set ) rare Masterpiece Theatre ",24.0,2020-07-16 00:00:00
"Jane Eyre [Original Broadway Cast] by Original Broadway Cast (CD, Nov-2000)",5.79,2020-07-16 00:00:00
"Jane Eyre (VHS, 1995, 2-Tape Set)",0.66,2020-07-16 00:00:00
Jane Eyre (Norton Critical Editions) by Charlotte Brontë,13.28,2020-07-16 00:00:00
Caxton  Edition Jane Eyre 2nd Edition (Currer Bell) Book -1847,24.83,2020-07-15 00:00:00
2005 Jane Eyre Prestige Booklet set of 4 panes Stampex special H/S,6.02,2020-07-15 00:00:00
Jane Eyre Wuthering Heights Charlotte & Emily Bronte Random House Book Lot of 2,45.39,2020-07-15 00:00:00
JANE EYRE DVD,3.74,2020-07-15 00:00:00
XC13579 Great Britain 2005 Jane Eyre definitives Elizabeth II FDC's used,6.42,2020-07-15 00:00:00
1943 BOOK JANE EYRE BY CHAROLETTE BRONTE WOOD ENGRAVINGS BY FRITZ EICHENBURG,34.39,2020-07-14 00:00:00
1943 Random House Jane Eyre with Wood Engravings by Fritz Eichenberg,21.32,2020-07-14 00:00:00
STAMPS SOUVENIR FIRST DAY COVER JANE EYRE WITH MINT SUPERB 50P COIN,13.76,2020-07-14 00:00:00
GB 2005 Commemorative Stamps Jane Eyre MNH,25.41,2020-07-13 00:00:00
Great Britain Presentation Pack-Jane Eyre -Face Value £4+,9.83,2020-07-13 00:00:00
1896 Paperback “Jane Eyre” By Charlotte Bronte -Antique Book F.M. Lupton Publish,23.85,2020-07-13 00:00:00
"2005 GB, 'Jane Eyre', Royal Mail Stamps Presentation Pack (No.369)",33.94,2020-07-13 00:00:00
Jane Eyre Hardback book by Charlotte Bronte,43.89,2020-07-12 00:00:00
Jane Eyre - DVD - with Timothy Dalton VERY GOOD,7.3,2020-07-10 00:00:00
GB 2005 Jane Eyre PHQ cards unused,6.16,2020-07-10 00:00:00
"A&E Literary Classics The Romance Collection (DVD, 14-Disc Set, Special Edition)",47.49,2020-07-09 00:00:00
"Jane Eyre (1970) George C. Scott, Susannah York, Jean Marsh DVD",3.51,2020-07-09 00:00:00
Long meadow press bronte sisters wuthering and jane eyre leather hardcover,9.0,2020-07-09 00:00:00
Vintage JANE EYRE Charlotte Bronte HARDBACK in Slipcase - Pub. by Collins - M13,28.86,2020-07-08 00:00:00
"""Jane Eyre"" by Charlotte Bronte Wood Engraving Eichenberg Random House 1943",13.32,2020-07-08 00:00:00
Rare 2vol set 1890 Jane Eyre by CHARLOTTE BRONTE Limited Edition 250 Books made ,111.99,2020-07-07 00:00:00
John Williams - Jane Eyre New CD Sealed ,12.79,2020-07-07 00:00:00
Jane Eyre Charlotte Bronte 1946 Rainbow Classics The World Publishing Company,18.33,2020-07-07 00:00:00
Easton Press JANE EYRE Charlotte Bronte Leather 100 Greatest Books NICE,26.5,2020-07-06 00:00:00
"Jane Eyre (DVD, 2007, 2-Disc Set)",28.5,2020-07-06 00:00:00
Jane Eyre By Charlotte Brontë,4.3,2020-07-06 00:00:00
Jane Eyre by Charlotte Bronte World's Best Reading Reader's Digest,5.03,2020-07-06 00:00:00
3 Books Illustrated Junior Library lot Jane Eyre Little Women Pride & Prejudice,30.0,2020-07-06 00:00:00
JANE EYRE EASTON PRESS 1978 CHARLOTTE BRONTE RED LEATHER BOUND BOOK COLLECTOR,26.49,2020-07-06 00:00:00
2005 Benham Jane Eyre FDC Stamp Card Charlotte Bronte Haworth Keighley SHS    ,9.11,2020-07-05 00:00:00
BRONTE BOX SET of 2 Books - Random House - 1943 (Jane Eyre/Wuthering Heights),33.44,2020-07-05 00:00:00
Great Britain Presentation Pack-Jane Eyre -Face Value £4+,7.63,2020-07-05 00:00:00
1943 boxed edition of Jane Eyre and Wurtherheights by Charlotte/ Emily Bronte,103.36,2020-07-05 00:00:00
Vintage Collins book The Pickwick Papers Charles Dickens Illustrated  Jane Eyre ,43.83,2020-07-05 00:00:00
2005 JANE EYRE FDC SIGNED BY JILL COOPER/JOANNE TROLLOPE LTD 300,18.33,2020-07-05 00:00:00
"Lot of 7~ BABYLIT Board Books: Frankenstein Oz, Jane Eyre, Romeo & Juliet, Pride",14.38,2020-07-04 00:00:00
"Jane Eyre by Charlotte Brontë (2010, Hardcover) White’s Fine Edition",140.83,2020-07-04 00:00:00
CLASSICAL ALBUM CHARLOTTE BRONTE'S JANE EYRE,4.19,2020-07-04 00:00:00
"Charlotte Bronte's Jane Eyre (DVD, 1999)",7.79,2020-07-03 00:00:00
"Easton Press Leather 100 Greatest Books,Jane Eyre by Charlotte Bronte",32.0,2020-07-03 00:00:00
A&E Jane Eyre (Charlotte Bronte) and Persuasion (Jane Austen) with Ciaran Hinds,16.94,2020-07-03 00:00:00
Jane Eyre DVD Brand New Sealed Timothy Dalton Rare Htf Oop BBC,16.98,2020-07-03 00:00:00
GB STAMPS PRESTIGE BOOK FIRST DAY COVER 2005 JANE EYRE COTSWOLD COLLECTION,22.94,2020-07-02 00:00:00
Jane eyre . Brontë. 1848. 492 pages. Hardback.,49.55,2020-07-01 00:00:00
Jane Eyre Charlotte Bronte The Franklin Library,52.7,2020-06-30 00:00:00
Jane Eyre: With Connections by Charlotte Bronte (Hrw Library) Hardcover,8.33,2020-06-29 00:00:00
"Jane Eyre 1943 20th Century Fox 11x14"" title card Orson Welles Joian Fontaine",135.5,2020-06-29 00:00:00
Jane Eyre Charlotte Bronte early 1900 hardcover w/preface,13.99,2020-06-29 00:00:00
Madame Alexander Jane Eyre collectible doll (MA#45920) w/cert.--MINT in box,430.16,2020-06-29 00:00:00
Jane Eyre by Charlotte Bronte Leather Bound Collectible Deluxe Edition Very Good,14.36,2020-06-29 00:00:00
"Jane Eyre & Wuthering Heights Box Set Charlotte Bronte 1943 Random House, Used",14.92,2020-06-29 00:00:00
Jane Eyre Hardcover 1931,10.83,2020-06-29 00:00:00
Jane Eyre - Charlotte Bronte 1950 Everyman's Library | Ravilious Era | Book,16.37,2020-06-29 00:00:00
"CHARLOTTE BRONTE BY JANE EYRE, 1946",46.51,2020-06-29 00:00:00
JANE EYRE By Charlotte Bronte - Limited Edition - Easton Press,37.0,2020-06-28 00:00:00
50 PLAYS *Inc FRANKENSTEIN & JANE EYRE* COLLECTION Dicks’ Standard Plays 19th C,302.73,2020-06-28 00:00:00
"Jane Eyre By Charlotte Bronte Ilustrated By Edmund H Garrett, Antique Book",95.77,2020-06-28 00:00:00
Jane Eyre  Charlotte Bronte Franklin Collectors Library Worlds Best Loved Books,25.46,2020-06-28 00:00:00
Jane Eyre Arlington Edition 1900’s By Charles Bronte W.M Thackeray,18.3,2020-06-27 00:00:00
Jane Eyre by Charlotte Bronte World's Best Reading Reader's Digest,7.78,2020-06-27 00:00:00
Jane Eyre By Charlotte Bronte W Nicholson 1900 London Edition Old Antique,19.63,2020-06-26 00:00:00
"Jane Eyre (DVD, 2007, 2-Disc Set)",10.79,2020-06-26 00:00:00
"Jane Eyre, Bronte Easton Press Sealed",36.0,2020-06-26 00:00:00
Total Language Plus Study Guide Jane Eyre Gr 9-12,7.79,2020-06-26 00:00:00
Jane Eyre By Charlotte Bronte Phq Cards,35.78,2020-06-26 00:00:00
"Jane Eyre (DVD, 2011, Widescreen) Mia Wasikowska, Michael Fassbender, Judi Dench",5.99,2020-06-25 00:00:00
Vintage Bronte Sisters Book set - 1944-JANE EYRE & WUTHERING HEIGHTS,42.39,2020-06-25 00:00:00
ATONEMENT  PRIDE  PREJUDICE  JANE EYRE  ELIZABETH FOUR FEATURE FILMS DVD,5.5,2020-06-25 00:00:00
Vintage Jane Eyre With Dust Jacket,5.99,2020-06-25 00:00:00
Jane eyre hardcover,14.89,2020-06-25 00:00:00
Jane Eyre by Charlotte Bronte Book,17.9,2020-06-24 00:00:00
Treasury Of World Masterpieces 2 Hardback Books Jane Eyre & Jane Austen #444,52.33,2020-06-24 00:00:00
Jane Eyre Charlotte Bronte Literary Classics Book Club VG+ w/ Dust Jacket,6.97,2020-06-24 00:00:00
Easton Press Jane Eyre Bronte 1978 First Edition Leather & Gold Collector's Ed,42.0,2020-06-23 00:00:00
Jane Eyre BBC Series DVD Timothy Dalton 1983 Miniseries MINT,11.3,2020-06-23 00:00:00
2005 Jane Eyre by Charlotte Bronte - Haworth SPMK FDC,6.55,2020-06-23 00:00:00
"Treasury of Illustrated Classics:Moby Dick,Jane Eyre,Robinson Crusoe,King Arthur",9.39,2020-06-22 00:00:00
"GB BELOW FACE 2005 Charlotte Bronte, Jane Eyre, set of 6, MNH / UNM",7.34,2020-06-22 00:00:00
"Jane Eyre by Charlotte Bronte (Art-Type Edition, The World's Popular Classics)",12.79,2020-06-22 00:00:00
Great Britain Presentation Pack-Jane Eyre -Face Value £4+,8.19,2020-06-21 00:00:00
"Jane Eyre, by C. Bronte, Lithographs by Barnett Freedman, 1st UK ed thus 1955",85.09,2020-06-21 00:00:00
GB STAMPS FIRST DAY COVER 2005 JANE EYRE HAWORTH KEIGHLEY RARES COLLECTION ,8.79,2020-06-21 00:00:00
"3 x Bronte Sisters Leather Bound Folio Society Books 1960s Jane Eyre, Villette ",78.22,2020-06-20 00:00:00
Photo - Joan Fontaine and Peggy Ann Garner on the set of Jane Eyre,25.09,2020-06-20 00:00:00
Jane Eyre Charlotte Bronte Franklin Library 100 Greatest Leather Limited Edition,29.86,2020-06-19 00:00:00
"Pride and Prejudice + Jane Eyre + Little Women, The Easton Press, Hardback",90.05,2020-06-18 00:00:00
 Jane Eyre (DVD 2007 2-Disc)  Ruth Wilson BBC/Masterpiece Theatre BRAND NEW/RARE,38.0,2020-06-18 00:00:00
STAMPS SOUVENIR FIRST DAY COVER JANE EYRE WITH MINT SUPERB 50P COIN,12.46,2020-06-18 00:00:00
"VINTAGE 1946 JANE EYRE/WUTHERING HEIGHTS, hard cover Library Edition",15.83,2020-06-16 00:00:00
"""Jane Eyre"", from the Franklin Library (1981), by Charlotte Bronte, BEAUTIFUL!",16.36,2020-06-16 00:00:00
3 Etchings 2 Of Jane Eyre 1 Signed Blanche Dillaye Gatehead Hall By E Mattack,57.14,2020-06-16 00:00:00
Lot of old books,48.5,2020-06-15 00:00:00
Jane Eyre Charlotte Bronte illustrations by Fritz Eichenberg Hardcover,10.36,2020-06-15 00:00:00
"Jane Eyre by Charlotte Bronte (2014, Artfolds No. 4 ""Read"" Hardcover)",7.5,2020-06-15 00:00:00
LOT DVDs New & Used Jane Eyre Pride & Prejudice Downton Abbey Atonement MORE,6.4,2020-06-15 00:00:00
Jane Eyre Charlotte Bronte Easton Press 100 Greatest Leather Collectors Edition,38.86,2020-06-15 00:00:00
Classics Illustrated #39 (Original Edition) (Jane Eyre) Golden Age 1947 VG+,47.0,2020-06-14 00:00:00
Jane Eyre Charlotte Bronte Easton Press Gilt Leather Bound Hard Cover Book LHL,54.0,2020-06-14 00:00:00
"Barnes and Noble Classics: Jane Eyre by Charlotte Brontë and Oscar Wilde (2003,",4.7,2020-06-14 00:00:00
Jane Eyre by Charlotte  Bronte 1943  With Wood Engravings ,17.36,2020-06-14 00:00:00
Hard cover Jane Eyre by Charlotte Bronte and Wuthering Heights by Emily Bronte,6.83,2020-06-12 00:00:00
Jane Eyre Broadway Playbill Program Musical Partial OBC NYC February 2001,4.95,2020-06-12 00:00:00
"Jane Eyre (DVD, 2011) - Includes the cover and DVD, the case is not included.",3.25,2020-06-12 00:00:00
Jane Eyre - Orson Welles - Joan Fontaine (DVD) - Combined Shipping discount,8.25,2020-06-12 00:00:00
Jane Eyre & Wuthering Heights - Charlotte & Emily Bronte Heritage Press Set,21.99,2020-06-12 00:00:00
Miniature Emily & Charlotte Bronte Set - Wuthering Heights and Jane Eyre,25.98,2020-06-11 00:00:00
VINTAGE JANE EYRE CHARLOTTE BRONTE HARDBACK WITH DUSTJACKET ABBEY CLASSICS,47.3,2020-06-11 00:00:00
"Jane Eyre - Fourth Edition - Norton Critical Editions - Brontë, Charlotte ",11.33,2020-06-10 00:00:00
JANE EYRE by Charlotte Bronte 1847 COLUMBUS SERIES International Book Company,23.0,2020-06-10 00:00:00
" JANE EYRE by Charlotte Bront, Franklin Library 1981",13.5,2020-06-09 00:00:00
"Miramax 4 Feature Films: Becoming Jane, Jane Eyre, Basquiat, St. Ives DVD",7.3,2020-06-09 00:00:00
"Jane Eyre by Charlotte Bronte - Everyman's Library No.287 (Hardback,1950)",54.36,2020-06-09 00:00:00
The Picture Of Dorian Gray & Jane Eyre Norton Critical Editions,4.32,2020-06-08 00:00:00
GB FDC Charlotte Bronte-Jane Eyre Miniature Sheet Bureau Postmark,3.65,2020-06-08 00:00:00
"Charlotte Bronte: Jane Eyre, 1943 Edition With Wood Engravings: Fritz Eichenberg",19.86,2020-06-08 00:00:00
2005  CHARLOTTE BRONTE – JANE EYRE  - HAWORTH CANCEL    FDC  -  Ref:1202,4.47,2020-06-08 00:00:00
Random House 1943 Books Wuthering Heights & Jane Eyre Without Slipcover GC,14.91,2020-06-07 00:00:00
"Jane Eyre, A Paper Doll Signed By Donald Hendricks",36.0,2020-06-07 00:00:00
DVD MOVIES: JANE EYRE (CGH012464),2.0,2020-06-07 00:00:00
Jane Eyre Charlotte Bronte  New Edition C1900 Thomas Crowell Illustrated US,43.24,2020-06-07 00:00:00
African Violet Plant /  Tiyuan's Jane Eyre ,44.0,2020-06-06 00:00:00
Antique Leather Bound Book - Jane Eyre by Charlotte Bronte - Hurst & Company,28.99,2020-06-06 00:00:00
GB FDC.  JANE EYRE-CHARLOTTE BRONTE.   Pmk. TALLENTS HOUSE  24/2/05. D1012,4.97,2020-06-06 00:00:00
Classics Illustrated 2 Pack #39 & #49 ~ Jane Eyre & Alice in Wonderland,32.5,2020-06-05 00:00:00
jane eyre book charlotte bronte Barnes And Noble Classic Hardcover,10.83,2020-06-05 00:00:00
VINTAGE 1943 1944 QUICK READER BOOKS 110 JANE EYRE A TALE OF TWO CITIES BUSHIDO,13.49,2020-06-05 00:00:00
Jane eyre charlotte bronte 1959 Print,47.56,2020-06-05 00:00:00
ORIGINAL 1944 JOAN FONTAINE STARS IN JANE EYRE FILM PRESS PHOTO C 10,14.88,2020-06-05 00:00:00
Charlotte Bronte Jane Eyre and Wuthering Heights in Slipcase,37.0,2020-06-05 00:00:00
Jane Eyre by Charlotte Bronte Barnes & Nobel Collector's Library,7.66,2020-06-04 00:00:00
ROYAL DOULTON Jane Eyre and Mr. Rochester Double Character Jug. D7115 Limited Ed,82.0,2020-06-03 00:00:00
JANE EYRE BY CHARLOTTE BRONTE - 2ND EDITION (1848) - RARE - GREAT CONDITION,302.8,2020-06-03 00:00:00
Texts From Jane Eyre by Mallory Ortberg LNew Hardcover 2014,13.33,2020-06-02 00:00:00
VINTAGE 2 BOOK SET JANE EYRE & WUTHERING HEIGHTS WITH SLIPCASE 1943,10.97,2020-06-02 00:00:00
"1940’s Editions ""Jane Eyre"" Bronte & ""A Tale of Two Cities"" Dickens",6.78,2020-06-02 00:00:00
Jane Eyre Wuthering Heights Emily Bronte Two Book Set Random House 1943,27.38,2020-06-02 00:00:00
Jane Eyre Charlotte Bronte Easton Press Excellent Condition,39.0,2020-06-02 00:00:00
VINTAGE JANE EYRE BY CHARLOTTE BRONTE THE BOOK LEAGUE OF AMERICA BLACK HC BOOK ,9.0,2020-06-01 00:00:00
Jane Eyre Charlotte Bronte Easton Press 100 Greatest Leather Collectors Edition,28.86,2020-06-01 00:00:00
Jane Eyre 1893 Edition,75.77,2020-06-01 00:00:00
The Franklin Library Jane Eyre & Barchester Towers Bronte Trollope,16.91,2020-05-31 00:00:00
Jane Eyre by Charlotte Bronte. The Franklin Library. Leather Bound,13.86,2020-05-30 00:00:00
JANE EYRE Charlotte Bronte - Art-Type Second Edition 1847 - Hardcover,15.7,2020-05-30 00:00:00
GB Stamps 2005 Jane Eyre Charlotte Bronte SG 2518-2523 Set Of 6 - MNH,5.79,2020-05-30 00:00:00
"Folio, Wuthering Heights & Jane Eyre",43.83,2020-05-30 00:00:00
JANE EYRE BLU-RAY,3.26,2020-05-29 00:00:00
DVD lot Anna Karenina Jane Eyre Treasure Hunters Archer One Last Thing Riches Bu,17.19,2020-05-29 00:00:00
2005 JANE EYRE/CHARLOTTE BRONTE - TALLENTS HOUSE H/S FDC FROM COLLECTION K7,5.11,2020-05-29 00:00:00
Lot of 10 Laserdiscs The Bonfire of the Vanities Jane Eyre and More,17.79,2020-05-28 00:00:00
Jane Eyre Doll 1:12 Dollhouse Miniature,8.98,2020-05-28 00:00:00
GB STAMPS JANE EYRE SET OF PHQ POSTCARDS FIRST DAY OF ISSUE SPECIAL POSTMARKS,6.24,2020-05-28 00:00:00
Jane Eyre Charlotte Bronte Easton Press 100 Greatest Leather Collectors Edition,21.33,2020-05-27 00:00:00
Old JANE EYRE Book CHARLOTTE BRONTE BEAUTIFUL DECORATIVE FINE BINDING WORKS LIFE,16.36,2020-05-27 00:00:00
"Jane Eyre (DVD, 2007) Cinema Classics Collection ",6.82,2020-05-27 00:00:00
GB 2005 QEII SG MS2524 Charlotte Bronte Jane Eyre Mini Sheet Mint MNH,7.86,2020-05-27 00:00:00
The Snowflower Diaries JANE EYRE Cross Stitch Maja Matyas Szilagyi Sampler Kit,15.45,2020-05-26 00:00:00
"Jane Eyre DVD 1983 Timothy Dalton, Zelah Clarke, Jean Harvey, Carol Gillies, ",9.68,2020-05-26 00:00:00
DVD lot Anna Karenina Jane Eyre Treasure Hunters Archer One Last Thing Riches Bu,21.5,2020-05-26 00:00:00
Jane Eyre Wuthering Heights Books 1943 Random House Engraving Fritz Eichenberg,32.49,2020-05-25 00:00:00
"Jane Eyre and Wuthering Heights by Bronte w/Fritz Eichenberg Illus, 1943",30.92,2020-05-25 00:00:00
"Jane Eyre (English Edition) by Bronte, Charlotte. (Paperback)",4.8,2020-05-24 00:00:00
Jane Eyre Charlotte Bronte The Easton Press 1978 Collector’s Edition,42.88,2020-05-24 00:00:00
Jane Eyre Hardback Book Charlotte Bronte,13.33,2020-05-24 00:00:00
DVD lot Anna Karenina Jane Eyre Treasure Hunters Archer One Last Thing Riches Bu,20.01,2020-05-24 00:00:00
WUTHERING HEIGHTS & JANE EYRE Illustrated w/ Wood Engravings - 1943 Random House,28.92,2020-05-24 00:00:00
JANE EYRE*1943*Blu Ray*Twilight Time*OOP*MINT,63.5,2020-05-24 00:00:00
"Vtg HB BK > JANE EYRE / Charlotte Bronte > Tower Book Edition, 1st Printing 1943",13.8,2020-05-23 00:00:00
Progeny Press Jane Eyre Study Guide,7.33,2020-05-23 00:00:00
XC11759 Great Britain 1992 best wishes Jane Eyre FDC's used,6.26,2020-05-23 00:00:00
XC11753 Great Britain 2004 -2005 trains & Jane Eyre FDC's used,6.23,2020-05-23 00:00:00
"Jane Eyre (DVD, 2011), Michael Fassbender, Mia Wasikowska, Judi Dench",7.05,2020-05-22 00:00:00
GB STAMPS FIRST DAY COVER 2005 JANE EYRE SHEET EYRE RD UNADDRESSED COLLECTION,6.29,2020-05-22 00:00:00
Jane Eyre by Charlotte Bronte,4.85,2020-05-21 00:00:00
*ACTRESS MAGGIE MITCHELL RARE LARGE 1872 JANE EYRE BROADSIDE CHARLOTTE BRONTE* ,89.94,2020-05-20 00:00:00
JANE EYRE DVD,4.5,2020-05-20 00:00:00
Jane Eyre - Charlotte Bronte - 1890 - Thomas Y Crowell & Co.,28.33,2020-05-20 00:00:00
GB 2005 JANE EYRE FINE MINT SHEET,5.14,2020-05-20 00:00:00
Jane Eyre (DVD 2007 2-Disc) Bronte Toby Stephens Ruth Wilson Masterpiece Theatre,19.99,2020-05-19 00:00:00
"RARE Vintage Books, Bronte Sisters Wuthering Heights, Jane Eyre, Agnes Grey ",30.39,2020-05-19 00:00:00
"JANE EYRE by Charlotte Bronte, International Collectors Library, Vintage HC",23.32,2020-05-19 00:00:00
"Bantam Classics: Jane Eyre by Charlotte Brontë (1983, Paperback, Reprint)",3.8,2020-05-18 00:00:00
SALE Jane Eyre Charlotte Bronte Easton Press Leather Collector's Ed 100 Greatest,37.32,2020-05-18 00:00:00
1959 JANE EYRE by Charlotte Bronte Hardcover Edited  by  Mark Shorer,5.32,2020-05-17 00:00:00
3 Books Lot Hamlet Shakespere / Anne Frank Diary / Jane Eyre Charlotte Bronte ,7.5,2020-05-17 00:00:00
