title,price,date
"Looking for Alaska - Paperback By Green, John - VERY GOOD - Free Shipping!",17.18,2020-08-11 00:00:00
Looking For Alaska,4.09,2020-08-11 00:00:00
"Charlie Plummer ""Looking for Alaska"" AUTOGRAPH Signed 8x10 Photo F ACOA",52.25,2020-08-11 00:00:00
"Looking for Alaska by John Green (2006, Paperback). ",22.5,2020-08-12 00:00:00
Looking for Alaska John Green,3.99,2020-08-12 00:00:00
Looking for Alaska By John Green. 9780007523160,12.94,2020-08-14 00:00:00
"LOOKING FOR ALASKA (DVD,2020,W/Slipcover)**FREE SHIPPING***",21.99,2020-08-16 00:00:00
Looking for Alaska by John Green,27.99,2020-08-18 00:00:00
Looking for Alaska by John Green NY Times Bestseller,5.0,2020-08-18 00:00:00
"Looking for Alaska, Hardcover by Green, John, Brand New, Free shipping in the US",43.16,2020-08-18 00:00:00
John Green Lot Of Two. Paper Towns; Looking for Alaska. Paperback. Free Shipping,10.0,2020-08-19 00:00:00
Looking for Alaska by John Green,27.99,2020-08-22 00:00:00
"Looking for Alaska by John Green (2006, Paperback)",18.13,2020-08-23 00:00:00
"John Green:1ST EDITION/SIGNED COPY Looking  for Alaska (2005, Hardcover)",25.0,2020-08-24 00:00:00
Looking For Alaska (3 disc DVD set) new & sealed with FREE SAME DAY SHIPPING!!!,8.0,2020-08-28 00:00:00
"Looking for Alaska (DVD, 2020)",9.99,2020-08-28 00:00:00
Looking for Alaska T-shirt TV Movie 2019 Black T-Shirt M-XXXL,25.9,2020-08-29 00:00:00
"Looking for Alaska by John Green (2006, Trade Paperback)",3.24,2020-08-30 00:00:00
"Looking for Alaska - Paperback By Jenkins, Peter - GOOD",21.04,2020-08-31 00:00:00
PICK AND CHOOSE BEST SELLING BOOKS COMBINE SHIPPING,0.99,2020-08-31 00:00:00
Looking For Alaska By John Green ,3.0,2020-09-01 00:00:00
"Looking for Alaska, Paperback by Green, John, Like New Used, Free shipping in...",31.1,2020-09-01 00:00:00
"Looking for Alaska - Paperback By Green, John - VERY GOOD Free Shipping!",17.08,2020-09-01 00:00:00
Looking for Alaska by John Green CD MP3-CD Unabridged Audiobook Disc MP3,21.24,2020-09-02 00:00:00
Looking For Alaska (Printz Award Winner) by John Green,27.99,2020-09-05 00:00:00
John Green Book Lot Paper Towns Looking For Alaska The Fault In Our Stars,13.49,2020-09-07 00:00:00
John Green~LOOKING FOR ALASKA~SIGNED 1ST(THUS)/DJ~NICE COPY,56.95,2020-09-07 00:00:00
LOOKING FOR ALASKA (TV) (3P...-LOOKING FOR ALASKA (TV) (3PC) / (3PK AC3  DVD NEW,20.81,2020-09-10 00:00:00
"3 John Green Books Looking For Alaska, Paper Towns & The Fault In Our Stars.",15.25,2020-09-11 00:00:00
"Looking for Alaska Exclusive Collector's Edition by Green, John",27.99,2020-09-12 00:00:00
"Looking for Alaska (DVD, 2020)",9.99,2020-09-13 00:00:00
Looking For Alaska (TV) DVD 2020 BRAND NEW FAST SHIPPING,42.94,2020-09-15 00:00:00
"Looking for Alaska, SIGNED John Green, Hardcover",24.95,2020-09-17 00:00:00
Looking for Alaska,3.91,2020-09-26 00:00:00
John Green~LOOKING FOR ALASKA~SIGNED 1ST(12)/DJ~NICE COPY,59.5,2020-09-26 00:00:00
"SIGNED John Green 4-Vol HC Box Set 2012 Looking for Alaska, Fault in Our Stars",156.45,2020-09-26 00:00:00
"Looking for Alaska by Green, John , Paperback",18.87,2020-09-28 00:00:00
"Looking for Alaska by John Green (2016, Paperback, Large Type)",19.6,2020-09-29 00:00:00
LOOKING FOR ALASKA Limited Series 3 DVD Collection -Fast Shipping- John Green ,22.99,2020-09-30 00:00:00
Looking for Alaska Deluxe Edition,2.25,2020-10-01 00:00:00
Lot of 3 Audiobooks John Green Unabridged MP3 CD Looking For Alaska...,21.99,2020-10-01 00:00:00
Looking for Alaska - Paperback –  by John Green - NEW,21.78,2020-10-02 00:00:00
"lot of 8 young adult books- The Fault In Our Stars, Looking For Alaska & More",31.5,2020-10-03 00:00:00
"Charlie Plummer ""Looking for Alaska"" AUTOGRAPH Signed 8x10 Photo D ACOA",60.75,2020-10-03 00:00:00
Looking for Alaska by John Green ,11.47,2020-10-05 00:00:00
Looking for Alaska by John Green CD MP3-CD Unabridged Audiobook Disc MP3,7.25,2020-10-05 00:00:00
"Looking for Alaska (DVD, 2020)",7.0,2020-10-05 00:00:00
Looking for Alaska by John Green  Puffin,22.2,2020-10-06 00:00:00
"Looking for Alaska - Paperback By Green, John - GOOD",20.99,2020-10-07 00:00:00
John Green~LOOKING FOR ALASKA~SIGNED First Edition /DJ~NICE COPY,44.99,2020-10-08 00:00:00
Looking for Alaska,4.04,2020-10-09 00:00:00
Looking For Alaska (TV) DVD,12.98,2020-10-10 00:00:00
"Looking for Alaska by John Green (2006, Paperback)",18.99,2020-10-11 00:00:00
Looking For Alaska DVD with SLIPCOVER 2020 New,8.99,2020-10-11 00:00:00
Looking for Alaska by Peter Jenkins,10.39,2020-10-14 00:00:00
"Looking for Alaska by John Green (2006, Trade Paperback)",5.99,2020-10-15 00:00:00
Looking for Alaska,3.67,2020-10-15 00:00:00
Looking For Alaska DVD w/slipcover SEALED Inside Slipcover,9.5,2020-10-15 00:00:00
Looking for Alaska,11.87,2020-10-17 00:00:00
Looking For Alaska (3 disc DVD set) new & sealed with FREE SAME DAY SHIPPING!!!,24.0,2020-10-18 00:00:00
"Looking for Alaska , Green, John",18.99,2020-10-22 00:00:00
"Looking for Alaska (DVD, 2020)",22.8,2020-10-23 00:00:00
"Looking for Alaska by John Green (2012, Trade Paperback)",3.99,2020-10-24 00:00:00
Looking for Alaska by John Green,10.39,2020-10-25 00:00:00
"Looking for Alaska by John Green (2006, Trade Paperback)",2.0,2020-10-26 00:00:00
Looking for Alaska by John Green - Collector’s Edition - Hardcover - BRAND NEW,29.0,2020-10-29 00:00:00
"Looking For Alaska by John Green (Paperback Book, 2013)",27.99,2020-10-31 00:00:00
Looking For Alaska By John Green Hard Cover Book,5.0,2020-11-04 00:00:00
Looking for Alaska by John Green (English) Hardcover Book Free Shipping!,26.93,2020-11-04 00:00:00
Looking for Alaska by John Green Paperback,18.89,2020-11-06 00:00:00
Lot of 3 Audiobooks John Green Unabridged MP3 CD Looking For Alaska Sealed ,34.99,2020-11-06 00:00:00
"Looking For Alaska - Hardcover By Green, John - GOOD",20.93,2020-11-07 00:00:00
"Looking for Alaska, Paperback by Green, John, Brand New, Free shipping",31.21,2020-11-07 00:00:00
"Looking for Alaska by John Green (2006, Paperback)",22.8,2020-11-07 00:00:00
Looking For Alaska Special 10th Anniversary Edition: By John Green,22.0,2020-11-07 00:00:00
"Looking for Alaska - Paperback By Green, John - GOOD",20.64,2020-11-08 00:00:00
