title,price,date
MACBETH Disc Black and Pink 12 Blink 182 Tom Delonge,64.99,2020-08-13 00:00:00
Macbeth Skate Shoes sz 9 1/2 Blink 182 Tom Delonge Rare Footwear Vegan Product,40.39,2020-08-07 00:00:00
"Macbeth Footwear Size 12 Tom Delonge, Mark Hoppus, Blink-182",27.0,2020-08-02 00:00:00
MACBETH - Eliot DY5056 White/Black Shoes Men’s Size 12 US 11 UK,46.0,2020-08-01 00:00:00
MACBETH SHOES Red yellow EXCELLENT SIZE 11 BLINK Tom Delonge Rare ,62.9,2020-07-23 00:00:00
"Macbeth Mens Gray With Black, White Accents Skateboarding Shoes Size 8.5 US",41.01,2020-07-22 00:00:00
Tom DeLonge Macbeth Brighton Studio Project 🔥 RARE 🚀 blink 182 Angels Airwaves,113.4,2020-07-19 00:00:00
Frank Iero Macbeth Wallister Studio Project 🔥 RARE 🚀 My Chemical Romance MCR,118.4,2020-07-19 00:00:00
MACBETH Footwear Vegan Products Size 11,29.9,2020-07-17 00:00:00
SoCal Macbeth Brand high Top Shoes Designer  Men’s Size 10,23.25,2020-07-16 00:00:00
MACBETH Holdon SHOES White Black EXCELLENT SIZE 9 BLINK ATTICUS EMO Rare!,113.5,2020-07-16 00:00:00
Macbeth Jack's Mannequin sneaker size 9,64.9,2020-07-14 00:00:00
MACBETH FOOTWEAR - ELIOT SHOES (20003.A2) VEGAN - BLACK/GUM size US 5,55.94,2020-07-11 00:00:00
MACBETH SHOE CO Olive Footwear Atticus Blink-182 Men’s Size 6 US WOMANS 8,58.25,2020-07-09 00:00:00
MACBETH Footwear Products Size 11 Flogging Molly,44.9,2020-07-06 00:00:00
Macbeth Brand The Shoes Are Nigh Blink 182 Black Graphic Sz XL T-Shirt X-Large,71.0,2020-07-06 00:00:00
Macbeth  Footwear Taking Back Sunday Eddie Reyes Sz 11,34.9,2020-07-06 00:00:00
MACBETH Footwear Products Size 12,29.9,2020-07-05 00:00:00
MACBETH Holdon SHOES White Black EXCELLENT SIZE 9 BLINK ATTICUS EMO Rare!,70.5,2020-07-05 00:00:00
MACBETH LEE SHOES White Black EXCELLENT SIZE 8 BLINK ATTICUS EMO Rare,89.5,2020-07-05 00:00:00
Angels and Airwaves Collectors Edition Bonham Macbeth Footwear,588.02,2020-06-25 00:00:00
Macbeth Bane lyrics black canvas blink 182 vintage skateboard shoes size 13,65.73,2020-06-21 00:00:00
MACBETH Footwear Vegan Products Size 11,34.9,2020-06-16 00:00:00
MACBETH SHOE CO Olive Footwear Atticus Blink-182,82.25,2020-06-14 00:00:00
"Men's MACBETH SHOE COMPANY C.2002 Navy ""Logo"" S/S T-Shirt MEDIUM footwear",30.0,2020-06-08 00:00:00
"Men's MACBETH SHOE COMPANY C.2002 Navy ""Lion Crest"" S/S T-Shirt MEDIUM footwear",30.0,2020-06-08 00:00:00
Tom Delonge Macbeth Elliot Size 11,40.0,2020-06-08 00:00:00
Macbeth Bane Lyrics Red Canvas Blink 182 Vintage Skateboard Shoes Sz 10.5,35.76,2020-06-07 00:00:00
"Vintage 2000s ""Macbeth"" Oregon Shakespeare Festival T-Shirt, L, Black NO RESERVE",9.74,2020-06-05 00:00:00
2 MACBETH blink 182 t shirts RARE used Vintage,61.5,2020-06-05 00:00:00
Macbeth Footwear - Tom Delonge Signature Sunglassses,90.0,2020-06-03 00:00:00
MACBETH Footwear Products Size 10.5,59.9,2020-06-01 00:00:00
Macbeth Switchfoot X Men Size 12 Skate Shoes BKI1013 Black Suede Lace Up Casual,40.5,2020-05-27 00:00:00
Rare MacBeth Brighton Band Men's US 11 Leather Skate Shoe Black & White w/ Red ,24.45,2020-05-25 00:00:00
Tom Delonge Macbeth Elliot Size 11,40.0,2020-05-24 00:00:00
