title,price,date
Loggins And Messina Vinyl Record Lot Native Sons On Stage Finale 4 X Album Lp,10.49,2020-08-15 00:00:00
2017 TOPPS BUNT APP Native Sons Award Omar Vizquel *DIGITAL CARD* 209 cc,1.0,2020-08-15 00:00:00
Anime Native Rocket Boy Melon Books Tapestry Aoi Nanami 1/6 PVC Figure No Box,31.0,2020-08-15 00:00:00
Valentine & Sons Native Hut Old Vintage RP Postcard. Black And White Unposted,25.05,2020-08-15 00:00:00
NATIVE Jefferson Red Boys Girls Kids Slip On Rubber Shoes - 9 C,13.99,2020-08-15 00:00:00
Native Navy Boy/Girl Size C10 Jefferson Style,20.5,2020-08-14 00:00:00
Precious Moments Nativity BELL**RARE**Shepherd Boy/Lamb-We Have Seen His Star,18.75,2020-08-14 00:00:00
BonEful Fabric Cotton Quilt Owl Eagle Horse Native American Indian FQ SALE SCRAP,2.96,2020-08-14 00:00:00
Vintage Green Planter Native Boy with Earrings Palm Tree Succulents  ,11.74,2020-08-13 00:00:00
Loggins and Messina Native Sons Reel to Reel Tape 3 3/4 ips 1R1 6488,23.4,2020-08-13 00:00:00
Precious Moments-Drummer Boy-Regular/Large Nativity Addition-Retired 2001,16.9,2020-08-13 00:00:00
"native american indian porcelain dolls, kissing boy and girl sitting on drum ",50.0,2020-08-13 00:00:00
Anime Native Rocket Boy Melon Books Tapestry Aoi Nanami 1/6 PVC Figure No Box,32.8,2020-08-13 00:00:00
BonEful Fabric Cotton Quilt Owl Eagle Horse Native American Indian MASK FQ SCRAP,2.96,2020-08-13 00:00:00
"GORGEOUS CYBIS BISQUE BUST OF A  NATIVE AMERICAN INDIAN BOY ""LITTLE EAGLE"" 1975",74.89,2020-08-12 00:00:00
Native Toddler Shoes Miles C6 Grey Boy Or Girl,20.0,2020-08-12 00:00:00
Notes of a Native Son & Nobody Knows My Name by James Baldwin [2 books],33.8,2020-08-11 00:00:00
c.1890s Indian Boy Indian Territory dressed as white boy w/native belt RW Duncan,26.49,2020-08-11 00:00:00
Anime Native Rocket Boy The Succubus Limited 1/6 PVC Figure New No Box 17cm,15.5,2020-08-11 00:00:00
Native Toddler Shoes Miles C6 Grey Boy Or Girl,20.0,2020-08-11 00:00:00
1952 LEFTON INDIAN NATIVE AMERICAN BOY GIRL PAPOOSE CHIEF FIGURINES THANKSGIVING,30.59,2020-08-10 00:00:00
Native American Indian Goebel The Blue Boy w/Cactus Figurine Handpainted Vintage,24.89,2020-08-10 00:00:00
"ACEO Original Gouache n Ink, Indian, Native Son, by Herbie Hasbrouck Jr ",5.99,2020-08-10 00:00:00
Native American Hopi Corn Boy Katsina (Kachina) Doll by Gene Dawahoya,209.9,2020-08-10 00:00:00
"Harper Perennial Deluxe Editions Ser.: Native Son by Richard Wright (2008, Trade",4.63,2020-08-10 00:00:00
The Long Ryders - Native Sons (CD 1996),33.05,2020-08-10 00:00:00
VINTAGE LLADRO SPAIN CHILDREN'S NATIVITY BOY WITH LAMB/SHEEP - PERFECT SHAPE,29.39,2020-08-10 00:00:00
Anime Native Rocket Boy The Succubus Limited 1/6 PVC Figure New No Box 17cm,18.61,2020-08-10 00:00:00
1900s Native Sons Golden West NSGW Madera CA Ribbon Flags Pinback,29.49,2020-08-10 00:00:00
1900 NSGW Native Sons Golden West Madera CA Admission Day Ribbon San Francisco,39.06,2020-08-10 00:00:00
"The Long Ryders-Native Sons LP (ZONG 003) + Looking For Lewis & Clark Dbl 7"" Pac",28.82,2020-08-10 00:00:00
"Notes of a Native Son by James Baldwin (2012, Paperback)",8.25,2020-08-09 00:00:00
4 1966 Negatives Native American Indians Picket Young Boy White Man Go Home CA,4.98,2020-08-09 00:00:00
Anime Native Rocket Boy Melon Books Tapestry Aoi Nanami 1/6 PVC Figure No Box,28.27,2020-08-09 00:00:00
Precious Moments Ornaments-It's A Perfect Boy-Nativity-Doctor/Stethoscope,12.21,2020-08-09 00:00:00
Broadway Programs Playbills Theater Actors Oklahoma Native Son Barrymore Lyceum,34.0,2020-08-09 00:00:00
Native American Boy  Toothpick Holder,6.79,2020-08-09 00:00:00
Boys Native Navy Shoes Size 2,21.45,2020-08-09 00:00:00
Native Peoples Silk Boy Scout Presqu’ile DISTRICT or Area Uniform Badge Canadian,28.19,2020-08-09 00:00:00
RPPC Postcard Native American Indian Boy with Eels Oregon OR ,28.9,2020-08-08 00:00:00
"BYER'S CAROLERS 2003 NATIVE AMERICAN BOY FISHING W/CANOE, ORRS ",40.95,2020-08-07 00:00:00
"Vintage Solid Brass Bronze Native Boy on Rock with Fish 14""  Statue Sculpture",62.37,2020-08-07 00:00:00
Native Boy Regatta Blue / Shell White Jefferson Shoes,25.0,2020-08-07 00:00:00
2xHP Needlepoint 18ct STITCHIN' STUFF Nativity Set: Boy & Old Man Shepherds-AN20,58.33,2020-08-07 00:00:00
Native Miller Toddler Boy Girl Water Beach Pool Shoes Green/Gray C7 EUC,18.0,2020-08-07 00:00:00
Anime Native Rocket Boy The Succubus Limited 1/6 PVC Figure New No Box 17cm,14.61,2020-08-07 00:00:00
"1930's SKOOKUM ""Bully Good"" Native American Indian Boy 6.5"" Celluloid Doll ",31.75,2020-08-07 00:00:00
Vintage Lladro 4676 Nativity Shepherd Boy Kneeling with Lamb EVC ,29.28,2020-08-06 00:00:00
BonEful Fabric Cotton Quilt Owl Eagle Horse Native American Indian FQ SALE SCRAP,2.96,2020-08-06 00:00:00
Anime Native Rocket Boy The Succubus Limited 1/6 PVC Figure New No Box 17cm,27.2,2020-08-06 00:00:00
Lyrita SRCS.125-V.Williams-Sons of Light-H.Parry-Nativity Ode-Cahill-Willcocks.,21.29,2020-08-06 00:00:00
(2) Byers Choice Native American Indian - Girl w/Basket Corn &  Boy w/ Fish 1998,78.49,2020-08-06 00:00:00
BonEful Fabric Cotton Quilt Owl Eagle Horse Native American Indian MASK FQ SCRAP,2.96,2020-08-05 00:00:00
Anime Native Rocket Boy The Succubus Limited 1/6 PVC Figure New No Box 17cm,18.61,2020-08-05 00:00:00
Anime Native Rocket Boy Melon Books Tapestry Aoi Nanami 1/6 PVC Figure No Box,30.0,2020-08-04 00:00:00
 Anime Native Rocket Boy Kurone From Asanagi 1/6 Scale PVC Figure  No Box  ,26.0,2020-08-04 00:00:00
Native Son Richard Wright Hardcover stated First Edition 1940 Harper Bros no DJ,102.33,2020-08-04 00:00:00
James Baldwin Notes of a Native Son 1st Ed. Beacon Paperback Ninth Printing 1963,35.8,2020-08-04 00:00:00
2017 TOPPS BUNT APP Native Sons Award Hideki Matsui *DIGITAL CARD* 175 cc,1.0,2020-08-04 00:00:00
2017 TOPPS BUNT APP Native Sons Award Edgar Renteria *DIGITAL CARD* 156 cc,1.25,2020-08-04 00:00:00
2017 TOPPS BUNT APP Native Sons Award Ivan Rodriguez *DIGITAL CARD* 135 cc,3.25,2020-08-04 00:00:00
Native Boys Size 1 Light Weight Sneaker,14.5,2020-08-04 00:00:00
"Vintage Ceramic Native American Indian Woman with Boy Figurine 11 1/2"" M G 90",9.6,2020-08-03 00:00:00
Richard Wright - Native Son - Hardcover First Trade Edition - Harper & Bro 1940,12.9,2020-08-03 00:00:00
Precious Moments-Drummer Boy-Regular/Large Nativity Addition-Retired 2001,31.25,2020-08-03 00:00:00
Precious Moments-Boy Giving His Heart To Jesus-Nativity-WITH BOX,26.35,2020-08-03 00:00:00
Spanish Porcelain Lladro Figure Shepherd Boy Nativity #5485 Glazed,142.4,2020-08-03 00:00:00
 Anime Native Rocket Boy The Succubus Limited 1/6 PVC Figure No Box 17cm   ,18.61,2020-08-02 00:00:00
BonEful Fabric Cotton Quilt Owl Eagle Horse Native American Indian FQ MASK SCRAP,2.96,2020-08-02 00:00:00
Anime Native Rocket Boy The Succubus Limited 1/6 PVC Figure New No Box 17cm,18.61,2020-08-02 00:00:00
14k 1920s-1940s NSGW pin - LOT OF 2 - NATIVE SONS OF THE GOLD WEST -ESTATE FRESH,31.0,2020-08-02 00:00:00
Native Kids Jefferson Slip On Shoe Boy's Size C8 Navy Blue 8 Toddler EUC,20.75,2020-08-02 00:00:00
1910 E50 Dockman & Son WILD WEST GUM -Painted Horse (Native American),8.75,2020-08-01 00:00:00
Signet Classic Richard Wright Native Son First Printing 1961 Classics,7.05,2020-08-01 00:00:00
Anime Native Rocket Boy The Succubus Limited 1/6 PVC Figure New No Box 17cm,21.5,2020-08-01 00:00:00
Vintage Native American Boy & Girl in Mocassins Salt & Pepper Shakers (Japan),8.99,2020-08-01 00:00:00
VTG Boy Scout Neckerchief Slide ~ LG Native American Indian Chief ~ carved wood,34.7,2020-07-31 00:00:00
Native Kids Shoes Jefferson Slip On Toddler Boy's Size 6 Blue Navy Pre Owned,26.25,2020-07-31 00:00:00
Precious Moments-Boy Giving His Heart To Jesus-Nativity-WITH BOX,29.35,2020-07-31 00:00:00
Native Rocket Boy Wagaya no Liliana san 1/6 PVC Figure USA SELLER pole Dancer,385.19,2020-07-31 00:00:00
Vtg Hallmark Birthday Greeting Card Diecut Native American Indian Boy Girl 1940s,7.95,2020-07-31 00:00:00
LOGGINS & MESSINA NATIVE SONS CBS/SONY SOPO-121 JAPAN OBI VINYL LP,19.99,2020-07-31 00:00:00
"1979 ""JUST ABOVE MY HEAD"" JAMES BALDWIN Native Son author 1st HB BCE BOOK CLUB ",21.42,2020-07-31 00:00:00
NATIVE BOYS NAVY BLUE WATER SHOES SIZE C9,21.59,2020-07-31 00:00:00
Anime Native Rocket Boy The Succubus Limited 1/6 PVC Figure New No Box 17cm,20.5,2020-07-31 00:00:00
Kids Boy Gray Native Breathable Shoes Slide On Size 4 ,14.99,2020-07-31 00:00:00
Anime Native Rocket Boy Melon Books Tapestry Aoi Nanami 1/6 PVC Figure No Box,28.0,2020-07-30 00:00:00
Precious Moments-Doctor/Stethoscope Mini Nativity Addition-It's a Perfect Boy,14.75,2020-07-30 00:00:00
5 Vintage 1969 Boy Scout Patches Native American Order of the Arrow OA WWW ,14.34,2020-07-30 00:00:00
"Perennial Classics Ser.: Native Son by Richard Wright (2004, Trade Paperback)",4.93,2020-07-30 00:00:00
Native Jefferson Toddler Boy’s Size 7 Blue/Yellow Casual Shoes,19.5,2020-07-29 00:00:00
PRECIOUS MOMENTS Nativity Mini I’LL PLAY MY DRUM FOR HIM  DRUMMER BOY E-5384,12.46,2020-07-29 00:00:00
"JAMES BALDWIN Lot of 5 Books, Vintage Paperback Editions Beale Street Native Son",80.39,2020-07-29 00:00:00
Native Jefferson Toddler Boy Green Shoes Size 10,20.49,2020-07-29 00:00:00
Brand New NATIVE SONS Chino Silver 46/24 Eyeglasses Frame w/Case  #312,165.43,2020-07-28 00:00:00
Anime Native Rocket Boy The Succubus Limited 1/6 PVC Figure New No Box 17cm,18.61,2020-07-28 00:00:00
FL Florida Miami Musa Isle Boy Girl Native American Indian Postcard RPPC,3.99,2020-07-27 00:00:00
"1961 ""Nobody Knows My Name"" JAMES BALDWIN First Edition Note Native Son 1st HBDJ",34.33,2020-07-27 00:00:00
BonEful Fabric Cotton Quilt Rainbow Red Southwest Stripe Navajo Indian Boy SCRAP,2.02,2020-07-27 00:00:00
Alexandria - Native Boy on Buffalo - Old Unposted Postcard - Nude,8.11,2020-07-27 00:00:00
Goebel Berta Hummel Mini Ornament Nativity: Boy With Calf And Ox NIB,29.89,2020-07-26 00:00:00
"1961 ""Nobody Knows My Name"" JAMES BALDWIN First Edition Note Native Son 1st HBDJ",64.42,2020-07-26 00:00:00
"Goebel Hummel Figurine Nativity #214/H Shepherd Boy ""Little Tooter""",13.39,2020-07-26 00:00:00
NATIVE SON - Richard Wright - 1940 - Dustjacket - ,14.0,2020-07-26 00:00:00
RECORD VINYL ALBUM THE LONG RYDERS NATIVE SONS,8.63,2020-07-26 00:00:00
Anime Native Rocket Boy Kurone From Asanagi 1/6 Scale PVC Figure No Box,42.58,2020-07-26 00:00:00
BonEful Fabric Cotton Quilt Owl Eagle Horse Native American Indian FQ RARE SCRAP,3.23,2020-07-26 00:00:00
"Wagaya no Liliana-san - Liliana - 1/6 (Native, Rocket Boy)",292.69,2020-07-25 00:00:00
Native American - Navajo Boy - Fred Harvey  Print by Karl E. Moon c1906 Postcard,5.75,2020-07-25 00:00:00
Native Sons Indian Head Pressed Elongated Penny RETIRED,3.0,2020-07-25 00:00:00
"Native Jefferson Boy Toddler ,Water Shoes, Blue Color ( size 7 C)",26.39,2020-07-25 00:00:00
Vintage Relpo Baby Boy Indian Native American Chief Planter 1960’s,18.8,2020-07-25 00:00:00
 Anime Native Rocket Boy Kurone From Asanagi 1/6 Scale PVC Figure  No Box  ,36.5,2020-07-25 00:00:00
Vtg Native American Boy And Girl Celluloid  Figures,17.5,2020-07-24 00:00:00
Anime Native Rocket Boy Melon Books Tapestry Aoi Nanami 1/6 PVC Figure No Box,30.9,2020-07-24 00:00:00
Son of Shoshone Chief Tendoy - RPPC - Horseback Tipi Native American Headdress,13.49,2020-07-24 00:00:00
Precious Moments-Doctor/Stethoscope Mini Nativity Addition-It's a Perfect Boy,14.48,2020-07-23 00:00:00
Native Sons of the Golden West  New In Box Sarome “Swallow” Automatic Lighter,50.9,2020-07-23 00:00:00
"Lenox Renaissance Nativity Set 5 Pieces Camel, Donkey, King, Girl, Boy",128.0,2020-07-23 00:00:00
"1961 ""Nobody Knows My Name"" JAMES BALDWIN First Edition Note Native Son 1st HBDJ",82.42,2020-07-23 00:00:00
The JudyBats 2CD combo pack incl. Native Son & Down In The Shacks Where The ...,4.99,2020-07-23 00:00:00
Anime Native Rocket Boy Melon Books Tapestry Aoi Nanami 1/6 PVC Figure No Box,15.5,2020-07-23 00:00:00
NATIVE RED SLIP ON SHOES SANDALS GIRL'S BOY'S SIZE 12 C12,23.5,2020-07-22 00:00:00
"Boys Native Shoes Toddler Jefferson Navy Blue Size C5 Size 5 toddler, EUC",18.99,2020-07-22 00:00:00
Fisher Price Little People Lil' Drummer Boy 10pc Musical Nativity + Box Works!,39.75,2020-07-22 00:00:00
Boy Scout BSA OA Mic-O-Say Dancers Native American Style Ceremonial Apron Set,15.8,2020-07-22 00:00:00
Signed Monteague Native American Indian Child Print Boy Billy Coyote Framed,20.0,2020-07-21 00:00:00
NATIVE SONS of the GOLDEN WEST - PIEDMONT PARLOR - Vintage 4x5 Copy Negative ,28.7,2020-07-21 00:00:00
NATIVITY / WISE MEN / ADORATION OF BOY JESUS / BRONZE MEDAL BY ANTUNES,28.01,2020-07-21 00:00:00
DARK EYED FRIENDS figurine PERILLO Artaffects 1989 Native American Boy & Beaver,46.89,2020-07-21 00:00:00
Brand New NATIVE SONS Kent Black 52.7/20.3 Eyeglasses Frame w/Case  #312,116.45,2020-07-20 00:00:00
"Furga Classic 17"" Vinyl Native American Hispanic Boy Paco w/ Box & Birth Cert",30.48,2020-07-20 00:00:00
Anime Native Rocket Boy Melon Books Tapestry Aoi Nanami 1/6 PVC Figure No Box,24.49,2020-07-20 00:00:00
BonEful Fabric Cotton Quilt Owl Eagle Horse Native American Indian FQ SALE SCRAP,3.23,2020-07-20 00:00:00
2001 CHERISHED TEDDIES ETHAN DRUMMER BOY WITH LAMB NATIVITY FIGURINE 864293,24.89,2020-07-20 00:00:00
Native Shoes Toddler Blue 8 Jefferson Marbled Boy Girl Unisex,18.4,2020-07-20 00:00:00
Native Toddler Boy's Jefferson Slip On Gray Marble Shoes Size 4,16.3,2020-07-19 00:00:00
Gawani Pony Boy’s Kola- Native American Paint Mustang- Breyer Traditional Horse,43.7,2020-07-19 00:00:00
Native Sons Of The Golden West Belt Buckle ,24.69,2020-07-19 00:00:00
Anime Native Rocket Boy Melon Books Tapestry Aoi Nanami 1/6 PVC Figure No Box,32.0,2020-07-19 00:00:00
Native Jefferson Toddler Boy’s Size 10M Navy Blue Casual Shoes,24.65,2020-07-19 00:00:00
Native Sons Golden West Token - LOS ANGELES NO. 45 // J. T. NEWELL - 2K-1671,15.99,2020-07-18 00:00:00
Loggins And Messina Native Sons Mini LP CD JAPAN MHCP-1058 / Kenny Loggins Jim,41.14,2020-07-18 00:00:00
"**Native Shoes Jefferson Slip On, Toddler Boy's Size 5, Gray",9.5,2020-07-18 00:00:00
Anime Native Rocket Boy The Succubus Limited 1/6 PVC Figure New No Box 17cm,21.5,2020-07-18 00:00:00
BonEful Fabric Cotton Quilt Rainbow Red Southwest Stripe Navajo Indian Boy SCRAP,2.02,2020-07-17 00:00:00
Friends of the Feather Native American Boy and Girl Canoe Figurines - Lot Of 60,69.1,2020-07-17 00:00:00
Friends of the Feather Wisconsin Girl & Boy Native Americans Canoe Figurines 12,22.4,2020-07-17 00:00:00
"Lladro #4676 ""Shepherd With Lamb"" Nativity Original Box Sheep Boy Spain 1990 MIB",37.52,2020-07-17 00:00:00
James Baldwin: Notes of a Native Son New TPB,7.0,2020-07-17 00:00:00
Notes of a Native Son & Nobody Knows My Name by James Baldwin [2 books],39.35,2020-07-16 00:00:00
Precious Moments Ornaments-Nativity Shepherd Boy,11.44,2020-07-16 00:00:00
"Native American Indian Artifact Stone Maul Indian stone Tool, Son. Co California",74.89,2020-07-16 00:00:00
Native Miller Toddler Boy Girl Water Beach Pool Shoes Green/Gray C7 EUC,11.0,2020-07-16 00:00:00
NATIVITY / BOY JESUS / BIG BRONZE MEDAL BY ULISSES 1979,19.0,2020-07-16 00:00:00
Precious Moments-Doctor/Stethoscope Mini Nativity Addition-It's a Perfect Boy,14.7,2020-07-15 00:00:00
Anime Native Rocket Boy Melon Books Tapestry Aoi Nanami 1/6 PVC Figure No Box,27.49,2020-07-15 00:00:00
BonEful Fabric Cotton Quilt Owl Eagle Horse Native American Indian Game FQ SCRAP,2.96,2020-07-15 00:00:00
"Native Son, Harper & Row paperback 1966 by Richard Wright",7.33,2020-07-15 00:00:00
Native Son by Richard Wright,6.3,2020-07-13 00:00:00
Vintage NATIVE BOY Sitting On CROCODILE Salt & Pepper Shakers Made In Japan,19.95,2020-07-13 00:00:00
Vintage Melanie-Parker Levi Native American Indian Thumb Sucking Boy 1988,45.0,2020-07-13 00:00:00
DOUBLE D RANCH NATIVE AMERICAN NAVAJO CROW BOY FULLY BEADED HIP BELT SIZE 32,160.97,2020-07-13 00:00:00
Vintage Royal Copley Little Indian Native American Boy Glazed Planter Vase,17.75,2020-07-13 00:00:00
Anime Native Rocket Boy Melon Books Tapestry Aoi Nanami 1/6 PVC Figure No Box,27.0,2020-07-13 00:00:00
Native Son (VHS 1987 Lightning) Matt Dillon~Oprah Winfrey~Geraldine Page,5.0,2020-07-12 00:00:00
California CA San Francisco Native Sons Monument Postcard Old Vintage Card View,1.5,2020-07-12 00:00:00
Vintage Postcard Native Rickshaw Boy South Africa posted 1908,6.54,2020-07-12 00:00:00
Named Royal Air Force Officer & Small Native Boy 1930's RAF Photograph L2,9.15,2020-07-12 00:00:00
Rare U2 Vinyl Live Boot 2 LPS - Native Son - 1987 Italy - EXC,27.99,2020-07-12 00:00:00
Native Shoes Youth Boys Shoes Size 1 M Blue Synthetic Casual Shoes ,20.7,2020-07-11 00:00:00
Anime Native Rocket Boy The Succubus Limited 1/6 PVC Figure New No Box 17cm,18.61,2020-07-11 00:00:00
📚Native Son Richard Wright Modern Library1940 Hardcover book,7.56,2020-07-11 00:00:00
BonEful Fabric Cotton Quilt Owl Eagle Horse Native American Indian FQ SALE SCRAP,2.96,2020-07-10 00:00:00
"Native Miles 13104600 Slip-On Shoes, Toddler Boy's Size C12, Blue/Shell White ",26.25,2020-07-10 00:00:00
Native American White Buffalo Warrior Kachina Doll Father and Son  by L Vandever,64.65,2020-07-10 00:00:00
Anime Native Rocket Boy Melon Books Tapestry Aoi Nanami 1/6 PVC Figure No Box,29.99,2020-07-10 00:00:00
Anime Native Rocket Boy The Succubus Limited 1/6 PVC Figure Model toys No Box,15.5,2020-07-10 00:00:00
NIB Native Shoes Boys Miller Child Regatta Blue C5 5 UK 4 EUR 20 GLMC02-488,23.0,2020-07-10 00:00:00
 Anime Native Rocket Boy Kurone From Asanagi 1/6 Scale PVC Figure  No Box  ,40.0,2020-07-09 00:00:00
Lladro Nativity Shepherd Boy w/Lamb Figurine #4676 Made in Spain Retired,39.99,2020-07-09 00:00:00
HOPI BOY ON PUEBLO LADDER NATIVE AMERICAN CHILD KID COLOR LITHO POSTCARD,11.99,2020-07-09 00:00:00
NATIVE JEFFERSON Gray + Blue slip on waterproof shoes size 13c Toddler/boy VGUC,19.5,2020-07-09 00:00:00
NEW NATIVE + Rocket Boy  Aoi Nanami 1/6 PVC Figure,168.75,2020-07-09 00:00:00
"Native Jefferson Boy Toddler ,Water Shoes, Gray Color ( size 7 )",26.39,2020-07-09 00:00:00
New Anime Native Rocket Boy Melon Books Tapestry Aoi Nanami 1/6 PVC Figure,28.0,2020-07-08 00:00:00
 Anime Native Rocket Boy The Succubus Limited 1/6 PVC Figure No Box 17cm   ,25.0,2020-07-08 00:00:00
Vintage Lladro 4676 Nativity Shepherd Boy Kneeling with Lamb EVC ,24.59,2020-07-07 00:00:00
RPPC ~ NATIVE AMERICAN INDIAN ~ ESKIMO FAMILY ~ DRIED FISH BARE FOOT BOY ~ 65D,2.99,2020-07-07 00:00:00
Handbook Boy Rangers 1925 HB Boy Scout Similiar Organization Native American,21.54,2020-07-07 00:00:00
"Native Son  Richard Wright, Jean Wallace, Nicholas Joy  NE16",104.99,2020-07-07 00:00:00
Richard WRIGHT / LIBRARY OF AMERICA Lawd Today! Uncle Tom's Children; Native Son,19.0,2020-07-07 00:00:00
NATIVITY / BIRTH OF BOY JESUS / WISE MEN / BRONZE MEDAL BY ARMINDO VISEU,21.01,2020-07-07 00:00:00
BonEful Fabric Cotton Quilt Owl Eagle Horse Native American Indian Game FQ SCRAP,1.97,2020-07-07 00:00:00
"Vintage E&B Australia (Pat Elvins and Gorge Beggs) Sculpture ""Aboriginal Boy""",43.65,2020-07-06 00:00:00
Anime Native Rocket Boy The Succubus Limited 1/6 PVC Figure New No Box 17cm,18.61,2020-07-06 00:00:00
The Long Ryders Native Sons Victor VIL-6167 Japan  VINYL LP OBI,33.5,2020-07-05 00:00:00
Anime Native Rocket Boy Kurone From Asanagi 1/6 Scale PVC Figure New No Box,23.5,2020-07-05 00:00:00
4.5” Fontanini Nativity Retired Boy with Dog,19.85,2020-07-05 00:00:00
4.5” Fontanini Nativity Retired Boy with Basket,19.85,2020-07-05 00:00:00
 Anime Native Rocket Boy Kurone From Asanagi 1/6 Scale PVC Figure  No Box  ,43.85,2020-07-04 00:00:00
Precious Moments-Regular Nativity Shepherd Boy w/Lamb-Come Let Us Adore Him,38.47,2020-07-04 00:00:00
Native Son. by Richard Wright. 1940 First Edition HC,15.95,2020-07-04 00:00:00
CONRAD BUFF DRAWING ORIGINAL ANTIQUE VINTAGE AMERICAN NATIVE YOUNG MAN BOY ,59.55,2020-07-04 00:00:00
Anime Native Rocket Boy The Succubus Limited 1/6 PVC Figure Model toys No Box,14.5,2020-07-04 00:00:00
Topps Skate Brent Burns Cory Schneider Native Sons 2017 Digital Card,3.93,2020-07-04 00:00:00
Vintage Gotz Starshine Native American Boy Doll-used for display only,204.95,2020-07-04 00:00:00
Native Brand Howard Toddler Boat Shoes EVA Slip On Boys US Size 8 Blue,6.83,2020-07-03 00:00:00
Native Miles Slip-On Shoes Toddler Kids Boy's Size 9 Navy White,17.99,2020-07-03 00:00:00
New Anime Native Rocket Boy The Succubus Limited 1/6 PVC Figure,13.53,2020-07-03 00:00:00
NATIVE NAVY BLUE RUBBER SANDALS SHOES BABY TODDLER GIRL'S BOY'S SIZE 8 C8,19.51,2020-07-03 00:00:00
NATIVE BLUE RUBBER SANDALS SHOES BABY TODDLER GIRL'S BOY'S 6 C6,19.5,2020-07-03 00:00:00
 Anime Native Rocket Boy The Succubus Limited 1/6 PVC Figure No Box 17cm   ,18.61,2020-07-03 00:00:00
Pamphlet Native Sons of the Golden West 1895 Ceremony New Hall,29.99,2020-07-02 00:00:00
"Perennial Classics Ser.: Native Son by Richard Wright (2004, Trade Paperback)",4.93,2020-07-02 00:00:00
1919 1ST EDITION INSCRIBED INEZ HAYNES IRWIN THE NATIVE SON & Autographed Letter,18.38,2020-07-02 00:00:00
Handbill Flyer Native Son Canada Lee Orson Welles Royal Alexandra Theatre ,18.96,2020-07-01 00:00:00
"FISHER PRICE LITTLE PEOPLE CHRISTMAS STORY NATIVITY, LIGHTS & MUSIC, DRUMMER BOY",45.99,2020-07-01 00:00:00
Anri Ferrandiz Italy 3” Wood Hand Carved SHEPHERD BOY WITH SHEEP Lamb Nativity,39.59,2020-07-01 00:00:00
Vintage Deadstock 60s Boy Scout Camp Shirt M Native Indian BSA,128.15,2020-07-01 00:00:00
Anime Native Rocket Boy The Succubus Limited 1/6 PVC Figure New No Box 17cm,18.61,2020-07-01 00:00:00
NATIVITY / WISE MEN / ADORATION OF BOY JESUS / BRONZE MEDAL BY ANTUNES,25.01,2020-07-01 00:00:00
Native boys shoes Size 13,21.08,2020-07-01 00:00:00
AUSTRALIA SMILING ABORIGINAL BOY,12.19,2020-07-01 00:00:00
Precious Moments-Boy Giving His Heart To Jesus-Nativity-WITH BOX,27.35,2020-06-30 00:00:00
Anime Native Rocket Boy Melon Books Tapestry Aoi Nanami 1/6 PVC Figure No Box,30.0,2020-06-30 00:00:00
BonEful Fabric Cotton Quilt Bull Owl Eagle Horse Native American Indian FQ SCRAP,2.96,2020-06-30 00:00:00
Anime Native Rocket Boy Melon Books Tapestry Aoi Nanami 1/6 PVC Figure No Box,26.85,2020-06-30 00:00:00
Long Ryders - R.E.M - Native Sons Vinyl LP,39.49,2020-06-29 00:00:00
Vintage American Indian Native American Boy Doll With Blinking Eyes Leather...,7.95,2020-06-29 00:00:00
Hummel Goebel Nativity Porcelain Good Shepard Boy Figurine Germany,26.0,2020-06-29 00:00:00
"Marvel - Ren & Stimpy #9 (1993) Native Son See scan, $ave on shipping",4.08,2020-06-28 00:00:00
New Anime Native Rocket Boy The Succubus Limited 1/6 PVC Figure,12.5,2020-06-28 00:00:00
 VINTAGE WOODEN LACROSSE STICK M. ETIENNE & SON CANADA NATIVE INDIAN MADE short,126.0,2020-06-28 00:00:00
 VINTAGE WOODEN LACROSSE STICK M. ETIENNE & SON CANADA NATIVE INDIAN MADE ,350.0,2020-06-28 00:00:00
"old postcard CANADA - QUEBEC - NATIVE, Cree Indian Boy - 1907",7.49,2020-06-28 00:00:00
New Anime Native Rocket Boy Melon Books Tapestry Aoi Nanami 1/6 PVC Figure,35.0,2020-06-28 00:00:00
Vintage Christmas Large 9” Nativity Boy with Oxen Chalk ware Plaster Chalkware,34.55,2020-06-27 00:00:00
G75/ Patriotic Postcard c1910 Native American Indian Flag Stripes Boy 14,9.6,2020-06-27 00:00:00
"Native American Dressed Indian Dolls - Vintage - Boy & Girl - 6""",12.9,2020-06-27 00:00:00
Aboriginal Image Essendon AUSTRALIA Boy Scout County or District Scouting Badge,0.75,2020-06-27 00:00:00
" NATIVE Miles size C-12 Water friendly, Bright green Nordstroms boy or girl - P",17.0,2020-06-27 00:00:00
"Native Jefferson Boy Toddler ,Water Shoes,multicolor Blue ( size 10c)",23.89,2020-06-27 00:00:00
Native Son (1968) Richard Wright,15.51,2020-06-27 00:00:00
Precious Moments-Boy Giving His Heart To Jesus-Nativity-WITH BOX,29.35,2020-06-26 00:00:00
Precious Moments-Regular Nativity Shepherd Boy w/Lamb-Come Let Us Adore Him,31.14,2020-06-26 00:00:00
"CREST: HOCKEY - 1948-49 LETHBRIDGE NATIVE SONS, COLOR, 4"" X 8 1/2"" VERY RARE",24.13,2020-06-26 00:00:00
BonEful Fabric Cotton Quilt Owl Eagle Horse Native American Indian Game FQ SCRAP,1.97,2020-06-26 00:00:00
Anime Native Rocket Boy The Succubus Limited 1/6 PVC Figure New No Box 17cm,18.61,2020-06-26 00:00:00
"Perennial Classics Ser.: Native Son by Richard Wright (2004, Trade Paperback)",6.08,2020-06-25 00:00:00
Fisher Price Nativity  Lil' Drummer Boy Christmas Wise Men Shepherds lot +,44.9,2020-06-25 00:00:00
NATIVE SON OF DESERT DONKEY REAL PHOTO POSTCARD RPPC POMONA CA CALIFORNIA 1920s,5.07,2020-06-25 00:00:00
Native Miles Water Shoe Toddler Boy Size 10 Green Slip On ,12.49,2020-06-25 00:00:00
"Native Jefferson Boy Toddler ,Water Shoes, Gray Color ( size 7 )",27.89,2020-06-25 00:00:00
"Native Jefferson Boy Toddler ,Water Shoes, Gray Color ( size 7 )",21.39,2020-06-25 00:00:00
Anime Native Rocket Boy Melon Books Tapestry Aoi Nanami 1/6 PVC Figure No Box,27.0,2020-06-25 00:00:00
Native Jefferson Child Small Water Shoes Jefferson Child Boy Girl Size C9 9 Grey,23.5,2020-06-25 00:00:00
1960s Vintage Boy Scouts BSA Native American Indian Chief Neckerchief Slide,9.65,2020-06-24 00:00:00
Native Shoes Youth Boys Shoes Size 1 M Blue Synthetic Casual Shoes ,24.39,2020-06-24 00:00:00
"Big Kids Native Shoes Jefferson Slip On Waterproof Gray, Size J4 Boy Girl",22.7,2020-06-24 00:00:00
"Big Kids Native Shoes Jefferson Slip On Waterproof Black/White, Size J4 Boy Girl",31.4,2020-06-24 00:00:00
