title,price,dateJoccarilla Apache Postcard Raphael Tuck & Sons Native American Indians Oilette,4.0,2020-06-24 00:00:00
Anime Native Rocket Boy The Succubus Limited 1/6 PVC Figure New No Box 17cm,13.5,2020-06-24 00:00:00
HOME INTERIORS NATIVE AMERICAN CHILDREN FIGURINES BOY WOLF & GIRL LAMB #1428-95,26.64,2020-06-23 00:00:00
"Vintage 12 1/2"" Chalkware Indian Boy Bank  Native American  Duquesne Statuary PA",23.89,2020-06-23 00:00:00
New Anime Native Rocket Boy The Succubus Limited 1/6 PVC Figure,14.5,2020-06-23 00:00:00
New Anime Native Rocket Boy Melon Books Tapestry Aoi Nanami 1/6 PVC Figure,29.0,2020-06-23 00:00:00
Anime Native Rocket Boy Melon Books Tapestry Aoi Nanami 1/6 PVC Figure No Box,13.25,2020-06-23 00:00:00
BonEful Fabric Cotton Quilt Owl Eagle Horse Native American Indian FQ SALE SCRAP,1.97,2020-06-23 00:00:00
"NATIVE KIds Shoes Casual, Slip-on, Little Boy's Size C12, Gray, WaterProof",18.5,2020-06-22 00:00:00
Precious Moments Mini Nativity E2395 Shepherd Boy Replacement,9.95,2020-06-22 00:00:00
BonEful Fabric Cotton Quilt Bull Owl Eagle Horse Native American Indian FQ SCRAP,2.96,2020-06-22 00:00:00
"Kid Native boy girl Miles Low Top Slip On Fashion Sneaker, gray,  Size Infant c5",14.99,2020-06-21 00:00:00
Vintage Bill Burch Boy Scout Carved Wood Bolo - Native American w box,59.99,2020-06-21 00:00:00
Anime Native Rocket Boy Melon Books Tapestry Aoi Nanami 1/6 PVC Figure No Box,26.0,2020-06-21 00:00:00
Authentic Native Rocket Boy Dva Sun Kissed Version Ban PVC Figure Anime Futanari,238.99,2020-06-21 00:00:00
EUC Boy’s Native Black Jefferson Shoes - J3,20.25,2020-06-21 00:00:00
Native Son by Richard Wright*First Edition*1940,56.5,2020-06-21 00:00:00
New Native Miles Block Boy Shoes Size US C6 Black And White,23.7,2020-06-21 00:00:00
Anime Native Rocket Boy The Succubus Limited 1/6 PVC Figure New No Box 17cm,18.61,2020-06-21 00:00:00
Anime Native Rocket Boy Kurone From Asanagi 1/6 Scale PVC Figure No Box,27.0,2020-06-20 00:00:00
Anime Native Rocket Boy The Succubus Limited 1/6 PVC Figure No Box 17cm,20.5,2020-06-20 00:00:00
Anime Native Rocket Boy Melon Books Tapestry Aoi Nanami 1/6 PVC Figure No Box,21.25,2020-06-20 00:00:00
"Native American Indians, RPPC, Young Boy Dressed in a Costume, Feather Headress",11.99,2020-06-20 00:00:00
Blue Stripes Native Jefferson Toddler Boy Size 7 Slip on Water Shoe RARE HTF,15.0,2020-06-20 00:00:00
Anime Native Rocket Boy The Succubus Limited 1/6 PVC Figure New No Box 17cm ,18.61,2020-06-20 00:00:00
Anime Native Rocket Boy Melon Books Tapestry Aoi Nanami 1/6 PVC Figure No Box,26.0,2020-06-20 00:00:00
1992 Franklin Mint Nativity Shepherd Boy With Lamb Figurine ,13.99,2020-06-20 00:00:00
The Long Ryders 2 Original Vinyl Lot Native Sons 1984 & Two Fisted Tales 1987 NM,34.98,2020-06-20 00:00:00
Native Son - Richard Wright Easton Press Great Books of the 20th Century ,30.89,2020-06-20 00:00:00
 Anime Native Rocket Boy Kurone From Asanagi 1/6 Scale PVC Figure  No Box  ,22.5,2020-06-19 00:00:00
 Anime Native Rocket Boy The Succubus Limited 1/6 PVC Figure New No Box 17cm   ,20.61,2020-06-19 00:00:00
The Long Ryders - Native Son - Vinyl LP Original Zippo Pressing - EX,20.61,2020-06-19 00:00:00
Richard Wright NATIVE SON paperback book,4.8,2020-06-18 00:00:00
blue NATIVE JEFFERSON toddler boy sz 9 GLOW IN THE DARK  shoes loafers,18.32,2020-06-18 00:00:00
New Anime Native Rocket Boy The Succubus Limited 1/6 PVC Figure,20.5,2020-06-18 00:00:00
"Perennial Classics: Native Son by Richard Wright (2005, Paperback)",4.58,2020-06-18 00:00:00
Timeless Collection Porcelain Native American Doll WHITE SON Ltd Ed W/Acessories,44.99,2020-06-18 00:00:00
Tan Boy/Girl Leather Baby Infant Moccasins Indian Native American Beaded Shoes,24.45,2020-06-17 00:00:00
James Baldwin - Notes of a Native Son - Stated First Beacon Edition 1957 - VG+,99.99,2020-06-17 00:00:00
BonEful Fabric Cotton Quilt Owl Eagle Horse Native American Indian FQ SALE SCRAP,2.82,2020-06-17 00:00:00
NATIVE SON by RICHARD WRIGHT HARDCOVER 1940 FIRST YEAR PRINT,19.45,2020-06-17 00:00:00
Strangeways Native Sons CD New Sealed Bonus Tracks,10.0,2020-06-16 00:00:00
Anime Native Rocket Boy The Succubus Limited 1/6 PVC Figure New No Box 17cm,22.61,2020-06-16 00:00:00
 Anime Native Rocket Boy The Succubus Limited 1/6 PVC Figure New No Box 17cm,20.99,2020-06-15 00:00:00
Native shoes Boys Size 2 Junior J2,22.5,2020-06-15 00:00:00
Native Kids Jefferson Slip On Shoe Boy's Size C8 Navy Blue 8 Toddler EUC,24.5,2020-06-15 00:00:00
Vista House Oregon Salt&Pepper Shakers Native American Boy and Girl Souvenir ,9.75,2020-06-15 00:00:00
BonEful Fabric Cotton Quilt Bull Owl Eagle Horse Native American Indian FQ SCRAP,4.23,2020-06-15 00:00:00
Native Boys Slip On Jefferson Shoes Black Gray Size 9,13.5,2020-06-15 00:00:00
Anime Native Rocket Boy The Succubus Limited 1/6 PVC Figure New No Box 17cm ,23.5,2020-06-15 00:00:00
SCARCE MINT 1951 Global Hummel #214/G WHITE Nativity SHEPHERD BOY Figurine,29.59,2020-06-15 00:00:00
CATHAY COLLECTION 17” NATIVE AMERICAN INDIAN Boy PORCELAIN DOLL #224/5000,18.65,2020-06-15 00:00:00
"8 Vtg Native American ""Indian"" girl boy Doll Lot Carlson Heritage Ocala Sioux",16.2,2020-06-15 00:00:00
Vintage Royal Copley Little Indian Native American Boy Glazed Planter Vase,23.65,2020-06-14 00:00:00
DeGrazia Native 1st Nation Collectors Plates Flower Girl 1978 Flower Boy 1979 ,31.9,2020-06-14 00:00:00
1908 Postcard Aboriginal Boy South Australia (Free UK postage),15.6,2020-06-14 00:00:00
"FONTANINI Nativity 5"" Drummer Boy Depose Italy 1988 #437 signed: S. Simonette",21.79,2020-06-14 00:00:00
"PERFECT LENOX INNOCENCE NATIVITY SHEPHERD BOY KNEELING WITH CROOK  5 3/8"" X 4""",73.64,2020-06-13 00:00:00
New Anime Native Rocket Boy The Succubus Limited 1/6 PVC Figure,18.48,2020-06-13 00:00:00
New in Box Native Phoenix Slip On Shoe - Little Kid's Size C13 - Blue,25.1,2020-06-13 00:00:00
2003 BYERS CHOICE NATIVE AMERICAN BOY CARRYING FISH WITH CANOE,19.99,2020-06-13 00:00:00
New Anime Native Rocket Boy Melon Books Tapestry Aoi Nanami 1/6 PVC Figure,34.0,2020-06-13 00:00:00
 Anime Native Rocket Boy The Succubus Limited 1/6 PVC Figure No Box 17cm   ,26.0,2020-06-13 00:00:00
Native Sons Sunglasses (RARE),44.7,2020-06-12 00:00:00
Anime Native Rocket Boy Melon Books Tapestry Aoi Nanami 1/6 PVC Figure No Box,35.0,2020-06-11 00:00:00
Harper Perennial Deluxe Editions Ser.: Native Son by Richard Wright (Trade...,8.98,2020-06-11 00:00:00
Native Shoes - Natives - Blue Marble - Boys Girls Water - 9 Summer Slip On GUC,19.0,2020-06-11 00:00:00
Vintage Christmas Large 9” Tall Nativity Boy With 3 Sheep Chalkware Plaster,20.89,2020-06-11 00:00:00
Anime Native Rocket Boy The Succubus Limited 1/6 PVC Figure New No Box 17cm,24.9,2020-06-11 00:00:00
Native Son - Richard Wright - HC DJ protector 1st 1968,29.84,2020-06-11 00:00:00
Anime Native Rocket Boy The Succubus Limited 1/6 PVC Figure No Box 17cm,25.48,2020-06-10 00:00:00
 Anime Native Rocket Boy The Succubus Limited 1/6 PVC Figure New No Box 17cm,20.48,2020-06-10 00:00:00
VINTAGE NATIVE AMERICAN INDIAN BOY SOUVENIR CLOTH DOLL VELVET & COTTON,28.64,2020-06-10 00:00:00
RPPC Young Native Boy with Coconut HI Hawaii? Real Photo Postcard,6.99,2020-06-10 00:00:00
Anime Native Rocket Boy The Succubus Limited 1/6 PVC Figure New No Box 17cm ,26.0,2020-06-10 00:00:00
A Native Sons Reader VINTAGE BOOK 1st 1970 James Baldwin Malcolm X Leroi Jones,35.99,2020-06-10 00:00:00
"HEAVENLY BLESSINGS Avon Nativity Manager DRUMMER BOY  1988 figurine 3 1/2""",15.77,2020-06-10 00:00:00
BonEful Fabric Cotton Quilt Bull Owl Eagle Horse Native American Indian FQ SCRAP,4.23,2020-06-10 00:00:00
TEEN BOY EMBRACES NATIVE AMERICAN Indian MAN @ DISNEYLAND vtg 50s SNAPSHOT photo,18.24,2020-06-09 00:00:00
"Two Native American Indian Rubber Dolls 7.5"" Kewpie Cute Boy Girl Made Hong Kong",17.94,2020-06-09 00:00:00
"The Long Ryders, Native Sons, Vinyl LP, Zong 003, Grade Ex. Gene Clark",22.0,2020-06-08 00:00:00
All Hail the Queen by Queen Latifah CD 1989 Tommy Boy Hip Hop Rap Native Tongues,7.79,2020-06-08 00:00:00
VINTAGE NATIVE AMERICAN SOUVENIR SKOOKUM INDIAN DOLL boy,8.13,2020-06-08 00:00:00
New Anime Native Rocket Boy The Succubus Limited 1/6 PVC Figure,16.0,2020-06-08 00:00:00
 Anime Native Rocket Boy The Succubus Limited 1/6 PVC Figure No Box 17cm   ,18.61,2020-06-08 00:00:00
Native Son - Richard Wright Easton Press Great Books of the 20th Century ,28.33,2020-06-08 00:00:00
"Navajo Native American  Sterling Silver Turquoise ""Son of Bear"" Money Clip",58.0,2020-06-08 00:00:00
"**Native Kids Shoes Jefferson Slip On - Boy's Size 12, Navy",14.6,2020-06-08 00:00:00
Native Boy/Girl Navy Jefferson Slip On Shoes Sz 8 EEUC,21.97,2020-06-07 00:00:00
Native Shoes Size 10 Red,15.49,2020-06-07 00:00:00
Anime Native Rocket Boy Melon Books Tapestry Aoi Nanami 1/6 PVC Figure No Box,31.01,2020-06-06 00:00:00
4386 MNH 2009 61c Richard Wright Father of Black Literature Native Son racism,2.29,2020-06-06 00:00:00
2016-17 Topps SKATE DIGITAL CARD Nicolas Backstrom Native Sons,1.49,2020-06-06 00:00:00
"Native Son by Richard Wright (Trade Paper, Abridged edition)",3.79,2020-06-06 00:00:00
Boy's & Girl’s NATIVES Black/White Star Print Jefferson Slip-On Shoes Toddler 9c,26.31,2020-06-06 00:00:00
Anime Native Rocket Boy The Succubus Limited 1/6 PVC Figure New No Box 17cm,18.61,2020-06-06 00:00:00
red NATIVE shoes loafers child youth 2  J2 boy girl,19.35,2020-06-05 00:00:00
Native toddler boy's blue rubber casual shoes size 5,10.3,2020-06-05 00:00:00
Anime Native Rocket Boy The Succubus Limited 1/6 PVC Figure New No Box 17cm ,21.5,2020-06-05 00:00:00
Native American Girl And Boy Salt And Pepper Shakers,11.9,2020-06-05 00:00:00
Vintage Photograph DIAMOND HEAD cc1900 ID native boy riding the surf board stand,89.85,2020-06-05 00:00:00
Boys Native Jefferson Outdoor Summer Water Blue Shoe Size 1,9.6,2020-06-05 00:00:00
 Anime Native Rocket Boy The Succubus Limited 1/6 PVC Figure New No Box 17cm,20.5,2020-06-05 00:00:00
NIKE shoes sandals toddler boy sz 9 red worn3days EUC clean,25.0,2020-06-05 00:00:00
PIEDMONT PARLOR - NATIVE SONS of the GOLDEN WEST - Vintage 4x5 Copy Negative ,28.7,2020-06-05 00:00:00
Postcard Native American Navajo Boy Fred Harvey Postcard 1900s,6.0,2020-06-05 00:00:00
New Native Miles Block Boy Shoes Size Us J2/black And White,30.0,2020-06-04 00:00:00
Native Shors Toddler Boy Size 5,12.6,2020-06-04 00:00:00
Native toddler boy's navy blue with stars rubber shoes size 5,10.3,2020-06-04 00:00:00
Native Shoes C11 Miles in Blue/Green NIB boy girl unisex slip-on,30.19,2020-06-04 00:00:00
New Anime Native Rocket Boy Melon Books Tapestry Aoi Nanami 1/6 PVC Figure,28.0,2020-06-04 00:00:00
Precious Moments-Doctor/Stethoscope Mini Nativity Addition-It's a Perfect Boy,11.7,2020-06-04 00:00:00
Anime Native Rocket Boy The Succubus Limited 1/6 PVC Figure Model toys No Box,15.59,2020-06-04 00:00:00
Precious Moments-Boy Giving His Heart To Jesus-Nativity-WITH BOX,35.85,2020-06-03 00:00:00
Kids Boys Black Native Water Shoes Size 4,15.4,2020-06-03 00:00:00
New Anime Native Rocket Boy Melon Books Tapestry Aoi Nanami 1/6 PVC Figure,32.98,2020-06-03 00:00:00
NATIVE BLUE SLIP ON LOAFERS SHOES TODDLER GIRL'S BOY'S SIZE 10,11.5,2020-06-03 00:00:00
Grey Crocs and Native Shoes (LOT 2) Boys Size 12,27.1,2020-06-03 00:00:00
Gold Key Tarzan Of The Apes #170 Tarzan & The Native Boy Jungle TV Action ,8.95,2020-06-02 00:00:00
"Perennial Classics: Native Son by Richard Wright (2005, Paperback)",7.25,2020-06-02 00:00:00
Native Boys Shoes 8- LOT to include Harper Canyon and children's place shoes,28.64,2020-06-02 00:00:00
Byers Choice 1988 Nativity Shepherd Boy Caroler with Black Sheep - Nice!,20.0,2020-06-02 00:00:00
Native Jefferson Toddler Boy Gray Shoes White Size 10,30.0,2020-06-02 00:00:00
Anime Native Rocket Boy Melon Books Tapestry Aoi Nanami 1/6 PVC Figure No Box,28.5,2020-06-01 00:00:00
Anime Native Rocket Boy The Succubus Limited 1/6 PVC Figure New No Box 17cm,19.61,2020-06-01 00:00:00
"Notes of a Native Son by James Baldwin (2012, Paperback)",10.9,2020-06-01 00:00:00
"RICHARD WRIGHT pb Native Son, Uncle Tom’s Cabin, Black Boy",13.36,2020-05-31 00:00:00
Franklin Library LAUGHING BOY Oliver La Fargo Native American Navajo Indians OOP,17.49,2020-05-31 00:00:00
Boys Native Shoes Size C11,28.98,2020-05-31 00:00:00
Anime Native Rocket Boy The Succubus Limited 1/6 PVC Figure New No Box 17cm ,20.5,2020-05-31 00:00:00
 Anime Native Rocket Boy The Succubus Limited 1/6 PVC Figure New No Box 17cm,20.5,2020-05-31 00:00:00
Native Sons Siegel Sunglasses (RARE) - Men's COLOR: SPAZZLE / ANTIQUE GOLD,154.04,2020-05-31 00:00:00
2016-17 Topps SKATE DIGITAL CARD Pekka Rinne Predators Native Sons (150cc),1.74,2020-05-31 00:00:00
WINTER FROLIC Cricut Cartridge Shapes Snow Christmas Nativity snowman Boy Girl,9.4,2020-05-31 00:00:00
Kids Boys Black Native Water Shoes Size 4,15.67,2020-05-31 00:00:00
New Anime Native Rocket Boy Melon Books Tapestry Aoi Nanami 1/6 PVC Figure,35.9,2020-05-30 00:00:00
"Native Son And The Foundation ""Life In The Grave""",13.99,2020-05-30 00:00:00
Boys Crocs size 11 Native Boys 11,25.4,2020-05-30 00:00:00
Boys NATIVE Jefferson Gray And Blue  Slip On Shoes Child sz 11,21.9,2020-05-30 00:00:00
The Library of America: Baldwin - Collected Essays : Notes of a Native Son -...,13.83,2020-05-29 00:00:00
Precious Moments-Regular Nativity Shepherd Boy w/Lamb-Come Let Us Adore Him-Nice,36.13,2020-05-29 00:00:00
New Anime Native Rocket Boy Melon Books Tapestry Aoi Nanami 1/6 PVC Figure,41.0,2020-05-29 00:00:00
RealCare Reality Works Baby Think it Over Doll G5 BOY NATIVE AMERICAN ** TESTED ,229.59,2020-05-28 00:00:00
1940/1950 MAR Toy Target Pieces/Antique Tin Target Game/Vintage Cow Boy/Native,21.5,2020-05-28 00:00:00
BonEful Fabric Cotton Quilt Bull Owl Eagle Horse Native American Indian FQ SCRAP,3.23,2020-05-28 00:00:00
"Jareth, Drummer Boy (55103) - Fontanini Heirloom Nativity 5"" Collection, 1992",17.75,2020-05-28 00:00:00
Little Boy Dake Native Indian Costume Riding Horse Toy Real Photo Postcard,16.29,2020-05-28 00:00:00
"Bug House Bone China Nativity-Jesus,Mary & Joseph,Wise Men,Shepard Boy -7 Pc NEW",19.99,2020-05-28 00:00:00
Anime Native Rocket Boy Melon Books Tapestry Aoi Nanami 1/6 PVC Figure No Box,26.89,2020-05-27 00:00:00
Anime Native Rocket Boy The Succubus Limited 1/6 PVC Figure New No Box 17cm,26.0,2020-05-27 00:00:00
Anime Native Rocket Boy The Succubus Limited 1/6 PVC Figure New No Box 17cm ,30.9,2020-05-26 00:00:00
Anime Native Rocket Boy The Succubus Limited 1/6 PVC Figure Model toys No Box,29.51,2020-05-25 00:00:00
Original Gerda Christoffersen Native American Girl & Boy Signed Pastel Paintings,129.99,2020-05-25 00:00:00
New Anime Native Rocket Boy Melon Books Tapestry Aoi Nanami 1/6 PVC Figure,39.9,2020-05-25 00:00:00
Vintage ROBERT SHIELDS Sterling Silver Figural Sunny Boy Native Brooch Pin,17.99,2020-05-25 00:00:00
BOYS OR GIRLS NATIVE MILLER WATER SHOES SIZE J2,17.89,2020-05-25 00:00:00
Vintage Gotz Starshine Native American Boy Doll~PLEASE READ DESCRIPTION,168.41,2020-05-25 00:00:00
LOT OF 7 BLACK HISTORY CIVIL RIGHTS STRUGGLE VINTAGE PAPERBACKS Native Son Souls,19.99,2020-05-24 00:00:00
"1875 Cherry Blosson 2sen yellow with SON native numeral JSC post mark ""Musashi""",15.05,2020-05-24 00:00:00
"1915 Coronation 10sen,top value w/ SON comb type native ship post mark. JSCA#C14",4.88,2020-05-24 00:00:00
1938 National park 2sen with SON native machine cancel. Extremely fine.JSCA#P5,3.0,2020-05-24 00:00:00
native boy shoes 9,12.0,2020-05-24 00:00:00
Vintage Native Boy And Girl On Phone Salt & Pepper,31.98,2020-05-24 00:00:00
Native Son by Richard Wright - 1940 1st Edition - Harper & Brothers,20.0,2020-05-24 00:00:00
VINTAGE HUMMEL BOY NATIVITY SHEPARD WITH STAFF&LANTERN STAMPED GOEBEL/W. GERMANY,29.45,2020-05-23 00:00:00
Mayfairstamps Egypt 1916 Native Boy Picture Postcard wwe86787,2.75,2020-05-22 00:00:00
Native Shoes Toddler Boys Size 10 Gray,25.1,2020-05-22 00:00:00
Native Toddler Boy Size 7,7.85,2020-05-22 00:00:00
BonEful Fabric Cotton Quilt Bull Owl Eagle Horse Native American Indian FQ SCRAP,7.25,2020-05-21 00:00:00
"Native Son (1940) Richard Wright, hardbound w/incorrect dust jacket",4.99,2020-05-21 00:00:00
Anime Native Rocket Boy The Succubus Limited 1/6 PVC Figure New No Box 17cm ,34.9,2020-05-21 00:00:00
Native Kids Shoes Jefferson Slip On Waterproof Red Size 13 Boy Girl Unisex,26.5,2020-05-21 00:00:00
BEAUTIFUL--Lladro 5485 Shepherd Boy - Mint Condition Great Nativity Piece,126.9,2020-05-21 00:00:00
New Anime Native Rocket Boy Melon Books Tapestry Aoi Nanami 1/6 PVC Figure,39.0,2020-05-20 00:00:00
Vintage Native American Indian Chief Fabric SHAMASH and Sons 1 Yd 14” NEW,15.26,2020-05-20 00:00:00
Vintage African American Native Boy Salt Shaker ,18.12,2020-05-19 00:00:00
"Lot of Boys Shoes Size 8 Plae, Native & Jambukd Swim Shoes",31.4,2020-05-19 00:00:00
Byers Choice Caroler Native American Indian Boy,33.45,2020-05-19 00:00:00
Native Son by Richard Wright - 1940 1st Edition - Harper & Brothers,13.33,2020-05-19 00:00:00
Topps Skate Brent Burns Native Sons 2017 Digital Card,3.93,2020-05-19 00:00:00
Topps Skate Cory Schneider Native Sons 2017 Digital Card ,2.62,2020-05-19 00:00:00
Precious Moments-Regular Nativity Shepherd Boy w/Lamb-Come Let Us Adore Him-Nice,36.25,2020-05-18 00:00:00
Boys Native Shoes Size C10,31.0,2020-05-18 00:00:00
Precious Moments-Regular Nativity Addition-Drummer Boy-Come Let Us Adore Him **,40.25,2020-05-18 00:00:00
Precious Moments Nativity BELL**RARE**Shepherd Boy/Lamb-We Have Seen His Star,18.75,2020-05-18 00:00:00
"2 1992 Annalee Native American Indian Dolls 10"" 3168 and 3170 Boy and Girl",49.4,2020-05-18 00:00:00
Anime Native Rocket Boy The Succubus Limited 1/6 PVC Figure New No Box 17cm,10.5,2020-05-18 00:00:00
Native Toddler Gray Size C 4 Baby Boy Jefferson Slip On Shoes new with tags,20.0,2020-05-18 00:00:00
Boy’s Toddler Native Lennox Block Slip On Shoes C5,15.96,2020-05-17 00:00:00
