title,price,dateAC Adapter +EP-5B DC Coupler EN-EL15 Dummy Battery For Nikon DSLR 1 V1 1V1 Z6 Z7,38.99,2020-12-08 00:00:00
ZOMEI Square Gradual color Filter Red/blue for cokin Z-PRO For Nikon Canon Sony,15.4,2020-12-08 00:00:00
SmallRig L-Bracket Holder for Nikon Z6 Z7 Camera with Extendable Side Plate 2258,69.0,2020-12-08 00:00:00
Nikon Battery Door Cover For D7000 D7100 D610 Digital F2Y9 camera Lid HOT P2Z8,3.85,2020-12-08 00:00:00
M42-NZ Lens Mount Adapter Ring Alloy for M42 to for Nikon Z Mirrorless Camera ,17.97,2020-12-08 00:00:00
 HD 62MM AF 180° FISHEYE LENS + MACRO LENS FOR Nikon NIKKOR Z 50mm f/1.8 S Lens,35.99,2020-12-08 00:00:00
"Nikon Z6 Full-Frame Mirrorless+ FTZ Mount Adapter, AF-S 50mm 1.8G Lens, EXTRAS!",1614.0,2020-12-08 00:00:00
Glass Screen Protector for Nikon Z6 / Z7 2D 9H Tempered Ultra Thin,3.66,2020-12-08 00:00:00
Nikon NIKKOR Z 24-70mm F/4 S Lens,444.9,2020-12-08 00:00:00
Rear Lens Cover + Camera Front Body Cap for Nikon Z7 Z6 reDXHWP5,4.19,2020-12-08 00:00:00
Nikon Z50 Camera Kit W/ 16-50 & 50-250 Lenses,757.9,2020-12-08 00:00:00
"Adapter for Canon FD Lens to Nikon Z NZ Z50 Z6 Z7 Mirrorless Camera ""US Seller""",12.8,2020-12-08 00:00:00
JJC Remote Control Cable M Cord 4 Nikon Z7 Z6 D7500 D5200 D5100 D3200 D90 MC-DC2,8.99,2020-12-08 00:00:00
SmallRig Camera L Bracket Quick Release Plate for Nikon Z5/Z6/Z7 Aluminum Alloy,35.9,2020-12-08 00:00:00
Nikon Z 5 24.3MP Mirrorless Camera (Body Only),1000.0,2020-12-08 00:00:00
Nikon HB-88 Camera Lens Hood For Z 24mm f/1.8 S,33.99,2020-12-08 00:00:00
JJC Automatic Extension Tube Macro Photography for Nikon Z Mount Camera Z7 Z6 II,39.95,2020-12-09 00:00:00
Nikon HN-40 Screw-On Lens Hood for Nikkor Z DX 16-50mm f/3.5-6.3 VR DN,36.0,2020-12-09 00:00:00
Olympus OM Lens mount adapter to Nikon Z Z6 Z7 Full frame Mirrorless Camera,23.59,2020-12-09 00:00:00
GABALE M/Z Adapter for Leica LM Zeiss M Series Lens to Nikon Z Mount Z6/7 Camera,27.49,2020-12-09 00:00:00
Nikon DK-30 Rubber Eyecup for Z50 DN,18.0,2020-12-09 00:00:00
"Viltrox DC-50 HD Clip-on 5"" LCD Monitor Wide View for Canon Nikon DSLR Cam Z6Q8",125.89,2020-12-09 00:00:00
Quick Release Lens Foot Mount Plate for Nikon NIKKOR Z 70-200mm f/2.8 VR S Lens,39.98,2020-12-09 00:00:00
SmallRig - QUICK RELEASE HALF CAGE FOR NIKON Z6 AND Z7 - Black,79.95,2020-12-09 00:00:00
SmallRig Half Cage for Nikon Z6 Z7 Camera with Quick Release Manfrotto Plate,89.0,2020-12-09 00:00:00
Anti-Scratch Leather Lens Film Cover Protector for Nikon NIKKOR Z 24-70mm f/4 S,10.29,2020-12-09 00:00:00
DSLRKIT Rear Lens+body Cover cap for Nikon Z7 Z6 Camera with Z Mount,7.24,2020-12-09 00:00:00
"JJC Leather Hand Strap Grip Arca Swiss QR Plate for Nikon Z50 Z6 Z7 ""US Shiper""",21.59,2020-12-09 00:00:00
GABALE QR L Plate Bracket Camera Grip Camera Holder for  Nikon Z7 Z6 LB-Z7 Red,43.9,2020-12-09 00:00:00
Nikon Z6 Camera All Original Accessories 4 Year Extended Warranty Drop Or Water,1149.99,2020-12-09 00:00:00
"Minolta MD Rokkor Lens to Nikon Z5 Z50 Z6 Z7 Mirrorless Camera Adapter ""US Ship""",13.08,2020-12-09 00:00:00
Leica R LR Lens to Nikon Z Mount Z50 Z5 Z6 Z7 Z6iI II Mirrorless Camera Adapter ,12.59,2020-12-09 00:00:00
LM-NZ/M Macro Focusing Adapter For Leica M Lens to Nikon Z mount Z5 Z7 Z6 Camera,64.99,2020-12-09 00:00:00
Z CAM E2 Professional 4K Cinema Camera - Mint Condition,1500.0,2020-12-09 00:00:00
"Brand New 2020 Nikon Z7 Mirrorless Camera Body ( No Box ) 45,7 Megapixels",1730.0,2020-12-09 00:00:00
Nikon MB-N10 Multi Battery Power Pack for Z Series Camera,135.0,2020-12-09 00:00:00
HB-N/Z Hasselblad V C CF Lens to Nikon Z7 Z6 Cameras Replace FTZ Camera Adapter,33.99,2020-12-09 00:00:00
FOTOFOX adapter for Micro Four Thirds M4/3 lens to Nikon Z mount Z6 Z7 camera,19.0,2020-12-09 00:00:00
 EN-EL15b Rechargeable Battery D850-D810-D800- D750-D7200-D7300-D610- Z6-Z7 USA,25.97,2020-12-09 00:00:00
Nikon Z50 DX-Format Mirrorless Camera Body w/NIKKOR Z DX 16-50mm f/3.5-6.3VR kit,591.38,2020-12-09 00:00:00
Nikon Z6 24.5MP Mirrorless Camera - Black (Body Only),1208.7,2020-12-09 00:00:00
BRAND NEW Nikon Z6 Mirrorless Digital Camera (Body Only) ,1380.0,2020-12-09 00:00:00
"1/4""-20 Tripod Mount Screw to Hot Shoe Adapter For Nikon Camera DSLR C2T5 Z3Y5",2.01,2020-12-09 00:00:00
easyCover Nikon Z50 Camera Protective Case YELLOW Silicone EA-ECNDZ50Y,29.95,2020-12-09 00:00:00
Mint Condition Nikon 24-70mm F/4 S Lens Z-mount Mirrorless (Z6 & Z7) MSRP $1000,759.99,2020-12-09 00:00:00
Rockstar 10mm F8 Wide angle Fisheye Lens For Canon Nikon Sony Fuji M4/3 Camera,76.0,2020-12-09 00:00:00
MC-DC2 LCD Timer Remote Shutter for Nikon Z7 D750 D610 D7500 D7200 D5600 D3300,15.26,2020-12-09 00:00:00
Silicon Rubber Case Cover Skin Protector for Nikon Z7 Z6 Mirrorless Camera,9.49,2020-12-09 00:00:00
T-2 T2 mount telephoto lens To Nikon Z mount adapter full frame camera Z5 Z7 Z50,18.49,2020-12-09 00:00:00
Nikon NIKKOR FTZ Z Mount Adapter Nikon F Lens To Nikon Z-Mount Camera Black LN,174.95,2020-12-10 00:00:00
Rokinon 14mm F2.8 Ultra Wide Angle Weather Sealed Lens for Nikon Z Cameras,349.0,2020-12-10 00:00:00
Nikon Nikkor 200mm 1:4 Ai Lens *As Is* #Z014b,51.8,2020-12-10 00:00:00
Nikon MB-N10 Multi Battery Power Pack for Z Series Camera,150.0,2020-12-10 00:00:00
Protective Cage for Nikon Z6/ Nikon Z7 Camera for Nikon Z6/Z7 Camera Cage Cover,49.98,2020-12-10 00:00:00
D500 D750 D800 D810 D850 D5 Z6 Z7 Quick Release L-Plate Bracket Holder For Nikon,13.95,2020-12-10 00:00:00
Adapter for Olympus OM Lens to Nikon Z Z5 Z6 Z7 Z50 Z6II Z7II Mirrorless Camera,16.49,2020-12-10 00:00:00
Nikon NIKKOR Z 35mm F/1.8 S Lens,610.19,2020-12-10 00:00:00
Nikon Z 7II FX-Format Mirrorless Camera Body,2996.95,2020-12-10 00:00:00
SmallRig L Bracket Holder Camera for Nikon Z5/Z6/Z7/Z6 II/Z7 II Camera 2947,39.68,2020-12-10 00:00:00
"GGS LARMOR Self-Adhesive Optical Glass LCD Screen Protector for Nikon Z7, Z6",14.99,2020-12-10 00:00:00
 EN-EL15b Rechargeable Battery D850-D810-D800- D750-D7200-D7300-D610- Z6-Z7 USA,25.97,2020-12-10 00:00:00
Nikon NIKKOR Z 24-70mm F/4 S Lens,360.0,2020-12-10 00:00:00
TECHART TZC-01 Auto Focus Adapter for Canon EF Lens to Nikon Z Z6 Z7 Z50 Camera,202.5,2020-12-10 00:00:00
BRAND NEW ikon NIKKOR Z 24-70mm f/4 S Lens for Z Series Mirrorless Camera #20072,515.0,2020-12-10 00:00:00
AODELAN Wireless Remote Control For Nikon COOLPIX P1000 P950 Z50 B600 A1000,26.99,2020-12-10 00:00:00
Screen Protector for Nikon Z7 Z6 Camera LCD Screen + Top Screen (2+2Packs),7.99,2020-12-10 00:00:00
Nikon NIKKOR Z 24-70mm f/2.8 S Lens #20089,1996.95,2020-12-10 00:00:00
Nikon NIKKOR Z 35mm F/1.8 S Lens,610.19,2020-12-10 00:00:00
Nikon FTZ 50619 Mount Adapter,155.0,2020-12-10 00:00:00
"Nikon Z6, Z7 Instruction Owner User's Manual Book - NEW",19.98,2020-12-10 00:00:00
7artisans 50mm F1.05 Full Frame Lens for Canon Nikon Sony Leica Panasonic Sigma ,486.0,2020-12-10 00:00:00
Digital Camera Bag Backpack Photo SLR DSLR Case for Nikon Canon Waterproof L8Z1,14.16,2020-12-10 00:00:00
SmallRig Formfitting Full Cage 1/4”-20 Screw for Nikon Z5/Z6/Z7/Z6II/Z7II Camera,31.41,2020-12-10 00:00:00
Camera Body + Rear Lens Cap Cover Set Nikon Z7 Z6 Z Mount JJC L-RNZ BF-N1 LF-N1,11.49,2020-12-10 00:00:00
DK-30 Nikon Long Extended Eyepiece Eyecup Soft Rubber Silicone Cushioning Z50,17.49,2020-12-10 00:00:00
Nikon Z7 FX 45.7MP Mirrorless Camera - Black (Kit with 24-70mm F/4 Lens),2218.0,2020-12-10 00:00:00
EH-5 AC Adapter+EP-5B dc coupler EN-EL15 dummy battery For Nikon D810 D500 Z7 Z6,36.8,2020-12-10 00:00:00
easyCover Nikon Z5 Camera Protective Case BLACK Silicone FREE FAST SHIPPING,29.95,2020-12-10 00:00:00
FOTOFOX T2 T-2 telephoto lens to Nikon Z mount full frame camera adapter Z6 Z7,16.99,2020-12-10 00:00:00
Novoflex Lens Adapter for Leica M Lenses to Nikon Z-Mount Cameras #NIKZ/LEM,260.0,2020-12-10 00:00:00
MC-DC2 LCD Timer Remote Shutter Release for Nikon Z7 D750 D610 D7500 D7200 D5600,19.79,2020-12-10 00:00:00
Nikon MB-N10 Battery Pack for Z6 Mint condition,140.0,2020-12-11 00:00:00
K&F Concept Lens Mount Adapter for Olympus OM Lens to Nikon Z Z6 Z7 Camera,27.89,2020-12-11 00:00:00
JJC GSP-Z7 2.5D Tempered Optical Glass LCD Protector for Nikon Z5 Z6 Z7,8.44,2020-12-11 00:00:00
Nikon FTZ Mount Adapter (F-Mount Lens to Z-Mount Camera) #631,204.74,2020-12-11 00:00:00
Z Flex Tilt Ball Head Quick Release Plate System for Canon Nikon Sony Cameras,10.05,2020-12-11 00:00:00
Kastar Li-ion Battery LTD2 USB Charger for EN-EL15c ENEL15c Nikon Z 5 Z5 Camera,24.99,2020-12-11 00:00:00
Nikon MB-N10 Battery Pack for Z6 Mint condition,148.0,2020-12-11 00:00:00
Kastar Rechargeable Battery for Nikon EN-EL15b EN-EL15e Nikon Z 6 Z6 Z7 7 Z7 Q3,10.99,2020-12-11 00:00:00
K&F Concept Lens Mount Adapter for Olympus OM Lens to Nikon Z Z6 Z7 Camera,27.89,2020-12-11 00:00:00
JJC GSP-Z7 2.5D Tempered Optical Glass LCD Protector for Nikon Z5 Z6 Z7,6.49,2020-12-11 00:00:00
Nikon Z 5 Mirrorless Digital Camera with 24-50mm Lens Bundle,1559.95,2020-12-11 00:00:00
Nikon NIKKOR Z 24-70mm f/2.8 S Lens for Z Series Mirrorless Cameras,1996.95,2020-12-11 00:00:00
Nikon FTZ Mount Adapter (F-Mount Lens to Z-Mount Camera) #631,175.99,2020-12-11 00:00:00
Z Flex Tilt Ball Head Quick Release Plate System for Canon Nikon Sony Cameras,10.05,2020-12-11 00:00:00
Rollei QBM lens To Nikon Z mount adapter mirrorless full frame camera Z5 Z7 Z50,26.98,2020-12-11 00:00:00
Nikon Nikkor Z 24-70mm f4 S Lens - Excellent Condition,399.0,2020-12-11 00:00:00
CheatSheet Nikon Z50 Mirrorless DSLR Laminated Mini Guide to take along!,11.88,2020-12-11 00:00:00
72mm Flower Screw Mount Lens Hood For Nikon Nikkor Z 24-70mm F4 S Lens,22.66,2020-12-11 00:00:00
M645-NZ Lens Mount Adapter for Mamiya 645 M645 Lens to Nikon Z NZ Mount Camera,33.5,2020-12-11 00:00:00
"Funleader CapLens 18mm f8.0 Wide angle lens Pancake Cap Lens- R, Z, X Mount",139.0,2020-12-11 00:00:00
MC-DC2 LCD Timer Remote Shutter for Nikon Z7 D750 D610 D7500 D7200 D5600,18.99,2020-12-11 00:00:00
"GGS LARMOR Self-Adhesive Optical Glass LCD Screen Protector for Nikon Z7, Z6",12.77,2020-12-11 00:00:00
Z Type Tilt Tripod Head Flex Folding For Canon Nikon DSLR Camera Go  RAS,13.09,2020-12-11 00:00:00
Siliconen Armor Skin Case Body Cover Protector For Nikon Z7 Z6 Body DSLR Camera,14.88,2020-12-11 00:00:00
"Nikon Z7 45.7MP Digital Camera - Black (Body Only), New in Box, GREAT! ",1899.0,2020-12-11 00:00:00
Nikon NIKKOR Z 24-70mm F/4 S Lens 20210102 New,549.9,2020-12-11 00:00:00
Nikon Z6 24.5 MP Mirrorless Digital Camera Body,1149.95,2020-12-11 00:00:00
Nikon NIKKOR Z 50mm f/1.8 S Lens for Z Series Mirrorless Cameras W/Free Acc Kit,508.17,2020-12-11 00:00:00
Nikon Z50 DX Mirrorless Camera NIKKOR Z DX 16-50 & 50-250mm VR Lens + 32GB Bundl,989.0,2020-12-11 00:00:00
Nikon Z6 Mirrorless Digital Camera (Body Only),1424.95,2020-12-11 00:00:00
SmallRig Cage for Nikon Z50 Camera CCN2499,69.0,2020-12-11 00:00:00
Nikon Z6 24.5MP Mirrorless Camera (Body Only) + MB-N10 Battery Grip * USA Model ,1268.0,2020-12-11 00:00:00
M42-Nikon Z Metal Ring Adapter for M42 Screw Mount Lens to Nikon Z7 Z6 Cameras,11.98,2020-12-11 00:00:00
Kastar Rechargeable Battery for Nikon EN-EL15b EN-EL15e Nikon Z 6 Z6 Z7 7 Z7 Q3,18.99,2020-12-11 00:00:00
K&F Concept Lens Mount Adapter for Olympus OM Lens to Nikon Z Z6 Z7 Camera,45.99,2020-12-11 00:00:00
Nikon Z 5 Mirrorless Digital Camera with 24-50mm Lens Bundle,1809.95,2020-12-11 00:00:00
"Nikon NIKKOR Z 24mm f/1.8 S Lens with Nikon L37C Filter, Box, Caps, Hood, Pouch",740.0,2020-12-12 00:00:00
3 Legged Thing ZAYLA L-Bracket for Nikon Z50 - Copper,55.99,2020-12-12 00:00:00
Nikon Z6 24.5MP FX-format Full-Frame Mirrorless Camera Body + FTZ Mount Adapter,1646.95,2020-12-12 00:00:00
"Canon Dream Lens 50mm f0.95 TV,RF onto Canon EOS R RF mount singl metal adapter ",117.75,2020-12-12 00:00:00
Nikon NIKKOR Z 24-70mm F/4 S Lens + B&W filter,483.0,2020-12-12 00:00:00
Nikon NIKKOR Z 24-70mm f/4 S Lens,575.59,2020-12-12 00:00:00
"(2 Packs) Nikon Z 50 Screen Protector, Tempered Glass Touch Screen for Z50",7.99,2020-12-12 00:00:00
USED Nikon NIKKOR Z 24-70mm F4 S Lens (#20013543),422.99,2020-12-12 00:00:00
TECHART TZC-01 Autofocus Adapter Canon EOS EF mount Lens to Nikon Z Z6 Z7 Z50 ,229.0,2020-12-12 00:00:00
SmallRig Universal 15mm Rail Support System Baseplate for Nikon Z6/Z7 Cage 2272,89.0,2020-12-12 00:00:00
SmallRig Aluminum Arca-Type L Bracket for Nikon Z5/Z6/Z7 Camera 2947 US,51.9,2020-12-12 00:00:00
"Round Camera Glass Eyepiece for NIKON FE, FM DSLR Cameras Eyecup Replacement",23.95,2020-12-12 00:00:00
Nikon NIKKOR Z 50mm f/1.8 S Lens for Z Series Mirrorless Cameras W/Free Acc Kit,498.03,2020-12-12 00:00:00
Nikon Z6 Z7 Shutter Original Replacement Part,172.25,2020-12-12 00:00:00
Glass for Nikon Z6 / Z7 TOP & LCD Screen Protector (2PCS Top & 2PCS LCD Screen),7.99,2020-12-12 00:00:00
Automatic Macro Extension Tube Set for Nikon Z-mount Cameras/Lenses(26mm+36mm),72.99,2020-12-12 00:00:00
"SmallRig Camera L Bracket for Nikon Z5/Z6/Z7 Camera with Arca 1/4"" Threads 2947 ",39.9,2020-12-12 00:00:00
JJC 2PCS 0.3mm 9H Optical Tempered Glass Screen Protector for Nikon Z5 Z6 Z7 II,9.99,2020-12-12 00:00:00
"Nikon Z50 Mirrorless Digital Camera with 16-50mm Lens+ 32GB Card, (18PC Bundle)",927.0,2020-12-12 00:00:00
WEIDON OM-Z adapter for Olympus OM mount lens to Nikon Z mount Z6 Z7 camera,29.0,2020-12-12 00:00:00
AYdgcam Genuine Real Leather Camera Case Handmade Cover For Nikon Z6 Nikon Z7,55.98,2020-12-12 00:00:00
"Leica M LM Lens to Nikon Z5 Z50 Z6 Z7 Mirrorless Camera Adapter ""US Seller""",15.0,2020-12-12 00:00:00
Nikon S Mount RangerFinder Lens(OUTER Bayonet) to Nikon Z Z6 Z7 Camera Adapter ,16.24,2020-12-12 00:00:00
NEW LCD Screen Display For Casio Exilim EX-Z33 Z35 Z37 Samsung ES20 SL35,24.98,2020-12-12 00:00:00
"Nikon NIKKOR Z 24mm f/1.8 S Lens with Nikon L37C Filter, Box, Caps, Hood, Pouch",760.0,2020-12-12 00:00:00
3 Legged Thing ZAYLA L-Bracket for Nikon Z50 - Copper,44.99,2020-12-12 00:00:00
Nikon Z6 24.5MP FX-format Full-Frame Mirrorless Camera Body + FTZ Mount Adapter,1646.95,2020-12-12 00:00:00
"Canon Dream Lens 50mm f0.95 TV,RF onto Canon EOS R RF mount singl metal adapter ",112.0,2020-12-12 00:00:00
Nikon NIKKOR Z 24-70mm F/4 S Lens + B&W filter,464.22,2020-12-12 00:00:00
Nikon NIKKOR Z 24-70mm f/4 S Lens,575.59,2020-12-12 00:00:00
"(2 Packs) Nikon Z 50 Screen Protector, Tempered Glass Touch Screen for Z50",7.99,2020-12-12 00:00:00
USED Nikon NIKKOR Z 24-70mm F4 S Lens (#20013543),404.99,2020-12-12 00:00:00
TECHART TZC-01 Autofocus Adapter Canon EOS EF mount Lens to Nikon Z Z6 Z7 Z50 ,229.0,2020-12-12 00:00:00
SmallRig Universal 15mm Rail Support System Baseplate for Nikon Z6/Z7 Cage 2272,89.0,2020-12-12 00:00:00
SmallRig Aluminum Arca-Type L Bracket for Nikon Z5/Z6/Z7 Camera 2947 US,39.9,2020-12-12 00:00:00
"Round Camera Glass Eyepiece for NIKON FE, FM DSLR Cameras Eyecup Replacement",9.95,2020-12-12 00:00:00
Nikon NIKKOR Z 50mm f/1.8 S Lens for Z Series Mirrorless Cameras W/Free Acc Kit,508.17,2020-12-12 00:00:00
Nikon Z6 Z7 Shutter Original Replacement Part,164.7,2020-12-12 00:00:00
Glass for Nikon Z6 / Z7 TOP & LCD Screen Protector (2PCS Top & 2PCS LCD Screen),7.99,2020-12-12 00:00:00
Automatic Macro Extension Tube Set for Nikon Z-mount Cameras/Lenses(26mm+36mm),71.99,2020-12-12 00:00:00
"SmallRig Camera L Bracket for Nikon Z5/Z6/Z7 Camera with Arca 1/4"" Threads 2947 ",39.9,2020-12-12 00:00:00
EH-5A AC Power Adapter EP-5B DC Coupler for Nikon D850 D800E D600 D7100 D7500 Z6,37.95,2020-12-12 00:00:00
JJC 2PCS 0.3mm 9H Optical Tempered Glass Screen Protector for Nikon Z5 Z6 Z7 II,9.99,2020-12-12 00:00:00
"Nikon Z50 Mirrorless Digital Camera with 16-50mm Lens+ 32GB Card, (18PC Bundle)",899.0,2020-12-12 00:00:00
WEIDON OM-Z adapter for Olympus OM mount lens to Nikon Z mount Z6 Z7 camera,29.0,2020-12-12 00:00:00
AYdgcam Genuine Real Leather Camera Case Handmade Cover For Nikon Z6 Nikon Z7,53.99,2020-12-12 00:00:00
"Leica M LM Lens to Nikon Z5 Z50 Z6 Z7 Mirrorless Camera Adapter ""US Seller""",13.05,2020-12-12 00:00:00
Nikon S Mount RangerFinder Lens(OUTER Bayonet) to Nikon Z Z6 Z7 Camera Adapter ,14.29,2020-12-12 00:00:00
NEW LCD Screen Display For Casio Exilim EX-Z33 Z35 Z37 Samsung ES20 SL35,11.99,2020-12-12 00:00:00
Nikon NIKKOR Z 24-70mm F/4 S Lens + B&W filter,462.57,2020-12-12 00:00:00
Nikon NIKKOR Z 24-70mm f/4 S Lens,592.1,2020-12-12 00:00:00
Nikon NIKKOR Z 50mm f/1.8 S Lens for Z Series Mirrorless Cameras W/Free Acc Kit,608.03,2020-12-12 00:00:00
Petriflex Petri Lens onto Canon EOS R  mirrorless mount adapter,62.75,2020-12-13 00:00:00
NEWYI 50mm F1.8 Z Mount Large Aperture Manual Lens for Nikon Z7/Z6/Z5/Z50 Camera,75.05,2020-12-13 00:00:00
Samyang 14mm F2.8 ED ASP UMC Ultra Wide Angle MF Lens for Nikon Z6 - Z7   NEW,370.0,2020-12-13 00:00:00
Sony E NEX lens To Nikon Z mount adapter mirrorless full frame camera Z6 Z7 Z5,20.99,2020-12-13 00:00:00
2.5mm-N3 Shutter Release Cable f Nikon Z6 Z7 D7500 D750 D780 D5600 D5500 D7200,9.74,2020-12-13 00:00:00
Nikon 14-30mm F4 S Nikkor Z Lens   20070,1096.95,2020-12-13 00:00:00
EN-EL15 power usb powr cable+EP-5B dummy battery  For Nikon D810 D850 D750 Z6 Z7,41.1,2020-12-13 00:00:00
"""3,850 shots"" Nikon D7000 16.2MP Digital SLR Camera Black Body Only #201031z",293.04,2020-12-13 00:00:00
46mm Center Pinch Snap-On Lens Cap with Leash Canon Nikon Sony DSLR Camera,17.95,2020-12-13 00:00:00
Wired Remote Shutter Release Control MC-DC2 f/ Nikon D750 D7500 Z6 Z7-USA Seller,9.89,2020-12-13 00:00:00
For Nikon Z6 Z7 Top Cover Shell Dial Mode Flex Cable Original,48.99,2020-12-13 00:00:00
Reversible Stretchy Wrap Case Camera Bag For Nikon Z6 Z7 Z-6 Z-7,22.99,2020-12-13 00:00:00
Kipon Tilt Adapter for Nikon F Mount Lens to Nikon Z Mirrorless Camera,210.0,2020-12-13 00:00:00
Nikon Z50 20.9MP Mirrorless Digital Camera (Body Only),665.99,2020-12-13 00:00:00
Petriflex Petri Lens onto Canon EOS R  mirrorless mount adapter,59.25,2020-12-13 00:00:00
NEWYI 50mm F1.8 Z Mount Large Aperture Manual Lens for Nikon Z7/Z6/Z5/Z50 Camera,74.56,2020-12-13 00:00:00
Samyang 14mm F2.8 ED ASP UMC Ultra Wide Angle MF Lens for Nikon Z6 - Z7   NEW,353.5,2020-12-13 00:00:00
Kastar AC Travel Battery Charger for Nikon ENEL25 Nikon Z Series Z50 Z 50 Camera,7.99,2020-12-13 00:00:00
4-Pack Khaos For Nikon Z50 Tempered Glass Screen Protector,9.94,2020-12-13 00:00:00
Kastar AC Wall Battery Charger for Nikon EN-EL25 Nikon Z Series Z50 Z 50 Camera,6.99,2020-12-13 00:00:00
Sony E NEX lens To Nikon Z mount adapter mirrorless full frame camera Z6 Z7 Z5,20.99,2020-12-13 00:00:00
2.5mm-N3 Shutter Release Cable f Nikon Z6 Z7 D7500 D750 D780 D5600 D5500 D7200,9.74,2020-12-13 00:00:00
Nikon 14-30mm F4 S Nikkor Z Lens   20070,1096.95,2020-12-13 00:00:00
EN-EL15 power usb powr cable+EP-5B dummy battery  For Nikon D810 D850 D750 Z6 Z7,41.1,2020-12-13 00:00:00
JJC Long Rubber Eyecup Replace DK-29 for Nikon Z6 Z7,15.5,2020-12-13 00:00:00
SMALLRIG Vlogging Mounting Plate Pro for Nikon Z50 Camera LCN2667,33.22,2020-12-13 00:00:00
"""3,850 shots"" Nikon D7000 16.2MP Digital SLR Camera Black Body Only #201031z",293.04,2020-12-13 00:00:00
46mm Center Pinch Snap-On Lens Cap with Leash Canon Nikon Sony DSLR Camera,4.95,2020-12-13 00:00:00
Nikon NIKKOR Z 24mm f/1.8 S Lens for Nikon Z,896.95,2020-12-13 00:00:00
Wired Remote Shutter Release Control MC-DC2 f/ Nikon D750 D7500 Z6 Z7-USA Seller,9.89,2020-12-13 00:00:00
Nikon NIKKOR Z 14-30mm f/4 S Lens with UV Filter Kit - US Model,998.75,2020-12-13 00:00:00
For Nikon Z6 Z7 Top Cover Shell Dial Mode Flex Cable Original,48.99,2020-12-13 00:00:00
Reversible Stretchy Wrap Case Camera Bag For Nikon Z6 Z7 Z-6 Z-7,11.99,2020-12-13 00:00:00
Kipon Tilt Adapter for Nikon F Mount Lens to Nikon Z Mirrorless Camera,210.0,2020-12-13 00:00:00
Nikon Z50 20.9MP Mirrorless Digital Camera (Body Only),642.99,2020-12-13 00:00:00
Weidon adapter for Contax/Yashica CY mount Lens to Nikon Z mount Z6 Z7 camera,39.9,2020-12-13 00:00:00
Nikon 14-30mm F4 S Nikkor Z Lens   20070,1296.95,2020-12-13 00:00:00
Nikon NIKKOR Z 24mm f/1.8 S Lens for Nikon Z,996.95,2020-12-13 00:00:00
Variable Close Focus M42 Lens To Nikon ZFocusing Helicoid Tube Adapter Z50 Z6 Z7,29.5,2020-12-14 00:00:00
Pentax K PK Lens To Nikon Z-Mount Mirrorless Camera Adapter Z6II Z5 Z50 Z6 Z7,16.5,2020-12-14 00:00:00
TECHART TZM-01 For Leica M to Nikon Z Mount Lens Adapter Ring For Z5 Z6 Z7 Z50,349.0,2020-12-14 00:00:00
BRAND NEW Nikon Z 6II FX-Format Mirrorless Camera Body Black ,2194.5,2020-12-14 00:00:00
360 Angle Shutter Release Wireless Remote 100M for Nikon Z6 Z7 D7500 D750 D5600,31.79,2020-12-14 00:00:00
M42 Screw SLR Lens To Nikon Z-Mount Mirrorless Camera Adapter Z50 Z6 Z7,16.5,2020-12-14 00:00:00
1pcs Rear Lens Cap for Nikon Z Mount Mirroless Camera Z6 Z7,6.92,2020-12-14 00:00:00
FOTOFOX adapter for Pentax 645 P645 mount lens to Nikon Z mount Z6 Z7 camera,36.6,2020-12-14 00:00:00
Nikon Z50 Mirrorless Digital Camera with 16-50mm Lens 1633,858.99,2020-12-14 00:00:00
Nikon Z6 24.5MP Mirrorless Camera (Body Only) + MB-N10 Battery Grip * USA Model ,1249.0,2020-12-14 00:00:00
3 foot Flash Extension Cord Off Nikon Camera TTL DSLR Coiled Heavy Duty 3FT,29.95,2020-12-14 00:00:00
"Nikon F Mount Lens to Nikon z50 Z5 Z6 Z7 Mirrorless Camera Adapter ""US Seller""",9.99,2020-12-14 00:00:00
Nikon NIKKOR Z 24-70mm F/4 S Lens kit.,441.0,2020-12-14 00:00:00
"Nikon NIKKOR Z 70-200mm f/2.8 VR S Lens for Z Mount, with Filter Kit #20091 A",2676.95,2020-12-14 00:00:00
Original NEW Side Shell SD CF Card Cover USB Door + Grip Rubber For Nikon Z7 Z6,89.99,2020-12-14 00:00:00
NEW! Nikon NIKKOR Z 50mm f/1.8 S Lens #20083,618.95,2020-12-14 00:00:00
JJC Body Cap & Rear Lens Cap for Nikon Z Mount Z6 Z7 Camera as Nikon BF-N1 LF-N1,6.95,2020-12-14 00:00:00
Mcoplus BG-Z6/Z7 Battery Grip Holder Bracket Plate For Nikon Z6 Z7 for MB-N10,79.95,2020-12-14 00:00:00
"SMDV RF-908 Wireless Cable Shutter Release for Nikon Z7, Z6, D5300, D7500 MC-DC2",70.95,2020-12-14 00:00:00
 BRAND NEW UNTOCHED-Nikon NIKKOR Z 50mm F/1.8 S Lens,486.0,2020-12-14 00:00:00
CheatSheet Nikon Z7 Mirrorless DSLR Laminated Mini Guide to take along!,24.88,2020-12-14 00:00:00
Nikon NIKKOR Z 24-70mm F/4 S Lens (Lightly Used),395.0,2020-12-14 00:00:00
Variable Close Focus M42 Lens To Nikon ZFocusing Helicoid Tube Adapter Z50 Z6 Z7,31.5,2020-12-14 00:00:00
Pentax K PK Lens To Nikon Z-Mount Mirrorless Camera Adapter Z6II Z5 Z50 Z6 Z7,18.5,2020-12-14 00:00:00
TECHART TZM-01 For Leica M to Nikon Z Mount Lens Adapter Ring For Z5 Z6 Z7 Z50,349.0,2020-12-14 00:00:00
BRAND NEW Nikon Z 6II FX-Format Mirrorless Camera Body Black ,2194.5,2020-12-14 00:00:00
"Leica R Lens to Nikon Z Mount Z50 Z6 Z7 Mirrorless Camera Adpater ""US Seller""",12.81,2020-12-14 00:00:00
360 Angle Shutter Release Wireless Remote 100M for Nikon Z6 Z7 D7500 D750 D5600,31.79,2020-12-14 00:00:00
M42 Lens to AI For Nikon F-mount adapter ring D70s New L0Z0 D5100 D100 K2D5,1.74,2020-12-14 00:00:00
M42 Screw SLR Lens To Nikon Z-Mount Mirrorless Camera Adapter Z50 Z6 Z7,18.5,2020-12-14 00:00:00
1pcs Rear Lens Cap for Nikon Z Mount Mirroless Camera Z6 Z7,7.42,2020-12-14 00:00:00
Nikon NIKKOR Z 35mm F/1.8 S Lens,550.0,2020-12-14 00:00:00
FOTOFOX adapter for Pentax 645 P645 mount lens to Nikon Z mount Z6 Z7 camera,36.6,2020-12-14 00:00:00
Nikon Z50 Mirrorless Digital Camera with 16-50mm Lens 1633,832.99,2020-12-14 00:00:00
Nikon Z6 24.5MP Mirrorless Camera (Body Only) + MB-N10 Battery Grip * USA Model ,1268.0,2020-12-14 00:00:00
3 foot Flash Extension Cord Off Nikon Camera TTL DSLR Coiled Heavy Duty 3FT,16.95,2020-12-14 00:00:00
Quick Release L Bracket Plate Mount Vertical Holder Z6 Z7 For Nikon RRS J5G3,18.5,2020-12-14 00:00:00
"Nikon F Mount Lens to Nikon z50 Z5 Z6 Z7 Mirrorless Camera Adapter ""US Seller""",13.94,2020-12-14 00:00:00
E-Z Lens Mount Adapter Ring for Sony E NEX MF Lenses to Nikon Z Z7 Z6 NEX-Z,16.69,2020-12-14 00:00:00
JJC LH-98 Lens Hood replaces Nikon HB-98 for Nikon NIKKOR Z 24-50mm f/4-6.3 Lens,13.39,2020-12-14 00:00:00
Nikon AN-6W Wide Nylon Neck Strap for Camera Neckstrap,30.0,2020-12-14 00:00:00
Nikon NIKKOR Z 24-70mm F/4 S Lens kit.,420.9,2020-12-14 00:00:00
"Nikon NIKKOR Z 70-200mm f/2.8 VR S Lens for Z Mount, with Filter Kit #20091 A",2676.95,2020-12-14 00:00:00
Original NEW Side Shell SD CF Card Cover USB Door + Grip Rubber For Nikon Z7 Z6,89.99,2020-12-14 00:00:00
NEW! Nikon NIKKOR Z 50mm f/1.8 S Lens #20083,596.95,2020-12-14 00:00:00
JJC Body Cap & Rear Lens Cap for Nikon Z Mount Z6 Z7 Camera as Nikon BF-N1 LF-N1,6.95,2020-12-14 00:00:00
Mcoplus BG-Z6/Z7 Battery Grip Holder Bracket Plate For Nikon Z6 Z7 for MB-N10,79.95,2020-12-14 00:00:00
"SMDV RF-908 Wireless Cable Shutter Release for Nikon Z7, Z6, D5300, D7500 MC-DC2",59.95,2020-12-14 00:00:00
 BRAND NEW UNTOCHED-Nikon NIKKOR Z 50mm F/1.8 S Lens,448.0,2020-12-14 00:00:00
CheatSheet Nikon Z7 Mirrorless DSLR Laminated Mini Guide to take along!,11.88,2020-12-14 00:00:00
Nikon NIKKOR Z 24-70mm F/4 S Lens (Lightly Used),405.9,2020-12-14 00:00:00
M42 Screw SLR Lens To Nikon Z-Mount Mirrorless Camera Adapter Z50 Z6 Z7,21.8,2020-12-14 00:00:00
"Nikon F Mount Lens to Nikon z50 Z5 Z6 Z7 Mirrorless Camera Adapter ""US Seller""",13.79,2020-12-14 00:00:00
Nikon NIKKOR Z 24-70mm F/4 S Lens kit.,423.25,2020-12-14 00:00:00
Nikon NIKKOR Z 24-70mm F/4 S Lens (Lightly Used),404.7,2020-12-14 00:00:00
Nikon Z-Series Z7 Z6 Mirror-less Camera Guide / Brochure in English,16.95,2020-12-15 00:00:00
TECHART TZE-01 Auto Focus  Lens Adapter for Sony E FE To Nikon Z Z5 Z6 Z7 Camera,219.0,2020-12-15 00:00:00
