title,price,date
New lens Mount adapter FT-Z FTZ for Nikon Z6 Z7 Z50 micro camera,169.99,2020-08-11 00:00:00
Nikon EN-EL15b Rechargeable Battery D850-D810-D800- D750-D7200-D7300-D610- Z6-Z7,41.99,2020-08-11 00:00:00
NIKKOR Z 24-70mm f/2.8 S Zoom Lens - EXC! *USA Model*,1799.0,2020-08-11 00:00:00
NEW Nikon Z 24-70mm lense f/2.8 S,1899.0,2020-08-11 00:00:00
Nikon NIKKOR Z 50mm F/1.8 S Mirrorless Lens - MINT (Barely Used) ** USA Model,539.0,2020-08-11 00:00:00
Nikon FTZ Mount Adapter mint in box,162.5,2020-08-11 00:00:00
Nikon NIKKOR Z 35mm F/1.8 S Mirrorless Lens - MINT (Barely Used) ** USA Model,539.0,2020-08-11 00:00:00
NEW NIKON FTZ Z MOUNT LENS ADAPTER. USA ITEM.  NEVER USED. NIKON Z6 and Z7,185.0,2020-08-11 00:00:00
Nikon Z 7 Mirrorless Camera,2150.0,2020-08-11 00:00:00
Waterproof Shoulder Bridge Camera Case Bag For Compact System Nikon 1 AW1 Z4,22.49,2020-08-11 00:00:00
"Nikon EN-EL15b OEM & Genuine Battery - For D850, D810, D750, Z7, Z6, D7500",49.84,2020-08-12 00:00:00
Z Flex Ball Head Quick Release Plate System for Nikon D5600 D5000 D5300 D5100,9.95,2020-08-12 00:00:00
ZOMEI Z888 Pro Portable Aluminum Tripod Monopod&Ball Head For Canon Nikon Camera,75.99,2020-08-12 00:00:00
Nikon AN-6W Wide Nylon Neck Strap for Camera Neckstrap DN,30.0,2020-08-12 00:00:00
Nikon Dot Sight DF-M1 Black for Nikon SLR Z7 Z6 P1000 New in Box,195.6,2020-08-12 00:00:00
Nikon SB-910 Speedlight Flash SB910 ref2496216 for d800 d600 d5600 d3 d4  z6 z7,152.99,2020-08-12 00:00:00
Nikon Nikkor Z 24-70mm F/4 S Lens for Nikon Z #28350 L4,410.0,2020-08-12 00:00:00
"Hoodman 128GB CFExpress Type B Memory card + 6 card case, used twice in Nikon Z6",149.0,2020-08-12 00:00:00
Genuine Nikon Remote Release Cord MC-DC2 for Z6 Z7 D7100 D5600 D780 D610 D600 Df,28.99,2020-08-12 00:00:00
"Adapter for Tamron Adaptall I II Lens to Nikon Z Mount Z6 Z7 Camera ""US Seller""",12.53,2020-08-12 00:00:00
"Leica R LR Lens to Nikon Z Mount Z50 Z6 Z7 Mirrorless Camera Adapter ""US Seller""",14.67,2020-08-12 00:00:00
Anti-Scratch Camera Body Cover Carbon Fiber Film Kit For Nikon D810 D850 Z7 Z6,12.99,2020-08-12 00:00:00
Nikon NIKKOR Z 14-30mm f/4 S Camera Lens - Black,999.0,2020-08-12 00:00:00
JJC 2 Slot Camera Battery + Card Pouch Bag Holder for Nikon Z50 Fujifilm X100V,8.99,2020-08-12 00:00:00
"Nikon Z6 24.5MP Body, Excell cond, 10,800 shutter count (5% of shutter life)",1360.0,2020-08-12 00:00:00
Nikon Nikkor Z 24-70mm f4 S Great Condition Free Shipping!,400.0,2020-08-12 00:00:00
Nikon NIKKOR Z 14-30mm f/4 S Camera Lens,950.0,2020-08-13 00:00:00
Bower 67mm UV Filter For Nikon NIKKOR Z 85mm f/1.8 S Lens,25.15,2020-08-13 00:00:00
2.5mm-N3 Remote Cable-PocketWizard to Nikon Z6 Z7 D7500 D750 D5600 D780 D7200,9.74,2020-08-13 00:00:00
M58x1 female thread to Nikon Z camera mount adapter for helicoids,36.5,2020-08-13 00:00:00
QR L-Plate Bracket Hand Grip Holder Handle Plate For Nikon Z6 Z7 Mirrorless Cam,19.78,2020-08-13 00:00:00
Nikon FTZ Mount Adapter (F-Mount Lens to Z-Mount Camera)                    #857,196.75,2020-08-13 00:00:00
Nikon EN-EL15b Rechargeable Battery D850-D810-D800- D750-D7200-D7300-D610- Z6-Z7,41.99,2020-08-13 00:00:00
New K&F Concept adapter for Contax Yashica CY mount lens to Nikon Z6 Z7 camera,44.2,2020-08-13 00:00:00
KMZ Start Lens Onto Sony E Mount (FS100 A7R A7S etc) Adapter With Close Focus,45.5,2020-08-13 00:00:00
Camera Shoulder Neck Strap Vintage Belt For All Dslr Camera Nikon  So B7Z7,6.04,2020-08-13 00:00:00
Floating Wrist Strap Water Buoyancy Band Swim Dive for DSLR Camera Cannon Nikon,21.5,2020-08-14 00:00:00
Nikon Z6 24.5MP Mirrorless Camera Body - EXC and USA,1439.0,2020-08-14 00:00:00
Nikon Z7 and Z6 Mirrorless Cameras User's Instruction Manual - EX,18.17,2020-08-14 00:00:00
Nikon Z 50 Mirrorless Camera (Lens not included) - 2 Year Nikon Aust. Warranty ,1077.49,2020-08-14 00:00:00
Nikon NIKKOR Z DX 50-250mm f/4.5-6.3 VR Telephoto Lens MINT,289.0,2020-08-14 00:00:00
Nikon Z 7 Mirrorless Camera Hardly Used! Free Shipping!,2116.0,2020-08-14 00:00:00
Near Mint!! Nikon NIKKOR Z 24-70mm f/4 S w/ Case for Nikon Z Series,513.0,2020-08-14 00:00:00
Nikon FTZ Mount Adapter (F Lens to Nikon Z-Mount) (new without package),175.0,2020-08-14 00:00:00
Nikon Z7 with FTZ Mount Adapter and Smallrig L-Bracket,2575.0,2020-08-14 00:00:00
Nikon WR-T10 Wireless Remote Controller Transmitter for Z7 Z6 D5600 D780 D750 Df,69.0,2020-08-14 00:00:00
2X BATTERY FOR CASIO NP-80 NP-82 NIKON EN-EL10 EX-G1 S5 S6  S7PE Z550 Z330 Z280 ,17.98,2020-08-14 00:00:00
"Nikon Z6, Z7 Instruction Owner User's Manual Book - NEW",16.99,2020-08-14 00:00:00
Nikon Z50 with Z16-50mm VR Lens Kit WITH Nikon FTZ ADAPTER + EXTRA NIKON BATTERY,964.0,2020-08-15 00:00:00
Z6 Z7 Hand Grip Quick Release NIKON Z6 Z7 L Plate Z7 Camera Bracket for NIKON Z7,20.99,2020-08-15 00:00:00
Nikon NIKKOR Z 24-70mm f/2.8 S zoom Camera Lens - in box - mint condition ,1875.0,2020-08-15 00:00:00
NIkon Nikkor Z 24mm f/1.8 S MINT!!!,779.0,2020-08-15 00:00:00
"Nikon Z 24-70mm F/4 S Lens, Lightly Used, Excellent Condition",417.0,2020-08-16 00:00:00
Nikon NIKKOR Z 35mm F/1.8 S Lens,725.0,2020-08-16 00:00:00
SmallRig Lens Adapter Support for Nikon FTZ Mount Adapter for Z6 Z7 Cage 2243,24.62,2020-08-16 00:00:00
77mm Metal Screw-On Lens Cap for Canon Nikon Sony Pentax Universal DSLR Camera,23.95,2020-08-16 00:00:00
Camera For Nikon Z6 Z7 Siliconen Case Kleur Rubber Cover Case Accessoires,14.5,2020-08-16 00:00:00
Nikon NIKKOR Z 24mm f/1.8 S Lens BNIB,836.0,2020-08-16 00:00:00
SmallRig LCD Screen Sun Hood for Nikon Z6 Z7 Camera Sunshade Sun Shield VH2807,19.9,2020-08-17 00:00:00
LCD Dual Channel Charger For Nikon D850 D810 D800 D750 Z6 Z7 MH-25 EL15b EL15,33.7,2020-08-17 00:00:00
58mm Macro Reverse Lens Adapter Ring For Nikon camera F Ai-s AF-S Close-up D850,15.16,2020-08-17 00:00:00
NIKON NIKKOR Z 85mm F/1.8 S,622.0,2020-08-17 00:00:00
(2 Pack) JJC GSP-Z7 2.5D Tempered Optical Glass LCD Protector for Nikon Z5 Z6 Z7,8.98,2020-08-17 00:00:00
FOTOFOX Camera Macro Focusing Tube Helicoid Adapter For M42 Lens to Nikon Z6 Z7,35.88,2020-08-17 00:00:00
Canon FD mount lens To Nikon Z mount adapter mirrorless camera Z6 Z7 Z50 Z5,20.99,2020-08-17 00:00:00
Nikon 24-70mm F4 Z Lens (new),507.0,2020-08-17 00:00:00
FOTOFOX P6-NZ For Kiev 60 Pentacon 6 P6 Mount Lens to Nikon Z mount Z6 Z7 camera,28.6,2020-08-18 00:00:00
"EN-EL15B Battery Replacement for Nikon Z6, Z7 Mirrorless  D7000 D7100 D7200 D850",21.99,2020-08-18 00:00:00
Soft Hand Grip Strap fr Sony Nikon Z50 Z7 Z6 D5600 D5500 D5300 D3500 D3400 D3300,21.9,2020-08-18 00:00:00
"Nikon Nikkor Z 85MM f/1.8 S for Mirrorless Z50, Z6 & Z7 ",1001.15,2020-08-18 00:00:00
SmallRig LCD Sun Hood for Nikon Z6 and Z7 Cameras #VH2807,79.55,2020-08-18 00:00:00
Bell+Howell High Speed Power Zoom Flash for Canon (Z1080AFZ-C),32.95,2020-08-18 00:00:00
AS-IS Nikon Z50 20.9MP Mirrorless Digital Camera Body Water Damage 1634,327.99,2020-08-18 00:00:00
MC-DC2 LCD Timer Remote Shutter for Nikon Z7 D750 D610 D7500 D7200 D5600 H1,19.6,2020-08-18 00:00:00
"Nikon Z50 Ultimate Camera Bundle! 7 lenses, 3 batteries, filters, flash and MORE",2300.0,2020-08-19 00:00:00
Nikon Z 7 Mirrorless Digital Camera (Body Only),2399.95,2020-08-19 00:00:00
SHOTEN adapter for CONTAX YASHICA CY mount lens to Nikon Z mount Z6 Z7 camera,55.99,2020-08-19 00:00:00
Nikon Genuine Charging AC Adapter EH-7P For Z5 / Z6 / Z7 / D780,24.99,2020-08-19 00:00:00
Opteka 3' Remote Shutter Release Cable for Nikon Z6 P7800 P7700,19.99,2020-08-19 00:00:00
Fikaz CY to NIK-Z Adapter Contax Yashica to Nikon-Z Adapter,42.12,2020-08-19 00:00:00
SHOTEN adapter for LEICA R mount lens to Nikon Z mount Z6 Z7 camera,55.99,2020-08-19 00:00:00
Nikon NIKKOR Z 24-70mm f/4 S,574.95,2020-08-19 00:00:00
Nikon EN-EL15b Rechargeable Battery D850-D810-D800- D750-D7200-D7300-D610- Z6-Z7,41.99,2020-08-20 00:00:00
easyCover Nikon Z50 Camera Protective Case BLACK Silicone EA-ECNZ50B,43.95,2020-08-20 00:00:00
"Brand New Nikon NIKKOR Z 24-70mm F/4 S Lens, black",400.0,2020-08-20 00:00:00
Kipon Lens Adapter for Mamiya 645 M645 Mount Lens to Nikon Z Full Frame Camera,140.0,2020-08-20 00:00:00
New K&F Concept adapter for Leica M39 mount lens to Nikon Z6 Z7 camera,23.92,2020-08-20 00:00:00
PULUZ Soft Silicone Protective Case for Nikon Z6 / Z7,11.99,2020-08-20 00:00:00
K&F Concept Lens Mount Adapter for Pentax PK Mount Lens to Nikon Z Mount  Camera,26.99,2020-08-20 00:00:00
Nikon Z6 Mirrorless Digital Camera with 24-70mm Lens & FTZ Mount Adapter Kit,2309.94,2020-08-20 00:00:00
Nikon Z7 45.7MP Digital Camera - Black (Body Only),2000.0,2020-08-20 00:00:00
Meike 50mm f/1.7 Lens for Nikon Z (Black) - With Free Accessory Bundle,196.49,2020-08-20 00:00:00
For Nikon 80-205mm f/4.5 zoom lens mirrorless Z50 Z6 Z7 Z5 Z mount camera,87.49,2020-08-20 00:00:00
Rokinon 14mm F2.8 Ultra Wide Angle Weather Sealed Lens for Nikon Z Cameras,404.64,2020-08-21 00:00:00
12V-24V car charger dc cable EN-EL15 EP-5B dc coupler for Nikon D850 D610 Z6 Z7,32.5,2020-08-21 00:00:00
Nikon Z6 24.5MP Mirrorless Camera (Body Only) * Low Shutter -- !! READ NOTES !!,1149.0,2020-08-21 00:00:00
"Mitakon Zhongyi Speedmaster 50mm f/0.95 III Lens,Nikon Z Mirrorless Camera Mount",752.26,2020-08-21 00:00:00
Kipon Adapter for Nikon F Mount Lens to Nikon Z Full Frame Mirrorless Camera,90.0,2020-08-21 00:00:00
AS-IS Nikon Z50 20.9MP Mirrorless Digital Camera Body Water Damage 1634,327.99,2020-08-21 00:00:00
Nikon AN-4B Narrow Nylon Neck Strap for Camera Neckstrap DN,26.0,2020-08-21 00:00:00
Nikon HB-86 Bayonet Lens Hood Japan,50.14,2020-08-21 00:00:00
" For Nikon Z50 camera, half leather case bag+hand grip strap, black brown coffee",16.44,2020-08-22 00:00:00
"Opteka NS-7 Swivel Neck Strap for Nikon D3500, D3400, D3300, D3200, Z50, Z7, Z6",20.95,2020-08-22 00:00:00
"Industar-61 L/Z 2.8/50mm mount M42 USSR lens for Canon, Nikon, Sony",50.0,2020-08-22 00:00:00
For Nikon Z6 Top Cover Shell Case + Flash Dial Mode Button Flex Cable Original,279.99,2020-08-22 00:00:00
 EN-EL15b Rechargeable Battery D850-D810-D800- D750-D7200-D7300-D610- Z6-Z7 USA,42.97,2020-08-22 00:00:00
Nikon Z 50 20.9MP with 16-50mm + 50-250mm Lenses Kit. Bundle. Mint.,800.0,2020-08-22 00:00:00
LM-N.Z Leica M Voigtlander Lens to Nikon Z Macro Brass Close Focus Adapter,69.0,2020-08-22 00:00:00
Lomography Petzval 55mm f/1.7 MKII Brass Black Art Lens Canon RF Nikon Z Sony E,590.0,2020-08-22 00:00:00
JJC EN-DK29 II  Eyecup replaces Nikon DK-29 compatible with Nikon Z6 Z7 camera ,22.98,2020-08-22 00:00:00
Nikon Nikkor Z 85mm F1.8 S Autofocus Normal Prime Lens 20090,640.92,2020-08-22 00:00:00
7artisans 60mm F2.8 Fixed Manual Focus Macro Lens for Sony Canon Fuji Nikon M43,159.0,2020-08-23 00:00:00
Samyang 14mm F2.8 Ultra Wide Angle Weather Sealed Lens for Nikon Z Cameras,354.65,2020-08-23 00:00:00
Rollei QBM lens To Nikon Z mount adapter mirrorless full frame camera Z5 Z7 Z50,26.98,2020-08-23 00:00:00
"Nikon Z50 DX-Format Camera w/16-50mm and 50-250mm Lens, FTZ Adapter, Wrist Strap",1173.57,2020-08-23 00:00:00
Nikon Nikkor Z 24-70mm F4 S Autofocus Standard Zoom Lens 20072,458.99,2020-08-23 00:00:00
Nikon Z7/ Z6 Camera Screen + Lens Protector Glass Tempered Protective (2+2 pack),7.99,2020-08-23 00:00:00
" Remote MC-DC2 Shutter Release for Nikon Z7, Z6, COOLPIX  P1000, P7700, P7800",24.84,2020-08-23 00:00:00
Meike MK-Z-AF1 11mm+18mm Metal Auto Focus Macro Extension Tube Adapter Ring,48.79,2020-08-23 00:00:00
Nikon NIKKOR Z 35mm F/1.8 S Mirrorless Lens - MINT,759.0,2020-08-23 00:00:00
Nikon MH-25a Battery Charger EN-EL15 EN-EL15b D610 D750 D810 D7200 D7500 Z6 Z7,14.77,2020-08-24 00:00:00
Nikon Z6 FX-Format Mirrorless Camera Body w/NIKKOR Z 24-70mm f/4 S,2044.95,2020-08-24 00:00:00
Adapter EXA-NZ for Exakta mount lens to Nikon Z Mount Z6 Z7 Camera,110.99,2020-08-24 00:00:00
Eyecup For Nikon D7000 D7100 D750 D610 D5200 D3300 D3100 L0Z1 R2H Ty D5200 R9N8,2.23,2020-08-24 00:00:00
Z Flex Tilt Ball Head Quick Release Plate System for Nikon D7500 D7200 D7100 ,9.95,2020-08-24 00:00:00
Nikon NIKKOR Z 50mm F/1.8 S Lens MINT!!,495.0,2020-08-24 00:00:00
Nikon NIKKOR Z 35mm F/1.8 S Lens,570.0,2020-08-24 00:00:00
Rear Lens Cap Cover for Nikon Z DX 50-250mm f/4.5-6.3 VR and Z 35mm f/1.8 S Lens,9.99,2020-08-24 00:00:00
JJC Body Cap & Rear Lens Cap for Nikon Z Mount Z6 Z7 Camera as Nikon BF-N1 LF-N1,7.15,2020-08-24 00:00:00
 EN-EL15b Rechargeable Battery D850-D810-D800- D750-D7200-D7300-D610- Z6-Z7 USA,42.97,2020-08-24 00:00:00
Kastar EN-EL4 Battery for Nikon D2Z D2H D2Hs D2X D2Xs D3 D3S D3X  F6 ,48.98,2020-08-25 00:00:00
Nikon Z 50 Camera + 16-50mm f/3.5-6.3 VR + 50-250mm f/4.5-6.3 VR Lens ,1519.18,2020-08-25 00:00:00
Nikon Z7 45.7MP Digital Camera - Black (Body Only)  5k Shutter Count!!,2089.0,2020-08-25 00:00:00
Nikon nikkor z 24-70mm f/4 s lens,438.0,2020-08-25 00:00:00
JJC AutoFocus Calibration Aid for Nikon Z6 Z7 D7500 D850 D810A D810 D800 D800E,34.99,2020-08-25 00:00:00
LM-Z Manual Adapter for Leica M LM Zeiss ZM Lens to Nikon Z Mount Z6 Z7 Camera,38.98,2020-08-25 00:00:00
Vintage Camera Shoulder Neck Strap Sling Belt for Nikon Sony Panasonic SLR T5Z7,7.98,2020-08-25 00:00:00
SHOTEN Lens adapter Close Focus for Leica M mount to Nikon Z Z6 Z7 camera Black,253.0,2020-08-25 00:00:00
Nikon Nikkor Z 24-70mm F/4 S Lens from Japan【Mint】642510,402.2,2020-08-25 00:00:00
ALTSON Auto Focus Adaptor CEF-NZ for Canon EOS EF Lens to Nikon Z Z6 Z7 Camera,186.0,2020-08-26 00:00:00
Opteka Z Bracket Tripod Head Mount for Nikon D3500 D3400 D3300 D3200 Z50 Z7 Z6,32.95,2020-08-26 00:00:00
Handheld Pistol Grip Tripod + Remote Control For Nikon Z6 Z5 P1000 Z Type MC-DC2,33.98,2020-08-26 00:00:00
 FOTOFOX AI-NZ adapter for Nikon F AI AIS mount lens to Nikon Z Z6 Z7 camera,26.0,2020-08-26 00:00:00
Nikon Z6 Digital Mirrorless Camera CheatSheet,12.95,2020-08-26 00:00:00
FOTOFOX adapter for Pentax 645 P645 mount lens to Nikon Z mount Z6 Z7 camera,36.6,2020-08-26 00:00:00
Half Leather Case Bag Cover Grip for Nikon Z 50 DX-Format Mirrorless Camera Z50,14.49,2020-08-26 00:00:00
Nikon NIKKOR Z 85mm f/1.8 S Lens Near Perfect Condition! basically unused+filter,699.99,2020-08-26 00:00:00
SmallRig 2258 Arca L-Bracket Cage for Nikon Z6 Z7 US Stock,49.85,2020-08-26 00:00:00
Kipon Macro Helicoid Adapter for Leica M Lens to Nikon Z Mirrorless Camera,203.0,2020-08-26 00:00:00
Nikon Z 6 Body + original Sony 64GB memory card (memory card RRP £168),1919.09,2020-08-26 00:00:00
SHOTEN adapter for MINOLTA MD MC SR mount lens to Nikon Z mount Z6 Z7 camera,55.99,2020-08-27 00:00:00
nikon z6 ,1350.0,2020-08-27 00:00:00
nikon z 35mm f1.8 s,600.0,2020-08-27 00:00:00
Nikon LC-72B 72mm Snap-on Lens Cap #4195,19.95,2020-08-27 00:00:00
Rear Lens Cap Camera Dust Cover for Nikon Z Mount DX16-50 DX50-250 24-70S 14-30S,7.87,2020-08-27 00:00:00
New NIKON NIKKOR Z 35mm f/1.8 S Lens - GENTLY USED,684.0,2020-08-27 00:00:00
Meike MK-Z-AF1 Auto Focus Macro Extension Tube Adapter 11&18mm For Nikon Z6 Z7,59.97,2020-08-27 00:00:00
SmallRig HDMI and USB Type-C Cable Clamp for Nikon Z5/Z6/Z7 Camera 2927,25.9,2020-08-27 00:00:00
TECHART TZC-01 Auto Focus Lens Adapter for Canon EF EOS To Nikon Z6 Z7 Z50 Camer,232.0,2020-08-27 00:00:00
GABALE MD-Z adapter for Minolta MD/MC mount lens to Nikon Z mount Z6 Z7 camera,45.9,2020-08-27 00:00:00
Nikon Z6 FX-Format Mirrorless Camera Body with Mount Adapter FTZ #1595 AD,1843.9,2020-08-28 00:00:00
Nikon NIKKOR Z 24-70mm F/4 S Lens #J06001,521.99,2020-08-28 00:00:00
Nikon Z50 Mirrorless Digital Camera (Body Only),694.95,2020-08-28 00:00:00
Brand New Unused Nikon FTZ F to Z Lens Mount Adapter NIKKOR AF-S I P E G D Z7 Z6,224.0,2020-08-28 00:00:00
Nikon Camera Neck official Strap Z6 Z7  Camera Strap AN-DC19,33.0,2020-08-28 00:00:00
Nikon Z7 45.7MP Digital Camera - Black (Body Only)  5k Shutter Count!!,2089.0,2020-08-28 00:00:00
Andoer On-Camera Cold Shoe Mount Adapter for Canon Nikon SonyDSLR Camera Z6R7,6.98,2020-08-28 00:00:00
Lens MC Industar - 61 L/Z M42 для Practica Canon Nikon Zenit № 8410724,79.99,2020-08-28 00:00:00
"EN-EL15B Battery for Nikon Z6, Z7 Mirrorless D7000 D7100 D7200 UK STOCK ",35.46,2020-08-28 00:00:00
TP original Camera Half Case For Nikon Z7 / Z6,74.0,2020-08-28 00:00:00
Futura-S Optical head onto Sony E  mount adapter with fast focus helical ,81.25,2020-08-29 00:00:00
 EN-EL15b Rechargeable Battery D850-D810-D800- D750-D7200-D7300-D610- Z6-Z7 USA,42.97,2020-08-29 00:00:00
SmallRig L-Bracket for Nikon Z6 and Nikon Z7 Camera Arca-Type compatible 2258,69.0,2020-08-29 00:00:00
NIKKOR Z 14-30mm f/4 S,1154.95,2020-08-29 00:00:00
Nikon Z7 Mirrorless Digital Camera with NIKKOR Z 24-70mm f/2.8 Lens,4633.84,2020-08-29 00:00:00
VERY SHARP RUSSIAN USSR EXPORT INDUSTAR-61 L/Z LENS f2.8/50 M42 mount (1),89.99,2020-08-29 00:00:00
Nikon Z6 Mirrorless Body 24MP 4K video + 2 batteries + Sony 120gb XQD card,1799.0,2020-08-29 00:00:00
Nikon NIKKOR Z 35mm F/1.8 S Lens **MINT** Condition!  ,698.0,2020-08-29 00:00:00
Nikon Battery Door Cover For D7000 D7100 D610 Digital F2Y9 camera Lid HOT P2Z8,3.55,2020-08-29 00:00:00
Zhongyi 50mm F0.95 III Large Aputure Lens for Canon RF SONY E Nikon Z Mount Came,696.0,2020-08-29 00:00:00
M42 Lens to AI For Nikon F-mount adapter ring D70s D7000 D100 D5100 L0Z0 F7H1,2.22,2020-08-30 00:00:00
Nikon FTZ Mount Adapter (Nikon F to Z - Mount),129.99,2020-08-30 00:00:00
Nikon Nikkor Z 50mm f/1.8 S Mirrorless Lens,596.95,2020-08-30 00:00:00
"500mm 1000mm Telephoto Lens for Nikon Z6, Z7 Mirrorless Cameras",119.99,2020-08-30 00:00:00
SHOTEN adapter for CANON EF mount lens to Nikon Z mount Z6 Z7 camera,55.99,2020-08-30 00:00:00
Nikon Z50 Camera +16-50mm VR + FTZ + Accessories+Small Rig,700.0,2020-08-30 00:00:00
Zacuto 2.5X Z-Finder Pro Optical Viewfinder for Canon Nikon Sony Olympus,192.0,2020-08-30 00:00:00
EN-EL15 power supply EH-5A+EP-5B dc coupler For Nikon D800 D850 D500 D7500 Z6 Z7,36.8,2020-08-30 00:00:00
Silicon Rubber Case Cover Body Skin Protector for Nikon Z7 Z6 Mirrorless Camera,14.59,2020-08-31 00:00:00
FRONT SNAP-ON LENS CAP DIRECTLY TO CAMERA NIKON COOLPIX L330 L 330 +HOLDER,18.24,2020-08-31 00:00:00
EXCELLENT CONDITION Nikon NIKKOR Z 50mm F/1.8 S Lens,480.0,2020-08-31 00:00:00
Nikon Nikkor Z DX 16-50mm f/3.5-6.3 VR,180.0,2020-08-31 00:00:00
Nikon AF NIKKOR 85mm F1.8D Portrait Prime Lens for F Mount with Box #200717z,256.03,2020-08-31 00:00:00
Nikon Z6 24.5MP Digital Mirrorless Camera - NIKKOR Z 24-70mm Lens Kit & More,2000.0,2020-08-31 00:00:00
Nikon NIKKOR Z 35mm f/1.8 S Z Mount System Mirrorless Wide Angle Prime Lens,828.45,2020-09-18 00:00:00
Nikon Z 50 20.9MP Mirrorless Interchangeable Lens Camera W/ Extras,599.99,2020-09-19 00:00:00
Nikon NIKKOR Z 24-70mm F/4 S Lens - Near Mint! Used Twice - w/ POL Filter,419.99,2020-09-19 00:00:00
Nikon SMZ 10 2T U Microscope FULL FRAME camera kit W 42mm 2 Nikon F & Z Opti lab,60.95,2020-09-19 00:00:00
GABALE Leica M ZM VM-NZ Close Focus Adapter to Nikon Z camera Z6 Z7 LM-NZ CF,79.9,2020-09-19 00:00:00
"Zomei Z818 Pro Compact Aluminium Tripod Monopod,Ball Head for DSLR Camera Nikon",101.99,2020-09-19 00:00:00
M39 mount Leica LTM screw lens To Nikon Z mount adapter camera Z6 Z7 Z5 Z50,18.49,2020-09-19 00:00:00
SmallRig Vlogging Mounting Plate for Nikon Z50 Camera LCN2525 2525,14.0,2020-09-19 00:00:00
Nikon MC-DC2 Remote Control Cable Release for D780 D7500 D7200 D5500 D3300 Z6,28.18,2020-09-19 00:00:00
Nikon Z 50 20.9MP Mirrorless Interchangeable Lens Camera W/ Extras,599.99,2020-09-19 00:00:00
Nikon NIKKOR Z 24-70mm F/4 S Lens - Near Mint! Used Twice - w/ POL Filter,419.99,2020-09-19 00:00:00
Nikon SMZ 10 2T U Microscope FULL FRAME camera kit W 42mm 2 Nikon F & Z Opti lab,50.95,2020-09-19 00:00:00
GABALE Leica M ZM VM-NZ Close Focus Adapter to Nikon Z camera Z6 Z7 LM-NZ CF,79.9,2020-09-19 00:00:00
"Zomei Z818 Pro Compact Aluminium Tripod Monopod,Ball Head for DSLR Camera Nikon",89.99,2020-09-19 00:00:00
M39 mount Leica LTM screw lens To Nikon Z mount adapter camera Z6 Z7 Z5 Z50,18.49,2020-09-19 00:00:00
SmallRig Vlogging Mounting Plate for Nikon Z50 Camera LCN2525 2525,21.0,2020-09-19 00:00:00
Nikon Z 7 Mirrorless Digital Camera with 24-70mm f/2.8 S Lens + EXT BATT Bundle,4929.95,2020-09-19 00:00:00
Nikon Z 50 with 16-50mm VR Lens Kit Mirrorless 20.9MP Camera + EXTRAS,849.0,2020-09-20 00:00:00
"Nikon NIKKOR Z 35mm F/1.8 S Lens, Near Mint!!!",695.0,2020-09-20 00:00:00
"Remote Shutter Release MC-DC2 FOR NIKON Z 7, Z 6, COOLPIX P1000, P950, D780",23.13,2020-09-20 00:00:00
Zhongyi Mitakon Speedmaster 85mm f/1.2 Lens for Nikon Z Mount Camera,688.0,2020-09-20 00:00:00
Simple Kipon Adapter for Contax Rangefinder RF Lens to Nikon Z Full Frame Camera,82.0,2020-09-20 00:00:00
Kipon Adapter for Exakta Lens to Nikon Z Full Frame Mirrorless Camera,90.0,2020-09-20 00:00:00
"Nikon Nikkor telephoto Lens Z 50-250mm, Black",368.44,2020-09-20 00:00:00
Nikon Z6 Digitalkamera Kit mit 24-70mm F4 Objektiv - TOP,900.0,2020-09-20 00:00:00
4-Pack Khaos For Nikon Z50 Tempered Glass Screen Protector,9.94,2020-09-20 00:00:00
"Really Right Stuff RRS BZ7-L Arca Plate for Nikon Z7, Z6 and Z5 Cameras ",95.0,2020-09-20 00:00:00
Rear Lens Cap & Body Cap Cover Fit for Z Mount for Nikon Z50 Z7 Z6 Replace L…,34.52,2020-09-20 00:00:00
Nikon Z 50 with 16-50mm VR Lens Kit Mirrorless 20.9MP Camera + EXTRAS,849.0,2020-09-20 00:00:00
Nikon NIKKOR Z 50mm F/1.8 S Lens w/FREE UV Filter *NEW*,596.95,2020-09-20 00:00:00
"Nikon NIKKOR Z 35mm F/1.8 S Lens, Near Mint!!!",712.25,2020-09-20 00:00:00
"Remote Shutter Release MC-DC2 FOR NIKON Z 7, Z 6, COOLPIX P1000, P950, D780",23.13,2020-09-20 00:00:00
Zhongyi Mitakon Speedmaster 85mm f/1.2 Lens for Nikon Z Mount Camera,688.0,2020-09-20 00:00:00
Simple Kipon Adapter for Contax Rangefinder RF Lens to Nikon Z Full Frame Camera,82.0,2020-09-20 00:00:00
Kipon Adapter for Exakta Lens to Nikon Z Full Frame Mirrorless Camera,90.0,2020-09-20 00:00:00
"Nikon Nikkor telephoto Lens Z 50-250mm, Black",368.44,2020-09-20 00:00:00
4-PCS CLOSE-UP MACRO LENS SET +1 +2 +4 +10 for NIKON FM10,24.95,2020-09-21 00:00:00
Nikon Z6 Mirrorless Camera Body •MINT• Batt+Dummy Batt - Shutter C. 7 Full Frame,1510.0,2020-09-21 00:00:00
Sony E NEX lens To Nikon Z mount adapter mirrorless full frame camera Z6 Z7 Z5,20.99,2020-09-21 00:00:00
RED QR L-Plate Bracket Hand Grip Holder For Nikon Z6 Z7 Mirrorless Camera,19.98,2020-09-21 00:00:00
Kastar EN-EL4 Battery for Nikon D2Z D2H D2Hs D2X D2Xs D3 D3S D3X  F6 ,66.98,2020-09-21 00:00:00
RED Aluminum Thumb Rest Thumb Up Thumb Grip Hot Shoe Cover For Nikon Z6 Z7,12.59,2020-09-21 00:00:00
Nikon Premium Shoulder Bag z Series Lightweight NZ-PRSB NZPRSB,204.47,2020-09-21 00:00:00
Nikon NIKKOR Z 24-70mm f/4 S Zoom Lens,633.0,2020-09-21 00:00:00
Nikon Z50 Mirrorless Digital Camera with 16-50mm Lens 1633,855.99,2020-09-21 00:00:00
"SmallRig Plate for Nikon Z50 Camera with Cold Shoe Mount & 1/4"" Thread - LCN2525",38.01,2020-09-21 00:00:00
MIC-06 3.5mm Stereo Microphone Recording Mic Nikon D750 D700 D610 D7500 D7200 Z7,15.95,2020-09-21 00:00:00
Nikon Z 50mm f/1.8 S lens BRAND NEW ~ 2 YEAR NIKON WORLDWIDE WARRANTY,588.77,2020-09-21 00:00:00
Nikon NIKKOR Z 85mm F/1.8 S Lens *NEW* *IN STOCK*,796.95,2020-09-21 00:00:00
Nikon Z6 Body w/Free Extra OEM Battery *NEW* ,1796.95,2020-09-21 00:00:00
LM-NZ/M Macro Focusing Adapter For Leica M Lens to Nikon Z Z5 Z7 Z6 mount Camera,39.99,2020-09-21 00:00:00
4-PCS CLOSE-UP MACRO LENS SET +1 +2 +4 +10 for NIKON FM10,13.95,2020-09-21 00:00:00
Nikon Z6 Mirrorless Camera Body •MINT• Batt+Dummy Batt - Shutter C. 7 Full Frame,1519.0,2020-09-21 00:00:00
Sony E NEX lens To Nikon Z mount adapter mirrorless full frame camera Z6 Z7 Z5,20.99,2020-09-21 00:00:00
RED QR L-Plate Bracket Hand Grip Holder For Nikon Z6 Z7 Mirrorless Camera,19.98,2020-09-21 00:00:00
Kastar EN-EL4 Battery for Nikon D2Z D2H D2Hs D2X D2Xs D3 D3S D3X  F6 ,55.98,2020-09-21 00:00:00
RED Aluminum Thumb Rest Thumb Up Thumb Grip Hot Shoe Cover For Nikon Z6 Z7,12.59,2020-09-21 00:00:00
Nikon Premium Shoulder Bag z Series Lightweight NZ-PRSB NZPRSB,204.47,2020-09-21 00:00:00
Nikon NIKKOR Z 24-70mm f/4 S Zoom Lens,611.8,2020-09-21 00:00:00
Nikon Z50 Mirrorless Digital Camera with 16-50mm Lens 1633,829.99,2020-09-21 00:00:00
"SmallRig Plate for Nikon Z50 Camera with Cold Shoe Mount & 1/4"" Thread - LCN2525",26.01,2020-09-21 00:00:00
MIC-06 3.5mm Stereo Microphone Recording Mic Nikon D750 D700 D610 D7500 D7200 Z7,15.95,2020-09-21 00:00:00
Nikon Z 50mm f/1.8 S lens BRAND NEW ~ 2 YEAR NIKON WORLDWIDE WARRANTY,588.77,2020-09-21 00:00:00
Nikon Z6 Mirrorless Digital Camera with 24-70mm Lens + FTZ Mount Adapter *MINT*,2186.0,2020-09-22 00:00:00
Nikon Z6 Full frame Mirrorless (Body Only) - Excellent - <2000 clicks! XQD incl!,1346.0,2020-09-22 00:00:00
Nikon Z6 with FTZ Mount Adapter 24-70 F4 Lens and more,2000.0,2020-09-22 00:00:00
Nikon Z6 Full Frame Mirrorless Camera Body Nikon USA Warranty Complete Body Set,1400.0,2020-09-22 00:00:00
USA Premium Slim Canvas Camera Strap for Sony NEX Nikon Z Canon Leica M9 Fuji,27.98,2020-09-22 00:00:00
NEW! Nikon Z6 Mirrorless Digital Camera with 24-70mm Lens & FTZ Mount Adapter,2446.9,2020-09-22 00:00:00
LCD Display Screen Monitor Repair Parts For  EX-Z60 Z70 Z6 Z7 Wide Cable,24.98,2020-09-22 00:00:00
Nikon NIKKOR Z 24-70mm f/2.8 S Standard Camera Lens - Black - pristine!,1843.0,2020-09-22 00:00:00
Nikon Z6 / Z7 Mirrorless Camera Instruction Book / Manual / User Guide,28.24,2020-09-22 00:00:00
Self-adhesive Tempered Glass LCD Screen Protector for Nikon Z50 Z 50 Camera,2.99,2020-09-22 00:00:00
