title,price,dateDHL Megadap MTZ11 AF Adapter for Leica M VM lens to Nikon Z Z5 Z6 Z7 Z50 Z6/7 II,349.0,2020-10-31 00:00:00
Z Flex Tilt Head Folding QR Plate Camera Ball Head Holder for Canon Nikon Sony,35.79,2020-10-31 00:00:00
Peak Design Nikon Z Strap - Nikon Z Limited Edition (Z5-Z6-Z7-Z50-Z6ii-Z7ii),191.1,2020-10-31 00:00:00
TECHART TZE-01 Auto-Focus For Sony FE Mount Lens Adapter to Nikon Z6 Z7 Camera,225.0,2020-10-31 00:00:00
Original NEW SD CF Card Cover Door Grip Handle  Holding Rubber For Nikon Z7 Z6,31.99,2020-10-31 00:00:00
Shoot Remote Control MC-DC2 Shutter Release Coolpix P1000 Nikon Z7 Nikon Z 6,14.41,2020-10-31 00:00:00
UURig R039 L Bracket Quick Release Plate Mount For Nikon Z50 Cam Video Shooting,24.03,2020-10-31 00:00:00
Pixco Camera Adapter For Leica M39 L39 Lens To Nikon Z6 Z7 Full Frame Mirrorless,17.09,2020-10-31 00:00:00
"Original Nikon Neck Strap 1.5"" Black Yellow Stitched White ""Nikon Z"" ",12.99,2020-10-31 00:00:00
【NEAR MINT】Nikon Black Shoulder Neck Strap For Nikon Z6 From Japan #0002,22.99,2020-10-31 00:00:00
"HELIOS 44-2 F2 58MM VINTAGE LENS M42 USSR with adapter CANON, NIKON, Sony",65.0,2020-10-31 00:00:00
Nikon NIKKOR Z 50mm F/1.8 S Lens w/FREE UV Filter *NEW*,596.95,2020-10-31 00:00:00
"Leica M lens to Nikon Z Mount Adapter, fits Nikon Z50 Z6 Z7 Mirrorless Camera",12.98,2020-10-31 00:00:00
BG-Z6/7 Battery Hand Grip Vertical Multi Powe Grips for Nikon Z6 Z7 DSLR MB-N10,78.98,2020-10-31 00:00:00
Nikon Z 24-70 F4 Lens Hood,25.0,2020-10-31 00:00:00
DHL Megadap MTZ11 AF Adapter for Leica M VM lens to Nikon Z Z5 Z6 Z7 Z50 Z6/7 II,349.0,2020-10-31 00:00:00
Z Flex Tilt Head Folding QR Plate Camera Ball Head Holder for Canon Nikon Sony,35.79,2020-10-31 00:00:00
Peak Design Nikon Z Strap - Nikon Z Limited Edition (Z5-Z6-Z7-Z50-Z6ii-Z7ii),267.85,2020-10-31 00:00:00
TECHART TZE-01 Auto-Focus For Sony FE Mount Lens Adapter to Nikon Z6 Z7 Camera,225.0,2020-10-31 00:00:00
Original NEW SD CF Card Cover Door Grip Handle  Holding Rubber For Nikon Z7 Z6,31.99,2020-10-31 00:00:00
Shoot Remote Control MC-DC2 Shutter Release Coolpix P1000 Nikon Z7 Nikon Z 6,22.43,2020-10-31 00:00:00
UURig R039 L Bracket Quick Release Plate Mount For Nikon Z50 Cam Video Shooting,24.03,2020-10-31 00:00:00
Pixco Camera Adapter For Leica M39 L39 Lens To Nikon Z6 Z7 Full Frame Mirrorless,15.79,2020-10-31 00:00:00
82mm Metal Screw-On Lens Cap for Canon Nikon Sony Pentax Universal DSLR Camera,28.95,2020-10-31 00:00:00
Shoulder Camera Case Bag For NIKON COOLPIX A1000 A900 B500 B700 B600 Z7 Z6,21.5,2020-10-31 00:00:00
Nikon Z Genuine Camera Neck Strap AN-DC19 For Z5 / Z6 / Z7 / Z50,28.49,2020-11-01 00:00:00
M43-Z Lens Mount Adapter Ring for Micro 4/3 M43 MFT Lens to Nikon Z Z7 Z6 Camera,16.39,2020-11-01 00:00:00
4PCS Hot Shoe Cover fr Nikon Z7 Z6 D850 D810 D750 D700 D7500 D7200 D5600 as bc-1,8.59,2020-11-01 00:00:00
2X EN-EL15b Battery + USB charger for Nikon D7200 D850 D610 Z7 Z6 Mirrorless Cam,33.74,2020-11-01 00:00:00
Nikon Z7 Body 45.7MP fullframe Mirrorless Digital Camera body -Near Mint- #257,2289.56,2020-11-01 00:00:00
Nikon FTZ Mount Lens Adapter - Nikon Z Camera Mount to Nikon F Lens Mount,154.0,2020-11-01 00:00:00
 EN-EL15b Rechargeable Battery D850-D810-D800- D750-D7200-D7300-D610- Z6-Z7 USA,25.97,2020-11-01 00:00:00
For Nikon Z50 Battery Cover Battery Door Cap Lid NEW Original,39.99,2020-11-01 00:00:00
【US Dealer】LEOFOTO Z6/Z7 Camera Cage Dedicated for Nikon Z 6 / Z 7,84.0,2020-11-01 00:00:00
4 Slot Camera Battery+Card Pouch Bag Holder for Nikon Z7 Z6 D850 D810 D750 D610,10.99,2020-11-01 00:00:00
Kipon Tilt Adapter for Nikon F Mount Lens to Nikon Z Mirrorless Camera,210.0,2020-11-01 00:00:00
Nikon AN-4Y Narrow Nylon Neck Strap for Camera Neckstrap,27.0,2020-11-01 00:00:00
Metz Mecablitz 52 AF-1 digital Flash for Nikon DSLR Z6 Z7 D850 D810 camera,110.0,2020-11-01 00:00:00
"YP-860II/DC2 Wireless Shutter Release Remote Control for Nikon Z7,Z6,D7500,D7200",39.3,2020-11-01 00:00:00
K&F Concept Lens Mount Adapter for M39 Mount Lens to Nikon Z6 Z7 Camera,17.99,2020-11-01 00:00:00
4PCS Hot Shoe Cover fr Nikon Z7 Z6 II Z5 D850 D810 D750 D700 D7500 D5600 as BC-1,8.59,2020-11-01 00:00:00
Nikon FTZ Mount Lens Adapter - Nikon Z Camera Mount to Nikon F Lens Mount,153.0,2020-11-01 00:00:00
GUTTY Lens Mount Adapter for Canon EOS EF Mount Lens to Nikon Z6 Z7 Camera New,54.57,2020-11-01 00:00:00
K&F Concept Lens Mount Adapter for M39 Mount Lens to Nikon Z6 Z7 Camera,21.61,2020-11-01 00:00:00
EH-5A Plus EP-5A AC Power Adapter Camera Charger for Nikon D5100 D5200 D530 F1Z9,30.99,2020-11-02 00:00:00
Reversible Lens Hood fr Nikon Nikkor Z DX 50-250mm f/4.5-6.3 VR on Z50 as HB-90A,12.99,2020-11-02 00:00:00
 EN-EL15b Rechargeable Battery D850-D810-D800- D750-D7200-D7300-D610- Z6-Z7 USA,25.97,2020-11-02 00:00:00
Nikon NIKKOR Z 70-200mm f/2.8 VR S,2754.95,2020-11-02 00:00:00
4x Camera Strap Triangle Split Ring Adapter+Cap For Fuji Nikon Canon New O0Z6,1.8,2020-11-02 00:00:00
"Helios 44m-4 lens F2.0/58mm M42 USSR Russia, with adapter for Canon, Nikon, Sony",49.0,2020-11-02 00:00:00
JJC LCD Timer Remote Control for Nikon Z7 Z6 D750 D610 D600 D7200 D5600 D5500 Df,19.99,2020-11-02 00:00:00
Z Flex Tilt Ball Head Quick Release Plate System for Canon Nikon Sony Cameras,9.95,2020-11-02 00:00:00
Nikon Z6 +  Nikkor Z 24-70mm f4 lens +  FTZ Lens Adapter - Kit - MINT CONDITION ,2150.0,2020-11-02 00:00:00
Nikon Charging Kit for D7500 D7200 D850 D810 D800 D780 D750 D610 D500 Z6 Z7 DN,199.0,2020-11-02 00:00:00
Nikon Nikkor Z 24-70mm f4 S Lens #268,587.75,2020-11-02 00:00:00
"JJC Remote Control Connecting Cable Cord M for Nikon D7500, D750, Z7, Z6 MC-DC2",22.26,2020-11-02 00:00:00
Nikon NIKKOR Z 24-70mm F/4 S Lens,440.0,2020-11-02 00:00:00
Nikon Z50 Camera w/ 16-50mm USA Lens Kit - Pristine!,785.99,2020-11-02 00:00:00
 EN-EL15b Rechargeable Battery D850-D810-D800- D750-D7200-D7300-D610- Z6-Z7 USA,25.97,2020-11-02 00:00:00
Nikon Z7 45.7MP Digital Camera - Black (Body Only) extra battery and 120gb xqd ,2059.0,2020-11-02 00:00:00
MC-DC2 LCD Timer Remote Shutter for Nikon Z7 D750 D610 D7500 D7200 D5600,20.82,2020-11-02 00:00:00
4x Camera Strap Triangle Split Ring Adapter+Cap For Fuji Nikon Canon New O0Z6,3.09,2020-11-02 00:00:00
HB-N/Z Adapter for Hasselblad HB V CF Lens to Nikon Z mount Z6 Z7 Z50 Mirrorless,30.97,2020-11-02 00:00:00
"JJC Remote Control Connecting Cable Cord M for Nikon D7500, D750, Z7, Z6 MC-DC2",8.05,2020-11-02 00:00:00
Nikon Z50 Camera w/ 16-50mm USA Lens Kit - Pristine!,783.99,2020-11-02 00:00:00
Nikon Z7 45.7MP Digital Camera - Black (Body Only) extra battery and 120gb xqd ,2056.0,2020-11-02 00:00:00
MC-DC2 LCD Timer Remote Shutter for Nikon Z7 D750 D610 D7500 D7200 D5600,21.46,2020-11-02 00:00:00
Adapter M39-NZ for Leica M39 mount lens to Nikon Z Mount Z6 Z7 Camera,105.98,2020-11-03 00:00:00
AODELAN Wireless Shutter Release Remote Control For Nikon D750 D5300 D5600 Z6 Z7,42.71,2020-11-03 00:00:00
Rear Lens Cover + Camera Front Body Cap for Nikon Z7 Z6 replace BF-N1 LF-ODUS,3.4,2020-11-03 00:00:00
Pixco Adjustable Macro to Infinity Lens Adapter For Leica M Mount to Nikon Z6 Z7,38.28,2020-11-03 00:00:00
GABALE QR L Plate Bracket Camera Grip Camera Holder for Nikon Z7 Z6 LB-Z7 ,43.9,2020-11-03 00:00:00
"D-Tap to Nikon D610, D800, D810, D850, D7500, Z6, Z7 (20"")",50.0,2020-11-03 00:00:00
V-mount Power Plate+EN-EL15 Dummy Battery+15mm Rod Clamp for Nikon D7200 D850 Z7,81.69,2020-11-03 00:00:00
SmallRig Universal 15mm Rail Support System Baseplate for Nikon Z6/Z7 Cage 2272,89.0,2020-11-03 00:00:00
Genuine Nikon OEM HB-85 Bayonet Lens Hood for NIKKOR Z 24-70mm f/4 S Lens,43.0,2020-11-03 00:00:00
Nikon Z7 45.7MP Digital Camera - Black (Body Only) US Model + Extras,2090.0,2020-11-03 00:00:00
HELIOS 44m-6 MC F/2 58mm LENS CANON SONY MTF FX NX NIKON Z MINT + PASSPORT,85.0,2020-11-03 00:00:00
"M42 Lens Adapter To Nikon Z Lens Mount for Nikon Z7, Z6, Z5, Z50 Camera ",15.05,2020-11-03 00:00:00
JJC KS-Z7SK Anti Scratch Protective Skin Film for Nikon Z7 Z6 Camera Custom Fit ,25.98,2020-11-03 00:00:00
SmallRig Form-Fitted Cage for Nikon Z6/ Nikon Z7 Camera 2243 US,83.99,2020-11-03 00:00:00
52mm Center Pinch Snap Front Lens Cap Cover For Canon String W Nikon New Q0Z5,1.81,2020-11-03 00:00:00
Battery Cover for Nikon EN-EL15 D600 D610 D7100 D750 D800 D810 V1 D850 Z6 Z7,3.99,2020-11-03 00:00:00
 FOTOFOX adapter for Leica LM Zeiss M VM mount lens to Nikon Z mount Z6 Z7camera,25.5,2020-11-03 00:00:00
Nikon Z50 DX Mirrorless Camera Body w NIKKOR Z DX 16-50mm f/3.5-6.3 VR Lens,739.0,2020-11-03 00:00:00
7Artisans 35mm F1.2 II Large Aperture Lens For Sony E/Fuji FX/NIKON Z/Canon EOS,139.0,2020-11-03 00:00:00
Adapter M39-NZ for Leica M39 mount lens to Nikon Z Mount Z6 Z7 Camera,89.98,2020-11-03 00:00:00
Genuine Nikon OEM HB-85 Bayonet Lens Hood for NIKKOR Z 24-70mm f/4 S Lens,44.0,2020-11-03 00:00:00
Nikon Z7 45.7MP Digital Camera - Black (Body Only) US Model + Extras,2084.0,2020-11-03 00:00:00
SmallRig Form-Fitted Cage for Nikon Z6/ Nikon Z7 Camera 2243 US,84.99,2020-11-03 00:00:00
Wireless Shutter Release Remote Control MC-DC2 For Nikon Z7 Z6 D7500 D7200 D7100,25.79,2020-11-03 00:00:00
7Artisans 35mm F1.2 II Large Aperture Lens For Sony E/Fuji FX/NIKON Z/Canon EOS,118.0,2020-11-03 00:00:00
AF 67MM 18K FISHEYE LENS + MACRO LENS FOR Nikon NIKKOR Z 85mm f/1.8 S Lens 180°,45.88,2020-11-04 00:00:00
Nikon Z series Z6 Z7 Just fit bag in bag Z logo Black Japan original,99.98,2020-11-04 00:00:00
Nikon Z6 24.5MP Mirrorless Camera (Body Only) + FTZ Adapter ** USA Model ,1479.0,2020-11-04 00:00:00
"Flash Hot Shoe Cover Protector Standard Flash For Nikon Canon, Pentax, Olympus +",25.95,2020-11-04 00:00:00
Thumb Rest Thumb Up Thumb Grip Hot Shoe Cover For Nikon Z6 Z7,12.58,2020-11-04 00:00:00
Aluminium Alloy Vertical L-shape Quick Release Bracket Plate For Nikon Z6 Z7 Cam,21.22,2020-11-04 00:00:00
JJC LH-HN40 Lens Hood Shade Fr Nikon NIKKOR Z DX 16-50mm f/3.5-6.3 VR Lens HN-40,25.98,2020-11-04 00:00:00
FED F/3.5 50mm INDUSTAR 10 COLLAPSIBLE LENS ADAPTED NIKON Z Z5 Z50 Z6 Z7 ADAPTER,77.0,2020-11-04 00:00:00
7artisans 35mm F0.95 Large Aperture Portrait Lens For Sony E EOS-M M43 Nikon Z X,249.0,2020-11-04 00:00:00
Nikon TELECONVERTER TC-2.0 Z Mount ZTC2.0x NEW,767.99,2020-11-04 00:00:00
Nikon NIKKOR Z 70-200mm f/2.8 VR S,2754.95,2020-11-04 00:00:00
Nikkor Z 24-70mm F/2.8 S,2154.95,2020-11-04 00:00:00
Nikon Z6 24.5MP Mirrorless Camera - Black (Body Only) w/64GB XQD card & adapter,1500.0,2020-11-04 00:00:00
Nikon Z6 With 20-70 F(4) And Accessories,2000.0,2020-11-04 00:00:00
HN-24 62mm Hood Lens For NIKON AF 70-210mm f/4-5.6D Len 75-300mm f/4.5-5.6 R3Z9,4.48,2020-11-04 00:00:00
49mm Metal Screw-On Lens Cap for Canon Nikon Sony Pentax Universal DSLR Camera,24.95,2020-11-04 00:00:00
Fringer EF-NZ Auto Focus Lens Adapter for Canon Sigma Tamron to Nikon Z6 Z7 Z50,284.0,2020-11-04 00:00:00
AF 67MM 18K FISHEYE LENS + MACRO LENS FOR Nikon NIKKOR Z 85mm f/1.8 S Lens 180°,46.88,2020-11-04 00:00:00
Nikon Z series Z6 Z7 Just fit bag in bag Z logo Black Japan original,107.98,2020-11-04 00:00:00
"Flash Hot Shoe Cover Protector Standard Flash For Nikon Canon, Pentax, Olympus +",24.95,2020-11-04 00:00:00
Nikon NIKKOR Z 70-200mm f/2.8 VR S,2509.95,2020-11-04 00:00:00
Nikkor Z 24-70mm F/2.8 S,1989.95,2020-11-04 00:00:00
HN-24 62mm Hood Lens For NIKON AF 70-210mm f/4-5.6D Len 75-300mm f/4.5-5.6 R3Z9,5.58,2020-11-04 00:00:00
GABALE Lens Adapter for Sony NEX E-Mount Lens to Nikon Z Mount Camera  Z6 Z7,28.9,2020-11-05 00:00:00
 EN-EL15b Rechargeable Battery D850-D810-D800- D750-D7200-D7300-D610- Z6-Z7 USA,25.97,2020-11-05 00:00:00
Kastar EN-EL4 Battery Fast Charger for Nikon D2Z D2H D2Hs D2X D2Xs D3 D3S D3X F6,19.98,2020-11-05 00:00:00
"GGS LARMOR Self-Adhesive Optical Glass LCD Screen Protector for Nikon Z7, Z6",26.88,2020-11-05 00:00:00
Kipon Adapter for C Mount Lens to Nikon Z Full Frame Camera,50.0,2020-11-05 00:00:00
New lens Mount adapter FT-Z FTZ for Nikon Z6 Z7 Z50 micro camera,225.95,2020-11-05 00:00:00
 2x EN-EL15B ENEL15B New Battery For Nikon D7100 D7000 D800 D810 D750 Z7 Z6 V1,36.99,2020-11-05 00:00:00
Used Leofoto LPN-Z7 L Plate/Bracket for Nikon Z 7 Z7 & Z6 / RRS /ARCA/ Kirkphoto,64.0,2020-11-05 00:00:00
37mm Thread Mount Metal Lens Hood For Nikon Canon L0Z1 New Olympus Type N1Y4,2.67,2020-11-05 00:00:00
SmallRig Formfitting Full Cage for Nikon Z5/Z6/Z7/Z6II/Z7II Camera 2926,34.9,2020-11-05 00:00:00
"Nikon NIKKOR Z 35mm F/1.8 S Lens with Original Box, Caps, Hood, Storage Pouch",600.0,2020-11-05 00:00:00
L Plate Bracket Camera Grip dock Holder  tripod stabilizer for Nikon Z6 Z7 Red,42.99,2020-11-05 00:00:00
Lensbaby Velvet 85mm f/1.8 for Nikon Z,325.0,2020-11-05 00:00:00
Nikon Z7 and Z6 Mirrorless Cameras User's Instruction Manual - EX,22.11,2020-11-05 00:00:00
Lomography Diana F Lens Adaptor For Nikon F Mount,12.99,2020-11-05 00:00:00
Pixco Camera Adapter For Leica M LM Zeiss M VM Lens To Nikon Z6 Z7 Z Mount,17.09,2020-11-05 00:00:00
Nikon Z Genuine Camera Neck Strap AN-DC20 For Z50 / Z5 / Z6 / Z7,28.49,2020-11-05 00:00:00
Camera Body Cap and Rear Lens Cap fit Nikon Z mount cameras & lenses Z6 Z7 Cover,16.98,2020-11-05 00:00:00
7artisans 35mm F0.95 Prime Fixed Lens For Sony E EOS-M M 4/3 M43 Nikon Z Fuji X,249.0,2020-11-05 00:00:00
Adapter for Canon EOS EF-S Lens to Nikon Z Mount Z5 Z6 Z7 Z50 Z6II Z7II Camera,16.49,2020-11-05 00:00:00
Rollei QBM mount lens to Nikon Z mount full frame mirrorless camera adapter Z7,23.2,2020-11-05 00:00:00
Adapter for M42 Lens to Nikon Z mount Z5 Z6 Z7 Z50 Z6II Z7II Mirrorless Camera,11.49,2020-11-05 00:00:00
Adapter for Canon FD Lens to Nikon Z Z5 Z6 Z7 Z50 Z6II Z7II Mirrorless Camera,15.98,2020-11-05 00:00:00
Adapter for Olympus OM Lens to Nikon Z Z5 Z6 Z7 Z50 Z6II Z7II Mirrorless Camera,16.49,2020-11-05 00:00:00
GABALE FE-Z adapter for Sony FE mount lens to Nikon Z mount Z6 Z7 camera,29.9,2020-11-05 00:00:00
Lens Mount Adaptor Ring for Olympus SLR OM 4/3 Lens to Nikon Z7 Z6 Camera Body,29.99,2020-11-05 00:00:00
T2-Z Lens Mount Adapter Ring for T2 T Mirror Screw Lens Telescope to Nikon Z7 Z6,21.39,2020-11-05 00:00:00
D850 Vertical Release L Plate/Bracket Holder Hand Grip for Nikon D850 Came P5Z7,24.99,2020-11-06 00:00:00
2Pack Camera Body Cap + Rear Lens Cap for Nikon Z7 Z6 Z50 Z Mount Camera & Lens,8.99,2020-11-06 00:00:00
JJC 2PCS 0.3mm 9H Optical Tempered Glass Screen Protector for Nikon Z5 Z6 Z7,9.99,2020-11-06 00:00:00
JJC Lens Hood Replace HB-98 for Nikon Nikkor Z 24-50mm F4-6.3 for Nikon Z6 Z7 II,13.99,2020-11-06 00:00:00
New lens Mount adapter FT-Z FTZ for Nikon Z6 Z7 Z50 micro camera,187.99,2020-11-06 00:00:00
VILTROX EF-Z2 Auto Focus Adapter Ring Kit for Canon Lens to for Nikon Z6 Z7 Z50,218.17,2020-11-06 00:00:00
New K&F Concept adapter for M42 mount lens to Nikon Z6 Z7camera,35.12,2020-11-06 00:00:00
"ESDDI Flash Speedlite for Nikon, i-TTL 1/8000 HSS GN58 2.4G Wireless Flash Ti...",85.88,2020-11-06 00:00:00
Nikon NIKKOR Z 50mm F/1.8 S Lens,420.0,2020-11-06 00:00:00
Nikon F-mount Lens Rear Cover Lid Cap Lens Lid Rear Cap z6 z7,10.57,2020-11-06 00:00:00
VULCAN Glass Screen Protector - Nikon Z6 / Z7 LCD Tough Anti Scratch Cover (UK),17.19,2020-11-06 00:00:00
Nikon Z6II Mirrorless Camera 24.5MP Full Frame FX-Format Body Only 1659,1996.95,2020-11-06 00:00:00
Round Eyecup Camera Eyepiece for Canon Nikon Sony Pentax Fits Most Cameras DSLR,28.95,2020-11-06 00:00:00
MEGADAP MTZ11 Auto Focus Adapter for Leica M VM lens to Nikon Z Z6 Z7 Z5 Z50,349.0,2020-11-06 00:00:00
SmallRig Cable Clamp Lock HDMI Protector for Nikon Z6 Z7 Sony A7III A9 L Bracket,19.9,2020-11-06 00:00:00
Quick Release L Plate Bracket Hand Grip Compatible With Nikon Z7II Z6II Z5,25.99,2020-11-06 00:00:00
7artisans 35mm F1.4 Full Frame Large Aperture Manual Lens for Nikon Z Mount,224.0,2020-11-06 00:00:00
Mcoplus Battery Hand Grip MB-N10 Vertical Multi Powe Grips for Nikon Z6 Z7 DSLR,76.98,2020-11-06 00:00:00
JJC Long Rubber Eyecup Replace DK-29 for Nikon Z6 Z7 DN,17.0,2020-11-06 00:00:00
For Canon EF Mount Lens to Nikon Z Mount Camera Adapter Ring Nikon Z6 Nikon Z7,26.2,2020-11-06 00:00:00
JJC LCP-Z7 LCD Film Screen Protector cover For Nikon Z6 Z7 Z 7 6 Camera 2 Pack,20.98,2020-11-06 00:00:00
7Artisans 35mm F1.2 II Large Aperture Mirrorless Lens For Sony E/Fuji FX/NIKON Z,139.0,2020-11-06 00:00:00
Nikon Z6 Z7 LCD ASSY Original Replacement Part,164.5,2020-11-06 00:00:00
Nikon Z6 Z7 Original Bottom Cover Replacement Part,89.5,2020-11-06 00:00:00
Camera Lens Hood Cover Replaces HB-98 for Nikon Z 24-50mm on Z5 Z6 Z6II Z7 Z7II,13.99,2020-11-06 00:00:00
VILTROX EF-Z2 Auto Focus Adapter Ring Kit for Canon Lens to for Nikon Z6 Z7 Z50,218.0,2020-11-06 00:00:00
"ESDDI Flash Speedlite for Nikon, i-TTL 1/8000 HSS GN58 2.4G Wireless Flash Ti...",84.88,2020-11-06 00:00:00
Nikon F-mount Lens Rear Cover Lid Cap Lens Lid Rear Cap z6 z7,16.37,2020-11-06 00:00:00
Round Eyecup Camera Eyepiece for Canon Nikon Sony Pentax Fits Most Cameras DSLR,27.95,2020-11-06 00:00:00
Camera Wrist Hand Strap for DSLR Camera Canon Nikon Olympus Photography Photo,27.95,2020-11-06 00:00:00
10pcs Plastic Black Nikon Z mount Front body cap for Z6 Z7 camera,25.98,2020-11-07 00:00:00
GABALE Lens Adapter for Sony NEX E-Mount Lens to Nikon Z Mount Camera  Z6 Z7 Z50,29.9,2020-11-07 00:00:00
Kipon Adapter for Konica AR Mount Lens to Nikon Z Full Frame Camera,88.0,2020-11-07 00:00:00
TECHART TZM-01 For Leica M to Nikon Z Mount Lens Adapter Ring For Z5 Z6 Z7 Z50,349.0,2020-11-07 00:00:00
Genuine Nikon OEM 1 Series Body Cap + Rear Lens Cap for 1 J1 J2 V1 V2 J3 J4 J5 ,36.98,2020-11-07 00:00:00
Zhongyi Mitakon Speedmaster 50mm f/0.95 III Lens for Sony E  Canon RF  Nikon Z,699.0,2020-11-07 00:00:00
"NEW Nikon EN-EL15B Battery for D850 D7500 D750 D810 Z6, Z7 Mirrorless EL15 EL15A",20.98,2020-11-07 00:00:00
Glass Screen Protector for Nikon Z6 / Z7 2D 9H Tempered Ultra Thin,3.58,2020-11-07 00:00:00
4PCS Camera Strap Ring Adapter+Cap for Nikon Z7 Z6/1 J5 J4 J3 V3 V2 V1/COOLPIX A,8.29,2020-11-07 00:00:00
SmallRig Arca-Type L Bracket for Nikon Z5/Z6/Z7 Camera 2947,27.9,2020-11-07 00:00:00
"M42 Lens to Nikon Z Lens Mount Adapter for Nikon Z50, Z5, Z7, Z6 Camera",15.31,2020-11-07 00:00:00
Lomography Petzval 55 mm f/1.7 MKII Brass Art Lens Canon RF Nikon Z Sony E Mount,533.0,2020-11-07 00:00:00
JJC Oval Rubber Eyecup Eyepiece Viewfinder for Nikon Z7 Z6 Camera replace DK-29,12.99,2020-11-07 00:00:00
USED Nikon NIKKOR Z 24-70mm f/2.8  G ED,460.0,2020-11-07 00:00:00
NEW! Nikon MC-XQ64G XQD Memory Card 64GB for Z7 Z6 D850 D500 F/S FROM JAPAN,169.99,2020-11-07 00:00:00
JJC Long Rubber Eyecup Replace DK-29 for Nikon Z6 Z7,18.0,2020-11-07 00:00:00
Water-resistant Storage Memory Card Case Holder fits 6 XQD Card for Nikon Z7 Z6,9.49,2020-11-07 00:00:00
Multi Power Battery Pack Grip for Nikon Z5 Z6 Replace MB-N10 EN-EL15 EN-EL15B,71.99,2020-11-07 00:00:00
SmallRig Base Plate for Nikon Z50 Mirrorless Camera for Tripod Handheld Shooting,28.9,2020-11-07 00:00:00
For Nikon Z6 Front Cover Shell Grip Hand Holding Hold Handle Rubber Original,64.99,2020-11-08 00:00:00
New Listing,400.0,2020-11-08 00:00:00
New Listing,600.0,2020-11-08 00:00:00
New Listing,800.0,2020-11-08 00:00:00
Rear Lens Cover + Camera Front Body Cap for Nikon Z7 Z6 reDXH W5,3.87,2020-11-08 00:00:00
Silicone Armor Skin Case Camera Body Cover for Nikon Z6 Z7 Mirrorless Camera,10.7,2020-11-08 00:00:00
Super Strong Tempered Glass Screen Protector for Nikon Z6 Z7 Z 6 Z 7 Camera,69.73,2020-11-08 00:00:00
Ultra-slim Macro Adapter For M42 Lens To Nikon Z6 Z7 Full Frame Mirrorless,9.09,2020-11-08 00:00:00
Manual Lens Mount Adapter for Sony E Mount Lens to Nikon Z Camera Z6 Z7 Z50,28.48,2020-11-08 00:00:00
Lomography Petzval 55 mm f/1.7 MKII Brass Art Lens Canon RF Nikon Z Sony E Mount,533.0,2020-11-08 00:00:00
Nikon NIKKOR Z 50mm F/1.8 S Lens,400.0,2020-11-08 00:00:00
Battery for Nikon EN-EL15b | 65134 | D600 D800 D7000 D7500 1 V1 / Z6 Z7 /Charger,32.98,2020-11-08 00:00:00
Nikon NIKKOR Z 85mm f/1.8 S Lens,600.0,2020-11-08 00:00:00
Nikon Z 50 20.9MP with 16-50mm + 50-250mm Lenses Kit Mirrorless Camera - Black,800.0,2020-11-08 00:00:00
LCD Display Screen Monitor Repair Parts For  EX-Z60 Z70 Z6 Z7 Wide Cable,24.98,2020-11-08 00:00:00
Z699C Light Weight Carbon Fiber Tripod Monopod&Ball Head Stand For Nikon Camera,147.74,2020-11-09 00:00:00
10Pcs Hot Shoe Cover Cap Bubble Spirit Level For Canon Nikon Camera DSLR E9Z8,1.3,2020-11-09 00:00:00
Nikon NIKKOR Z 35mm F/1.8 S Lens,600.0,2020-11-09 00:00:00
9H Tempered Glass Screen Protector for Nikon Z6 Z7 Mirrorless Camera AUS seller.,72.03,2020-11-09 00:00:00
Nikon Z 50 DX 20.9 Mirrorless Camera Body Z50 #773,704.51,2020-11-09 00:00:00
Genuine Nikon Nikkor Z 72mm Lens Cap LC-72B - 24-70mm/4,19.9,2020-11-09 00:00:00
NEWYI 50mm F1.8 Large Aperture Z Mount Prime Lens for Nikon Z7/Z6/Z5/Z50 Camera,74.39,2020-11-09 00:00:00
"Nikon Z6 24.5MP Mirrorless Camera+ FTZ Mount Adapter, 401 shutter count",1300.0,2020-11-09 00:00:00
📸 NIKON Z7 with 24-70 F/4 lens ⭐️,2492.0,2020-11-09 00:00:00
"Nikon NIKKOR Z 24-70mm F/4 S Lens, minor damage",350.0,2020-11-09 00:00:00
Nikon Z7 45.7MP Digital Camera - Black (Body Only) ONLY 34 CLICKS! PRICE DROP!,1800.0,2020-11-09 00:00:00
Ulanzi Quick Release UUrig R039 L Plate Holder Hand Grip Accessory for Nikon Z50,23.44,2020-11-09 00:00:00
Z Type Tilt Tripod Head Flex Folding For Canon Nikon DSLR Camera GoproTCB xbTY,8.98,2020-11-09 00:00:00
Half Leather Case Bag Cover Grip for Nikon Z 50 DX-Format Mirrorless Camera Z50,13.49,2020-11-10 00:00:00
Nikon Z6 24-70 Kit ONLY 129 SHUTTER ACTUATIONS! PRICE DROP!,1800.0,2020-11-10 00:00:00
Nikon Z6 24.5MP Mirrorless Camera Body And MB-N10 Battery Grip - EXC and USA,1299.99,2020-11-10 00:00:00
Arca Swiss type foot 4 Nikon Z 70-200 F2.8 VR Lens RRS Kirk Acratech Foba Benro,90.0,2020-11-10 00:00:00
 EN-EL15b Rechargeable Battery D850-D810-D800- D750-D7200-D7300-D610- Z6-Z7 USA,25.97,2020-11-10 00:00:00
Nikon Z6 24.5MP Mirrorless Camera - Black (Body Only) in Excellent Condition,1249.0,2020-11-10 00:00:00
DK-29 Nikon Long Extended Eyepiece Eyecup Soft Rubber Silicone Cushioning Z7 Z6,13.99,2020-11-10 00:00:00
Nikon Nikkor Z DX 16-50mm f/3.5-6.3 VR Lens for Z Mount {46} - EX,281.35,2020-11-10 00:00:00
"Helios 44m-4 lens F2.0/58mm M42 USSR Russia, with adapter for Canon, Nikon, Sony",49.0,2020-11-10 00:00:00
Nikon Nikkor Z 24-70mm f4 S Lens #743,538.21,2020-11-11 00:00:00
Nikon NIKKOR Z 24-70mm F/4 S Lens,425.0,2020-11-11 00:00:00
"62mm UV Filter for Nikon NIKKOR Z 50mm f/1.8 S, NIKKOR Z 35mm f/1.8 S Lens",28.66,2020-11-11 00:00:00
Nikon NIKKOR Z 14-30mm f/4 S Camera Lens - Black,900.0,2020-11-11 00:00:00
 EN-EL15b Rechargeable Battery D850-D810-D800- D750-D7200-D7300-D610- Z6-Z7 USA,25.97,2020-11-11 00:00:00
Portable Photography Camera Monopod Unipod Pole Walking Stick for Nikon SLR E2Z5,52.2,2020-11-11 00:00:00
"RSS Really Right Stuff Base Plate for Nikon Z5, Z6, Z7",35.0,2020-11-11 00:00:00
Nikon Z6 24.5MP Camera with FTZ many extras US Model low shutter mint,1575.0,2020-11-11 00:00:00
Textured Rubber Silicon Case Body Cover Protector Skin for Nikon Z7 Z6 Camera,18.89,2020-11-11 00:00:00
Nikon NIKKOR Z 35mm F/1.8 S Lens PRICE DROP!,550.0,2020-11-11 00:00:00
Sigma 24mm f/1.4 DG HSM Art Lens and Nikon Z6,1750.0,2020-11-11 00:00:00
SHOTEN LM-NZ II Mount Adapter Leica M Lens to Nikon Z Camera Japan with Tracking,132.99,2020-11-12 00:00:00
Nikon Nikkor Z 24-70mm F/4 S Lens  AUSTRALIAN STOCK ,674.07,2020-11-12 00:00:00
BATTERY+CHARGER FOR CASIO NP-80 NP-82 NIKON EN-EL10 EX-G1 S5 S6  S7PE Z550 Z330 ,8.99,2020-11-12 00:00:00
12V-24V car charger dc cable EN-EL15 EP-5B dc coupler for Nikon D850 D610 Z6 Z7,32.5,2020-11-12 00:00:00
AV Video Cable Cord Lead For Konica Minolta DiMage Z10 Z20 Z3 Z5 Z6 Dynax 5D 7D,9.98,2020-11-12 00:00:00
    Computar TV Zoom Lens M6Z 1212-3S 12.5-75mm F1.2 C Mount,197.0,2020-11-12 00:00:00
Nikon Z6 Z7 Dedicated L-Bracket Grip Arca-Swiss Dovetail Compatible,19.99,2020-11-12 00:00:00
Wireless Remote for Nikon P1000 B600 A1000 P950 Z50 Replace Nikon ML-L7 Replcmnt,38.99,2020-11-12 00:00:00
 EN-EL15b Rechargeable Battery D850-D810-D800- D750-D7200-D7300-D610- Z6-Z7 USA,25.97,2020-11-12 00:00:00
Nikon FTZ Mount Adapter (F-Mount Lens to Z-Mount Camera) #933,203.31,2020-11-12 00:00:00
PK645-N/Z Adapter for Pentax 645 Lens to Nikon Z Mount Z6 Z7 Z50 Mirrorless Cam,30.97,2020-11-12 00:00:00
5pcs 37mm Thread Mount Metal Lens Hood For Nikon Canon L0Z1 New Olympus Type,10.4,2020-11-12 00:00:00
Nikon NIKKOR Z 35mm F1.8 S Lens Genuine,764.0,2020-11-12 00:00:00
Fringer EF-NZ Auto Focus Lens Adapter for Canon Sigma EF to Nikon N/Z Z6 Z7 Z50,284.9,2020-11-13 00:00:00
 EN-EL15b Rechargeable Battery D850-D810-D800- D750-D7200-D7300-D610- Z6-Z7 USA,25.97,2020-11-13 00:00:00
L Plate Bracket Camera Grip dock Holder  tripod stabilizer for Nikon Z6 Z7 Black,41.99,2020-11-13 00:00:00
 EN-EL15b Rechargeable Battery D850-D810-D800- D750-D7200-D7300-D610- Z6-Z7 USA,25.97,2020-11-13 00:00:00
Nikon Z6 24.5 MP Mirrorless Digital Camera Body (Black) w/Sony 64GB XQD Card,1412.95,2020-11-13 00:00:00
FISHEYE LENS + ZOOM LENS + TRIPOD +LED LIGHT + FLASH STARTER KIT FOR NIKON Z50,86.99,2020-11-13 00:00:00
"Nikon Z6 Mirrorless Camera Body Only, 2 Batteries & Charger, 8,300 Shutter Count",1149.0,2020-11-13 00:00:00
Nikon NIKKOR Z 24-70mm f/2.8 S Standard Camera Lens - Black,1749.0,2020-11-13 00:00:00
Nikon Z6 Z7 Digital Camera REFERENCE MANUAL,54.95,2020-11-13 00:00:00
"Nikon Z50 DX Digital Camera + FTZ Adapter Kit + SDHC 16GB , FREE DHL",985.0,2020-11-13 00:00:00
