title,price,date
SHARP! Nikon NIKKOR Z 24-70mm f/2.8 Z S Camera Lens,1832.99,2020-09-30 00:00:00
Nikon Z6 Full frame Mirrorless (Body Only) - Excellent - <2000 clicks! XQD incl!,1271.0,2020-09-30 00:00:00
Nikon NIKKOR Z 14-30mm f/4 S Lens *MINT CONDITION*,1049.0,2020-09-30 00:00:00
Nikon Z6 24.5MP Mirrorless Camera - Black (Body Only),1198.25,2020-09-30 00:00:00
M42 Lens to AI For Nikon F-mount adapter ring D70s D31 C5I9 D5100 L0Z0 D100 V5W7,2.9,2020-09-30 00:00:00
Nikon Z5 Kit w/24-50mm f/4-6.3 VR Z Lens *NEW* *IN STOCK* *NIKON USA WARRANTY*,1596.95,2020-09-30 00:00:00
Nikon Z6 Z7 LCD ASSY Original Replacement Part,154.75,2020-09-30 00:00:00
Retro Vintage Genuine Real Leather Camera Case Handmade Half Bag For Nikon Z6 Z7,53.99,2020-09-30 00:00:00
Nikon SB-910 Speedlight Flash SB910 ref2469575 for d800 d600 d5600 d3 d4 z6 z7..,179.98,2020-09-30 00:00:00
Nikon Nikkor S Rangefinder Lens To Nikon Z-Mount Camera Adapter Z5 Z50 Z6 Z7,15.2,2020-09-30 00:00:00
"Nikon Z7 Mirrorless Digital Camera 45.7MP ,w/3Lens/Flash, STUDIO ,W/MATTBOX",4650.0,2020-10-01 00:00:00
Quick Release L Bracket Plate Mount Vertical Holder Z6 Z7 For Nikon RRS J5G3,15.77,2020-10-01 00:00:00
Nikon Z6 24.5MP Mirrorless Camera | MINT,1300.0,2020-10-01 00:00:00
Nikon NIKKOR Z 14-30mm f/4 S Ultra-Wide Zoom Lens Complete!,1050.0,2020-10-01 00:00:00
Nikon Z50 DX Mirrorless Camera Body w NIKKOR Z DX 16-50mm f/3.5-6.3 VR Lens,722.0,2020-10-01 00:00:00
Nikon Nikkor Z 24-70mm f4 S Lens excellent condition - US Model ,540.0,2020-10-01 00:00:00
Tilta DSLR Cage for NIKON Z6 Z7 Camera rig TA-T02-A-G Kit Handle VS Smallrig,161.0,2020-10-01 00:00:00
Nikon AN-4Y Narrow Nylon Neck Strap for Camera Neckstrap DN,26.0,2020-10-01 00:00:00
USB Dual Battery Charger for Nikon EN-EL15 MH-25A Nikon Z6 Z7 Z7Q3 DSLR Camera,10.35,2020-10-01 00:00:00
AODELAN Wireless Remote Control For Nikon COOLPIX P1000 P950 Z50 B600 A1000,28.99,2020-10-01 00:00:00
Nikon NIKKOR Z 14-30mm f/4 S Camera Lens - Black Full Frame Mirrorless USA ver,1080.0,2020-10-01 00:00:00
Nikon Z7 FX 45.7MP Mirrorless Camera - Black (Kit with 24-70mm F/4 Lens),2455.87,2020-10-01 00:00:00
Silicone Case Cover Protector for Canon EOS Nikon Z7 Z6 D3400 D3500 D5300 DSLR,17.46,2020-10-01 00:00:00
SmallRig Cage for Nikon Z6/Z7 with MB-N10 Battery Grip 2882,100.61,2020-10-01 00:00:00
Nikon FTZ Mount Adapter (F Lens to Nikon Z-Mount) 4185,188.95,2020-10-01 00:00:00
Nikon Nikkor Z 24-70mm f4 S Lens                                            #020,530.23,2020-10-01 00:00:00
Nikon FTZ Mount Adapter (F Lens to Nikon Z-Mount) 4185,188.95,2020-10-01 00:00:00
Lightweight Partition Padded Insert Protection Storage Camera Case bag for Nikon,15.69,2020-10-01 00:00:00
SHOTEN adapter for LEICA R mount lens to Nikon Z mount Z6 Z7 camera,49.42,2020-10-01 00:00:00
M42-NZ Lens Mount Adapter Ring for M42 to for Nikon Z Mirrorless Camera /ND,17.78,2020-10-01 00:00:00
fringer ef-nz  lens adapter for canon lenses on nikon z body,225.0,2020-10-01 00:00:00
Silicone Case Cover Protector for Canon EOS Nikon Z7 Z6 D3400 D3500 D5300 DSLR,17.46,2020-10-01 00:00:00
SmallRig Cage for Nikon Z6/Z7 with MB-N10 Battery Grip 2882,100.61,2020-10-01 00:00:00
JJC Long Rubber Eyecup Replace DK-29 for Nikon Z6 Z7,17.0,2020-10-01 00:00:00
Nikon FTZ Mount Adapter (F Lens to Nikon Z-Mount) 4185,174.95,2020-10-01 00:00:00
Nikon Nikkor Z 24-70mm f4 S Lens                                            #020,494.0,2020-10-01 00:00:00
UURig R039 L-Shaped Quick-Release Board Plate Mount Bracket For Nikon Z50 Camera,25.49,2020-10-01 00:00:00
Nikon FTZ Mount Adapter (F Lens to Nikon Z-Mount) 4185,174.95,2020-10-01 00:00:00
Lightweight Partition Padded Insert Protection Storage Camera Case bag for Nikon,15.69,2020-10-01 00:00:00
SHOTEN adapter for LEICA R mount lens to Nikon Z mount Z6 Z7 camera,49.42,2020-10-01 00:00:00
M42-NZ Lens Mount Adapter Ring for M42 to for Nikon Z Mirrorless Camera /ND,19.29,2020-10-01 00:00:00
fringer ef-nz  lens adapter for canon lenses on nikon z body,225.0,2020-10-01 00:00:00
"Leica M39 39mm Lens to Nikon Z Z5 Z50 Z6 Z7 Mirrorless Camera Adapter ""US Seller",12.9,2020-10-02 00:00:00
Nikon Z 50 20.9MP Mirrorless Camera - Black (Body Only) USA Model,645.0,2020-10-02 00:00:00
Nikon HB-85 Bayonet Lens Hood for NIKKOR Z 24-70mm f/4 S Lens #4184,43.95,2020-10-02 00:00:00
62mm Reversible Flower Lens Hood 105mm Tamron 18-200mm Nikon Z6 Z7 Z50 50mm 35mm,17.98,2020-10-02 00:00:00
Lensbaby Velvet 85mm f/1.8 for Nikon Z,343.0,2020-10-02 00:00:00
Nikon Z 50 DX 20.9 Mirrorless Camera Body Z50                               #778,691.23,2020-10-02 00:00:00
Nikon NIKKOR Z DX 16-50mm f/3.5-6.3 VR Wide Angle Lens,210.0,2020-10-02 00:00:00
"JJC GSP-Z7 0.3mm Optical Temper Glass LCD Screen Cover Protector for Nikon Z7,Z6",7.82,2020-10-02 00:00:00
Nikon NIKKOR Z 24-70mm F/4 S Lens + Filters,460.0,2020-10-02 00:00:00
Kipon Adapter for  Leica M39 Mount Lens to Nikon Z Full Frame Mirrorless Camera,45.0,2020-10-02 00:00:00
Fringer EF-NZ Auto Focus Lens Adapter for Canon Sigma EF to Nikon N/Z Z6 Z7 Z50,284.9,2020-10-02 00:00:00
FRONT SNAP-ON LENS CAP  DIRECTLY TO CAMERA NIKON COOLPIX L340 L 340 +HOLDER,19.76,2020-10-02 00:00:00
"Nikon Z6 24.5MP Mirrorless Camera (Body Only) + Bracket, FTZ & 64GB XQD - USA",1649.0,2020-10-02 00:00:00
Nikon FTZ Lens Adapter - F Mount Z Mount,175.0,2020-10-02 00:00:00
Lightly used Nikon Z6 Z 6 Mirrorless Camera (Body Only) - Only 241 Shutter Count,1365.0,2020-10-02 00:00:00
Mint Nikon NIKKOR Z DX 50-250mm f4.5-6.3 VR Lens With Box #32304,315.05,2020-10-02 00:00:00
Water-Resistant Memory Card Case Storage Holder fits 6 XQD Cards for Nikon Z7 Z6,9.99,2020-10-03 00:00:00
Nikon Z7 FX-Format Mirrorless Camera Body by Nikon U.S.A. #1591,1898.0,2020-10-03 00:00:00
"Opteka Wireless Shutter Release & Flash Trigger for Nikon Z6 Z7 D90 D3100, D3200",28.99,2020-10-03 00:00:00
"Professional 61.4"" Camera Tripod Monopod Stabilizer Walking Stick for Nikon S7Z6",30.87,2020-10-13 00:00:00
2PCS ULANZI 3 COLD SHOE CAMERA MOUNT ADAPTER EXTEND PORT FOR NIKON CAMERAS Z7L7,20.07,2020-10-13 00:00:00
Kastar Battery LCD2 USB Charger for Nikon EN-EL15e & Nikon Z6 Nikon Z7Q3 Camera,24.59,2020-10-13 00:00:00
Nikon Standard Zoom Lens NIKKOR Z 24-70 mm F/4 S Z Mount for Fullsize New,887.99,2020-10-13 00:00:00
Camera Lens Adapter Mount Tube For M42 42mm Lens to Nikon Z Mount Z50 Z6 Z7,16.91,2020-10-13 00:00:00
Macro LED Ring Flash Light for Nikon Canon Panasonic Olympus Pentax Cameras K4Z3,37.09,2020-10-14 00:00:00
Nikon NIKKOR Z 24-70mm F/4 S Lens wide angle zoom with UV filter hood and box,449.0,2020-10-14 00:00:00
Radio Speedlite Flash Trigger 16 Channels PT-16GY for Canon Nikon Pentax TE Z8J2,14.05,2020-10-14 00:00:00
Zhiyun Weebill S 3-Axis Handheld Gimbal for Sony A7M3 A7R3 A9 Nikon Z6 Canon 5D4,299.99,2020-10-14 00:00:00
Andoer 67MM Filter Kit UV+CPL+Close-Up+4 +Star 8-Point for Nikon DSLR US R5Z2,13.96,2020-10-14 00:00:00
90cm MC-DC2 LCD Timer Remote Shutter Release for Nikon Z7 D750 D610 D7500 D7200,16.84,2020-10-14 00:00:00
Fringer EF-NZ Auto Focus Lens Adapter for Canon Lens to Nikon Z6 Z7 Z5,243.0,2020-10-14 00:00:00
Nikon Z7 24-70mm F/4 Lens Kit,2600.0,2020-10-14 00:00:00
Nikon Z6 24.5MP FX-format 4K Mirrorless Camera with NIKKOR Z 24-70mm f/4 S Lens,1899.0,2020-10-14 00:00:00
Kastar Battery Dual Charger for Nikon EN-EL15 EN-EL15a Nikon Z7Q3  Z 7 Q3 4K UHD,23.99,2020-10-14 00:00:00
"Adjustable Leica M39 39mm Lens to Nikon Z Mount Z5 Z50 Z6 Z7 Adapter ""US Seller""",10.95,2020-10-14 00:00:00
Sony Alpha Minolta AF lens To Nikon Z mount adapter full frame camera Z5 Z7 Z50,28.98,2020-10-14 00:00:00
Nikon Z6 24.5MP Mirrorless Camera - Black (Body) w/FTZ Adapter!,1584.0,2020-10-14 00:00:00
NIKKOR Z 24-200mm f/4-6.3 VR,984.95,2020-10-14 00:00:00
NEW Nikon MC-XQ64G XQD Memory Card 64GB for Z7 Z6 D850 D500 from JAPAN,193.37,2020-10-14 00:00:00
Wireless Timer Remote Control Shutter Release for Nikon D5500 D7100 D7200 Z7J2,30.96,2020-10-14 00:00:00
0.45x HD 58MM Wide Angle Lens + Macro Lens for Canon Nikon Pentax Cameras G9Z0,14.79,2020-10-14 00:00:00
Close Focus Adapter Leica M Lens to Nikon Z - US Seller,65.0,2020-10-14 00:00:00
"Nikon NIKKOR Z 50mm F/1.8 S Lens, LINE NEW",481.46,2020-10-14 00:00:00
Nikon Z 50 DX 20.9 Mirrorless Camera Body Z50 #283,657.51,2020-10-14 00:00:00
"BM Premium 2X EN-EL15B Batteries and Dual Charger for Nikon Z6, Z7, D500 Cameras",34.99,2020-10-14 00:00:00
 EN-EL15b Rechargeable Battery D850-D810-D800- D750-D7200-D7300-D610- Z6-Z7 USA,27.97,2020-10-14 00:00:00
Nikon Z6 24.5MP Mirrorless Camera - Black (Body Only) FOR PARTS AND NOT WORKING,363.65,2020-10-14 00:00:00
Video Photography Fluid Drag Hydraulic Tripod Head for Nikon Canon Camera V0Z0,48.99,2020-10-14 00:00:00
Nikon EN-EL25 Rechargeable Li-Ion Battery for Z 50 Mirrorless Digital Camera,69.95,2020-10-14 00:00:00
new for Nikon Z6 bottom shell camera bottom shell bottom shell bottom shell ,69.05,2020-10-14 00:00:00
Nikon Z6 Mirrorless Digital Camera with 24-70mm f/4 S Lens Kit,1992.32,2020-10-14 00:00:00
Khaos For Nikon Z6 / Z7 Digital SLR Camera Tempered Glass Screen Protector,6.13,2020-10-14 00:00:00
Camera Backpack Bag for DSLR and Lens - Padded Case for Canon Nikon So ny Z9J5,19.95,2020-10-14 00:00:00
EN-EL15 power usb powr cable+EP-5B dummy battery  For Nikon D810 D850 D750 Z6 Z7,41.1,2020-10-14 00:00:00
Nikon NIKKOR Z 35mm f/1.8 S Lens,794.95,2020-10-14 00:00:00
Camera silicone cover Black for Nikon Z50 Black + Screen Protectors.,29.99,2020-10-14 00:00:00
7artisans 60mm F2.8 Fixed Manual Focus Macro Lens for Sony Canon Fuji Nikon M43,147.0,2020-10-15 00:00:00
Nikon Z6 24.5MP Mirrorless Camera - Black (Body Only),1050.0,2020-10-15 00:00:00
Nikon Nikkor Z 24-70 mm f/4 S Lens - Black **EXCELLENT** Condition,443.0,2020-10-15 00:00:00
SUNWAYFOTO PNL-Z6 Dedicated L Plate / Nikon Z6 / Z7 Camera Arca / RRS Compatible,49.95,2020-10-15 00:00:00
Nikon MB-N10 Multi Battery Power Pack for Z7 and Z6 Mirrorless Cameras - Used,149.99,2020-10-15 00:00:00
Nikon Z6 FX-Format Mirrorless Digital Camera Body with Top Accessory Kit,1549.99,2020-10-15 00:00:00
Kipon Adapter for Canon EOS EF Mount Lens to Nikon Z Nik NZ Full Frame Camera,39.8,2020-10-15 00:00:00
JJC Long Rubber Eyecup Replace DK-30 for Nikon Z50 DN,17.0,2020-10-15 00:00:00
Andoer Mini Tripod Ball Head 360 Degree Swivel for DSLR Camera Canon Nikon Z5V5,8.23,2020-10-15 00:00:00
 HD3 WIDE ANGLE FISHEYE LENS + MACRO LENS FOR Nikon NIKKOR Z 24-200mm f/4-6.3 VR,139.92,2020-10-15 00:00:00
Rear Lens Cover + Camera Front Body Cap for Nikon Z7 Z6 reDXHWP5,4.12,2020-10-15 00:00:00
Nikon Z 6 Mirrorless Digital Camera w/ 24-70mm f4 Lens & FTZ adaptor,2009.9,2020-10-15 00:00:00
Vertical L Bracket Plate L Bracket Holder Grip for Nikon Z7 Z6 Camera Arca-Swiss,19.98,2020-10-15 00:00:00
Nikon NIKKOR Z 24-70mm f/4 S Lens,565.95,2020-10-15 00:00:00
58mm Reverse Mount Macro Adapter Ring for Nikon Z-Mount Camera Z6 Z7,7.5,2020-10-15 00:00:00
3 Legged Thing Zelda L- Bracket for Nikon z Series Cameras,99.99,2020-10-15 00:00:00
Nikon AN-6W Wide Nylon Neck Strap for Camera Neckstrap,30.0,2020-10-15 00:00:00
Kipon Adapter for Mamiya 645 Mount Lens to Nikon Z Full Frame Mirrorless Camera,185.0,2020-10-15 00:00:00
"# Nikon NIKKOR Z 24-70mm F/4 S Lens ""Mint"" S/N 20084753",449.99,2020-10-16 00:00:00
7artisans 35mm F1.2 F/1.2 Large Aperture Z Mount Lens for Nikon Z6 Z7 Z50 Camera,139.0,2020-10-16 00:00:00
Rear Lens Cover + Camera Front Body Cap for Nikon Z7 Z6 re*K0YYY,4.12,2020-10-16 00:00:00
easyCover Nikon Z6 / Z7 Silicone Camera Protective Case YELLOW  EA-ECNDZ7Y,29.95,2020-10-16 00:00:00
Nikon Z 50 20.9MP Camera With 16-50mm + 50-250mm Lenses FTZ Adapter+ Ex Battery,1059.9,2020-10-16 00:00:00
"Nikon NIKKOR Z 24-70mm f/4 S Lens w/Box, Caps, Hood & UV Filter",519.85,2020-10-16 00:00:00
KIWIFOTOS Lengthen Soft Camera Eye cup Eyepiece for Nikon Z7 Z6 Z5 Replace DK-29,13.99,2020-10-16 00:00:00
USB Cable for Nikon UC-E6 Fuji Finepix 100 20 S1000FD Z35 F70EXR S2000 S2000HD,5.14,2020-10-16 00:00:00
Nikon Nikkor Z 24-200mm F/4-6.3 VR Lens *NEW* *IN STOCK* *NIKON USA WARRANTY*,896.95,2020-10-16 00:00:00
50mm f/1.4 SLR Lens for Nikon D7000 D7100 D200 D300 D5200 D3300 D800 D3200 J1Z9,130.99,2020-10-16 00:00:00
ENEL15 Battery Charger for Nikon Z9 Z7 Z6 Z5 Z1 D7500 D7200 D7100 D810 D850 D500,9.44,2020-10-16 00:00:00
"Glass for Nikon Z7 & Z6, Camera LCD+Top Screen Protector Tempered Glass (4-Pack)",7.99,2020-10-16 00:00:00
Kipon Focal Reducer Adapter Speedbooster for Mamiya 645 Lens to Nikon Z Camera,755.0,2020-10-16 00:00:00
Kipon Tilt Adapter for Nikon F Mount Lens to Nikon Z Mirrorless Camera,190.0,2020-10-16 00:00:00
Kipon LR-NZ Lens Adapter for Leica R Mount Lens to Nikon Full Frame Z6 Z7 Camera,67.9,2020-10-16 00:00:00
"Pixel RC-201/DC2 Shutter Release Cable for Nikon Z7,Z6,D7500,D7200,D5600,D5500",11.82,2020-10-16 00:00:00
Sony NEX E Mount Lens To Nikon Z-Mount Mirrorless Camera Adapter Z7II Z6 Z5 Z50,15.79,2020-10-17 00:00:00
Nikon lens hood HB-85 for 24-70mm f/4 S Nikkor Z sun shade,29.0,2020-10-17 00:00:00
Mcoplus Z6Z7Pro 2.4G Remote Control Vertical Battery Grip for Nikon Z6 Z7 camera,99.99,2020-10-17 00:00:00
Nikon NIKKOR Z 24-70mm f/2.8 S Lens + Filter Kit + Accessory Kit,1995.95,2020-10-17 00:00:00
Nikon Nikkor Z 50mm f1.8 S Lens #654,519.75,2020-10-17 00:00:00
"Nikon Z 6 (Z6) Mirrorless Digital Camera Body Only - Shutter Count is 4,721",1249.0,2020-10-17 00:00:00
Nikon Z50 Kit w/DX 16-50mm VR Lens & FREE Extra OEM Battery & 32GB SDHC *NEW* ,996.95,2020-10-17 00:00:00
Nikon Z 20mm F/1.8 S Lens *NEW* *IN STOCK*,1046.95,2020-10-17 00:00:00
Nikon Nikkor Z 50mm f/1.8 S,606.95,2020-10-17 00:00:00
Nikon NIKKOR Z 24-70mm F4 S Lens ,545.0,2020-10-17 00:00:00
JJC GSP-Z50 Optical GLASS LCD Screen Protector Film for Nikon Z50 Camera + Cloth,8.99,2020-10-17 00:00:00
Genuine Nikon EN-EL15B Battery for D850 D810 D750 D7000 D600 D500 Z6 Z7 V1,24.4,2020-10-17 00:00:00
New EN-EL15B ENEL15b Battery For Nikon D7100 D7000 D800 D810 D750 Z7 Z6 V1,18.69,2020-10-17 00:00:00
Genuine Nikon EN-EL15B Battery for D850 D810 D750 D7000 D600 D500 Z6 Z7 V1,27.98,2020-10-17 00:00:00
Nikon bayonet hood HB-86 NIKKOR Z 14-30mm f / 4S,49.75,2020-10-17 00:00:00
Tamron For Nikon Rear Lens Cap Protector - USED Z526,10.71,2020-10-17 00:00:00
9H Tempered Glass Screen Protector for Nikon Z6 Z7 Mirrorless Camera AUS seller.,69.23,2020-10-17 00:00:00
Adapter for Hasselblad HB V CF Lens to Nikon Z mount Z6 Z7 Z50 Mirrorless Camera,34.95,2020-10-17 00:00:00
Used Nikon NIKKOR Z 24-70mm F/4 S Lens Excellent condition,418.0,2020-10-18 00:00:00
Anti-Scratch Protection Skin Film For Nikon Z50 + 16-50Mm Lens Carbon Fiber,23.17,2020-10-18 00:00:00
2.5mm-N3 Shutter Release Cable f Nikon Z6 Z7 D7500 D750 D780 D5600 D7200 D90 Df,7.99,2020-10-18 00:00:00
Nikon MB-N10 Multi Battery Power Pack for Z7 and Z6 Mirrorless Cameras,190.0,2020-10-18 00:00:00
Kastar Battery LCD Dual Charger for Nikon EN-EL15 MH-25  Nikon Z6 Z7 Z7Q3 DSLR,7.99,2020-10-18 00:00:00
Nikon Z7 Full Frame Mirrorless Camera Body + 24-70mm Lens Kit Filmmakers Bundle,3299.0,2020-10-18 00:00:00
Standard Hot Shoe Cover f Nikon Z6 Z7 D850 D7500 D5 D500 D750 D3400 D780 D5600,6.29,2020-10-18 00:00:00
K&F Concept Lens Adapter for Leica M39 Mount Lens to Nikon Z Z6 Z7 Camera Body,20.01,2020-10-18 00:00:00
Genuine Nikon HB-98 Lens Hood for Z 24-50mm f/4-6.3 VR Lens,69.07,2020-10-18 00:00:00
M49x0.75 male thread to Nikon Z camera mount adapter,36.5,2020-10-18 00:00:00
72mm Lens cap Cover fr Nikon 10-20MM 16-80MM 18-200MM 24MM 105MM 24-85MM Z 24-70,9.99,2020-10-18 00:00:00
Nikon NIKKOR Z 24-70mm F/4 S - Used - FREE SHIPPING,549.99,2020-10-18 00:00:00
Nikon Z 50 Z50 20.9MP w/ 16-50mm + 50-250mm VR Lens Kit * LOW Use - USA MODEL,968.0,2020-10-18 00:00:00
Nikon Nikkor Z 24-200mm F/4-6.3 VR Lens *NEW* *IN STOCK* *NIKON USA WARRANTY*,896.95,2020-10-18 00:00:00
Nikon MB-N10 Multi Battery Power Pack for Z7 and Z6 Mirrorless Cameras - Used,149.99,2020-10-18 00:00:00
NIKON COOLPIX L840 DIGITAL CAMERA | WIFI 16.0MP 38X ZOOM; PURPLE; TESTED WORKS,89.95,2020-10-18 00:00:00
Nikon NIKKOR Z 50mm F1.8 S Lens Genuine,635.0,2020-10-18 00:00:00
K&F Concept Lens Mount Adapter for Nikon G AF-S Mount Lens to Nikon Z6 Z7 Camera,35.99,2020-10-18 00:00:00
Nikon NIKKOR Z 35mm F1.8 S Lens Genuine,755.0,2020-10-18 00:00:00
Nikon NIKKOR Z 24-70mm F/4 S Lens,468.45,2020-10-18 00:00:00
Nikon D7100 24.1MP Digital SLR Camera Body - 9420 Shutter Count -------- *Z11*,386.99,2020-10-18 00:00:00
AI-NIK Z Ring Adapter for Nikon F Mount Lens to Nikon Z7 Z6 Cameras Replace FTZ,25.88,2020-10-18 00:00:00
JJC Leather Mirrorless Camera Hand Wrist Grip Strap for Nikon 1 J5 AW1 Z6 Z7 Z50,27.0,2020-10-18 00:00:00
SHOTEN Lens adapter Close Focus for Leica M mount to Nikon Z Z6 Z7 camera Black,169.22,2020-10-18 00:00:00
Screen Protector Glass Appliable for Nikon Z 5 DX-Format Mirrorless Camera-3Pack,7.99,2020-10-18 00:00:00
Nikon NIKKOR Z 35mm f/1.8 S Lens for Z Series Mirrorless Cameras W/Filter KIT,746.95,2020-10-18 00:00:00
K&F Concept Lens Mount Adapter for Canon FD FL Lens to Nikon Z6 Z7 Camera,35.99,2020-10-19 00:00:00
LM to NZ M Close Focus for Leica M ZM to Nikon Z7 Z6 Camera Adapter With Macro,48.88,2020-10-19 00:00:00
Nikon NIKKOR Z DX 50-250mm f/4.5-6.3 VR Telephoto Lens Used *Excellent Conditio*,239.0,2020-10-19 00:00:00
For Nikon 75-200mm f/4.5 zoom lens mirrorless Z50 Z6 Z7 Z5 Z mount camera,47.98,2020-10-19 00:00:00
Nikon Z7 45.7MP FX-Format Full-Frame 4K Mirrorless Camera  with Backpack Bundle,2799.0,2020-10-19 00:00:00
Nikon Z50 Mirrorless Camera 4K DX-Format 16-50mm + 50-250mm VR 2 Lens Kit Bundle,1179.0,2020-10-19 00:00:00
Kastar Battery for Nikon EN-EL15 (27011) EL15a EL15b EL15c Nikon Z5 Z6 Z7 D7500,10.99,2020-10-19 00:00:00
Stabil LNZ : L Plate (Bracket) For Nikon Z7 / Z6 - Black (Out of stock),122.0,2020-10-19 00:00:00
2-Pack Khaos For Nikon Z50 Tempered Glass Screen Protector,7.11,2020-10-19 00:00:00
2X Khaos For Nikon Z6 / Z7 Digital SLR Camera Tempered Glass Screen Protector,6.98,2020-10-19 00:00:00
JJC Body Cap & Rear Lens Cap for Nikon Z Mount Z6 Z7 replace Nikon BF-N1 LF-N1,14.29,2020-10-19 00:00:00
Nikon Speedlight SB-5000 AF Shoe Mount Flash Strobe iTTL DSLR D850 Z6 Z7 D5 D6,259.97,2020-10-19 00:00:00
Nikon NIKKOR Z 24-70mm f/2.8 S Lens,1969.95,2020-10-19 00:00:00
Mcoplus BG-Z6Z7 Vertical Battery Grip Pack  for Nikon Z6 Z7 Mirrorless Camera,79.0,2020-10-19 00:00:00
Lensbaby - Composer Pro 2 with Sweet Optic 50mm for Nikon Z,229.02,2020-10-19 00:00:00
"Canon FD Lens to Nikon Z Z50 Z6 Z7 Mirrorless Camera Adapter Ring ""US Seller""",12.8,2020-10-19 00:00:00
Professional Interview Video Recording Camera Microphone For Canon Nikon MI Z4C7,11.16,2020-10-19 00:00:00
" PC Socket Cover Cap for Nikon, Canon, Pentax, Olympus DSLR SLR Cameras",6.95,2020-10-19 00:00:00
Nikon Z6 FX-Format Mirrorless Camera Body w/ 32GB XQD Card and 2 Batteries,1409.68,2020-10-19 00:00:00
Automatic Macro Extension Tube Set for Nikon Z-mount Cameras/Lenses(26mm+36mm),69.0,2020-10-19 00:00:00
Vertical L Bracket Plate for Nikon Z7 Z6 Camera Arca-Swiss Standard Mounting,19.58,2020-10-19 00:00:00
Nikon NIKKOR Z 85mm f/1.8 S Lens,699.0,2020-10-19 00:00:00
New EN-EL15B ENEL15b Battery For Nikon D7100 D7000 D800 D810 D750 Z7 Z6 V1,32.49,2020-10-19 00:00:00
TECHART TZE-01 Auto-Focus for Sony FE Mount Lens Adapter To Nikon Z6 Z7 Camera,236.53,2020-10-19 00:00:00
Nikon Nikkor Z 24-200mm F/4-6.3 VR Lens *NEW* *IN STOCK* *NIKON USA WARRANTY*,896.95,2020-10-19 00:00:00
49mm Front Lens Cap Snap on Front Lens Cap For Nikon Black Best Z6S0,2.12,2020-10-19 00:00:00
 Camera Wireless Remote Flash Trigger Shutter Release for Nikon D3500 D7500 Z6,33.95,2020-10-20 00:00:00
Nikon NIKKOR Z 35mm f/1.8 S Lens for Z Series Mirrorless Cameras #20081,696.95,2020-10-20 00:00:00
LM-NZ Adapter For Leica M Lens to Nikon Z mount Z5 Z6 Z7 mirrorless Camera,20.6,2020-10-20 00:00:00
BRAND NEW Nikon Z7 FX-Format 45.7MP Mirrorless Digital Camera (Body Only),2099.95,2020-10-20 00:00:00
SHOTEN adapter for Sony E FE mount lens to Nikon Z mount Z6 Z7 camera,60.17,2020-10-20 00:00:00
Lens Mount Adaptor for Pentacon Six Kiev 60 Lenses to Nikon Z6 Z7 Camera Body,34.89,2020-10-20 00:00:00
Kase Built-in Filter For Nikon Z7/Z6 ( MCUV / Neutral Density / Neutral Night ),76.0,2020-10-20 00:00:00
Macro Focusing Tube Helicoid Adapter For CONTAX YASHICA CY Lens to Nikon Z6 Z7,39.9,2020-10-20 00:00:00
52mm Macro Lens Reverse Adapter Ring Nikon Z mount Z6 Z7 Z50 Mirrorless Camera,6.2,2020-10-20 00:00:00
7artisans 60mm f2.8 Macro Portrait Manual Focus Lens For Canon Fuji Sony Nikon,159.0,2020-10-20 00:00:00
Kastar AC Wall Battery Charger for Nikon EN-EL25 Nikon Z Series Z50 Z 50 Camera,6.99,2020-10-20 00:00:00
"(3 Packs) JJC Camera Body Cap for Nikon Z6 Z7, Rear Lens Cap for Nikon Z Lens...",10.99,2020-10-20 00:00:00
Rear Lens Cover + Camera Front Body Cap for Nikon Z7 Z6 replace BF-N1 LF-N1 FDT,4.34,2020-10-20 00:00:00
"Pro Zomei Z818 Compact Portable Tripod Monopod,Ball Head for DSLR Camera Nikon",79.99,2020-10-20 00:00:00
New Nikon NIKKOR Z 24-70mm f/4 S Lens ,546.0,2020-10-20 00:00:00
SmallRig Vlogging Mounting Plate Pro for Nikon Z50 Camera LCN2667 2667,34.9,2020-10-20 00:00:00
Nikon NIKKOR Z 35mm f/1.8 S Lens,696.95,2020-10-20 00:00:00
Nikon NIKKOR Z 35mm F/1.8 S Lens w/FREE Hoya UV Filter *NEW* ,696.95,2020-10-20 00:00:00
Nikon NIKKOR Z 85mm F/1.8 S Lens *NEW* *IN STOCK*,696.95,2020-10-20 00:00:00
95mm Center Pinch Snap-On Lens Cap with Leash Canon Nikon Sony DSLR Camera,7.95,2020-10-20 00:00:00
Nikon Z7 45.7MP Digital Camera - Black (Body Only)-Very Good Condition,1909.7,2020-10-20 00:00:00
72mm Flower Screw Mount Lens Hood For Nikon Nikkor Z 24-70mm F4 S Lens,26.02,2020-10-20 00:00:00
SmallRig HDMI Cable Clamp for Nikon Z6/Z7 L-Bracket APL2258 - 2259,19.9,2020-10-20 00:00:00
Nikon Z 6 Mirrorless Digital Camera w/ 24-70mm Lens 1598,1997.97,2020-10-20 00:00:00
Viltrox DG-Z Auto Focus 12mm+24mm Macro Extension Tube Ring for Nikon Z Mount,50.75,2020-10-21 00:00:00
NIKON FTZ LENS ADAPTER F LENSES TO Z CAMERA BODIES,165.0,2020-10-21 00:00:00
NEW! Nikon Z7 Mirrorless Digital Camera with FTZ Mount Adapter Kit USA Model,2546.9,2020-10-21 00:00:00
E-Z Lens Mount Adapter Ring for Sony E NEX MF Lenses to Nikon Z Z7 Z6 NEX-Z,16.69,2020-10-21 00:00:00
"Opteka 650mm to 2600mm Telephoto Zoom Lens for Nikon Z-Mount Z7, Z6, Z50 Camera",199.95,2020-10-21 00:00:00
Genuine Nikon CL-C1 Soft Lens Pouch Case for Nikkor Z 35mm 50mm 85mm 14-30 24-70,19.95,2020-10-21 00:00:00
"Leica M lens to Nikon Z Mount Adapter, fits Nikon Z50 Z6 Z7 Mirrorless Camera",12.98,2020-10-21 00:00:00
Memory Card Reader-Writer Kit For Nikon Z6 Z7 Z-6 Z-7,8.97,2020-10-21 00:00:00
Nikon NIKKOR Z 24-70mm F/4 S Lens #J06001,502.98,2020-10-21 00:00:00
HB-90A Lens Hood Shade for Nikon NIKKOR Z DX 50-250mm f/4.5-6.3 VR + Filter +Cap,13.99,2020-10-21 00:00:00
Kastar Rechargeable Li-ion Battery for EN-EL15b EL15a Nikon Z7Q3  Z 7 Q3 4K UHD,18.99,2020-10-21 00:00:00
Rectangle Eyecup Camera Eyepiece for Canon Nikon Sony Pentax & Most Cameras DSLR,7.95,2020-10-21 00:00:00
Nikon Nikkor Z 24-70mm f/2.8 S Lens w/ German Filter NEW,999.0,2020-10-21 00:00:00
Nikon Nikkor Z 24-70mm f/2.8 S Lens w/ German Filter NEW,999.0,2020-10-21 00:00:00
Nikon Nikkor Z 24-70mm f/2.8 S Lens w/ German Filter NEW,999.0,2020-10-21 00:00:00
Nikon Nikkor Z 24-70mm f/2.8 S Lens w/ German Filter NEW,999.0,2020-10-21 00:00:00
Nikon Nikkor Z 24-70mm f/2.8 S Lens w/ German Filter NEW,999.0,2020-10-21 00:00:00
Genuine Nikon MC-DC2 Remote Cord for COOLPIX P950 D7500 D7200 D5500 D3300 D90 Z7,37.0,2020-10-21 00:00:00
Nikon Nikkor Z 24-70mm f/2.8 S Lens w/ German Filter NEW,999.0,2020-10-21 00:00:00
Nikon Nikkor Z 24-70mm f/2.8 S Lens w/ German Filter NEW,999.0,2020-10-21 00:00:00
Wired Remote Shutter Release Control MC-DC2 f/ Nikon D750 D7500 Z6 Z7-USA Seller,9.89,2020-10-21 00:00:00
New Rear Lens Cap For Nikon Nikkor SLR DSLR Lens -S Z6G1 CAP-AIx R0X5 Mount R2V7,2.43,2020-10-21 00:00:00
58mm Metal Screw-On Lens Cap for Canon Nikon Sony Pentax Universal DSLR Camera,7.95,2020-10-21 00:00:00
SHOTEN adapter for NIKON AUTO AIS AI F mount lens to Nikon Z mount Z6 Z7 camera,55.99,2020-10-21 00:00:00
#2 Nikon Z6 / Z7 Mirrorless Camera Instruction Book / Manual / User Guide,16.49,2020-10-21 00:00:00
"Nikon EN-EL15B Camera Battery for D850 D7500 D750 D810 Z6, Z7 Mirrorless D750",23.39,2020-10-21 00:00:00
"Nikon Z50 Kit w/Z DX 16-50mm VR, 50-250mm VR, Extra OEM Batt & 32GB SDHC *NEW* ",1096.95,2020-10-21 00:00:00
Fujica X Old Fuji AX mount lens to Nikon Z Mirrorless Full Frame Z6 Z7 Adapter,28.97,2020-10-21 00:00:00
"Near Mint - Nikon Nikkor Z 50/1.8 S W/ Box, Caps, and Hood ",540.24,2020-10-21 00:00:00
NIKON NIKKOR Z 24-200 MM f/4-6.3 VR LENS - 2-Year Nikon Warranty,1184.73,2020-10-22 00:00:00
SmallRig Mounting Plate for Nikon Z50 Vlogging  - en aluminium - LCN2525,28.9,2020-10-22 00:00:00
Nikon NIKKOR Z DX 16-50mm f/3.5-6.3 VR Wide Angle Lens,210.0,2020-10-22 00:00:00
Mcoplus Z6 Z7Pro Battery Grip with 2.4G Wireless Remote Control for Nikon Z6 Z7 ,99.99,2020-10-22 00:00:00
"Nikon MB-N10 Multi power battery pack - Z6, Z7",317.0,2020-10-22 00:00:00
Nikon WR-T10 Remote Controller Transmitter for Z7 Z6 D7500 D5600 D780 D750 Df DN,73.0,2020-10-22 00:00:00
Nikon NIKKOR Z 24-70mm F/4 S Lens ( Pro Workhorse ),412.95,2020-10-22 00:00:00
New K&F Concept adapter for Nikon F mount lens to Nikon Z6 Z7 camera,38.64,2020-10-22 00:00:00
AODELAN Camere Remote Control ML-L7A For Nikon COOLPIX P1000 P950 Z50 B600 A1000,26.99,2020-10-22 00:00:00
