title,price,dateMC-DC2 LCD Timer Remote Shutter for Nikon Z7 D750 D610 D7500 D7200 D5600 D3300,17.87,2020-08-06 00:00:00
Camera Siliconen Case Cover For Nikon D850 D3400 D5300 D810 D5600 D7200 Z7 Z6 ,18.07,2020-08-06 00:00:00
JJC USB Dual Battery Charger with Extension Cable fit Nikon EN-EL25 fr Nikon Z50,12.99,2020-08-06 00:00:00
Nikon Z7 Mirrorless Digital Camera with FTZ Mount Adapter Kit,2630.6,2020-08-05 00:00:00
Nikon NIKKOR Z 24-70mm f/2.8 S Lens,2018.83,2020-08-05 00:00:00
UURig Camera Vlog Selfie Flip Screen Bracket for Sony Fuji Nikon Z6/Z7 Canon,11.91,2020-08-05 00:00:00
JJC Oval Rubber Eyecup Eyepiece Viewfinder for Nikon Z7 Z6 Camera replace DK-29,12.99,2020-08-05 00:00:00
Nikon Z50 16-50mm VR Lens Kit Mirrorless Camera+FTZ adaptor+SD Card +Smallrig,858.7,2020-08-05 00:00:00
SmallRig Arca-Type L-Bracket Cage for Nikon Z6 and Nikon Z7 Camera 2258 CG,69.0,2020-08-05 00:00:00
SmallRig Cage for Nikon Z6/ Nikon Z7 Camera 2243 US STOCK FAST SHIPPING,89.0,2020-08-05 00:00:00
2x Hot Shoe Cover Cap For Mount Canon Nikon Panasonic Fuji Olympus B2Q2 DS N5Z9,1.22,2020-08-05 00:00:00
"Leica M39 39mm Lens to Nikon Z Z50 Z6 Z7 Mirrorless Camera Adapter ""US Seller""",10.95,2020-08-05 00:00:00
UURig Vlog Selfie Flip Screen Bracket for Sony A6000 A6500 A7M3 A7R3 Nikon Z6 Z7,17.89,2020-08-05 00:00:00
"Adapter for Canon FD Lens to Nikon Z NZ Z50 Z6 Z7 Mirrorless Camera ""US Seller""",12.75,2020-08-05 00:00:00
JJC Wired Remote Control for Nikon Z7 Z6 D750 D610 D600 D7100 D7000 D5600 D5500,7.99,2020-08-05 00:00:00
"XIT LAR​GE BAG CASE to CAMERA NIKON Z6 Z7 FX, DSLR D5200 D 5200 SLR",15.4,2020-08-05 00:00:00
"🔴  Nikon FTZ Adapter for Z50, Z6 Z7. White Box.",266.1,2020-08-05 00:00:00
Silicon Rubber Case Cover Skin Protector for Nikon Z7 Z6 Mirrorless Camera,8.99,2020-08-05 00:00:00
LR-NZ Lens Mount Adapter Ring For Leica R L/R Mount Lens to Nikon Z Z6 Z7 Camera,19.98,2020-08-05 00:00:00
Rear Lens Cover + Camera Front Body Cap for Nikon Z7 Z6 reDXH,3.93,2020-08-04 00:00:00
Nikon Z6 24.5MP Digital Camera Kit w/ Lenses! Z Mount Adapter (Filmmaker's Kit) ,2450.0,2020-08-04 00:00:00
Glass for Nikon Z6 / Z7 TOP & LCD Screen Protector (2PCS Top & 2PCS LCD Screen),7.99,2020-08-04 00:00:00
Replacement Cover for Nikon D90 DSLR BM-10,5.99,2020-08-04 00:00:00
Nikon Z6 Digital Camera w/ NIKKOR Z 24-70mm f/4 S Lens,1759.0,2020-08-04 00:00:00
Nikon Z6 Z7 PU Leather Half Case Cover - Brown,19.6,2020-08-04 00:00:00
Nikon NIKKOR Z 14-30mm f/4 S Lens - NEAR MINT,1095.0,2020-08-04 00:00:00
Nikon Z6 24.5MP Mirrorless Camera - Black (Body Only) Box,1011.19,2020-08-04 00:00:00
Nikon Z50 APSC Two Lens Camera Kit (MINT) With Many Extras US Version,1025.0,2020-08-04 00:00:00
Nikon NIKKOR Z DX 50-250mm f/4.5-6.3 VR Telephoto Lens + Filter (USA Model) MINT,279.0,2020-08-04 00:00:00
New K&F Concept adapter for Pentax K mount lens to Nikon Z6 Z7 camera,38.64,2020-08-04 00:00:00
New K&F Concept adapter for Canon FD mount lens to Nikon Z6 Z7 camera,38.64,2020-08-04 00:00:00
New K&F Concept adapter for Minolta MD mount lens to Nikon Z6 Z7 camera,38.64,2020-08-04 00:00:00
Kastar Battery Dual Charger for Nikon EN-EL15 EL15a Nikon Z Series Z 6 Z 7 Z6 Z7,8.99,2020-08-04 00:00:00
Lens Rear Cap for Nikon Z Mount NIK Z Mirrorless Camera Lens Black,8.51,2020-08-04 00:00:00
Camera Body Cap and Rear Lens Cap fit Nikon Z mount cameras & lenses Z6 Z7 Cover,6.99,2020-08-04 00:00:00
"1/4""-20 Tripod Mount Screw to Hot Shoe Adapter For Nikon O1P6 Camera DSLR Z0N1",2.69,2020-08-04 00:00:00
K&F Concept Lens Mount Adapter for M39 Mount Lens to Nikon Z6 Z7 Camera,17.99,2020-08-04 00:00:00
NEW Nikon MC-XQ64G XQD Memory Card 64GB for Z7 Z6 D850 D500 from JAPAN,193.37,2020-08-04 00:00:00
M42 Lens to AI For Nikon F-mount adapter ring D70s L0Z0 D100 New D5100 D31 C5I9,1.74,2020-08-04 00:00:00
Aodelan ML-L7A Shutter Release Remote Control for Nikon Z 50 Coolpix P1000 A1000,31.99,2020-08-04 00:00:00
7artisans 35mm F1.2 Manual Focus Lens for Nikon Z-Mount Z6 Z7 Z50 Mirrorless Cam,135.89,2020-08-04 00:00:00
KIWIFOTOS Lengthen Soft Camera Eye cup Eyepiece for Nikon Z7 Z6 Replaces DK-29,13.99,2020-08-04 00:00:00
"Remote MC-DC2 Z Type Shutter Release for Nikon Z7, Z6 COOLPIX P1000 P7700 P7800",8.99,2020-08-04 00:00:00
New K&F Concept adapter for Nikon F mount lens to Nikon Z6 Z7 camera,38.64,2020-08-04 00:00:00
Body Cap Lens Rear Cap For All Nikon Camera &Camera Accessory Y2R3 P2Z9,2.69,2020-08-03 00:00:00
easyCover Armor Protective Silicone Skin for Nikon Z6 (Yellow),29.95,2020-08-03 00:00:00
GABALE QR Base L Plate Bracket Camera Grip Camera Holder For Nikon Z7 Z6 LB-Z7,27.99,2020-08-03 00:00:00
QR Base L Plate Bracket Camera Grip Camera Holder For Nikon Z7 Z6 LB-Z7,26.99,2020-08-03 00:00:00
JJC EN-DK29 II  Eyecup replaces Nikon DK-29 compatible with Nikon Z6 Z7 camera ,9.99,2020-08-03 00:00:00
SmallRig Cage for Nikon Z6/ Nikon Z7 Camera 2243 CG,89.0,2020-08-03 00:00:00
SmallRig Vlogging Mounting Plate for Nikon Z50 Camera LCN2525,28.9,2020-08-03 00:00:00
SmallRig 2258 Arca L-Bracket Cage for Nikon Z6 Z7 US STOCK FAST SHIPPING,68.99,2020-08-03 00:00:00
"80"" True Professional Heavy Duty Tripod with Case For Nikon Z6 Z7 Z-6 Z-7",89.95,2020-08-03 00:00:00
Nikon NIKKOR Z 85mm f/1.8 S Lens,761.75,2020-08-03 00:00:00
Glass Screen Protector for Nikon Z6 / Z7 2D 9H Tempered Ultra Thin,3.92,2020-08-03 00:00:00
Used Nikon - Z7 MIRRORLESS CAMERA BODY ONLY - Full Frame,2099.95,2020-08-03 00:00:00
Nikon Z7 FX 45.7MP Mirrorless Camera - Black (Kit with NIKKOR Z 50mm f/1.8 S),3050.0,2020-08-03 00:00:00
"Nikon Neck Strap 1.5"" Black Yellow Stitched White ""Nikon Z"" (AN-DC19) - *EX*",10.56,2020-08-03 00:00:00
SHOTEN adapter for NIKON AUTO AIS AI F mount lens to Nikon Z mount Z6 Z7 camera,45.99,2020-08-03 00:00:00
"Nikon Z50 20.9MP Mirrorless Digital Camera (Body Only) Shutter Ct: 2,382  #P2080",689.98,2020-08-03 00:00:00
Meike Z-AF1 Metal AF Macro Extension Tube adapter Ring 11mm+18mm for Nikon Z6 Z7,43.0,2020-08-03 00:00:00
72mm center pinch snap on Front Lens Cap Cover For Canon w Nikon string D1Z8,2.59,2020-08-03 00:00:00
Nikon FTZ Mount Adapter (Nikon F to Z - Mount),160.09,2020-08-03 00:00:00
EXCELLENT CONDITION Nikon NIKKOR Z 50mm F/1.8 S Lens,520.0,2020-08-03 00:00:00
Nikon Z6 24.5MP Mirrorless Digital Camera w/ free hand grip,1509.95,2020-08-03 00:00:00
Used Nikon - NIKKOR Z 35mm f/1.8 S Lens - Mirrorless Z Mount,649.95,2020-08-03 00:00:00
AODELAN Camera Remote for Nikon P1000 B600 A1000 P950 Z50 Replace Nikon ML-L7,28.99,2020-08-02 00:00:00
3X Rear + Body Lens Cap 6PCS NIKON Lens DSLR Camera Photo Studio Photography,8.5,2020-08-02 00:00:00
NEW  Lens ZOOM FOR FUJIFILM FUJI J10 J15 CASIO EX-Z9 Z19 Z29 NIKON L11 ,4.99,2020-08-02 00:00:00
Fujica X Old Fuji AX mount lens to Nikon Z Mirrorless Full Frame Z6 Z7 Adapter,28.97,2020-08-02 00:00:00
12V-24V car charger dc cable EN-EL15 EP-5B dc coupler for Nikon D850 D610 Z6 Z7,32.5,2020-08-02 00:00:00
7artisans 35mm F1.4 Full Frame Large Aperture Manual Lens for Nikon Z Sony E Nex,199.0,2020-08-02 00:00:00
PRO JJC GSP-Z7 Optical GLASS LCD Screen Protector For Nikon Z6 Z7 camera NEW ,8.99,2020-08-02 00:00:00
39mm Center Pinch Snap-On Lens Cap with Leash Canon Nikon Sony DSLR Camera,4.95,2020-08-02 00:00:00
"NIkon Nikkor Z 24mm f/1.8 S open box, w/ Nikon L37C (UV) filter",764.05,2020-08-02 00:00:00
Leica M39 lens to Nikon Z mount Z6 Z7 full frame mirrorless adapter + rear CAP,19.97,2020-08-02 00:00:00
AODELAN Intervalometer HDR Remote Control for Nikon Z6 Z7 Coolpix P1000 A1000 D5,56.04,2020-08-02 00:00:00
Camera Silicone Case Cover for Nikon Z7 D3500 D5300 D5600 D7200 D7500 D810 D850,18.17,2020-08-02 00:00:00
JJC Body Cap + Rear Lens Cap for Nikon Z7 Z6 Z50 Z Mount Camera & Lens,7.99,2020-08-02 00:00:00
DK-29 Nikon Long Extended Eyepiece Eyecup Soft Rubber Silicone Cushioning Z7 Z6,17.49,2020-08-02 00:00:00
Nikon NIKKOR Z 24-70mm f/2.8 S with 82mm Nikon NC Filter,1799.0,2020-08-02 00:00:00
10pcs Plastic Black Nikon Z mount rear lens cap for Z6 Z7 Lenses,25.98,2020-08-02 00:00:00
12V step-down dc cable EN-EL15 EP-5B dummy battery for Nikon D850 D610 Z6 Z7,30.8,2020-08-02 00:00:00
Nikon Z50 DX-Format Mirrorless Camera with 16-50mm and 50-250mm Lenses Bundle,1119.95,2020-08-02 00:00:00
M43-Z Lens Mount Adapter Ring for Micro 4/3 M43 MFT Lens to Nikon Z Z7 Z6 Camera,16.89,2020-08-02 00:00:00
Kastar EN-EL15B ENEL15b Battery For Nikon D7100 D7000 D800 D810 D750 Z7 Z6 V1,10.99,2020-08-02 00:00:00
Nikon EP-5B Power Connector D7500 D7200 D850 D810 D800 D780 D750 D610 D500 Z6 Z7,48.99,2020-08-02 00:00:00
ZOMEI Z669 Camera Tripod Monopod Travel for Canon Nikon Sony Samsung Camcorders,56.39,2020-08-02 00:00:00
Nikon Z6 24.5MP Mirrorless Digital Camera with Extras,1399.0,2020-08-01 00:00:00
Nikon NIKKOR Z 85mm f/1.8 S Lens 67mm Nikon NC Filter,699.0,2020-08-01 00:00:00
For Nikon Z50 Case Half Cover Original Camera Full PU Leather or Silicone Option,23.0,2020-08-01 00:00:00
"JJC Large Ergonomic Eyecup for Nikon Z6 Z7 replaces Nikon DK-29 ""US Seller""",13.89,2020-08-01 00:00:00
T-Mount T-2 Lens To Nikon Z-Mount Mirrorless Camera Adapter Z5 Z50 Z6 Z7,13.2,2020-08-01 00:00:00
Nikon High-power zoom lens NIKKOR Z 24-200mm f/4-6.3 VR Z mount Full size,1538.24,2020-08-01 00:00:00
Wired Remote Shutter Release Control Replacement for Nikon MC-DC2 D7100 Z7 Z6 ,10.01,2020-08-01 00:00:00
"JJC Black Pouch Case Bag for Nikon Z50 &16-50mm lens+Hood, LCD Screen Protector",15.95,2020-08-01 00:00:00
SmallRig Vlogging Mounting Plate Pro for Nikon Z50 Camera #LCN2667,34.9,2020-08-01 00:00:00
Nikon NIKKOR Z 35mm f/1.8 S with 62mm Nikon NC Filter,599.0,2020-08-01 00:00:00
New Nikon COOLPIX (Z20) A300 20.1MP HD Digital Camera Silver,139.66,2020-08-01 00:00:00
Camera Remote Control for Nikon Z50 COOLPIX P950 B600 A1000 P1000 replace ML-L7,30.49,2020-08-01 00:00:00
HN-24 62mm Hood Lens For NIKON AF 70-210mm f/4-5.6D 75-300mm L0Z0 f/4.5-5.6 W1Q6,4.52,2020-08-01 00:00:00
Nikon NIKKOR Z 50mm f/1.8 S with 62mm Nikon NC Filter,399.0,2020-08-01 00:00:00
Nikon Z6 With 24-70 F4 + 32GB XQD Card + Card Reader & L-Bracket Free Shipping,1725.0,2020-08-01 00:00:00
"🔴  Nikon FTZ Lens Mount Adapter Adaptor for Z50, Z6 Z7. Brand New.",283.31,2020-08-01 00:00:00
Khaos For Nikon Z6 / Z7 Digital SLR Camera Tempered Glass Screen Protector,6.45,2020-08-01 00:00:00
Nikon NIKKOR Z 35mm F/1.8 S Lens for Z6 and Z7 Mirrorless Excellent+,676.84,2020-07-31 00:00:00
38mm  - Leash - Front Snap On Lens Cap - Nikon - USED Z702,10.94,2020-07-31 00:00:00
Nikon Z6 Mirrorless Digital Camera Body 24.5 MP & FTZ Mount Adapter Plus Extras,1699.0,2020-07-31 00:00:00
Nikon Z6 Mirrorless Camera Body w/NIKKOR Z 24-70mm f/4 S New in Box US Model,1995.0,2020-07-31 00:00:00
"Nikon Z 7  Camera, 6 x Transparent ULTRA Clear Camera Screen Protector",29.4,2020-07-31 00:00:00
95mm Center Pinch Snap-On Lens Cap with Leash Canon Nikon Sony DSLR Camera,7.95,2020-07-31 00:00:00
Reversible Lens Hood fr Nikon Nikkor Z DX 50-250mm f/4.5-6.3 VR on Z50 as HB-90A,12.99,2020-07-31 00:00:00
Nikon DK-29 Rubber Eyecup for Z6 Z7 DN,15.0,2020-07-31 00:00:00
New Rear Lens Cap For Nikon Nikkor SLR DSLR Lens -S CAP-AIx R0X5 Mount F AI R0Z5,2.36,2020-07-31 00:00:00
360 Angle Shutter Release Wireless Remote 100M for Nikon Z6 Z7 D7500 D750 D5600,31.49,2020-07-31 00:00:00
"Leica M lens to Nikon Z Mount Adapter, fits Nikon Z50 Z6 Z7 Mirrorless Camera",12.98,2020-07-30 00:00:00
Nikon NIKKOR Z 24-70mm f/2.8 S Lens,1969.95,2020-07-30 00:00:00
Pentax 6X7 67 Lens mount adapter Ring to Nikon Z Camera Full frame Mirrorless,79.75,2020-07-30 00:00:00
Sony Alpha Minolta AF lens To Nikon Z mount adapter Z6 Z7 full frame camera,28.98,2020-07-30 00:00:00
USA Premium Slim Canvas Camera Strap for Sony NEX Nikon Z Canon Leica M9 Fuji,7.99,2020-07-30 00:00:00
"Glass for Nikon Z7 & Z6, Camera LCD+Top Screen Protector Tempered Glass (4-Pack)",7.99,2020-07-30 00:00:00
EXCELLENT Nikon Z6 body only 4536 clicks!,1430.0,2020-07-30 00:00:00
2.5mm-N3 Shutter Release Cable f Nikon Z6 Z7 D7500 D750 D780 D5600 D7200 D90 Df,7.69,2020-07-30 00:00:00
Viltrox DG-Z Auto Macro Extension Tube Ring Lens Adapter for Nikon Z Mount Pre,41.46,2020-07-30 00:00:00
Lens Mount Adaptor for Pentacon Six Kiev 60 Lenses to Nikon Z6 Z7 Camera Body,34.89,2020-07-30 00:00:00
Kipon Adapter for Exakta Lens to Nikon Z Full Frame Mirrorless Camera,90.0,2020-07-30 00:00:00
Kipon Adapter for Contarex Mount Lens to Nikon Z Full Frame Camera,170.0,2020-07-30 00:00:00
MC-DC2 LCD Timer Remote Shutter Release for Nikon Z7 D750 D610 D7500 D7200 D5600,19.42,2020-07-30 00:00:00
"Hot Shoe Cold Foot & 1/4"" Screw Stand Bracket For Canon Z1N8 Light Nikon Re I8U2",2.68,2020-07-30 00:00:00
3 Nikon EN-EL15b Rechargeable Li-ion Battery for Z6/Z7 bodies,53.2,2020-07-30 00:00:00
YouPro YP-20 DC2 Portable Camera Wired Shutter Remote Trigger for Nikon D750 Z7,7.22,2020-07-30 00:00:00
"Neck Strap 1.5"" Black Yellow Stitched White ""Nikon Z"" (AN-DC19) LN",12.2,2020-07-30 00:00:00
SmallRig HDMI Cable Clamp for Nikon Z6/Z7 L-Bracket APL2258 - 2259,19.9,2020-07-30 00:00:00
Nikon NIKKOR Z 14-30mm f/4 S Lens for Z Series Cameras #20070,1296.95,2020-07-30 00:00:00
"Pentax PK Lens to Nikon Z Mount Z50 Z6 Z7 Mirrorless Camera Adapter ""US Seller""",12.63,2020-07-30 00:00:00
Camera Neck Shoulder Strap for Nikon D3500 D3400 D5300 D5600 D7500 D7100 Z6 Z7,7.99,2020-07-30 00:00:00
Fikaz CY to NIK-Z Adapter Contax Yashica to Nikon-Z Adapter,42.0,2020-07-30 00:00:00
TILTA LWS Baseplate For DSLR GH5 XT3 Nikon Z7 Sony a6 a7 a9 TA-BSP2-15-G 15mm,119.0,2020-07-29 00:00:00
VIVITAR Filter Kit 72mm ND8 UV CPL for Lens Z6 Z7 Nikon NIKKOR Z 24-70mm f/4 S ,19.45,2020-07-29 00:00:00
37mm Thread Mount Metal Lens Hood For Nikon Canon Olympus L0Z1 New Type C0G2,3.96,2020-07-29 00:00:00
37mm Thread Mount Metal Lens Hood For Nikon Canon Olympus L0Z1 New Type C0G2,3.96,2020-07-29 00:00:00
NEW Nikon NIKKOR Z 14-30mm f/4 S Lens,1103.0,2020-07-29 00:00:00
NEW Nikon Z6 Mirrorless Digital Camera with 24-70mm Lens + FTZ Mount Adapter,2173.0,2020-07-29 00:00:00
Contax / Yashica C/Y Lens to Nikon Z Mount Z50 Z6 Z7 Mirrorless Camera Adapter ,12.65,2020-07-29 00:00:00
Excellent Nikon Nikkor Z 24-70 F4 S No Warranty Imported,441.9,2020-07-29 00:00:00
SmallRig L-Bracket Holder for Nikon Z6 Z7 Camera with Extendable Side Plate 2258,69.0,2020-07-29 00:00:00
Kipon Olympus OM Mount Lens to Nikon Z Mount Camera Adapter #KP-LA-NKZ-OM,77.3,2020-07-29 00:00:00
K&F Concept Lens Mount Adapter for Nikon G AF-S Mount Lens to Nikon Z6 Z7 Camera,37.99,2020-07-29 00:00:00
New Camera Cage Kit for Nikon Z6/Z7 Camera Cage Durable Protective Camera Cage,47.98,2020-07-29 00:00:00
72mm Lens cap Cover fr Nikon 10-20MM 16-80MM 18-200MM 24MM 105MM 24-85MM Z 24-70,9.99,2020-07-29 00:00:00
Kipon Adapter for Alpa Mount Lens to Nikon Z Full Frame Camera,157.0,2020-07-29 00:00:00
Ultra-slim Macro Adapter For M42 Lens To Nikon Z6 Z7 Full Frame Mirrorless,9.09,2020-07-29 00:00:00
easyCover Protective Silicon Skin - Camera Cover for Nikon Z50 Black Camo Yellow,29.95,2020-07-29 00:00:00
SMALLRIG Vlogging Mounting Plate Pro for Nikon Z50 Camera LCN2667,33.22,2020-07-29 00:00:00
Samyang MF 14mm F2.8 ED ASP UMC f/2.8 Ultra Wide Angle Lens for Nikon Z mount,419.9,2020-07-29 00:00:00
GABALE QR L-Bracket Hand Grip Plate Base Camera Quick Release for Nikon Z6  q,29.85,2020-07-29 00:00:00
    Computar TV Zoom Lens M6Z 1212-3S 12.5-75mm F1.2 C Mount,200.0,2020-07-28 00:00:00
Rear Lens Cover + Camera Front Body Cap for Nikon Z7 Z6 replace BF-N1 LF-N_jn,3.15,2020-07-28 00:00:00
EN-EL15 power usb powr cable+EP-5B dummy battery  For Nikon D810 D850 D750 Z6 Z7,41.1,2020-07-28 00:00:00
"Nikon Z6 Z7 Mirrorless Digital Camera Cage Mount Microphone, LED, Monitor, Flash",29.99,2020-07-28 00:00:00
4 Slot Camera Battery+Card Pouch Bag Holder for Nikon Z7 Z6 D850 D810 D750 D610,10.99,2020-07-28 00:00:00
Nikon Z7 Mirrorless Digital Camera +24-70mm Lens and Nikon FTZ Mount Adapter Bun,3058.4,2020-07-28 00:00:00
"Battery Charger for Nikon D7000, D7100, D7200, D7500 Z6 Z7 Camera",7.24,2020-07-28 00:00:00
Battery Charger for Nikon D7000 D7100 D7200 D7500 1 v1 Z6 Z7 Camera,6.99,2020-07-28 00:00:00
Adjustable M42 42mm Lens to Nikon Z Mount Mirrorless Z50  Z6 Z7 Camera Adapter,11.57,2020-07-28 00:00:00
Nikon Z7 45.7 MP Mirrorless Ultra HD Digital Camera 4K Nikkor Z 24-70mm S Lens (,2890.01,2020-07-28 00:00:00
Rear Lens Cover + Camera Front Body Cap for Nikon Z7 Z6 replace BF-N1 LF-N1 a VP,3.35,2020-07-28 00:00:00
Nikon Z7 w/ 24-70 & FTZ!  New with USA warranty!,3196.9,2020-07-28 00:00:00
EN-EL15 power usb powr cable+EP-5B dc coupler For Nikon D810  D800 D750 Z6 Z7,38.1,2020-07-28 00:00:00
Pentax K PK A Bayonet Lens mount adapter to Nikon Z Full frame Mirrorless Camera,27.75,2020-07-28 00:00:00
SmallRig Lens Adapter Support for Nikon FTZ Mount Adapter for Z6 Z7 Cage 2243,24.55,2020-07-28 00:00:00
SmallRig Nikon Z6 Nikon Z7 Camera Cage with Anti-twist m2.5 Threaded Hole - 2243,89.0,2020-07-28 00:00:00
Nikon Z50 LCD Screen Guard Film Protector Scratch Resistance PET JJC LCP-Z50,9.29,2020-07-28 00:00:00
Nikon EN-EL15b Rechargeable Battery D850-D810-D800- D750-D7200-D7300-D610- Z6-Z7,25.99,2020-07-28 00:00:00
FOTOFOX Camera Macro Focusing Tube Helicoid Adapter For M42 Lens to Nikon Z6 Z7,35.88,2020-07-27 00:00:00
"Sigma-Z 300/5.6 Pantel, Nikon F Mount, Very Clean, Excellent +",89.99,2020-07-27 00:00:00
72mm Center Pinch Snap-On Lens Cap with Leash Canon Nikon Sony DSLR Camera,6.5,2020-07-27 00:00:00
Neewer Z Flex Tilt Head Tripod Ball Head Camera Bracket for Canon Nikon Sony,29.99,2020-07-27 00:00:00
Nikon NIKKOR Z 14-30mm f/4 S Camera Lens - Black,1305.0,2020-07-27 00:00:00
"ZUMA PC Socket Cover Cap for Nikon, Canon, Pentax, Olympus DSLR SLR Camera",3.99,2020-07-27 00:00:00
LM to NZ M Close Focus for Leica M ZM to Nikon Z7 Z6 Camera Adapter With Macro,48.88,2020-07-27 00:00:00
Nikon NIKKOR Z 35mm f/1.8 S Lens for Z Series Mirrorless Cameras #20081,846.95,2020-07-27 00:00:00
Nikon En-El25 Battery Z50 Case Cover,99.54,2020-07-27 00:00:00
Nikon Z7 Mirrorless Digital Camera & FTZ F-mount Lens Adapter Accessory Bundle,2849.0,2020-07-27 00:00:00
Nikon Z50 Mirrorless Camera 4K DX-Format 16-50mm + 50-250mm VR 2 Lens Kit Bundle,1229.0,2020-07-27 00:00:00
"Exakta /Auto Topcon Lens to Nikon Z Mount Z50 Z6 Z7 Camera Adapter ""US Seller""",13.34,2020-07-27 00:00:00
NEW! Nikon Z6 Mirrorless Digital Camera w/ FTZ Mount Adapter *Authorized Dealer*,1846.9,2020-07-27 00:00:00
Adapter For Contax G lens to Nikon Z mount Z6 Z7 mirrorless Camera CYG-NZ,35.4,2020-07-27 00:00:00
55 MM Center Pinch Snap on Front cap for all Nikon NEW. O1Z7 V1F2,2.56,2020-07-27 00:00:00
Nikon NIKKOR Z 14-30mm f/4 S Lens - EXC & USA Model,1052.95,2020-07-27 00:00:00
Nikon AN-6W Wide Nylon Neck Strap for Camera Neckstrap,29.0,2020-07-27 00:00:00
Nikon Z7 with FTZ mount and 35mm 1.8 lens and CFexpress 128GB card,2431.85,2020-07-27 00:00:00
"T Mount T2 Ring Lens to Nikon Z-Mount Z6 Z7 Mirrorless Camera Adapter ""US Seller",12.6,2020-07-27 00:00:00
Nikon MC-XQ64G XQD Memory Card 64GB for Z7 Z6 D850 D500,149.0,2020-07-27 00:00:00
JJC Bayonet Petal Hood  for Nikon NIKKOR Z DX 50-250mm 4.5-6.3 VR Lens as HB-90A,13.99,2020-07-27 00:00:00
T2 (M42x0.75) female thread to Nikon Z camera mount  adapter,36.5,2020-07-27 00:00:00
New LCD Display Screen for Olympus U1060 U7000 U7020 E-P2 Nikon D3000 Kodak Z980,14.99,2020-07-27 00:00:00
Nikon Z6 FX Mirrorless Camera & NIKKOR Z 24-70mm f/4 S Lens + FTZ Adapter Bundle,2649.0,2020-07-26 00:00:00
Nikon FTZ Lens Adapter Z6 Z7 Z50,169.0,2020-07-26 00:00:00
Kipon NG-NZ Lens Adapter for Nikon AI G Lens to Nikon Z Full Frame Z6 Z7 Camera,85.0,2020-07-26 00:00:00
6PCS Lens Cap Leash Holder Keeper Canon Nikon Sony Pentax Fuji DSLR Camera,6.95,2020-07-26 00:00:00
Cheecar 35mm f1.2 Scene Portrait Manual Fixed-Focus Lens for Mirrorless Camera,116.69,2020-07-26 00:00:00
Rear Lens Cover + Camera Front Body Cap for Nikon Z7 Z6 re*K0,3.11,2020-07-26 00:00:00
Carl Zeiss Planar T* 85mm f/1.4 ZF For Nikon[Very Good] from Japan 06-Z45,599.0,2020-07-26 00:00:00
LCD Dual Channel Charger For Nikon D850 D810 D800 D750 Z6 Z7 MH-25 EL15b EL15,33.7,2020-07-26 00:00:00
VERY SHARP RUSSIAN USSR EXPORT INDUSTAR-61 L/Z LENS f2.8/50 M42 mount (ITEM №2),65.99,2020-07-26 00:00:00
VERY SHARP RUSSIAN USSR EXPORT NON-MC INDUSTAR-61 L/Z LENS f2.8/50 M42 (ITEM №1),65.99,2020-07-26 00:00:00
62mm/67mm Lens Cap Cover For Canon Nikon Pentax Use L0Z0 Sigma DSLR Tamron X6V2,2.24,2020-07-26 00:00:00
"Adjustable Leica M39 39mm Lens to Nikon Z Mount Z50 Z6 Z7 Adapter ""US Seller""",10.95,2020-07-25 00:00:00
Zhongyi Mitakon Speedmaster 50mm f/0.95 III Lens for Nikon Z6 Z7 mount camera,699.0,2020-07-25 00:00:00
Nikon AN-4B Narrow Nylon Neck Strap for Camera Neckstrap,27.0,2020-07-25 00:00:00
VULCAN Glass Screen Protector - Nikon Z6 / Z7 LCD Tough Anti Scratch Cover (UK),31.05,2020-07-25 00:00:00
Nikon Z7 body US Version (MINT),2299.0,2020-07-25 00:00:00
FOTOFOX adapter for Leica M39 screw mount lens to Nikon Z Z6 Z7 camera M39-NIK Z,25.68,2020-07-25 00:00:00
Nikon Z6 Mirrorless Camera with NIKKOR Z 24-70mm - PLUS MORE ***BUNDLE***,2418.95,2020-07-25 00:00:00
Nikon Z6 Mirrorless Digital Camera Body,1599.0,2020-07-25 00:00:00
58mm Macro Reverse Lens Adapter Ring For Nikon camera F Ai-s AF-S Close-up D850,11.95,2020-07-25 00:00:00
Ultra Slim Macro M42 Screw Lens To Nikon Z-Mount Camera Adapter Z50 Z6 Z7,7.29,2020-07-25 00:00:00
NIKON AF-S NIKKOR ED 28-70mm f/2.8 D SWM Light Grey [Excellent] 06-Z25,719.0,2020-07-25 00:00:00
GABALE QR L Plate Bracket Camera Grip Camera Holder for Nikon Z7 Z6 LB-Z7 ,43.9,2020-07-24 00:00:00
DSLR Compact Backpack Camera Bag For Nikon D7500 D810 Df D850 D3500 D500 Z7 Z6,48.49,2020-07-24 00:00:00
"JJC Metal Hood, MRC UV Filter Cap for Nikon NIKKOR Z DX 16-50mm f3.5-6.3 VR Lens",14.95,2020-07-24 00:00:00
"Adapter for Canon FD Lens to Nikon Z NZ Z50 Z6 Z7 Mirrorless Camera ""US Seller""",12.7,2020-07-24 00:00:00
62mm Reversible Flower Lens Hood 105mm Tamron 18-200mm Nikon Z6 Z7 Z50 50mm 35mm,9.99,2020-07-24 00:00:00
Viltrox 20mm F1.8 Full Frame Wide Angle Manual Focus Lens for Nikon Z6 Z7 Camera,399.0,2020-07-24 00:00:00
BRAND New wifi remote control ML-l7 for Nikon P1000 B600 Z50 camera,38.95,2020-07-24 00:00:00
4 PCS Hot Shoe Cover for Nikon Z7 Z6 Z50 D850 D810 D800 D750 D700 D7200 D3400,6.49,2020-07-24 00:00:00
SmallRig Form-Fitted Cage for Nikon Z6/ Nikon Z7 Camera with Nato Rail 2243,89.0,2020-07-24 00:00:00
Kipon Adapter for Konica AR Mount Lens to Nikon Z Full Frame Camera,88.0,2020-07-24 00:00:00
SmallRig Lens Adapter Support 2244 for Nikon FTZ Mount Adapter for Z6 Z7 Cage,23.9,2020-07-24 00:00:00
SmallRig L-Bracket for Nikon Z6 and Nikon Z7 Camera 2258,69.0,2020-07-24 00:00:00
EN-EL15B ENEL15b Battery For Nikon Camera D7100 D7000 D800 D810 D750 Z7 Z6 V1,26.8,2020-07-24 00:00:00
 FOTOFOX adapter for Leica LM Zeiss M VM mount lens to Nikon Z mount Z6 Z7camera,25.5,2020-07-24 00:00:00
 FOTOFOX adapter for CONTAX YASHICA CY mount lens to Nikon Z mount Z6 Z7 camera,26.0,2020-07-24 00:00:00
Z Type Tilt Tripod Head Flex Folding For Canon Nikon DSLR Camera GoproTCB xbW EW,10.72,2020-07-24 00:00:00
Nikon NIKKOR Z 35mm F/1.8 S Lens and NIKKOR Z 50mm F 1.8 S,1035.0,2020-07-24 00:00:00
SHOTEN adapter II for Leica LM Zeiss M VM mount lens to Nikon Z Z6 Z7 z50 camera,44.8,2020-07-24 00:00:00
Stable Z Flex Tilt Head Tripod Ball Head Camera Bracket for Canon Nikon Sony,39.79,2020-07-24 00:00:00
For Nikon Z6 Top Cover Shell Case + Flash Dial Mode Button Flex Cable Original,279.99,2020-07-24 00:00:00
2.5mm-N3 Shutter Release Cable f Nikon Z6 Z7 D7500 D750 D780 D5600 D5500 D7200,9.44,2020-07-24 00:00:00
"Hot Shoe Cold Foot & 1/4"" Screw Stand Bracket For Canon Re Light Z1N8 Nikon N4T4",1.48,2020-07-24 00:00:00
AI-NIK Z Ring Adapter for Nikon F Mount Lens to Nikon Z7 Z6 Cameras Replace FTZ,25.88,2020-07-24 00:00:00
Micro Four Thirds M4/3 Lens To Nikon Z-Mount Mirrorless Camera Adapter Z50 Z6 Z7,16.19,2020-07-24 00:00:00
Nikon Nikkor S Rangefinder Lens To Nikon Z-Mount Camera Adapter Z50 Z6 Z7,18.79,2020-07-24 00:00:00
Nikon NIKKOR Z 24-70mm f/2.8 S Lens - Black - USA - Mint Condition,1814.9,2020-07-23 00:00:00
T-Mount T-2 Lens To Nikon Z-Mount Mirrorless Camera Adapter Z50 Z6 Z7,14.79,2020-07-23 00:00:00
Leica M Rangefinder Lens To Nikon Z-Mount Mirrorless Camera Adapter Z50 Z6 Z7,18.79,2020-07-23 00:00:00
Kastar Battery AC Rapid Charger for Nikon EN-EL15e & Nikon Z6 Nikon Z7Q3 Camera,30.99,2020-07-23 00:00:00
Manual Lens Mount Adapter for Sony E Mount Lens to Nikon Z Camera Z6 Z7 Z50,28.48,2020-07-23 00:00:00
E-Z Lens Mount Adapter Ring for Sony E NEX Lenses to Nikon Z Z7 Z6 Cameras NEX-Z,16.69,2020-07-23 00:00:00
"JJC Leather Hand Strap Grip Arca Swiss QR Plate for Nikon Z50 Z6 Z7 ""US Shiper""",21.59,2020-07-23 00:00:00
Hoodman HoodEYE Eyecup for Nikon Z6 and Z7 Models,19.99,2020-07-23 00:00:00
"Leica M39 39mm Lens to Nikon Z Z50 Z6 Z7 Mirrorless Camera Adapter ""US Seller""",10.95,2020-07-23 00:00:00
Rokinon 85mm F1.4 MF Lens for Nikon Z Cameras - Z85-N,269.99,2020-07-23 00:00:00
NIKKOR Z 85mm F/1.8 S,878.76,2020-07-23 00:00:00
Battery Grip Holder Pack for Nikon D7500 Work with EN-EL15a EN-EL15 Camera Z4U5,34.91,2020-07-23 00:00:00
"Nikon Neck Strap 1.5"" Black Yellow Stitched White ""Nikon Z"" (AN-DC19) - *EX*",10.56,2020-07-23 00:00:00
Silicone Armor Skin Case Camera Body Cover for Nikon Z6 Z7 Mirrorless Camera,10.67,2020-07-23 00:00:00
4PCS Camera Strap Ring Adapter+Cap for Nikon Z7 Z6/1 J5 J4 J3 V3 V2 V1/COOLPIX A,7.99,2020-07-23 00:00:00
