title,price,datePixco adapter for Fujifilm X FX lens To Nikon Z mount Z6 Z7 mirrorless camera,20.99,2020-07-04 00:00:00
Andoer EH-5 plus EP-5B AC Power Adapter for Nikon D7100 D7200 D810 Cameras G1Z5,31.34,2020-07-03 00:00:00
Canon FD FL Lens mount adapter to Nikon Z 6 7 Full frame Mirrorless Camera,27.75,2020-07-03 00:00:00
Nikon FTZ Mount Lens Adapter Z Nikkor to F Mount In Box With Warranty Never Used,135.0,2020-07-03 00:00:00
Silicon Rubber Case Cover Body Skin Protector for Nikon Z7 Z6 Mirrorless Camera,13.99,2020-07-03 00:00:00
easyCover Armor Protective Silicone Skin for Nikon Z50 (Camouflage),29.95,2020-07-03 00:00:00
Nikon Z6 FX-Format Mirrorless Camera Body with Mount Adapter FTZ,1770.27,2020-07-03 00:00:00
easyCover Nikon Z6 / Z7 Silicone Camera Protective Case YELLOW  EA-ECNDZ7Y,29.95,2020-07-03 00:00:00
Nikon EP-5B Power Connector D7500 D7200 D850 D810 D800 D780 D750 D610 D500 Z6 Z7,49.0,2020-07-03 00:00:00
Silicone Case Armor Skin Body Cover Protector Anti-skid Texture for Nikon Z6 Z7,14.78,2020-07-03 00:00:00
Nikon F-mount Lens Rear Cover Lid Cap Lens Lid Rear Cap z6 z7,15.85,2020-07-03 00:00:00
Rear Lens Cover + Camera Front Body Cap for Nikon Z7 Z6 replace BF-N1 LF-N_me,4.05,2020-07-03 00:00:00
New Nikon Z Rear Cap for Nikon Z system Mirrorless Cameras Z Mount Z6 Z7 ,5.69,2020-07-03 00:00:00
JJC KS-Z50SK Anti-Scratch Protective Skin Film for Nikon Z50 + 16-50mm lens,16.99,2020-07-03 00:00:00
 EN-EL15B ENEL15b Battery For Nikon D7100 D7000 D800 D810 D750 Z7 Z6 V1,10.25,2020-07-02 00:00:00
Nikon NIKKOR Z 35mm F/1.8 S Lens in original box (US model) ,730.0,2020-07-02 00:00:00
Nikon NIKKOR Z 24-70mm f/2.8 S Lens - USA - Mint,1799.0,2020-07-02 00:00:00
T2-N1 T2 Mount Lens Adapter for Nikon 1-Series Camera V1 J1 Mirrorless Cameras,10.99,2020-07-02 00:00:00
T2-N1 T2 Mount Lens Adapter for Nikon 1-Series Camera V1 J1 Mirrorless Cameras,10.99,2020-07-02 00:00:00
Self-adhesive Glass + Film Screen Protector for Nikon Z7 Z6 Main & Info/Top LCD,4.43,2020-07-02 00:00:00
Nikon NIKKOR Z 24-70mm f/2.8 S Lens 20089,1984.97,2020-07-02 00:00:00
QR L-Plate Bracket Vertical Hand Grip Holder For Nikon Z6 Z7 Mirrorless Camera,18.98,2020-07-02 00:00:00
M42 Lens to AI For Nikon F-mount adapter ring D70s D7000 D100 D5100 L0Z0 F7H1,1.8,2020-07-02 00:00:00
Nikon DK-29 Eyepiece for Z7 / Z6,30.8,2020-07-02 00:00:00
New Nikon nikkor Z DX 50-250mm f/4.5-6.3 VR len for NIKON Z50 camera,314.99,2020-07-01 00:00:00
KMZ Start Lens Onto Nikon Z Z6 Z7 mount Adapter with close focus adjustable adap,42.75,2020-07-01 00:00:00
12Pcs Flash Speedlite Color Gel Filters for Canon Nikon Sony Yongnuo DSLR Cam Z2,4.34,2020-07-01 00:00:00
FX-Z Lens Mount Adapter Ring for Fujifilm X Lenses to Nikon Z Z7 Z6 Cameras,21.1,2020-07-01 00:00:00
"Round Camera Eyecup Eyepiece for ALL Nikon DSLR, FM-10 DSLR Rubber Glass",10.95,2020-07-01 00:00:00
Kastar Battery for Nikon EN-EL15 Battery 899352 D800 D850 D7200 D7500 Z6 Z7 1V1,10.99,2020-07-01 00:00:00
Mamiya 645 Lens mount adapter Ring to Nikon Z 6 7 Full frame Mirrorless Camera,49.75,2020-07-01 00:00:00
Nikon D3400 Front Cover Unit Black. NEW OEM GENUINE/ORIGINAL. 11Z5R,50.99,2020-07-01 00:00:00
Nikon Z6 & FTZ Adapter Bundle shutter count 6094,1678.99,2020-07-01 00:00:00
K&F Concept Lens Mount Adapter for Pentax PK Mount Lens to Nikon Z Mount  Camera,29.99,2020-07-01 00:00:00
7artisans 35mm F1.4 Full Frame Large Aperture Manual Wide Lens for Nikon Z mount,199.0,2020-07-01 00:00:00
VERY SHARP RUSSIAN USSR EXPORT NON-MC INDUSTAR-61 L/Z LENS f2.8/50 M42 (ITEM №1),55.99,2020-07-01 00:00:00
Nikon NIKKOR Z 24-70 24-70mm f/2.8 f2.8 S Mirrorless Lens * Beautiful! (USA),1859.0,2020-07-01 00:00:00
Nikon Z50 Mirrorless Digital Camera with 16-50mm & 50-250mm Lenses + FTZ Adapter,1243.9,2020-07-01 00:00:00
Nikon NIKKOR Z 85mm F/1.8 S Lens *NEW* *IN STOCK*,796.95,2020-07-01 00:00:00
Nikon Dot site DF-M1 Nikon SLR Z For P1000 Camera Finder accessory from JAPAN,181.98,2020-07-01 00:00:00
KIPON LEICA / M-NIK Z Mount Adapter For Leica M Lens Nikon Z Body Japan,105.14,2020-07-01 00:00:00
YEENON LM-NZ Leica M  VM  to Nikon Z camera  Close Focus adapter Silver（macro）,167.0,2020-07-01 00:00:00
DSTE 2 x EN-EL15 Battery for Nikon D7200 D750 D810A D7500 Z6 Z7 D780 MB-D11,33.99,2020-07-01 00:00:00
Fotodiox Lens Adapter for C-Mount lens to Nikon F-Mount Cameras [C-NikF],7.95,2020-07-01 00:00:00
"New Nikon EN-EL15B Battery for Nikon D850 D7500 D750 D810 Z6, Z7 Mirrorless D750",25.97,2020-06-30 00:00:00
Genuine OEM MH-25 Battery Charger For Nikon D750 D800 D810 D850 D7500 Z6 Z7,25.64,2020-06-30 00:00:00
"Nikon Z6 Z7 Neck Strap 1.5"" Black Yellow Stitched White ""Nikon Z"" - AN-DC19",14.99,2020-06-30 00:00:00
Nikon NIKKOR Z 14-30mm f/4 S Lens - EXC & USA Model,1012.95,2020-06-30 00:00:00
2x LCD Screen Protector w/ Top LCD Film for Nikon Z7 Z6 Mirrorless Camera,5.99,2020-06-30 00:00:00
Nikon Z6 Mirrorless Camera Minimal Use Two battery 32GXQD and XQR adapter,1458.25,2020-06-30 00:00:00
GABALE Leica M ZM VM to Nikon Z Camera Z6 Z7 Close Focus Lens Adapter Cap MACRO,79.0,2020-06-30 00:00:00
Fotodiox Pro TLT ROKR - Tilt/Shift Lens Mount Adapter for Pentax 6x7 to Nikon Z,129.0,2020-06-30 00:00:00
FOTOFOX P6-NZ For Kiev 60 Pentacon 6 P6 Mount Lens to Nikon Z mount Z6 Z7 camera,28.6,2020-06-30 00:00:00
Pixco Lens Adapter For T2 Lens to Nikon Z Mount Camera Full Frame Mirrorless,16.17,2020-06-29 00:00:00
Nikon Z6 FX-Format Mirrorless Camera Body w/NIKKOR Z 24-70mm f/4 S,2056.55,2020-06-29 00:00:00
58mm Macro Reverse Lens Adapter Ring For Nikon Z Z6 Z7 Full Frame Close-up,11.95,2020-06-29 00:00:00
52mm Macro Lens Reverse Adapter Ring Nikon Z mount Z6 Z7 Z50 Mirrorless Camera,6.2,2020-06-29 00:00:00
Nikon NIKKOR Z 24-70mm f2.8 S Mirrorless Lens Mint condition! PRIORITY SHIPPING!,1798.0,2020-06-29 00:00:00
SmallRig Cage for Nikon Z6/ Nikon Z7 Camera 2243,68.85,2020-06-29 00:00:00
"Leica M LM Lens to Nikon Z50 Z6 Z7 Mirrorless Camera Adapter ""US Seller""",12.95,2020-06-29 00:00:00
NEW Nikon Z7 Mirrorless Digital Camera with 24-70mm Lens,2969.0,2020-06-29 00:00:00
4X Khaos For Nikon Z6 / Z7 Digital SLR Camera Tempered Glass Screen Protector,11.75,2020-06-29 00:00:00
7artisans 35mm F1.2 Large aperture Lens for Sony E Fuji X Nikon Z M4/3 Canon EOS,139.0,2020-06-29 00:00:00
"JJC GSP-Z7 0.3mm Optical Temper Glass LCD Screen Cover Protector for Nikon Z7,Z6",7.8,2020-06-29 00:00:00
LCD Display Screen Monitor Repair Parts For  EX-Z60 Z70 Z6 Z7 Wide Cable,19.99,2020-06-29 00:00:00
New Rear Lens Cap For Nikon Nikkor SLR DSLR Lens -S AI Z6G1 Mount CAP-AIx X6E6,1.24,2020-06-29 00:00:00
Sony G Series 240GB XQD Memory Card QDG240F For Nikon Z6 Z7 D850 D4S D5 D6 256GB,300.0,2020-06-29 00:00:00
"Altix V, N, NB Zeiss Lens to Nikon Z Z6 Z7 Camera Adapter with backfocus and clo",84.75,2020-06-29 00:00:00
Rear Lens Cover + Camera Front Body Cap for Nikon Z7 Z6 replace BF-N1 LF-N _ji,4.21,2020-06-29 00:00:00
 F&V HDV-Z96 96 LED Light Kit  for canon nikon HD Video Light ,79.9,2020-06-29 00:00:00
Wireless Timer Shutter Release Remote Control DC2 Nikon Z6 Z7 D750 D7100 D5500,37.94,2020-06-29 00:00:00
YEENON Leica LM  VM  lens to Nikon Z camera STANDARD adapter Black,81.0,2020-06-28 00:00:00
Vertical L Bracket Plate for Nikon Z7 Z6 Camera Arca-Swiss Standard Mounting,19.98,2020-06-28 00:00:00
JJC LCP-Z7 LCD Film Screen Protector cover For Nikon Z6 Z7 Z 7 6 Camera 2 Pack,8.99,2020-06-28 00:00:00
Nikon Nikkor Z 24-70mm f4 S Lens                                            #035,524.0,2020-06-28 00:00:00
Rear Lens Cover + Camera Front Body Cap for Nikon Z7 Z6 reDZH,3.19,2020-06-28 00:00:00
Memory Card Case Storage Holder fit 6 XQD Cards for Nikon Z7 Z6 D850 D500 D5 D4S,9.99,2020-06-28 00:00:00
Nikon Z7 FX 45.7MP Mirrorless Camera Kit 24-70mm F/4 Lens FTZ Adapter USA,2595.0,2020-06-28 00:00:00
7artisans 60mm F2.8 Macro Lens  for The Canon EOSM EOSR E Fuji M43 Nikon Z Mount,178.0,2020-06-28 00:00:00
2-Pack For Nikon Z6 / Z7 Digital SLR Camera Tempered Glass Screen Protector,6.98,2020-06-28 00:00:00
LARMOR Optical Glass LCD Screen Protector for Nikon D4 D4S D5 D6 DF Z6 Z7 Camera,18.8,2020-06-28 00:00:00
Nikon Z 16-50mm lens with matching lens hood ,190.0,2020-06-28 00:00:00
Nikon NIKKOR Z DX 16-50mm f/3.5-6.3 VR Wide Angle Lens,139.98,2020-06-27 00:00:00
Nikon Z7 45.7MP Mirrorless Camera with 24-70 Nikkor S + Nikkor S 14-30 lenses,3223.15,2020-06-27 00:00:00
Genuine OEM MH-25a Battery Charger For Nikon D750 D800 D810 D850 D7500 Z6 Z7,24.99,2020-06-27 00:00:00
UURig Vlog Selfie Flip Screen Bracket for Sony A6000 A6500 A7M3 A7R3 Nikon Z6 Z7,17.89,2020-06-27 00:00:00
Lens Rear Cap for Nikon Z Mount NIK Z Mirrorless Camera Lens Black,4.88,2020-06-27 00:00:00
Professional Stabilizing Handle Grip Bracket For Nikon Z7 Z6 Z-7 Z-6,19.93,2020-06-27 00:00:00
Nikon NIKKOR Z DX 50-250mm f/4.5-6.3 VR Telephoto Lens,239.99,2020-06-27 00:00:00
Meike MK-Z-AF1 11+18mm Macro Extension Tube Adapter Ring for Nikon Z6 Z7 Camera,47.98,2020-06-27 00:00:00
T Mount T2 Ring Lens to Nikon Z-Mount Z50 Z6 Z7 Mirrorless Camera Adapter,12.65,2020-06-27 00:00:00
Kastar EN-EL4 Battery&LCD Charger for Nikon D2Z D2H D2Hs D2X D2Xs D3 D3S D3X F6 ,69.98,2020-06-27 00:00:00
Nikon FTZ Mount Adapter BNIB *US Seller* Fast Shipping*,160.0,2020-06-27 00:00:00
Ring Adapter for Leica LM Zeiss M VM Lens to Nikon Z6 Z7 Cameras Replace FTZ,21.88,2020-06-27 00:00:00
SopiGuard Tempered Glass 9H Japan Asahi Screen Protector for Nikon Z7 Z6,13.99,2020-06-27 00:00:00
Z Type Tilt Tripod Head Flex Folding For Canon Nikon DSLR Camera GoproTCB LTKJ,9.37,2020-06-27 00:00:00
Kipon Adapter for Leica M39 Mount Lens to Nikon Z Full Frame Mirrorless Camera,34.8,2020-06-27 00:00:00
"Techart PRO Autofocus Adapter, Sony E-Mount to Nikon Z-Mount Autofocus Adapter",180.0,2020-06-26 00:00:00
JJC GSP-Z7 2.5D Tempered Optical Glass LCD Protector for Nikon Z6 Z7,7.98,2020-06-26 00:00:00
Nikon Z 24-70mm F/2.8 S Lens w/FREE Hoya UV Filter *NEW* ,1996.95,2020-06-26 00:00:00
Nikon Z7 45.7MP Mirrorless Camera with 24-70 Nikkor S + Nikkor S 14-30 lenses,3223.15,2020-06-26 00:00:00
Macro Adapter Ultra-slim For M42 Lens To Nikon Z Full Frame Mirrorless Z6 Z7,7.8,2020-06-26 00:00:00
Nikon Z6 Mirrorless Digital Camera & FTZ F-mount Lens Adapter Accessory Bundle,1849.0,2020-06-26 00:00:00
SmallRig Z6 Z7 L Bracket for Nikon Z6 Z7 Camera L Plate with Allen Wrench - 2258,69.0,2020-06-25 00:00:00
NIKKOR Z 24-70mm f/2.8 S Zoom Lens - EXC! *USA Model*,1822.95,2020-06-25 00:00:00
Nikon Z6 24.5MP Mirrorless Camera (Body Only) Excellent Condition-Low Shutter,1419.98,2020-06-25 00:00:00
Nikon Nikkor Z 24-200mm f/4-6.3 VR Lens,896.95,2020-06-25 00:00:00
EasyCover Silicone Skin Soft Case Cover Protector Nikon Z6 Z7 (UK Stock) BNIB,70.13,2020-06-25 00:00:00
7artisans 35mm F1.2 Large Aperture Lens for Z Mount Nikon Z6 Z7 Z50 Mirrorless,137.99,2020-06-25 00:00:00
Nikkor Z 16-50mm,270.73,2020-06-25 00:00:00
2Pack Z 50 Screen Protector Glass for Nikon Z 50 DX-Format Mirrorless Camera,7.99,2020-06-25 00:00:00
Z Type Tilt Tripod Head Flex Folding For Canon Nikon DSLR Camera GoproTCB GYJAU,10.69,2020-06-24 00:00:00
Nikon NIKKOR Z 24-70mm f/4 S Lens,569.95,2020-06-24 00:00:00
Nikon Z50 Camera with 16-50mm and 50-250mm Lenses + EXTRAS - Perfect Condition!,1018.15,2020-06-24 00:00:00
Kipon Focal Reducer Adapter Speedbooster for Mamiya 645 Lens to Nikon Z Camera,755.0,2020-06-24 00:00:00
"Nikon Z7 45.7MP Mirrorless Camera Body, 18,5XX Shutter, RRS Arca Plate, 64GB XQD",2099.0,2020-06-24 00:00:00
Hi Def 3-Pcs UV Polarizer & FLD Filter Kit For Nikon Z7 Z6 Z-7 Z-6,16.95,2020-06-24 00:00:00
Nikon NIKKOR Z 24-70mm f/4 S Lens + Deluxe Accessory Kit,579.95,2020-06-24 00:00:00
"Genuine original EN-EL15B Battery for D850 D7500 D750 D810 Z6, Z7 Mirrorles D750",34.06,2020-06-24 00:00:00
Z699C Light Weight Carbon Fiber Tripod Monopod&Ball Head Stand For Nikon Camera,154.99,2020-06-24 00:00:00
Z Type Tilt Tripod Head Flex Folding For Canon Nikon DSLR Camera GoproTCB  TBO,10.24,2020-06-23 00:00:00
Z Type Tilt Tripod Head Flex Folding For Canon Nikon DSLR Camera Go  JB,12.8,2020-06-23 00:00:00
Nikon Charging Kit for D7500 D7200 D850 D810 D800 D780 D750 D610 D600 D500 Z6 Z7,205.0,2020-06-23 00:00:00
SmallRig Mounting Plate for Nikon Z50 Vlogging  - en aluminium - LCN2525,28.9,2020-06-23 00:00:00
Nikon Z6 Z7 FX-Format Mirrorless Digital Camera Video Cage Film Photography Kit,29.99,2020-06-23 00:00:00
Quick Release L Tripod Plate Vertical Bracket for Nikon Z7 Z6 Camera,18.49,2020-06-23 00:00:00
GABALE QR L Plate Bracket Camera Grip Camera Holder for Nikon Z7 Z6 LB-Z7,43.9,2020-06-23 00:00:00
Z Type Tilt Tripod Head Flex Folding For Canon Nikon DSLR Camera GoproTCB xbWP4,10.02,2020-06-23 00:00:00
(Open Box) Nikon NIKKOR Z 24-70mm F/4 S Z-Mount Mirrorless Lens,460.0,2020-06-23 00:00:00
Rokinon 14mm F2.8 Ultra Wide Angle Weather Sealed Lens for Nikon Z Cameras,349.0,2020-06-23 00:00:00
Lens Adapter Mount Ring for Pentacon 6 Kiev 60 Lenses to Nikon Z Z6 Z7 Camera,34.49,2020-06-23 00:00:00
New EN-EL15B ENEL15b Battery For Nikon D7100 D7000 D800 D810 D750 Z7 Z6 V1,19.57,2020-06-23 00:00:00
Futura-S Optical head onto Sony E  mount adapter with fast focus helical ,78.75,2020-06-23 00:00:00
Z Flex Tilt Head Flex Folding Z Pan For Canon Nikon DSLR Camera Aluminum Alloy,15.88,2020-06-22 00:00:00
SmallRig Vlogging Mounting Plate Pro for Nikon Z50 Camera LCN2667 2667,34.9,2020-06-22 00:00:00
Nikon AN-6Y Wide Nylon Neck Strap for Camera Neckstrap,32.0,2020-06-22 00:00:00
Nikon NIKKOR Z 35mm F/1.8 S Mirrorless Lens - MINT,679.99,2020-06-22 00:00:00
easyCover Nikon Z6 / Z7 EA-ECNDZ7C Camera Protective Case Camouflage Silicone ,29.95,2020-06-22 00:00:00
Z Type Tilt Tripod Head Flex Folding For Canon Nikon DSLR Camera GoproTCB x w5,10.18,2020-06-22 00:00:00
"NEW USA NIKON Z6 24.5MP CAMERA w/NIKKOR Z 24-70mm F4 S, COMPLETE, BRAND NEW",1827.95,2020-06-22 00:00:00
Novoflex Lens Adapter (NIKZ/LEM) Leica-M Lenses to Nikon-Z Mount Cameras,229.99,2020-06-22 00:00:00
Nikon Z6 24.5MP Mirrorless Camera (Body Only) - LOW USE ** USA Model,1469.0,2020-06-21 00:00:00
LikeNew Nikon NIKKOR Z 35mm F/1.8 S Lens in original Box,683.7,2020-06-21 00:00:00
TP original Camera Half Case For Nikon Z7 / Z6,58.5,2020-06-21 00:00:00
77MM 16:9 Wide Angle Lens Hood fits Sony PXW-Z280 Canon NIKON 70-200mm 80-400mm,36.99,2020-06-21 00:00:00
Kipon MD-NZ Lens Adapter for Minolta MD Lens to Nikon Z Full Frame Z6 Z7 Camera,68.8,2020-06-21 00:00:00
8P USB Cable Charging Cord Data Line Wire for Nikon Z7 D850 D750 D810 D5300,6.26,2020-06-21 00:00:00
Z Type Tilt Tripod Head Flex Folding For Canon Nikon DSLR Camera GoproTCB xb  KL,9.0,2020-06-21 00:00:00
Rear Lens Cover + Camera Front Body Cap for Nikon Z7 Z6 replace BF-N1 LF-N tbB0U,3.95,2020-06-21 00:00:00
LikeNew Nikon Nikkor Z 24-70mm f4 S Lens in white box,447.7,2020-06-21 00:00:00
PU Leather Half Case Cover - Coffee Brown for Nikon Z6 Z7,11.25,2020-06-21 00:00:00
Nikon Camera Neck official Strap Z6 Z7 D850 D750 Camera Signature version ,19.23,2020-06-20 00:00:00
Nikkor Z 24mm f/1.8 S,908.25,2020-06-20 00:00:00
Viltrox EF-Z Lens Mount Adapter Ring Auto Focus For Canon EF/EF-S to Nikon Z6/Z7,168.0,2020-06-20 00:00:00
SHOTEN Mount Adapter Leica M mount lens to Nikon Z mount Conversion Black W/T,140.06,2020-06-20 00:00:00
Nikon Z6 Mirrorless Digital Camera with 24-70mm F4 Lens & FTZ Mount Adapter,1925.0,2020-06-20 00:00:00
LikeNew Nikon NIKKOR Z 14-30mm f/4 S Camera Lens,969.0,2020-06-20 00:00:00
Quick Release L Plate Bracket Holder Vertical Hand Grip for Nikon Z6 Z7 Camera,21.58,2020-06-19 00:00:00
LM-NZ/M Close Focus For Leica M VM ZM Lens to Nikon Z6 Z7 Camera Adapter Macro,49.99,2020-06-19 00:00:00
FX-Z Lens Mount Adapter Ring for Fujifilm X Lenses to Nikon Z Z7 Z6 Cameras,17.49,2020-06-19 00:00:00
"Nikon Neck Strap 1.5"" Black Yellow Stitched White ""Nikon Z"" (AN-DC19) EX",10.56,2020-06-19 00:00:00
NEW NIKON FTZ Z MOUNT ADAPTER (BRAND NEW - USA ITEM - NEVER USED),227.55,2020-06-19 00:00:00
Nikon Z 6 24.5MP Mirrorless Digital Camera Body 1595,1399.99,2020-06-19 00:00:00
Nikon Z50 Mirrorless Camera 20.9MP with 16-50mm VR Lens Kit Black Free Shipping,994.0,2020-06-19 00:00:00
NIKON NIKKOR S 24-70mm f4 Z MOUNT AUTO FOCUS LENS,415.0,2020-06-19 00:00:00
CHEAT SHEET Quick Cards Guide NIKON DSLR D5 D4S D4s D3s Df D7500 D5600 Z7 Z6 &+,17.9,2020-06-19 00:00:00
JJC 0.3mm 9H HD Optical Tempered Glass Screen Protector for Nikon Z6 Z7 Camera,8.99,2020-06-18 00:00:00
Aluminum Camera L-Bracket Holder for Nikon Z6 Z7 with Extendable Side Plate,27.3,2020-06-18 00:00:00
Genuine Real Leather Camera Half case Bag Grip with strap for Nikon Z7 Z6,16.11,2020-06-18 00:00:00
Leather Camera Half case Bag Grip with strap for Nikon Z7 Z6,11.61,2020-06-18 00:00:00
Adapter For Exakta EXA lens to Nikon Z mount Z6 Z7 mirrorless Camera,21.24,2020-06-18 00:00:00
Adapter For Canon EOS EF lens to Nikon Z mount Z6 Z7 mirrorless Camera,21.15,2020-06-18 00:00:00
Camera Soft Silicone Protector Skin Case Bag Cover for Nikon Z7 Z6,8.28,2020-06-18 00:00:00
Adapter For Leica M LM Lens to Nikon Z mount Z6 Z7 mirrorless Camera LM-NZ,18.72,2020-06-18 00:00:00
Protective Cage for Nikon Z6/ Nikon Z7 Camera for Nikon Z6/Z7 Camera Cage Cover,49.98,2020-06-18 00:00:00
Modify Lens Adapter For Macro Ultra-slim (1mm) M42 Lens To Nikon Z6 Z7 Camera,7.74,2020-06-18 00:00:00
High Quality Leather Camera Protector Bag case Grip strap for NIKON Z7 Z6,28.71,2020-06-18 00:00:00
Leather Camera Protector Half case Bag Grip for Nikon Z50,10.26,2020-06-18 00:00:00
Black Plastic Lens Rear Cap For Nikon Z Z6 Z7,4.6,2020-06-18 00:00:00
Genuine Nikon UC-E24 Cable Part# 4216  2ft .61m Z6 Z7 D6 D780 (#6250N),14.95,2020-06-18 00:00:00
"(3 Packs) JJC Camera Body Cap for Nikon Z6 Z7, Rear Lens Cap for Nikon Z Lens...",10.99,2020-06-18 00:00:00
Tilta DSLR Cage for NIKON Z6 Z7 Camera rig TA-T02-A-G Kit Handle VS Smallrig,157.0,2020-06-18 00:00:00
Bayonet Lens Hood for Nikon Z50 Dual Lens Kit Nikkor Z DX 16-50mm 50-250mm HB90A,27.95,2020-06-18 00:00:00
Rear Lens Cap/Cover/Protector with installation point Lens Mount For Nikon L0Z7,1.59,2020-06-18 00:00:00
Nikon EP-5B Power Connector D7500 D7200 D850 D810 D800 D780 D750 D610 D500 Z6 Z7,44.99,2020-06-18 00:00:00
Really Right Stuff L-Plate Ultralight for Nikon Z 7 and Z 6 - MINT in Box - RRS,94.95,2020-06-18 00:00:00
Nikon Z50 Mirrorless Digital Camera with 16-50mm Lens (Intl Model),824.47,2020-06-18 00:00:00
Oval Rubber Camera Viewfinder Eyecup Eye Cup Eyepiece for Nikon Z7 Z6 as DK-29,12.99,2020-06-18 00:00:00
Nikon NIKKOR Z 24-70mm F/4 S Lens - Excellent Condition Used + UV Filter + Box,484.9,2020-06-18 00:00:00
Battery/ USB Dual Charger for Nikon EN-EL15 MH-25A Nikon Z6 Z7 Z7Q3 DSLR Camera,31.56,2020-06-18 00:00:00
Nikon NIKKOR Z 85mm F/1.8 S Lens *NEW* *IN STOCK*,796.95,2020-06-17 00:00:00
Replacement Rear cap for Nikon Z full frame Z mount Lenses  Z6 Z7,9.89,2020-06-17 00:00:00
JJC Metal Screw In Hood for Nikon NIKKOR Z DX 16-50mm f/3.5-6.3 VR Lens as HN-40,12.99,2020-06-17 00:00:00
Nikon F Lens to Nikon Z Mount Z50 Z6 Z7 Adapter/ Macro Focusing Helicoid ,34.9,2020-06-17 00:00:00
JJC AutoFocus Calibration Aid for Nikon Z6 Z7 D7500 D850 D810A D810 D800 D800E,33.99,2020-06-17 00:00:00
Nikon NIKKOR Z 14-30mm f/4 S Camera Lens - Black in Exc +++ condition!,879.5,2020-06-17 00:00:00
Nikon NIKKOR Z 50mm f/1.8 S Lens for Z Series Mirrorless Cameras Amazing Conditi,409.59,2020-06-17 00:00:00
JJC 2PCS 0.3mm 9H Optical Tempered Glass Screen Protector for Nikon Z6 Z7 Camera,8.99,2020-06-17 00:00:00
Nikon Z6 Mirrorless Camera with 24-70mm f/4 S Lens and Mount Adapter FTZ,2219.41,2020-06-17 00:00:00
"M42 Lens to Nikon Z Lens Mount Adapter for Nikon Z50, Z5, Z7, Z6 Camera",24.31,2020-06-17 00:00:00
"EN-DK29II Eye Cup, Viewfinder for Nikon Z6, Z7",21.94,2020-06-17 00:00:00
Nikon Z6 Z7 Digital Camera REFERENCE MANUAL,39.95,2020-06-16 00:00:00
Nikon Micro NIKKOR 200mm 1:4 Ai-s  Lens *As Is* #Z016e,146.31,2020-06-16 00:00:00
Quick Release Plate L Bracket Adjustment for Nikon Z6 Z7 Camera,22.97,2020-06-16 00:00:00
1+1 Lens Hood fr Nikon Z50 16-50mm & 50-250mm Dual Lens Kit Replace HN-40 HB-90A,24.99,2020-06-16 00:00:00
"🔴  Nikon FTZ Lens Mount Adapter Adaptor for Z50, Z6 Z7. Brand New.",337.11,2020-06-16 00:00:00
Nikon DW-30 Waist Level View Finder for F5 35mm Film SLR [Excellent] 06-Z68,149.0,2020-06-16 00:00:00
Full-frame mirrorless camera NIKON Z series Z6 Z7  Brochure   FREE SHIPPING  ,14.85,2020-06-16 00:00:00
SmallRig Cable Clamp Lock HDMI Protector for Nikon Z6 Z7 Sony A7III A9 L Bracket,19.9,2020-06-15 00:00:00
"BM Premium 2X EN-EL15B Batteries and Charger for Nikon Z6, Z7, D500 Cameras",32.99,2020-06-15 00:00:00
Leica R L/R LR lens To Nikon Z mount macro focusing helicoid adapter camera Z50,39.58,2020-06-15 00:00:00
Nikon Z6 24.5MP Mirrorless Digital Camera with FTZ adapter,1520.0,2020-06-15 00:00:00
Fotodiox PRO Lens Adapter Leica M Lens to Nikon Z-Mount Camera,69.95,2020-06-15 00:00:00
easyCover Armor Protective Silicone Skin for Nikon Z50 (Black),29.95,2020-06-15 00:00:00
Commlite CM-EF-NZ Lens Mount Adapter Ring for Canon EF/EF-S to Nikon Z6/Z7/Z50,235.0,2020-06-15 00:00:00
"JJC Remote Control Connecting Cable Cord M for Nikon D7500, D750, Z7, Z6 MC-DC2",7.85,2020-06-15 00:00:00
SmallRig Cage for Nikon Z6/ Nikon Z7 Camera with Nato Rail Cold Shoe 2243,91.45,2020-06-15 00:00:00
Second hand Leofoto LPN-Z7 Combo L Bracket Plate for Nikon Z7,28.0,2020-06-15 00:00:00
nikon z6 24-70 ,2100.0,2020-06-14 00:00:00
Sigma Z 28mm F2.8 Nikon Ai Mount Prime Lens For SLR/Mirrorless Cameras,53.39,2020-06-14 00:00:00
Leather PU Half case Bag Grip with strap for Nikon Z7 Z6 Camera,11.4,2020-06-14 00:00:00
"Flash Hot Shoe Cover Protector Standard Flash For Nikon Canon, Pentax, Olympus +",6.95,2020-06-14 00:00:00
JJC Wired Remote Control for Nikon Z7 Z6 D750 D610 D600 D7100 D7000 D5600 D5500,8.99,2020-06-14 00:00:00
Fotodiox Pro Lens Adapter Arri PL Lens to Nikon Z-Mount ND Filter NEW,99.99,2020-06-14 00:00:00
Rear Lens Cover + Camera Front Body Cap for Nikon Z7 Z6 replace BF-N1 LF-N AE,4.0,2020-06-14 00:00:00
Nikon 41mm Plastic Lens Cap - Front - USED Z062,9.95,2020-06-14 00:00:00
Fotodiox PRO Lens Adapter Pentax K AF Lens to Nikon Z-Mount Camera,59.95,2020-06-14 00:00:00
Nikon D5600 Digital SLR Camera Black w/DX AF-P 18-55mm 1:3.5-5.6G Lens ----*Z16*,449.99,2020-06-14 00:00:00
SmallRig Vlogging Mounting Plate for Nikon Z50 Camera Rig With Cold Shoe Mount,28.9,2020-06-13 00:00:00
*Brand New* Nikon NIKKOR Z 24-70mm F/4 S Lens w/ Add-ons,519.99,2020-06-13 00:00:00
SHOTEN LM-NZ M EX B Mount Adapter Helicoid Leica M Lens - Nikon Z Body Japan EMS,317.99,2020-06-13 00:00:00
Nikon NIKKOR Z 50mm F/1.8 S Lens w/FREE UV Filter *NEW*,496.95,2020-06-13 00:00:00
Memory Card Reader-Writer Kit For Nikon Z6 Z7 Z-6 Z-7,8.97,2020-06-13 00:00:00
"EN-EL15B Battery + Charger for Nikon Z7, and Z6 Mirrorless Digital Cameras",29.99,2020-06-13 00:00:00
"Nikon Z50 Mirrorless Digital Camera with 16-50mm Lens+ 32GB Card, (18PC Bundle)",899.0,2020-06-13 00:00:00
FOTOFOX Adapter for Nikon F Mount Lens to Nikon Z Full Frame Mirrorless Camera,21.99,2020-06-13 00:00:00
37mm Thread Mount Metal Lens Hood For Nikon Canon New Olympus Type L0Z1,2.85,2020-06-13 00:00:00
Laowa 100mm f/2.8 2x Ultra Macro APO - (Nikon Z) **Brand New** + Tripod Collar,430.05,2020-06-13 00:00:00
Nikon Nikkor Z 24-70mm f4 S Lens                                            #335,469.0,2020-06-13 00:00:00
Nikon G AF-S F Mount Lens to Nikon Z50 Z6 Z7 Mirrorless Camera Adapter US Seller,19.95,2020-06-12 00:00:00
 Novoflex Lens Adapter Leica 39mm Thread Mount Lenses to Nikon Z-Mount Cameras,75.47,2020-06-12 00:00:00
Nikon NIKKOR Z DX 50-250mm f/4.5-6.3 VR Telephoto Lens,237.75,2020-06-12 00:00:00
GUTTY Lens Mount Adapter for Canon EOS EF Mount Lens to Nikon Z6 Z7 Camera New,27.16,2020-06-12 00:00:00
Nikon NIKKOR Z 24-70mm F/4 S Lens,380.0,2020-06-12 00:00:00
"Canon FD Lens to Nikon Z Z50 Z6 Z7 Mirrorless Camera Adapter Ring ""US Seller""",12.85,2020-06-12 00:00:00
Nikon Z7 Mirrorless Digital Camera (Body Only) Body + FTZ EF Lens Adapter Bundle,3026.72,2020-06-12 00:00:00
NIKKOR Z 14-30mm f/4 S,1258.78,2020-06-12 00:00:00
"Konica AR Lens to Nikon Z Mount Z50 Z6 Z7 Mirrorless Camera Adapter ""US Seller""",12.98,2020-06-12 00:00:00
"BM Premium EN-EL15 EL15A EL15B Dual Bay Battery Charger for Nikon Z6, Z7 Camera",14.99,2020-06-12 00:00:00
Fringer EF-NZ Auto Focus Lens Adapter Canon EF EF-S to Nikon Z Z6 Z7 Z50 camera,299.0,2020-06-11 00:00:00
Waist Mount Bracket for GoPro Fusion insta360 Panoramic Camera&Smartphone Selfie,54.36,2020-06-11 00:00:00
Kastar Battery LCD Wall Charger for Nikon EN-EL15a Nikon Z7Q3  Z 7 Q3 4K UHD,15.49,2020-06-11 00:00:00
"New Nikon EN-EL15B Battery for Nikon D850 D7500 D750 D810 Z6, Z7 Mirrorless D750",25.97,2020-06-11 00:00:00
Nikon Nikkor Z 24-70mm f/4 Free Shipping!,389.0,2020-06-11 00:00:00
55mm Metal Stack Cap for Canon Nikon Sony Pentax Universal DSLR Camera Lens,10.95,2020-06-11 00:00:00
Z Type Tilt Tripod Head Flex Folding For Canon Nikon DSLR Camera GoproTCB xbTD$N,11.03,2020-06-11 00:00:00
BOWER Filter Kit 72mm ND4 UV PL :to CAMERA Z6 Z7 Lens Nikon NIKKOR Z 24-70mm f/4,15.25,2020-06-11 00:00:00
Pro Z6 CL5-NZ camera sling bag for Nikon Z7 Z 7 6 mirrorless SLR case,91.9,2020-06-11 00:00:00
SHOTEN adapter for CONTAX YASHICA CY mount lens to Nikon Z mount Z6 Z7 camera,45.99,2020-06-11 00:00:00
MegaGear Ultra Light Neoprene Camera Case compatible with Nikon Z50 (16-50mm),39.99,2020-06-11 00:00:00
