title,price,date
NIkon Nikkor Z 24mm f/1.8 S MINT!!!,779.0,2020-08-15 00:00:00
Viltrox DG-Z Auto Macro Extension Tube Ring Lens Adapter for Nikon Z Mount Safe,47.22,2020-08-15 00:00:00
SUNWAYFOTO PNL-Z6 Dedicated L Plate / Nikon Z6 / Z7 Camera Arca / RRS Compatible,49.95,2020-08-15 00:00:00
New Rear Lens Cap For Nikon Nikkor SLR DSLR Lens -S Z6G1 CAP-AIx R0X5 Mount R2V7,1.17,2020-08-15 00:00:00
Nikon FTZ Mount Adapter (F Lens to Nikon Z-Mount) 4185,177.97,2020-08-15 00:00:00
Kipon Tilt Adapter for Nikon F Mount Lens to Nikon Z Mirrorless Camera,190.0,2020-08-15 00:00:00
"NEW Nikon EN-EL15B Battery for D850 D7500 D750 D810 Z6, Z7 Mirrorless D750",25.99,2020-08-15 00:00:00
Genuine Nikon EN-EL15B Battery for D850 D810 D750 D7000 D600 D500 Z6 Z7 V1,24.38,2020-08-15 00:00:00
Nikon FTZ Mount Adapter 4185 - White Box,189.0,2020-08-15 00:00:00
"EN-EL15B Battery for Nikon Z6, Z7 Mirrorless D7000 D7100 D7200 UK STOCK ",35.37,2020-08-15 00:00:00
Genuine Nikon EN-EL15B Battery for D850 D7500 D750 D810 Z6 Z7 D750 V1 D810,26.99,2020-08-15 00:00:00
Super Strong Tempered Glass Screen Protector for Nikon Z6 Z7 Z 6 Z 7 Camera,68.8,2020-08-14 00:00:00
TECHART TZC-01 Auto Focus Lens Adapter for Canon EF EOS To Nikon Z6 Z7 Z50 Camer,232.0,2020-08-14 00:00:00
JJC LH-HN40 Lens Hood Shade Fr Nikon NIKKOR Z DX 16-50mm f/3.5-6.3 VR Lens HN-40,10.99,2020-08-14 00:00:00
Mount Adaptor Ring for Olympus Panasonic M43 Lens to Nikon Z7 Z6 Camera Body,17.59,2020-08-14 00:00:00
ZOMEI Z818 Pro Portable Aluminum Tripod Monopod&Ball Head For Canon Nikon Camera,59.99,2020-08-14 00:00:00
Z Flex Tilt Ball Head Quick Release Plate System for Canon Nikon Sony Cameras,9.95,2020-08-14 00:00:00
Floating Wrist Strap Water Buoyancy Band Swim Dive for DSLR Camera Cannon Nikon,6.5,2020-08-14 00:00:00
Nikon Z6 24.5MP Mirrorless Camera Body - EXC and USA,1462.95,2020-08-14 00:00:00
Nikon Z7 and Z6 Mirrorless Cameras User's Instruction Manual - EX,5.92,2020-08-14 00:00:00
Meike MK-Z7G Hand Grip for Nikon Z6 and Z7 Cameras,41.61,2020-08-14 00:00:00
Nikon NIKKOR Z DX 50-250mm f/4.5-6.3 VR Telephoto Lens MINT,303.9,2020-08-14 00:00:00
"Nikon F Mount Lens to Nikon z50 Z6 Z7 Mirrorless Camera Adapter ""US Seller""",12.93,2020-08-14 00:00:00
Nikon Z 7 Mirrorless Camera Hardly Used! Free Shipping!,2116.0,2020-08-14 00:00:00
2 Packs JJC Body Cap & Rear Lens Cap for Nikon Z Z6 Z7 Z50 replace BF-N1 LF-N1,8.95,2020-08-14 00:00:00
Kastar Battery for Nikon EN-EL15 (27011) EL15a EL15b EL15c Nikon Z5 Z6 Z7 D7500,10.99,2020-08-14 00:00:00
Nikon Z 6 Mirrorless Digital Camera w/ 24-70mm Lens 1598,1966.97,2020-08-14 00:00:00
Nikon NIKKOR Z 24-70mm f/4 S Lens 20072,476.97,2020-08-14 00:00:00
Nikon Z 6 Mirrorless Digital Camera with 24-70mm Lens,2056.55,2020-08-14 00:00:00
Near Mint!! Nikon NIKKOR Z 24-70mm f/4 S w/ Case for Nikon Z Series,513.0,2020-08-14 00:00:00
Nikon FTZ Mount Adapter (F Lens to Nikon Z-Mount) (new without package),182.75,2020-08-14 00:00:00
Nikon Z7 with FTZ Mount Adapter and Smallrig L-Bracket,2600.0,2020-08-14 00:00:00
Godox TT685N TTL Camera Flash Speedlite Xpro-N F Nikon D800 D850 Z7 Z6 D610 D500,265.88,2020-08-14 00:00:00
Nikon WR-T10 Wireless Remote Controller Transmitter for Z7 Z6 D5600 D780 D750 Df,69.0,2020-08-14 00:00:00
Nikon Z6 Mirrorless Digital Camera Body 24.5 MP Full-Frame,1539.95,2020-08-14 00:00:00
"Nikon Z6, Z7 Instruction Owner User's Manual Book - NEW",19.98,2020-08-14 00:00:00
SmallRig L Bracket for Nikon Z5/Z6/Z7 Camera 2947,27.9,2020-08-14 00:00:00
JJC KIWIFOTOS Long Camera Eyecup for Nikon Z6 Z7 Nikon Z6 Eye Cup Nikon Z7 Ey...,24.99,2020-08-14 00:00:00
Battery for Nikon EN-EL15b | 65134 | D600 D800 D7000 D7500 1 V1 / Z6 Z7 /Charger,30.24,2020-08-14 00:00:00
Z Type Tilt Tripod Head Flex Folding For Canon Nikon DSLR Camera GoproTCB xb _DR,10.61,2020-08-14 00:00:00
New Genuine Nikon EN-EL15B Battery for D850 D810 D750 D7000 D600 D500 Z6 Z7 V1,25.97,2020-08-14 00:00:00
New Genuine Nikon EN-EL15B Battery for D850 D810 D750 D7000 D600 D500 Z6 Z7 V1,20.57,2020-08-14 00:00:00
EN-EL15B Battery For Nikon D850 D810 D800 D750 D610 D600 D500 Z7 Z6 V1 D7500,21.87,2020-08-14 00:00:00
New EN-EL15B Battery For Nikon D850 D810 D800 D750 D610 D600 D500 Z7 Z6 V1 D7500,21.57,2020-08-14 00:00:00
9H Tempered Glass Screen Protector for Nikon Z6 Z7 Mirrorless Camera AUS seller.,68.31,2020-08-13 00:00:00
Rear Lens Cover + Camera Front Body Cap for Nikon Z7 Z6 re xx48,3.22,2020-08-13 00:00:00
Zhiyun Weebill S 3-Axis Handheld Gimbal for Sony A7M3 A7R3 A9 Nikon Z6 Canon 5D4,304.0,2020-08-13 00:00:00
Nikon Z 7 Mirrorless Digital Camera with 24-70mm Lens + EXT BATT + Flash Bundle,2949.95,2020-08-13 00:00:00
Nikon Charging Kit for D7500 D7200 D850 D810 D800 D780 D750 D610 D600 D500 Z6 Z7,205.0,2020-08-13 00:00:00
Nikon WR-T10 Wireless Remote Controller Transmitter for Z7 Z6 D5600 D780 D750 Df,69.0,2020-08-13 00:00:00
Genuine Nikon DK-29 Rubber Eyecup for Z6 Z7,14.0,2020-08-13 00:00:00
Genuine Nikon MC-DC2 Remote Cord for Z6 D7100 D5600 D3200 D780 D750 D610 D600 Df,37.0,2020-08-13 00:00:00
Nikon EP-5B Power Connector D7500 D7200 D850 D810 D800 D780 D750 D610 D500 Z6 Z7,49.0,2020-08-13 00:00:00
JJC Camera LCD Guard Film Screen Protector for Nikon Z6 Z7 (Set of 2 Pieces),10.5,2020-08-13 00:00:00
Nikon AN-4B Narrow Nylon Neck Strap for Camera Neckstrap,24.0,2020-08-13 00:00:00
Nikon AN-6Y Wide Nylon Neck Strap for Camera Neckstrap,30.0,2020-08-13 00:00:00
Nikon AN-6W Wide Nylon Neck Strap for Camera Neckstrap,27.0,2020-08-13 00:00:00
Nikon AN-4Y Narrow Nylon Neck Strap for Camera Neckstrap,24.0,2020-08-13 00:00:00
JJC Long Rubber Eyecup Replace DK-29 for Nikon Z6 Z7,17.0,2020-08-13 00:00:00
Nikon NIKKOR Z 14-30mm f/4 S Camera Lens,950.0,2020-08-13 00:00:00
Bower 67mm UV Filter For Nikon NIKKOR Z 85mm f/1.8 S Lens,11.15,2020-08-13 00:00:00
2.5mm-N3 Remote Cable-PocketWizard to Nikon Z6 Z7 D7500 D750 D5600 D780 D7200,9.44,2020-08-13 00:00:00
M58x1 female thread to Nikon Z camera mount adapter for helicoids,36.5,2020-08-13 00:00:00
SmallRig Vlogging Mounting Plate for Nikon Z50 Camera Rig with Battery Slot 2667,34.9,2020-08-13 00:00:00
"Round Camera Glass Eyepiece for NIKON FE, FM DSLR Cameras Eyecup Replacement",9.95,2020-08-13 00:00:00
Rear Lens Cover + Camera Front Body Cap for Nikon Z7 Z6 replace BF-N1 LF-N_bl,3.21,2020-08-13 00:00:00
ZOMEI Z688 Aluminum Tripod Monopod&Ball Head Travel for Canon Nikon Sony Camera,60.99,2020-08-13 00:00:00
QR L-Plate Bracket Hand Grip Holder Handle Plate For Nikon Z6 Z7 Mirrorless Cam,19.78,2020-08-13 00:00:00
Metz Mecablitz 52 AF-1 digital Flash for Nikon DSLR Z6 Z7 D850 D810 camera,110.0,2020-08-13 00:00:00
Nikon FTZ Mount Adapter (F-Mount Lens to Z-Mount Camera)                    #857,169.0,2020-08-13 00:00:00
Kastar LCD USB Battery Charger for Nikon EN-EL25 Nikon Z Series Z50 Z 50 Camera,10.99,2020-08-13 00:00:00
Pixco Camera Macro Focusing Tube Helicoid Adapter For M42 Lens to Nikon Z6 Z7,28.79,2020-08-13 00:00:00
Adjustable M42 42mm Lens to Nikon Z Mount Mirrorless Z50  Z6 Z7 Camera Adapter,11.69,2020-08-13 00:00:00
"Nikon F Mount Lens to Nikon z50 Z6 Z7 Mirrorless Camera Adapter ""US Seller""",12.98,2020-08-13 00:00:00
Nikon EN-EL15b Rechargeable Battery D850-D810-D800- D750-D7200-D7300-D610- Z6-Z7,28.99,2020-08-13 00:00:00
Nikon HB-85 Bayonet Lens Hood for NIKKOR Z 24-70mm f/4 S Lens #4184,34.95,2020-08-13 00:00:00
New K&F Concept adapter for Contax Yashica CY mount lens to Nikon Z6 Z7 camera,40.75,2020-08-13 00:00:00
KMZ Start Lens Onto Sony E Mount (FS100 A7R A7S etc) Adapter With Close Focus,42.75,2020-08-13 00:00:00
Camera Shoulder Neck Strap Vintage Belt For All Dslr Camera Nikon  So B7Z7,5.65,2020-08-13 00:00:00
Nikon Charging Kit for D7500 D7200 D850 D810 D800 D780 D750 D610 D500 Z6 Z7 DN,219.0,2020-08-13 00:00:00
"SmallRig Full Cage for Nikon Z5/Z6/Z7 Camera 1/4""-20 & ARRI 3/8”-16 2972 ",34.9,2020-08-13 00:00:00
Pixco Camera Adapter For Olympus OM Lens To Nikon Z6 Z7 Full Frame Mirrorless,17.91,2020-08-13 00:00:00
"SmallRig Camera L Bracket for Nikon Z5/Z6/Z7 Camera w/ Arca 1/4"" Threads 2947",27.9,2020-08-13 00:00:00
New wifi remote control ML-l7 for Nikon P1000 P950 B600 A1000 Z50 camera,39.99,2020-08-12 00:00:00
Nikon NIKKOR Z 24-70mm f/4 S Lens,499.99,2020-08-12 00:00:00
"Nikon EN-EL15b OEM & Genuine Battery - For D850, D810, D750, Z7, Z6, D7500",27.95,2020-08-12 00:00:00
2X Khaos For Nikon Z6 / Z7 Digital SLR Camera Tempered Glass Screen Protector,7.35,2020-08-12 00:00:00
LCD Timer Shutter Release Cord f/ Nikon D780 Z6 Z7 D7500 D750 D5600 D7200 D90,31.49,2020-08-12 00:00:00
LCD Dual Fast Charger for Nikon EN-EL4 D2Z D2H D2X D3 D3S D3X F6,35.98,2020-08-12 00:00:00
USB Dual Battery Charger fits EN-EL15a/b fr Nikon Z7 Z6 D780 D850 D810 D750 D610,11.99,2020-08-12 00:00:00
Water-resistant Storage Memory Card Case Holder fits 6 XQD Card for Nikon Z7 Z6,9.49,2020-08-12 00:00:00
EN-EL15B Battery For Nikon D850 D810 D800 D750 D610 D600 D500 Z7 Z6 V1 D7500,19.94,2020-08-12 00:00:00
Z Flex Ball Head Quick Release Plate System for Nikon D5600 D5000 D5300 D5100,9.95,2020-08-12 00:00:00
Nikon AN-6W Wide Nylon Neck Strap for Camera Neckstrap DN,29.0,2020-08-12 00:00:00
Nikon AN-6Y Wide Nylon Neck Strap for Camera Neckstrap DN,32.0,2020-08-12 00:00:00
"Pro Zomei Z818 Compact Portable Tripod Monopod,Ball Head for DSLR Camera Nikon",71.99,2020-08-12 00:00:00
NEW Nikon Z50 Mirrorless Camera w/ 16-50mm & 50-250mm lenses & MUCH MORE!,1196.95,2020-08-12 00:00:00
Nikon USB & HDMI Cable Clip for Z6 & Z7 Protector (#6734),7.95,2020-08-12 00:00:00
USA  Leica M LM Zeiss M Lens Dedicated to Nikon Z Mount Z6 Z7 Adapter Ring,13.25,2020-08-12 00:00:00
"BM Premium 2 Pack of EN-EL15A, EN-EL15B Battery for Nikon Z6, Z7, D500 Cameras",28.99,2020-08-12 00:00:00
Nikon Dot Sight DF-M1 Black for Nikon SLR Z7 Z6 P1000 New in Box,193.75,2020-08-12 00:00:00
BOYA BY-M1 Omnidirectional Lavalier Microphone For Canon Nikon Son-y Camera Z0I7,18.99,2020-08-12 00:00:00
Nikon SB-910 Speedlight Flash SB910 ref2496216 for d800 d600 d5600 d3 d4  z6 z7,139.98,2020-08-12 00:00:00
JJC Remote Shutter Release Cable AS NIKON MC-DC2 for Z6 Z7 P1000 P7800 D7500 Df,6.49,2020-08-12 00:00:00
JJC Kiwifotos Long Large TPU Silica Gel Eyecup Eyepiece for Nikon Z6 Z7 as DK-29,12.9,2020-08-12 00:00:00
Nikon Z50 Mirrorless Digital Camera with 16-50mm Lens 1633,817.97,2020-08-12 00:00:00
Nikon Nikkor Z 24-70mm F/4 S Lens for Nikon Z #28350 L4,410.0,2020-08-12 00:00:00
Nikon  Z6  Z7 Digital Camera Battery Door  cover part 129S9 Z 6 7,36.99,2020-08-12 00:00:00
"Hoodman 128GB CFExpress Type B Memory card + 6 card case, used twice in Nikon Z6",149.0,2020-08-12 00:00:00
Nikon Z7 Mirrorless Digital Camera (Body Only) + Pro Camera Bag,2399.0,2020-08-12 00:00:00
New lens Mount adapter FT-Z FTZ for Nikon Z6 Z7 Z50 micro camera,169.99,2020-08-12 00:00:00
Nikon NIKKOR Z 24-70mm F/4 S,406.41,2020-08-12 00:00:00
Genuine Nikon Remote Release Cord MC-DC2 for Z6 Z7 D7100 D5600 D780 D610 D600 Df,14.79,2020-08-12 00:00:00
"Adapter for Tamron Adaptall I II Lens to Nikon Z Mount Z6 Z7 Camera ""US Seller""",12.53,2020-08-12 00:00:00
"Leica R LR Lens to Nikon Z Mount Z50 Z6 Z7 Mirrorless Camera Adapter ""US Seller""",12.72,2020-08-12 00:00:00
Anti-Scratch Camera Body Cover Carbon Fiber Film Kit For Nikon D810 D850 Z7 Z6,12.99,2020-08-12 00:00:00
Nikon NIKKOR Z 14-30mm f/4 S Camera Lens - Black,999.0,2020-08-12 00:00:00
JJC 2 Slot Camera Battery + Card Pouch Bag Holder for Nikon Z50 Fujifilm X100V,8.99,2020-08-12 00:00:00
64GB SD Memory Card Pro for Nikon Dslr D3300 D5500 D3200 Z 50 D7000 Camera 4K,22.99,2020-08-12 00:00:00
37mm Thread Mount Metal Lens Hood For Nikon Canon L0Z1 Olympus Type New S3W2,2.55,2020-08-12 00:00:00
MeikeZ-AF1 Metal Auto Focus Macro Extension Tube Ring (11mm+18mm) for Nikon Z6Z7,43.0,2020-08-12 00:00:00
"Nikon Z6 24.5MP Body, Excell cond, 10,800 shutter count (5% of shutter life)",1374.9,2020-08-12 00:00:00
Nikon Nikkor Z 24-70mm f4 S Great Condition Free Shipping!,400.0,2020-08-12 00:00:00
Quick Release L Plate Bracket Holder Vertical Hand Grip for Nikon Z6 Z7 Camera,21.97,2020-08-11 00:00:00
"Long TPU Silica Gel Eyecup Eyepiece for Nikon Z6 Z7 Camera as DK-29 ""US Seller""",12.9,2020-08-11 00:00:00
JJC LCD Timer Remote Control for Nikon Z7 Z6 D750 D610 D600 D7200 D5600 D5500 Df,19.99,2020-08-11 00:00:00
FOTOFOX Lens Adapter for Sony NEX E-Mount Lens to Nikon Z Camera Nikon Z6 Z7,13.89,2020-08-11 00:00:00
New lens Mount adapter FT-Z FTZ for Nikon Z6 Z7 Z50 micro camera,169.99,2020-08-11 00:00:00
Nikon Z 50 Body Only,705.04,2020-08-11 00:00:00
Nikon EN-EL15b Rechargeable Battery D850-D810-D800- D750-D7200-D7300-D610- Z6-Z7,28.99,2020-08-11 00:00:00
NIKKOR Z 24-70mm f/2.8 S Zoom Lens - EXC! *USA Model*,1822.95,2020-08-11 00:00:00
NEW Nikon Z 24-70mm lense f/2.8 S,1899.0,2020-08-11 00:00:00
Nikon NIKKOR Z 50mm F/1.8 S Mirrorless Lens - MINT (Barely Used) ** USA Model,539.0,2020-08-11 00:00:00
Nikon FTZ Mount Adapter mint in box,162.5,2020-08-11 00:00:00
Nikon NIKKOR Z 35mm F/1.8 S Mirrorless Lens - MINT (Barely Used) ** USA Model,539.0,2020-08-11 00:00:00
HB-90A Lens Hood Shade for Nikon NIKKOR Z DX 50-250mm f/4.5-6.3 VR + Filter +Cap,13.99,2020-08-11 00:00:00
NEW NIKON FTZ Z MOUNT LENS ADAPTER. USA ITEM.  NEVER USED. NIKON Z6 and Z7,194.6,2020-08-11 00:00:00
Nikon Z 7 Mirrorless Camera,2176.7,2020-08-11 00:00:00
SmallRig LCD Sun Hood for Nikon Z6 and Z7 Cameras #VH2807,19.9,2020-08-11 00:00:00
55mm Metal Screw-On Lens Cap for Canon Nikon Sony Pentax Universal DSLR Camera,7.95,2020-08-11 00:00:00
Z Flex Tilt Ball Head Quick Release Plate System for Nikon D7500 D7200 D7100 ,9.95,2020-08-11 00:00:00
Nikon FTZ Mount Adapter (Nikon F to Z - Mount),204.49,2020-08-11 00:00:00
Waterproof Shoulder Bridge Camera Case Bag For Compact System Nikon 1 AW1 Z4,20.49,2020-08-11 00:00:00
Rear Lens Cover + Camera Front Body Cap for Nikon Z7 Z6 reDXHWP4,3.44,2020-08-11 00:00:00
96 LED Video Light Lamp Lighting Shoe For Canon Nikon Hot Camera DSLR W6Z2,12.49,2020-08-10 00:00:00
Opteka 10' Remote Shutter Release Cable for Nikon D610 D3100 Z7 Z6 P7800 P7700,9.95,2020-08-10 00:00:00
Rear Lens Cover + Camera Front Body Cap for Nikon Z7 Z6 reDDN,3.76,2020-08-10 00:00:00
Kipon Adapter for C Mount Lens to Nikon Z Full Frame Nik NZ Mirrorless Camera ,34.8,2020-08-10 00:00:00
Nikon EN-EL15b Rechargeable Battery D850-D810-D800- D750-D7200-D7300-D610- Z6-Z7,28.99,2020-08-10 00:00:00
SmallRig Cage for Nikon Z5/Z6/Z7 Camera With Cold Shoe & NATO Rail 2972 ,34.9,2020-08-10 00:00:00
3 Foot I-TTL Off Camera Coil Cord for Nikon Sync flash SC-29 AF Illuminating,21.95,2020-08-10 00:00:00
Opteka 3' Remote Shutter Release Cable for Nikon Z6 P7800 P7700,5.99,2020-08-10 00:00:00
For Nikon 135mm f/2.8 prime lens mirrorless Z50 Z6 Z7 Z5 Z mount camera,67.98,2020-08-10 00:00:00
Nikon Z 50 Camera + 16-50mm f/3.5-6.3 VR + 50-250mm f/4.5-6.3 VR Lens ,1267.02,2020-08-10 00:00:00
"NEW Nikon EN-EL15B Battery for D850 D7500 D750 D810 Z6, Z7 Mirrorless EL15 EL15A",25.97,2020-08-10 00:00:00
Rear Lens Cover + Camera Front Body Cap for Nikon Z7 Z6 re*P1,3.03,2020-08-10 00:00:00
Nikon Z 6 Mirrorless Digital Camera (Body) 1595,1522.97,2020-08-10 00:00:00
"Konica AR Lens to Nikon Z Mount Z50 Z6 Z7 Mirrorless Camera Adapter ""US Seller""",12.93,2020-08-10 00:00:00
Nikon Z6 Mirrorless Digital Camera with NIKKOR Z 50mm f/1.8 Lens,2056.0,2020-08-10 00:00:00
Z Type Tilt Tripod Head Flex Folding For Canon Nikon Sony DSLR Camera Aluminum,15.98,2020-08-10 00:00:00
GABALE Lens Adapter for Sony NEX E-Mount Lens to Nikon Z Mount Camera  Z6 Z7,28.9,2020-08-10 00:00:00
"Leica R Lens to Nikon Z Mount Z50 Z6 Z7 Mirrorless Camera Adpater ""US Seller""",12.71,2020-08-10 00:00:00
Rear Lens Cover + Camera Front Body Cap for Nikon Z7 Z6 replace BF-N1 LF-N1 a yt,3.25,2020-08-10 00:00:00
Nikon Z50 with Z16-50mm VR Lens Kit WITH Nikon FTZ ADAPTER + EXTRA NIKON BATTERY,940.0,2020-08-10 00:00:00
Kipon Adapter for  Leica M39 Mount Lens to Nikon Z Full Frame Mirrorless Camera,45.0,2020-08-10 00:00:00
Nikon Z 50 Mirrorless Digital Camera w/ NIKKOR Z DX 16-50mm & 50-250mm Lenses,999.95,2020-08-10 00:00:00
"Nikon Nikkor Z 24-70mm f4 S Lens Perfect cond with Hood,  box,  caps ",418.99,2020-08-10 00:00:00
Nikon Z7 Digital Mirrorless Camera CheatSheet,11.95,2020-08-10 00:00:00
new for Nikon Z6 bottom shell camera bottom shell bottom shell bottom shell ,68.0,2020-08-10 00:00:00
original for Nikon Z6 USB leather side skin leather plug port leather ,32.5,2020-08-10 00:00:00
Nikon FTZ Mount Adapter,199.95,2020-08-10 00:00:00
"Pixel RC-201/DC2 Shutter Release Cable for Nikon Z7,Z6,D7500,D7200,D5600,D5500",11.78,2020-08-10 00:00:00
Gabale Lens Mount Adaptor for Sony FE E Lenses to Nikon Z7 Z6 Z Camera Body,28.49,2020-08-10 00:00:00
72mm Flower Screw Mount Lens Hood For Nikon Nikkor Z 24-70mm F4 S Lens,25.95,2020-08-10 00:00:00
HB-90A Lens Hood Tulip Flower Shade Nikon NIKKOR Z DX 50-250mm f/4.5-6.3 VR Z50,18.49,2020-08-09 00:00:00
Nikon NIKKOR Z DX 16-50mm f/3.5-6.3 VR Lens USA version,231.0,2020-08-09 00:00:00
JJC KS-Z7SK Anti Scratch Protective Skin Film for Nikon Z7 Z6 Camera Custom Fit ,10.99,2020-08-09 00:00:00
New Rear Lens Cap For Nikon Nikkor SLR DSLR Lens -S Mount R0X5 Z6G1 AI A9M2,1.28,2020-08-09 00:00:00
Nikon Z6 24.5MP Mirrorless Camera - Black (Body Only),1398.25,2020-08-09 00:00:00
Kastar Replacement Battery Pack for Nikon EN-EL15e & Nikon Z7 Nikon 1V1 Camera,26.49,2020-08-09 00:00:00
"Nikon Z6 Kit with 24-70mm F4 Lens + XQD + batteries -  less than 20 shots, MINT",1849.0,2020-08-09 00:00:00
Nikon S560 S620 P6000 P80 D5000 Fujifilm Z200 LCD DISPLAY SCREEN MONITOR,39.99,2020-08-09 00:00:00
Nikon Z6 Mirrorless Digital Camera with 24-70mm Lens & FTZ Mount Adapter Kit,2209.95,2020-08-09 00:00:00
Body Cap & Rear Lens Cap Protector Part f Nikon Z7 Z6 Z Mount Camera & Lenses,9.99,2020-08-09 00:00:00
"Nikon Z7 mirrorless digital camera MINT IN BOX US SELLER ""LQQK""",2330.0,2020-08-09 00:00:00
Used Nikon Z 7 45.7 MP Mirrorless Digital Camera (Body Only) #842,2246.08,2020-08-09 00:00:00
Nikon EH-7P Charging AC Adapter genuine OEM for Z 7 6 mirrorless camera EN-EL15b,37.99,2020-08-09 00:00:00
Used Nikon Z 7 45.7 MP Mirrorless Digital Camera (Body Only) #842,2166.92,2020-08-09 00:00:00
Used Nikon Z 7 45.7 MP Mirrorless Digital Camera (Body Only) #842,2166.92,2020-08-09 00:00:00
RED Aluminum Thumb Rest Thumb Up Thumb Grip Hot Shoe Cover For Nikon Z6 Z7,12.98,2020-08-09 00:00:00
AODELAN ML-L7 Wireless Remote Control For Nikon COOLPIXA1000 P1000 P950 Z50 B600,26.63,2020-08-09 00:00:00
MEDIUM CASE BAG to CAMERA NIKON COOLPIX B600 Z6 Z7 P900 D90 P600 P610 P530 ,13.72,2020-08-09 00:00:00
Pixco Lens Adapter for Sony NEX E-Mount Lens to Nikon Z Mount Camera Nikon Z6 Z7,16.18,2020-08-09 00:00:00
49mm Wide Angle Metal Wide-angle Lens Hood for Canon Nikon Camera+free 72mm Cap,8.85,2020-08-09 00:00:00
K&F Concept Lens Mount Adapter for Olympus OM Lens to Nikon Z Z6 Z7 Camera,28.49,2020-08-09 00:00:00
Kastar EN-EL4 Battery Fast Charger for Nikon D2Z D2H D2Hs D2X D2Xs D3 D3S D3X F6,19.98,2020-08-09 00:00:00
Z Type Tilt Tripod Head Flex Folding For Canon Nikon DSLR Camera GoproTCB xb QEA,13.84,2020-08-08 00:00:00
ET-3120 Digital Camera Camcorder Tripod Stand for Canon Nikon Sony #Z,14.5,2020-08-08 00:00:00
Nikon Z 50 20.9MP Mirrorless Camera (Body Only) MINT in box USA version,643.0,2020-08-08 00:00:00
Pixco Adapter For Pentax K PK DA Lens to Nikon Z Z6 Z7 Full Frame Mirrorless,24.79,2020-08-08 00:00:00
SmallRig Vlogging Mounting Plate for Nikon Z50 Camera #LCN2525,28.9,2020-08-08 00:00:00
7artisans 35mm F1.4 Full Frame Large Aperture Manual Lens for Nikon Z Mount,199.0,2020-08-08 00:00:00
37mm Thread Mount Metal Lens Hood For Nikon Canon Type Olympus L0Z1 New O1F2,3.39,2020-08-08 00:00:00
NEW Nikon Z 24-70mm lense f/2.8 S,1099.0,2020-08-08 00:00:00
Nikon Z6 FX-Format Mirrorless Camera Body w/NIKKOR Z 24-70mm f/4 S,2059.95,2020-08-08 00:00:00
FUJIFILM CM Fujinon W 300mm f/5.6 Copal shutter Nikon Board [Excellent] 06-Z100,529.0,2020-08-08 00:00:00
Camera Lens Hoods Reversible Petal Flower Lens Shade HB-69 Q1B4 For Nikon E6Z3,1.69,2020-08-08 00:00:00
Rubber Protection Case For Nikon D750 D5500 D5600 D7200 D5300 D3400 D7500 Z7 Z6,15.5,2020-08-08 00:00:00
"Nikon Z7 FX 45.7MP Mirrorless Camera Kit 24-70mm F/4 Lens, FTZ Adapter + extras",2875.0,2020-08-08 00:00:00
Z Flex Tilt Ball Head Quick Release Plate System for Canon Nikon Sony Cameras,9.95,2020-08-08 00:00:00
Pixco Camera Adapter For M42 Lens To Nikon Z6 Z7 Full Frame Mirrorless,19.79,2020-08-08 00:00:00
Pixco Camera Adapter For Contax CY Lens to Nikon Z Z6 Z7 Full Frame Mirrorless,17.94,2020-08-08 00:00:00
Rear Lens Cover + Camera Front Body Cap for Nikon Z7 Z6 replace BF-N1 LF-N KHhZZ,3.03,2020-08-08 00:00:00
Genuine Nikon EN-EL15B Battery for D850 D810 D750 D7000 D600 D500 Z6 Z7 V1,23.37,2020-08-08 00:00:00
"GGS LARMOR Self-Adhesive Optical Glass LCD Screen Protector for Nikon Z7, Z6",12.45,2020-08-08 00:00:00
Kipon Adapter for M42 Screw Mount Lens to Nikon Z Full Frame Mirrorless Camera,70.0,2020-08-08 00:00:00
Kipon Adapter for Minolta MD Mount Lens to Nikon Z Full Frame Mirrorless Camera,88.0,2020-08-08 00:00:00
K&F Concept adapter for Contax G mount lens to Nikon Z mount Z6 Z7 Z50 camera,47.04,2020-08-08 00:00:00
GABALE Adapter for Leica LM Zeiss M Series Lens to Nikon Z Mount Z6 Z7 CAM,19.98,2020-08-07 00:00:00
Laowa FF II 9mm F/5.6 W-Dreamer RL Lens (Nikon Z) *NEW* *IN STOCK*,799.0,2020-08-07 00:00:00
Pixco Camera Adapter Fr B4 Lens to Nikon Z Mount Camera Z6 Full Frame Mirrorless,41.4,2020-08-07 00:00:00
K&F Concept Lens Mount Adapter for M39 Mount Lens to Nikon Z6 Z7 Camera,22.64,2020-08-07 00:00:00
Wired Remote Shutter Release Control MC-DC2 f/ Nikon D750 D7500 Z6 Z7-USA Seller,9.59,2020-08-07 00:00:00
New Pro Grip Wrist Strap for Nikon Coolpix L810,11.89,2020-08-07 00:00:00
JJC GSP-Z50 Optical GLASS LCD Screen Protector Film for Nikon Z50 Camera + Cloth,8.99,2020-08-07 00:00:00
JJC LCP-Z50 LCD Guard Film Screen display Protector for Nikon Z50 camera,9.8,2020-08-07 00:00:00
D500 D750 D800 D810 D850 D5 Z6 Z7 Quick Release L-Plate Bracket Holder For Nikon,24.5,2020-08-07 00:00:00
Eyecup / eyepiece Protection for Nikon Z6 and Nikon Z7 cameras (3D Printed),10.8,2020-08-07 00:00:00
Zhiyun Weebill S 3-Axis Gimbal Stabilizer for Mirrorless DSLR Sony A7M3 Nikon Z7,304.0,2020-08-07 00:00:00
Pixco External Hand Grip Vertical L Plate Metal Bracket For Nikon Z6 Z7 Black,15.8,2020-08-07 00:00:00
Kastar Battery + Charger For Nikon EN-EL15B D7100 D7000 D800 D810 D750 Z7 Z6 V1,25.99,2020-08-07 00:00:00
Nikon SB-910 Speedlight Flash SB910 ref2471746 for d800 d600 d5600 d3 d4 z6 z7..,169.98,2020-08-07 00:00:00
"Canon FD Lens to Nikon Z Z50 Z6 Z7 Mirrorless Camera Adapter Ring ""US Seller""",12.8,2020-08-07 00:00:00
MINT! Nikon Z6 24.5MP Mirrorless Camera w/ NIKKOR Z 24-70mm F/4 S Lens,2070.0,2020-08-07 00:00:00
US Fringer EF-NZ  Auto Focus Lens Adapter For Canon EF EF-S to Nikon Z Z6 Z7 Z50,289.0,2020-08-07 00:00:00
Leica M bayonet Lens mount adapter to Nikon Z 6 7 Full frame Mirrorless Cameras,39.25,2020-08-07 00:00:00
EN-EL15B ENEL15b Battery For Nikon D7100 D7000 D800 D810 D750 Z7 Z6 V1,19.37,2020-08-07 00:00:00
For Nikon Z50 Battery Cover Battery Door Cap Lid  Original,27.99,2020-08-07 00:00:00
"SmallRig Plate for Nikon Z50 Camera with Cold Shoe Mount & 1/4"" Thread - LCN2525",28.9,2020-08-07 00:00:00
DK-29 Nikon Eyepiece Cup Z7 Z6 Ergonomic Rotatable Soft Rubber JJC EN-DK29II,17.49,2020-08-07 00:00:00
46mm Bundle Kit Filter Lens hood Cap Cleaning pen Air Blower for Nikon Z50 ,9.9,2020-08-07 00:00:00
Kastar AC Travel Battery Charger for Nikon ENEL25 Nikon Z Series Z50 Z 50 Camera,9.99,2020-08-07 00:00:00
Neoprene Neck Strap for Nikon Z7 Z6 D850 D810A D800 D750 D7500 D7200 D5600 D5500,9.99,2020-08-07 00:00:00
Nikon NIKKOR Z 50mm F/1.8 S Lens,509.71,2020-08-06 00:00:00
82mm Metal Screw-On Lens Cap for Canon Nikon Sony Pentax Universal DSLR Camera,10.95,2020-08-06 00:00:00
GGS IV 0.3mm Glass Screen Protector and Sunshade Hood for Nikon Z7/Z6,14.7,2020-08-06 00:00:00
"1/4""-20 Tripod Mount Screw to Hot Shoe Adapter For Nikon Camera DSLR C2T5 Z2Y6",2.61,2020-08-06 00:00:00
Variable Close Focus Leica M Lens To Nikon Z Helicoid Tube Adapter Z5 Z50 Z6 Z7,31.9,2020-08-06 00:00:00
Genuine Nikon Remote Release Cord MC-DC2 for Z6 Z7 D7100 D5600 D780 D610 D600 Df,14.79,2020-08-06 00:00:00
Ultra Slim Macro M42 Screw Lens To Nikon Z-Mount Camera Adapter Z50 Z6 Z7,7.2,2020-08-06 00:00:00
ZOMEI Z669 Lightweight Aluminium Tripod Monopod Travel for Canon Nikon Camera,55.99,2020-08-06 00:00:00
49mm Metal Screw-On Lens Cap for Canon Nikon Sony Pentax Universal DSLR Camera,7.95,2020-08-06 00:00:00
52mm Metal Screw-On Lens Cap for Canon Nikon Sony Pentax Universal DSLR Camera,7.95,2020-08-06 00:00:00
Quick Release L Bracket Plate Mount Vertical Holder For Nikon Z6 Z7 Camera RRS,17.2,2020-08-06 00:00:00
Nikon Z6 24.5MP Mirrorless Camera - Black (Body Only),1623.39,2020-08-06 00:00:00
Kastar LTD2 USB Battery Charger for Nikon EN-EL25 Nikon Z Series Z50 Z 50 Camera,12.99,2020-08-06 00:00:00
Kastar Battery LCD AC Charger for Nikon EN-EL15b MH-25b Nikon Z7 Z 7 UHD Camera,38.49,2020-08-06 00:00:00
Nikon Z6 Mirrorless Digital Camera Body 24.5 MP Full-Frame & FTZ Mount Adapter,1729.95,2020-08-06 00:00:00
FX-Z Lens Mount Adapter Ring for Fujifilm X Lenses to Nikon Z Z7 Z6 Cameras,21.1,2020-08-06 00:00:00
 FOTOFOX AI-NZ adapter for Nikon F AI AIS mount lens to Nikon Z Z6 Z7 camera,26.0,2020-08-06 00:00:00
