title,price,dateNintendo wii rvl001 console with 4 games.,68.79,2020-07-22 00:00:00
Nintendo Wii  Black Console bundle,98.0,2020-07-22 00:00:00
Nintendo Wii Limited Edition Console - Blue,195.5,2020-07-22 00:00:00
"Nintendo Wii White Console (NTSC)with games cords,controller and wheel.",106.14,2020-07-22 00:00:00
"Nintendo Wii U 32 GB Black System Bundle Console Gamepad, Games & Controllers",232.15,2020-07-22 00:00:00
"White nintendo Wii with controllers, pro controllers, nunchuck, Mario games",152.71,2020-07-22 00:00:00
Nintendo Wii White Console (NTSC),38.4,2020-07-22 00:00:00
"Nintendo Wii + Wii Sports, White Console (NTSC)",63.95,2020-07-22 00:00:00
"Nintendo Wii Console,power supply, game bundle 4 parts or repair untested ",40.99,2020-07-22 00:00:00
"Unopened Orginal Nintendo Wii, About 10-15 Years Old.",307.64,2020-07-22 00:00:00
"Lot of 5 Vintage Game Consoles, N64, SEGA Genesis, Playstation 1, Nintendo WII",79.68,2020-07-22 00:00:00
Nintendo Wii GameCube Compatible FULL SET w/ Wiimote & Games (RCL-001,64.98,2020-07-22 00:00:00
Nintendo Wii White Console (NTSC),55.8,2020-07-22 00:00:00
Nintendo - Wii U WUP-101 ( LOT 14928) ,110.5,2020-07-22 00:00:00
Nintendo Wii Console Game Accessory Lot - GameCube Compatible 2 Wii Motion Plus!,164.47,2020-07-22 00:00:00
"NINTENDO Wii LIMITED EDITION BLUE CONSOLE, GAMES & ACCESSORIES BUNDLE PRE-OWNED ",127.5,2020-07-22 00:00:00
LIMITED EDITION RED NINTENDO Wii CONSOLE W/ POWER CORD RVL-001 ,66.0,2020-07-22 00:00:00
Nintendo Wii System White Console RVL-001 GameCube Compatible Console Game Lot,130.5,2020-07-22 00:00:00
Nintendo Wii Bundle White Console Game Model RVL-001 wii sports wii play,90.2,2020-07-22 00:00:00
Nintendo Wii Console (Red) RVL-001 Console + All Cords GAMECUBE COMPATIBLE ,77.0,2020-07-22 00:00:00
Nintendo Wii White Console (NTSC),58.99,2020-07-22 00:00:00
Nintendo Wii White Console (NTSC),100.99,2020-07-22 00:00:00
Nintendo Wii Bundle with 8 Games PLUS Crossbow AND 3 Controllers (tested) MORE!,153.8,2020-07-22 00:00:00
Nintendo Wii Video Game System 3 REMOTES Console WHITE,76.05,2020-07-22 00:00:00
Nintendo Wii Video Game System Console Bundle RVL-101 Blue,42.19,2020-07-22 00:00:00
Lot of 4 Nintendo Wii CONSOLES RVL-101(USA) RVL-001(USA) RED BLACK BRED,172.49,2020-07-22 00:00:00
Lot of 4 Nintendo Wii Consoles RVL-001(USA) White,157.5,2020-07-22 00:00:00
Lot of 4 Nintendo Wii Consoles RVL-001(USA) WHITE,157.5,2020-07-22 00:00:00
Nintendo Wii Console  bundle,225.0,2020-07-22 00:00:00
Nintendo Wii Console RVL-001 + STUFF  ( LOT 14920) ,95.0,2020-07-22 00:00:00
Nintendo RVL-101 Wii Console - White,79.33,2020-07-22 00:00:00
Nintendo Wii Game Console System with Nunchuck Wiimote and Motion Sensor Bundle,42.75,2020-07-22 00:00:00
Nintendo Wii U 32GB Black Handheld System !!Tested!!,175.15,2020-07-22 00:00:00
Nintendo Wii Video Game Consoles White/Red,53.31,2020-07-22 00:00:00
Nintendo Wii Video Game Consoles White/Black,58.2,2020-07-22 00:00:00
"Nintendo Wii Sports Pack White Console (Complete Box), Original Packaging",99.5,2020-07-22 00:00:00
"Nintendo Wii U Console - 32gb Black with Extras!! Mario Kart, Zelda, Donkey Kong",196.1,2020-07-22 00:00:00
Nintendo Wii UÂ Super Mario Deluxe Set 32GB,113.3,2020-07-22 00:00:00
Nintendo Wii Mini 8GB Red Console (with two controllers and one nunchuck),86.7,2020-07-22 00:00:00
Nintendo Wii Console with 7 Games + 2 Controllers + Wii Board Included,157.25,2020-07-22 00:00:00
Nintendo Wii White Console - no controllers,49.85,2020-07-22 00:00:00
Nintendo Wii U 32GB Deluxe Black Complete Console With Box *NO GAME*,192.49,2020-07-22 00:00:00
Nintendo Wii White Console - CONSOLE ONLY,51.4,2020-07-22 00:00:00
"Nintendo Wii U (Black) with GamePad, Pro controllers, Wii Remote, and Sensor Bar",190.9,2020-07-22 00:00:00
Modded Nintendo Wii,140.0,2020-07-21 00:00:00
Nintendo Wii Black Console INCLUDES Wii MOTION PLUS CONTROLLER AND CABLES/STANDS,69.95,2020-07-21 00:00:00
Limited Edition Red Nintendo Wii w/ Accessories Fully FunctionalÂ ,89.95,2020-07-21 00:00:00
Nintendo Wii U The Legend of Zelda: The Wind Waker HD Deluxe Set 32GB+4DigiGames,211.95,2020-07-21 00:00:00
Nintendo Wii Sports Game Console Bundle Mario Kart New Super Mario Bros Nunchuck,117.95,2020-07-21 00:00:00
"Nintendo Wii Rvl 101 / Not Backwards Compatable, Console Only, with 1 controller",38.26,2020-07-21 00:00:00
Nintendo Wii 320GB HDD (w/ 77games) (Listing B),100.0,2020-07-21 00:00:00
Nintendo Wii Bundle Black Console,36.94,2020-07-21 00:00:00
Nintendo Wii U HD Deluxe Set 32GB Black...,234.8,2020-07-21 00:00:00
Nintendo Wii U Console Bundle + 4 Games (tested/played) Mario Kart 8 Donkey Kong,259.46,2020-07-21 00:00:00
Nintendo Wii White Console (NTSC),76.0,2020-07-21 00:00:00
Nintendo Wii Bundle with Games,207.56,2020-07-21 00:00:00
Nintendo Wii U Console - Black 32GB Value Bundle!,347.57,2020-07-21 00:00:00
Nintendo Wii White Console (NTSC) bundle. Gamecube games compatible. ,122.8,2020-07-21 00:00:00
Nintendo Wii (RVL-001),89.41,2020-07-21 00:00:00
Nintendo Wii (RVL-001),67.55,2020-07-21 00:00:00
Nintendo Wii Mini (RVL-201),67.93,2020-07-21 00:00:00
Nintendo Wii (RVL-001),83.45,2020-07-21 00:00:00
Nintendo Wii (RVL-001),67.55,2020-07-21 00:00:00
Nintendo Wii (RVL-001),84.21,2020-07-21 00:00:00
Nintendo Wii (RVL-001),67.55,2020-07-21 00:00:00
Nintendo Wii (RVL-001),67.55,2020-07-21 00:00:00
Nintendo Wii (RVL-001),89.41,2020-07-21 00:00:00
Nintendo Wii (RVL-001),74.28,2020-07-21 00:00:00
Nintendo Wii (RVL-001),83.45,2020-07-21 00:00:00
Nintendo Wii (RVL-001),82.69,2020-07-21 00:00:00
"Nintendo Wii Original Game Console Bundle W/ Controller, Cords, 5 Games... Works",72.99,2020-07-21 00:00:00
Nintendo RVL-101 Wii Console - White,56.0,2020-07-21 00:00:00
Nintendo Wii White Game Console W/ Controller Games Bundle Tested in Box,87.0,2020-07-21 00:00:00
"Nintendo Wii console with controller, Mario Galaxy 1, 2, Super Mario Bros Wii",93.0,2020-07-21 00:00:00
Nintendo Wii - Original 8GB White Home Console,43.0,2020-07-21 00:00:00
Nintendo Wii U 32GB Console Deluxe Set with Super Mario 3D World - BlackÂ ,201.5,2020-07-21 00:00:00
Nintendo RVL-101 Wii Console - White,57.0,2020-07-21 00:00:00
Nintendo Wii U 32GB Black Console | Complete  | Game Pad  | Sensor Bar | TESTED,141.3,2020-07-21 00:00:00
Nintendo RVL-101 Wii Console - White,230.01,2020-07-21 00:00:00
"Nintendo Wii White Console Bundle w/ 2 Games (Zelda, Smash Brothers Installed)",97.01,2020-07-21 00:00:00
Nintendo Wii Console w/ 5 Games & Extras Mario Party Galaxy Donkey Kong HDMI,174.25,2020-07-21 00:00:00
HUGE LOT Nintendo Wii Limited Edition Red Console + Wii Sports + Mario + Brawl,111.0,2020-07-21 00:00:00
Nintendo RVL-101 Wii Console BLACK 16 Games 2 CONT. & CHUCKS + hi def CABLES,126.9,2020-07-21 00:00:00
Nintendo Wii Console Bundle - SEE DESCRIPTION!,172.45,2020-07-21 00:00:00
Nintendo Wii White Console (RVL-001 (USA)) w/ Just Dance / Supper Mario Bros +++,80.99,2020-07-21 00:00:00
Nintendo Wii Game Console RVL-001 (USA) w/ Wii Play / Madden '09 and Controller,55.01,2020-07-21 00:00:00
Nintendo Wii Console (White) RVL-001 + All Cords + Wii Adapter GAMECUBE COMP,76.0,2020-07-21 00:00:00
"Nintendo Wii Red Console + 2 Controllers, Nunchuck, Controller Cases, 7 Games",129.99,2020-07-21 00:00:00
Nintendo Wii Console Lot W/ Sensor Bar + More Accessories + Fit ,49.03,2020-07-21 00:00:00
Nintendo Wii White Console With Games,100.85,2020-07-21 00:00:00
Nintendo Wii Console - White (THIS DOES NOT READ DISCS),17.5,2020-07-21 00:00:00
Nintendo Wii WHITE Video Game Console System Bundle Online RVL-001 GameCube Port,44.0,2020-07-21 00:00:00
"Nintendo Wii Console Bundle w/ 2 Controllers,  games (Mario Kart) + More",167.3,2020-07-21 00:00:00
Nintendo wii  console with ac adapter and remote only,63.67,2020-07-21 00:00:00
nintendo wii console bundle LU330370538 controllers ,60.27,2020-07-21 00:00:00
Nintendo Wii U 32 GB Deluxe Set Box 5 Video Games Mario,351.25,2020-07-21 00:00:00
Nintendo Wii White Video Game Console (RVL-001) Bundle - GameCube Compatible,64.17,2020-07-21 00:00:00
"Nintendo Wii Console Bundle (fully tested, great condition, smoke-free)",127.5,2020-07-21 00:00:00
Nintendo Wii Mega Pack Black Console,74.2,2020-07-21 00:00:00
nintendo wii console With Games And Extras,100.0,2020-07-21 00:00:00
Nintendo Wii White Console with Wii Sports and Original Box,86.55,2020-07-21 00:00:00
Nintendo Wii Console w/ Extras - Mario Kart!,147.51,2020-07-21 00:00:00
Lot of 2 Nintendo Wii Console ONLY White Model RVL-001 FOR PARTS OR REPAIR AS-IS,46.69,2020-07-21 00:00:00
Nintendo Wii White Console (NTSC) RVL-001 + 2 CONT. & CHUCKS + 15 GAMES ,142.26,2020-07-21 00:00:00
Nintendo Wii Video Game Console Black Bundle,110.23,2020-07-21 00:00:00
Nintendo Wii Video Game Console Bundle,103.22,2020-07-21 00:00:00
Nintendo Wii Video Game Console Bundle,107.32,2020-07-21 00:00:00
Nintendo Wii  With Tons Of Games & Accessories,209.0,2020-07-21 00:00:00
Nintendo Wii White Console (NTSC) With Games And Controllers,142.87,2020-07-21 00:00:00
Nintendo Wii Mario Kart Pack Black Console (NTSC-U/C (US/CA)),70.03,2020-07-21 00:00:00
Nintendo wii white console rvl-001,30.0,2020-07-21 00:00:00
Nintendo wii console ,60.0,2020-07-21 00:00:00
Nintendo Wii Used Super Mario Bros. Pack Red Console (RCLSRAAK),143.35,2020-07-21 00:00:00
Nintendo Wii U Console Model: WUP-101(02) VS 5.5.1U Black - 32GB w Power Supply,52.0,2020-07-21 00:00:00
"Nintendo Wii U Deluxe 32GB+ Game Pad+10 Games, 2Controller&Nunchuck & ALL WIRES",228.75,2020-07-21 00:00:00
nintendo wii console,93.76,2020-07-21 00:00:00
NINTENDO Wii BUNDLE: CONSOLE GAMES CONTROLLERS,91.01,2020-07-21 00:00:00
"Nintendo Wii Mini Includes Mariokart (NEW, OPEN BOX) Free Shipping",102.67,2020-07-21 00:00:00
Nintendo wii u games bundle,7.2,2020-07-21 00:00:00
NINTENDO Wii W/ Mario Party 8 Installed,65.0,2020-07-21 00:00:00
Nintendo Wii U with Gamepad and 2 Controllers has some issues playing some discs,122.5,2020-07-21 00:00:00
"Nintendo Wii U 32 GB console lot + 5 video games Super smash bros , Yoshis",177.5,2020-07-21 00:00:00
Nintendo Wii RV-101 Black Console Bundle + Balance Board + Games,153.87,2020-07-21 00:00:00
Nintendo Wii Replacement Console Only White RVL-001 For Parts,38.65,2020-07-21 00:00:00
Nintendo Wii U Mario Kart 8 Deluxe Set,190.89,2020-07-21 00:00:00
WORKING NINTENDO WII BUNDLE WHITE ONLINE RVL-001 COMPATIBLE WITH GAMECUBE!!!!!,60.99,2020-07-21 00:00:00
Nintendo Wii Console - Black - For Parts,17.5,2020-07-21 00:00:00
Nintendo Wii Red Gamecube Compatible RVL-001 Console System F Cond Red cntr,100.8,2020-07-21 00:00:00
Nintendo Wii White Complete Console with Original Box and Wii Sports Monkey Ball,116.95,2020-07-20 00:00:00
"Nintendo Wii Game System with console, Model number RVL-001 ",100.0,2020-07-20 00:00:00
NINTENDO Wii w/ Accessories,69.05,2020-07-20 00:00:00
NINTENDO Wii W/ Accessories,78.0,2020-07-20 00:00:00
NINTENDO Wii W/ Accessories,80.0,2020-07-20 00:00:00
nintendo wii u console bundle Model wup-101,76.0,2020-07-20 00:00:00
Nintendo Wii White Console (NTSC),71.01,2020-07-20 00:00:00
Nintendo Wii Console White GameCube compatible 4 wands 4 Wheels 14 GamesÂ ,269.71,2020-07-20 00:00:00
Black Nintendo Wii Bundle + Classic Controller Mario Kart 64 Donkey Kong SNES,118.45,2020-07-20 00:00:00
Nintendo Wii U The Legend of Zelda: The Wind Waker HD Deluxe Set 32GB Black...,173.55,2020-07-20 00:00:00
Nintendo Wii /2 remotes/2 nunchucks+2 Games,75.0,2020-07-20 00:00:00
"Nintendo Wii U Deluxe 32GB Black, Pro Controller, Breath of the Wild, LEGO game",174.25,2020-07-20 00:00:00
Nintendo Wii White Console (NTSC),114.2,2020-07-20 00:00:00
Nintendo Wii Console with wii remotes,86.0,2020-07-20 00:00:00
nintendo wii u - 32gb black deluxe set with several games included,184.8,2020-07-20 00:00:00
"Nintendo Wii U 32GB Console Deluxe with Nintendo Land, 16 Games Extra Contollers",235.04,2020-07-20 00:00:00
Nintendo Wii White Console Bundle + 14 Video Games,193.5,2020-07-20 00:00:00
White Nintendo Wii Console With Classic Mario - Metroid - Zelda - Free Shipping,69.99,2020-07-20 00:00:00
Nintendo Wii U 32GB Deluxe Pro MotionPlus Nunchuck Classic Controllers 3 Games,255.0,2020-07-20 00:00:00
Limited  Edition  Blue Nintendo Wii Console Bundle with games and homebrew,130.0,2020-07-20 00:00:00
"Nintendo Wii White Console (NTSC) W/ 2 Controllers/Nunchucks, Cables, and Games",142.5,2020-07-20 00:00:00
Nintendo Wii U Deluxe 32GB Black Console - Mario Kart 8 - Zelda + Kirby + More,260.0,2020-07-20 00:00:00
nintendo wii console bundle,77.0,2020-07-20 00:00:00
NINTENDO Wii BUNDLE: CONSOLE GAMES CONTROLLERS,155.81,2020-07-20 00:00:00
nintendo wii console bundle,107.5,2020-07-20 00:00:00
Nintendo Wii Replacement Console With Cables Black RVL-101 (USA) w Just Dance 4,63.8,2020-07-20 00:00:00
"Nintendo Wii U 160GB Console Bundle w/ 3 Games, Pro Controller, and More",213.15,2020-07-20 00:00:00
Two Nintendo Wii's Black and White *for parts*,26.89,2020-07-20 00:00:00
"Nintendo Wii RVL-001, Complete! with Controllers, Madden 07. Plays Gamecube",65.2,2020-07-20 00:00:00
"Nintendo Wii Bundle Black various items included UNTESTED 3 controllers, cables",56.9,2020-07-20 00:00:00
Nintendo Wii U Super Mario 3D World With Box and 6 Games Included,226.25,2020-07-20 00:00:00
Nintendo Wii U 32GB Black WUP-010 WUP-101(02) + 6 GAMES Mario Kart 8 Splatoon +,210.38,2020-07-20 00:00:00
Nintendo Wii (RVL-001) White Console OEM Bundle - 2 Controllers - Clean & Tested,80.0,2020-07-20 00:00:00
Nintendo Wii Console Wii Sports Bundle Including Mario Kart and more Mario Games,250.5,2020-07-20 00:00:00
"nintendo wii u console bundle, 3 controllers and many games NO RESERVE",216.7,2020-07-20 00:00:00
Nintendo Wii Mini Console With Mario Wii,73.38,2020-07-20 00:00:00
Nintendo Wii White Console RVL-001 Game Cube Compatible ~BUNDLE~ Tested!,56.0,2020-07-20 00:00:00
Nintendo Wii White Handheld System,80.0,2020-07-20 00:00:00
Nintendo Wii Console Star Wars Bundle With 2 Controllers 5 Games RVL-001 TESTED,89.2,2020-07-20 00:00:00
Nintendo Wii Bundle - Great Collection - Rare Tony Hawk Games with Skateboard,136.78,2020-07-20 00:00:00
Nintendo Wii â˜†500GB HDDâ˜†50+ LEGIT Wiigames+Retro Emulatorsâ˜† With all accessories,164.4,2020-07-20 00:00:00
Nintendo Wii U Mario Kart 8 & PokÃ©mon Pokken Tournament,153.5,2020-07-20 00:00:00
Nintendo Wii Holiday Bundle Black Console,70.75,2020-07-20 00:00:00
"Nintendo Wii with Mario Kart, Zelda, Accessories, (10 Games)! Tested + Working!",145.0,2020-07-20 00:00:00
"Nintendo Wii Black Game Console GameCube Compatible, 2 Wiimotes, 3 Hunting Games",65.5,2020-07-20 00:00:00
Nintendo Wii U Basic set 8GB White console System Mario Maker 2 pro controllers ,177.5,2020-07-20 00:00:00
Nintendo Wii White Console - Box And Manuals Only,26.9,2020-07-20 00:00:00
Nintendo Wii U Mario Kart 8 Deluxe Bundle,163.49,2020-07-20 00:00:00
"Nintendo Wii U 32GB Console Deluxe Set With 7 Games, 2x Pro Controllers And More",242.5,2020-07-20 00:00:00
Nintendo Wii White Console (NTSC) RVl 001,65.99,2020-07-20 00:00:00
Nintendo Wii-U 32GB Console - Black No Handheld,62.0,2020-07-20 00:00:00
Nintendo Wii White Video Game Console (RVL-001) Bundle - GameCube Compatible,82.7,2020-07-20 00:00:00
Nintendo Wii White Console (NTSC) With Accessories+400gb Hard Drive 182 games,120.5,2020-07-20 00:00:00
Nintendo Wii  Console Complete Bundle Gamecube Compatible Tested 6 Bonus Games,99.78,2020-07-20 00:00:00
Nintendo Wii White Console (NTSC),102.11,2020-07-20 00:00:00
Nintendo Wii Console (NTSC) RVL-001 w/ 2 Controllers & Nunchucks Wii Sports!!!,95.99,2020-07-20 00:00:00
Nintendo Wii White Console ,50.5,2020-07-20 00:00:00
Nintendo Wii U 32GB Black Handheld System Console Bundle and 9 games,181.5,2020-07-20 00:00:00
"Nintendo Wii U 32GB Black - Extra controllers, wheels and games",203.54,2020-07-20 00:00:00
Nintendo Wii U WHITE 8GB Replacement Console Only WUP-001 (02) Tested + EXTRAS,59.0,2020-07-20 00:00:00
"Nintendo Wii White Console (NTSC) Cables included, No controller. Tested.",62.21,2020-07-20 00:00:00
Nintendo Wii Sports Resort with games and Extras  Cooking Mama  Mario Galaxy,154.98,2020-07-20 00:00:00
"Nintendo Wii Black Console, Used in original box w/games",120.2,2020-07-20 00:00:00
Nintendo Wii White Console (NTSC) RVL-001 Bundle,100.0,2020-07-20 00:00:00
NINTENDO WII U REPLACEMENT 32GB BLACK CONSOLE SYSTEM with Power/Video Cables,50.0,2020-07-20 00:00:00
Nintendo Wii Console Power Brick And A/V- Only Black | RVL-101 (USA) Working,51.99,2020-07-20 00:00:00
"Nintendo Wii System Console White, Tested, Missing Top Seal, Read Description",64.15,2020-07-20 00:00:00
Nintendo Wii U Launch Edition 32GB Black Handheld System,195.4,2020-07-19 00:00:00
"Nintendo Wii - Original 8GB White Home Console, Controls, 6 games,Balance board",82.01,2020-07-19 00:00:00
Black NINTENDO Wii Console + Sports Resort Bundle!! NEW in Box!! Motion PlusÂ ,411.0,2020-07-19 00:00:00
"Nintendo Wii U Mario Kart 8 Bundle - 4 Controllers, 7 Games And More!",200.0,2020-07-19 00:00:00
Nintendo Wii BOX ONLY Original Boxes Packaging Lot Good Condition .01 Auction!,15.4,2020-07-19 00:00:00
Nintendo RVL-101 Wii game console bundle with extras! TESTED - Fully functional ,95.9,2020-07-19 00:00:00
"Nintendo Wii Console RVL-001 (1 Controller + Accessories, 3 Games) GREAT SHAPE",71.0,2020-07-19 00:00:00
"Nintendo Wii With Everything And Extras , MINT CONDITION",145.2,2020-07-19 00:00:00
Nintendo wii console and games Game Lot,65.0,2020-07-19 00:00:00
Nintendo Wii U Mario Kart Bundle w/ Extra Games & AccessoriesÂ ,226.15,2020-07-19 00:00:00
Nintendo Wii RVL001 Console Only .01 TESTED WORKING Played 2x! Replacement White,78.77,2020-07-19 00:00:00
"Nintendo Wii White Console With 5 Games, Zapper, And One Wii Mote Plus Nunchuck",106.85,2020-07-19 00:00:00
nintendo wii bundle with games,156.34,2020-07-19 00:00:00
Nintendo Wii White Console (NTSC) (Please Read Description For Details),46.49,2020-07-19 00:00:00
"Nintendo Wii U Deluxe Set 32GB Black Bundle Lot W/ Pro Controller, 9 Games",187.45,2020-07-19 00:00:00
Nintendo RVL-101 Wii Console - White,83.29,2020-07-19 00:00:00
Nintendo Wii White Console (NTSC) Bundle in acceptable condition!!,54.0,2020-07-19 00:00:00
Nintendo Wii White Console (NTSC),58.0,2020-07-19 00:00:00
NINTENDO WII COMPLETE SYSTEM TESTED WORKING w/ 5 GMS. SUPER SMASH RESORT &  MORE,91.0,2020-07-19 00:00:00
"Lot of 3 Nintendo Wii Consoles RVL-00, Tested.  Free ship",110.04,2020-07-19 00:00:00
Nintendo Wii U Super Mario 3D World Deluxe Set 32GB Black Console Complete Box,239.9,2020-07-19 00:00:00
"nintendo wii u console lot of 2- 32gb black, Wii system Smash Bros. Kirby *Read*",307.0,2020-07-19 00:00:00
"Nintendo Wii White Console, 2 Controllers/Nunchucks, 7 Games, DDR Mat, More",144.05,2020-07-19 00:00:00
Nintendo Wii Black Console And Video Game Lot Controllers Wii Play Carnival Nice,100.93,2020-07-19 00:00:00
Nintendo Wii U Mario & Luigi Premium Pack 32GB Black Handheld System WITH EXTRAS,172.5,2020-07-19 00:00:00
Nintendo Wii U Deluxe 32GB Console - Black.Â  Includes four games,126.95,2020-07-19 00:00:00
Nintendo Wii White Video Game Console Wii Sports Wii Play,101.7,2020-07-19 00:00:00
*Pristine* White Nintendo Wii Console Bundle w/ Cables Remote (RVL-001) TESTED,102.95,2020-07-19 00:00:00
Nintendo Wii Super Mario Bros Bundle Black Console Wii sports  Huge Games Lot,175.07,2020-07-19 00:00:00
NINTENDO WII COMPLETE SYSTEM TESTED WORKING w/ 5 GMS. SUPER MARIO BROS. &  MORE,91.01,2020-07-19 00:00:00
Nintendo Wii U 32GB Black Console with 4 Mario Games and Official Pro Controller,270.5,2020-07-19 00:00:00
Nintendo Wii White Video Game Console Wii Sports Wii Play,86.38,2020-07-19 00:00:00
"Modded Nintendo Wii + 128gb USB Drive + 32gb SD Card, HDMI Adapter, In Box",157.0,2020-07-19 00:00:00
NINTENDO WII WHITE CONSOLE BUNDLE WITH REMOTE NUNCHUCK TESTED WORKING,114.05,2020-07-19 00:00:00
"Nintendo Wii bundle with console, two controllers, 6 wii games - READY TO PLAY",151.0,2020-07-19 00:00:00
Nintendo Wii U Deluxe 32GB Black System Console+EIGHT GAMES- Excellent Condition,257.35,2020-07-19 00:00:00
Nintendo Wii Console White System RVL-001 Repair or Parts Read Description,17.05,2020-07-19 00:00:00
Nintendo Wii Original Black Console + Accessories As-Is (Worked Last Tested),80.59,2020-07-19 00:00:00
Nintendo Wii U 32 GB Console Bundle with Games,185.35,2020-07-19 00:00:00
Nintendo Wii White Video Game Console NO Remotes,82.85,2020-07-19 00:00:00
"Nintendo Wii U 32GB The Legend of Zelda w/  Mariokart 8 , (15 games)+ 64GB USB ",227.49,2020-07-19 00:00:00
Nintendo Wii White Handheld System- Gamecube compatible!! Tested!!,80.05,2020-07-19 00:00:00
Nintendo Wii White Console and Accessories,70.95,2020-07-19 00:00:00
"Nintendo Wii  Black Console Mario brother, Zelda, 2 controllers, Donkey kong",96.1,2020-07-19 00:00:00
"nintendo wii u console bundle, 6 games, 2 controllers",182.95,2020-07-19 00:00:00
Nintendo Wii U Launch Edition With 4 Games and Mario Kart 8 and BrosÂ ,162.05,2020-07-19 00:00:00
"Nintendo Wii Console Bundle/Lot w/ 9 Games, Remote & Much More!",109.0,2020-07-19 00:00:00
"Nintendo Wii Sports Pack White Console (NTSC) w/HDMI, games & original box",145.5,2020-07-19 00:00:00
Nintendo Wii - Original 8GB White Home Console,62.0,2020-07-19 00:00:00
Nintendo RVL-101 Wii Console - White including Wii Fit and Mario Cart Bundle,177.5,2020-07-19 00:00:00
Nintendo Wii U Mario Kart 8 Deluxe Bundle 32GB Black Console System,202.5,2020-07-19 00:00:00
Nintendo Wii White Console (USED) with Super Smash Bros Brawl READ DESCRIPTION ,61.0,2020-07-19 00:00:00
Nintendo Wii White Console (NTSC),14.0,2020-07-19 00:00:00
"Nintendo Wii Console w/ 4 Controllers, 6 games   + More",112.02,2020-07-19 00:00:00
"Nintendo Wii Console RVL-001 8 games, 2 wireless controllers with charger",101.21,2020-07-19 00:00:00
Nintendo Wii Console RVL-001 - No Controllers Included - Read Description 5520c,33.99,2020-07-19 00:00:00
Nintendo Wii console Game Cube Compatible Model RVL-001 with box and manual,71.05,2020-07-19 00:00:00
Nintendo Wii Red Console Bundle - No Box (TESTED AND WORKS WELL),218.05,2020-07-19 00:00:00
BRAND NEW Nintendo Wii White Console READ DISCRIPTION RVL-001 (USA) 2006,102.51,2020-07-19 00:00:00
Nintendo Wii U Launch Edition 32GB Black GOOD CONDITIONÂ ,187.55,2020-07-19 00:00:00
Nintendo Wii U 32GB Console - Black,141.7,2020-07-19 00:00:00
Nintendo Wii,222.5,2020-07-19 00:00:00
"Nintendo Wii Console Lot - 2 Games, Cords, One Controller with Extension, Extras",93.9,2020-07-19 00:00:00
Nintendo Wii Bundle Wii Fit plus with Balance Board and Games,75.94,2020-07-19 00:00:00
Black Nintendo Wii Console CIB Mario Kart Bundle + (4) Controllers + (20) Games,252.5,2020-07-19 00:00:00
Nintendo Wii With Wii Sports + Wii Sports Resort Black Console,44.95,2020-07-19 00:00:00
Nintendo Wii Sports Pack White Console,100.95,2020-07-19 00:00:00
Nintendo Wii White Console With 12 Games,118.99,2020-07-19 00:00:00
"HUGE nintendo Wii bundle: console,cables,controller,games,tennis,baseball TESTED",191.5,2020-07-19 00:00:00
Nintendo Wii U Super Mario 3D World Deluxe Set 32GB Black Console + extras,415.75,2020-07-19 00:00:00
Nintendo Wii U 8GB White Console System & Gamepad + Cables *FULLY FUNCTIONAL*,174.7,2020-07-19 00:00:00
Nintendo Wii White Console Hacked Read Description,27.95,2020-07-19 00:00:00
"Nintendo wii bundle tested - Includes game system, remotes, nunchucks, and games",156.46,2020-07-19 00:00:00
Nintendo RVL-101 Wii Console - White,22.5,2020-07-19 00:00:00
Nintendo Wii White Console BUNDLE 5 Games TESTED Just Dance Wii Play Rayman,70.88,2020-07-19 00:00:00
Nintendo Wii Console + 2 Controllers + 2 Nunchucks + Motion Bar  - NO RESERVE,76.0,2020-07-19 00:00:00
"Nintendo Wii Console With 23 Games, 4 Controllers And Controller Accessories",148.0,2020-07-19 00:00:00
Nintendo Wii White Console BUNDLE 7 Games TESTED Just Dance 2 Controllers Mic,108.2,2020-07-19 00:00:00
Nintendo Wii Console Bundle With 2 Controllers RVL-001,69.99,2020-07-19 00:00:00
Nintendo Wii U Premium Pack 32GB Black In good conditions with accessories,170.0,2020-07-19 00:00:00
Nintendo Wii U Deluxe 32 GB Console/Gamepad/Cords + Minecraft & 3 Wii Remotes,204.25,2020-07-19 00:00:00
Nintendo wii console bundle,97.0,2020-07-19 00:00:00
Nintendo Wii - Original 8GB White Home Console,47.0,2020-07-19 00:00:00
Nintendo Wii Replacement Console Only White RVL-001 GameCube TESTED,34.45,2020-07-19 00:00:00
Nintendo Wii,21.5,2020-07-19 00:00:00
NINTENDO WII BLUE WITH 2 WII REMOTES AND WII SPORTS,66.01,2020-07-19 00:00:00
Nintendo Wii Sports Complete Console w/ Accessories Wii Play + Extras!!!,159.3,2020-07-19 00:00:00
Nintendo Wii Console With Games Lot,53.0,2020-07-19 00:00:00
Nintendo Wii Video Game System Console Bundle Black 6 Games Controller and Gun,111.01,2020-07-19 00:00:00
Nintendo wii bundle with wii motion plus and balance board,86.7,2020-07-19 00:00:00
Nintendo Wii U Mario Kart 8 Deluxe Bundle (32GB) - w/ 3 add. Super Mario games ,166.5,2020-07-19 00:00:00
Nintendo Wii RVL-001 36 Games Rare Zelda Smash Broâ€™s Mario Animal Crossing,341.56,2020-07-19 00:00:00
Nintendo Wii System Tested IOB,81.01,2020-07-19 00:00:00
Nintendo Wii System Tested IN ORIGINAL BOX,90.0,2020-07-19 00:00:00
Nintendo Wii System Tested & Wii SPORTS GAME,91.01,2020-07-19 00:00:00
038- Assorted Nintendo Wii Lot (Working & Clean),73.85,2020-07-19 00:00:00
Nintendo Wii System Tested,76.21,2020-07-19 00:00:00
