title,price,dateNintendo Wii Red Console bundle with 3 games,130.24,2020-06-28 00:00:00
Nintendo Wii console Red,66.99,2020-06-28 00:00:00
Nintendo Wii Console Bundle 15 games 4 controller MarioKart rechargeable battery,324.54,2020-06-28 00:00:00
Nintendo Wii Console System RVL001 White Remote Motion Plus & Nunchuk Wii Sports,72.51,2020-06-28 00:00:00
"Nintendo Wii U 32GB Deluxe Bundle Pack w 5 Remotes,6 Games, Disney Infinity Pack",267.55,2020-06-28 00:00:00
"Nintendo Wii Bundle Console, 4 Controllers, 2 Nunchuks, 2 Games, Charging Doc",157.49,2020-06-28 00:00:00
"Nintendo Wii Console (RVL-001) Bundle 2 Games, 2 Wii Remotes, & Cables, Tests OK",79.99,2020-06-28 00:00:00
Wii U Console with Super Mario 3D World and Nintendo Land TestedÂ ,175.5,2020-06-28 00:00:00
Nintendo Wii Console (White) - No Controllers,53.1,2020-06-28 00:00:00
Nintendo Wii U 32GB Console Bundle w/ Gamepad Pro Controller 5 Games Controllers,219.94,2020-06-28 00:00:00
Nintendo Wii White Console (NTSC) - Perfect Working Condition!!!,106.99,2020-06-28 00:00:00
Nintendo Wii Console White RVL-001 + 3 Games + 3 Remotes + 1 Nunchuck Mario Kart,116.01,2020-06-28 00:00:00
"Nintendo Wii with Controller, Nunchuks, and Sensor Bar",51.5,2020-06-28 00:00:00
Nintendo Wii U Mario Kart 8 Deluxe Bundle with Splatoon!!!!!!,190.05,2020-06-28 00:00:00
"Large Nintendo Wii Lot: Console, 8 Games, Balance Board & Accessories",209.87,2020-06-28 00:00:00
Nintendo Wii Console with controllers. It's ready to play.,99.17,2020-06-28 00:00:00
Nintendo: Wii Video Game Console System (RVL-001) (WHITE),67.3,2020-06-28 00:00:00
NINTENDO WII COMPLETE SYSTEM TESTED WORKING w/ 6 GMS. SUPER MARIO BROS.& MORE !!,91.0,2020-06-28 00:00:00
Nintendo Wii U Deluxe 32GB with 3 Wii U Pro Controllers and WiiMote/nunchuck,192.5,2020-06-28 00:00:00
HUGE LOT NINTENDO Wii U 32GB CONSOLE (WUP-101-02) & GAMEPAD NINTENDOLAND BUNDLE,339.63,2020-06-28 00:00:00
"Nintendo Wii Console + 2 Controllers/Nunchucks + Mario Kart,Skyward Sword + MORE",161.09,2020-06-28 00:00:00
Nintendo Wii Ultimate Bundle Including Wii Sports!!,97.49,2020-06-28 00:00:00
NINTENDO WII COMPLETE SYSTEM TESTED WORKING w/ 6 GAMES WII SPORTS & MORE !!,88.0,2020-06-28 00:00:00
Nintendo Wii New Super Mario Bros. Pack Red Console (RCLSRAAK),97.95,2020-06-28 00:00:00
In Box Nintendo Wii U Super Mario 3D World Deluxe Set 32GB Black Console.,259.15,2020-06-28 00:00:00
Nintendo Wii White Console Bundle Lot Tested Working Links Crossbow 3 Games,64.0,2020-06-28 00:00:00
Nintendo Wii Console W/ 4 Controllers And Wheels Nunchucks Manuals Charging,86.99,2020-06-28 00:00:00
Nintendo Wii White with games Just Dance Dragon's Lair & More,67.87,2020-06-28 00:00:00
White Nintendo Wii Console Just Dance Edition Original Box,60.68,2020-06-28 00:00:00
Nintendo Wii With Wii Sports + Wii Sports Resort Black Console,99.0,2020-06-28 00:00:00
"Nintendo Wii RVL-101 Bundle with controllers, nunchuks, wheels, 11 Games - Black",169.97,2020-06-28 00:00:00
Nintendo Wii RVL-001 White Console System Bundle w/ Cables & Controllers,100.98,2020-06-28 00:00:00
Nintendo Wii White Game Console (RVL-001) GameCube Compatible - 15 games Tested,130.5,2020-06-28 00:00:00
Nintendo Wii Console Family Bundle With Motion Plus Tested Working & Batman Game,74.45,2020-06-28 00:00:00
"Nintendo Wii Game Console, Wii FIT Board 2 Remotes and 4 Wii Fit games IT WORKS!",158.94,2020-06-28 00:00:00
Nintendo Wii U 32GB with 8 games Amiibos and Pro Controller,200.5,2020-06-28 00:00:00
"Nintendo Wii White Console RVL-001 Game Cube Compatible Bundle 1 control, 7 game",67.0,2020-06-28 00:00:00
Nintendo Wii White Console (NTSC),61.0,2020-06-28 00:00:00
Nintendo Wii System Console Bundle with 6 Games 1 Controller RVL-001 TESTED,102.99,2020-06-28 00:00:00
Nintendo Wii System Console Bundle with 7 Games 1 Controller RVL-001 TESTED,70.99,2020-06-28 00:00:00
Nintendo Wii U 32GB Deluxe Set BUNDLE - w 6 Games / 7 controllers / in Orig Box!,222.49,2020-06-28 00:00:00
nintendo wii console sports bundle,111.89,2020-06-28 00:00:00
Nintendo Wii U 32GB System Console tested works great super smash Bros + extras,91.05,2020-06-28 00:00:00
Nintendo Wii U Deluxe 32 gb Black + 11 GAMES,181.39,2020-06-28 00:00:00
NINTENDO WII U REPLACEMENT 32GB BLACK CONSOLE SYSTEM ONLY WUP-101(02) NO GAMEPAD,56.0,2020-06-28 00:00:00
Nintendo Wii Console with Game and Accessories Bundle  Shown Working!,76.0,2020-06-28 00:00:00
Nintendo WII Red Console W 3 Zelda Mario Kart 3 controllers Steering Wheels +++,175.0,2020-06-28 00:00:00
Nintendo Wii With Wii Sports and Resort Black Console Bundle gamecube RVL-001 ,178.5,2020-06-28 00:00:00
Nintendo Wii U 8GB White Console with 9 games,201.05,2020-06-28 00:00:00
Nintendo Wii Console Bundle Black RVL-101 2 Controllers Cables Games Tested,96.05,2020-06-28 00:00:00
Nintendo Wii White Console (NTSC) Bundle With Wii Sports - Tested,79.64,2020-06-28 00:00:00
Nintendo Wii U System Black 32gb Sd Gamepad Games +More Bundle Lot (NO RESERVE),174.44,2020-06-28 00:00:00
"Nintendo Wii Console System Bundle w/4 Games (Tested, Cleaned)",101.05,2020-06-28 00:00:00
Nintendo Wii Console Bundle (2 Games),102.99,2020-06-28 00:00:00
"Nintendo Wii System/Console Mario Galaxy 1 & 2, Zelda Family Bundle with 2 Contr",145.5,2020-06-28 00:00:00
Nintendo Wii U console with 4 games,202.5,2020-06-28 00:00:00
Nintendo Wii Black Console - tested and working,82.95,2020-06-28 00:00:00
Nintendo RVL-101 Wii Console - White with Wii Sports and other games,91.45,2020-06-28 00:00:00
"Nintendo Wii Console Mario Kart BUNDLE Steering Wheels, Controllers, Plus games!",137.0,2020-06-28 00:00:00
"Nintendo Wii U Console, Gamepad /2 Games and (MarioKart 8",162.55,2020-06-28 00:00:00
Nintendo Wii U 32GB Console Deluxe Set + 3 remotes + 3 gamesÂ  - works great!,196.95,2020-06-28 00:00:00
nintendo wii bundle with games,107.11,2020-06-28 00:00:00
"Nintendo Wii Console Bundle (NTSC) w/ 2 Controllers, 4 games(Wii pLAY) RVL-101",96.8,2020-06-28 00:00:00
"Nintendo Wii  Console W/4 Wiimotes, 1 Nunchuck, accessories, and Mario kart",92.1,2020-06-28 00:00:00
Nintendo Wii RVL-101 Console bundle ,172.13,2020-06-28 00:00:00
"Nintendo Wii U Black 32GB Console + 4 Games - Mario Kart, Smash Bros, and more!",295.0,2020-06-28 00:00:00
Nintendo Wii system,53.8,2020-06-28 00:00:00
"Nintendo Wii Bundle, Console,Mario Kart w/2 Wheels, 2 Controllers, 2 Other Games",152.5,2020-06-28 00:00:00
Nintendo wii u console bundle,192.5,2020-06-28 00:00:00
Nintendo Wii With 3 Controllers + Mario Kart & Super Mario Bros,76.8,2020-06-28 00:00:00
Nintendo RVL-101 Wii Console - White*** Games And  One Controller Included***,82.85,2020-06-28 00:00:00
Nintendo Wii Console RVL-001 (GameCube Comp.) Bundle 2 Controllers 7 Games,80.19,2020-06-28 00:00:00
Nintendo Wii Mini 8GB Red Console ONLY,56.98,2020-06-28 00:00:00
TESTED - Nintendo Wii Blue Console Bundle - Original Box w/ Manuals. RVL-101,100.75,2020-06-28 00:00:00
Nintendo Wii ,51.0,2020-06-28 00:00:00
Nintendo Wii White (bundle),182.7,2020-06-28 00:00:00
Nintendo RVL-101 Wii Console - White,64.54,2020-06-28 00:00:00
Nintendo Wii Black Console (NTSC) with 2 Wii controller and games,47.55,2020-06-28 00:00:00
Red Super Mario Nintendo Wii System Bundle Console RVL-001 7 Games Motion+ M52,117.55,2020-06-28 00:00:00
Nintendo Wii U Black 32GB Mario Kart 8 Edition,176.91,2020-06-28 00:00:00
Nintendo Wii console bundle with Wii sports - excellent condition,93.15,2020-06-28 00:00:00
Nintendo Wii Mini 8GB Red Console With Mario Kart Bundle.,70.73,2020-06-28 00:00:00
"Nintendo Wii Console with 2 remotes,1 nunchuk and more!",51.6,2020-06-28 00:00:00
Nintendo Wii White Video Game Console (RVL-001) Bundle - GameCube Compatible,94.65,2020-06-28 00:00:00
[7 GAMES] Nintendo Wii U Launch Edition 32GB Black Handheld System With Games,256.23,2020-06-28 00:00:00
"Nintendo Wii Console White With Cables, Sensor Bar, and 1 Controller, Nunchuck",74.0,2020-06-28 00:00:00
Nintendo Wii Console Super Mario Broâ€™s Bundle Black Console Complete In Box,133.35,2020-06-28 00:00:00
"Nintendo Wii Console Mario Kart Bundle with Wii Sports, 2 Controllers & 2 Wheels",255.6,2020-06-28 00:00:00
Nintendo Wii White Console Rvl-001 w/ Accessories and Wii Cables,60.65,2020-06-28 00:00:00
"Nintendo Wii With Board, Controller, And Cords. Also Including Wii Fit",84.65,2020-06-28 00:00:00
Nintendo Wii Console (RVL-001) Bundle GameCube Compatible 2 Controllers 7 Games,89.05,2020-06-28 00:00:00
Nintendo Wii White Handheld System Bundle With Games And Controllers,65.0,2020-06-28 00:00:00
Nintendo Wii U Launch Edition 32GB Black and 5 Games SUPER MARIO 3D Is Download,110.1,2020-06-28 00:00:00
Nintendo Wii Console Bundle 2 Controllers Nunchuck 7 Games Fit Board,158.5,2020-06-28 00:00:00
Nintendo Wii Black Model Tested And Working With Cables,45.0,2020-06-28 00:00:00
Nintendo Wii System Tested,70.0,2020-06-28 00:00:00
"Nintendo Wii Wii Sports, Guitar Hero, Mario Kart, 2 Remotes, 1 Numchuk, 2 Wheels",124.44,2020-06-28 00:00:00
Nintendo Wii U - Zelda Limited Edition Console Lot - 10 Games - Pro Controller,402.62,2020-06-28 00:00:00
Nintendo Wii U Basic Set 8GB White System In Box Tested & Reset w/ 5 Games Mario,137.54,2020-06-28 00:00:00
"Nintendo WII RVL-001 Console with accessories, controllers and instruction bookl",86.0,2020-06-28 00:00:00
Nintendo Wii Sports Pack White Console (NTSC),119.43,2020-06-28 00:00:00
Nintendo RVL-101 Wii Console - White,76.67,2020-06-28 00:00:00
Nintendo Wii Console Bundle White System,106.53,2020-06-28 00:00:00
Nintendo Wii Holiday Bundle Black Console With Accessories Shown. - Sold As Is,71.9,2020-06-28 00:00:00
Nintendo Wii RVL-001 Backwards Compatible plus Wii Balance Board + games ,55.43,2020-06-28 00:00:00
Nintendo Wii U 32GB Console - Black (Console Only) - Parental Lock,59.25,2020-06-28 00:00:00
Nintendo Wii Console With Wii Sports And Super Mario Brothers Wii,101.63,2020-06-28 00:00:00
"Nintendo Wii Console + 2 Controllers + 4 Games â€” Galaxy, Sports, Play, New Blood",131.15,2020-06-28 00:00:00
Nintendo Wii - Original 8GB Black Home Console,50.0,2020-06-28 00:00:00
NINTENDO WII GAME SYSTEM - BUNDLE W/ ACCESSORIES,72.24,2020-06-27 00:00:00
Nintendo Wii Console Bundle Complete In Box with Four Games Wii Sports,138.0,2020-06-27 00:00:00
Nintendo Wii U Super Mario 3D World Deluxe Set 32GB Black Console with/ 3 gamesÂ ,199.39,2020-06-27 00:00:00
Nintendo Wii U Black Handheld System withÂ Wii U accessories and 38 Games,340.0,2020-06-27 00:00:00
Nintendo Wii U Launch Edition 32GB Bundle,152.5,2020-06-27 00:00:00
Nintendo Wii Console 9 Games 3 Controllers Bundle Mario FIFA Sim City ,160.04,2020-06-27 00:00:00
Nintendo Wii U 32GB Black System with 4 games,248.05,2020-06-27 00:00:00
Nintendo Wii - Original 8GB White Home Console,39.88,2020-06-27 00:00:00
Nintendo Wii U Deluxe 32GB Gaming Console System Bundle - Black - 5 Games.,200.05,2020-06-27 00:00:00
Nintendo Wii RVL-001 White Console + 2 Controllers + 2 Nunchucks + 3 Games + Box,130.01,2020-06-27 00:00:00
Nintendo Wii Console Bundle Black RVL-101 2 Controllers Cabl Es And 9 Games,199.49,2020-06-27 00:00:00
"Nintendo Wii U Deluxe 32GB Super Mario 3D World, Lego City Undercover Wii Mote",145.0,2020-06-27 00:00:00
"Nintendo wii (can play gamecube) with cables, with wii play",54.05,2020-06-27 00:00:00
Nintendo Wii can play gamecube  *PLEASE READ*,27.55,2020-06-27 00:00:00
nintendo wii bundle,60.4,2020-06-27 00:00:00
Nintendo Wii White Console (NTSC),61.0,2020-06-27 00:00:00
Nintendo Wii White Console Bundle w/ Wii Sports,169.49,2020-06-27 00:00:00
"Nintendo Wii System/Console Wii Fit Plus & 2 Other Games, 4 Controllers Bundle",122.51,2020-06-27 00:00:00
Nintendo RVL-101 Wii Console - White,32.2,2020-06-27 00:00:00
Nintendo Wii System Bundle With Games,140.5,2020-06-27 00:00:00
Nintendo Wii Console & Wii Fit Balance Board & Games Bundle Open Box Mint!,187.5,2020-06-27 00:00:00
"Nintendo wii Console with 4 Controllers, Wheel, Charger and Adapter Included ",112.05,2020-06-27 00:00:00
"Nintendo Wii White Video Game Console Bundle + 4 Games, Controllers",156.02,2020-06-27 00:00:00
NINTENDO Wii BUNDLE WHITE CONSOLE (RVL-001) 20 GAMES - CONTROLLERS - NUNCHUCKS,135.45,2020-06-27 00:00:00
Nintendo wii Only Console White RVL-001 GameCube Compatible TESTED missing door,33.99,2020-06-27 00:00:00
Nintendo Wii CONSOLE ONLY White RVL-001 GameCube Compatible TESTED missing door,29.49,2020-06-27 00:00:00
Nintendo Wii Sports Bundle + remote + nunchuck + all cords TESTED,87.0,2020-06-27 00:00:00
Nintendo Wii Console Bundle - White - COMPLETE! TESTED Wii Fit plus 6 Games,141.04,2020-06-27 00:00:00
NO RESERVE! Nintendo Wii System & 20 Games Lot w/ Mario Sonic Skylander ect,236.49,2020-06-27 00:00:00
Nintendo Wii U 32GB Console Deluxe Set with Nintendo Land - Black (WUPSKAFB),164.25,2020-06-27 00:00:00
Nintendo Wii U 32GB Black Console. Includes Mario Party 10. In original box WiiU,174.5,2020-06-27 00:00:00
Nintendo Wii U 32GB Complete with accessories and great game collection,265.5,2020-06-27 00:00:00
Huge Nintendo Wii System Bundle with 7 Games - Softmodded Retro Gaming ,122.5,2020-06-27 00:00:00
Nintendo Wii U 32GB Video Game Console System Bundle With 4 GAMES!,253.4,2020-06-27 00:00:00
Nintendo Wii Console Bundle - White - COMPLETE! TESTED Wii Fit plus 2 Games,143.04,2020-06-27 00:00:00
"Nintendo Wii Bundle, Console,Mario Kart w/2 Wheels, 2 Controllers, 2 Other Games",168.5,2020-06-27 00:00:00
"Nintendo Wii U Bundle- Console, Controllers And Games",148.6,2020-06-27 00:00:00
Nintendo Wii U Deluxe WUP-101(02) 32GB Gaming Console Tested. With 4 Controllers,140.9,2020-06-27 00:00:00
Nintendo Wii White Home Console with Sensor Bar - Black (RVL-001),42.0,2020-06-27 00:00:00
Nintendo Wii White Console (USED),46.05,2020-06-27 00:00:00
 Nintendo Wii U 32GB System Console Only Black Mario kart extras dlc included,61.05,2020-06-27 00:00:00
Nintendo Wii Sports Pack White Console (NTSC),115.0,2020-06-27 00:00:00
"Nintendo Wii U Super Mario 3D World Deluxe Set  W/ Mario Party, Mario Kart and..",177.05,2020-06-27 00:00:00
Nintendo Wii Replacement Console System Only White RVL-101 Working - Ships Free,48.15,2020-06-27 00:00:00
Nintendo Wii Console With All Hookups *Works*,74.15,2020-06-27 00:00:00
Nintendo Wii Sports Resort White Console,65.2,2020-06-27 00:00:00
++ Nintendo Wii Bundle (Extra Controllers & Games) ++,102.0,2020-06-27 00:00:00
NEW Nintendo Wii Black Console Wii Sports Resort Bundle Sealed Collectors RARE! ,463.75,2020-06-27 00:00:00
Nintendo Wii System Tested,65.77,2020-06-27 00:00:00
Nintendo Wii System Tested,71.01,2020-06-27 00:00:00
Nintendo Wii White Console Replacement Console Only RVL-001 TESTED Gamecube comp,47.39,2020-06-27 00:00:00
Nintendo Wii U Super Mario 3D World Deluxe Set 32GB Black Console,144.55,2020-06-27 00:00:00
"Used Wii Nintendo Console Bundle, 2 Remotes, 8 Games (3 Mario Games, Skylanders)",159.96,2020-06-27 00:00:00
Nintendo Wii U 32GB Black Console | w/ Game Pad & Game | No Sensor Bar | TESTED,142.5,2020-06-27 00:00:00
Nintendo Wii BLACK Video Game Console System Bundle / Animal Crossing / Remotes,168.59,2020-06-27 00:00:00
"Original Nintendo Wii White Console has all Cords, Adapters One Remote",83.85,2020-06-27 00:00:00
Nintendo Wii Black Console RVL-001 GameCube COMPLETE with Extras & TESTED,151.82,2020-06-27 00:00:00
HUGE Nintendo Lot -Wii U Console w/ Accessories -12 GAMES -BONUS Wii & 15 Games,561.51,2020-06-27 00:00:00
Nintendo Wii Sports Resort White Console,83.21,2020-06-27 00:00:00
Nintendo Wii Console W/ Power Cord Not Working,35.51,2020-06-27 00:00:00
nintendo wii console RVL-001 No Controlls (Tested Works Great),57.05,2020-06-27 00:00:00
Nintendo Wii Console Only,50.91,2020-06-27 00:00:00
Nintendo Wii Console System Bundle RVL-001 Gamecube Compatible 2 Controllers,115.05,2020-06-27 00:00:00
working Nintendo Wii Sports Pack White Console (NTSC) in good condition,65.9,2020-06-27 00:00:00
Nintendo Wii Console Complete in Box w/ Wii Sports Tested (Original White),150.0,2020-06-27 00:00:00
"Nintendo Wii Mega Bundle: 2 Guitars, Remotes, Nunchucks 11 Games, Wii Sports",165.5,2020-06-27 00:00:00
Nintendo Wii U 32GB Console - Black,200.0,2020-06-27 00:00:00
Nintendo Wii System Tested,79.0,2020-06-27 00:00:00
Nintendo Wii Holiday Bundle Black Console,119.54,2020-06-27 00:00:00
Nintendo Wii System Tested,66.01,2020-06-27 00:00:00
"Nintendo Wii U with digital version of Mario Kart 8, GamePad, and 2 controllers",157.2,2020-06-27 00:00:00
Nintendo Wii System Tested,49.0,2020-06-27 00:00:00
Nintendo Wii System Tested,49.01,2020-06-27 00:00:00
Nintendo Wii System Tested,51.01,2020-06-27 00:00:00
"Nintendo Wii Console Bundle (Modded) Inc retro SNES, NES games",53.74,2020-06-27 00:00:00
Nintendo Wii Sports Pack White Console (NTSC),136.24,2020-06-27 00:00:00
Nintendo Wii U 32GB Console - Black,155.62,2020-06-27 00:00:00
Nintendo Wii Console (Console only) RVL001 White,32.15,2020-06-27 00:00:00
"Nintendo Wii Console with box, Zumba World Party, Console stand, Wii Remote, Etc",116.98,2020-06-27 00:00:00
Nintendo Wii U 32GB Black Console Bundle + 11 Games,226.4,2020-06-27 00:00:00
Black Nintendo Wii Console With Classic Mario - Metroid - Zelda + Game,99.99,2020-06-27 00:00:00
"Nintendo Wii U Console Only MINOR SCRATCHES, TESTED & WORKING",89.04,2020-06-27 00:00:00
Nintendo Wii U 32GB Console - Black,200.0,2020-06-26 00:00:00
Nintendo Wii Holiday Bundle Black Console,76.9,2020-06-26 00:00:00
Nintendo Wii Console Only White RVL-001 GameCube Compatible - TESTED,48.0,2020-06-26 00:00:00
Nintendo Wii U 32GB Black with 8 games and 1 downloaded ,222.5,2020-06-26 00:00:00
Black Replacement Nintendo Wii CONSOLE ONLY RVL-101 Tested & Working,49.95,2020-06-26 00:00:00
Nintendo Black Wii U Deluxe Console W/ 12 Games! Tested! Works Great!,170.0,2020-06-26 00:00:00
Nintendo Wii RVL-001 Games And Accessories Bundle,109.27,2020-06-26 00:00:00
Nintendo Wii Holiday Bundle Black New,321.0,2020-06-26 00:00:00
Nintendo Wii Mario Kart Pack White Console (NTSC-U/C (US/CA)). Plus case,69.95,2020-06-26 00:00:00
"Nintendo Wii U Super Mario 3D World Deluxe Set black with game, nunchcuk, remote",166.05,2020-06-26 00:00:00
"Nintendo Wii Console-17 Games-Huge Bundle Lot! Mario Kart & Sports Mix, Disney++",199.56,2020-06-26 00:00:00
Nintendo Wii White Console RVL-001 2006 Model made in China - FOR PARTS,23.67,2020-06-26 00:00:00
Nintendo Wii U 32GB Console Deluxe Set with Nintendo Land - Black (WUPSKAFB),225.5,2020-06-26 00:00:00
Nintendo Wii bundle Mario Zelda Donkey Kong and more ,220.76,2020-06-26 00:00:00
"NINTENDO Wii CONSOLE COMPLETE SYST, PWR SUPP, REMOTE, SUMMERSPORTS GAME ETC,A++",71.0,2020-06-26 00:00:00
Nintendo Wii U Console & Game Pad- Black SEE DESCRIPTION,92.99,2020-06-26 00:00:00
Nintendo Wii Console (Black) w/ Wii Remote Plus and Epic Mickey,55.05,2020-06-26 00:00:00
Nintendo Wii Black Console W/ Extras Bundle complete! Free Super Fast Shipping,51.55,2020-06-26 00:00:00
"Nintendo Wii System/Console Wii Fit Plus & 3 Other Games, 4 Controllers Bundle",108.0,2020-06-26 00:00:00
Nintendo Wii Console -White Bundle W/ All Cords & Extras-No Games Or Controllers,55.2,2020-06-26 00:00:00
Nintendo Wii Console System Complete In Box 7 Games Wii Sports w/ 2 Remotes,174.67,2020-06-26 00:00:00
Original Nintendo RVL-101(USA) Wii Console - White,71.1,2020-06-26 00:00:00
Black Nintendo Wii Sports RVL-001 Bundle W/ Motion Plus Controllers & 11 Games ,102.5,2020-06-26 00:00:00
nintendo wii u games bundle,134.01,2020-06-26 00:00:00
Nintendo Wii U Launch Edition 32GB Black Handheld System,96.55,2020-06-26 00:00:00
Nintendo Wii Mini Tested Console only ,43.85,2020-06-26 00:00:00
"Nintendo wii, comes with controller, nunchuck, and games",117.4,2020-06-26 00:00:00
"Nintendo Wii Bundle, Console,Mario Kart w/2 Wheels, 4 Controllers, 2 Other Games",127.51,2020-06-26 00:00:00
Nintendo Wii Sports Pack White Console (NTSC),67.1,2020-06-26 00:00:00
Nintendo Wii Modded with 114 games,164.63,2020-06-26 00:00:00
Nintendo Wii U 32GB Console w/ Nintendoland & Super Mario World 3D World +More,170.5,2020-06-26 00:00:00
Nintendo Wii U Deluxe 32 GB BUNDLE!!!!!Black System with 4 Game,164.35,2020-06-26 00:00:00
Nintendo Wii Console Black - Used - No Cords - Includes Games and Battery,46.16,2020-06-26 00:00:00
Nintendo wii bundle with games,111.95,2020-06-26 00:00:00
Nintendo Wii Console - White - No Controller - 6 Games Works Great,90.9,2020-06-26 00:00:00
"Nintendo Wii 25th Anniversary Limited Edition Red Console System, Used.",107.15,2020-06-26 00:00:00
Nintendo Wii U 32GB Console Deluxe Set with Nintendo Land - Black + Skylanders,209.25,2020-06-26 00:00:00
Nintendo Wii Black Console Tested Works Console Only,40.0,2020-06-26 00:00:00
Nintendo Wii U Mario & Luigi Deluxe 32GB Black Handheld System Console 4 Games,217.5,2020-06-26 00:00:00
*AS IS*Nintendo Wii U Black-32GB System Console-and Power Cord- Parts Or Repair,21.5,2020-06-26 00:00:00
Nintendo Wii U Deluxe 32 GB Black System w/ 12 Games Console Bundle Ships Fast,239.25,2020-06-26 00:00:00
Nintendo Wii U Deluxe 32 GB with Zelda Breath of the Wild and more!,344.55,2020-06-26 00:00:00
Nintendo Wii U 32GB Video Game Console System Bundle With Gamepad Cords W/ game,140.3,2020-06-26 00:00:00
Nintendo RVL-101 Wii Console - White,78.0,2020-06-26 00:00:00
Nintendo wii u games bundle**12 games**,80.2,2020-06-26 00:00:00
Nintendo Wii Gaming System With 22 Games And Extras.. Mint!,199.85,2020-06-26 00:00:00
Nintendo Wii U Deluxe 32 GB Black System Console & Gamepad Bundle,142.55,2020-06-26 00:00:00
Nintendo Wii â˜†500GB HDDâ˜†50+ LEGIT Wiigames+Retro Emulatorsâ˜† With all accessories,209.9,2020-06-26 00:00:00
Nintendo Wii System With 19 Games,132.15,2020-06-26 00:00:00
Nintendo Wii u black with game pad 2 controller and 3 games,119.55,2020-06-26 00:00:00
"Nintendo Wii Console +10 Games, Gamecube Compatible",111.9,2020-06-26 00:00:00
Nintendo Wii Bundle - 23 Games,115.74,2020-06-26 00:00:00
Nintendo Wii Mario Kart Game and 2 Steering Wheels - PERFECT w/ NO SCRATCHES!,37.0,2020-06-26 00:00:00
Nintendo Wii Red Console Bundle Lot W/ Games Controllers Cords! Tested! ,93.2,2020-06-25 00:00:00
Nintendo Wii (Gamecube compatible) - CONSOLE ONLY - TESTED,55.0,2020-06-25 00:00:00
"Nintendo Wii Console,Cords RVL-001 GameCube Compatable, wheel, Just Dance SD crd",68.7,2020-06-25 00:00:00
"Nintendo Wii Console - White *bundle* With 3 Games, See Description",126.32,2020-06-25 00:00:00
Nintendo Wii Console - White *bundle* With 3 Games *cib* see Description,129.2,2020-06-25 00:00:00
Nintendo Wii U Legend of Zelda Wind Waker Set console black 32gb 10 game bundle,179.2,2020-06-25 00:00:00
Nintendo Wii Console RVL 001 White With 8 games Tested and Working,110.2,2020-06-25 00:00:00
"nintendo wii u 32gb bundle Mario Kart 8, 2 Wheels, Mario 3D World+Galaxy, Pokken",179.45,2020-06-25 00:00:00
Nintendo Wii RVL-001 Video Game Console with Link's Crossbow Training,63.05,2020-06-25 00:00:00
Nintendo Wii U Deluxe 32GB Black Console - Mario Kart 8 - Zelda + Kirby & More,209.99,2020-06-25 00:00:00
Nintendo RVL-101 Wii Console - White,67.93,2020-06-25 00:00:00
4 Nintendo Wii Systems Tested Working & Reset,94.93,2020-06-25 00:00:00
Used Nintendo Wii Gaming Console Everything Intact WORKS Tested Fine,39.8,2020-06-25 00:00:00
4 Nintendo Wii Systems Tested Working & Reset,67.41,2020-06-25 00:00:00
4 Nintendo Wii Systems Tested Working & Reset,68.93,2020-06-25 00:00:00
Nintendo RVL-101 Wii Console - White,75.88,2020-06-25 00:00:00
"Nintendo Wii System/Console Wii Fit Plus and 5 Other Games, 4 Controllers Bundle",145.5,2020-06-25 00:00:00
Nintendo wii console white system complete,62.0,2020-06-25 00:00:00
Nintendo Wii Console with Controllers in Great Working Condition - Used,70.16,2020-06-25 00:00:00
Nintendo Wii CONSOLE ONLY White RVL-001 GameCube Compatible TESTED missing door,39.74,2020-06-25 00:00:00
"Nintendo Wii Console Bundle: 2 Remotes + Nunchucks, 13 Games (Mario Kart, Brawl)",215.24,2020-06-25 00:00:00
Limited Edition 25th Anniversary Red Nintendo Wii System RVL-001 Tested bundle,61.05,2020-06-25 00:00:00
Nintendo Wii U Bundle (includes 4 games),237.05,2020-06-25 00:00:00
nintendo wii console bundle Black 4 Games Super mario Bros. Edition In Box,197.49,2020-06-25 00:00:00
Massive Nintendo Wii WHITE Console Bundle 6 Games 2 Controllers w/ Skylanders,123.7,2020-06-25 00:00:00
Nintendo Wii - Original 8GB White Home Console,45.0,2020-06-25 00:00:00
"Nintendo Wii U, Black, 32GB, w/ gamepad & TWO Wiimotes w/nunchuks & 5 games!!",148.8,2020-06-25 00:00:00
 Blue Nintendo Wii  Limited Edition Console,78.99,2020-06-25 00:00:00
Massive Nintendo Wii WHITE Console Bundle 4 Games-2 Controllers w/ U draw + More,102.7,2020-06-25 00:00:00
Black Nintendo Wii Console Working Wires White Remote,66.0,2020-06-25 00:00:00
Nintendo Wii U Black 32gb Console - With Gamepad and All Cables and 2 Games,138.0,2020-06-25 00:00:00
Nintendo wii Black Console,80.9,2020-06-25 00:00:00
Nintendo Wii U Launch Edition 32GB Black Handheld System,137.9,2020-06-25 00:00:00
"Nintendo Wii U 32GB Console Bundle W/ Gamepad, Pro Controller and 7 Games",257.0,2020-06-25 00:00:00
nintendo wii console games bundle,127.95,2020-06-25 00:00:00
Nintendo Wii White Console (NTSC) with Mario Kart game,83.99,2020-06-25 00:00:00
Parts & Repair Nintendo Wii U Game Pad WUP-010 With Charging Stand -MT0029,27.99,2020-06-25 00:00:00
"Nintendo Wii U 32GB Black Deluxe Console, Gamepad, Game, Wii-mote, & cord bundle",248.05,2020-06-25 00:00:00
