title,price,date
Nintendo Wii White Console RVL-001 Game Cube Compatible Bundle Complete! Tested!,57.0,2020-08-14 00:00:00
Nintendo Wii Console - White Bundle With Extras GameCube Games,103.0,2020-08-14 00:00:00
nintendo wii rvl-101 (Console Only),30.2,2020-08-14 00:00:00
Nintendo Wii U 32GB Black System No Gamepad ,124.55,2020-08-14 00:00:00
Pre Owned Nintendo Wii Console - Black NO GAMES!!!!! Works Good. Complete System,72.0,2020-08-14 00:00:00
Nintendo WII- Missing Sensor ,43.05,2020-08-14 00:00:00
"Nintendo Wii White Console (NTSC), Extra Large Bundle, Controller(s) + Games",110.5,2020-08-14 00:00:00
Nintendo Limited Edition Wii Console w/ Cords BLUE RVL-101(USA)    NO Sensor Bar,58.7,2020-08-14 00:00:00
"LOT NINTENDO WII RVL-001USA 1 Controller, Mario Cart Wii Super Smash Bros BrawlÂ ",96.17,2020-08-14 00:00:00
Nintendo Wii White Console RVL-001 Game Cube Compatible Bundle Tested!,76.01,2020-08-14 00:00:00
Nintendo Wii U The Legend of Zelda 32GB Black Handheld System,183.29,2020-08-14 00:00:00
Nintendo Wii Console Bundle 2 remotes/2 nun chucks/AC adapter/NYKO Sensor Tested,74.0,2020-08-14 00:00:00
Nintendo Wii With Wii Sports + Wii Sports Resort Black Console,66.99,2020-08-14 00:00:00
Nintendo Wii White Video Game Console (RVL-001) Bundle - GameCube Compatible,72.85,2020-08-14 00:00:00
New Listing,79.2,2020-08-14 00:00:00
New Listing,130.0,2020-08-14 00:00:00
Wii Lot System Mario Kart wheels golf tennis racket cord sensor Nintendo Manuals,31.57,2020-08-14 00:00:00
Nintendo Wii Black Console 1 Controller 1 Nunchuck RVL-001 Tested [LOOK],45.0,2020-08-14 00:00:00
Nintendo Wii Black Console 1 Controller 1 Nunchuck & 3 Games Tested [LOOK],49.0,2020-08-14 00:00:00
Nintendo Wii White Console Bundle with Controllers and Games,94.05,2020-08-14 00:00:00
Nintendo Wii U Mario Kart 8 Console Deluxe Set Bundle Complete In Box - CLEAN,341.7,2020-08-14 00:00:00
"Nintendo WII Model RVL-001 USA) Console with Power Cord , Sensor Bar, WII Remote",66.0,2020-08-14 00:00:00
Nintendo Wii White Console (NTSC),93.17,2020-08-14 00:00:00
Nintendo Wii U Deluxe 32GB Black Console Complete Bundle Tested*,155.0,2020-08-13 00:00:00
Nintendo Wii White Console Bundle,64.2,2020-08-13 00:00:00
"BUNDLE Nintendo Wii System Console, power cord av cables",47.94,2020-08-13 00:00:00
Nintendo Wii White Video Game Console (RVL-001) Bundle,86.94,2020-08-13 00:00:00
Nintendo Wii U The Legend of Zelda 32GB Black Handheld System lots of extras,241.8,2020-08-13 00:00:00
"Nintendo Wii U 32gb  System Console, Gamepad, 8 game lot Hori Pokeball case",180.25,2020-08-13 00:00:00
Nintendo Wii Sports Resort White Console,129.21,2020-08-13 00:00:00
Nintendo Wii White Console (NTSC),62.0,2020-08-13 00:00:00
"Red Nintendo Wii Console RVL-001 Lot 8 Games, Mario & Luigi Controllers Tested",193.83,2020-08-13 00:00:00
"Nintendo Wii U 32GB Black Bundle, 11 Games, 3 Controllers, & Extras!",230.0,2020-08-13 00:00:00
Nintendo Wii U with Games,142.9,2020-08-13 00:00:00
Nintendo Wii U 32 GB Console Bundle Wii Games And Controllers Zelda StarFox,250.0,2020-08-13 00:00:00
Nintendo Wii lot Black console with games cables sensor and controller Tested,80.0,2020-08-13 00:00:00
New Listing,169.99,2020-08-13 00:00:00
Nintendo Wii Replacement Console Only White RVL-001 GameCube Compatible - Tested,49.15,2020-08-13 00:00:00
Nintendo Wii U Basic Set 8GB White Handheld System W/ 2 Wii U Pro Controllers,142.3,2020-08-13 00:00:00
NINTENDO WII U 32GB CONSOLE WITH 13 GAMES + 3 CONTROLLERS - BlackÂ WUP-101(02),280.0,2020-08-13 00:00:00
"Nice Nintendo Wii Lot Console, 2 Controllers & Nunchucks! 2 Steering Wheels ++",69.98,2020-08-13 00:00:00
Nintendo Wii White Console (NTSC),78.2,2020-08-13 00:00:00
Nintendo Wii White Console (NTSC),100.0,2020-08-13 00:00:00
Nintendo Wii White Console with extras. Tested Clean and Works. ,58.99,2020-08-13 00:00:00
Nintendo Wii Blue Console with Accessories  Wii Fit & 12 Video Games Huge Lot,111.0,2020-08-13 00:00:00
Nintendo Wii White Console - no remotes or sensor bar.Â ,35.45,2020-08-13 00:00:00
Nintendo Wii Complete Bundle w/ Games & Controls RVL-001,69.99,2020-08-13 00:00:00
Nintendo Wii U The Legend of Zelda 32GB Black Handheld System,250.68,2020-08-13 00:00:00
Original Nintendo Wii Console With Balance Board Remotes Accessories Gamecube...,115.75,2020-08-13 00:00:00
Nintendo Wii U 32GB Black Console Deluxe Set with Nintendo Land - WUPSKAFBÂ  ,177.25,2020-08-13 00:00:00
Nintendo wii console bundle plus wii fit and games and controllers !!!!!!!,122.75,2020-08-13 00:00:00
"Nintendo Wii System Console, 2 Controllers, 6 Games, Bundle/Lot OEM",161.7,2020-08-13 00:00:00
"Nintendo Wii Console Lot In Original Box Wii Sports, Mario Bros And More Games",72.3,2020-08-13 00:00:00
Nintendo Wii Bundle,49.95,2020-08-13 00:00:00
Nintendo Wii Bundle ,49.95,2020-08-13 00:00:00
Nintendo Wii balck Console Combo Bundle  tested!!!,63.26,2020-08-13 00:00:00
Nintendo Wii U 32GB Black Console Deluxe SetÂ  - WUPSKAFB,199.25,2020-08-13 00:00:00
TESTED Nintendo Wii Console + Handheld 3DS +Case 6 games Lot Bundle Super Mario ,134.46,2020-08-13 00:00:00
Nintendo Wii black console - Wii sports resort - 2 controllers and 1 nunchuck,63.35,2020-08-13 00:00:00
Nintendo Wii Limited Edition Red Console,372.2,2020-08-13 00:00:00
Nintendo WiiÂ  Console (NTSC) w/cables + 2 Nunchucks + 2 Controllers + 9 videosÂ ,74.25,2020-08-13 00:00:00
Nintendo Wii red console - with Super Mario Bros. Wii - Tested works great,65.63,2020-08-13 00:00:00
Nintendo Wii System Console White Gamecube Compatible RVL-001 Sensor Bar/Cords,55.14,2020-08-13 00:00:00
Nintendo Wii U Mario Kart 8 Deluxe Set used with 6 games Zelda WW no Mario kart,225.9,2020-08-13 00:00:00
Nintendo Wii U Mario Kart 8 Deluxe Set,222.5,2020-08-13 00:00:00
"Nintendo Wii White Console Bundle, Steering Wheel, Pro Controller, Wii Sports!!",75.0,2020-08-13 00:00:00
Nintendo Wii White Console  All Cords With Remote Nunchuck And Rubber Case,69.86,2020-08-13 00:00:00
Nintendo Wii Console Sports + Games Bundle -TESTED,101.46,2020-08-13 00:00:00
Nintendo WIi U 32GB Console - Black,93.7,2020-08-13 00:00:00
"HACKED Nintendo Wii Bundle - 4 Remotes, Games, All Cables, HDD, SD Card & more!",191.32,2020-08-13 00:00:00
Nintendo wii  games bundle,95.76,2020-08-13 00:00:00
Nintendo Wii White Video Game Console (RVL-001) Bundle AS SHOWN,62.5,2020-08-13 00:00:00
"Nintendo Wii System Console, 2 Controllers, GAMES, Tested, Gamecube - Bundle/Lot",209.05,2020-08-13 00:00:00
Nintendo Wii White Console RVL-001 Game Cube Compatible Bundle Complete Game ,75.05,2020-08-13 00:00:00
Nintendo wii console with controller And Wii Sports Game,93.0,2020-08-12 00:00:00
Nintendo Wii U 32 GB Super Mario 3D World with Pro Controller and 5 Games,231.81,2020-08-12 00:00:00
"Nintendo Wii Mini Red Console RVL-201 - Bundle: Controller, cables, Sensor, Game",58.94,2020-08-12 00:00:00
Nintendo WUPSKA52 32GB Wii U Console And Gamepad - Black Used Good Condition!,140.17,2020-08-12 00:00:00
"Nintendo Wii Console w/stand, Wii Remote, 2 Nunchucks & 1 Wheel (No Sensor Bar)",37.7,2020-08-12 00:00:00
"Nintendo Wii Bundle with accessories, 12 games, Read!!",169.49,2020-08-12 00:00:00
Nintendo Wii Limited Edition Red Console with Wii Sports and New Super Mario...,97.0,2020-08-12 00:00:00
Nintendo Wii White Console Bundle With 14 Games. Tested.,93.7,2020-08-12 00:00:00
Nintendo Wii White Console - 2 Wii Motes & Nunchucks - All Wires & Sensor Bar,73.99,2020-08-12 00:00:00
Nintendo Wii White Console (NTSC),65.1,2020-08-12 00:00:00
"Nintendo Wii Black Console Bundle w/2 controllers, 2 nunchucks & 13 GAMES Tested",151.25,2020-08-12 00:00:00
Nintendo Wii Console BLACK,50.04,2020-08-12 00:00:00
Nintendo Wii U Basic Set 8GB White Handheld System,117.0,2020-08-12 00:00:00
Nintendo Wii Black Console NTSC 2 Controllers.,54.2,2020-08-12 00:00:00
Nintendo Wii (RVL-001),66.8,2020-08-12 00:00:00
Nintendo Wii (RVL-101),79.67,2020-08-12 00:00:00
Nintendo Wii and games lot,145.06,2020-08-12 00:00:00
Nintendo Wii (RVL-001),59.98,2020-08-12 00:00:00
Nintendo Wii (RVL-001),64.9,2020-08-12 00:00:00
Nintendo Wii (RVL-001),67.56,2020-08-12 00:00:00
Nintendo Wii (RVL-001),64.9,2020-08-12 00:00:00
Nintendo Wii (RVL-001),75.58,2020-08-12 00:00:00
Nintendo Wii (RVL-001),90.26,2020-08-12 00:00:00
Nintendo Wii (RVL-001),75.62,2020-08-12 00:00:00
Nintendo Wii (RVL-101),75.13,2020-08-12 00:00:00
Nintendo Wii RVL-101 Console MARIO KART BUNDLE ,88.05,2020-08-12 00:00:00
Nintendo Wii U Deluxe 32GB Black Bundle With 4 Games! Tested,162.15,2020-08-12 00:00:00
"Black 32GB Nintendo Wii U w/ Gamepad, Controllers, Games, and Console - WORKING!",216.85,2020-08-12 00:00:00
WII NINTENDO RED CONSOLE LIMITED EDITION +CONTROLLER+NUNCHUCK TESTED PREOWNED,125.27,2020-08-12 00:00:00
Nintendo Wii Black Console System RVL-001 W/ Cords Tested (GameCube Compatible),76.99,2020-08-12 00:00:00
Nintendo Wii Black RVL-101 Console 2 Controllers 5 Video Games Lot Just dance,131.68,2020-08-12 00:00:00
"Black Nintendo Wii Mario bundle remote, nunchuk, and wheel. include Just dance 3",150.0,2020-08-12 00:00:00
"Black 32GB Nintendo Wii U Bundle With Gamepad, Controller, and 3 Games",161.6,2020-08-12 00:00:00
"Nintendo Wii Console White RVL-001 USA w/Cords FOR PARTS, WON'T READ DISCS",29.7,2020-08-12 00:00:00
Nintendo Wii U 32GB Console w/ Gamepad -Controller-Black-5 Games All Cords Works,193.0,2020-08-12 00:00:00
EMPTY BOX - Nintendo Wii Mario Kart Pack ,26.49,2020-08-12 00:00:00
Nintendo Wii Console Model RVL-001 (USA) w/ Cords + Super Paper Mario,56.0,2020-08-12 00:00:00
Nintendo Wii Console (RVL-001 (USA)) w/ Cords Controller - TESTED AND WORKS!,38.99,2020-08-12 00:00:00
Nintendo Wii Console RVL-001 (USA) w/Sensor Bar Glo Sabers + Zelda,58.0,2020-08-12 00:00:00
Nintendo Wii Black Console RVL-001 w/ Remote + Adapter,33.99,2020-08-12 00:00:00
Nintendo Wii Console - Wii Fit Balance Board - 6 Games - Accessories - Bundle,134.98,2020-08-12 00:00:00
Nintendo Wii White Console (NTSC) RVL-001 Modded!,72.05,2020-08-12 00:00:00
Nintendo Wii Black Lot Console Motion Sensor Cables x4 Controllers Cases 4 Games,74.64,2020-08-12 00:00:00
Nintendo Wii White Console only.  Tested and works,40.0,2020-08-12 00:00:00
"Nintendo Wii RVL-001 White Console (NTSC) With Controllers, Cables & More",60.56,2020-08-12 00:00:00
Nintendo Wii Console (RVL-001) {GameCube Compatible} Set!!,67.68,2020-08-12 00:00:00
Nintendo Wii u Deluxe 32GB Black Console,133.05,2020-08-12 00:00:00
Nintendo Wii U 32 GB Super Mario 3D World Deluxe Set - Black,214.55,2020-08-12 00:00:00
Nintendo Wii Console with Controllers and Wheel + Cables,66.0,2020-08-12 00:00:00
White Nintendo Wii Console System Tested Working Original Backwards Compatible ,75.2,2020-08-12 00:00:00
Nintendo Wii White Console Only As Is Won't Read Discs For Parts,17.99,2020-08-12 00:00:00
Nintendo Wii White Console Super Smash Brawl + Wii Sports 2 Wii-motes,142.02,2020-08-12 00:00:00
Nintendo Wii White Console Tested Good Condition With Balance Board & Yoga,84.0,2020-08-12 00:00:00
Nintendo Wii U with 2 games and accessories,142.1,2020-08-12 00:00:00
Nintendo Wii - Black with 2 Remote and 2 Nunchucks,51.55,2020-08-12 00:00:00
"Nintendo Wii U Console - Black, 32GB",134.16,2020-08-12 00:00:00
Nintendo Wii Video Game System Console Bundle Black W/ Remotes - Tested,88.44,2020-08-12 00:00:00
Nintendo Wii Video Game System Console Bundle Black W/ Remotes & Extra's -Tested,70.76,2020-08-12 00:00:00
"Nintendo Wii White Console RVL-001 Gamecube Comp w/ Controller, Power & Av Cable",45.99,2020-08-12 00:00:00
Nintendo Wii White Console RVL-001 Gamecube Complete w/ Motion Plus Controller,56.08,2020-08-12 00:00:00
Nintendo Wii White Game Console Sports 7 Game Bundle Mario LEGO Donkey Kong MORE,182.51,2020-08-12 00:00:00
"Nintendo Bundle Wii RVL001 Console System w/ Controller, Nunchuk & Wii Sports",165.45,2020-08-12 00:00:00
"Nintendo Wii U Launch Edition 32GB Black Console Only (No Plugs, Controllers)",35.9,2020-08-12 00:00:00
Nintendo Wii Sports Console - White Bundle (controllers + sleeves + games etc),101.0,2020-08-12 00:00:00
"Nintendo Wii U 32GB Console ONLY - Black - NOT WORKING, FOR PARTS OR REPAIR ",38.15,2020-08-12 00:00:00
"Tested Nintendo Wii White Console W/ All Cables, 1 Controller & 5 Games Lot",70.75,2020-08-12 00:00:00
"Nintendo Wii Console + Controller +HD Cables + Original Box, Manuals + Wii Speak",91.67,2020-08-12 00:00:00
Nintendo Wii Black Console With 2 Controllers And 6 Games,62.2,2020-08-12 00:00:00
Nintendo Wii Mario Bundle GameCube Compatible Model RVL-001 Tested WORKS GREAT,111.94,2020-08-12 00:00:00
Nintendo Wii U 32GB Console and Pad - Black with Wii Mote/Nunchuck,163.15,2020-08-12 00:00:00
TESTED Nintendo Wii Console Black +  & 8 games lot bundle Mario Kart READ,168.43,2020-08-12 00:00:00
Nintendo Wii + Board + 6 Games + Controller/Nunchuk + Disc Cleaner,91.01,2020-08-12 00:00:00
Nintendo Wii Full Setup (Working!),68.25,2020-08-12 00:00:00
NINTENDO WII CONSOLE RVL-101 COMPLETE SET UP (BLACK) (CGM013683),57.0,2020-08-12 00:00:00
COMPLETE BLACK NINTENDO WII CONSOLE | READY TO PLAY ~ TESTED ~ ALL CORDS,86.8,2020-08-12 00:00:00
Nintendo Wii White Console RVL-001 Game Cube Compatible Bundle Tested!,55.0,2020-08-12 00:00:00
"Nintendo Wii Console Only RVL-101 System For Parts, Working Except Disc Drive",25.8,2020-08-12 00:00:00
Nintendo Wii Mini Red Console Mario Kart Selects Bundle + Bonus Wii Remote Plus,110.2,2020-08-12 00:00:00
Nintendo Wii Console bundle GameCube compatible  RVL-101 - White # 3,60.05,2020-08-12 00:00:00
Nintendo Wii Yellow Console (NTSC),78.2,2020-08-12 00:00:00
Nintendo Wii Mini Red Console & Wiimote w/ 3 games:  RVL-201,67.7,2020-08-12 00:00:00
NEW- NEVER OPENED! Nintendo Wii Smash Splat Deluxe Set - 32GB Special Edition,567.55,2020-08-12 00:00:00
Nintendo Wii Sports + Wii Sports Resort Black Console Brand New,424.75,2020-08-12 00:00:00
Nintendo Wii Black w/ 2 x Wii remotes & Mario Kart Game #404,202.51,2020-08-12 00:00:00
Nintendo Wii w/ Controller & Wii Sports Game #404,96.56,2020-08-12 00:00:00
Nintendo Wii Red Console 25th Anniversary - Super Mario Bros. - Limited Ed. #661,349.21,2020-08-12 00:00:00
Nintendo Wii White Console (NTSC),35.0,2020-08-11 00:00:00
Nintendo Wii Console Games Controllers Bundle,158.01,2020-08-11 00:00:00
Nintendo Wii White Video Game Console (RVL-001) Bundle - GameCube Compatible,42.0,2020-08-11 00:00:00
"Nintendo Wii Gamecube Bundle - Mario Kart, Mario Sunshine, Mario Party, + More!",297.0,2020-08-11 00:00:00
Nintendo Wii Console Bundle Cords BLACK RVL-001 wiimote Gamecube Compatible,46.0,2020-08-11 00:00:00
"Nintendo Wii Bundle RVL-001 Wii Sports, Wii Super Mario Bros & Other Accessories",112.0,2020-08-11 00:00:00
Nintendo Wii U Launch Edition Black Handheld System + Super Smash Bros. Wii U,143.0,2020-08-11 00:00:00
Nintendo Wii U 32 GB Super Mario 3D World Delux Bundle ,255.0,2020-08-11 00:00:00
Nintendo Wii U Super Mario 3D World Deluxe Set 32GB Black Console and More!,236.55,2020-08-11 00:00:00
Nintendo Wii White Console (NTSC),65.05,2020-08-11 00:00:00
Nintendo Wii U Mario & Luigi Premium Pack 32GB Black Handheld System with Extras,252.5,2020-08-11 00:00:00
Nintendo Wii White Console (NTSC) w/ Game Bundle- Condition Fair,49.25,2020-08-11 00:00:00
Nintendo Wii U Bundle Mario Kart Mario 3d World Splatoon 32gb Mario Maker ,206.33,2020-08-11 00:00:00
"Nintendo Wii in Box Bundle! Smash Brawl, Wii Play, OEM Component Cables, more!",68.91,2020-08-11 00:00:00
Nintendo Wii U 2 games & 6 digital games Mario Metroid More,160.5,2020-08-11 00:00:00
Nintendo Wii White Console (NTSC) WORKING,55.0,2020-08-11 00:00:00
Nintendo Wii U 32GB Black Console With Nintendo Land,157.25,2020-08-11 00:00:00
Nintendo Wii White plus Super Mario Bros Wii,86.0,2020-08-11 00:00:00
Nintendo Wii Console & Two Controllers ,80.01,2020-08-11 00:00:00
Nintendo Wii U 32GB Black Console and Games Bundle - Mario Splatoon Just Dance,217.5,2020-08-11 00:00:00
Nintendo Wii U Bundle Super Mario/Just Dance,138.5,2020-08-11 00:00:00
32 GBÂ  Nintendo Wii U Mario Kart 8 Deluxe Set Bundle In Great Condition,175.04,2020-08-11 00:00:00
NINTENDO Wii - ACCESORIES / GAMES / MATT LOT - CLEAN / L@@K!!!,54.98,2020-08-11 00:00:00
"Nintendo Wii Games - Mario Kart Wii, Super Mario Galaxy, Wii Zapper & More",53.89,2020-08-11 00:00:00
Nintendo Wii White Console Bundle with Wii Fit Balance Board & 4 Games!!,126.2,2020-08-11 00:00:00
"Nintendo Wii Console, White Bundle 10 Games Complete Konami Dance Pad",113.06,2020-08-11 00:00:00
Nintendo Wii U (32GB) WUP-101(02) Lot - See Description,177.5,2020-08-11 00:00:00
NINTENDO WII U REPLACEMENT 8GB WHITE CONSOLE SYSTEM +used WUP-001(02) NO GAMEPAD,54.25,2020-08-11 00:00:00
Nintendo Wii System + 5 Games LOT Console Mario Party Just Dance Star Wars U OEM,102.55,2020-08-11 00:00:00
Nintendo Wii Wii Sports Resort and Wii Remote Plus Console - Black,113.97,2020-08-11 00:00:00
Nintendo Wii White Console With Extra Controllers And Games !!!,145.41,2020-08-11 00:00:00
Nintendo Wii Model RVL-001 White Backwards Compatible Bundle,45.47,2020-08-11 00:00:00
HUGE Nintendo Wii Bundle 36 Games Wii Fit Board 2 Guitars & MORE *FREE SHIPPING*,180.0,2020-08-11 00:00:00
Nintendo Wii White Video Game Console (RVL-001) Bundle - GameCube Compatible,50.99,2020-08-11 00:00:00
Nintendo Wii Mini Black / Red 8 GB Video Game Home Console (RVL-201) Bundle,48.77,2020-08-11 00:00:00
Nintendo Wii-U 32 GB Console With 4 Games and 3 Genuine Wii-U Pro Controllers,232.0,2020-08-11 00:00:00
Nintendo Wii System Console RVL-001 GameCube Port With Cords & Controller WORKS!,49.95,2020-08-11 00:00:00
Nintendo Wii White Console W/2 Wiimotes & 2 Joycons. Complete Set,74.05,2020-08-11 00:00:00
Nintendo Wii Console Bundle With SD Card Containing 55 Classic Games,86.99,2020-08-11 00:00:00
Nintendo Wii - Modded,94.2,2020-08-11 00:00:00
"TESTED Nintendo Wii Console White Bundle with Remotes, Nunchucks, Wii Speak",98.75,2020-08-11 00:00:00
Nintendo Wii Sports Home Console - White with 6 games and original boxÂ ,150.05,2020-08-11 00:00:00
"MINT Nintendo Wii U Bundle 8GB: Gamepad, Cords, Box, 15 Games, Controller Holder",318.65,2020-08-11 00:00:00
Nintendo Wii Replacement Console Only White RVL-001 GameCube Parts,29.89,2020-08-11 00:00:00
Modded Nintendo Wii White- Console only 16gb sd card w/1800 retro gamesÂ Â ,71.9,2020-08-11 00:00:00
"Nintendo Wii U[32GB] With Game Pad, Cables, Sensor Bar, and Wireless Sensor Bar",130.0,2020-08-11 00:00:00
Nintendo Wii RVL-001 White Console Wii Sports Bundle w/ Original Box,107.0,2020-08-11 00:00:00
NINTENDO WII U DELUXE BLACK 32 GB CONSOLE & GAMEPAD WUP-010 + WUP-101(2) & GAMES,181.28,2020-08-11 00:00:00
"Nintendo Wii w 2 Controllers, 2 Nunchuks w Balance Board  & 18 Games!!",128.3,2020-08-11 00:00:00
HUGE LOT Nintendo Wii console system white Gamecube compatible w/cables SET ,117.5,2020-08-11 00:00:00
Nintendo Wii White Console w/Wii Sports Game -  ðŸ”¥ ðŸ”¥ ðŸ”¥,106.73,2020-08-11 00:00:00
"Nintendo Wii U 8GB bundled with 4 Games, 2 Controllers, Trackpad, Pro Controller",184.5,2020-08-11 00:00:00
Nintendo Wii U 32GB Black Console Deluxe Set with Nintendo Land - WUPSKAFB,357.75,2020-08-11 00:00:00
"LOT of 4x Nintendo Wii's, 10x Wii Remotes, Accessories, Cables (UNTESTED)",185.48,2020-08-11 00:00:00
Nintendo Wii Red Replacement Console ONLY RVL-001 TESTED & WORKING FAST SHIP!,70.8,2020-08-11 00:00:00
Nintendo Wii U -  32 GB Black Handheld System Complete,110.0,2020-08-11 00:00:00
Nintendo Wii - Original 8GB White Home Console,102.05,2020-08-11 00:00:00
"Nintendo Wii White Console Bundle. Three Controllers, Nunchuck, Games",100.2,2020-08-11 00:00:00
Nintendo Wii Console white NO CONTROLLER AC Adapter Cords Sports game + charger,50.96,2020-08-11 00:00:00
Nintendo Wii Black Console Works Great Tested Console Cords and Wheel No Game,63.88,2020-08-11 00:00:00
"Nintendo Wii Sports: White Console, Sensor & Charger *Incomplete Package* WORKS",50.1,2020-08-11 00:00:00
Nintendo Wii-U Console Lot of 2 Consoles & 1 Controller - NOT TESTED,104.22,2020-08-10 00:00:00
"Nintendo Wii U Deluxe 32GB Black Handheld System 7 Games, Huge Bundle!! Console",233.15,2020-08-10 00:00:00
Nintendo wii bundle with console 12 games 5 controllers cables and batteries wii,175.0,2020-08-10 00:00:00
Nintendo Wii with wii sports and resort and controllers and gamecube accessories,148.02,2020-08-10 00:00:00
Nintendo Wii Console Complete Bundle Gamecube Compatible & Wii Sports & 5 games ,105.01,2020-08-10 00:00:00
"Nintendo Wii Black Console Tested Working Console only with Stand, And Cords",42.5,2020-08-10 00:00:00
Nintendo Wii White Console (NTSC),66.0,2020-08-10 00:00:00
"Nintendo Wii U 32GB Black Console w/ 4 games, Wiimote, sensor bar",199.0,2020-08-10 00:00:00
(Used) Nintendo Wii U The Legend of Zelda Wind Waker Edition 32GB with Box,206.1,2020-08-10 00:00:00
Nintendo Wii 25th Anniversary Limited Edition Red Console With Extras,92.0,2020-08-10 00:00:00
"Nintendo Wii U Consoles W/ Game Pads, FOR PARTS, REPAIR!",113.0,2020-08-10 00:00:00
Nintendo Wii u 5 games and 2 digital games,133.95,2020-08-10 00:00:00
Nintendo Wii Console gamecube compatible - White with virtual console games,45.05,2020-08-10 00:00:00
Nintendo Wii Console Bundle 2 Controllers 13 games+ many extras with UDraw,117.99,2020-08-10 00:00:00
"Nintendo Wii Console, Accessories and 28 Games!!",193.55,2020-08-10 00:00:00
NINTENDO Wii RVL-101 (USA) W/Wii MOTION PLUS REMOTE/NUNCHUCK 2 GAMES,74.0,2020-08-10 00:00:00
NINTENDO WII CONSOLE RVL-001 WII SPORTS PACK BUNDLE CONSOLE CABLES SENSOR GAME,74.98,2020-08-10 00:00:00
Nintendo Wii White Console RVL-001 Bundle Gamecube Compatible CORDS CONTROLER +,74.7,2020-08-10 00:00:00
"Nintendo Wii Mario Kart Console 3 wheels, 4 controllers, 2 nun chucks,sensor bar",129.95,2020-08-10 00:00:00
"Nintendo Wii Console Bundle w/ Wii Sports, Extra Controller & BoxesÂ  - Excellent",125.32,2020-08-10 00:00:00
Nintendo Wii Console Complete Bundle White Wii Sport Remote Nunchuck Accessories,115.9,2020-08-10 00:00:00
nintendo wii bundle used with games and remote some games not working.,41.0,2020-08-10 00:00:00
Nintendo Wii RVL-001 Video Game Console Bundle - White / Untested,62.02,2020-08-10 00:00:00
Nintendo Wii U 32GB Video Game Console Bundle WUP-101 Black,201.32,2020-08-10 00:00:00
Nintendo Wii U Mario Kart 8 Deluxe Set,175.75,2020-08-10 00:00:00
Nintendo Wii U 32GB Console w/ GamePad WUP-101(02) Black and Power Cord,174.25,2020-08-10 00:00:00
Nintendo Wii U console bundle Black,181.45,2020-08-10 00:00:00
5 Original Nintendo Wii consoles only Untested. RVL-001 (JPN),34.0,2020-08-10 00:00:00
"Nintendo Wii Console & Massive Bundle with Games , Accessories, Controllers/More",170.5,2020-08-10 00:00:00
Nintendo Wii Red Replacement Console Only RVL-001 Tested & Working ,52.98,2020-08-10 00:00:00
Nintendo WIi-U  Console - Black 32GB,133.15,2020-08-10 00:00:00
Nintendo Wii ,64.89,2020-08-10 00:00:00
Nintendo Wii White Console Bundle(7 Games),142.25,2020-08-10 00:00:00
"Nintendo Wii U 32GB Black Console Set w 2 controllers, Mario Kart 8 & Windwaker",205.25,2020-08-10 00:00:00
Nintendo Wii Console with controllers and extras,90.99,2020-08-10 00:00:00
Nintendo Wii Console - Games - AUTHENTIC controllers- USED,114.81,2020-08-10 00:00:00
nintendo wii u 32gb HUGE bundle! ,342.69,2020-08-10 00:00:00
Nintendo Wii U Black Handheld System Mario & Luigi Deluxe Set 32GB,206.99,2020-08-10 00:00:00
Nintendo Wii White Console,58.0,2020-08-10 00:00:00
Nintendo Wii U Gamepad Black Stand / Console Holder / HDMI port,21.6,2020-08-10 00:00:00
Nintendo Wii White Video Game Console (RVL-001) Bundle - GameCube Compatible,57.42,2020-08-10 00:00:00
Nintendo Wii RVL-001(USA) Bundle with 3 Games Sports & Mario Kart,96.78,2020-08-10 00:00:00
Nintendo Wii White Console with motion sensor and required cables,47.0,2020-08-10 00:00:00
Nintendo Wii White Console (NTSC),90.65,2020-08-10 00:00:00
Nintendo Wii Video Game Console Bundle RVL-101 Black,78.2,2020-08-10 00:00:00
Nintendo Wii Video Game Console Bundle RVL-001 White,67.2,2020-08-10 00:00:00
Nintendo Wii Video Game Console Bundle White RVL-001,80.2,2020-08-10 00:00:00
Nintendo Wii White Video Game Console (RVL-001) WORKING,63.0,2020-08-10 00:00:00
Nintendo Wii Console  + Stand & Cords Gamecube Compatible White RVL-001(USA),49.0,2020-08-10 00:00:00
Nintendo Wii console Works,54.05,2020-08-10 00:00:00
Nintendo Wii  And PlayStation 2 With 2 Remotes Missing Ac Adapter,78.0,2020-08-10 00:00:00
Nintendo Wii Used (Working) Good Condition Controller With Sleeve All Chords,65.01,2020-08-10 00:00:00
"Nintendo Wii Console WHITE with Games and Motion Plus Wiimote, Sensor Bar, Power",90.6,2020-08-09 00:00:00
Nintendo Wii Super Mario Bros 25th Anniversary Red Console Boxed Great Condition,189.46,2020-08-09 00:00:00
"Nintendo Wii Console, FitBoard Plus & Games",100.95,2020-08-09 00:00:00
"Nintendo Wii U Skylanders Bundle 8GB White With 10 Games, Controllers, with Box",329.02,2020-08-09 00:00:00
Nintendo Wii U Deluxe 32GB Console - Black + Mario Kart 8 + Pro Controller,198.3,2020-08-09 00:00:00
Nintendo Wii U Game Pad WUP-010(USA) And Console WUP-101(02),117.5,2020-08-09 00:00:00
"Nintendo Wii U console bundle black with game, works great!",182.35,2020-08-09 00:00:00
"Nintendo Wii White Console, 2006 Edition, Gamecube Compatible, RVL-001",57.05,2020-08-09 00:00:00
NINTENDO WII COMPLETE SYSTEM TESTED WORKING w/ 6 GAMES   WII SPORTS &  MORE !!,93.0,2020-08-09 00:00:00
