title,price,dateLEGO Harry Potter: Years 1-4 Nintendo Wii,13.75,2020-07-30 00:00:00
"Guitar Hero: World Tour (Nintendo Wii, 2008)",9.6,2020-07-30 00:00:00
"Just Dance 3 (Nintendo Wii) Game, Case, and Instruction Booklet",7.05,2020-07-30 00:00:00
"Nintendo Land (Nintendo Wii U, 2012) Game With Book",6.24,2020-07-30 00:00:00
"Wipeout 2 (Nintendo Wii, 2011) Complete with Manual Tested and Works",6.05,2020-07-30 00:00:00
Go Diego Go Safari Rescue - Nintendo Wii,3.74,2020-07-30 00:00:00
NINTENDO WII NEW SUPER MARIO BROS. VIDEO GAME COMPLETE WITH MANUAL TESTED WORKS,24.99,2020-07-30 00:00:00
"No More Heroes/Red Steel (Nintendo Wii, 2009)",20.65,2020-07-30 00:00:00
For Nintendo Wii Wii U Gamepad Wall AC Power Supply Charging Adapter Cable Cord,6.5,2020-07-30 00:00:00
Bandai Namco Games (BC-001) Dance Mat/Pad Nintendo Wii With Outdoor Challenge,11.0,2020-07-30 00:00:00
Nintendo Wii Plus (RVLAPNRB) Multimedia Remote,28.0,2020-07-30 00:00:00
Nintendo Wii U Glow FX Stylus 6 Color Gaming Stylus,9.99,2020-07-30 00:00:00
Nintendo Wii U 32GB Black Console With Nintendo Land,164.25,2020-07-30 00:00:00
"Super Paper Mario (Nintendo Wii, 2007)",19.7,2020-07-30 00:00:00
"Guitar Hero III: Legends of Rock Bundle Gibson Guitar  (Nintendo Wii, 2007) Ised",60.2,2020-07-30 00:00:00
"Super Smash Bros. (Nintendo Wii U, 2014). Preowned. Great condition",16.7,2020-07-30 00:00:00
"Mario Kart 8 (Nintendo Wii U, 2014). Preowned. Great condition",20.86,2020-07-30 00:00:00
Nintendo Wii Guitar Hero White Gibson Les Paul Used Good Condition,59.0,2020-07-30 00:00:00
"Metroid: Other M (Nintendo Wii, 2010) Factory Sealed",10.4,2020-07-30 00:00:00
"Guitar Hero: World Tour (Nintendo Wii, 2008)",9.7,2020-07-30 00:00:00
"The Hip Hop Dance Experience (Nintendo Wii, 2012)",16.04,2020-07-30 00:00:00
Band Hero - Nintendo Wii-,8.5,2020-07-30 00:00:00
"Guitar Hero: Metallica (Nintendo Wii, 2009)",23.05,2020-07-30 00:00:00
"Mario Party 8 (Nintendo Wii, 2007) Complete CIB",25.3,2020-07-30 00:00:00
"Mario Kart (Nintendo Wii, 2012) With Wheel Bundle!",25.47,2020-07-30 00:00:00
Official Gamecube Controller Orange Spice Original Nintendo OEM Genuine Wii,55.74,2020-07-30 00:00:00
50 X Animal Crossing: Amiibo Festival (Nintendo Wii U) PAL UK DISC ONLY LOT,20.0,2020-07-30 00:00:00
"Crash of the Titans (Nintendo Wii, 2007) complete with manual",18.0,2020-07-30 00:00:00
Nintendo Wii Luigi Motion Plus Remote Controller RVL-036 TESTED Great Cond. RARE,40.0,2020-07-30 00:00:00
Nintendo Wii U New Super Mario Bros + Luigi U Deluxe Set Console W Box 16 Games,340.0,2020-07-30 00:00:00
"Just Dance 2015 (Nintendo Wii, 2014)",12.2,2020-07-30 00:00:00
"Hasbro Family Game Night 3 (Nintendo Wii, 2010) Complete",14.9,2020-07-30 00:00:00
Zelda Twilight Princess Official Nintendo Power Player's Guide Wii Poster Intact,12.98,2020-07-30 00:00:00
Endless Ocean Blue World - Disc Only (Nintendo Wii),6.99,2020-07-30 00:00:00
Nintendo Wii U Mario Kart 8 Deluxe 32GB w/ GamePad+3 Games/ Black/ Complete Box,200.0,2020-07-30 00:00:00
Wii Sports Resort & Super Mario Galaxy Nintendo Selects Nintendo Wii Complete,46.0,2020-07-30 00:00:00
"Lot of 6 Nintendo Wii Games- Skylanders, ZhuZhu Pets, Boogie, Candy Factory, Etc",13.44,2020-07-30 00:00:00
Black Nintendo Wii Console In Box Wii Sport/ Resort Motion Plus,115.99,2020-07-30 00:00:00
Nintendo Wii White Console (NTSC),61.0,2020-07-30 00:00:00
 2Pack Wired NGC Controller Gamepad for Nintendo GameCube GC & Wii U Console,16.75,2020-07-30 00:00:00
"Nintendo Wii Console Bundle [â­ï¸Manuals, Sensor, Controllers, 2 Mics, 5 Gamesâ­ï¸]",90.0,2020-07-30 00:00:00
Mario & Sonic at the Olympic Winter Games Nintendo Wii,13.99,2020-07-30 00:00:00
"Mighty No. 9 (Nintendo Wii U, 2016)  10/B2617E",8.25,2020-07-30 00:00:00
"New Super Mario Bros. Wii (Nintendo Wii, 2009)",24.7,2020-07-30 00:00:00
"NEW Splatoon Inkling Girl AMIIBO Nintendo Wii U, 3DS & Switch. Ships Free!!",11.97,2020-07-30 00:00:00
"Guitar Hero Live Bundle (Nintendo Wii U- Game and Wireless Guitar) ðŸŽ¸(ps4, Xbox)",28.25,2020-07-30 00:00:00
"PokePark Nintendo Wii Prima Guide, Lightly Used",8.98,2020-07-30 00:00:00
Lot of 155 Wii XBOX 360 PS2 nintendo playstation 2 games game CDVGM1,317.3,2020-07-30 00:00:00
New Super Mario Bros. Wii Nintendo Wii Brand New Facotry Sealed RARE,40.68,2020-07-30 00:00:00
Shovel Knight  Nintendo Wii U New Sealed RARE OOP ,18.48,2020-07-30 00:00:00
Star Fox Zero Star Fox Guard(sealed) Nintendo Wii U Great 2 Games,11.49,2020-07-30 00:00:00
Super Mario All Stars Nintendo Wii Vidoegame,25.0,2020-07-30 00:00:00
Official Nintendo Wii U Remote Plus Princess Peach Official Controller RARE ,35.99,2020-07-30 00:00:00
Donkey Kong Tropical Freeze Nintendo Wii U New Sealed RARE OOP,23.49,2020-07-30 00:00:00
"Nickelodeon Fit for Nintendo Wii, 2010 - Dora Kids Children's Fitness Games",12.7,2020-07-30 00:00:00
"New Super Mario Bros. Wii (Nintendo Wii, 2009)",21.41,2020-07-30 00:00:00
"Kidz Sports: Crazy Golf (Nintendo Wii, 2008)",4.89,2020-07-30 00:00:00
"Tetris Party Deluxe (Nintendo Wii, 2010)",19.7,2020-07-30 00:00:00
"Mario & Sonic at the London 2012 Olympic Games (Nintendo Wii, 2011)",18.45,2020-07-30 00:00:00
Nintendo Wii Sonic Colors Game In Box..Works,17.5,2020-07-30 00:00:00
Nintendo Wii Console Bundle With Games   TESTED  Animal Crossing  Zelda  Metroid,225.98,2020-07-30 00:00:00
Nintendo Wii Bundle,100.0,2020-07-30 00:00:00
Nintendo Wii Super Mario Bros. Game..Works,21.5,2020-07-30 00:00:00
"Mario and Sonic at The Olympic Winter Games Sochi 2014, Nintendo Wii U, Tested",12.0,2020-07-30 00:00:00
Nintendo Wii Super Mario Galaxy Game In Box...Works,20.0,2020-07-30 00:00:00
Kirby and the Rainbow Curse (Nintendo Wii U) CIB Good - Mint Disc! (see photos),23.01,2020-07-30 00:00:00
Nintendo Wii & Smash Broâ€™s Brawl + Super Mario broâ€™s. Online RVL-001 GC Port,95.0,2020-07-30 00:00:00
Lot of 7 Nintendo Wii Games - Price is Right - Family Feud - M&M - Jeep - MORE!,31.65,2020-07-30 00:00:00
Nintendo Wii - White Console - GameCube Compatible Dance Mat,88.0,2020-07-30 00:00:00
"Just Dance Kids 2 (Nintendo Wii, 2011)",8.45,2020-07-30 00:00:00
"Harvest Moon: Animal Parade (Nintendo Wii, 2009) Complete w/ Manual - Tested",19.0,2020-07-30 00:00:00
"NES Remix Pack (Nintendo Wii U, 2014) Tested, Works Great, Excellent Condition",15.0,2020-07-30 00:00:00
NINTENDO WII SUPER MARIO BROS w/ INSTRUCTIONS,24.45,2020-07-30 00:00:00
Lego Marvel Avengers Wii U Nintendo Wii U Complete with marvel super heroes free,8.99,2020-07-30 00:00:00
Nintendo Wii U Deluxe 32GB White Handheld System,89.27,2020-07-30 00:00:00
Spongebob Squarepants Puss n Boots G-force Nintendo Wii Destroy All Humans Lot,14.98,2020-07-30 00:00:00
"Medieval Games (Nintendo Wii, 2009)",8.0,2020-07-30 00:00:00
Nintendo Wii Ãœ 32GB Bundle w/2 Games,149.25,2020-07-30 00:00:00
"Mario Sports Mix (Nintendo Wii, 2011)",18.29,2020-07-30 00:00:00
Mario Kart (Nintendo Wii) with racing wheel,28.04,2020-07-30 00:00:00
"Super Mario Galaxy (Nintendo Wii, 2007) (Used)",20.7,2020-07-30 00:00:00
"Disney Planes (Nintendo Wii, 2013)",6.8,2020-07-30 00:00:00
"Michael Jackson: The Experience (Nintendo Wii, 2010) Complete",19.04,2020-07-30 00:00:00
"Kidz Bop Dance Party The Video Game (Nintendo Wii, 2010)",10.0,2020-07-30 00:00:00
"Tales of Symphonia: Dawn of the New World (Nintendo Wii, 2008)",13.74,2020-07-30 00:00:00
Nintendo Wii U - Super Mario Bros U (with box and game),212.3,2020-07-30 00:00:00
"Nintendo Wii Console Bundle w/6 Games, 2 Remotes, Nunchuks, Gamepad",136.8,2020-07-30 00:00:00
Genuine BAND HERO Warriors of Rock DRUM PEDAL Nintendo Wii foot bass guitar hero,39.99,2020-07-30 00:00:00
"LEGO Pirates of the Caribbean: The Video Game (Nintendo Wii, 2011)",5.5,2020-07-30 00:00:00
"Trauma Center: New Blood (Nintendo Wii, 2007)",5.0,2020-07-30 00:00:00
"LEGO Batman 2: DC Super Heroes (Nintendo Wii, 2012)",7.0,2020-07-30 00:00:00
"Cooking Mama: Cook Off Nintendo Wii, Complete CIB, Tested",10.5,2020-07-30 00:00:00
"Guitar Hero: World Tour (Nintendo Wii, 2008)",13.1,2020-07-30 00:00:00
"Just Dance: Disney Party (Nintendo Wii, 2012)",17.05,2020-07-30 00:00:00
"Nintendo Wii Console System RVL-001 w/4 controllers, Wii-Speak, Board, no games",128.45,2020-07-30 00:00:00
Epic Mickey Paintbrush Nintendo Wii Nunchuk Controller,10.6,2020-07-30 00:00:00
Nintendo Wii Remote Plus (B00FLYZIM0) Gamepad,23.0,2020-07-30 00:00:00
"Tangled (Nintendo Wii, 2010)",8.8,2020-07-30 00:00:00
Nintendo Wii Mario Kart Wii Game W/ Steering Wheel,43.95,2020-07-30 00:00:00
Band Hero (Nintendo Wii Game) Complete w/ Manual ,8.99,2020-07-30 00:00:00
Nintendo Wii WHITE Video Game Console System ,74.85,2020-07-30 00:00:00
"LOT OF 6 NINTENDO WII GAMES, JUST DANCE 3, NANCY DREW, U DRAW, WII FIT & More",18.49,2020-07-30 00:00:00
"Dog Island (Nintendo Wii, 2008) Manual Included",9.9,2020-07-30 00:00:00
Skylanders Superchargers Racing Starter Pack - Dark edition (Nintendo Wii),39.8,2020-07-30 00:00:00
"Wii Games- Mario, Zelda, Wario, Strikers, Party 8, etc Nintendo Gamecube",84.1,2020-07-30 00:00:00
"Just Dance 4 (Nintendo Wii, 2012)",13.8,2020-07-30 00:00:00
"Nintendo Wii RVL-001 White Console (NTSC) With Controllers, Cables & More",107.86,2020-07-30 00:00:00
Nintendo Wii White Game System RVL-001  Controllers Games Gamecube Compatible ,86.0,2020-06-07 00:00:00
Nintendo Wii Console and Cables Only,75.2,2020-06-07 00:00:00
Nintendo Wii RVL-001 Console Bundle Mario Kart Wii Sports Super Mario Bros. +++,164.05,2020-06-07 00:00:00
Nintendo Wii Black Console RVL-001 Bundle,64.7,2020-06-07 00:00:00
Nintendo Wii Bundle (red),74.9,2020-06-07 00:00:00
Nintendo Wii White Console With Original Controllers And Wires- Tested Working,56.05,2020-06-07 00:00:00
Nintendo Wii Sports White Console in original box .(NEW) NEVER PLAYED Used accs,302.65,2020-06-06 00:00:00
Nintendo Wii Video Game Console / System + 2 Controllers/Sensor/Cables (bundle),62.98,2020-06-06 00:00:00
"Nintendo Wii BLACK Video Game Console System Bundle w 3 games, 2 controllers",100.05,2020-06-06 00:00:00
Nintendo Wii Sports Resort White Console,52.85,2020-06-06 00:00:00
Nintendo Wii Console,67.65,2020-06-06 00:00:00
NINTENDO Wii SPORTS BUNDLE: Black Console (RVL-101) COMPLETE AUTHENTIC Package!,133.01,2020-06-06 00:00:00
Nintendo Wii White Console + 5 games + hdmi adapter + 1 remote and 1 nunchuk,90.45,2020-06-06 00:00:00
Nintendo Wii Remotes Parts Only Non Working lot of 5 AS IS,21.5,2020-06-06 00:00:00
Nintendo Wii Console - WhiteÂ Includes Remote- Nunchuck and Cables and Game,67.0,2020-06-06 00:00:00
Nintendo Wii UÂ  32GB Console - Black w/ super Mario 3d world 2 pro controllers,175.0,2020-06-06 00:00:00
Nintendo Wii For Repair/Parts( Disc Read Error),34.5,2020-06-06 00:00:00
Sega Genesis Playstation 2 Nintendo XBox Wii Guncon Super Nintendo Controller ,31.31,2020-06-06 00:00:00
Nintendo Wii U 32GB Console Bundle,171.5,2020-06-06 00:00:00
Nintendo Wii console bundle with games,178.5,2020-06-06 00:00:00
Nintendo Wii Console Complete in Box w/ Wii Sports & Wii Remote Bundle,74.8,2020-06-06 00:00:00
"Nintendo Wii-U Mario & Luigi Deluxe Set Console  CIB w/ games, extras   WORKING",324.99,2020-06-06 00:00:00
Nintendo Wii White Console Lot RVL-001 Bundle with Wii Sports TESTED FAST SHIP,92.7,2020-06-06 00:00:00
Nintendo Wii Modded bundle Gamecube Wii Ps1 & Retro Games 2TB,296.57,2020-06-06 00:00:00
Nintendo Wii Sports Pack White Console (NTSC),86.2,2020-06-06 00:00:00
Nintendo Wii U Deluxe WUP-101(02) 32GB Video Game Console,167.5,2020-06-06 00:00:00
Nintendo Wii U: White Handheld System w/ 3 Lego Games & Pro Controller,182.6,2020-06-06 00:00:00
Nintendo Wii Console System Only White RVL-001 w/ 2 Classic Controllers,71.39,2020-06-06 00:00:00
Nintendo Wii U Launch Edition 32GB Black Handheld System,133.25,2020-06-06 00:00:00
lot of 2 Nintendo Wii Consoles Only RVL-001  power on AS IS parts repair,21.0,2020-06-06 00:00:00
NINTENDO WII U REPLACEMENT 32GB BLACK CONSOLE SYSTEM ONLY NO GAMEPAD,62.0,2020-06-06 00:00:00
Nintendo Wii U 32GB Black Handheld System - w/games Shown & Controller. Tested,185.35,2020-06-06 00:00:00
Nintendo Wii U Smash Splat Deluxe Set 32GB Black Handheld System,195.4,2020-06-06 00:00:00
"Nintendo Wii with 10 games, 3 controllers and charging station",179.2,2020-06-06 00:00:00
Nintendo Wii ðŸŒŸConsole RVL-001 3 game bundleðŸ”¥Lego-Mickey,66.66,2020-06-06 00:00:00
Nintendo Wii Mini 8GB Red Console + Mario Kart Game + Steering Wheel & More!!,95.0,2020-06-06 00:00:00
Nintendo Wii Black Console (RVL-101) w/ OEM Power & A/V Cable CLEANED / TESTED,57.0,2020-06-06 00:00:00
Nintendo Wii Super Mario Bros 25th Anniversary Red Console w Box Free Shipping ,114.5,2020-06-06 00:00:00
 Nintendo Wii U Black Replacement Console ,73.0,2020-06-06 00:00:00
Nintendo Wii Black Console RVL-001 Game Cube Compatible Bundle TESTED,102.5,2020-06-06 00:00:00
"Nintendo Wii WiiU System, 20 Games Controllers Bundle Wheels Mic all hardware  ",243.98,2020-06-06 00:00:00
Nintendo Wii White Console With Cords & Sensor Bar RVL-001 | GameCube Compatible,64.8,2020-06-06 00:00:00
"Nintendo Wii Model No. RVL-001 BROKEN, For Parts or Repair... NO SOUND OR VIDEO",22.94,2020-06-06 00:00:00
Nintendo Wii U The Legend of Zelda: The Wind Waker HD Deluxe CHECK DESCRIPTION,231.05,2020-06-06 00:00:00
NINTENDO WII U BLACK GAMEPAD TABLET CONTROLLER WITH CHARGER AND 4 GAMES MARIO,197.5,2020-06-06 00:00:00
Nintendo Wii U Deluxe 32GB White Handheld System + 5 Games,168.4,2020-06-06 00:00:00
Nintendo Wii Console bundle,115.72,2020-06-06 00:00:00
Nintendo Wii Console +Wii Balance Board + SportsKit +5 Games MARIO KART BUNDLE ,109.99,2020-06-06 00:00:00
"Used Nintendo Wii White Console w/ Two Controllers, One Nunchuk + games",85.9,2020-06-06 00:00:00
Nintendo Wii White Console (NTSC) Plus 3 Games! Console Only And Power Brick!,43.35,2020-06-06 00:00:00
Nintendo wii u black handheld (as is),44.16,2020-06-06 00:00:00
Used Nintendo Wii White Console Bundle (RVL-001),120.55,2020-06-06 00:00:00
Nintendo Wii Console System Tested RVL-101 With 7 Games,128.4,2020-06-06 00:00:00
Nintendo Wii Bundle Black Console with Wii Sports Games (Never Before Opened),535.9,2020-06-06 00:00:00
nintendo wii u 32gb Mario Kart 8 Super Smash+ Pro Controller +More -Tested Works,226.45,2020-06-06 00:00:00
Nintendo Wii White Console (NTSC),80.0,2020-06-06 00:00:00
NINTENDO WII - CONSOLE & MANY EXTRAS - CONTROLLERS / GAMES & MORE,71.5,2020-06-06 00:00:00
Nintendo Wii Game Console (Black) with Additional Remote & Nunchuk!!!,87.54,2020-06-06 00:00:00
Nintendo Wii Red Console And Accessories For Parts See Description,70.55,2020-06-06 00:00:00
"Nintendo Wii bundle: games, controllers, Wii Fit, MarioKart with wheels etc.",182.5,2020-06-06 00:00:00
"Nintendo Wii *GAMECUBE COMPATIBLE* - Console, Sensor Bar, Cords Included *WORKS*",46.59,2020-06-06 00:00:00
Nintendo Wii System RVL-001 White,62.0,2020-06-06 00:00:00
Nintendo Wii + Wii Sports/Wii Sports Resort Black Console 4 remotes 3 nunchucks,146.15,2020-06-06 00:00:00
Nintendo Wii Console Bundle - 2 Games + 2 Controllers,118.49,2020-06-06 00:00:00
Nintendo Wii Console Only Replacement White Edition UnTested For Parts,25.5,2020-06-05 00:00:00
Nintendo Wii White Console (NTSC),20.5,2020-06-05 00:00:00
Nintendo Wii White Console And Wires Only.,92.75,2020-06-05 00:00:00
Nintendo Wii Black Console With Cords & Sensor Bar RVL-001 GameCube Compatible,62.7,2020-06-05 00:00:00
Nintendo Wii U Black 32gb Console - With All US Games Installed,318.91,2020-06-05 00:00:00
Nintendo Wii - Original 8GB White Home Console Bundle,45.4,2020-06-05 00:00:00
nintendo wii console black,45.95,2020-06-05 00:00:00
Black Nintendo Wii Console,79.99,2020-06-05 00:00:00
Nintendo Wii With Wii Sports + Wii Sports Resort Black Console,69.2,2020-06-05 00:00:00
Nintendo Wii U Super Mario 3D World Deluxe Set 32GB Black Console COMPLETE CIB,170.74,2020-06-05 00:00:00
NINTENDO Wii Black With 12 Games,93.0,2020-06-05 00:00:00
NINTENDO Wii Bundle With 11 Games,91.0,2020-06-05 00:00:00
NINTENDO Wii Bundle Black With 12 Games,116.5,2020-06-05 00:00:00
NINTENDO Wii With 16 Games & 8 Accessories,143.5,2020-06-05 00:00:00
NINTENDO WII WHITE SYSTEM COMPLETE TESTED WORKING VIDEO GAME SYSTEM ,74.95,2020-06-05 00:00:00
**Sterilized** Nintendo Wii U 32GB Deluxe Black Gamepad & Main Unit WiiU 32 GB,162.45,2020-06-05 00:00:00
Nintendo Wii Console Bundle w/ Wii Sports Included in Original Box ~ Barely USED,142.5,2020-06-05 00:00:00
Nintendo Wii Console Bundle inc Accessories | Black | Model RVL-001 | TESTED,81.0,2020-06-05 00:00:00
Nintendo Wii U WUP-101(02),155.74,2020-06-05 00:00:00
Nintendo Wii U WUP-101(02),186.68,2020-06-05 00:00:00
Nintendo Wii U WUP-101(02),166.24,2020-06-05 00:00:00
Nintendo Wii U WUP-101(02),163.31,2020-06-05 00:00:00
Nintendo Wii U WUP-101(02),186.68,2020-06-05 00:00:00
Black Nintendo Wii Console RVL-001 Mario Cart Game Bundle W/steering Wheel,47.3,2020-06-05 00:00:00
5 WHITE Nintendo Wii Replacement Console System Only White RVL-001(USA) Working ,137.5,2020-06-05 00:00:00
Nintendo Wii U Deluxe 32GB Black Console - Mario Kart 8 - Zelda + Kirby & More,209.99,2020-06-05 00:00:00
"Nintendo Wii U 64gb With 9 Games, Pro Controller, Wii Controller, and Nunchuks",206.0,2020-06-05 00:00:00
Nintendo Wii U 32GB Deluxe Console w/ GamePad and 5 Games,187.5,2020-06-05 00:00:00
Nintendo Wii Black Console ONLY NO cords/controller (NTSC),57.2,2020-06-05 00:00:00
NINTENDO Wii With Controllers + Joysticks (Tested),47.83,2020-06-05 00:00:00
"Nintendo Wii U Black 32gb Console - With Gamebar, 2 handwands, 1Â ",97.52,2020-06-05 00:00:00
Nintendo Wii Console RVL-001 Bundle + Wii Sports,122.17,2020-06-05 00:00:00
"Nintendo Wii RVL-001 Console Bundle-Mario Kart, Super SmashBros 2 Wheels/4 Contr",166.4,2020-06-05 00:00:00
Nintendo Wii sports Console bundle 10 games wii fit sport resort ben 10 madden ,163.61,2020-06-05 00:00:00
Nintendo Wii Console White System RVL-001 Complete Bundle 2 Games Gamecube Comp,71.8,2020-06-05 00:00:00
Nintendo Wii sports Console bundle 25 games wii fit super mario kart play donkey,201.33,2020-06-05 00:00:00
Nintendo Wii RVL-101( USA ) BLUE Console Bundle 5 Games Tested works.,141.5,2020-06-05 00:00:00
"Nintendo RVL-001 Wii Console - Black includes remotes, controllers, nunchucks",81.95,2020-06-05 00:00:00
NICE BLACK Nintendo Wii  Console MARIO KART Bundle  Tested works.,99.5,2020-06-05 00:00:00
Nintendo Wii White Console (NTSC) w/ 2 controllers & all cords,96.0,2020-06-05 00:00:00
Nintendo Wii  Red Console Bundle 6 Games Tested works.,95.02,2020-06-05 00:00:00
Nintendo Wii Black in Aluminum Case with Games,79.99,2020-06-05 00:00:00
"Nintendo Wii Complete Bundle w/ Travel Case, Games +",69.0,2020-06-05 00:00:00
Nintendo wii rvl-001,63.65,2020-06-05 00:00:00
Nintendo wii bundle gamecube compatible  RVL001. With gold zelda remote.,182.44,2020-06-05 00:00:00
Nintendo Wii U 32GB Console Deluxe Set with Nintendo Land - Black (WUPSKAFB),172.45,2020-06-05 00:00:00
Nintendo Wii U 32GB Console - Black (2 games included!)Â ,186.5,2020-06-05 00:00:00
Nintendo Wii u console bundle Black 32 GB,234.5,2020-06-05 00:00:00
Nintendo Wii U Mario & Luigi Deluxe Set 32GB Black Console with Mario Game + Box,253.5,2020-06-05 00:00:00
Nintendo Wii System Console Black Lot 7 games 2 Controllers RVL-001,122.0,2020-06-05 00:00:00
Nintendo wii rvl-001 ,48.05,2020-06-05 00:00:00
 WHITE Nintendo Wii Replacement Console System Only RVL-001(USA) Working ,55.0,2020-06-05 00:00:00
Nintendo Wii Console - 2 Controls - Super Smash Brawl & Wii Sports,62.8,2020-06-05 00:00:00
Nintendo Wii White Console Missing Cover Works Great! RVL-001,61.0,2020-06-05 00:00:00
Nintendo Wii U The Legend of Zelda: The Wind Waker HD Deluxe Set 32GB Black Hanâ€¦,173.33,2020-06-05 00:00:00
 WHITE Nintendo Wii Replacement Console System Only White RVL-001(USA) Working U,50.0,2020-06-05 00:00:00
5 WHITE Nintendo Wii Replacement Console System Only White RVL-001(USA) Working ,172.5,2020-06-05 00:00:00
Nintendo Wii U Deluxe 32GB Black Console Bundle + Splat Smash Games On System,150.0,2020-06-05 00:00:00
"Nintendo Wii U 32GB (Black) Handheld System Console + 8 Games , Lots Of Extras",237.5,2020-06-05 00:00:00
Nintendo Wii White Console (NTSC) LOT (5 units),113.54,2020-06-05 00:00:00
Red Nintendo Wii 25th Anniversary Mario Edition - TESTED - With 1 remote & cords,98.0,2020-06-05 00:00:00
Nintendo Wii White Console Complete in box with 3 games,78.65,2020-06-05 00:00:00
Tested Nintendo Wii Replacement White Console Only RVL-001 ,45.9,2020-06-05 00:00:00
Nintendo Wii white console w/ 2 controllers and charger. Tested.,76.7,2020-06-05 00:00:00
Nintendo Wii U Mario & Luigi Premium Pack 32GB Black | Wii U Console,229.45,2020-06-05 00:00:00
"Nintendo Wii U 32g Deluxe + Mario Kart 8, Call of Duty, Minecraft & Mario Party",217.5,2020-06-05 00:00:00
Nintendo Wii Console Bundle (RVL-001) with Wii Sports and Remote -Tested!,83.4,2020-06-05 00:00:00
Nintendo Wii Console/Wires w/ Wii Sports+Mario Kart & Wheels Bundle!,118.01,2020-06-05 00:00:00
Nintendo Wii Console System Black RVL-101 tested.,61.05,2020-06-05 00:00:00
"INTENDO Wii,DRUM SET & GUITARðŸŽ®131 GAMES WII&CLASICC NINTENDO, BALANCE BOARD.ðŸŽ®",139.99,2020-06-05 00:00:00
Nintendo Wii U Launch Edition 32GB Black Handheld System,144.8,2020-06-05 00:00:00
Nintendo Wii RVT-R Reader Test Kit RVT-002,219.99,2020-06-05 00:00:00
Nintendo Wii White Console With Cords & Sensor Bar & Balance Board,67.7,2020-06-05 00:00:00
"Nintendo Wii Console, 4 games, controllers and sensor bar",176.7,2020-06-05 00:00:00
Nintendo Wii U Launch Edition 32GB Black Handheld System,88.0,2020-06-05 00:00:00
nintendo wii mini console red,65.14,2020-06-05 00:00:00
NINTENDO Wii Black Console Bundle RVL-001 With 1 Game + Base + Controller covers,86.55,2020-06-05 00:00:00
NINTENDO Wii White Console Bundle RVL-001 With 1 Games + Wii Wheel ,74.55,2020-06-05 00:00:00
Nintendo Wii U (32GB Black Console + Extra Controller),178.94,2020-06-05 00:00:00
Nintendo Wii Black and Red Console,70.0,2020-06-05 00:00:00
Nintendo Wii Console with lots of Games!,127.73,2020-06-05 00:00:00
Nintendo Wii White Console Mario Kart BUNDLE (RVL-001) + Controllers + MORE,237.49,2020-06-05 00:00:00
Nintendo Wii Holiday Bundle Black Console,95.9,2020-06-04 00:00:00
Nintendo Wii U 32GB Console Deluxe Set with Two games and original wires,130.0,2020-06-04 00:00:00
Nintendo Wii U Console - Black comes with everything in picture. Works great,163.95,2020-06-04 00:00:00
"NINTENDO WII W/ Games, Controllers, Accessories",90.0,2020-06-04 00:00:00
Nintendo Wii Console With Games And Skylanders Pad,83.0,2020-06-04 00:00:00
Nintendo Wii White Console (NTSC),50.9,2020-06-04 00:00:00
Nintendo Wii U 32GB Console 11 Games New Mario Bros LEGO Zelda,246.65,2020-06-04 00:00:00
Nintendo Wii U 32GB Mario Kart 8 Deluxe Console Bundle + 4 Games + 3 Controllers,365.0,2020-06-04 00:00:00
"Nintendo Wii RVL-001 Console Bundle-Mario Kart, 2 Wheels/Controllers",206.1,2020-06-04 00:00:00
Nintendo Wii Sports Resort White Console,70.2,2020-06-04 00:00:00
modded nintendo wii Full bundle With 1 TB Hard Drive,157.2,2020-06-04 00:00:00
Nintendo Wii RVL-001 (Black)Â ,117.9,2020-06-04 00:00:00
Nintendo Wii U Super Mario 3D World Deluxe Set 32GB Black Console ,247.5,2020-06-04 00:00:00
Nintendo RVL-001 Wii Console - White,205.59,2020-06-04 00:00:00
Awesome Nintendo Wii Console Bundle including Wii Sports & Original Box!,121.9,2020-06-04 00:00:00
"Nintendo Wii U system with 5 games, Pro Controller, Mario Kart 8, Super Mario ",239.99,2020-06-04 00:00:00
Nintendo Wii U Black 32gb Console - With Gamepad and All Cables and an older gm,151.23,2020-06-04 00:00:00
Nintendo Wii Broken console only,38.9,2020-06-04 00:00:00
Nintendo Wii White Console bundle with 16 games plus Wii Sports,219.29,2020-06-04 00:00:00
Nintendo wii u console bundle with game,178.83,2020-06-04 00:00:00
Nintendo Wii BUNDLE used White Console 4 Full Controllers Plus 5 Games TESTED,99.99,2020-06-04 00:00:00
Nintendo Wii Modded bundle Gamecube Wii Ps1 & Retro Games 2TB,267.57,2020-06-04 00:00:00
Nintendo Wii Mini 8GB Red Console tested works perfectly. Pics are of exact item,47.05,2020-06-04 00:00:00
Nintendo Wii Console Bundle With Mario Kart and Many Extras!,134.45,2020-06-04 00:00:00
Nintendo WII Game Console with Controllers + NunChucks + 7 Super WII Games,80.97,2020-06-04 00:00:00
Nintendo Wii White Console Tested Works,83.9,2020-06-04 00:00:00
Nintendo wii console and nyko controllers with all trimings original owner,88.0,2020-06-04 00:00:00
Nintendo Wii U 32GB Console Deluxe Set with Games,333.06,2020-06-04 00:00:00
White nintendo wii,100.13,2020-06-04 00:00:00
Nintendo Wii U 32GB Console Deluxe Set with Nintendo Land - Black,172.5,2020-06-04 00:00:00
Nintendo Wii U 32 GB Console w/ New Super Mario Bros. U & Xenoblade Chronicles X,216.0,2020-06-04 00:00:00
Nintendo Wii U Super Mario 3D World Deluxe Set 32GB Gamepad Included No Box,192.05,2020-06-04 00:00:00
"Nintendo Wii console bundle, 8 Games, 2 Controllers, Nanchuk, Sports Attachments",153.0,2020-06-04 00:00:00
Nintendo Wii U Launch Edition 32GB (Black) Handheld System Console + 6 Games,369.55,2020-06-04 00:00:00
"Nintendo Wii U Mario Kart 8 Deluxe 32GB + EXTRAS (4 Games, 2 Controllers & More)",224.8,2020-06-04 00:00:00
"Nintendo Wii Home Console with Cords, (4) hand-held controllers, and games",72.98,2020-06-04 00:00:00
**BROKEN** Nintendo Wii White Console **SOLD AS IS**,17.94,2020-06-04 00:00:00
Nintendo Wii,144.0,2020-06-04 00:00:00
