title,price,date
"New in Box! Olympus CAMEDIA C-5500 Zoom 5.1MP Digital Camera with card, batts",49.75,2020-08-15 00:00:00
"Olympus CAMEDIA C-765 Ultra Zoom 4.0MP Digital Camera - Silver, Bundle",49.89,2020-08-14 00:00:00
Olympus CAMEDIA C-765 Ultra Zoom 4.0MP Digital Camera - Silver,24.9,2020-08-14 00:00:00
Olympus Brio D-230 Camedia 2MP Digital Camera With Box A6,16.0,2020-08-14 00:00:00
Olympus Camedia CLA-1 41-43mm Conversion Lens Adapter Tube Camera Filter,19.89,2020-08-14 00:00:00
Olympus Black / Gray Camera Neck Strap Included w/ Camedia E-10 / E-20 ,7.99,2020-08-14 00:00:00
"USB Charge & Sync Cable for Olympus Camedia C-5500, C7000 Cameras",7.93,2020-08-13 00:00:00
128 MB MEG SMART MEDIA SM MEMORY CARD OLYMPUS CAMEDIA C-120 D-380 220Z 4000Z R4,74.87,2020-08-13 00:00:00
2! Olympus cameras CAMEDIA C-740 Ultra Zoom 3.2MP Digital Camera w box manuals +,41.18,2020-08-13 00:00:00
Olympus CAMEDIA C-2020 Zoom 2.1MP Digital Camera - Black & Metallic silver,28.34,2020-08-12 00:00:00
Olympus Camedia P-200 HP passport photo printer photo printers photo printer,59.15,2020-08-12 00:00:00
OLYMPUS CAMEDIA E-100RS DIGITAL CAMERA (E-100 RS) w/SOFTWARE & INSTRUCTIONS nice,69.99,2020-08-12 00:00:00
NEW OLYMPUS CAMEDIA P-P40 Print Pack for P-10 Series Digital Photo Printer,40.34,2020-08-12 00:00:00
NEW OLYMPUS CAMEDIA P-L1O0 Print Pack for P-10 Series Digital Photo Printer,34.5,2020-08-12 00:00:00
Olympus CAMEDIA D-380 2.0MP Digital Camera - Silver,20.74,2020-08-12 00:00:00
OLYMPUS CAMEDIA C-170 / C-180 / C-480 / C-500 / C-5500 DIGITAL CAMERA  USB CABLE,7.77,2020-08-12 00:00:00
Olympus CAMEDIA D-560 Zoom 3.2MP Digital Camera - Silver,13.98,2020-08-11 00:00:00
Olympus CAMEDIA C-4000 Zoom 4.0MP Digital Camera - Silver,9.99,2020-08-11 00:00:00
Olympus B-HLD10 Vertical Grip/Battery Holder for E-10 & E-20 Cameras 2 Batteries,92.9,2020-08-11 00:00:00
Kastar Battery AC Charger for Olympus Li-10B Li-12B & Camedia C-770 Ultra Zoom,11.99,2020-08-10 00:00:00
Olympus CAMEDIA D-550 Zoom 3.0MP 2.8X Zoom Digital Camera - Tested Working,24.99,2020-08-10 00:00:00
OLYMPUS CAMEDIA Digital Camera C-60 Optical ZOOM 6.1 ALL Accessories XD Card,21.9,2020-08-10 00:00:00
Kastar Battery Slim Charger for Olympus Li-10B Li-12B Li-10C & Camedia C-60 Zoom,6.59,2020-08-10 00:00:00
Olympus Camedia C-1000 L RARE Early Collectors Digital Bridge Camera,37.98,2020-08-10 00:00:00
Olympus CAMEDIA D-360L 1.2MP Digital Camera; works; memory card + download cable,15.99,2020-08-09 00:00:00
Kastar Battery Wall Charger for Olympus BLM-1 BLM-01 Camedia C-5060 Wide Zoom,11.49,2020-08-09 00:00:00
Olympus Camedia D-360L 1.3 MP Digital Camera - Tested! Accessories Included ,21.89,2020-08-08 00:00:00
"Olympus Camedia D-370 1.3 Digital Point-and-Shoot SmartMedia Camera, Tested",14.0,2020-08-08 00:00:00
Olympus Camedia C-5050zoom C-5050 35mm Digital Camera,34.5,2020-08-08 00:00:00
Olympus Camedia Digital High Speed Photo Quality Printer P-400 Gloss Paper 25 ct,14.99,2020-08-08 00:00:00
Olympus Camedia D-490 Zoom Digital Camera Free Shipping,11.19,2020-08-07 00:00:00
Olympus D-490 Zoom Digital 2.1 Megapixel Camera,11.25,2020-08-07 00:00:00
OLYMPUS CAMEDIA E-10 4.0 Megapixel Camera 9-36 Mm Sunpak 62mm And Charger,69.99,2020-08-07 00:00:00
Olympus CAMEDIA C-5060 Wide Zoom 5.1MP Digital Camera - Black,35.0,2020-08-06 00:00:00
Kastar Battery Wall Charger for Olympus BLM-1 BLM-01 & Camedia C-8080 Wide Zoom,5.99,2020-08-06 00:00:00
Olympus CAMEDIA C-50 Zoom 5.0MP Digital Camera - Silver,14.99,2020-08-05 00:00:00
Kastar Replacement Battery for Olympus Li-10B Li-12B Li-10C & Camedia C-50 Zoom,8.99,2020-08-05 00:00:00
Olympus C-6AU 6.5V 2A AC Adapter Camedia D500 Digital Camera - see notes,9.99,2020-08-05 00:00:00
Olympus C-4040 Zoom Camedia 4.1 Mega Pixel Digital Camera 	3x Optical Zoom,40.0,2020-08-05 00:00:00
NEW OLYMPUS 3V LITHIUM BATTERY CAMEDIA LB-01 / CR-V3 New in Seal ,9.05,2020-08-05 00:00:00
Olympus CAMEDIA D-340R 1.3MP Digital Camera - Silver,22.0,2020-08-04 00:00:00
Olympus Camedia C-765 4MP 10x Super Compact Ultra Zoom Digital Camera,24.88,2020-08-04 00:00:00
Olympus CAMEDIA C-2040 Zoom 2.1MP Digital Camera W/Bag & Manuel,22.0,2020-08-04 00:00:00
Olympus Camedia C-3030 Zoom Digital Camera w Memory Card Manual & Remote Bundle,26.98,2020-08-04 00:00:00
olympus camedia camera    c4000  c-4000          b1.06,13.15,2020-08-03 00:00:00
OLYMPUS CAMEDIA D-630 / Evolt E-30 / E-330 / E-400 DIGITAL CAMERA USB CABLE ,6.52,2020-08-03 00:00:00
USB Data SYNC Cable Cord Lead for Olympus camera Camedia D-595 D-545 D-435 D-425,6.95,2020-08-02 00:00:00
Olympus CAMEDIA C-740 Ultra Zoom 3.2MP Digital Camera - Silver Tested EUC,21.96,2020-08-02 00:00:00
OLYMPUS CAMEDIA C-170 / C-180 / C-480 / C-500 / C-5500 CAMERA USB DATA CABLE,7.06,2020-08-02 00:00:00
Olympus Camedia C-2500L Historic Collectors nr. Mint 1999 DSLR Digital Camera,77.31,2020-08-02 00:00:00
NEW OLYMPUS CAMEDIA P-P40 Print Pack for P-10 Series Digital Photo Printer,37.49,2020-08-01 00:00:00
Olympus Digital Camera C-720 Camedia Ultra 8X Zoom 3.0 MP Silver with Carry Case,19.99,2020-08-01 00:00:00
Olympus CAMEDIA C-8080 Wide Zoom 8.0MP Digital Camera,79.99,2020-08-01 00:00:00
Olympus CAMEDIA E-20N Digital SLR Camera w/Lens + Memory Card + Batteries,99.95,2020-08-01 00:00:00
Kastar Replacement Battery for Olympus Li-10B Li-12B Li-10C Camedia C-7000 Zoom,8.99,2020-08-01 00:00:00
Olympus CAMEDIA D-580 Zoom 4.0MP Digital Camera -Olympus D-560,17.7,2020-08-01 00:00:00
Olympus CAMEDIA C-5000 Zoom 5.0MP Digital Camera - Silver,18.99,2020-07-31 00:00:00
Olympus Camedia C-720 Ultra Zoom 3.0MP HD Digital Camera 8x Optical Smart Media ,17.22,2020-07-31 00:00:00
Olympus CAMEDIA C-740 Ultra Zoom 3.2MP Digital Camera - Silver,18.95,2020-07-31 00:00:00
Panasonic Toughbook CF-C1 Laptop Intel Core i5-2520M 2.50GHZ 4GB RAM NO HDD ,74.91,2020-07-31 00:00:00
Olympus CAMEDIA D-450 Zoom 1.3 MP Digital Camera - Champagne Excellent Condition,24.4,2020-07-31 00:00:00
OLYMPUS C-3020 AF Zoom Digital Camera Tested w/ card ,11.48,2020-07-30 00:00:00
Olympus DP72 CCD Digital Microscope Camera for Parts or Repair AS IS,149.99,2020-07-30 00:00:00
Kastar Battery AC Charger for Olympus Li-10B Li-12B Li-10C & Camedia D-590,9.59,2020-07-30 00:00:00
Olympus CAMEDIA C-2500L 2.5MP Digital SLR Camera - Black Z,33.19,2020-07-30 00:00:00
Lot of 2 Olympus CAMEDIA C-2500L Digital DSLR Zoom Camera Macroscopic Lens,40.99,2020-07-30 00:00:00
Genuine Olympus LH-1 Lens Hood f/ Camedia E-10 E-20 NEW #774,14.99,2020-07-29 00:00:00
#U) OLYMPUS CAMEDIA M-XD32P xD-Picture Card 32 MB ,10.0,2020-07-29 00:00:00
Olympus CAMEDIA C-700 Ultra Zoom 2.1MP Digital Camera -EXCELLENT- FREE SHIPPING,24.95,2020-07-29 00:00:00
LI-10B LI-12B Replacement Battery for OLYMPUS CAMEDIA C-50 C-60 C-70 C-5000 ZOOM,12.99,2020-07-28 00:00:00
"Olympus Camedia C-5050 Zoom Digital Camera, Used, F1.8 Super Bright Zoom 5mp",41.0,2020-07-28 00:00:00
olympus camedia camera    d555  d-555    b1.01,10.15,2020-07-28 00:00:00
Olympus CAMEDIA C-765 Ultra Zoom 4.0 MP 10.0x Optical Zoom Silver UVGC Guarantee,38.85,2020-07-28 00:00:00
Lot Of 4 Working - Olympus Camedia C-765 C-770 Stylus 500 600 Digital Cameras,43.49,2020-07-28 00:00:00
Olympus CAMEDIA C-750 Ultra Zoom 4.0MP Digital Camera - Silver PARTS ONLY ,26.99,2020-07-28 00:00:00
2 Olympus Cameras  CAMEDIA C-4000 Zoom and C-50 Zoom,30.74,2020-07-27 00:00:00
Olympus CAMEDIA C-3000 Zoom 3.3MP Digital Camera Bundle,37.54,2020-07-27 00:00:00
Olympus Camedia D-100 1.3 Megapixel Digital Camera with Samsonite case T,17.7,2020-07-27 00:00:00
Kastar Battery LCD Charger for Olympus Li-10B & Olympus Camedia C-770 Ultra Zoom,8.59,2020-07-27 00:00:00
Olympus CAMEDIA C-8080 Wide Zoom 8.0MP Digital Camera with Electronic Flash,135.0,2020-07-27 00:00:00
Olympus Camedia C-750 Ultra Zoom 4.0 MP P&S Digital Camera 10x Optical Zoom,37.71,2020-07-26 00:00:00
Vintage Olympus Camedia D-370 1.3 MP Digital Camera 2x Digital Zoom Original Box,13.99,2020-07-26 00:00:00
Genuine - Olympus Camedia C-740 Etc. Digital Camera Black Lens Cap w/ Leash,12.99,2020-07-26 00:00:00
Kastar Battery AC Charger for Olympus Li-60B LI60B & Olympus CAMEDIA FE-370,5.99,2020-07-26 00:00:00
OLYMPUS CAMEDIA C-5060 WIDE ZOOM 5.1MP DIGITAL CAMERA BLACK,36.9,2020-07-26 00:00:00
"Olympus Camedia C-730 Digital Point and Shoot Camera w/ Case, Cap, Strap, in EC.",44.89,2020-07-26 00:00:00
olympus camedia camera    c3000  c-3000          b1.02,11.9,2020-07-26 00:00:00
Genuine Olympus LC-58 58mm Front Lens Cap for Camedia C-8080 Wide Zoom,9.95,2020-07-25 00:00:00
Olympus CAMEDIA C-3030 Zoom 3.3MP Digital Camera w/ 64MB Smart Media Card Bundle,35.98,2020-07-25 00:00:00
EX! Olympus Camedia C-211 Zoom Digital Printing Camera Polaroid TESTED WORKING,48.65,2020-07-25 00:00:00
"OLYMPUS CAMEDIA TELE EXTENSION LENS PRO TCON-300 & TCON-SA1 Support Arm, Case",50.0,2020-07-25 00:00:00
Olympus CAMEDIA C-700 Ultra Zoom 2.1MP Digital Camera -EXCELLENT- FREE SHIPPING,27.95,2020-07-25 00:00:00
Olympus Camedia FL-BK01 Flash bracket,34.94,2020-07-25 00:00:00
Olympus CAMEDIA D-540 Zoom 3.2MP Digital Camera - Silver - Case Cable Card,9.0,2020-07-25 00:00:00
Camedia Master 4.2 Software for Olympus C160/D-395 Digital Camera,5.0,2020-07-25 00:00:00
Olympus Camedia Master 4.0 Reference Manual CD-ROM Software Windows & Macintosh,7.99,2020-07-24 00:00:00
OLYMPUS LI-10B LITHIUM ION RECHARGEABLE BATTERY PACK Camedia - A,16.09,2020-07-24 00:00:00
USB Data SYNC Cable Cord Lead For Olympus camera Camedia D-595 D-545 D-435 D-425,6.59,2020-07-24 00:00:00
Olympus Camedia FE-5500 5MP 3x Zoom Quality All Metal Digital Camera,19.63,2020-07-24 00:00:00
Olympus Camedia E-10 Digital SLR Camera,81.66,2020-07-24 00:00:00
Olympus CAMEDIA C-5050 Zoom 5.0MP Digital Camera BUNDLE with case,40.05,2020-07-23 00:00:00
"Silver OLYMPUS CAMEDIA C-450 Zoom Digital Camera Boxed, Instructions & Card",30.14,2020-07-23 00:00:00
"Olympus CAMEDIA C-60 Camera 6.1MP 3x Zoom Silver, 4 xD cards, charger, etc",36.9,2020-07-23 00:00:00
Olympus CAMEDIA C-60 Zoom 6.1MP Digital Camera,11.0,2020-07-23 00:00:00
Olympus P-RBWW Glossy Ribbon Kit For P400 / 440 Printers Dye Sublimation 10/2012,42.99,2020-07-23 00:00:00
"New Olympus Remote Control RM-1 for Olympus CAMEDIA, Stylus and E-Sytem Cameras",24.98,2020-07-23 00:00:00
"Olympus TCON-14B Tele Extension Lens Pro CAMEDIA, W/ Box, CLEAN!",43.2,2020-07-22 00:00:00
OLYMPUS CAMEDIA ELECTRONIC FLASH FL-20 FLASH GUN WITH ORIGINAL CASE,49.99,2020-07-22 00:00:00
Olympus CAMEDIA C-5060 Wide Zoom 5.1MP Digital Camera untested,20.98,2020-07-22 00:00:00
Battery / CHARGER for OLYMPUS Li-10b Li-12B Li-10C Camedia C X µ / SANYO DB-L10,13.95,2020-07-21 00:00:00
Used Olympus Camera  D-380 Digital 2.0 Megapixel Camedia,13.95,2020-07-21 00:00:00
Olympus CAMEDIA C-2500L Digital DSLR Zoom Camera Teleconverter Macroscopic Lens,53.89,2020-07-21 00:00:00
Olympus Camedia C-3020 3.2MP 3x Zoom AA Battery Digital Camera and Case,31.43,2020-07-21 00:00:00
Olympus CAMEDIA C-8080 Wide Zoom 8.0MP Digital Camera - Black,111.39,2020-07-21 00:00:00
Olympus CAMEDIA C-730 Ultra Zoom 3.2 MP 10x Optical Zoom Silver #31B,20.0,2020-07-20 00:00:00
"Olympus D100 Camedia 100 1.3MP Digital Camera - Black, Works",10.5,2020-07-20 00:00:00
"Olympus Camedia C-7000 Zoom Silver 7.1.0MP Digital Camera, Battery Charger Card",23.11,2020-07-20 00:00:00
Olympus CAMEDIA E-20N 5.0MP Digital SLR Camera,53.1,2020-07-20 00:00:00
Olympus Camedia D-580 Zoom 4MP Digital Camera Memory Card / Case / Manual Tested,26.64,2020-07-20 00:00:00
Olympus CAMEDIA C-3040 Zoom 3.3MP Digital Camera  BLACK with card,29.25,2020-07-19 00:00:00
Olympus CAMEDIA D-340R 1.3MP Digital Camera Silver 16/8mb Memory Card +Reader L,19.99,2020-07-19 00:00:00
Olympus Digital Camera Camedia D-40 Zoom,33.64,2020-07-19 00:00:00
Olympus B-HLD30 Power Battery Holder for the C-8080 Wide Zoom 200439,95.0,2020-07-19 00:00:00
Olympus Camedia C-5000 Zoom CAMERA REPLACEMENT USB DATA SYNC CABLE/LEAD,9.15,2020-07-19 00:00:00
Olympus Camedia C-700 & C-2040Zoom Digital Cameras - One 8MP Media Card - Tested,29.75,2020-07-18 00:00:00
Olympus CAMEDIA D-460 Zoom 1.3MP Digital Camera - Silver / 1Memory card included,18.0,2020-07-18 00:00:00
Kastar Replacement Battery for Olympus Li-10B Li-12B Camedia C-5000 Sport Zoom,6.59,2020-07-17 00:00:00
Olympus Snapshot Gloss Photo Paper P-A4L for P-400 Series camedia 25 pcs new,14.99,2020-07-17 00:00:00
Olympus Camedia D-450 Zoom Digital Camera - Camera Only  6.J1,17.99,2020-07-17 00:00:00
"Olympus Digital Camera D-450 Zoom CAMEDIA 1.3 MP 3x Zoom - Tested, With Bag",20.98,2020-07-17 00:00:00
Olympus CAMEDIA D-450 LCD Zoom 1.3 Megapixel Digital Camera Bundle,44.99,2020-07-17 00:00:00
OLYMPUS CAMEDIA C-750 Ultra Zoom 4.0MP Digital Camera Huge Bundle - FOR PARTS,46.9,2020-07-17 00:00:00
Olympus C 740 Ultra Zoom Digital Camera,44.65,2020-07-17 00:00:00
"OLYMPUS CAMEDIA 8080 DIGITAL 8MP CAMERA-2 CHARGING BATTERIES, REMOTE AND MORE!!",99.99,2020-07-17 00:00:00
Olympus Camedia FE-5500 5MP 3x Optical Top Quality All Metal Digital Camera,20.94,2020-07-16 00:00:00
OLYMPUS CAMEDIA 4346 43-46mm STEP UP RING NEW,8.66,2020-07-16 00:00:00
Olympus CAMEDIA D-380 2.0MP Digital Camera - Silver,9.89,2020-07-16 00:00:00
Olympus Camedia C-3030 Zoom Digital Camera ,34.85,2020-07-16 00:00:00
OLYMPUS XD Picture Card 32 MB Panorama -200841 Camedia Camera New In Package,26.7,2020-07-15 00:00:00
Olympus Camedia D-360L 1.3 MP Digital Camera - Clean condition!,24.98,2020-07-14 00:00:00
Olympus Camedia Master Software CD for Windows & Macintosh,5.99,2020-07-14 00:00:00
Olympus CAMEDIA C-4000 Zoom 4.0MP Digital Camera - Silver~~Nr Mint~~Bundle~~,29.99,2020-07-14 00:00:00
Kastar Replacement Battery for Olympus Li-10B Li-12B Li-10C & Camedia D-590,6.59,2020-07-14 00:00:00
Olympus Camedia Digital Camera C-4000 Zoom with Camera Strap,23.99,2020-07-14 00:00:00
Olympus Camera D-490 Zoom 2.1MP Digital Camera Gray metallic,38.0,2020-07-14 00:00:00
Olympus CAMEDIA C-740 Ultra Zoom 3.2MP Digital Camera - Silver Tested & WORKS!!!,19.98,2020-07-13 00:00:00
Olympus C3030 3.3 MP Includes Case And 16MB Smart Media Card,29.99,2020-07-13 00:00:00
Kastar Battery LCD Wall Charger for Olympus Li-10B Li-12B & Camedia C-7000 Zoom,7.99,2020-07-13 00:00:00
Olympus CAMEDIA D-340R 1.3MP Digital Camera - Silver - 8mb Memory Card + Reader,18.39,2020-07-13 00:00:00
Olympus Camedia C-750 Ultra Zoom Digital Camera 4MP 10x Optical Zoom,47.9,2020-07-13 00:00:00
Olympus CAMEDIA C-4040 4.1MP Digital Camera - Black,25.95,2020-07-13 00:00:00
Olympus CAMEDIA C-770 Lot Ultra Zoom 4.0MP Digital Camera~~Mint~~Bundle~~ ,54.99,2020-07-13 00:00:00
Olympus Camedia Master Pro 4.2 for PC and Mac CD,9.98,2020-07-12 00:00:00
"Olympus Camedia  Master 4.2 CD for C-460/D-580 Zoom, X-400",10.0,2020-07-12 00:00:00
OEM Olympus Camedia D-565 Zoom 4.0MP Digital Camera Tested Cleaned Free Shipping,9.95,2020-07-12 00:00:00
Olympus Camedia C-2500L Digital Camera,25.99,2020-07-12 00:00:00
Kastar Replacement Battery for Olympus Li-10B Li-12B & Camedia C-765 Ultra Zoom,8.99,2020-07-11 00:00:00
Olympus D-600L Digital Camera,23.7,2020-07-11 00:00:00
USB Cable Cord for Olympus Camedia C-2 C-50 C-60 C-150 C-160 C-220 C-300 Zoom,6.98,2020-07-11 00:00:00
Olympus C-300 zoom PLUS 64mb card and case,13.1,2020-07-11 00:00:00
Olympus Camedia C-8080 Digital Camera w/ Battery Charger Hood Box more #677,124.0,2020-07-11 00:00:00
"EXC+++ OLYMPUS C-2500L DIGITAL CAMERA, CAP, STRAP, 512MB CF, TESTED, CLEAN",41.95,2020-07-11 00:00:00
Olympus CAMEDIA D-40 Zoom 4.0MP Digital Camera - Silver,21.95,2020-07-10 00:00:00
Olympus Camedia C-2040 2.1MP 3x Zoom AA Battery Digital Camera and Case,31.43,2020-07-10 00:00:00
Olympus CAMEDIA C-3000 Zoom 3.3MP Digital Camera,19.99,2020-07-10 00:00:00
Olympus CAMEDIA C-3030 Zoom 3.3MP Digital Camera - Black,34.89,2020-07-10 00:00:00
2 Pk Olympus Camedia Batteries LB-01 CR-V3 3Volt Lithium Battery  Factory Sealed,12.94,2020-07-10 00:00:00
Olympus CAMEDIA D-360L 1.2MP Digital Camera - Silver,40.0,2020-07-10 00:00:00
USB Cable Olympus Camedia Zoom C-460/C-520/C-550/C-8080,3.92,2020-07-10 00:00:00
OLYMPUS CAMEDIA D-7AC AC ADAPTER FOR DIGITAL CAMERA,9.48,2020-07-10 00:00:00
Olympus CAMEDIA C-5050 Zoom 5.0MP Digital Camera - PARTS or REPAIR,16.91,2020-07-10 00:00:00
Olympus CAMEDIA C-730 Ultra Zoom 3.2 MP 10x Zoom New Digital Camera Silver,37.99,2020-07-09 00:00:00
Olympus CAMEDIA C-2100 UZ 2.1MP 10.0x Optical Zoom Silver UVGC Guarantee Bundled,52.85,2020-07-09 00:00:00
Olympus CAMEDIA C-5050 Zoom 5.0MP Digital Camera w/2 CARDS & USB Reader - TESTED,43.7,2020-07-09 00:00:00
Olympus Camedia C5050 PT-015 Waterproof Underwater Camera Case 40M Dive,50.98,2020-07-09 00:00:00
Olympus Camedia C5050 PT-015 Waterproof Case 40M Dive EUC,17.0,2020-07-09 00:00:00
"NEW Olympus Remote Control RM-1 for Olympus Camedia, Stylus and E-System Cameras",12.49,2020-07-09 00:00:00
Li-10B  LI-12B Battery for  OLYMPUS Stylus 1000  Stylus 600 Digital  Camedia X-1,13.99,2020-07-09 00:00:00
Olympus CAMEDIA D-490 Zoom 2.1MP Digital Camera - FREE SHIPPING,15.0,2020-07-09 00:00:00
Camedia Master 4.2 Software for Olympus Stylus 410 Digital Camera,10.99,2020-07-09 00:00:00
Olympus CAMEDIA C-5050 ZOOM 5.1MP  3x Optical Zoom Black UVGC Guarantee Bundled ,61.5,2020-07-09 00:00:00
Olympus Postcard Gloss Photo Paper P-A4P for P-400 Series camedia 25 pcs new,14.99,2020-07-09 00:00:00
OLYMPUS CAMEDIA D-390 SILVER 2.0MP 2X DIGITAL CAMERA,13.93,2020-07-08 00:00:00
"Olympus CAMEDIA C-3000 Zoom 3.3MP w/ Case 8MB, Two 32MB SmartMedia Cards, Remote",19.5,2020-07-08 00:00:00
USB Battery Charger for Olympus Camedia C-730 C-730UZ C-740 C-740UZ C-745 FE-120,9.98,2020-07-08 00:00:00
Micro USB Battery Charger for Olympus Camedia C-5060 C-7070 C-8080 Wide Zoom,9.98,2020-07-08 00:00:00
olympus camedia  camera    c5000  c-5000     b1.04,9.25,2020-07-08 00:00:00
Olympus Camedia P-400 Digital Sublimation Color Photo Printer W/30 Print Paper,118.99,2020-07-07 00:00:00
Olympus CAMEDIA E-10 4.0MP Digital SLR Camera - Black (Kit w/ ED 9-36mm Lens),29.29,2020-07-07 00:00:00
Olympus CAMEDIA C-720 Ultra Zoom 3.0 MP - Silver~~Excellent~~45.6 - 52  Adapter,19.99,2020-07-07 00:00:00
Olympus CAMEDIA C-3000 Zoom 3.3MP Digital Camera w/ Manual and Extras,50.79,2020-07-07 00:00:00
Olympus Camedia D-395 3.2MP Camera,12.52,2020-07-07 00:00:00
Olympus CAMEDIA C-700 Ultra Zoom 2.1MP Digital Camera - Black & Metallic silver ,20.0,2020-07-07 00:00:00
Olympus CAMEDIA C-700 Ultra Zoom 2.1MP Camera - Black & Metallic silver ,20.0,2020-07-07 00:00:00
Olympus CAMEDIA C-5000 Zoom 5.0MP Digital Camera - Silver,12.0,2020-07-07 00:00:00
Olympus CAMEDIA C-4000 Zoom 4.0MP /Olympus C-700 2.1 MP digital Camera,15.0,2020-07-07 00:00:00
Olympus CAMEDIA C-60 Zoom 6.1MP Digital Camera - Silver,10.0,2020-07-07 00:00:00
olympus camera  camedia c5050 c-5050       b1.04,41.5,2020-07-07 00:00:00
Used Olympus Camera  D-380 Digital 2.0 Megapixel Camedia,14.35,2020-07-07 00:00:00
Olympus CAMEDIA D-380 2.0MP Digital Camera - Silver,19.59,2020-07-07 00:00:00
VTG Olympus Camedia D-380 2MP Digital Camera Working DC IN .. USB ready CLEAN,18.94,2020-07-07 00:00:00
Olympus Camedia C5050 PT-015 Waterproof Underwater Camera Case 40M Dive,34.99,2020-07-06 00:00:00
Olympus Camedia C-5050 5.0MP Digital Camera F1.8 Lens with Box and Extras,68.91,2020-07-06 00:00:00
Olympus CAMEDIA C-211 Zoom 2.1MP Digital Camera - Black & Metallic silver,47.14,2020-07-06 00:00:00
OLYMPUS Camedia C-211 Instant Printing Digital Camera (Complete),29.99,2020-07-06 00:00:00
Olympus CAMEDIA C-211 Zoom 2.1MP Digital Camera - Black & Metallic silver,39.4,2020-07-06 00:00:00
Olympus CAMEDIA C-770 Ultra Zoom 4.0MP Digital Camera Silver W/ Accessories,51.95,2020-07-06 00:00:00
Genuine Olympus LC-58 58mm Front Lens Cap for Camedia C-8080 Wide Zoom,9.95,2020-07-05 00:00:00
Olympus CAMEDIA C-720 Ultra Zoom 3.0MP Digital Camera - Silver 250819S,19.99,2020-07-05 00:00:00
olympus camedia  camera    c5000  c-5000     b1.05,10.4,2020-07-05 00:00:00
Olympus CAMEDIA C-3030 Zoom 3.3MP Digital Camera - Black,19.9,2020-07-05 00:00:00
Olympus C-8080 8MP Digital Camera with 5x Optical Wide Zoom (225450),424.72,2020-07-05 00:00:00
Olympus Camedia C-5060 Wide Zoom 5.1MP 4x Wide Semi Pro Digital Camera *READ*,51.09,2020-07-05 00:00:00
Olympus Camedia Digital Camera D340-R 1.3 Megapixel Olympus Lens 5.5 mm 1.2.8,13.5,2020-07-04 00:00:00
Kastar Battery Travel Charger for Olympus Li-10B Li-12B Li-10C & Camedia D-590,5.99,2020-07-04 00:00:00
Olympus CAMEDIA D-490 Zoom 2.1MP Digital Camera - Gray metallic With Manuals,18.99,2020-07-04 00:00:00
Olympus Camedia RM-1 remote control for digital camera,14.34,2020-07-04 00:00:00
Olympus CAMEDIA E-20N 5.0MP Digital SLR Camera - comes with power grip.batteries,95.0,2020-07-03 00:00:00
Olympus CAMEDIA D-360L 1.3MP Digital Camera - Silver w/SD Card and Bag - Tested,34.85,2020-07-03 00:00:00
OLYMPUS CAMEDIA D-435 SILVER 5.1MP COMPACT DIGITAL POINT AND SHOOT CAMERA #720,35.39,2020-07-03 00:00:00
Olympus xD-Picture Card Camedia USB Reader/Writer MAUSB-10,27.35,2020-07-03 00:00:00
Olympus Camedia Floppy Disk Adapter Flash Path WAFP-2 SmartMedia FDD,12.99,2020-07-03 00:00:00
Kastar Replacement Battery for Olympus Li-60B LI60B & Olympus CAMEDIA FE-370,6.99,2020-07-03 00:00:00
Olympus CAMEDIA C-4000 Zoom 4.0MP Digital Camera,17.8,2020-07-02 00:00:00
Genuine Olympus 128MB MEG SMART MEDIA SM MEMORY CARD CAMEDIA M-128PEID/3.3V 💯,93.06,2020-07-02 00:00:00
Olympus Camedia Floppy Disk Adapter Flash Path WAFP-2 SmartMedia FDD,14.8,2020-07-02 00:00:00
"Olympus Remote Control RM-1 for Olympus Camedia, Stylus, E-System Cameras",6.95,2020-07-02 00:00:00
Olympus CAMEDIA C-4000 Zoom 4.0MP Digital Camera TESTED WORKS,23.49,2020-07-02 00:00:00
Olympus CAMEDIA C-4000 Zoom 4.0MP Digital Camera With Case & Instructions,27.99,2020-07-02 00:00:00
Olympus Camedia C-3040Zoom Digital Camera Kit with FL40 & FL-BK01 Flash,99.0,2020-07-02 00:00:00
Olympus Camedia C-700 Ultra Zoom 2.1MP Digital Camera - Excellent,11.95,2020-07-01 00:00:00
Olympus CAMEDIA C-765 Ultra Zoom 4.0MP Digital Camera w/3x XD Cards AV Manuals,38.9,2020-06-30 00:00:00
Olympus B-HLD10 Vertical Grip/Battery Holder for E-10 & E-20 Cameras 200721 Read,79.99,2020-06-30 00:00:00
Olympus Camedia Flash Path Floppy Disk Adapter MAFP-1 Smart Media,9.99,2020-06-30 00:00:00
Olympus CAMEDIA C-720 Ultra Zoom 3.0 MP Digital Camera Manual Memory,24.98,2020-06-29 00:00:00
Olympus CAMEDIA C-725 Ultra Zoom 3.0MP Digital Camera - Silver,14.99,2020-06-29 00:00:00
Olympus CAMEDIA RM-1 Remote Control Supports Many Models with Battery,9.99,2020-06-29 00:00:00
Olympus CAMEDIA D-580 Zoom 4.0MP Digital Camera - Silver,11.44,2020-06-29 00:00:00
Olympus CAMEDIA D-580 Zoom 4.0MP Digital Camera - Silver,10.5,2020-06-29 00:00:00
Olympus CAMEDIA C-765 Ultra Zoom 4.0MP Digital Camera - Silver Camera Only,18.99,2020-06-29 00:00:00
OLYMPUS CAMEDIA Digital Camera D-390,7.99,2020-06-28 00:00:00
Working Olympus Camedia C-2000 Z 2.0 MP Digital Camera No Card,22.15,2020-06-28 00:00:00
Olympus Camedia D-395 3.2MP Digital Camera W/16MB Card,15.0,2020-06-28 00:00:00
"Olympus Camedia C- 5060 wide zoom - flash, two batteries & charger",39.05,2020-06-28 00:00:00
Olympus CAMEDIA C-2100 10x Optical Ultra Zoom 2.1MP Digital Camera + Accessories,20.2,2020-06-28 00:00:00
Olympus CAMEDIA C-5050 Zoom 5.0MP Digital Camera - Black,33.25,2020-06-28 00:00:00
Kastar Battery Slim Charger for Olympus Li-60B LI60B & Olympus CAMEDIA FE-370,9.59,2020-06-28 00:00:00
Olympus CAMEDIA C-765 Ultra Zoom 4.0 MP 10.0x Optical Zoom Silver UVGC Guarantee,30.95,2020-06-28 00:00:00
Kastar Battery AC Charger for Olympus Li-10B Li-12B Camedia C-5000 Sport Zoom,6.99,2020-06-28 00:00:00
Olympus CAMEDIA C-3000 Zoom 3.3MP Digital Camera Bundle - Tested & Working,23.98,2020-06-28 00:00:00
Olympus CAMEDIA C-700 Zoom 10X 2.1MP Digital Camera - Black & Metallic silver,30.9,2020-06-28 00:00:00
Kastar Battery LCD Charger for Olympus Li-60B LI60B & Olympus CAMEDIA FE-370,7.99,2020-06-27 00:00:00
Olympus CAMEDIA E-20P - 5MP & 35-140mm Lens - Tested/Fully Working - See Details,39.26,2020-06-27 00:00:00
Olympus CAMEDIA 370 Zoom 3.2MP Digital Camera - Silver,26.2,2020-06-27 00:00:00
EDDIE BAUER Padded Camera Bag  Includes Olympus Camedia Digital Cam and MORE.,31.06,2020-06-26 00:00:00
Olympus Camedia E-20n E-20 5.0mp Digital SLR Camera with Lens,60.85,2020-06-26 00:00:00
Olympus CAMedia D-490 Zoom 2.1MP Digital SLR Camera + 32MB Memory Card - Tested,20.98,2020-06-25 00:00:00
Olympus CAMEDIA D-425 4.0MP Digital Camera - With USB cable & Memory card,21.38,2020-06-25 00:00:00
Olympus Camedia C-50 Zoom 5.0MP Digital Camera Silver With Battery & Charger,20.98,2020-06-25 00:00:00
Olympus Camedia D-520 Zoom 2.0 Megapixel Digital Camera Vintage With Box Mint,31.75,2020-06-25 00:00:00
Olympus CAMEDIA C-720 Ultra Zoom 3.0MP Digital Camera - VERY GOOD,14.0,2020-06-25 00:00:00
Olympus CAMEDIA C-2500L 2.5MP Digital SLR Camera - Black Z,38.19,2020-06-24 00:00:00
Olympus CAMEDIA C-60 Camera 6.1MP 3x Optical Zoom Silver Camera Bag,24.69,2020-06-24 00:00:00
Olympus CAMEDIA C-3040 Zoom 3.3MP Digital Camera - Black ,10.0,2020-06-24 00:00:00
Vintage Olympus Camedia Olympus C-5050 Zoom 3x Optical Zoom,45.12,2020-06-24 00:00:00
Olympus Camera D-380 Digital 2.0 Megapixel Camedia with cards used in orig box,14.99,2020-06-24 00:00:00
Olympus Camedia C-310 3 Mega Pixel Digital Compact Camera. stock No. U10528,39.31,2020-06-24 00:00:00
Olympus Camedia C-2500L Digital Camera Bundle (Mint Condition),143.63,2020-06-23 00:00:00
