title,price,dateOlympus Camedia 5.1MP Vintage AA Battery Digital Camera,18.32,2020-06-23 00:00:00
Olympus CAMEDIA C-720 Ultra Zoom 3.0MP Digital Camera - Silver,16.0,2020-06-23 00:00:00
NEW Olympus Camedia P-10 Digital Photo Printer Thermal dye sub USB with extras,110.19,2020-06-23 00:00:00
"NEW Olympus Remote Control RM-1 for Olympus Camedia, Stylus and E-System Cameras",12.99,2020-06-22 00:00:00
Olympus CAMEDIA D-520 Zoom 2.0MP Digital Camera - Black & Metallic silver,13.24,2020-06-22 00:00:00
Olympus CAMEDIA D-360L 1.3MP Digital Camera - Silver,24.29,2020-06-22 00:00:00
Olympus Camedia RM-1 Remote Control For Olympus E1 E3 E5 E10 E20 E30 E510 E410,9.95,2020-06-22 00:00:00
Olympus Camedia D-580 Zoom 4MP Digital Camera w/case and usb cable,9.99,2020-06-21 00:00:00
Olympus Camedia D-580 Zoom Digital Camera 1c,9.85,2020-06-21 00:00:00
Olympus Camedia c4000 zoom digital camera! Untested. No Batteries. Clean!,23.25,2020-06-20 00:00:00
olympus camedia camera    c4000  c-4000          b1.04,11.78,2020-06-20 00:00:00
Kastar Battery LCD Fast Charger for Olympus BLM-1 BLM01 Camedia C-8080 Wide Zoom,26.99,2020-06-20 00:00:00
Kastar Replacement Battery for Olympus Li-10B Li-12B Li-10C Camedia C-5000 Zoom,6.59,2020-06-19 00:00:00
"Olympus CAMEDIA D-360L 1.3MP Digital Camera - Silver w/SD Card, Case  D1",14.95,2020-06-19 00:00:00
Olympus CAMEDIA C-7000 Zoom Pocketable 7.1MP Digital Camera - Tested and Works!,40.89,2020-06-19 00:00:00
Olympus CAMEDIA C-5060 Wide Zoom 5.1MP Digital Camera ,48.49,2020-06-19 00:00:00
Olympus CAMEDIA C-5060 Wide Zoom 5.1MP Digital Camera - Black,44.95,2020-06-19 00:00:00
Olympus CAMEDIA C-4000 Zoom 4.0MP Digital Camera - Silver,22.95,2020-06-18 00:00:00
Kastar Battery AC Charger for Olympus Li-10B Li-12B Li-10C & Camedia C-50 Zoom,9.59,2020-06-17 00:00:00
Battery + Charger Combo For Olympus Li-42B Li-40B Camedia FE-340 FE-350 FE-360,10.89,2020-06-17 00:00:00
Olympus CAMEDIA C-50 Zoom 5.0MP Digital Camera - Silver,10.99,2020-06-16 00:00:00
Olympus Camedia C-70 Digital Compact Camera. Stock No u10904,65.53,2020-06-16 00:00:00
Olympus Camedia D-580 Zoom 4MP Digital Camera ,9.99,2020-06-16 00:00:00
Olympus Camedia C-750 Ultra Zoom Digital Camera 4MP 10x Optical Zoom - Tested,62.29,2020-06-15 00:00:00
Olympus CAMEDIA C-700 Ultra Zoom 2.1MP 10X optical zoom Digital Camera 64mb card,26.45,2020-06-15 00:00:00
Olympus CAMEDIA D-560 Zoom 3.2MP Digital Camera - Silver,11.6,2020-06-15 00:00:00
Olympus CAMEDIA C-3040 Zoom 3.3MP Digital Camera - Black ,16.9,2020-06-15 00:00:00
Olympus CAMEDIA C-5060 Zoom 5.1MP Digital Camera BUNDLE,55.98,2020-06-15 00:00:00
 Olympus CAMEDIA  C-120 2.0MP Digital Camera - Silver,58.97,2020-06-15 00:00:00
Kastar 1 Battery & Normal Charger kit for Olympus Li-10B Li-12B,9.99,2020-06-14 00:00:00
Olympus CAMEDIA C-2100 10x Optical Ultra Zoom 2.1MP Digital Camera + Accessories,20.2,2020-06-14 00:00:00
Olympus CAMEDIA C-2100 10x Optical Ultra Zoom 2.1MP Digital Camera + Accessories,20.2,2020-06-14 00:00:00
"Olympus Camedia C-5050 Zoom Digital Camera, Used, 469-P",46.0,2020-06-14 00:00:00
Lot of 13 Vintage Cameras - Kodak Movie Sony Olympus Camedia Konica Polaroid ,55.8,2020-06-14 00:00:00
Kastar Battery LCD Charger for Olympus Li-10B Li-12B & Camedia C-765 Ultra Zoom,10.59,2020-06-14 00:00:00
Kastar Battery AC Charger for Olympus Li-10B Li-12B Li-10C Camedia C-5000 Zoom,11.99,2020-06-14 00:00:00
Olympus Camedia D-580 Zoom 4MP Digital Camera With Memory Card - Tested Working,14.0,2020-06-13 00:00:00
Olympus CAMEDIA C-60 Zoom 6.1MP Digital Camera - Silver with accessories WORKS,38.0,2020-06-13 00:00:00
Olympus CAMEDIA C-750 Ultra Zoom 4.0MP Digital Camera - Silver,19.99,2020-06-13 00:00:00
Olympus CAMEDIA E-20N 5.0MP Digital SLR WTH Strap. Memory Card Ready to Use,88.0,2020-06-13 00:00:00
VTG Olympus Camedia D-580 Zoom 4MP Digital Camera ONLY Tested Free Shipping,9.95,2020-06-13 00:00:00
Olympus Camedia C-50 Zoom 5.0MP Digital Camera Silver With Battery & Charger,20.98,2020-06-13 00:00:00
Olympus Camedia C-220 2MP 3x Zoom AA Battery Viewfinder Digital Camera,19.63,2020-06-13 00:00:00
OLYMPUS  C-770 10x ZOOM  DIGITAL  CAMERA,40.0,2020-06-12 00:00:00
Olympus C-2100 Digital Camera with Accessories,90.6,2020-06-12 00:00:00
3 Battery + Charger Combo For Olympus Li-42B Li-40B Camedia FE-340 FE-350 FE-360,14.95,2020-06-12 00:00:00
Kastar Battery AC Charger for Olympus Li-10B Li-12B Li-10C & Camedia C-60 Zoom,9.59,2020-06-12 00:00:00
Kastar Replacement Battery for Olympus Li-42B Li40C Olympus Camedia X-600 Camera,15.99,2020-06-12 00:00:00
"Olympus Wide Angle Extension Lens For Olympus CAMEDIA, WCON-08BE, NICE!",41.2,2020-06-12 00:00:00
Olympus CAMEDIA E10 4.0MP DSLR Camera - Black (Kit w/ ED 9-36mm Lens) - PLS READ,55.0,2020-06-12 00:00:00
3.3V AC/DC Adapter For Olympus CAMEDIA D-520 D-535 D-540 D-545 D-555 Zoom Camera,15.98,2020-06-11 00:00:00
🔴  Olympus CAMEDIA RM-1 Remote Control Camedia,7.49,2020-06-11 00:00:00
Olympus CAMEDIA C-4000 Zoom 4.0MP Digital Camera - WORKS + FREE SHIPPING,14.0,2020-06-11 00:00:00
OLYMPUS CAMEDIA C-2020 Z DIGITAL CAMERA & RECORDER SD Card Works Perfectly,33.33,2020-06-11 00:00:00
Olympus Digital Camera C-7000 Zoom,28.85,2020-06-11 00:00:00
Olympus CAMEDIA C-720 Ultra Zoom Camera~~BUNDLE~~Works great,35.6,2020-06-11 00:00:00
2 Battery + Charger Combo For Olympus Li-42B Li-40B Camedia FE-340 FE-350 FE-360,11.95,2020-06-11 00:00:00
Olympus CAMEDIA C-4000 Zoom 4.0MP Digital Camera - Silver with case ,16.4,2020-06-10 00:00:00
Olympus Photo Paper Camedia P-A4NE For P-400 Series 100 Sheets 8.25x11.7,79.95,2020-06-10 00:00:00
Olympus Camedia C-4000 Zoom 4.0 MP Digital Camera: GOOD CONDITION/FREE SHIPPING,27.99,2020-06-10 00:00:00
OLYMPUS CAMEDIA P-60 LE Passport Photo Paper Set,32.76,2020-06-10 00:00:00
Olympus CAMEDIA D-520 Zoom 2.0MP Digital Camera PARTS OR REPAIR,6.99,2020-06-09 00:00:00
"OLYMPUS CAMEDIA Digital Camera C-60 ZOOM, 6.1 MP & Accessories",19.48,2020-06-09 00:00:00
Olympus Camedia Camera C-8080 8.0MP Wide 1:2.4-3.5 Zoom 7.1-35.6mm Digital Ø58mm,96.9,2020-06-09 00:00:00
"Olympus CAMEDIA C-720 Ultra Zoom 3.0MP Digital Camera w/ 16,64 mb cards",24.9,2020-06-09 00:00:00
Olympus E-10 Camedia digital camera Parts or Repair,21.0,2020-06-09 00:00:00
Olympus CAMEDIA RM-1 Remote Control,7.0,2020-06-08 00:00:00
Olympus Camedia Digital Camera D-560 Zoom Silver,11.94,2020-06-08 00:00:00
Olympus Camedia C-4000 Digital Camera 4MP 3x Optical Zoom 16mb Smart media card,40.0,2020-06-07 00:00:00
Olympus CAMEDIA D-595 5.0MP Digital Camera - Silver,22.99,2020-06-07 00:00:00
Olympus Camedia C-4000 4.0MP Digital Camera WORKS TESTED,13.99,2020-06-07 00:00:00
Olympus D-620L Digital Camera 1.4MP Metallic Silver,23.66,2020-06-06 00:00:00
Olympus CAMEDIA D-460 Zoom 1.3MP Digital Camera - Silver,17.99,2020-06-06 00:00:00
Olympus CAMEDIA C 160 3.2 MP Digital Camera - Silver. TESTED,42.6,2020-06-06 00:00:00
USB Cable for Olympus Camedia D-555 D-560 D-565 D-575 D-580 D-590 D-765 D-770,7.98,2020-06-05 00:00:00
NEW OLYMPUS Camedia CLA-8 Conversion Lens Adapter FAST SHIPPING,26.95,2020-06-05 00:00:00
Kastar Battery LCD AC Charger for Olympus Li-10B Li-12B Li-10C Camedia C-50 Zoom,13.99,2020-06-05 00:00:00
Olympus Camedia D-100 Digital Camera 1.3MP ,24.77,2020-06-05 00:00:00
Olympus CAMEDIA RM-1 Remote Control Supports Many Models New Battery,9.19,2020-06-05 00:00:00
Olympus Camedia CLA-1 41-43mm Conversion Lens Adapter Tube Camera C-2000Zoom etc,8.0,2020-06-04 00:00:00
Olympus Camedia 3.2 MP 3x Optical Zoom Viewfinder Digital Camera & 16MB XD Card ,23.56,2020-06-04 00:00:00
OLYMPUS CAMEDIA TELE EXTENSION LENS PRO TCON-300 - Free S&H,121.51,2020-06-04 00:00:00
Olympus Camedia D-535 3.2MP 3x Optical Zoom Digital Camera - Fair,6.95,2020-06-04 00:00:00
Kastar Battery Dual Charger for Olympus Li-10B Li-12B & Camedia C-765 Ultra Zoom,20.99,2020-06-03 00:00:00
OLYMPUS Digital Camera CAMEDIA SP-565UZ,198.99,2020-06-03 00:00:00
Olympus CAMEDIA D-460 Zoom 1.3MP Digital Camera - Silver,29.89,2020-06-03 00:00:00
Olimpus Camedia C-720 UZ optical zoom X 8 Digitat Camera Silver Color,7.5,2020-06-03 00:00:00
Olympus CAMEDIA C-770 Ultra Zoom 4.0MP Digital Camera - Silver - UnTested (A8),38.94,2020-06-03 00:00:00
Olympus CAMEDIA C-765 Ultra Zoom 4.0MP Digital Camera - Silver,23.7,2020-06-01 00:00:00
Olympus CAMEDIA C-60 Zoom 6.1MP Digital Camera - No Charger & Untested,10.35,2020-05-31 00:00:00
Olympus CAMEDIA C-4000 Zoom 4.0MP Digital Camera - Silver w/ 2 SmartMedia Cards,41.15,2020-05-31 00:00:00
Olympus Camedia CLA-8 Conversion Lens Adapter 200449,22.04,2020-05-31 00:00:00
Olympus CAMEDIA C-60 Zoom 6.1MP Digital Camera W/ Accessories,25.0,2020-05-31 00:00:00
Olympus CAMEDIA C-60 Zoom 6.1MP Digital Camera - Silver,23.59,2020-05-31 00:00:00
Olympus D-490 Zoom Digital 2.1 Megapixel Camera,15.3,2020-05-30 00:00:00
Olympus Conversion Lens Adapter Camedia CLA-7,28.99,2020-05-30 00:00:00
Olympus Camedia C-700 Digital Camera With Samsonite Bag,34.19,2020-05-29 00:00:00
Olympus CAMEDIA E-10 Digital SLR Camera with Manual & Remote,61.75,2020-05-29 00:00:00
Olympus P-60NE Camedia Print Paper for Digital Color Printer (BRAND NEW!) 1x,29.59,2020-05-29 00:00:00
Olympus CAMEDIA E-10 Digital SLR Camera ,87.0,2020-05-28 00:00:00
Olympus Camedia camera D-340R 1.3 megapixel CD instructions cord case AC adapter,12.74,2020-05-27 00:00:00
Kastar Battery LCD Charger for Olympus Li-10B & Olympus Camedia C-765 Ultra Zoom,14.99,2020-05-27 00:00:00
NEW OLYMPUS CAMEDIA DIGITAL COLOR PRINTER P-400 In box,131.69,2020-05-27 00:00:00
Olympus CAMEDIA C-770 Ultra Zoom 4.0MP Digital Camera Silver w/ extras complete,35.7,2020-05-27 00:00:00
OLYMPUS CAMEDIA D-630 / Evolt E-30 / E-330 / E-400 CAMERA USB DATA SYNC CABLE,7.06,2020-05-27 00:00:00
"OLYMPUS D-520 ZOOM Digital Camera  2.0 Megapixel   Camedia, memory card",12.3,2020-05-27 00:00:00
Olympus MAUSB-10 XD Card USB Reader/Writer for Olympus Camedia Camera ,19.0,2020-05-26 00:00:00
Kastar Battery Slim Charger for Olympus Li-10B Li-12B & Camedia C-765 Ultra Zoom,11.49,2020-05-26 00:00:00
Olympus Camedia P-400 Digital Sublimation Color Photo Printer W/30 Print Paper,118.99,2020-05-26 00:00:00
TESTED - Complete Olympus Camedia C-5060 Digital Camera Batteries Charger Bag C2,45.96,2020-05-25 00:00:00
Olympus Camera CAMEDIA C-720 Digital Zoom 3 MP PRISTINE WORKING CONDITION,13.98,2020-05-24 00:00:00
Olympus CAMEDIA C-5060 Wide Zoom 5.1MP Digital Camera w/Battery & Charger.,49.99,2020-05-24 00:00:00
Olympus CAMEDIA C-3020 Zoom Digital Camera 3.2 Megapixel + Genuine Strap #4166,43.25,2020-05-24 00:00:00
camedia master 4.0 olympus quicktime cd-rom camera software c-300 d-550 zoom,7.0,2020-05-24 00:00:00
Li-10B Li-12B Battery Charger For Olympus Camedia C-760 C-765 C-770 Zoom C-5000,12.9,2020-05-23 00:00:00
Olympus CAMEDIA C-3030 Zoom 3.3MP Digital Camera - Black,18.0,2020-05-23 00:00:00
Olympus Camera Neck Strap Included w/ Camedia C-3000 C-3020 C-3030 C-4000 C-4040,5.49,2020-05-23 00:00:00
Olympus CAMEDIA D-425 4.0MP Digital Camera - Silver W/ Case,10.89,2020-05-23 00:00:00
Olympus CAMEDIA D-425 4.0MP Digital Camera - Silver In Box W/ A,19.6,2020-05-23 00:00:00
Olympus C-3020 Zoom 3.2MP Digital Camera - Metallic Silver,29.59,2020-05-22 00:00:00
Olympus Camedia Electronic Flash FL-20,41.11,2020-05-22 00:00:00
Olympus CAMEDIA C-5000 Zoom 5.0MP HD Digital Camera 3x Optical - Silver,20.15,2020-05-22 00:00:00
AC Adapter For Olympus Camedia 100R E-10 E-20 E-20P E-20N Charger Power Supply,18.98,2020-05-22 00:00:00
OLYMPUS CAMEDIA C-4000 ZOOM - DIGITAL CAMERA WITH MEMORY CARD,19.0,2020-05-21 00:00:00
Olympus CAMEDIA C-740 Ultra Zoom 3.2MP Digital Camera - Silver *GOOD/TESTED*,17.98,2020-05-21 00:00:00
Olympus CAMEDIA E-10 Digital SLR Camera - Black,126.45,2020-05-21 00:00:00
Kastar Battery Slim Charger for Olympus Li-10B Li-12B & Camedia C-770 Ultra Zoom,13.99,2020-05-21 00:00:00
Olympus Camedia D-490 2.1 Megapixel Point & Shoot Camera w/ Wrist Strap,13.69,2020-05-20 00:00:00
"Olympus CAMEDIA C-3030 Zoom Digital Camera Kit, Bag, Remote, Stand, Charger",53.2,2020-05-20 00:00:00
"Olympus D-540 Zoom 3.2MP Digital Camera - Silver | Tested, Works",14.88,2020-05-20 00:00:00
Olympus Camedia C-3020 Zoom 3.2MP 3x Optical Full Manual Control Digital Camera,28.81,2020-05-20 00:00:00
Olympus CAMEDIA D-490 Zoom 2.1MP Digital Camera - Clean Condition!,12.99,2020-05-20 00:00:00
"Olympus D-540 Zoom 3.2MP Digital Camera - Silver | Tested, Works",14.88,2020-05-20 00:00:00
Olympus Camedia C-3020 Zoom 3.2MP 3x Optical Full Manual Control Digital Camera,28.81,2020-05-20 00:00:00
Olympus CAMEDIA D-490 Zoom 2.1MP Digital Camera - Clean Condition!,12.99,2020-05-20 00:00:00
Olympus Camedia E-10 4MP Digital Camera w/9-36mm Lens,99.99,2020-05-20 00:00:00
Olympus CAMEDIA D-390 2.0MP Digital Camera - Silver TESTED WORKING,14.15,2020-05-19 00:00:00
Olympus Camedia C-2040 Zoom Fast f1.8-2.6 3x Zoom 2.1MP Classic Digital Camera,31.43,2020-05-19 00:00:00
Olympus CAMEDIA C-720 Ultra Zoom 3.0 MP Digital Camera Silver ,11.45,2020-05-19 00:00:00
Olympus Camedia 0.2x Fish-eye Conversion Lens Japan,13.99,2020-05-19 00:00:00
Olympus CAMEDIA C-3000 Zoom 3.3MP Digital Camera,19.59,2020-05-19 00:00:00
Olympus CAMEDIA RM-1 Remote Control,7.0,2020-05-18 00:00:00
Olympus CAMEDIA C-750 Ultra Zoom 4.0MP Digital Camera - Silver,24.99,2020-05-18 00:00:00
Olympus CAMEDIA C-725 Ultra Zoom 3.0MP Digital Camera - Silver w/ Case & Lanyard,18.99,2020-05-18 00:00:00
"Olympus Camedia C-5050 5.0MP Digital Camera, Remote, 2x memory, & Bag TESTED",53.99,2020-05-18 00:00:00
Olympus CAMEDIA C-2500L 2.5MP Digital SLR Camera - Black & Metallic silver,29.95,2020-05-18 00:00:00
