title,price,date
Jane Austen Pride And Prejudice Best Loved Classics Undated Edition 8vo HC VG+,15.0,2020-08-15 00:00:00
"Pride and Prejudice (DVD, 2006) Brand New",7.99,2020-08-15 00:00:00
Elizabeth of Jane Austen’s Pride&Prejudice Paper Doll by Donald Hendricks-Signed,25.0,2020-08-15 00:00:00
Lot of 2: Pride and Prejudice and Zombies + Three Vampire Women,8.32,2020-08-15 00:00:00
The Bad Miss Bennet: A Novel (Pride and Prejudice),3.25,2020-08-15 00:00:00
NWT KATE SPADE PRIDE & PREJUDICE BOOK CLUTCH WKRU1994,429.0,2020-08-15 00:00:00
"Hallmark Pride, Prejudice & Mistletoe DVD Lacey Chabert  Brand New Sealed",14.99,2020-08-15 00:00:00
Pride and Prejudice (1940) DVD Greer Garson Laurence Oliver Marv Boland,9.05,2020-08-15 00:00:00
Pride and Prejudice Volume 1 DVD,8.54,2020-08-15 00:00:00
Pride + Prejudice + Zombies [Blu-ray],6.34,2020-08-15 00:00:00
Pride & Prejudice - DVD - VERY GOOD,3.97,2020-08-15 00:00:00
Pride & Prejudice Hardcover Book Jane Austin  Peebles Classic Library,12.32,2020-08-15 00:00:00
Pride And Prejudice: Having A Ball [DVD][Region 2],10.15,2020-08-15 00:00:00
PRIDE and PREJUDICE By Jane Austen Brand New Leather Bound  Collectible Edition,19.53,2020-08-14 00:00:00
Pride and Prejudice (Barnes & Noble Classics) - Paperback - VERY GOOD,3.99,2020-08-14 00:00:00
Pride and Prejudice and Zombies: The Classic Regency Romance - Now w - VERY GOOD,3.59,2020-08-14 00:00:00
Pride and Prejudice and Zombies: Dawn of the Dreadfuls (Pride and Prej. a - GOOD,3.84,2020-08-14 00:00:00
POP Movies: Pride and Prejudice and Zombies - Lady Catherine,5.5,2020-08-14 00:00:00
Pride and Prejudice (Dover Thrift Editions) - Mass Market Paperback - VERY GOOD,3.58,2020-08-14 00:00:00
"Pride and Prejudice : Chiltern Edition, Hardcover by Austen, Jane, Brand New,...",21.85,2020-08-14 00:00:00
"Pride and Prejudice by Austen, Jane",9.81,2020-08-14 00:00:00
1:16 SCALE MINIATURE BOOK PRIDE AND PREJUDICE ILLUSTRATED JANE AUSTEN PLAYSCALE,12.0,2020-08-14 00:00:00
"Horror Movie Lot (DVD) The Cured, Zombies, Pride Prejudice and Zombies",13.98,2020-08-14 00:00:00
Pride and Prejudice and Zombies (Blu-ray),7.25,2020-08-14 00:00:00
Pride and Prejudice [Special Edition],5.49,2020-08-14 00:00:00
Pride And Prejudice (1940) Dvd,8.8,2020-08-14 00:00:00
Pride and Prejudice (Bantam Classics) by Jane Austen ,4.49,2020-08-14 00:00:00
Pride & Prejudice DVD Gurinder Chadha(DIR) 2005,3.96,2020-08-14 00:00:00
"Regency Gown Costume Jane Austen Pride and Prejudice Emma 1700s 38""Bust Petite",94.9,2020-08-14 00:00:00
Pride and Prejudice [Special Edition],4.69,2020-08-14 00:00:00
Custom jane austen regency 1812 colonial Empire waist pride & prejudice Dress,115.0,2020-08-14 00:00:00
1940 PRIDE AND PREJUDICE Love story ART romance NOVEL Emma movie JANE AUSTEN vtg,107.38,2020-08-14 00:00:00
"Lot Of 2 Jane Austen - Pride And Prejudice And Zombies , Sense And Sensibility A",6.0,2020-08-14 00:00:00
Funko Pop! Pride and Prejudice and Zombies Elizabeth Bennet (factory defected),16.0,2020-08-14 00:00:00
Pride and Prejudice (1940) Greer Garson [DVD] FAST SHIPPING,7.64,2020-08-14 00:00:00
Pride and Prejudice and Zombies by Seth Grahame-Smith Heirloom Ed (HC),22.3,2020-08-14 00:00:00
"Pride And Prejudice, Like New Used, Free shipping in the US",12.37,2020-08-14 00:00:00
PRIDE AND PREJUDICE by Jane Austen Easton Press Leather Limited Edition 1977,95.0,2020-08-14 00:00:00
Posters USA - Pride and Prejudice Movie Poster Glossy Finish - PRM558,16.95,2020-08-14 00:00:00
Pride & Prejudice: A BabyLitÂ® Counting Primer - Board book - VERY GOOD,3.63,2020-08-14 00:00:00
Vintage PRIDE AND PREJUDICE Jane Austen 1945 1st ed Robert Ball Color Illustr.,78.86,2020-08-14 00:00:00
Easton Press PRIDE AND PREJUDICE Jane Austen SEALED,96.4,2020-08-14 00:00:00
1920 s 4 VOLS JANE AUSTEN SET BROCK & THOMPSON ILLUST PRIDE & PREJUDICE ETC,267.05,2020-08-14 00:00:00
Pride and Prejudice (Dover Thrift Editions) - Mass Market Paperback - GOOD,3.58,2020-08-14 00:00:00
"Pride and Prejudice (Mini-Series) (Blu-ray, 2014, 2-Disc) Keepsake Edition OOP!",27.96,2020-08-14 00:00:00
"Pride & Prejudice DVD, Simon Woods, Sylvester Morand, Claudie Blakley, Brenda Bl",4.89,2020-08-14 00:00:00
Pride & Prejudice cross stitch chart ,3.59,2020-08-14 00:00:00
1980 Pride and Prejudice by Jane Austen FRANKLIN LIBRARY Like New.,29.85,2020-08-14 00:00:00
NEAR MINT ~ Leather Franklin Library ~ Pride and Prejudice Jane Austen,34.95,2020-08-14 00:00:00
Vintage Jane Austen Pride and Prejudice Book Copyright 1918,43.33,2020-08-14 00:00:00
EASTON PRESS Jane Austen PRIDE AND PREJUDICE Leather Hundred Greatest Books,48.99,2020-08-14 00:00:00
Pride and Prejudice (Special Edition),6.52,2020-08-14 00:00:00
Atonement / Pride & Prejudice / Jane Eyre / Elizabeth DVD  NEW,9.79,2020-08-14 00:00:00
1940 PRIDE AND PREJUDICE Love story ART romance NOVEL Emma movie JANE AUSTEN vtg,82.38,2020-08-13 00:00:00
"Pride and Prejudice : Large Print Edition by Jane Austen (2014, Paperback,...",17.31,2020-08-13 00:00:00
Pride and Prejudice : An Authoritative Text Backgrounds and Sources Criticism...,12.92,2020-08-13 00:00:00
"Pride and Prejudice by Jane Austen (Book, Other)",9.33,2020-08-13 00:00:00
Pride and Prejudice by Jane Austen Unabridged New Sealed Collectible Hardcover,34.63,2020-08-13 00:00:00
PRIDE AND PREJUDICE AND ZOMBIES 4K ULTRA HD UHD BLU RAY 2 DISC SET * NICE *,7.99,2020-08-13 00:00:00
"Pride & Prejudice (DVD, 2016, Widescreen, Kiera Knightly)",7.99,2020-08-13 00:00:00
Pride and Prejudice the Special Edition DVD in good condition,10.99,2020-08-13 00:00:00
Pride And Prejudice/North And South   [Region 2] DVD NEW,7.85,2020-08-13 00:00:00
"Barnes and Noble Classics: Pride and Prejudice by Jane Austen (2004, Paperback)",4.16,2020-08-13 00:00:00
Pride & Prejudice Special Edition DVD BBC Video,15.0,2020-08-13 00:00:00
"The Making of Pride and Prejudice (BBC) by Conklin, Susie; Birtwistle, Sue",4.09,2020-08-13 00:00:00
Pride And Prejudice 10th Anniversary 1995 Collector's 3 DVD Set + BBC Book,26.8,2020-08-13 00:00:00
Postscript from Pemberley: The acclaimed Pride and Prejudice sequel series The P,6.02,2020-08-13 00:00:00
"Pride and Prejudice (Mini-Series) (DVD, 2001, 2-Disc Set, Special Edition...",6.97,2020-08-13 00:00:00
Pride and Prejudice Blu-Ray + DVD REGION 1 (2019) Jane Austen -- NEW! SEALED!!,25.95,2020-08-13 00:00:00
Complete Novels of Jane Austen : Sense and Sensibility / Pride and Prejudice ...,21.38,2020-08-13 00:00:00
Pride and Prejudice and Zombies (Blu-ray Disc),7.49,2020-08-13 00:00:00
"Pride & Prejudice Blu-Ray [Region Free] Colin Firth, Jennifer Ehle Drama Movie",20.63,2020-08-13 00:00:00
Pride and Prejudice [Special Edition],6.49,2020-08-13 00:00:00
Pride and Prejudice (Hardback or Cased Book),10.17,2020-08-13 00:00:00
"Pride and Prejudice and Zombies [New DVD] Ac-3/Dolby Digital, Dolby, W",8.76,2020-08-13 00:00:00
"Bantam Classics: Pride and Prejudice by Jane Austen (1983, Paperback, Reprint)",7.89,2020-08-13 00:00:00
"Funko Lot Pride and Prejudice Collins, Jane Bennet, Mr Darcy, Mrs. Featherstone",20.0,2020-08-13 00:00:00
Atonement / Pride & Prejudice / Jane Eyre / Elizabeth Four Feature Films,5.36,2020-08-13 00:00:00
"5 DVD lot: Pride & Prejudice, Emma, Sense & Sensibility, Becoming Jane Austen",28.33,2020-08-13 00:00:00
Pride and Prejudice [Penguin Clothbound Classics],13.38,2020-08-12 00:00:00
"PRIDE AND PREJUDICE 2 Disc DVD Colin Firth, Jennifer Eble LIKE NEW Region 4 ",17.92,2020-08-12 00:00:00
Pride and Prejudice (Special Edition),6.33,2020-08-12 00:00:00
Pride + Prejudice + Zombies 4K + Blu-Ray Brand New Factory Sealed,10.99,2020-08-12 00:00:00
Pride and Prejudice (Bantam Classics) - Mass Market Paperback - VERY GOOD,3.88,2020-08-12 00:00:00
Pride and Prejudice and Zombies DVD,7.05,2020-08-12 00:00:00
"Pride and Prejudice (DVD, 2006, Anamorphic Widescreen)",3.95,2020-08-12 00:00:00
Pride and Prejudice BBC 2-Disc DVD Set  ~Restored Edition 2010 Colin Firth *NEW*,34.0,2020-08-12 00:00:00
Pride and Prejudice (The Penguin English Library) - Mass Market Paperback - GOOD,4.09,2020-08-12 00:00:00
*New* PRIDE AND PREJUDICE by Jane Austen (2015 Flexibound Gift condition),16.99,2020-08-12 00:00:00
NEW Pride and Prejudice by Jane Austen Collectible Edition,19.95,2020-08-12 00:00:00
Pride & Prejudice (1995) DVD Simon Langton(DIR) 1995,6.8,2020-08-12 00:00:00
Pride and Prejudice,13.85,2020-08-12 00:00:00
"Pride and Prejudice: 200th Anniversary Edition, Brand New, Free shipping in t...",18.5,2020-08-12 00:00:00
LitJoy Classics Gold Foil Art Print - Pride & Prejudice,11.2,2020-08-12 00:00:00
Pride And Prejudice Book,10.76,2020-08-12 00:00:00
Jane Austen The Complete Novels 1981 Pride & prejudice Sense & sensibility Emma,18.99,2020-08-12 00:00:00
"Pride and Prejudice (BBC  Books) Includes Colour Pho... by Austen, Jane Hardback",11.58,2020-08-12 00:00:00
Pride and Prejudice and Zombies 4K Ultra HD / Blu ray Brand New ,12.8,2020-08-12 00:00:00
"Pride and Prejudice (Mini-Series) (DVD, 2006, 3-Disc Set, 10th Anniversary Firth",10.79,2020-08-12 00:00:00
Pride and Prejudice DVD 1995 BBC Jane Austen Drama Classic w/ Colin Firth 2-Disc,9.99,2020-08-12 00:00:00
Eligible : A Modern Retelling of Pride and Prejudice by Curtis Sittenfeld,4.09,2020-08-12 00:00:00
Pride & Prejudice BLU-RAY Gurinder Chadha(DIR) 2005,5.74,2020-08-12 00:00:00
Pride and Prejudice:Biography of Larry Doby (Signed)--J.T. Moore-BLACK AMERICANA,103.5,2020-08-12 00:00:00
PRIDE AND PREJUDICE by Jane Austen Caxton House Popular Classics c. 1930 VINTAGE,49.99,2020-08-12 00:00:00
Pride and Prejudice Vintage HC Book by Austen Everyman's Library Edition,25.0,2020-08-12 00:00:00
Pride and Prejudice and Zombies (DVD),8.79,2020-08-12 00:00:00
Pride and Prejudice (Great Illustrated Classics (A,5.98,2020-08-12 00:00:00
Pride and Prejudice Jane Austen Easton Press Collector's Ed.,58.0,2020-08-12 00:00:00
Pride and Prejudice [Special Edition],6.45,2020-08-12 00:00:00
"Pride and Prejudice (Mini-Series) (VHS, 1996, 6-Tape Set) USED",8.44,2020-08-12 00:00:00
Pride and Prejudice Blu-ray Keira Knightley NEW,14.98,2020-08-12 00:00:00
Pride and Prejudice - Paperback By Jane Austen - GOOD,5.28,2020-08-11 00:00:00
Pride & Prejudice DVD (2003) [New DVD] sealed free shipping ,8.95,2020-08-11 00:00:00
Pride + Prejudice + Zombies,6.28,2020-08-11 00:00:00
MSCHF Branded Books - Pride & Prejudice by Jane Austen - Limited Editions,38.25,2020-08-11 00:00:00
Pride and Prejudice [Special Edition],5.99,2020-08-11 00:00:00
Easton Press Collectors Edition Leather Embossed PRIDE & PREJUDICE Austen NEW,98.86,2020-08-11 00:00:00
"Pride and Prejudice by Jane Austen  (2003, Paperback) Brand New",6.15,2020-08-11 00:00:00
Pride and Prejudice [Music from the Motion Pictures] by Dario New,7.99,2020-08-11 00:00:00
"Pride and Prejudice (DVD, 2006, Anamorphic Widescreen)",7.79,2020-08-11 00:00:00
"Pride and Prejudice (Modern Library Classics) by Jane Austen, Anna Quindlen ",4.49,2020-08-11 00:00:00
"Pride and Prejudice (De Luxe Classics) by Austen, Jane Hardback Book The Fast",10.04,2020-08-11 00:00:00
Pride & Prejudice Blu-ray,8.11,2020-08-11 00:00:00
"MINIATURE BOOK  Jane Austen, Pride and Prejudice",69.0,2020-08-11 00:00:00
JANE AUSTEN : PRIDE AND PREJUDICE Talking Classics 2CD Audiobook Joanna Lumley,26.6,2020-08-11 00:00:00
Pride and Prejudice,4.38,2020-08-11 00:00:00
PRIDE AND PREJUDICE AND ZOMBIES 4K ULTRA HD UHD BLU RAY 2 DISC SET * NEW *,11.04,2020-08-11 00:00:00
NEW DVD 4-Disc Set Atonement Pride & Prejudice Jane Eyre Elizabeth Movie Drama,12.95,2020-08-11 00:00:00
"Jane Austen Lot 6 PB Books -Pride & Prejudice, Persuasion, Mansfield Park, Emma ",9.98,2020-08-11 00:00:00
New Complete Novels Jane Austen Emma Pride Prejudice Sense Leather Bound Deluxe ,29.78,2020-08-11 00:00:00
"Penguin Classics Deluxe Edition Ser.: Pride and Prejudice by Jane Austen (2009,",10.43,2020-08-11 00:00:00
"LDS ROMANTIC COMEDY/ DRAMA DVD PRIDE & PREJUDICE, VERY GOOD CONDITION",7.99,2020-08-11 00:00:00
Pride And Prejudice [Blu-ray] [1995] [Region Free] [DVD][Region 2],15.36,2020-08-11 00:00:00
Pride and Prejudice: Easton Press,28.98,2020-08-11 00:00:00
"Pride and Prejudice (Mini-Series) (DVD, 2001, 2-Disc Set, Special Edition) A&E",15.0,2020-08-11 00:00:00
Cozy Classics Collection:Jane Eyre/Pride & Prejudice by Jack Wang/Holman Wang ,9.98,2020-08-11 00:00:00
"Jane Austen Print, Pride and Prejudice Quote, Reading Wall Art, Book Decor, Gift",5.9,2020-08-11 00:00:00
Pride and Prejudice and Zombies (DVD),7.29,2020-08-10 00:00:00
Pride and Prejudice DVD Keira Knightley NEW,9.99,2020-08-10 00:00:00
Pride and Prejudice by Jane Austen ,4.49,2020-08-10 00:00:00
PRIDE & PREJUDICE (2005) / (FULL SUB AC3 DOL) [DVD],12.49,2020-08-10 00:00:00
Pride and Prejudice (Paperback or Softback),14.04,2020-08-10 00:00:00
B6074 Sewing Pattern Historical Dress Regency Jane Austen Pride & Prejudice,12.9,2020-08-10 00:00:00
"Pride and Prejudice - The Special Edition (A&E, 1996), , Very Good DVD, Colin Fi",13.39,2020-08-10 00:00:00
The Clergyman's Wife (A Pride & Prejudice Novel),9.74,2020-08-10 00:00:00
franklin mint  Jane Austens  ( Elizabeth ) From Pride & Prejudice No A2757,78.66,2020-08-10 00:00:00
Pride and Prejudice by Dalmatian Press,5.15,2020-08-10 00:00:00
"Pride and Prejudice by Austen, Jane",5.25,2020-08-10 00:00:00
"Pride and Prejudice (Penguin Classics) by Austen, Jane Paperback Book The Fast",8.81,2020-08-10 00:00:00
"Pride and Prejudice Mini-Series DVD, 2001, 2-Disc Set, Special Edition Widescree",10.45,2020-08-10 00:00:00
PRIDE AND PREJUDICE Special Edition 2 Volume DVD Set A&E Mini Series Colin Firth,22.93,2020-08-10 00:00:00
Pride & Prejudice 10th Anniversary 3 DVD set with Slip Cover and Making of Book,38.78,2020-08-10 00:00:00
Pride and Prejudice Colin Firth A&E Jennifer Ehle 3 DVDs 2006 10th Anniversary,23.32,2020-08-10 00:00:00
(2) Pride and Prejudice DVD Lot: Volumes 1 & 2  Colin Firth   Jennifer Ehle  A&E,11.85,2020-08-10 00:00:00
"Pride and Prejudice (Clydesdale Classics) by Austen, Jane in Used - Very Good",6.06,2020-08-10 00:00:00
"Pride and Prejudice (DVD, 2006, Full Screen) Keira Knightly, Brand New Sealed ",5.99,2020-08-10 00:00:00
Pride and Prejudice birthday card: Mr Darcy. 5x7 inches. Personalised + envelope,5.05,2020-08-10 00:00:00
"Colin Firth, Jennifer Ehle-Pride and Prejudice (UK IMPORT) DVD [REGION 2] NEW",11.24,2020-08-10 00:00:00
Pride & Prejudice: Keepsake Edition/,40.58,2020-08-10 00:00:00
The Annotated Pride and Prejudice,10.33,2020-08-10 00:00:00
Pride and Prejudice and Zombies: The Classic Regency Romance - Now with U - GOOD,3.59,2020-08-10 00:00:00
Pride And Prejudice vhs,5.49,2020-08-10 00:00:00
Pride and Prejudice Jane Austen A&E Mini Series VHS 1996 6 Video Tape Set,6.4,2020-08-10 00:00:00
PRIDE AND PREJUDICE (BILINGUAL) (GREEN COVER) (DVD),13.54,2020-08-10 00:00:00
"Pride and Prejudice (Mini-Series) (DVD, 2001, 2-Disc Set, Special Edition) NEW",22.75,2020-08-10 00:00:00
Pride and Prejudice [Marvel Illustrated],14.98,2020-08-10 00:00:00
Austen Jane-Pride & Prejudice (Seasons /E (UK IMPORT) HBOOK NEW,31.21,2020-08-10 00:00:00
Pride + Prejudice + Zombies 4k Ultra HD Blu-ray + Blu-ray 2 Disc Set,14.99,2020-08-10 00:00:00
Pride and Prejudice : Lit for Little Hands by Jane Austen,4.09,2020-08-10 00:00:00
"Pride And Prejudice (DVD, 2006)",24.35,2020-08-09 00:00:00
Pride And Prejudice And Sense And Sensibility Barnes And Noble Signature Edition,38.35,2020-08-09 00:00:00
Jane Austen's Pride and Prejudice BBC DVD Blu-ray 2 Disc GENTLY USED,13.95,2020-08-09 00:00:00
LONGBOURN PRIDE & PREJUDICE THE SERVANTS STORY BY JO BAKER UNCORRECTED PROOF,39.25,2020-08-09 00:00:00
"Pride, Prejudice and Mistletoe [New DVD] Widescreen",12.06,2020-08-09 00:00:00
"Pride and Prejudice (Illustrated Chosen Classics: Retold) by Austen, Jane",4.53,2020-08-09 00:00:00
Pride And Prejudice WS Remastered Special Edition DVD Box Set VIEWED ONCE,10.99,2020-08-09 00:00:00
"Pride and Prejudice (Mini-Series) (Blu-ray Disc, 2010, 2-Disc Set)",13.0,2020-08-09 00:00:00
"Pride and Prejudice [Penguin Drop Caps] Austen, Jane",10.62,2020-08-09 00:00:00
Pride and Prejudice and Zombies by Jane Austen and Seth Grahame-Smith Quirk 2009,4.8,2020-08-09 00:00:00
Pride and Prejudice and Zombies Ser.: Pride and Prejudice and Zombies: Dreadful…,4.0,2020-08-09 00:00:00
"Pride and Prejudice [New Blu-ray] Full Frame, Subtitled, Amaray Case",19.88,2020-08-09 00:00:00
1980 Franklin Mint Library Pride and Prejudice Jane Austen HC Red w/Gold Trim,28.81,2020-08-09 00:00:00
POP Movies: Pride and Prejudice and Zombies - Lady Catherine,6.6,2020-08-09 00:00:00
Pride and Prejudice (Special Edition),6.33,2020-08-09 00:00:00
Pride & Prejudice BBC A&E - Colin Firth and Jennifer Ehle - DVD only - DISCS=VG,21.9,2020-08-09 00:00:00
Pride and Prejudice by Jane Austen New Deluxe Collectible Hardcover Classics,24.52,2020-08-09 00:00:00
Jane Austen Pride and Prejudice,79.0,2020-08-09 00:00:00
PRIDE AND PREJUDICE NEW DVD,7.25,2020-08-09 00:00:00
"Pride and Prejudice (DVD, 2004)",15.79,2020-08-09 00:00:00
2 New in box Pride & Prejudice Ornaments UD14-6274 Jane Austin,13.99,2020-08-09 00:00:00
PRIDE and PREJUDICE ~ JANE AUSTEN ~ LEATHER BOUND FLEXI COVER ~ BRAND NEW,24.3,2020-08-09 00:00:00
Reader's Digest World's Best Reading PRIDE AND PREJUDICE by Jane Austen (1984),14.28,2020-08-09 00:00:00
Jane Austen Pride And Prejudice,11.08,2020-08-09 00:00:00
Pride and Prejudice (Norton Critical Editions) - Paperback - GOOD,4.09,2020-08-09 00:00:00
Pride And Prejudice Franklin Library 100 Greatest Books Of All Time Austen 1980,27.0,2020-08-09 00:00:00
PRIDE AND PREJUDICE (Mini-Series)  (Blu-ray 2 Disc Set) Colin Firth,12.99,2020-08-09 00:00:00
Norton Critical Editions Ser.: Pride and Prejudice by Donald Gray and Jane...,13.33,2020-08-09 00:00:00
"Pride and Prejudice (Mini-Series) (DVD, 2001, 2-Disc Set, Special Edition...",16.49,2020-08-09 00:00:00
Pride and Prejudice by Jane Austen (SparkNotes Literature Guide),5.0,2020-08-09 00:00:00
Pride Prejudice Jane Eyre DVD Complete Set of 8 A&E Literary Classics Romance ,24.97,2020-08-09 00:00:00
Pride and Prejudice by Jane Austen Penguin Popular Classics (Aug-1994),8.0,2020-08-09 00:00:00
Pride and Prej. and Zombies Ser.: Pride and Prejudice and Zombies by Jane...,3.25,2020-08-09 00:00:00
1940 PRIDE AND PREJUDICE Love story ART romance NOVEL Emma movie JANE AUSTEN vtg,97.38,2020-08-09 00:00:00
Pride and Prejudice (Barnes & Noble Classics) by Jane Austen ,4.49,2020-08-09 00:00:00
Pride and Prejudice (2-Disc DVD Set)  BBC Colin Firth Jennifer Ehle ,16.95,2020-08-09 00:00:00
Pride and Prejudice by Jane Austen - FIRST PRINTING OF THE FRANKLIN LIBRARY,175.0,2020-08-09 00:00:00
PRIDE & PREJUDICE AND ZOMBIES 4K ULTRA HD BLU RAY 2 DISC SET FREE WORLD SHIPPING,12.99,2020-08-09 00:00:00
"Pride and Prejudice (Bantam Classics) by Austen, Jane, Good Book",4.25,2020-08-08 00:00:00
Jane Austen's Pride & Prejudice: Signature Classics - HARDCOVER - BRAND NEW!,19.99,2020-08-08 00:00:00
Pride And Prejudice Book By Jane Austen,13.32,2020-08-08 00:00:00
Pride and Prejudice (Great Illustrated Classics),6.35,2020-08-08 00:00:00
Out of Print Pride and Prejudice Tote Bag Jane Austen NWT - Flawed,13.0,2020-08-08 00:00:00
Easton Press PRIDE AND PREJUDICE Peacock Ed slipcase Austen SEALED reproduction,1011.38,2020-08-08 00:00:00
Pride And Prejudice Book By Jane Austen,12.99,2020-08-08 00:00:00
"Torrid I heart Mr. Darcy tee from Pride, Prejudice and Zombies",19.4,2020-08-08 00:00:00
Pride and Prejudice by Jane Austen / Franklin Library Limited Edition 1980,51.0,2020-08-08 00:00:00
Pride and Prejudice [Special Edition],5.14,2020-08-08 00:00:00
"Pride and Prejudice (DVD, 2006, Anamorphic Widescreen)",3.94,2020-08-08 00:00:00
Pride and Prejudice [Special Edition],4.99,2020-08-08 00:00:00
Pride and Prejudice [Special Edition],4.8,2020-08-08 00:00:00
Pride and Prejudice by Jane Austen - 1933 Daily Express Publications,66.86,2020-08-08 00:00:00
NEW PRIDE & PREJUDICE Board Game Based on Jane Austen's Novel 2 - 4 players ,59.99,2020-08-08 00:00:00
Atonement / Pride & Prejudice / Jane Eyre / Elizabeth Four Feature Films,5.5,2020-08-08 00:00:00
Pride and Prejudice - Paperback By Jane Austen - GOOD,6.8,2020-08-08 00:00:00
Pride & Prejudice: Music from the Motion Picture Soundtrack (Sheet Music),15.33,2020-08-08 00:00:00
PRIDE & PREJUDICE PLAY ALONG SHEET MUSIC BOOK W/CD,17.9,2020-08-08 00:00:00
SIGNED Pride: A Pride and Prejudice REMIX By Ibi Zoboi - Hardcover,9.83,2020-08-08 00:00:00
"Pride and Prejudice (DVD, 2006, Anamorphic Widescreen)",5.15,2020-08-08 00:00:00
Easton Press  Pride & Prejudice by Jane Austen 100 Greatest Series,68.0,2020-08-08 00:00:00
"Pride and Prejudice and Zombies (Includes 4K Ultra HD + Blu-ray, 2016)",9.95,2020-08-08 00:00:00
Pride and Prejudice - BBC Production ( BRAND NEW 2 Set DVD) Colin Firth,25.1,2020-08-08 00:00:00
Pride & Prejudice DVD BBC 1985 Garvie Region 1 NTSC English Audio,34.51,2020-08-08 00:00:00
"Pride and Prejudice, Jane Austen,Easton Press, Collector's Edition,Leather Bound",59.0,2020-08-08 00:00:00
"Pride and Prejudice Keepsake Edition 1995 (Blu-ray, 2-Disc Set) Brand New",32.79,2020-08-08 00:00:00
Jane Austen Action Figure Pride And Prejudice Archie McPhee 5.5” New,15.99,2020-08-08 00:00:00
Pride and Prejudice [Barnes & Noble Classics],4.3,2020-08-08 00:00:00
"Pride and Prejudice (DVD, 2-Disc Set, Restored Edition) BRAND NEW BBC Free Ship!",19.99,2020-08-07 00:00:00
BBC JANE AUSTEN’S PRIDE AND PREJUDICE 2 DISC SET DVD R4 AUS SELLER AUS RELEASE,27.97,2020-08-07 00:00:00
Pride and Prejudice [Special Edition],4.72,2020-08-07 00:00:00
Pride + Prejudice + Zombies Blu-Ray Disc,5.49,2020-08-07 00:00:00
"Pride and Prejudice (Restored Edition), A&E Home Video, DVD",8.15,2020-08-07 00:00:00
"1940 Jane Austen Pride & Prejudice Book in slipcase, Heritage Press, Like new",49.95,2020-08-07 00:00:00
Pride and Prejudice (Barnes & Noble Classics) - Paperback - VERY GOOD,5.04,2020-08-07 00:00:00
PRIDE AND PREJUDICE BLU RAY COLIN FIRTH & JENNIFER EHLE PRE-OWNED 2009,13.9,2020-08-07 00:00:00
Unequal Affections: A Pride and Prejudice Retelling by Lara S Ormiston: New,13.09,2020-08-07 00:00:00
Jane Austen: Four Complete Novels: Sense and Sensibility / Pride and Prejudice /,11.56,2020-08-07 00:00:00
Pride and Prejudice (Full Screen) (2005) - DVD - VERY GOOD,4.09,2020-08-07 00:00:00
"Pride and Prejudice - The Special Edition (A&E Miniseries) by Colin Firth, Jenn",5.98,2020-08-07 00:00:00
Pride and Prejudice (1940) Greer Garson / Laurence Olivier DVD NEW *FAST SHIP.*,7.6,2020-08-07 00:00:00
Vintage Jane Austen Pride And Prejudice Literature Pendant on Chain Necklace ,33.06,2020-08-07 00:00:00
Jane Austen 3 Book HC Set Pride & Prejudice Emma Sense and Sensibility Doubleday,19.99,2020-08-07 00:00:00
Pride & Prejudice [Blu-ray],8.06,2020-08-07 00:00:00
Pride And Prejudice: The Miniseries (Keepsake Edition) DVD 2-Disc Set Sealed A77,22.2,2020-08-07 00:00:00
Norton Critical Editions Ser.: Pride and Prejudice by Donald Gray and Jane...,8.33,2020-08-07 00:00:00
Pride & Prejudice [Blu-ray],7.28,2020-08-07 00:00:00
"Pride + Prejudice + Zombies (4K UHD, 2016) - Lily James - Lena Heady",6.99,2020-08-07 00:00:00
PRIDE AND PREJUDICE DVD SET A&E MINI SERIES COLIN FIRTH 2 DVDs SEALED,27.79,2020-08-07 00:00:00
Pride & Prejudice Jane Austen Hugh Thomson Illustrated Large Paper Limited 1894,1506.92,2020-08-07 00:00:00
Pride and Prejudice: Lit for Little Hands by Jane Austen (English) Paperback Boo,8.56,2020-08-07 00:00:00
Pride & Prejudice [DVD] Like New Disc + Cover Art - No Case,3.95,2020-08-07 00:00:00
Modern Library Classics Ser.: Pride and Prejudice by Jane Austen and F....,9.82,2020-08-07 00:00:00
Pride and Prejudice [VHS],10.49,2020-08-06 00:00:00
"Pride and Prejudice (DVD, 2004)",12.28,2020-08-06 00:00:00
Pride and Prejudice (Fourth Edition) (Norton Critical Editions),13.37,2020-08-06 00:00:00
The Annotated Pride and Prejudice,7.71,2020-08-06 00:00:00
S8941 Sewing Pattern Historical Dress Robe Regency Jane Austen Pride & Prejudice,12.2,2020-08-06 00:00:00
"Modern Library Classics Ser.: Pride and Prejudice by Jane Austen (1995,...",14.99,2020-08-06 00:00:00
"Madame Alexander 2020 PRIDE & PREJUDICE 10"" Cissette Doll w/Stand 76290 - NEW!",159.95,2020-08-06 00:00:00
"Pride and Prejudice and Mistletoe , de la Cruz, Melissa",4.34,2020-08-06 00:00:00
NEW Jane Austen Pride and Prejudice Board Game,50.0,2020-08-06 00:00:00
Pride and Prejudice Tibet silver Glass dome Necklace chain Pendant Wholesale ,1.99,2020-08-06 00:00:00
PRIDE & PREJUDICE MINISERIES DVD,17.95,2020-08-06 00:00:00
"Pride and Prejudice DVD, 2004’",11.5,2020-08-06 00:00:00
Jane Austen - Pride and Prejudice - Paperback,5.0,2020-08-06 00:00:00
The Annotated Pride & Prejudice Jane Austen by David Shapard Hardcover ,14.99,2020-08-06 00:00:00
"Pride + Prejudice + Zombies (Blu-ray, 2016) - Lily James - Lena Heady",4.99,2020-08-06 00:00:00
Pride and Prejudice (Bantam Classics) - Mass Market Paperback - GOOD,3.88,2020-08-06 00:00:00
Pride and Prejudice by Jane Austen - Small HB ,24.64,2020-08-06 00:00:00
"Pride and Prejudice (DVD, 2006)",4.89,2020-08-06 00:00:00
1928 Jane Austen Pride And Prejudice MacMillan Pocket Classics,42.8,2020-08-06 00:00:00
The Disappearance of Georgiana Darcy : A Pride and Prejudice Mystery,5.13,2020-08-06 00:00:00
Jean-Yves Thibaudet - Pride and Prejudice - CD - New,16.03,2020-08-06 00:00:00
Pride and Prejudice and Zombies (DVD) U.S. Issue New & Sealed Sexy Lily James!,6.99,2020-08-06 00:00:00
