title,price,dateBritains 61004 Miss Lydia Bennet - Jane Austin Pride & Prejudice England,16.49,2020-06-22 00:00:00
Britains 61006 Miss Kitty Bennet - Jane Austin Pride & Prejudice England,16.49,2020-06-22 00:00:00
Britains 61000 Miss Elizabeth Bennet - Jane Austin Pride & Prejudice England,16.49,2020-06-22 00:00:00
Britains 61007 Mrs Bennet - Jane Austin Pride & Prejudice England,15.49,2020-06-22 00:00:00
Britains 61003 MR Bingley - Jane Austin Pride & Prejudice England,16.49,2020-06-22 00:00:00
Britains 61002 Miss Jane Bennet - Jane Austin Pride & Prejudice England,18.49,2020-06-22 00:00:00
Britains 61001 Mr Darcy - Jane Austin Pride & Prejudice England,16.49,2020-06-22 00:00:00
Pride and Prejudice (Restored Edition) - DVD - VERY GOOD,26.99,2020-06-21 00:00:00
Pride & Prejudice DVD Keira Knightley Movie Widescreen New Sealed in Package,12.08,2020-06-21 00:00:00
Pride and Prejudice - Jane Austen - Reader's Digest - 1998 - Hardcover Book VGC,42.61,2020-06-21 00:00:00
Pride and Prejudice (Barnes & Noble Classics) - Mass Market Paperback - GOOD,3.98,2020-06-21 00:00:00
"Pride and Prejudice [Dover Thrift Editions] , Jane Austen",3.99,2020-06-21 00:00:00
The Phantom of Pemberley: A Pride and Prejudice Murder Mystery,6.9,2020-06-21 00:00:00
Pride and Prejudice : Lit for Little Hands  (NoDust) by Jane Austen,4.14,2020-06-21 00:00:00
Deluxe Limited Edition Pride & Prejudice (3) DVD & Book Set Jane Austen ,15.99,2020-06-21 00:00:00
Pride and prejudice by Jane Austen. The Franklin library Best Loved Books.,59.95,2020-06-21 00:00:00
The Franklin Library Pride And Prejudice By Jane Austen 1980 Faux Leather,18.28,2020-06-21 00:00:00
"1964 Books Jane Austen Emma Sense & Sensibility, Pride & Prejudice Lot of 3",43.13,2020-06-21 00:00:00
"Pride and Prejudice (10th Anniversary Collector's Set) (A&E, 1996) DVD, Anna Cha",11.56,2020-06-21 00:00:00
Pride & Prejudice - DVD,24.99,2020-06-21 00:00:00
"Summer Shame : A Pride and Prejudice Novella Variation, Paperback by West, El...",13.73,2020-06-21 00:00:00
FUNKO POP! PRIDE & PREJUDICE & ZOMBIES #271 MRS FEATHERSTONE VINYL FIGURE ,10.29,2020-06-21 00:00:00
PERSUASION Jane AUSTEN 1900 author of Pride and Prejudice ILLUSTRATED,184.84,2020-06-21 00:00:00
Pride and Prejudice Penguin Classics Jane Austen Audiobook CD Abridged ,11.49,2020-06-21 00:00:00
"Pride and Prejudice and Zombies (DVD, 2016) (Lily James, Sam Riley, Jack Huston)",5.95,2020-06-21 00:00:00
Pride and Prejudice (Bantam Classics) by Jane Austen,3.99,2020-06-20 00:00:00
"Jennifer Ehle ""Pride & Prejudice"" AUTOGRAPH Signed 8x10 Photo C ACOA",45.0,2020-06-20 00:00:00
Pride and Prejudice DVD Keira Knightley NEW,6.0,2020-06-20 00:00:00
"COMPLETE  WORKS OF JANE AUSTEN, Leather, PRIDE AND PREJUDICE, EMMA,   MORE!!",17.34,2020-06-20 00:00:00
Pride and Prejudice Original Soundtrack for BBC / A&E TV Serial  -Carl Davis,32.78,2020-06-20 00:00:00
"Jane Austen: The Complete Novels,  Illustratrd: Pride and Prejudice &..... (1981",14.85,2020-06-20 00:00:00
FREE USA SHIPPING - Pride + Prejudice + Zombies (BLU-RAY)brand new,10.0,2020-06-20 00:00:00
New 2 Horror Movies Pride + Prejudice + Zombies & Resident Evil Vendetta DVDs,7.0,2020-06-20 00:00:00
"Pride and Prejudice (Mini-Series) (DVD, 2001, 2-Disc Set, Special Edition...",6.99,2020-06-20 00:00:00
CliffsNotes Pride and Prejudice by ,3.99,2020-06-20 00:00:00
"PRIDE, PREJUDICE AND MISTLETOE DVD - 100% Authentic- NEW - HALLMARK Free Ship",19.97,2020-06-20 00:00:00
The Franklin Library PRIDE AND PREJUDICE by Jane Austen 1980 Hardcover VG+ to LN,15.0,2020-06-20 00:00:00
"Favorite Jane Austen Novels: Pride and Prejudice, Sense and Sensibility and Pers",5.71,2020-06-20 00:00:00
Pride and Prejudice 11x17 Movie Poster (2005),9.98,2020-06-20 00:00:00
JANE AUSTIN - PRIDE AND PREJUDICE Near Mint,8.16,2020-06-20 00:00:00
"Pride and Prejudice (DVD, 2010, 2-Disc Set, Restored Edition)",22.8,2020-06-20 00:00:00
Pride and Prejudice 1945 Hardback Jane Austen Illustrated Robert Ball,43.32,2020-06-20 00:00:00
Pride and Prejudice Jane Austen World famous tales Counted Cross Stitch Kit 14CT,91.32,2020-06-20 00:00:00
Pride & Prejudice Sampler cross stitch chart .,2.87,2020-06-20 00:00:00
"Jane Austen Print, Pride and Prejudice Print, Reading Wall Art, Book Decor, Gift",5.9,2020-06-20 00:00:00
"Pride and Prejudice by Jane Austen (2002, Paperback)",5.79,2020-06-20 00:00:00
Pride & Prejudice Easton Press,107.6,2020-06-20 00:00:00
Thorn Willow Press Pride and Prejudice letterpress 3/4 Leather 99/100,800.0,2020-06-20 00:00:00
Pride and Prejudice and Zombies: The Deluxe Heirloom Edition [Pride and Prej. an,4.7,2020-06-20 00:00:00
"Pride and Prejudice by Jane Austen (1983, Mass Market, Reprint)",5.5,2020-06-19 00:00:00
"Pride v. Prejudice: A Claire Malloy Mystery [Claire Malloy Mysteries]  Hess, Joa",4.49,2020-06-19 00:00:00
Pride and Prejudice [Special Edition],5.11,2020-06-19 00:00:00
Pride & Prejudice DVD Keira Knightly Matthew Macfadyen 2006 Widescreen,5.75,2020-06-19 00:00:00
Mr. Darcy Takes a Wife: Pride and Prejudice Continues - Paperback - ACCEPTABLE,3.59,2020-06-19 00:00:00
Easton press PRIDE AND PREJUDICE Jane Austen Deluxe Collectors LIMITED Edition,89.99,2020-06-19 00:00:00
"Pride + Prejudice + Zombies [Blu-ray], Very Good Disc, Charles Dance, Sam Riley,",7.71,2020-06-19 00:00:00
"Pride and Prejudice, Paperback by Austen, Jane, Brand New, Free shipping in t...",13.17,2020-06-19 00:00:00
"Classics Reimagined, Pride and Prejudice, Austen, Jane, Very Good Book",16.77,2020-06-19 00:00:00
Pride And Prejudice BBC 2 Disc DVD Colin Firth Jennifer Ehle Sealed NWT NEW,41.24,2020-06-19 00:00:00
"NEW Babylit Pride & Prejudice MR. DARCY Puzzle by Gibbs Smith, Ages 3+ ",11.9,2020-06-19 00:00:00
"Pride and Prejudice [Blu-ray] DVD, Anna Chancellor,Crispin Bonham-Carter,David B",7.65,2020-06-19 00:00:00
Pride + Prejudice + Zombies (DVD)............NEW & FACTORY SEALED!,6.76,2020-06-19 00:00:00
PRIDE AND PREJUDICE AND ZOMBIES 4K ULTRA HD UHD BLU RAY 2 DISC SET * NICE *,8.5,2020-06-19 00:00:00
"Pride and Prejudice Quote Print, Mr Darcy Quote, Jane Austen Wall Art, Gift,Home",5.9,2020-06-19 00:00:00
"Classics Reimagined, Pride and Prejudice",24.06,2020-06-19 00:00:00
Jane Austen PRIDE AND PREJUDICE  1st Edition 1st Printing,130.94,2020-06-19 00:00:00
Pride & Prejudice by ,6.63,2020-06-18 00:00:00
Pride and Prejudice [Special Edition] Colin Firth,6.06,2020-06-18 00:00:00
"NEW - The Annotated Pride and Prejudice by Austen, Jane",15.48,2020-06-18 00:00:00
"Pride and Prejudice (DVD, FULL FRAME) - **DISC ONLY**",2.95,2020-06-18 00:00:00
Pride and Prejudice [Special Edition],4.8,2020-06-18 00:00:00
Pride + Prejudice + Zombies,3.04,2020-06-18 00:00:00
Pride and Prejudice (Word Cloud Classics),16.94,2020-06-18 00:00:00
"vintage pride and prejudice, Leather Back, Scritta Paper, Jane Austen",73.0,2020-06-18 00:00:00
Pride and Prejudice by Jane Austen,8.99,2020-06-18 00:00:00
Pride Prejudice and Zombies (4K Ultra HD and Blu-ray) Lily James - No Digital,8.0,2020-06-18 00:00:00
Pride And Prejudice by Jane Austen,7.32,2020-06-18 00:00:00
Scholastic Classics: Pride and Prejudice by Jane Austen (softcover book),3.69,2020-06-18 00:00:00
"Matthew MacFadyen, Keira Kn...-Pride and Prejudice (UK IMPORT) Blu-ray NEW",22.1,2020-06-18 00:00:00
"Pride and Prejudice by Austen, Jane",3.99,2020-06-18 00:00:00
Antique 1893 Pride and Prejudice Jane Austen Vol. 1 and 2 Hardcover Books,314.9,2020-06-18 00:00:00
2013 GB JANE AUSTEN SG 2609 - 2619 Set of 6 MNH Bicentenary Pride Prejudice,12.28,2020-06-18 00:00:00
"Pride&Prejudice dvd  Disc Only, NO USPS TRACKING!!",3.0,2020-06-17 00:00:00
1:12 SCALE MINIATURE BOOK PRIDE AND PREJUDICE ILLUSTRATED JANE AUSTEN DOLLHOUSE,8.0,2020-06-17 00:00:00
Pride and Prejudice [Special Edition] Colin Firth,4.75,2020-06-17 00:00:00
Pride and Prejudice [Special Edition],5.48,2020-06-17 00:00:00
Pride and Prejudice [Bantam Classics],3.69,2020-06-17 00:00:00
"Dover Thrift Editions: Pride and Prejudice by Jane Austen (1995, Paperback,...",6.0,2020-06-17 00:00:00
"Pride and Prejudice (Full Screen) (2005) DVD, Simon Woods, Sylvester Morand, Cla",4.49,2020-06-17 00:00:00
Pride And Prejudice: Library Edition By Jane Austen And Christina Calvit Books,11.91,2020-06-17 00:00:00
"Classics Reimagined, Pride and Prejudice, Austen, Jane, Very Good Book",4.99,2020-06-17 00:00:00
PRIDE AND PREJUDICE  by Jane Austen 2003 Bantam paperback CLASSIC BRITISH LIT,5.99,2020-06-17 00:00:00
Pride and Prejudice - Colin Firth & Jennifer Ehle - Special Edition- DVD movie,5.97,2020-06-17 00:00:00
Pride and Prejudice by Jane Austen - Franklin Library -1980,26.81,2020-06-17 00:00:00
PRIDE AND PREJUDICE T SHIRT bluray dvd cover tee SMALL MEDIUM LARGE or XL,21.99,2020-06-17 00:00:00
Pride and Prejudice and Zombies (DVD) NEW/UNUSED FREE SHIPPING!!,5.99,2020-06-17 00:00:00
steampunk brooch badge pin gothic pride prejudice skull cameo day of the dead,11.14,2020-06-17 00:00:00
Pride and Prejudice DVD 2 Disc Set Restored Edition NEW,35.0,2020-06-17 00:00:00
Pride and Prejudice [BBC Miniseries],11.35,2020-06-16 00:00:00
The Annotated Pride and Prejudice,10.49,2020-06-16 00:00:00
Pride and Prejudice and Zombies DVD NEW,13.52,2020-06-16 00:00:00
PRIDE AND PREJUDICE DVD SET A&E MINI SERIES COLIN FIRTH 2 DVDs,30.0,2020-06-16 00:00:00
"Pride and Prejudice: (Penguin Classics Deluxe Edition) by Austen, Jane",13.55,2020-06-16 00:00:00
Pride & Prejudice FRIDGE MAGNET (2 x 3 inches) first edition cover Jane Austen,5.95,2020-06-16 00:00:00
PRIDE AND PREJUDICE -  COLIN FIRTH / JENNIFER EHLE - 2 DISC DVD  PAL R4,30.06,2020-06-16 00:00:00
Jane Austen's Pride and Prejudice ~ DVD ~ 2-Disc Set ~ 200th Anniversary Edition,18.25,2020-06-16 00:00:00
The Complete Novels of Jane Austen 1933  Pride and Prejudice Sense Sensibility,66.86,2020-06-16 00:00:00
1894 'Peacock' Pride And Prejudice Book - Jane Austen - Illustrated Hugh Thomson,1152.4,2020-06-16 00:00:00
"Pride and Prejudice (DVD, 2 DISC, A&E) COLIN FIRTH",7.44,2020-06-16 00:00:00
"NEW Funko POP! Movies Pride Prejudice & Zombies ELIZABETH #266, Vinyl Figure",13.6,2020-06-16 00:00:00
Pride and Prejudice by Jane Austen a paperback book FREE USA SHIPPING austin,7.65,2020-06-16 00:00:00
PRIDE AND PREJUDICE - JANE AUSTEN - EVERYMAN EDITION 1909,48.5,2020-06-16 00:00:00
Penguin Classics Deluxe Edition Ser.: Pride and Prejudice by Jane Austen...,8.33,2020-06-16 00:00:00
Pride and Prejudice A&E Home Video Advertising Promo Postcard Unposted ,3.95,2020-06-16 00:00:00
Pride and Prejudice (Norton Critical Editions) by Jane Austen,3.99,2020-06-16 00:00:00
1924 Austen's Pride And Prejudice - MacMillan Pocket Classics,38.33,2020-06-16 00:00:00
Total Language Plus- Pride and Prejudice study guide,14.99,2020-06-16 00:00:00
Pride and Prejudice ; by Jane Austen - Reader's Digest World's Best Reading - HC,44.37,2020-06-16 00:00:00
Pride & Prejudice Sampler cross stitch chart ,2.87,2020-06-16 00:00:00
Pride and Prejudice,5.49,2020-06-15 00:00:00
FUNKO POP MOVIES PRIDE & PREJUDICE & ZOMBIES JANE BENNET #267 ,15.38,2020-06-15 00:00:00
"Pride & Prejudice [Blu-ray/DVD Combo + Digital Copy] DVD, Pike, Rosamund, Riley,",9.86,2020-06-15 00:00:00
PRIDE AND PREJUDICE AND ZOMBIES NEW DVD,5.55,2020-06-15 00:00:00
"JANE AUSTEN Pride and Prejudice, Sense and Sensibility, Persuasion ~ 3 Book Set",47.01,2020-06-15 00:00:00
Pride and Prejudice [Special Edition],5.79,2020-06-15 00:00:00
"Pride and Prejudice (Penguin Clothbound Classics) by Austen, Jane",22.98,2020-06-15 00:00:00
Pride and Prejudice and Zombies Dreadfully Ever After Brand New (GET 2 FOR $5)FS,5.0,2020-06-15 00:00:00
PRIDE AND PREJUDICE by Jane Austen/HC/Literature/Classic/Illustrated,130.0,2020-06-15 00:00:00
NEW Pride & Prejudice by Jane Austen Deluxe Pocket Size Hardcover Slipcase Ed,19.95,2020-06-15 00:00:00
Pride & Prejudice DVD Keira Knightley  Judi Dench Donald Sutherland Jane Austen,9.0,2020-06-15 00:00:00
5 Franklin Library Lot Pride And Prejudice David Copperfield Huckleberry Finn,57.89,2020-06-15 00:00:00
Pride and Prejudice DVD Keira Knightley,4.0,2020-06-15 00:00:00
"Jane Austen Barnes & Noble Collector's Library Set Of 4: Emma, Pride & Prejudice",44.38,2020-06-15 00:00:00
Secrets of Six Wives - Pride and Prejudice (DVD),12.8,2020-06-15 00:00:00
Jane Austen PRIDE AND PREJUDICE Vintage 1980 The Franklin Library Gold Guilded,29.99,2020-06-15 00:00:00
"Bantam Classics: Pride and Prejudice by Jane Austen (1983, Paperback, Reprint)",5.88,2020-06-15 00:00:00
"Pride and Prejudice (Mini-Series) (DVD, 2001, 2-Disc Set, Special Edition.B544+",16.49,2020-06-15 00:00:00
Lot of 3~Jane Austen~PB~BCE~Emma~Persuasion~Pride & Prejudice,21.99,2020-06-15 00:00:00
"NIB Porcelain Heroine PRIDE & PREJUDICE 11"" JANE AUSTEN BOOK CLUB FRANKLIN MINT",269.99,2020-06-15 00:00:00
"Pride and Prejudice (1940) Greer Garson, Laurence OlivIer DVD *NEW",6.8,2020-06-15 00:00:00
"Pride and Prejudice (Blu-ray/DVD, 2005, 2-Disc Set) New Free Shipping ",34.99,2020-06-15 00:00:00
"Pride and Prejudice (DVD, 2006, Anamorphic Widescreen) - Disc Only",3.87,2020-06-15 00:00:00
"Pride & Prejudice - by Jane Austen ONLINEPDF, NO PAPERBACK",1.99,2020-06-15 00:00:00
"Pride And Prejudice [Scholastic Classics] , Austen, Jane",4.34,2020-06-14 00:00:00
PRIDE AND PREJUDICE  Jane Austen 1996 Signet paperback CLASSIC BRITISH LIT,4.99,2020-06-14 00:00:00
"Jane Austen's Pride and Prejudice (DVD, 1985) BBC Miniseries",14.36,2020-06-14 00:00:00
Pride and Prejudice (Signet Classics) by Jane Austen ,4.49,2020-06-14 00:00:00
Pride and Prejudice and Zombies (DVD) NEW/UNUSED FREE SHIPPING!!,5.99,2020-06-14 00:00:00
Pride and Prejudice [Special Edition],5.98,2020-06-14 00:00:00
JANE AUSTEN'S PRIDE AND PREJUDICE HARDCOVER BOOK.,22.95,2020-06-14 00:00:00
"Pride & Prejudice & Zombies (DVD, 2016)",22.14,2020-06-14 00:00:00
PRIDE AND PREJUDICE 6 Tape Boxed Set VHS ,7.39,2020-06-14 00:00:00
Pride and Prejudice DVD Keira Knightley,3.9,2020-06-14 00:00:00
"Pride and Prejudice Mini-Series DVD 2001, 2-Disc Set, Special Edition Widescreen",30.68,2020-06-14 00:00:00
"Pride and Prejudice by Jane Austen (2004, Hardcover)",5.49,2020-06-14 00:00:00
Jane Austen: The Complete Novels brand new hardback Pride Prejudice Emma 7 novel,12.95,2020-06-14 00:00:00
"Pride and Prejudice (Mini-Series) (DVD, 2001, 2-Disc Set, Special Edition...",12.74,2020-06-14 00:00:00
Pride + Prejudice + Zombies,5.99,2020-06-14 00:00:00
Pride and Prejudice (Great Illustrated Classics (A,7.8,2020-06-14 00:00:00
Pride and Prejudice [Special Edition],6.02,2020-06-14 00:00:00
925 Sterling Silver Pride and Prejudice Book Charm - American Novel Pendant NEW,14.95,2020-06-14 00:00:00
Pride v. Prejudice: A Claire Malloy Mystery (Clair,4.49,2020-06-14 00:00:00
Pride & Prejudice Jane Austen From The Franklin Library,19.95,2020-06-14 00:00:00
"Pride and Prejudice (Everyman's Library) by Austen, Jane",10.8,2020-06-14 00:00:00
Mr. Darcy's Missing Bride: A Pride and Prejudice Variation (Paperback or Softbac,12.33,2020-06-14 00:00:00
"Pride and Prejudice (DVD, 2006)  **Good**",3.79,2020-06-14 00:00:00
"Pride and Prejudice (DVD,2-Disc Set, Restored Edition) - Colin Firth - Region 1",16.49,2020-06-13 00:00:00
Lot of Jane Austen PRIDE & PREJUDICE  Nelson Doubleday,11.86,2020-06-13 00:00:00
"Pride and Prejudice (DVD, 2004)",6.5,2020-06-13 00:00:00
The Amish Classics First Impressions Amish Tale Pride & Prejudice Sarah Price,5.99,2020-06-13 00:00:00
Jane Austen - Pride & Prejudice Sense & Sensibility 1950 Modern Library #264  ,19.38,2020-06-13 00:00:00
Pride and Prejudice DVD Keira Knightley NEW,5.49,2020-06-13 00:00:00
"PRIDE and PREJUDICE KEEPSAKE EDITION [2-DISC BLU-RAY SET, 2014] Colin Firth NEW!",49.95,2020-06-13 00:00:00
"Pride + prejudice + zombies Elizabeth, Parson and Mr. Darcy Funko POP",45.29,2020-06-13 00:00:00
Various Artists : Pride & Prejudice (Music From the Motion Picture) Soundtrack,5.25,2020-06-13 00:00:00
"AFTER JACKIE: PRIDE, PREJUDICE, AND BASEBALL'S FORGOTTEN Fussman HB/DJ/1ST/ NEW",9.49,2020-06-13 00:00:00
"Pride and Prejudice (DVD, 2006, Anamorphic Widescreen) - Disc Only",3.92,2020-06-12 00:00:00
Pride and Prejudice [Special Edition],5.65,2020-06-12 00:00:00
McDougal Littell Literature Connections: Student Text Pride and Prejudice 1996,4.29,2020-06-12 00:00:00
Mr. Darcy Takes a Wife: Pride and Prejudice Continues,3.5,2020-06-12 00:00:00
Pride & Prejudice Sampler cross stitch chart ,2.87,2020-06-12 00:00:00
"Pride and Prejudice, RARE CLASSIC DVD, 1940, Greer Carson, Laurence Oliver, MINT",8.24,2020-06-12 00:00:00
Illustrated Classic Editions : Pride and Prejudice by Jane Austen PB 1997,10.33,2020-06-12 00:00:00
PRIDE & PREJUDICE & ZOMBIES POP! LADY CATHERINE #270 VINYL FIGURE FUNKO  ,7.99,2020-06-12 00:00:00
"Pride and Prejudice (DVD, 2006, Anamorphic Widescreen)",6.5,2020-06-12 00:00:00
"Pride and Prejudice [Dover Thrift Editions] , Jane Austen",3.99,2020-06-12 00:00:00
Pride And Prejudice BBC 2 Disc DVD Colin Firth Jennifer Ehle Sealed NWT NEW,32.2,2020-06-12 00:00:00
Pride and Prejudice (Special Edition) - Region 2,10.0,2020-06-12 00:00:00
"Pride and Prejudice (DVD, 2001, 2-Disc Set, Special Edition) **Free Shipping**",9.99,2020-06-11 00:00:00
"Manga Classics Pride and Prejudice Austen, Jane Paperback Used - Like New",34.98,2020-06-11 00:00:00
Pride & Prejudice/North & South Hmv Ex (Repack) (UK IMPORT) DVD [REGION 2] NEW,7.86,2020-06-11 00:00:00
Victorian PRIDE PREJUDICE Jane Austen 1880s Gold Embossed Victorian Nouveau Book,482.85,2020-06-11 00:00:00
PEACOCK Victorian PRIDE & PREJUDICE Jane Austen 1894 Illustrated Hugh Thomson,1682.85,2020-06-11 00:00:00
"Jane Austen Pendant - PRIDE and PREJUDICE Necklace, Southern Jewelry, Large",19.8,2020-06-11 00:00:00
"Pink Cameo Dangle Earrings, Jane Austen Earrings PRIDE and PREJUDICE, Romantic",18.0,2020-06-11 00:00:00
Easton Press Pride and Prejudice Jane Austen All Leather,55.0,2020-06-11 00:00:00
PRIDE AND PREJUDICE BY JANE AUSTEN 1917 Dent's Deluxe Quarter Leather Binding ,216.3,2020-06-11 00:00:00
Pride and Prejudice by Jane Austen Unabridged  New Sealed Deluxe Hardcover Gift,28.36,2020-06-11 00:00:00
"Carl Davis - The World at War, Pride and Prejudice  CD",18.99,2020-06-11 00:00:00
Easton Press 100 Greatest Leather Collectors Edition of PRIDE AND PREJUDICE ,114.33,2020-06-11 00:00:00
"Pride and Prejudice, Jane Austen, 1965, Perennial Classic: Harper-Row",24.0,2020-06-10 00:00:00
"Pride, Prejudice and Mistletoe - DVD By Lacey Chabert - VERY GOOD",298.99,2020-06-10 00:00:00
"Lydia Bennet's Story: A Sequel to Pride and Prejudice by Odiwe, Jane",4.14,2020-06-10 00:00:00
Pride and Prejudice - Unabridged MP3 CD Audiobook in paper sleeve,5.59,2020-06-10 00:00:00
"Olympic Pride, American Prejudice The Untold Story of 18 Africa... 9781501162152",22.43,2020-06-10 00:00:00
PRIDE and PREJUDICE  2-Disc Special Edition DVD Boxset Set US A&E ,13.74,2020-06-10 00:00:00
Pride and Prejudice by Amanda Enright: Used,8.15,2020-06-10 00:00:00
Pride and Prej. and Zombies: Pride and Prejudice and Zombies by Seth...,4.97,2020-06-10 00:00:00
"LDS ROMANTIC COMEDY/ DRAMA DVD PRIDE & PREJUDICE, EXCELLENT CONDITION",10.39,2020-06-10 00:00:00
Vintage Book “Pride And Prejudice” By Jane Austen. Illustrated By Lex De Renault,19.99,2020-06-10 00:00:00
"2 Books ""PRIDE AND PREJUDICE/EMMA"" * Jane Austen-Nelson Doubleday",26.99,2020-06-10 00:00:00
"Impulse & Initiative: A Pride & Prejudice Variation by Reynolds, Abigail",3.99,2020-06-10 00:00:00
"Pride and Prejudice (Penguin Clothbound Classics) by Austen, Jane",16.7,2020-06-10 00:00:00
"Lot of 3 TPBs - Pride Prejudice Zombies, Dawn Dreadfuls, Dreadfully Ever After",15.99,2020-06-10 00:00:00
Pride & Prejudice Sampler cross stitch chart .,2.87,2020-06-10 00:00:00
Pride and Prejudice by Jane Austen Rebound,10.33,2020-06-10 00:00:00
Pride and Prejudice,5.83,2020-06-10 00:00:00
"Pride And Prejudice, 10th Anniversary Collector's 3 DVD Set - New",48.24,2020-06-10 00:00:00
MSCHF Branded Books - Pride & Prejudice by Jane Austen - Only 1000 Made SOLD OUT,45.0,2020-06-10 00:00:00
NEW - Pride and Prejudice: The Graphic Novel (Campfire Graphic Novels),13.98,2020-06-10 00:00:00
Original Soundtrack - Pride and Prejudice (2005) CD NEW,16.49,2020-06-10 00:00:00
Rare 1945 Illustrated by Robert Ball - PRIDE AND PREJUDICE Jane Austen Hardcover,68.33,2020-06-10 00:00:00
Jane Austen PRIDE AND PREJUDICE Easton Press Limited Edition 1977 Leather,34.36,2020-06-10 00:00:00
PRIDE AND PREJUDICE & SENSE AND SENSIBILITY Jane Austen Modern Library #264,30.33,2020-06-10 00:00:00
Jane Austen PRIDE AND PREJUDICE 1980 The Franklin Library In New Condition ,28.32,2020-06-10 00:00:00
Jane Austen 3 Book HC Set Pride & Prejudice Emma Sense and Sensibility Doubleday,29.95,2020-06-10 00:00:00
"Pride Prejudice and Zombies (DVD, 2016) SKU 3617",6.84,2020-06-09 00:00:00
EMMA by Jane Austen 1886 author of Pride and Prejudice ANTIQUE BOOK,163.86,2020-06-09 00:00:00
VHS Period Lot Jane Austin Pride Prejudice Sense Sensibility 1980/1981 Sets Tape,19.99,2020-06-09 00:00:00
"Pride and Prejudice (DVD, 2006, Anamorphic Widescreen) New and Unopened",4.99,2020-06-09 00:00:00
Pride and Prejudice [Special Edition],5.84,2020-06-09 00:00:00
Pride and Prejudice Jane Austen Small Vintage 1940 Classic Collector's Edition,27.79,2020-06-09 00:00:00
Pride and Prejudice by Jane Austen New Easton Press Leather Bound Gift Edition,78.86,2020-06-09 00:00:00
"Lot of 3 Jane Austen DVDs (BBC Video) Emma, Pride & Prejudice, Sense & Sensib",13.33,2020-06-09 00:00:00
"Pride and Prejudice (DVD, FULL FRAME) - **DISC ONLY**",3.5,2020-06-09 00:00:00
Pride and Prejudice Jane Austen HB c 1940,65.66,2020-06-09 00:00:00
PRIDE & PREJUDICE Board Game Based on Jane Austen's Novel 2~4 Players COMPLETE,49.33,2020-06-09 00:00:00
"1977 Easton Press ""Pride and Prejudice"" by Jane Austen-Leather Collector's Edit.",28.99,2020-06-09 00:00:00
"NEW - Pride and Prejudice (Collins Classics) by Austen, Jane",5.42,2020-06-09 00:00:00
Seth Grahame-Smith Pride And Prejudice Abraham Lincoln Vampire Hunter Signed 1st,55.45,2020-06-09 00:00:00
PRIDE AND PREJUDICE (Mini-Series)  (Blu-ray 2 Disc Set) Colin Firth,25.99,2020-06-09 00:00:00
"Easton Press Pride and Prejudice, Jane Austen, 100 Greatest Books, Leather",48.84,2020-06-09 00:00:00
"Pride & Prejudice DVD, Rainy Kerwin, Nicole Hamilton, Kara Holden, Hubbel Palmer",4.69,2020-06-09 00:00:00
"Pride and Prejudice - Special Edition 2-Disc Set SEALED (A&E Mini-Series, DVD)",25.19,2020-06-09 00:00:00
"Pride and Prejudice by Jane Austen, Heritage Press, Beautiful Gilt Spine, Illus.",29.75,2020-06-09 00:00:00
Pride and Prejudice 1894 First Peacock Edition Hugh Thomson Custom Box MUST SEE,1753.33,2020-06-09 00:00:00
"Jane Austen Set of 6 books- Emma, Pride and Prejudice, Sense and Sensibility",70.0,2020-06-09 00:00:00
PRIDE AND PREJUDICE AND ZOMBIES NEW DVD,8.75,2020-06-09 00:00:00
"Conviction: a sequel to Jane Austen's Pride & Prejudice Burris, Skylar Hamilton",6.99,2020-06-09 00:00:00
"Regency style wig color choice Jane austen, austenland, emma, pride & prejudice",106.54,2020-06-08 00:00:00
"Pride And Prejudice, The Fountain + Roswell CD Soundtracks + Bonus Tigerlilly CD",13.75,2020-06-08 00:00:00
"Pride And Prejudice (Penguin Classics S.) by Jones, Vivien Paperback Book The",7.84,2020-06-08 00:00:00
PRIDE & PREJUDICE 10th Anniversary Limited Edition-COLIN FIRTH is Mr Darcy,35.8,2020-06-08 00:00:00
Bantam Classics: Pride and Prejudice by Jane Austen 2003 Paperback,5.1,2020-06-08 00:00:00
"The Annotated Pride and Prejudice by Austen, Jane",11.81,2020-06-08 00:00:00
Pride and Prejudice By Jane Austen. 9781854712004,11.25,2020-06-08 00:00:00
PRIDE PREJUDICE By JANE AUSTEN,9.99,2020-06-08 00:00:00
"Atonement / Pride & Prejudice / Jane Eyre / Elizabeth Four Feature Films DVD, Ja",6.46,2020-06-08 00:00:00
"Pride and Prejudice (Mini-Series) (DVD, 2001, 2-Disc Set, Special Edition...",13.0,2020-06-08 00:00:00
Pride and Prejudice [Special Edition],5.59,2020-06-08 00:00:00
Mr. Darcy Takes a Wife: Pride and Prejudice Continues (Pride & Prejudice Contin,3.99,2020-06-08 00:00:00
"Pride And Prejudice - Soundtrack - Dario Marianelli Jean-Yves (NEW 12"" VINYL LP)",52.49,2020-06-08 00:00:00
"Pride and Prejudice by Jane Austen (2018 printing, Paperback)",5.33,2020-06-08 00:00:00
Pride and Prejudice (Unabridged and Annotated) by Jane Austen,4.09,2020-06-08 00:00:00
The Annotated Pride and Prejudice,10.27,2020-06-08 00:00:00
"Yours Truly, Mr. Darcy : A Pride and Prejudice Variation by Denise O'Hara...",8.75,2020-06-08 00:00:00
Eligible : A Modern Retelling of Pride and Prejudice by Curtis Sittenfeld,4.09,2020-06-08 00:00:00
Franklin Library Pride and Prejudice Jane Austen - A BEAUTY! SHIPS FREE in BOX,23.79,2020-06-08 00:00:00
"Pride and Prejudice (DVD, 2001, 2-Disc Set, Special Edition) - Free Shipping !!!",24.88,2020-06-08 00:00:00
Pride and Prejudice [Special Edition],5.65,2020-06-08 00:00:00
PRIDE and PREJUDICE  2-Disc Special Edition DVD Boxset Set US A&E ,13.74,2020-06-08 00:00:00
Jane Austen's Pride and Prejudice Trivia Game Complete! Free Shipping!,25.0,2020-06-08 00:00:00
GB 2013 SG3431-36 JANE AUSTEN'S PRIDE AND PREJUDICE GUTTER PAIRS,22.82,2020-06-08 00:00:00
"Pride And Prejudice: The Miniseries (Keepsake Edition) (2-Disc Set) (DVD, 2014)",19.99,2020-06-07 00:00:00
"Easton Press ""Pride and Prejudice"" by Jane Austen Leather Collector's Edition",103.86,2020-06-07 00:00:00
PRIDE & PREJUDICE - KEIRA KNIGHTLEY - DVD - 2005 - DVD - BRAND NEW SEALED,4.49,2020-06-07 00:00:00
