title,price,date"Pride and Prejudice by Jane Austen (2009, Trade Paperback)",5.0,2020-07-04 00:00:00
"🎧 Pride and Prejudice - Jane Austen audio books MP3, love novel,digital product",1.97,2020-07-04 00:00:00
SENSE AND SENSIBILITY/ PRIDE & PREJUDICE  DVD LOT OF 2,8.94,2020-07-04 00:00:00
"JANE AUSTEN Pride and Prejudice, Sense and Sensibility, Persuasion ~ 3 Book Set",47.01,2020-07-04 00:00:00
Easton Press PRIDE AND PREJUDICE by Jane Austen LEATHERBOUND - SEALED- BRAND NEW,64.99,2020-07-04 00:00:00
Pride and Prejudice and Zombies [DVD] [2016][Region 2],9.04,2020-07-04 00:00:00
"Pride and Prejudice - The Special Edition (A&E Miniseries) DVD, Alison Steadman,",4.81,2020-07-04 00:00:00
"Pride and Prejudice (DVD, 2006, Full Screen)",6.5,2020-07-04 00:00:00
Franklin Library PRIDE AND PREJUDICE Jane Austen  Collector's Edition Gilt Edge,16.85,2020-07-04 00:00:00
"Jane Austen's Pride and Prejudice by Jane Austen (1981, Paperback)",5.3,2020-07-04 00:00:00
Seth Grahame-Smith PRIDE AND PREJUDICE AND ZOMBIES Heirloom Edition 1st (mb),10.01,2020-07-03 00:00:00
Jane Eyre by Charlotte Bronte and Pride and Prejudice Penguin classics edition.,49.0,2020-07-03 00:00:00
Pride and Prejudice by Jane Austen (Hardcover),6.32,2020-07-03 00:00:00
Pride and Prejudice (Barnes & Noble Classics),4.35,2020-07-03 00:00:00
"PRIDE AND PREJUDICE (Remastered Edition) Colin Firth Mini-Series, Blu Ray + DVD",28.98,2020-07-03 00:00:00
Pride And Prejudice Sense and Sensibility Jane Austen HC DC 1949 Modern Library,22.99,2020-07-03 00:00:00
Easton Press THE NOVELS OF JANE AUSTEN 6 vol Pride Prejudice Emma Mansfield Park,543.3,2020-07-03 00:00:00
Pride and Prejudice / Northanger Abbey by Jane Austen VG,29.24,2020-07-03 00:00:00
"Pride And Prejudice The Special Edition DVD Colin Firth, BBC",12.8,2020-07-03 00:00:00
PRIDE AND PREJUDICE NEW DVD factory sealed ,5.69,2020-07-03 00:00:00
Pride and Prejudice - Jane Austen - Reader's Digest - 1998 - Hardcover Book VGC,42.61,2020-07-03 00:00:00
"NEW Funko POP! Movies Pride Prejudice & Zombies JANE BENNET #267, Vinyl Figure",12.9,2020-07-03 00:00:00
Pride & Prejudice,3.69,2020-07-03 00:00:00
Pride and Prejudice [Special Edition],5.39,2020-07-03 00:00:00
1822 1st PLAYING CARDS Game Quadrille  Pride and Prejudice Jane Austen interest,72.19,2020-07-03 00:00:00
"Pride and Prejudice (Mini-Series) (DVD, 2-Disc Set, Special Edition) Colin Firth",12.99,2020-07-03 00:00:00
Pride and Prejudice [Special Edition] - Free Shipping!,9.98,2020-07-03 00:00:00
"Pride and Prejudice ""The Game"" Board Game :  Jane Austen Novel  -  Complete",46.7,2020-07-03 00:00:00
"Pride and Prejudice - The Special Edition (A&E, 1996), , Very Good DVD, Colin Fi",14.65,2020-07-03 00:00:00
Sense and Sensibility (DVD) &  Pride + Prejudice + Zombies (DVD) Both New!,11.11,2020-07-03 00:00:00
"Pride and Prejudice and Zombies (Blu-ray Disc, 2016)",7.99,2020-07-03 00:00:00
"Pride and Prejudice and Zombies (2016) Lily James, Sam Riley DVD BRAND NEW",6.3,2020-07-03 00:00:00
Pride and Prejudice AUSTEN Jane c1900 1st Thus,163.86,2020-07-03 00:00:00
"Women's PRIDE AND PREJUDICE T-Shirt, Purple Size Large Purple Peacock Book",22.79,2020-07-03 00:00:00
"Pride + Prejudice + Zombies (Blu-ray Disc, 2017) Horror With Slipcover FREE SHIP",6.5,2020-07-02 00:00:00
A Pemberley Medley : Five Pride and Prejudice Variations by Abigail Reynolds,12.79,2020-07-02 00:00:00
"Pride and Prejudice: (Penguin Classics Deluxe Edition) by Austen, Jane",3.99,2020-07-02 00:00:00
Pride and Prejudice [Knickerbocker Classics],16.98,2020-07-02 00:00:00
Jane Austen Leather-Bound Classics Four Novels Pride & Prejudice Emma Sense & S ,18.0,2020-07-02 00:00:00
Vintage Rainbow Classics Pride & Prejudice by Jane Austen Hardcover 1946 ExLib,33.32,2020-07-02 00:00:00
Pride and Prejudice [Special Edition],5.76,2020-07-02 00:00:00
Pride & Prejudice (Wordsworth Classics) (Wadsworth Collection) By Jane Austen,5.33,2020-07-02 00:00:00
Pride and Prejudice [Special Edition],6.76,2020-07-02 00:00:00
"Pride and Prejudice and Zombies w/ Slipcover, Expired Digital Copy ",6.0,2020-07-02 00:00:00
Pride and Prejudice by Jane Austen [Hardcover 1980] Franklin Library Vintage,27.95,2020-07-02 00:00:00
Pride & Prejudice Sampler cross stitch chart .,2.87,2020-07-02 00:00:00
"Pride and Prejudice (Mini-Series) (DVD, 2001, 2-Disc Set, Special Edition Firth",8.5,2020-07-02 00:00:00
Pride & Prejudice New CD Soundtrack Carmen Rasmusen of American Idol + many more,23.99,2020-07-02 00:00:00
Pemberley Shades: Pride and Prejudice Continues  VeryGood,6.49,2020-07-02 00:00:00
PRIDE AND PREJUDICE (DK ILLUSTRATED CLASSICS) By Jane Austen New Old Stock,17.95,2020-07-02 00:00:00
Jane Austen Lot Oxford World Classics Mansfield Park Pride Prejudice Persuasion ,101.0,2020-07-02 00:00:00
Pride and Prejudice by Jane Austen PB Signet Classics 1996,5.2,2020-07-02 00:00:00
Pride and Prejudice [Special Edition],6.47,2020-07-02 00:00:00
Folio Society Jane Austen Pride and Prejudice Hardcover with Slipcase New Sealed,83.0,2020-07-01 00:00:00
"1980, Pride and Prejudice by Jane Austen, FRANKLIN LIBRARY, NF",23.0,2020-07-01 00:00:00
The Oxford Illustrated Jane Austin Pride & Prejudice Chapman Vol 2 Vtg 1983 HCDJ,32.83,2020-07-01 00:00:00
Jane Austen Classic “Pride and Prejudice” 2 disc DVD 1995 BBC w/ Colin Firth,13.95,2020-07-01 00:00:00
"Pride and Prejudice (Restored Edition) DVD, Lucy Davis, Emilia Fox, David Bamber",10.36,2020-07-01 00:00:00
Pride and Prejudice: A Romance by Jane Austen (English) Hardcover Book Free Ship,26.21,2020-07-01 00:00:00
Pride and Prejudice The Special Edition DVD,9.99,2020-07-01 00:00:00
Jane Austen ~ Pride and Prejudice ~ Illustrated ~ Junior Library Edition ~ 1984,29.0,2020-07-01 00:00:00
"Pride and Prejudice (Mini-Series) (VHS, 1996, 6-Tape Set)",10.91,2020-07-01 00:00:00
"Pride and Prejudice (Mini-Series) (DVD, 2006, 3-Disc Set, 10th Anniversary...",13.33,2020-07-01 00:00:00
Victorian / Girls 8 DVD Lot Pride Prejudice Shakespeare Love Vanity Fair Midsumm,15.94,2020-07-01 00:00:00
2006 PRIDE & PREJUDICE SENSE & SENSIBILITY by Jane Austen  The Complete Novels,47.0,2020-07-01 00:00:00
Lithographs Purple Pride & Prejudice V-Neck T-Shirt Women's Size XL ,29.62,2020-07-01 00:00:00
"Illustrated Classics Ser.: Pride and Prejudice by Jane Austen (2016, Trade...",10.86,2020-07-01 00:00:00
"Pride & Prejudice [Blu-ray/DVD Combo + Digital Copy] by Knightley, Keira, Macfa",10.67,2020-07-01 00:00:00
"Pride and Prejudice and Zombies [New DVD] Ac-3/Dolby Digital, Dolby, W",6.99,2020-07-01 00:00:00
Pride and Prejudice [Special Edition],5.17,2020-07-01 00:00:00
"LDS ROMANTIC COMEDY/ DRAMA DVD PRIDE & PREJUDICE, VERY GOOD CONDITION",11.99,2020-07-01 00:00:00
2 book set Pride and Prejudice by Jane Austen Hardcover and Cliffs Notes USED,10.33,2020-07-01 00:00:00
"Pride and Prejudice and Zombies by Jane Austen , Paperback",3.55,2020-07-01 00:00:00
Pride and Prejudice 11x17 Movie Poster (1940),9.98,2020-07-01 00:00:00
Pride and Prejudice and Zombies Graphic Novel,6.95,2020-07-01 00:00:00
Pride and Prejudice The Special Edition DVD (2 Disc) Colin Firth Jennifer Ehle,10.0,2020-07-01 00:00:00
"Colin Firth, Jennifer Ehle-Pride and Prejudice (UK IMPORT) Blu-ray NEW",14.47,2020-07-01 00:00:00
Pride and Prejudice [Special Edition],6.0,2020-07-01 00:00:00
"Jane Austen Scrabble Tile Pendant Charm ""Pride & Prejudice""  ",9.94,2020-07-01 00:00:00
"Pride and Prejudice (DVD, Widescreen) - **DISC ONLY**",2.95,2020-07-01 00:00:00
"PRIDE PREJUDICE ZOMBIES, VICTOR FRANKENSTEIN, ABE LINCOLN VAMPIRE HUNTER 3-DVDs",18.31,2020-07-01 00:00:00
"Pride and Prejudice [Everyman's Library] , Austen, Jane",3.99,2020-07-01 00:00:00
Pride & Prejudice Sampler cross stitch chart .,2.87,2020-07-01 00:00:00
"Pride and Prejudice (DVD, 2006, Full Screen) Keira Knightley, Matthew Macfadyen",4.8,2020-07-01 00:00:00
Pride & Prejudice Sampler cross stitch chart ,2.87,2020-07-01 00:00:00
Pride and Prejudice Jane Austen Small Vintage 1940 Classic Collector's Edition,20.83,2020-07-01 00:00:00
Pride and Prejudice - adaptation by Helen Jerome - Samuel French Script,4.95,2020-07-01 00:00:00
"Pride and Prejudice and Mistletoe - Hardcover By Cruz, Melissa De La - VERY GOOD",4.12,2020-07-01 00:00:00
"Pride and Prejudice (DVD, 2006, Anamorphic Widescreen)",3.99,2020-06-30 00:00:00
Funko Pop Pride & Prejudice & Zombies #266 Elizabeth Bennet Vinyl Figure,13.99,2020-06-30 00:00:00
Pride & Prejudice,3.69,2020-06-30 00:00:00
Book League of America : Pride and Prejudice / Jane Austen,19.33,2020-06-30 00:00:00
"Jane Austen's Pride and Prejudice (DVD, 1985) BBC Miniseries - NEW",12.98,2020-06-30 00:00:00
PRIDE & PREJUDICE 2 x DVD Set BBC AS NEW! Colin Firth Jane Austen Collection,15.77,2020-06-30 00:00:00
Pride and Prejudice By Jane Austen - 2014 New Hardcover,12.89,2020-06-30 00:00:00
"Pride and Prejudice by Jane Austen (1997, UK-B Format Paperback, Revised...",3.99,2020-06-30 00:00:00
Pride and Prejudice [Special Edition],5.48,2020-06-30 00:00:00
Pride & and Prejudice Sheet Music from Movie Piano Solo Songbook,9.95,2020-06-30 00:00:00
Jane Austen PRIDE AND PREJUDICE 1980; Franklin Library; Like New Condition ,24.0,2020-06-30 00:00:00
Pride & Prejudice Jane Austen Audiobook Fiction English unabridged on 9 Audio CD,13.99,2020-06-30 00:00:00
Lorna Doone Pride and Prejudice Library Edition 1946,8.0,2020-06-30 00:00:00
MATTHEW MACFADYEN SIGNED PRIDE & PREJUDICE CUTE STILL 8X10 PHOTO AUTOGRAPH COA,54.99,2020-06-30 00:00:00
"Lot: Pride and Prejudice, Emma, Persuasion (Jane Austen) Oxford World's Classicz",19.99,2020-06-30 00:00:00
Pride and Prejudice,48.25,2020-06-30 00:00:00
"NEW ~ Pride and Prejudice (1940) VHS Greer Garson, Laurence Olivier Classic NEW ",10.99,2020-06-30 00:00:00
Pride and Prejudice [Special Edition],5.34,2020-06-30 00:00:00
"Atonement/Pride and Prejudice/Jane Eyre/Elizabeth (DVD, 2012, 4-Disc Set)",6.99,2020-06-30 00:00:00
Matt Smith Signed 11x14 Photo *Pride And Prejudice And Zombies PSA AE84998,93.71,2020-06-29 00:00:00
Pride & and Prejudice Sheet Music from Movie Easy Piano Songbook NEW 000316107,15.39,2020-06-29 00:00:00
Pride and Prejudice and Zombies (Movie Tie-in Edition) (Pride and Pr - VERY GOOD,4.39,2020-06-29 00:00:00
Pride and Prejudice The Special Edition DVD,7.99,2020-06-29 00:00:00
"Pride and Prejudice (DVD, 2004)",11.5,2020-06-29 00:00:00
"Pride and Prejudice,Scarce 1940 MGM Movie Edition,Jane Austen, Dust Jacket",86.28,2020-06-29 00:00:00
"Pride and Prejudice and Zombies: Dreadfully Ever After [Quirk Classics] , Hocken",5.72,2020-06-29 00:00:00
Pride and Prejudice Special Edition Brand New,19.75,2020-06-29 00:00:00
Jane Austin Doll Action Figure 2013 Archie McPhee Pride & Prejudice Book Quill,19.99,2020-06-29 00:00:00
NEW SEALED Sense & Sensibility and Pride & Prejudice by Jane Austen Hardcover,44.95,2020-06-29 00:00:00
"Jane Austin's Sense&Sensibility, Pride&Prejudice DVDs and Soundtrack",12.8,2020-06-29 00:00:00
"Dover Thrift Editions Ser.: Pride and Prejudice by Jane Austen (1995, Trade...",4.8,2020-06-29 00:00:00
"COMPLETE  WORKS OF JANE AUSTEN, Leather, PRIDE AND PREJUDICE, EMMA,   MORE!!",32.14,2020-06-29 00:00:00
Pride and Prejudice [Special Edition],5.64,2020-06-29 00:00:00
Pride and Prejudice [Special Edition],5.56,2020-06-29 00:00:00
Pride and Prejudice by Jane Austen. 1976 Illustrated by Isabel Bishop. Slipcase,19.76,2020-06-29 00:00:00
"Pride and Prejudice (Mini-Series) (DVD, 2001, 2-Disc Set, Special Edition...",12.99,2020-06-29 00:00:00
"Pride and Prejudice (Oxford World's Classics) by Austen, Jane Paperback Book The",9.89,2020-06-29 00:00:00
PRIDE AND PREJUDICE Jane AUSTEN 1897 ILLUSTRATED (2 Vols) Brimley Johnson ,373.6,2020-06-29 00:00:00
Lot of 7 Mr & Mrs Darcy JANE AUSTEN PRIDE & PREJUDICE CONTINUES  Sharon Lathan,29.99,2020-06-29 00:00:00
PRIDE  PREJUDICE  ZOMBIES (Blu Ray) Lily James Sam Riley Zombies Lena Headey ,6.0,2020-06-29 00:00:00
Pride and Prejudice [Classic Lines],16.53,2020-06-29 00:00:00
Jane Austen / Sense & Sensibility Pride & Prejudice Emma Mansfield Park,148.75,2020-06-29 00:00:00
PRIDE AND PREJUDICE DVD Greer Garson / Lawrence Olivier NEW Region 4,19.35,2020-06-29 00:00:00
Pride And Prejudice The Best Film Of The Year Keira Knighley,6.3,2020-06-28 00:00:00
"Pride and Prejudice and Zombies: The Graphic Novel by Jane Austen, Seth Grahame-",4.89,2020-06-28 00:00:00
Mr. Darcy Takes a Wife: Pride and Prejudice Continues - Paperback - VERY GOOD,3.59,2020-06-28 00:00:00
"Pride and Prejudice (HD DVD, 2007)",7.8,2020-06-28 00:00:00
"Pride and Prejudice - The Special Edition (A&E, 1996), , Very Good DVD, Colin Fi",8.49,2020-06-28 00:00:00
"Pride and Prejudice [Puffin Classics] [ Austen, Jane ] Used - Good",4.09,2020-06-28 00:00:00
"Pride and Prejudice (DVD, 2006, Widescreen ) Keira Knightley Movie New Sealed",8.99,2020-06-28 00:00:00
Smirnoff “Pride Not Prejudice” Rainbow Short Sleeve Shirt - Large - Red NWOT ,8.0,2020-06-28 00:00:00
"Pride and Prejudice (Oxford World's Classics) by Austen, Jane Hardback Book The",9.82,2020-06-28 00:00:00
Pride & Prejudice by Jane Austen Unabridged Deluxe Soft Leather Feel Edition,24.81,2020-06-28 00:00:00
Atonement / Pride & Prejudice / Jane Eyre / Elizabeth Four Feature Films,5.61,2020-06-28 00:00:00
"Pride And Prejudice - Parts 01 And 02 (DVD, 2001, 2-Disc Set)",22.14,2020-06-28 00:00:00
Pride And Prejudice Jane Austen Bonded Leather Classic Literature Collection Red,43.98,2020-06-28 00:00:00
Pride and Prejudice [Special Edition],4.99,2020-06-28 00:00:00
Pride And Prejudice By Jane Austen (Wordsworth Classics Paperback),4.5,2020-06-28 00:00:00
"1st Peacock Edition of Pride & Prejudice - Jane Austen, Illust by Hugh Thomson ",2064.71,2020-06-28 00:00:00
Pride Ibi Zoboi Hardcover Mint Condition Pride & Prejudice REMIX,9.5,2020-06-28 00:00:00
"Pride and Prejudice by Jane Austen (Book, Other)",13.33,2020-06-28 00:00:00
Pride And Prejudice - R4 (DVD) Classic Drama Laurence Olivier,29.41,2020-06-28 00:00:00
Pride and Prejudice - 2014 South Korean TV Series - English - Chinese Subtitles,69.95,2020-06-28 00:00:00
"PRIDE AND PREJUDICE (DVD, IMPORT) GREEG GARSON",7.2,2020-06-28 00:00:00
Hal Leonard Pride And Prejudice - Music From The Motion Picture Soundtrack Piano,17.12,2020-06-27 00:00:00
Funko Pop Pride & Prejudice & Zombies #266 Elizabeth Bennet Vinyl Figure,17.95,2020-06-27 00:00:00
"Pride and Prejudice (Mini-Series) (DVD, 2001, 2-Disc Set, A&E) Colin Firth",8.25,2020-06-27 00:00:00
"Lot of 3  - 4K + Blu Ray Movies!! Angry Birds, Sausage Party, Pride & Prejudice ",15.49,2020-06-27 00:00:00
"Pride and Prejudice (Mini-Series) (DVD, 2001, 2-Disc Set Special Edition A&E BBC",14.8,2020-06-27 00:00:00
"Pride and Prejudice (Marvel Illustrated), Jane Austen, ",11.19,2020-06-27 00:00:00
1939 Press Photo Actor Max Gordon Producer Roberta Pride Prejudice Women 8X10,22.87,2020-06-27 00:00:00
Pride and Prejudice [Penguin Clothbound Classics],18.37,2020-06-27 00:00:00
Pride and Prejudice by Jane Austen: New,20.25,2020-06-27 00:00:00
Jane Austen – Pride and Prejudice International Collectors Library ,11.83,2020-06-27 00:00:00
Pride + Prejudice + Zombies 4K UHD Blu-ray {NEW/OPEN} {NO DIGITAL},10.04,2020-06-27 00:00:00
Pride and Prejudice - Jane Austen LEATHERETTE Heron Book 1968,52.59,2020-06-27 00:00:00
BABY Lit lot 8 Board books Pride Prejudice Jane Eyre Romeo & Juliet Alice MORE,32.91,2020-06-27 00:00:00
"Pride and Prejudice (DVD, 2006)",4.25,2020-06-27 00:00:00
"Pride and Prejudice (DVD, 2006, Widescreen), Keira Knightley  New Factory Sealed",8.5,2020-06-27 00:00:00
"Pride and Prejudice (Bantam Classics) by Austen, Jane, Good Book",4.25,2020-06-27 00:00:00
"Pride and Prejudice (Mini-Series DVD, 2010) Colin Firth, Jennifer Ehle- RESTORED",27.5,2020-06-27 00:00:00
"Pride, Prejudice, and Other Flavors By Sonali Dev",7.5,2020-06-27 00:00:00
"Pride and Prejudice (DVD, 2006, Widescreen ) Keira Knightley Movie New Sealed",8.99,2020-06-27 00:00:00
"Pride And Prejudice: The Miniseries (Keepsake Edition) (2-Disc Set) (DVD, 2014)",21.52,2020-06-27 00:00:00
Pride & Prejudice [DVD],6.49,2020-06-27 00:00:00
Jane Austin's Pride and Prejudice Dutton w/slipcase,20.0,2020-06-27 00:00:00
QE NEW PRIDE AND PREJUDICE SPECIAL EDITION 2-Disc DVD SET Mini-Series 2001 A&E ,30.0,2020-06-27 00:00:00
Pride and Prejudice [Dover Thrift Editions] [ Jane Austen ] Used - VeryGood,3.72,2020-06-27 00:00:00
Pride and Prejudice - Jane Austen LEATHERBOUND Franklin Library 1980,72.26,2020-06-27 00:00:00
Pride + Prejudice + Zombies  (4K Ultra HD + Blu-ray),8.39,2020-06-27 00:00:00
"Pride and Prejudice - The Special Edition (A&E Miniseries) DVD, Alison Steadman,",5.08,2020-06-26 00:00:00
Pride and Prejudice,3.82,2020-06-26 00:00:00
Pride and Prejudice [Special Edition],5.97,2020-06-26 00:00:00
 PRIDE AND PREJUDICE HC Book (Dalmation Press Leather Bound) Jane Austen,29.45,2020-06-26 00:00:00
Funko POP! - Pride and Prejudice and Zombies - Mr. Darcy #268 - Vinyl Bobblehead,12.85,2020-06-26 00:00:00
Little Dogs on the Prairie Pride Prejudice and Fudge Vintage VHS ,8.99,2020-06-26 00:00:00
"Pride and Prejudice  (DVD, 2001, 2-Disc Set, Special Edition Widescreen)Exc 1995",18.45,2020-06-26 00:00:00
Pride & Prejudice Jane Austen Audiobook Fiction English unabridged on 9 Audio CD,13.99,2020-06-26 00:00:00
Pride and Prejudice by Jane Austen ~ Easton Press ~ Leatherbound ,59.99,2020-06-26 00:00:00
"Pride + Prejudice + Zombies DVD, Lily James, Bella Heathcote, Sam Riley, Lena He",5.66,2020-06-26 00:00:00
Pride and Prejudice,4.89,2020-06-26 00:00:00
Pride and Prejudice [Restored Edition] 2 Disc Set,24.95,2020-06-26 00:00:00
Pride and Prejudice and Zombies - DVD - Lily James - Sam Riley - 2016 - 1h 48min,5.79,2020-06-26 00:00:00
"Eligible: A modern retelling of Pride and Prejudice by Sittenfeld, Curtis",4.49,2020-06-26 00:00:00
Pride and Prejudice and Zombies  The Deluxe Heirloom Edition  Pride a,4.89,2020-06-26 00:00:00
"PRIDE and PREJUDICE KEEPSAKE EDITION [2-DISC BLU-RAY SET, 2014] sealed ",30.19,2020-06-26 00:00:00
Pride and Prejudice by Jane Austen (English) Hardcover Book Free Shipping!,13.79,2020-06-26 00:00:00
Pride and Prejudice - Barnes & Noble Classics -2001,6.04,2020-06-26 00:00:00
"Pride and Prejudice [Dover Thrift Editions] , Jane Austen",3.99,2020-06-26 00:00:00
" Pride and Prejudice, 1931 Austen",12.79,2020-06-26 00:00:00
Pride & Prejudice [Blu-ray],6.54,2020-06-26 00:00:00
Pride and Prejudice By Jane Austen H C  1940,75.0,2020-06-26 00:00:00
PRIDE AND PREJUDICE BY JANE AUSTEN INTERNATIONAL COLLECTORS LIBRARY (First Editi,56.33,2020-06-26 00:00:00
"Pride and Prejudice [Bantam Classics] , Austen, Jane",3.99,2020-06-25 00:00:00
"Pride and Prejudice (Mini-Series) (DVD, 2001, 2-Disc Set, Special Edition...",9.49,2020-06-25 00:00:00
Pride and Prejudice (York Notes Advanced) By Jane Austen,9.99,2020-06-25 00:00:00
c1920 5vol Jane Austen The Novels Riviere Binding Pride and Prejudice,8294.0,2020-06-25 00:00:00
Pride And Prejudice Signet Classic Paperback,1.5,2020-06-25 00:00:00
Pride & Prejudice dvd disc only NO TRACKING!!!,3.0,2020-06-25 00:00:00
"Pride and Prejudice (BBC, 1980/1985) Elizabeth Garvie, David Rintoul (DVD, 2004)",16.16,2020-06-25 00:00:00
"Pride and Prejudice (Mini-Series) (DVD, 2001, 2-Disc Set, Special Edition...",9.99,2020-06-25 00:00:00
PRIDE AND PREJUDICE Movie DVD - Special Edition Set -Volume I & II Colin Firth ,12.47,2020-06-25 00:00:00
"Atonement / Pride & Prejudice / Jane Eyre / Elizabeth Four Feature Films DVD, Ja",4.55,2020-06-25 00:00:00
Pride and Prejudice (Collins Classics) by Jane Austen ,4.49,2020-06-25 00:00:00
Pride and Prejudice Blu-ray Keira Knightley NEW,8.85,2020-06-25 00:00:00
"Pride and Prejudice (Mini-Series) DVD, 2001, 2-Disc Set Special Edition BBC A&E",12.5,2020-06-25 00:00:00
Pride and Prejudice (DVD 2001) The Special Edition - FREE Shipping!,9.99,2020-06-25 00:00:00
"Pride and Prejudice BBC (DVD, 2010, 2-Disc Set, Restored Edition) NEW SEALED",27.99,2020-06-25 00:00:00
"Olympic Pride, American Prejudice: The Untold Story of 18 African Americans Who",22.58,2020-06-25 00:00:00
Eligible : A Modern Retelling of Pride and Prejudice by Curtis Sittenfeld,4.09,2020-06-25 00:00:00
Pride & Prejudice Performed by Glenda Jackson Dove 4-cassette Audio (B3SUAMZ),7.23,2020-06-25 00:00:00
*4K BLU-RAY DISC ONLY* Pride and Prejudice and Zombies (2016) UHD Ultra HD Movie,7.75,2020-06-25 00:00:00
"Mr Darcy - Pride & Prejudice - (JAustin) UK Postage Stamp , laminated bookmark ",1.5,2020-06-25 00:00:00
Pride and Prejudice [Special Edition],6.98,2020-06-25 00:00:00
Jean-Yves Thibaudet - Music from the Motion Picture Pride and Prejudice [CD],12.92,2020-06-25 00:00:00
"PRIDE & PREJUDICE & ZOMBIES   BLU-RAY DVD   ""very nice"" ",8.99,2020-06-25 00:00:00
Pride and Prejudice [Special Edition],5.77,2020-06-24 00:00:00
PRIDE & PREJUDICE ZOMBIES: DVD,7.0,2020-06-24 00:00:00
"Pride and Prejudice (DVD, 2010, 2-Disc Set, Restored Edition)",25.0,2020-06-24 00:00:00
Pride and Prejudice Book Lot of (5) Hahn Roth Odiwe Silkstone Mackrory Variation,12.99,2020-06-24 00:00:00
"Pride and Prejudice (Blu-ray Disc, 2010)",12.12,2020-06-24 00:00:00
Pride and Prejudice and Zombies (DVD) NEW/UNUSED FREE SHIPPING!!,5.99,2020-06-24 00:00:00
"Pride and Prejudice (DVD, Full Screen) NEW SEALED",7.99,2020-06-24 00:00:00
Pride and Prejudice by Jane Austen Book Hardcover GUC,9.5,2020-06-24 00:00:00
PRIDE + PREJUDICE + ZOMBIES (2016) - 4K Ultra HD UHD disc only (No BD & Digital),19.0,2020-06-24 00:00:00
"Pride and Prejudice (Mini-Series) (DVD, 2001, 2-Disc Set Special Edition A&E BBC",13.86,2020-06-24 00:00:00
"Lot 3 Jane Austen PB's ~ Persuasion, Pride & Prejudice, Northanger Abbey ~ GOOD+",9.98,2020-06-24 00:00:00
"PRIDE AND PREJUDICE, Jane Austen, Illustrated, Leather-like, ICL,  Book",29.94,2020-06-24 00:00:00
"Pride & Prejudice movie poster - 11 x 17 - Keira Knightley, Matthew Macfadyen",11.99,2020-06-24 00:00:00
Jane AUSTEN Pride and Prejudice. COLOURED Illustrations H.M. Brock DENT 1901,247.56,2020-06-24 00:00:00
"Colin Firth, Jennifer Ehle-Pride and Prejudice (UK IMPORT) DVD [REGION 2] NEW",11.4,2020-06-24 00:00:00
Pride and Prejudice (Seasons Edition -- Winter),19.5,2020-06-24 00:00:00
THE JANE AUSTEN COLLECTION: PRIDE AND PREJUDICE - ILLUSTRATED EDITION HCDJ 2010,37.97,2020-06-24 00:00:00
Pride and Prejudice: A Book-to-Table Classic by Jane Austen (English) Mass Marke,9.27,2020-06-24 00:00:00
"Pride and Prejudice (Colin Firth, Jennifer Ehle) New Region B Blu-ray",32.24,2020-06-24 00:00:00
PRIDE AND PREJUDICE AND ZOMBIES by Jane Austin & Seth Grahame-Smith 2009 Lg PB,5.13,2020-06-23 00:00:00
Pride and Prejudice [Oxford World's Classics],4.09,2020-06-23 00:00:00
Lit for Little Hands: Pride and Prejudice [1],6.14,2020-06-23 00:00:00
"Annotated Pride and Prejudice, Paperback by Austen, Jane; Shapard, David M. (...",16.56,2020-06-23 00:00:00
Easton Press 100 Greatest Leather Collectors Edition of PRIDE AND PREJUDICE ,114.33,2020-06-23 00:00:00
Jane Austen's Pride and Prejudice (1985) BBC Video DVD starring Elizabeth Garvie,11.95,2020-06-23 00:00:00
Orgullo y prejuicio (Edicion conmemorativa) / Pride and Prejudice (Commemorative,12.35,2020-06-23 00:00:00
Pride and Prejudice (1940) DVD Greer Garson Laurence Oliver Marv Boland,7.79,2020-06-23 00:00:00
"Pride&Prejudice bluray  Disc Only, NO USPS TRACKING!!",4.12,2020-06-23 00:00:00
"Pride and Prejudice Jane Austen, Anna Quindlen Modern Library BBC Presentation",19.99,2020-06-23 00:00:00
Pride & Prejudice DVD Keira Knightley New Sealed,8.23,2020-06-23 00:00:00
"Pride and Prejudice (DVD, 2006) Greer Garson Laurence Olivier 1940 Region 1",7.99,2020-06-22 00:00:00
"PRIDE, PREJUDICE AND MISTLETOE DVD - SINGLE DISC EDITION - NEW - HALLMARK ",13.99,2020-06-22 00:00:00
"Pride and Prejudice - The Special Edition (A&E, 1996), , Very Good DVD, Colin Fi",9.28,2020-06-22 00:00:00
Pride and Prejudice [Special Edition] NEW Factory Sealed,20.29,2020-06-22 00:00:00
Jane Austen: Pride and Prejudice. 1929 Everyman's Library edition,26.94,2020-06-22 00:00:00
Jane Austen 7 Volume Folio Society Box Set EMMA PRIDE PREJUDICE SENSE SENSIBILTY,92.6,2020-06-22 00:00:00
"NEW VHS Pride and Prejudice 1940 Greer Garson, Laurence Olivier Black & White",5.99,2020-06-22 00:00:00
Franklin Library PRIDE AND PREJUDICE Jane Austen  Collector's Edition Gilt Edge,25.0,2020-06-22 00:00:00
PRIDE & PREJUDICE 10th Anniversary Limited Edition-COLIN FIRTH is Mr Darcy,22.21,2020-06-22 00:00:00
"Pride and Prejudice (Mini-Series) (DVD, 2001, 2-Disc Set Special Edition bbc a&e",18.99,2020-06-22 00:00:00
"Pride and Prejudice (DVD, 2006, Anamorphic Widescreen) BRAND NEW SEALED ",15.48,2020-06-22 00:00:00
Pride and Prejudice [Special Edition] - DVD,6.48,2020-06-22 00:00:00
Franklin Library 100 Greatest Books Limited Edition Pride &Prejudice/Jane Austen,28.83,2020-06-22 00:00:00
Pride and Prejudice by Jane Austen 9780198826736 | Brand New | Free US Shipping,7.72,2020-06-22 00:00:00
PRIDE PREJUDICE & MISTLETOE...-PRIDE PREJUDICE & MISTLETOE / (WS) DVD NEW,12.2,2020-06-22 00:00:00
"Pride and Prejudice [Collector's Library]  Austen, Jane  Good  Book  0 Hardcover",4.93,2020-06-22 00:00:00
Pride and Prejudice (Special Edition),7.62,2020-06-22 00:00:00
"Jane Austen's Pride and Prejudice by Jane Austen (2013, Hardcover)",17.51,2020-06-22 00:00:00
Britains 61005 Mr Wickham - Jane Austin Pride & Prejudice England,16.49,2020-06-22 00:00:00
Britains 61008 Mr Bennet - Jane Austin Pride & Prejudice England,16.49,2020-06-22 00:00:00
