title,price,datePride + Prejudice + Zombies,5.5,2020-07-27 00:00:00
Pride and Prejudice (Penguin Clothbound Classics),25.99,2020-07-27 00:00:00
Pride and Prejudice (Barnes & Noble Lea... by Jane Austen Leather / fine binding,35.19,2020-07-27 00:00:00
"LOT OF 2 BOOKS: PRIDE AND PREJUDICE AND ZOMBIES, DAWN OF THE DREADFULS",12.34,2020-07-27 00:00:00
Pride and Prejudice the Special Edition DVD in good condition,10.99,2020-07-27 00:00:00
"Pride and Prejudice (DVD, 2010, 2-Disc Set, Restored Edition)",9.98,2020-07-27 00:00:00
2005 Pride & Prejudice FYC Best Original Score CD Dario Marianelli,10.99,2020-07-27 00:00:00
Classics Reimagined Pride and Prejudice by Jane Austen Illustrated Edition,16.92,2020-07-27 00:00:00
Pride & Prejudice Faux Leather Bound Book International Collectors Library,47.14,2020-07-27 00:00:00
BH Cosmetics Pride and Prejudice and Zombies Eye & Cheek Limited Edition Palette,17.95,2020-07-27 00:00:00
BH Cosmetics Pride and Prejudice and Zombies 5pc Lip Gloss Set,14.95,2020-07-27 00:00:00
Funko Pop Pride and Prejudice and Zombies Mrs. Featherstone 271,14.6,2020-07-27 00:00:00
Blockbuster Video 1 Week Rental Case 2 Disk Pride and Prejudice Colin Firth 1995,19.99,2020-07-27 00:00:00
Storiarts Literary Scarf Cream Black Pride and Prejudice,16.6,2020-07-27 00:00:00
PRIDE AND PREJUDICE: A COLORING,13.39,2020-07-27 00:00:00
Pride and Prejudice [Special Edition],5.56,2020-07-27 00:00:00
Pride and Prejudice by Jane Austen - A Signet Classic - New American Library,7.99,2020-07-27 00:00:00
Pride and prejudice,1.5,2020-07-27 00:00:00
"Colin Firth, Jennifer Ehle-Pride and Prejudice (UK IMPORT) DVD [REGION 2] NEW",10.73,2020-07-27 00:00:00
Beautiful Pride And Prejudice Jane Austen Book Peacock Edition 1894 Hugh Thomson,2178.76,2020-07-27 00:00:00
7 tapes Jane Austen's Pride and Prejudice Mini-series + Emma VHS  6B4,10.99,2020-07-27 00:00:00
Pride and Prejudice 2-Disc DVD Set BBC Colin Firth Jennifer Ehle ,19.99,2020-07-27 00:00:00
Pride and Prejudice [Special Edition],5.52,2020-07-27 00:00:00
"Cozy Classics: Pride & Prejudice , Wang, Jack",3.99,2020-07-27 00:00:00
"Purse Clip-Jane Austen Book Charms: Emma, Sense & Sensibility, Pride & Prejudice",8.99,2020-07-27 00:00:00
Pride and Prejudice DVD Full Screen Keira Knightley Judi Dench Movie,4.99,2020-07-27 00:00:00
Pride & Prejudice: Keepsake Edition/ [Blu-ray],12.0,2020-07-27 00:00:00
Atonement / Pride & Prejudice / Jane Eyre / Elizabeth [New DVD] Boxed,12.72,2020-07-27 00:00:00
Pride and Prejudice [Special Edition],48.84,2020-07-27 00:00:00
Postscript from Pemberley: The Acclaimed Pride and Prejudice Sequel Series  Very,6.56,2020-07-27 00:00:00
"Pride and Prejudice (DVD, 2006, WS) **DISC ONLY**",2.95,2020-07-27 00:00:00
BBC JANE AUSTEN’S PRIDE AND PREJUDICE 2 DISC SET DVD R4 AUS SELLER AUS RELEASE,27.97,2020-07-27 00:00:00
"Pemberley by the Sea : A Modern Love Story, Pride and Prejudice Style",5.76,2020-07-26 00:00:00
Pride and Prejudice Special Edition (1995 Colin Firth) Region 4 DVD New,24.35,2020-07-26 00:00:00
"Pride and Prejudice and Zombies (Blu-ray Disc, 2016, Includes Digital Copy Ultra",9.88,2020-07-26 00:00:00
Pride and Prejudice Mini-Series DVD 2001 2-Disc Set Special Edition A&E,15.99,2020-07-26 00:00:00
Vintage Sterling 925 Silver Jane Austin Pride & Prejudice DVB Cuff Bracelet,37.88,2020-07-26 00:00:00
Pride and Prejudice EZ Play Today Vol 114 Easy Piano Keyboard Music Book,13.94,2020-07-26 00:00:00
6 Disc Set The Jane Austen Collection BBC Video DVDs Emma Pride Prejudice,20.0,2020-07-26 00:00:00
Pride and Prejudice apothecary label stickers scrapbooking glossy paper,9.95,2020-07-26 00:00:00
PRIDE AND PREJUDICE (Mini-Series)  (Blu-ray 2 Disc Set) Colin Firth,14.99,2020-07-26 00:00:00
Funko Pop Movies Pride+Prejudice+Zombies PARSON COLLINS #269 Halloween Figure,9.39,2020-07-26 00:00:00
Pride and Prejudice and Zombies Funko Pops! (5 Pops) and DVD set,56.0,2020-07-26 00:00:00
PRIDE AND PREJUDICE ~ Jane Austen ~ Easton Press ~ Collector's Edition 1996,71.71,2020-07-26 00:00:00
Pride and Prejudice and Zombies (DVD) Brand New! Lena Headey | Lily James,6.95,2020-07-26 00:00:00
"Jane Austen - Pride and Prejudice in 2 vol. 1906 Chawton edn., numbered 27/1250",86.76,2020-07-26 00:00:00
Real Paper Book Locking Booksafe with Key Lock Dictionary Secret Hidden Safe,22.99,2020-07-26 00:00:00
"Pride and Prejudice Special Edition 2-Disc Set New SEALED (A&E Mini-Series, DVD)",25.3,2020-07-26 00:00:00
"Hallmark Pride, Prejudice & Mistletoe DVD Lacey Chabert  Brand New Sealed",12.99,2020-07-26 00:00:00
PRIDE  PREJUDICE  ZOMBIES BLU-RAY lily james Matt Smith lena headey,5.9,2020-07-26 00:00:00
"Pride and Prejudice (Mini-Series) (Blu-ray Disc, 2010, 2-Disc Set)",15.33,2020-07-26 00:00:00
"Excellent, Pride and Prejudice: Hidden Lusts, Mitzi Szereto, Book",6.49,2020-07-26 00:00:00
"Pride and Prejudice, Hardcover,by Austen, Jane; Pattullo, Alice (Illustrated)",26.39,2020-07-26 00:00:00
PRIDE AND PREJUDICE AND ZOMBIES:,5.32,2020-07-26 00:00:00
Pride and Prejudice by Jane Austen PAPERBACK 2002,7.99,2020-07-26 00:00:00
"Pride, Prejudice and Mistletoe DVD 2020 BRAND NEW FAST SHIPPING",16.9,2020-07-26 00:00:00
Pride and Prejudice 6VHS Lot 200th Anniversary Edition And Film BBC New & Sealed,14.38,2020-07-26 00:00:00
Jane Austin Pride and Prejudice Peacock Tshirt Top Small,20.9,2020-07-26 00:00:00
PRIDE AND PREJUDICE Jane Austen Little Brown & Co 1892 hard cover,62.8,2020-07-26 00:00:00
Pride and Prejudice by Jane Austin (A Bantam Classic),4.49,2020-07-26 00:00:00
"Pride and Prejudice (BBC, 1980/1985) Elizabeth Garvie, David Rintoul (DVD, 2004)",9.99,2020-07-26 00:00:00
Jane Austen 6 Vol Matching Set New Soft Leather Feel Pride and Prejudice Emma ++,139.99,2020-07-26 00:00:00
"""Pride & and Prejudice"" Sheet Music from Movie for Piano (CD not included)",8.98,2020-07-26 00:00:00
"Pride and Prejudice DVD 2-Disc Set, The Special Edition Colin Firth FREE SHIP !!",16.89,2020-07-26 00:00:00
PRIDE & PREJUDICE - Original Soundtrack CD,6.49,2020-07-26 00:00:00
"Pride and Prejudice (Mini-Series) (DVD, 2001, 2-Disc Set) BRAND NEW",19.95,2020-07-26 00:00:00
Pride and Prejudice & Zombies~Dreadfully Ever After~8 disc 9+hr Audio Book ,6.99,2020-07-26 00:00:00
NEW Pride and Prejudice by Jane Austen Faux Leather Softcover Word Cloud Edition,24.95,2020-07-26 00:00:00
New Pride and Prejudice by Jane Austen Ribbon Marker Collectible Hardcover,29.76,2020-07-26 00:00:00
Easton Press: PRIDE AND PREJUDICE: JANE AUSTEN: BENNETS & MR. DARCY,70.0,2020-07-26 00:00:00
Pride & Prejudice Music from the Motion Picture Soundtrack (Dario Marianelli) Ea,20.38,2020-07-26 00:00:00
"9 Volume Vintage Classics Book Set Daily Express Publications Pride & Prejudice,",124.88,2020-07-26 00:00:00
"Pride, Prejudice and Mistletoe DVD 2020 BRAND NEW FAST SHIPPING",11.95,2020-07-25 00:00:00
Franklin Library - Jane Austen Pride And Prejudice - Red Leather / Gold Trim,24.95,2020-07-25 00:00:00
"Pride and Prejudice (1940) Greer Garson, Laurence Olivier DVD *NEW",6.49,2020-07-25 00:00:00
Pride and Prejudice/Sense and Sensibility Barnes and Noble Classics Jane Austen,20.0,2020-07-25 00:00:00
"Pride and Prejudice and Zombies (NEW SEALED DVD, 2016) Sam Riley Lily James",6.88,2020-07-25 00:00:00
Pride and Prejudice Jane Austen Note Cards [With 17 Envelopes] (Mixed Media Prod,13.32,2020-07-25 00:00:00
Jane Austen - Pride and Prejudice - EASTON PRESS - 1977,35.0,2020-07-25 00:00:00
Pride And Prejudice And Zombies Book,2.98,2020-07-25 00:00:00
NEW MR DARCY PROPOSAL QUOTES PRIDE AND PREJUDICE JANE AUSTEN T-SHIRT USA SIZE,27.91,2020-07-25 00:00:00
Pride and Prejudice,7.2,2020-07-25 00:00:00
Pride and Prejudice Music from the Motion Pictures by Dario Marianelli Audio CD,13.88,2020-07-25 00:00:00
Pride And Prejudice  (1995) The Special Edition 2-Disc Dvd Set A&E BBC,14.3,2020-07-25 00:00:00
JANE AUSTEN - PRIDE AND PREJUDICE - FAUX LEATHER & GILT - HERON,46.23,2020-07-25 00:00:00
Marrying Mr. Darcy Pride and Prejudice Card Game,35.46,2020-07-25 00:00:00
BBC JANE AUSTEN’S PRIDE AND PREJUDICE 2 DISC SET DVD R4 AUS SELLER AUS RELEASE,27.97,2020-07-25 00:00:00
"Madame Alexander 2020 PRIDE & PREJUDICE 10"" Cissette Doll New",159.95,2020-07-25 00:00:00
Paper Book Locking Booksafe with Key Lock Secret Hidden Safe Pride and Prejudice,19.99,2020-07-24 00:00:00
"Pride and Prejudice and Zombies by Seth Grahame-Smith, paperback",4.99,2020-07-24 00:00:00
My Cousin Caroline: The acclaimed Pride and Prejudice sequel series The Pember..,35.35,2020-07-24 00:00:00
Mr. Darcy Takes a Wife~Darcy & Elizabeth Pride Prejudice Continues~Linda Berdoll,18.37,2020-07-24 00:00:00
Pride and Prejudice  Everyman s Library ,4.89,2020-07-24 00:00:00
Marvel Comics Jane Austen Pride and Prejudice HC NM-/M 2009,64.45,2020-07-24 00:00:00
Pride and Prejudice (1940) Greer Garson / Laurence Olivier DVD USED *FAST SHIP.*,5.45,2020-07-24 00:00:00
"Pride and Prejudice (Oct 2009, Marvel) #5 VF 8.0",12.0,2020-07-24 00:00:00
Pride And Prejudice  (1995) The Special Edition 2-Disc Dvd Set A&E BBC,14.55,2020-07-24 00:00:00
Pride and Prejudice : Lit for Little Hands by Jane Austen,4.09,2020-07-24 00:00:00
 Pride & Prejudice Variations of Jane Austen by Different Authors 9 Books ,34.95,2020-07-24 00:00:00
"Pride and Prejudice - Paperback By Austen, Jane - VERY GOOD",4.14,2020-07-24 00:00:00
Pride and Prejudice [Special Edition],5.87,2020-07-24 00:00:00
"Pride and Prejudice (DVD, 2005, Widescreen) - G0412",5.2,2020-07-24 00:00:00
Pride and Prejudice and Zombies - Jane Austin and Seth Grahame Smith - Hardcover,9.95,2020-07-24 00:00:00
1945 Hardcover Pride and Prejudice Jane Austen Garden City Doubleday & Company,59.9,2020-07-24 00:00:00
"Pride and Prejudice (Mini-Series) (DVD, 2001, 2-Disc Set, Special Edition Wides…",14.99,2020-07-24 00:00:00
Pride And Prejudice: Keepsake Edition BLU-RAY,32.98,2020-07-24 00:00:00
"Madame Alexander 2020 PRIDE & PREJUDICE 10"" Cissette Doll w/Stand 76290 - NEW!",159.95,2020-07-24 00:00:00
"GREER GARSON LAURENCE OLIVIER MAUREEN O'SULLIVAN PRIDE AND PREJUDICE, SEALED",8.0,2020-07-24 00:00:00
1940 PRIDE AND PREJUDICE Love story ART romance NOVEL Emma movie JANE AUSTEN vtg,97.38,2020-07-24 00:00:00
Pride And Prejudice T-shirt Small Darcy Jane Austen English Book Stack Teacher,13.49,2020-07-24 00:00:00
Frankenstein & Pride and Prejudice - 2 Penguin Classics Books Jane Austin & Mary,47.26,2020-07-24 00:00:00
Pride and Prejudice Mini-Series DVD 2001 2-Disc Set Special Edition A&E,19.99,2020-07-23 00:00:00
Pride and Prejudice [Restored Edition],8.53,2020-07-23 00:00:00
NEW Funko POP! Movies Pride Prejudice & Zombies MRS FEATHERSTONE #271 Figure,10.4,2020-07-23 00:00:00
Pride and Prejudice [Special Edition],6.4,2020-07-23 00:00:00
First Impressions: An Amish Tale of Pride and Prejudice (The Ami - VERY GOOD,4.14,2020-07-23 00:00:00
Pride & Prejudice by Jane Austen Sealed Deluxe Gift Hardback Gold Gilt & Ribbon,29.99,2020-07-23 00:00:00
"Pride and Prejudice by Jane Austen, Bantam Classic Edition",4.0,2020-07-23 00:00:00
PRIDE & PREJUDICE (4 BLU-RAY) [EDIZIONE: STATI UNITI] NEW DVD,25.81,2020-07-23 00:00:00
Pride and Prejudice and Zombies 4K Ultra HD / Blu ray Brand New ,10.8,2020-07-23 00:00:00
"Pride and Prejudice: New Edition by Austen, Jane",4.14,2020-07-23 00:00:00
"Pride and Prejudice (DVD, 2004) BBC ",11.0,2020-07-23 00:00:00
Pride and Prejudice,5.89,2020-07-23 00:00:00
Pride and Prejudice Mini-Series DVD 2001 2-Disc Set Special Edition New,19.96,2020-07-23 00:00:00
Pride and Prejudice [Special Edition],5.69,2020-07-23 00:00:00
Funko Pop Pride & Prejudice & Zombies Jane Bennet # 267,17.63,2020-07-23 00:00:00
True Vintage Jane Austen PB Pride And Prejudice Complete And Unabridged 1960,12.94,2020-07-23 00:00:00
"Pride and Prejudice (Mini-Series) (DVD, 2001, 2-Disc Set, Special Edition Wides…",19.99,2020-07-23 00:00:00
PRIDE AND PREJUDICE Greer Garson Blu-ray New Warner Archive Laurence Olivier,18.0,2020-07-23 00:00:00
Pride & Prejudice by Jane Austen -Odhams Press VINTAGE UNDATED,44.6,2020-07-23 00:00:00
"Orgullo y prejuicio / Pride and Prejudice, Hardcover by Austen, Jane; Adillon...",18.12,2020-07-23 00:00:00
"Olympic Pride, American Prejudice...HARDCOVER 2020 Deborah Riley",25.64,2020-07-23 00:00:00
Pride and Prejudice Lit for Little Hands Board Book,9.0,2020-07-23 00:00:00
JANE AUSTEN'S PRIDE AND PREJUDICE HARDCOVER BY Austen,23.64,2020-07-23 00:00:00
Pride and Prejudice by Jane Austen PAPERBACK 2002,13.64,2020-07-23 00:00:00
Pride & Prejudice Jane Austin Barnes & Noble 2015 Beautiful Cover!,17.99,2020-07-23 00:00:00
The Ladies of Longbourn: The acclaimed Pride and Prejudice sequel series (The P,6.98,2020-07-23 00:00:00
"Pride & Prejudice [Blu-ray/DVD Combo + Digital Copy] by Knightley, Keira, Macfa",13.98,2020-07-23 00:00:00
"Pride and Prejudice (DVD, 2006) *DISC ONLY*",2.95,2020-07-23 00:00:00
Lot of 5 Jane Austen Related Books Mr Darcy Takes a Wife Dearest Cousin Jane etc,20.0,2020-07-23 00:00:00
"Pride and Prejudice (DVD, 2010, 2-Disc Set)",22.63,2020-07-23 00:00:00
Jane Austen BBC Miniseries Lot - Pride and Prejudice Persuasion Sens Sensibility,19.99,2020-07-23 00:00:00
Pride and Prejudice: [Penguin Classics Deluxe Edition],4.04,2020-07-23 00:00:00
"Properly Humbled : A Pride and Prejudice Novel by April Floyd (2017, Paperback)",14.76,2020-07-23 00:00:00
Keira Knightley Pride and Prejudice Autographed Signed 8x10 Photo COA 2019-1,64.99,2020-07-23 00:00:00
AN ASSEMBLY SUCH AS THIS by Pamela Aidan FREE SHIPPING paperback book Mr. Darcy,7.39,2020-07-23 00:00:00
World War Z: An Oral History of the Zombie War & Pride and Prejudice and Zombies,11.99,2020-07-23 00:00:00
Pride & Prejudice Deluxe 2-Disc DVD Gift Set (2005) Issued 2007 Sealed,24.53,2020-07-22 00:00:00
Jane Austen PRIDE AND PREJUDICE Isabel Bishop E. P. Dutton 1976 in Slipcase,45.34,2020-07-22 00:00:00
"Pride and Prejudice - The Special Edition (A&E Miniseries) Colin Firth, Ehle",8.8,2020-07-22 00:00:00
Pride and Prejudice [Modern Library Classics],4.04,2020-07-22 00:00:00
The Annotated Pride and Prejudice : A Revised and Expanded Edition Jane Austen,11.95,2020-07-22 00:00:00
Pride and Prejudice BBC A&E DVD - Colin Firth - Jennifer Ehle - Mini-series 1995,22.84,2020-07-22 00:00:00
"Pride and Prejudice (A&E, 1996) DVD, Anna Chancellor, Lucy Briers, Polly Maberly",4.9,2020-07-22 00:00:00
Pride & Prejudice - DVD,7.99,2020-07-22 00:00:00
PRIDE AND PREJUDICE Special Edition 2 Volume DVD Set A&E Mini Series Colin Firth,27.99,2020-07-22 00:00:00
Pride And Prejudice And Zombies Graphic Novel TPB Jane Austen Seth Grahame-Smith,5.99,2020-07-22 00:00:00
PRIDE AND PREJUDICE (2005)~BRAND NEW/SEALED DVD~WIDESCREEN~KEIRA KNIGHTLEY,5.99,2020-07-22 00:00:00
The Houseguest A Pride and Prejudice Vagary,8.24,2020-07-22 00:00:00
"Dover Thrift Editions: Pride and Prejudice by Jane Austen (1995, Paperback,...",6.58,2020-07-22 00:00:00
"Pride and Prejudice (DVD, 2006, Full Screen) WORLD SHIP AVAIL",4.98,2020-07-22 00:00:00
Modern Library Classics Ser.: Pride and Prejudice by Jane Austen and F....,6.97,2020-07-22 00:00:00
"orp-07620 1940 orig photo Edmund Gwenn, Greer Garson film Pride and Prejudice or",16.98,2020-07-22 00:00:00
Pride & and Prejudice Sheet Music Piano Play-Along Book and Audio NEW 000311862,15.39,2020-07-22 00:00:00
"Pride and Prejudice (Mini-Series) (DVD, 2001, 2-Disc Set, Special Edition...",11.98,2020-07-22 00:00:00
"Pride and Prejudice [Bantam Classics] , Austen, Jane",4.34,2020-07-22 00:00:00
The Other Bennet Sister~Janice Hadlow~UK edition~Mary~Pride Prejudice~PB VG,15.84,2020-07-22 00:00:00
Pride and Prejudice [Penguin Clothbound Classics],12.99,2020-07-22 00:00:00
"Pride and Prejudice (World's Classics) by Austen, Jane",3.99,2020-07-22 00:00:00
Pride and Prejudice (Norton Critical Editions) - Paperback - VERY GOOD,4.09,2020-07-22 00:00:00
"Pride and Prejudice [Barnes & Noble Classics] , Austen, Jane",3.99,2020-07-21 00:00:00
Pride and Prejudice (Barnes & Noble Signature Edition) (Barnes & Noble...,4.09,2020-07-21 00:00:00
Pride and Prejudice (Dover Large Print Classics) - Paperback - GOOD,20.95,2020-07-21 00:00:00
Pride & Prejudice [Deluxe 2-Disc DVD Gift Set],12.96,2020-07-21 00:00:00
Pride and Prejudice [Restored Edition],6.48,2020-07-21 00:00:00
Pride and Prejudice: (Penguin Classics Deluxe Edition) - Paperback - VERY GOOD,5.4,2020-07-21 00:00:00
Pride and Prejudice : Lit for Little Hands by Jane Austen,8.59,2020-07-21 00:00:00
B004IZZNKA Pride and Prejudice (Bantam Classics) [Mass Market Paperback],3.95,2020-07-21 00:00:00
Pride & Prejudice (2005) DVD Joe Wright(DIR) 2005,4.09,2020-07-21 00:00:00
PRIDE AND PREJUDICE Greer Garson Blu-ray New Warner Archive Laurence Olivier,15.99,2020-07-21 00:00:00
HALLMARK HOLIDAY COLLECTION PRIDE PREJUDICE AND MISTLETOE NEW DVD,13.79,2020-07-21 00:00:00
Jane Austen Seven Novels 2007 Barnes And Noble Pride And Prejudice Emma...,16.92,2020-07-21 00:00:00
Pride + Prejudice + Zombies [Blu-ray],6.51,2020-07-21 00:00:00
"Easton Press - Complete Novels Of Jane Austen 6 Book Set - Pride & Prejudice,...",713.0,2020-07-21 00:00:00
Pride and Prejudice [Special Edition],5.98,2020-07-21 00:00:00
Pride and Prejudice [Special Edition],5.83,2020-07-21 00:00:00
"Pride and Prejudice, Sense And Sensibility, Wuthering Heights - 3 DVD Lot!!",13.79,2020-07-21 00:00:00
Franklin Library Pride and Prejudice Jane Austen Hardcover Book,22.95,2020-07-21 00:00:00
"Pride and Prejudice by Jane Austen (2016, Paperback)",18.63,2020-07-21 00:00:00
"Pride and Prejudice : Chiltern Edition, Hardcover by Austen, Jane, Like New U...",21.85,2020-07-21 00:00:00
"Pride & Prejudice by Jane Austen Unabridged, 10-CD Set Audio Book PDQ Audio Book",31.91,2020-07-21 00:00:00
The Complete Novels of Jane Austen Pride Prejudice Emma Northanger Abbey Sense,41.98,2020-07-21 00:00:00
"Jane Austen's Pride and Prejudice (A&E, 1996) DVD - 200th Anniversary Edition",28.32,2020-07-21 00:00:00
Pride and Prejudice an annotated edition by Jane Austen hardcover Excellent,23.0,2020-07-21 00:00:00
Antique 1893 Pride and Prejudice Jane Austen Vol. 1 and 2 Hardcover Books,314.9,2020-07-21 00:00:00
"Pride & Prejudice Premiere HC (Marvel Classics) by Butler, Nancy Hardback Book",25.04,2020-07-21 00:00:00
"Pride and Prejudice (The Peacock Edition, Revived)",23.78,2020-07-21 00:00:00
"Pride & Prejudice (Bluray, 2005) [BUY 2 GET 1]",8.99,2020-07-20 00:00:00
Pride and Prejudice [Special Edition],5.59,2020-07-20 00:00:00
Bantam Classics: Pride and Prejudice and Jane Eyre by Austen and Bronte ©1981,8.63,2020-07-20 00:00:00
Pride and Prejudice DVD 2006 Full Screen New Sealed DVD Keira Knightley NEW,9.8,2020-07-20 00:00:00
"Pride & Prejudice : Music from the Motion Picture Soundtrack: Piano Solo, Pap...",15.32,2020-07-20 00:00:00
Marrying Mr. Darcy: The Pride and Prejudice Card Game,26.38,2020-07-20 00:00:00
"Pride and Prejudice - The Special Edition (A&E Miniseries) by Colin Firth, Jenn",6.99,2020-07-20 00:00:00
PRIDE AND PREJUDICE The Miniseries Keepsake Edition A&E BBC 2-Disc DVD SET NEW,53.2,2020-07-20 00:00:00
"Pride and Prejudice (DVD, 1995 Mini-Series) A&E BBC + Slip Case! Colin Firth",6.98,2020-07-20 00:00:00
"Pride and Prejudice [10th Anniversary Collector's Set] [A&E, 1996]",8.81,2020-07-20 00:00:00
"Greer garson ""pride and prejudice"" (pride and prejudice) photo ep",37.85,2020-07-20 00:00:00
GREER GARSON MAUREEN O'SULLIVAN ORIG PRIDE AND PREJUDICE MGM FILM STILL,20.38,2020-07-20 00:00:00
Matt Smith Doctor Who Signed Funko Parson Collins Auto Pride Prejudice zombies,94.98,2020-07-20 00:00:00
Pride & Prejudice [Blu-ray],7.43,2020-07-20 00:00:00
Pride and Prejudice,12.88,2020-07-20 00:00:00
"Pride and Prejudice Blu-ray, 2 Disc Keepsake Edition Colin Firth New Sealed",32.79,2020-07-20 00:00:00
Pride and Prejudice-Jane Austin(Barnes & Noble Classics)FREE FAST US SHIPPING,12.0,2020-07-20 00:00:00
Pride and Prejudice [Special Edition],5.68,2020-07-20 00:00:00
Pride + Prejudice + Zombies,6.82,2020-07-20 00:00:00
"PRIDE, PREJUDICE AND MISTLETOE DVD - SINGLE DISC EDITION - SEALED- HALLMARK",12.79,2020-07-20 00:00:00
"Pride and Prejudice (Mini-Series) (DVD, 2001, 2-Disc Set, Special Edition...",14.8,2020-07-19 00:00:00
Pride and Prejudice [Special Edition],5.73,2020-07-19 00:00:00
VARIOS-OST-VARIOS:PRIDE AND PREJUDICE OST NEW VINYL,24.93,2020-07-19 00:00:00
Pride + Prejudice + Zombies [Blu-ray],4.96,2020-07-19 00:00:00
Pride and Prejudice Jane Austen Fine Editions Press 1946,19.99,2020-07-19 00:00:00
Pride and Prejudice [Special Edition],5.79,2020-07-19 00:00:00
Pride + Prejudice + Zombies (DVD),6.74,2020-07-19 00:00:00
PRIDE AND PREJUDICE by Jane Austen 1950 Harper's Modern Classics L. Kronenberger,39.99,2020-07-19 00:00:00
"PRIDE, PREJUDICE AND MISTLETOE DVD - SINGLE DISC EDITION - NEW - HALLMARK ",13.99,2020-07-19 00:00:00
Pride and Prejudice [Special Edition],4.79,2020-07-19 00:00:00
"Pride and Prejudice by Jane Austen Franklin Library (decorative hardcover,G)",12.93,2020-07-19 00:00:00
Pride And Prejudice Music From The Motion Picture Soundtrack Piano Solo,12.26,2020-07-19 00:00:00
PRIDE and PREJUDICE ~1977 Easton Press GREATEST BOOKS EVER WRITTEN Jane Austen,41.38,2020-07-19 00:00:00
"Pride & Prejudice: Keepsake Edition dvd Colin firth , Jennifer Ehle ",24.99,2020-07-19 00:00:00
Pride & Prejudice & Zombies Mrs. Featherstone Funko Pop Figure 271 t2991,10.94,2020-07-19 00:00:00
"Pride and Prejudice DVD (Special Edition) Very Good, Free Shipping.",12.87,2020-07-19 00:00:00
Pride and Prejudice [Special Edition],5.74,2020-07-19 00:00:00
"Pride and Prejudice (Mini-Series) (DVD, 2001, 2-Disc Set, Special Edition.B544",9.99,2020-07-19 00:00:00
"Pride and Prejudice (Mini-Series) (DVD, 2001, 2-Disc Set, Special Edition) MINT ",19.8,2020-07-19 00:00:00
Penguin English Library Pride and Prejudice  The Penguin English Libr,9.22,2020-07-19 00:00:00
Easton Press PRIDE & PREJUDICE Jane Austen 1977 LEATHER 1ST Collector's Ed MINT,106.42,2020-07-19 00:00:00
"Pride and Prejudice (Modern Library Classics) by Austen, Jane",3.99,2020-07-19 00:00:00
1902 PRIDE AND PREJUDICE Love story ART romance NOVEL Emma movie JANE AUSTEN vtg,427.38,2020-07-19 00:00:00
Pride & Prejudice CD Soundtrack Dario Marianelli Jean-Yves Thibaudet,14.99,2020-07-19 00:00:00
Pride and Prejudice ~ JANE AUSTEN 1894 Hugh Thomson Peacock Edition ~ First Thus,2500.0,2020-07-19 00:00:00
"Favorite Jane Austen Novels: Pride and Prejudice, Sense and Sensibility and Pers",5.86,2020-07-19 00:00:00
"Pride and Prejudice (DVD, 2006) Keira Knightley HISTORICAL ROMANCE DRAMA!!",7.55,2020-07-19 00:00:00
"Pride and Prejudice themed playing cards, full deck, 54 poker-size card deck",22.89,2020-07-18 00:00:00
NEW SEALED Pride & Prejudice by Jane Austen Cloth Bound Hardcover Hardback,24.95,2020-07-18 00:00:00
DEATH COMES TO PEMBERLEY - P.D. JAMES SEQUEL TO PRIDE & PREJUDICE - NEW ,40.84,2020-07-18 00:00:00
PRIDE AND PREJUDICE AND ZOMBIES AND ABE LINCOLN VAMPIRE HUNTER TPBs,7.0,2020-07-18 00:00:00
"Classics Library: Pride and Prejudice by Jane Austen (1992, Paperback)",7.8,2020-07-18 00:00:00
Pride and Prejudice Brand NEW Sealed DVD Keira Knightley,5.98,2020-07-18 00:00:00
PRIDE AND PREJUDICE -KEIRA KNIGHTLEY DVD-*DISC ONLY* WITH TRACKING,2.94,2020-07-18 00:00:00
"PRIDE AND PREJUDICE, by JANE AUSTEN Miniature Book Dollhouse 1:12 Scale Readable",11.65,2020-07-18 00:00:00
"Pride and Prejudice (DVD, 2006)",3.26,2020-07-18 00:00:00
"Pop Funko Jane Bennet Pride, Prejudice & Zombies",15.0,2020-07-18 00:00:00
Pride And Prejudice And Zombies  4K UltraHD + Blu Ray (Region Free),24.95,2020-07-18 00:00:00
"Pride and Prejudice NEW SEALED 2 DVD Gift Box Set, Keira Knightley, Jena Malone",24.0,2020-07-18 00:00:00
"Pride and Prejudice (Collector's Library) by Austen, Jane Hardback Book The Fast",9.88,2020-07-18 00:00:00
"Colin Firth, Jennifer Ehle-Pride and Prejudice (UK IMPORT) DVD [REGION 2] NEW",11.77,2020-07-18 00:00:00
Pride and Prejudice (Norton Critical Editions) by Jane Austen,3.99,2020-07-18 00:00:00
Pride & Prejudice: Keepsake Edition/,11.02,2020-07-18 00:00:00
3 Great Illustrated Classic HC Book Lot Pride/Prejudice+Little Women+Rebecca ,10.88,2020-07-18 00:00:00
Pride and Prejudice VHS Video Tape Movie,11.55,2020-07-18 00:00:00
2014- Pride and Prejudice by Jane Austen Penguin Classics 1813 Classic Book,5.83,2020-07-18 00:00:00
PRIDE AND PREJUDICE BY JANE AUSTEN CENTURY HUTCHINSON ILLUSTRATED DATED 1985,53.78,2020-07-18 00:00:00
Pride Prejudice and Zombies (4K Ultra HD and Blu-ray) Lily James - No Digital,9.0,2020-07-18 00:00:00
"Orgullo Y Prejuicio/ Pride And Prejudice, Paperback by Austen, Jane, Like New...",10.35,2020-07-18 00:00:00
"Pride and Prejudice (The Penguin English Library) by Austen, Jane",3.99,2020-07-18 00:00:00
Pop! Vinyl--Pride and Prejudice and Zombies - Mr Darcy Pop! Vinyl,46.62,2020-07-18 00:00:00
Pride and Prejudice and Zombies (DVD) Brand New! Lena Headey | Lily James,6.98,2020-07-18 00:00:00
Pride and Prejudice [Special Edition],7.0,2020-07-17 00:00:00
Pride & Prejudice Sampler cross stitch chart ,2.87,2020-07-17 00:00:00
PRIDE & PREJUDICE 10th Anniversary Limited Edition-COLIN FIRTH is Mr Darcy,17.77,2020-07-17 00:00:00
Pride and Prejudice and Zombies: Dawn of the Dreadfuls (Pride and Prej. and,8.93,2020-07-17 00:00:00
"Emma DVD Jane Austens - Kate Beckinsale "" Producer of Pride and Prejudice "" ",38.69,2020-07-17 00:00:00
Pride and Prejudice (Mini-Series) (Blu-ray) LIKE NEW DISCS AND CASE,15.0,2020-07-17 00:00:00
Jane Austen's Pride and Prejudice by Jane Austen Book The Fast Free Shipping,7.18,2020-07-17 00:00:00
