title,price,date
The Metamorphosis by Franz Kafka,4.14,2020-08-14 00:00:00
Metamorphosis - Rolling Stones The CD Sealed ! New !,9.69,2020-08-14 00:00:00
The Metamorphosis (Bantam Classics) - Mass Market Paperback - GOOD,3.54,2020-08-14 00:00:00
The Metamorphosis (Bantam Classics) by Franz Kafka ,4.49,2020-08-13 00:00:00
NEW The Metamorphosis and Other Stories by Franz Kafka Bonded Leather Softcover,29.95,2020-08-13 00:00:00
"The Metamorphosis, In The Penal Colony, and Other Stories",4.8,2020-08-13 00:00:00
The Metamorphosis: A New Translation by Susan Bernofsky,8.0,2020-08-13 00:00:00
The Metamorphosis of Plants (MIT Press) by Johann Wolfgang von Goethe,22.63,2020-08-13 00:00:00
Selected Short Stories of Franz Kafka HC 1952 The Metamorphosis Modern Library P,43.99,2020-08-13 00:00:00
The Path of Metamorphosis Mixed 3rd Edition/Sabbat War V:TES VTES,7.0,2020-08-13 00:00:00
The Metamorphosis: A New Translation by Susan Bernofsky,7.19,2020-08-12 00:00:00
"Bantam Classics: The Metamorphosis by Franz Kafka (1972, Paperback)",4.79,2020-08-12 00:00:00
The Metamorphosis: And Other Stories [The Schocken Kafka Library],5.76,2020-08-12 00:00:00
Metamorphosis of the Nude Metal Abstract Indoor/Outdoor Sculpture by TIHANY,153.0,2020-08-12 00:00:00
The Metamorphosis-Pumpinhead  Vinyl Model Kit 1/6th scale -Geometric,155.39,2020-08-12 00:00:00
"The Metamorphosis: A New Translation by Susan Bernofsky Kafka, Franz",10.88,2020-08-11 00:00:00
The Metamorphosis and Other Stories (Dover Thrift Editions) - VERY GOOD,3.6,2020-08-11 00:00:00
The Metamorphosis (Bantam Classics) - Mass Market Paperback - ACCEPTABLE,3.54,2020-08-11 00:00:00
"Lot of 3 Franz Kafka Books (Metamorphosis, The Trial, A Hunger Artist) Oxford ",15.85,2020-08-11 00:00:00
The Metamorphosis and Other Stories,4.09,2020-08-10 00:00:00
The Essential Kafka: The Castle; The Trial; Metamorphosis and Other Stories by F,9.29,2020-08-10 00:00:00
The Essential Kafka: The Castle; The Trial; Metamorphosis and Other Stories (Pap,7.79,2020-08-09 00:00:00
The Metamorphosis Melody CD+ DVD MIDNATTSOL ( FREE SHIPPING),10.1,2020-08-09 00:00:00
Janet Jackson Metamorphosis The Las Vegas Residency 2019 New T Shirt Reprint1,30.0,2020-08-09 00:00:00
MAGENTA The Metamorphosis Collection 5.1 Surround Sound FEMME VOX NEO PROG ROCK,19.0,2020-08-08 00:00:00
Franz Kafka : The Metamorphosis (Bantam Classics),3.6,2020-08-08 00:00:00
METAMORPHOSIS - THE ALIEN FACTOR NEW DVD,11.37,2020-08-08 00:00:00
"The Metamorphosis and Other Stories [Dover Thrift Editions] , Franz Kafka",3.99,2020-08-07 00:00:00
CD Lot BRUTALITY Metamorphosis/Dimension Demented + Archives Vol. 1 the DEMOS,16.94,2020-08-07 00:00:00
"Star Trek The Next Generation: Metamorphosis by Jean Lorrah (1990, Paperback)",6.19,2020-08-07 00:00:00
The Metamorphosis and other stories by Franz Kafka ,6.83,2020-08-07 00:00:00
The Metamorphosis by Franz Kafka Paperback ,7.67,2020-08-07 00:00:00
"Rolling Stones, The - Metamorphosis [VINYL LP]",54.85,2020-08-07 00:00:00
"The Metamorphosis , Kafka, Franz",4.17,2020-08-06 00:00:00
The Metamorphosis and Other Stories by Franz Kafka; Donna Freed,4.09,2020-08-06 00:00:00
Tracy Anderson Metamorphos Hipcentric 4 DVD Set and The Method for Beginners DVD,70.9,2020-08-05 00:00:00
The Metamorphosis: And Other Stories [The Schocken Kafka Library],4.62,2020-08-05 00:00:00
midnattsol - the metamorphosis melody,10.99,2020-08-05 00:00:00
The Metamorphosis by Franz Kafka's Vintage 1970s Bantam Paperback No. YM6954,9.98,2020-08-05 00:00:00
"ANDOVER ""THE VERY HUNGRY CATERPILLAR"" METAMORPHOSIS PANEL Multi by the panel",13.1,2020-08-04 00:00:00
"The Metamorphosis [Bantam Classics] , Franz Kafka",4.1,2020-08-04 00:00:00
The Transfiguration or Metamorphosis of Christ Greek Orthodox Icon 14x20cm,27.49,2020-08-04 00:00:00
"Metamorphosis - The Alien Factor (DVD, 2003)",6.86,2020-08-03 00:00:00
"The Metamorphosis [Bantam Classics] , Franz Kafka",3.99,2020-08-03 00:00:00
"Metamorphosis [Remaster] by The Rolling Stones (CD, Aug-2002, ABKCO Records)",6.33,2020-08-03 00:00:00
The Metamorphosis - Paperback By Franz Kafka - VERY GOOD,3.99,2020-08-03 00:00:00
Lemon Juice: The Confessions of a Used Car Dealer - a Metamorphosis (Paperback o,24.61,2020-08-02 00:00:00
Master Pieces Glow in the Dark Metamorphosis Butterfly 500 pc Jigsaw Puzzle NEW,29.95,2020-08-01 00:00:00
"The Metamorphosis and Other Stories, Franz Kafka",7.79,2020-08-01 00:00:00
The Metamorphosis by Franz Kafka Paperback 1972 Very Good,8.79,2020-07-31 00:00:00
"Lift-the-Flap: Metamorphosis : Animals That Change by Luise Woelflein (1995, ...",3.58,2020-07-31 00:00:00
[ROCK/POP]~EXC LP~The ROLLING STONES~Metamorphosis~[OG 1975~ABKO/LONDON~COMP]~,5.0,2020-07-31 00:00:00
The Metamorphosis by Franz Kafka,4.09,2020-07-31 00:00:00
Chrysalis : Maria Sibylla Merian and the Secrets of Metamorphosis by Kim Todd...,12.74,2020-07-31 00:00:00
IN THE DARK BODY OF METAMORPHOSIS & Other Poems by Mario Luzi trans Salomon ftpb,7.0,2020-07-30 00:00:00
Chrysalis: Maria Sibylla Merian and the Secrets of Metamorphosis,1.45,2020-07-30 00:00:00
"SALVADOR DALI Poster or Canvas Print ""The Metamorphosis of Narcissus"" Surrealism",49.98,2020-07-30 00:00:00
The Metamorphosis [First Edition] [Norton Critical Editions],7.04,2020-07-30 00:00:00
The Metamorphosis,5.99,2020-07-30 00:00:00
The Metamorphosis and Other Stories [Dover Thrift Editions] by Franz Kafka (PB),3.5,2020-07-28 00:00:00
The Price Graphic Novel GN Comic Eclipse 1981 Metamorphosis Odyssey Jim Starlin,12.97,2020-07-28 00:00:00
2 x The Path of Metamorphosis VTES CCG Mixed,5.0,2020-07-27 00:00:00
The Metamorphosis By Franz Kafka,7.8,2020-07-27 00:00:00
"NEW The Metamorphosis (Pulp! The Classics) 9781843444619 by Kafka, Franz",7.97,2020-07-27 00:00:00
THE ROLLING STONES - METAMORPHOSIS LP / UK 1ST PRESS STEREO DECCA SKL 5212 2W 2W,78.62,2020-07-27 00:00:00
Felix The Cat Chevrolet Metamorphosis Men T-Shirt,29.45,2020-07-26 00:00:00
Metamorphosis - Star Trek: The Next Generation - Jean Lorrah - PB - 1990.,5.77,2020-07-26 00:00:00
"The Metamorphosis , Franz Kafka",3.99,2020-07-26 00:00:00
The Metamorphosis of the Gods by Andre Malraux First Edition HC 1960,14.28,2020-07-25 00:00:00
"Franz Kafka Books (Metamorphosis, The Trial)",16.99,2020-07-25 00:00:00
Symphonic Metamorphosis - Let The Light So Shine 45 London pysch promo ,8.0,2020-07-25 00:00:00
"The Metamorphosis of Prime Intellect by Williams, Roger",7.48,2020-07-24 00:00:00
THE ROLLING STONES - METAMORPHOSIS NEW VINYL RECORD,21.15,2020-07-24 00:00:00
Dover Thrift Editions Ser.: The Metamorphosis and Other Stories by Franz...,3.95,2020-07-24 00:00:00
metamorphosis The Alien Factor vhs tape  VERY RARE OOP  HTF,14.0,2020-07-24 00:00:00
The Metamorphosis (Turtleback School &amp; Library Bin,8.28,2020-07-24 00:00:00
"The Metamorphosis (Norton Critical Editions) - Paperback By Kafka, Franz - GOOD",8.31,2020-07-23 00:00:00
"The Metamorphosis, In The Penal Colony, and Other ",4.89,2020-07-22 00:00:00
"The Metamorphosis by Kafka, Franz",11.52,2020-07-22 00:00:00
"Metamorphosis, The Rolling Stones, Acceptable Original recording remastered",9.25,2020-07-22 00:00:00
The Rolling Stones ‎- Metamorphosis LP - SEALED Vinyl Album DSD Remaster Record,30.98,2020-07-21 00:00:00
The Metamorphosis,6.0,2020-07-21 00:00:00
The Metamorphosis (Chump Change Edition) by Franz Kafka: New,14.95,2020-07-21 00:00:00
3 FRANZ KAFKA # HC THE TRIAL THE CASTLE THE METAMORPHOSIS,10.99,2020-07-20 00:00:00
"Enriched Classics Ser.: The Metamorphosis by Franz Kafka (2009, Mass Market,...",5.43,2020-07-20 00:00:00
The Metamorphosis by Franz Kafka,5.15,2020-07-20 00:00:00
"Lavinia Meijer - Philip Glass: Metamorphosis and The Hours (SACD,",19.02,2020-07-19 00:00:00
Metamorphosis & Other Stories - Kafka - The Folio Society 2010,104.91,2020-07-19 00:00:00
The Rolling Stones  Metamorphosis ,12.58,2020-07-19 00:00:00
The Metamorphosis: A New Translation by Susan Bernofsky,5.5,2020-07-19 00:00:00
The Metamorphosis and Other Stories by Franz Kafka Hardcover,15.75,2020-07-18 00:00:00
The Metamorphosis and Other Stories (Dover Thrift Editions) - ACCEPTABLE,3.58,2020-07-18 00:00:00
"The Metamorphosis by Kafka, Franz",3.99,2020-07-17 00:00:00
CD Lot BRUTALITY Metamorphosis/Dimension Demented + Archives Vol. 1 the DEMOS,16.94,2020-07-16 00:00:00
The Metamorphosis (First Edition) (Norton Critical Editions),7.79,2020-07-16 00:00:00
"The Sorcerer: Metamorphosis, Book 2 [The Camulod Chronicles, Book 6] , Whyte, Ja",5.51,2020-07-15 00:00:00
[P.D.F] The Metamorphosis of Plants (The MIT Press),3.95,2020-07-15 00:00:00
ISBN 978812985146 The Metamorphosis Franz Kafka ,6.86,2020-07-15 00:00:00
Metamorphosis ((The First Giant Novel) (Star Trek:The Next Generation)),3.6,2020-07-15 00:00:00
The Metamorphosis and other stories by Franz Kafka ,4.49,2020-07-14 00:00:00
MIDNATTSOL-THE METAMORPHOSIS MELODY-LIMITED EDITION CD + DVD DIGIPAK-2011,16.85,2020-07-14 00:00:00
Metamorphosis Arabian Nights NM Green Common MAGIC THE GATHERING CARD ABUGames,4.19,2020-07-14 00:00:00
The Metamorphosis Franz Kafka Hardcover Book School Discard Yellow Cover,6.32,2020-07-13 00:00:00
"The Metamorphosis and other stories - Paperback By KAFKA, Franz - GOOD",4.39,2020-07-12 00:00:00
The Rolling Stones - Metamorphosis - SACD Super Audio CD Hybrid DSD Stereo,19.99,2020-07-12 00:00:00
JEFFERSON STARSHIP Metamorphosis Of The Octopus ORIGINAL 1975 Promo Poster Ad,15.94,2020-07-11 00:00:00
The Metamorphosis (Bantam Classic) by Franz Kafka ,4.49,2020-07-11 00:00:00
"Bantam Classics: The Metamorphosis by Franz Kafka (1972, Paperback)",3.98,2020-07-11 00:00:00
The Rolling Stones LP Metamorphosis By 5 Musicians In The Band,264.9,2020-07-11 00:00:00
The Metamorphosis by Franz Kafka,5.1,2020-07-10 00:00:00
The Metamorphosis: And Other Stories (Unabridged Classics in Audio Book) (s47),6.99,2020-07-09 00:00:00
Metamorphosis LP by The Rolling Stones vinyl 1975 VG+ ANA-1 ABKCO,10.99,2020-07-08 00:00:00
The Metamorphosis by Franz Kafka; Susan Bernofsky; Mark M. Anderson,7.77,2020-07-08 00:00:00
"Modern Library Classics Ser.: The Metamorphosis by Franz Kafka (2013, Trade...",6.8,2020-07-07 00:00:00
DEL PRADO MINIATURE LIBRARY BOOK CLASSICS - THE METAMORPHOSIS - FRANZ KAFKA,26.21,2020-07-07 00:00:00
"Star Trek Cards Lot of 3 Uhura, Piece Of The Action & Metamorphosis 1991",3.84,2020-07-06 00:00:00
The Metamorphosis and Other Stories [Barnes & Noble Flexibound Classics],12.86,2020-07-06 00:00:00
Metamorphosis The Alien Factor VHS! 1993 Sci-Fi Hybrid Thriller! Critters Alien,20.29,2020-07-06 00:00:00
The Rolling Stones Metamorphosis LP Vinyl,13.32,2020-07-06 00:00:00
The Rolling Stones : Metamorphosis CD (2006) Incredible Value and Free Shipping!,15.39,2020-07-06 00:00:00
The Rolling Stones Metamorphosis Original Vinyl Record LP N-814,11.33,2020-07-05 00:00:00
“METAMORPHOSIS” Glow in the Dark Hidden Images 500 Piece Puzzle Butterflies,15.75,2020-07-05 00:00:00
Magic the Gathering MTG: Metamorphosis x 4   LP/NM,2.0,2020-07-04 00:00:00
1st Pressing -  The Rolling Stones ‎– Metamorphosis - Decca ‎– SKL.5212 ,24.05,2020-07-04 00:00:00
"The Metamorphosis by Kafka, Franz",7.79,2020-07-03 00:00:00
The Berlin Trilogy - Berlin History Metamorphosis Airlift Journey 3 DVD New Open,17.79,2020-07-02 00:00:00
Penguin Classics Deluxe Edition Ser.: The Metamorphosis and Other Stories by...,5.83,2020-07-01 00:00:00
The Metamorphosis [Pulp! The Classics],4.98,2020-06-30 00:00:00
"NEW The Metamorphosis (Pulp! The Classics) 9781843444619 by Kafka, Franz",7.97,2020-06-30 00:00:00
CD Lot BRUTALITY Metamorphosis/Dimension Demented + Archives Vol. 1 the DEMOS,16.94,2020-06-30 00:00:00
"The Metamorphosis - Franz Kafka - Bantam, 1972    B3",5.0,2020-06-29 00:00:00
1ST THUS Franz Kafka THE METAMORPHOSIS AND OTHER STORIES,13.86,2020-06-29 00:00:00
Metamorphosis and The Trial by Franz Kafka - unabridged audiobook mp3 CD,17.95,2020-06-29 00:00:00
The Metamorphosis and Other Stories (Dover Thrift Editions) by Franz Kafka,3.99,2020-06-29 00:00:00
The Metamorphosis-Pumpinhead  Vinyl Model Kit 1/6th scale -Geometric,110.0,2020-06-28 00:00:00
CD THE ROLLING STONES METAMORPHOSIS 2002 DSD REMASTERED BRAND NEW SEALED,11.55,2020-06-28 00:00:00
The Metamorphosis and Other Stories by Franz Kafka,4.14,2020-06-28 00:00:00
The Metamorphosis,3.49,2020-06-26 00:00:00
Metamorphosis The Alien Factor VHS tape  VERY RARE OOP ,20.98,2020-06-24 00:00:00
The Metamorphosis: And Other Stories [The Schocken Kafka Library],4.45,2020-06-24 00:00:00
"The Metamorphosis [Bantam Classics] , Franz Kafka",3.99,2020-06-23 00:00:00
The Metamorphosis and Other Stories (Dover Thrift Editions) by Franz Kafka,3.99,2020-06-22 00:00:00
"Metamorphosis, Paperback by Kafka, Franz, Brand New, Free shipping in the US",9.34,2020-06-21 00:00:00
Vtes v: tes - the path of metamorphosis-master/sabbat war,4.44,2020-06-21 00:00:00
The Camulod Chronicles: The Sorcerer Bk. 5 : Metamorphosis Bk. 6 by Jack Whyte …,5.99,2020-06-21 00:00:00
The Metamorphosis: And Other Stories [The Schocken Kafka Library],5.0,2020-06-19 00:00:00
The Metamorphosis and Other Stories (Dover Thrift Editions) by Franz Kafka,3.99,2020-06-19 00:00:00
"The Metamorphosis, in the Penal Colony, and Other Stories by Franz Kafka",4.14,2020-06-19 00:00:00
THE ROLLING STONES - METAMORPHOSIS MEGA RARE Test Pressing LONDON Peter Pan NM-,354.0,2020-06-19 00:00:00
The Rolling Stones Metamorphosis LP VG+   vinyl  ,14.25,2020-06-18 00:00:00
Chrysalis : Maria Sibylla Merian and the Secrets of Metamorphosis by Kim Todd (…,13.98,2020-06-18 00:00:00
Glow in the Dark Jigsaw Puzzle  Metamorphosis NEW,20.99,2020-06-17 00:00:00
MIDNATTSOL - The Metamorphosis Melody Deluxe CD + DVD 2011 Napalm Exc Cond!,19.0,2020-06-17 00:00:00
"LOT of 2 BOOKS by FRANZ KAFKA ""THE TRIAL"" & ""METAMORPHOSIS & OTHER STORIES"" NR!",9.0,2020-06-16 00:00:00
Franz Kafka Lot 3 The Trial The Castle Metamorphosis Penal Colony &other Stories,16.78,2020-06-16 00:00:00
THE ROLLING STONES - 'Metamorphosis' 2002 ABKCO HYBRID DISC CD Album,27.96,2020-06-15 00:00:00
DEL PRADO MINIATURE LIBRARY BOOK CLASSICS - THE METAMORPHOSIS - FRANZ KAFKA,46.42,2020-06-13 00:00:00
"The Metamorphosis [Bantam Classics] , Franz Kafka",3.99,2020-06-12 00:00:00
GEOmetric Designs PUMPKINHEAD:The Metamorphosis 1/6 scale Vinyl model kit Rare!,77.64,2020-06-12 00:00:00
Metamorphosis: The Beauty & Design of Butterflies DVD New/Sealed 2011 Illustra,9.77,2020-06-12 00:00:00
"Bantam Classics: The Metamorphosis by Franz Kafka (1972, Paperback)",6.79,2020-06-12 00:00:00
"The Rolling Stones ‎– Metamorphosis Vinyl, LP ABKCO ‎– ANA1 ",19.0,2020-06-12 00:00:00
 The Metamorphosis by Franz Kafka adapted Peter Kuper PB Book Graphic Novel 2004,13.98,2020-06-11 00:00:00
"Metamorphosis, in the Penal Colony, and Other Stories by Kafka, Franz",3.99,2020-06-11 00:00:00
MasterPieces Glow in The Dark Metamorphosis Butterfly 500 pc Jigsaw Puzzle ,17.78,2020-06-11 00:00:00
NEW - The Metamorphosis (Dover Thrift Study Edition) by Franz Kafka,7.49,2020-06-11 00:00:00
The Schocken Kafka Library: The Metamorphosis and Other Stories by Franz Kafka,3.99,2020-06-09 00:00:00
Metamorphosis by Tracy Anderson Omnicentric 4 DVD Set + The Method for Beginners,20.0,2020-06-07 00:00:00
Master Pieces Puzzles Unicorns Retreat & Metamorphosis Glow in the Dark,45.99,2020-06-07 00:00:00
Star Trek Fotonovels #5 Metamorphosis & #9 The Devil in the Dark,20.8,2020-06-06 00:00:00
Metamorphosis  The Rolling Stones  RE 2003 Lp,51.09,2020-06-06 00:00:00
The Metamorphosis and Other Stories (Dover Thrift Editions) - Paperback - GOOD,3.58,2020-06-06 00:00:00
The Metamorphosis and Other Stories (Dover Thrift Editions) by Franz Kafka. ,4.43,2020-06-05 00:00:00
The Metamorphosis Franz Kafka (Adapted into comic form by Peter Kuper) brand new,5.95,2020-06-05 00:00:00
"The Metamorphosis, the Penal Colony, and Other Stories (Schocken Classics) by F",3.99,2020-06-04 00:00:00
"The Metamorphosis by Susan Bernofsky, Franz Kafka and David Cronenberg (2014,...",11.31,2020-06-04 00:00:00
METAMORPHOSIS THE ALIEN FACTOR VHS TAPE TARA LEIGH TONY GIGANTE VIDMARK ENT.,13.95,2020-06-04 00:00:00
"The  Metamorphosis by Franze Kafka, isbn 0553213695, paperback",4.58,2020-06-03 00:00:00
"Metamorphosis: The Sorcerer, Book 2 (The Camulod Chronicle) by Whyte, Jack",4.09,2020-06-03 00:00:00
Kafka: The Metamorphosis,3.98,2020-06-03 00:00:00
The Metamorphosis by Franz Kafka (English) Hardcover Book Free Shipping!,16.73,2020-06-02 00:00:00
The Metamorphosis by Peter Kuper Graphic Novel Hampton-Brown Comics Book,8.8,2020-06-02 00:00:00
"THE ROLLING STONES - METAMORPHOSIS [REMASTER] [CD/SACD HYBRID, 2002, ABKCO]JAPAN",14.99,2020-06-02 00:00:00
The Metamorphosis by Franz Kafka (Mass Market),9.1,2020-06-02 00:00:00
"Metamorphosis, Paperback by Kafka, Franz, Brand New, Free shipping in the US",10.34,2020-06-02 00:00:00
THE ANDROID UNDERLORDS METAMORPHOSIS ALPHA ROLEPLAYING GAME BOOK BRAND NEW,12.7,2020-06-02 00:00:00
Star Trek The Next Generation. Metamorphosis. Very good,5.99,2020-06-01 00:00:00
METAMORPHOSIS THE ALIEN FACTOR VHS TAPE TARA LEIGH TONY GIGANTE VIDMARK ENT.,13.95,2020-06-01 00:00:00
"The Metamorphosis: By Kafka, Franz",11.87,2020-06-01 00:00:00
"""PUMPKINHEAD"" The Metamorphosis 1/6 scale Vinyl model kit by GEOmetric DESIGNS",149.95,2020-05-31 00:00:00
The Rolling Stones : Metamorphosis CD Highly Rated eBay Seller Great Prices,16.13,2020-05-31 00:00:00
"The Metamorphosis by Susan Bernofsky, Franz Kafka and David Cronenberg (2014,...",8.97,2020-05-31 00:00:00
B000LWWBF4 The Metamorphosis,3.95,2020-05-31 00:00:00
THE ROLLING STONES - METAMORPHOSIS [SHM] NEW CD,34.48,2020-05-30 00:00:00
The Rolling Stones - Metamorphosis - Vinyl Record 1975 LP Abkco Jagger,13.98,2020-05-30 00:00:00
The Metamorphosis By Franz Kafka Book,7.8,2020-05-29 00:00:00
The Metamorphosis Franz Kafka Hardcover Book School Discard,5.12,2020-05-29 00:00:00
The Metamorphosis and Other Stories by Franz Kafka (Schocken Paperback • 2011),8.99,2020-05-29 00:00:00
The Rolling Stones Metamorphosis LP Vinyl,12.79,2020-05-29 00:00:00
"The Metamorphosis and Other Stories by Franz Kafka, CDs, Audio Book",7.0,2020-05-29 00:00:00
The Rolling Stones Metamorphosis LP Vinyl,12.79,2020-05-29 00:00:00
"The Metamorphosis and Other Stories by Franz Kafka, CDs, Audio Book",7.0,2020-05-29 00:00:00
"The Metamorphosis [Bantam Classics] , Franz Kafka",3.99,2020-05-29 00:00:00
"The Sorcerer: Metamorphosis, Book 2 (The Camulod Chronicles, Book 6)",3.99,2020-05-29 00:00:00
"The Metamorphosis, In The Penal Colony, and Other Stories by Kafka, Franz",3.99,2020-05-29 00:00:00
"The Metamorphosis (Bantam Classics) by Franz Kafka, Good Book",4.2,2020-05-28 00:00:00
Hilary Duff Metamorphosis & Eminem The Marshall Mathers LP 2 CD Lot Rap Pop,8.44,2020-05-28 00:00:00
Near Mint Arabian Nights Metamorphosis Magic The Gathering MTG 1993,8.86,2020-05-28 00:00:00
NEW - The Metamorphosis: And Other Stories (The Schocken Kafka Library),12.74,2020-05-28 00:00:00
Dreadstar Vol 1 Metamorphosis Odyssey Vol 2 the Price Jim Starlin SLG TPB set ,45.0,2020-05-27 00:00:00
"The Metamorphosis by Franz Kafka, Translated by David Wyllie. ",4.65,2020-05-27 00:00:00
The Metamorphosis Thrift Study Edition by Franz Kafka,4.14,2020-05-27 00:00:00
"The Metamorphosis by Franz Kafka (2011, Hardcover)",20.55,2020-05-26 00:00:00
THE METAMORPHOSIS - Franz Kafka - 1st Schocken PB printing 1974 bilingual ,22.5,2020-05-26 00:00:00
CD Lot BRUTALITY Metamorphosis/Dimension Demented + Archives Vol. 1 the DEMOS,16.94,2020-05-26 00:00:00
"The Sorcerer: Metamorphosis, Book 2 (The Camulod Chronicles, Book 6) by Whyte, ",4.37,2020-05-25 00:00:00
"The Metamorphosis, the Penal Colony, and Other Stories (Schocken Cl - GOOD",3.99,2020-05-24 00:00:00
The Schocken Kafka Library: The Metamorphosis and Other Stories by Franz Kafka,5.9,2020-05-23 00:00:00
"""Metamorphosis"" Butterflies Glow in the Dark 500 Piece Jigsaw Puzzle & Poster",23.32,2020-05-22 00:00:00
"Metamorphosis : The Fiber Art of Judith Scott by MacGregor, John M.",19.0,2020-05-21 00:00:00
Christianity and Classical Culture: The Metamorphosis of Natural Theology in the,16.17,2020-05-21 00:00:00
Glow in the Dark Jigsaw Puzzle  Metamorphosis NEW,20.5,2020-05-21 00:00:00
"The Rolling Stones – Metamorphosis– CD-UICY93038 – Japan, 2006",24.5,2020-05-21 00:00:00
CD Lot BRUTALITY Metamorphosis/Dimension Demented + Archives Vol. 1 the DEMOS,16.94,2020-05-20 00:00:00
DVD: Test the West! Metamorphosis in East Germany - Rebuilding of a Country,39.95,2020-05-19 00:00:00
The Metamorphosis Franz Kafka Hardcover Book School Discard Yellow Cover,5.82,2020-05-19 00:00:00
The Metamorphosis and other stories by Franz Kafka B&N Edition - HCDJ,5.35,2020-05-19 00:00:00
"Bantam Classics: The Metamorphosis by Franz Kafka (1972, Hardcover)",6.29,2020-05-18 00:00:00
Chrysalis: Maria Sibylla Merian and the Secrets of Metamorphosis,6.98,2020-05-18 00:00:00
"The Rolling Stones 3 SACD CDs England's Newest, Now, Metamorphosis",50.0,2020-05-18 00:00:00
Lot Of 3 Franz Kafka Books: The Complete Stories The Castle The Metamorphosis PB,17.38,2020-05-17 00:00:00
THE ROLLING STONES METAMORPHOSIS LP RECORD,10.99,2020-05-17 00:00:00
