title,price,date
The Scarlet Letter Nathaniel Hawthorne 1887 Edition  Houghton Mifflin & Company,7.33,2020-08-12 00:00:00
The Gardener Pocketbook Kit By The Scarlet Letter,65.0,2020-08-12 00:00:00
The Scarlet Letter Ruth Bacheler 1717 Reproduction Sampler Cross Stitch Pattern,23.69,2020-08-12 00:00:00
"The Scarlet Letter (DVD, 2002)",5.2,2020-08-12 00:00:00
Franklin Library - The Scarlet Letter by Nathaniel Hawthorne - American Lit.,14.69,2020-08-14 00:00:00
"Abeka 11th Grade Speech,Science In Action,The Scarlet Letter 4 Book Bundle ",9.0,2020-08-15 00:00:00
The Scarlet Letter By N. Hawthorne Brand New Leather Bound Collectible Classics,11.33,2020-08-15 00:00:00
The Scarlet Letter by Nathaniel Hawthorne 1984  hardcover no DJ,7.0,2020-08-15 00:00:00
"The Scarlet Letter EN 1657 needlework kit, silk thread on linen",26.3,2020-08-16 00:00:00
"The Scarlet Letter - Nathaniel Hawthorne- Franklin Library, HB 1979 Illustrated.",32.85,2020-08-16 00:00:00
"Hawthorne's Twice-Told Tales & The Scarlet Letter, Salem Editions 1892 & 1893",5.32,2020-08-16 00:00:00
"Nathaniel Hawthorne The Scarlet Letter 1975, Easton Press Collectors Ed Leather ",46.01,2020-08-16 00:00:00
THE SCARLET LETTER MODERN LIBRARY FIRST EDITION 1927 BOOK  NATHANIEL HAWTHORNE,25.32,2020-08-16 00:00:00
"The Scarlet Letter by Hawthorne, Franklin Library 100 Greatest Books NEW Leather",17.45,2020-08-17 00:00:00
Hannah Breed Sampler 1756 The Scarlet Letter Kit  Linen Cross Stitch,33.0,2020-08-19 00:00:00
BJU The Scarlet Letter Teacher’s Edition and book,29.92,2020-08-19 00:00:00
"the Scarlet Letter “Dorothy Walpole” Sampler, Counted Cross-stitch Chart",19.35,2020-08-19 00:00:00
"Dover Thrift Editions: The Scarlet Letter by Nathaniel Hawthorne (1994,...",5.9,2020-08-19 00:00:00
"The Scarlet Letter by Nathaniel Hawthorne (1984, Hardcover)",4.32,2020-08-20 00:00:00
Scarlet Letter “The American Band Sampler 1803” Cross-stitch Chart NIP,18.85,2020-08-21 00:00:00
"The Scarlet Letter ""ABIGAIL BRAGDON"" 1832 Sampler Chart",9.0,2020-08-21 00:00:00
THE SCARLET LETTER 1975 Easton Press Collectors Edition Leather Bound W/ Reciept,31.0,2020-08-22 00:00:00
"The Scarlet Letter by Nathaniel Hawthorne (2015, Paperback)",5.93,2020-08-22 00:00:00
The Scarlet Letter Nathaniel Hawthorne 1858 Second Edition Ticknor & Fields,96.5,2020-08-22 00:00:00
The Scarlet Letter GORGEOUS LARGE Illustrated Vintage Nathaniel Hawthorne,29.39,2020-08-22 00:00:00
Cross Stitch Chart A Flamestitch Sampler The Scarlet Letter NIP!,31.75,2020-08-23 00:00:00
Easton Press~The Scarlet Letter~by Nathaniel Hawthorne~Leather Bound,31.0,2020-08-23 00:00:00
The Scarlet Letter By Nathaniel Hawthorne Folio Society,42.56,2020-08-23 00:00:00
The Scarlet Letter Cross Stitch Kit Mary Gail,41.0,2020-08-23 00:00:00
1893 The Scarlet Letter by HC Hawthorne antique book Salem edition,25.33,2020-08-23 00:00:00
two The Scarlet letter cross stitch charts,30.0,2020-08-23 00:00:00
THE SCARLET LETTER Nathaniel Hawthorne Easton Press Leather,28.95,2020-08-23 00:00:00
"The Ann Thompson linen Sampler kit 1804 by the Scarlet Letter. 19x22"". SCARCE",55.5,2020-08-25 00:00:00
THE FRANKLIN LIBRARY Leather Book THE SCARLET LETTER 1976 NATHANIEL HAWTHORNE ,13.83,2020-08-26 00:00:00
The Scarlet Letter - Barnes and Noble Leather bound Classic Collection,17.45,2020-08-26 00:00:00
The Scarlet Letter Cross Stitch Charts Set Of 7,65.0,2020-08-27 00:00:00
Nathaniel Hawthorne 1887 The Scarlet Letter and The Blithedale Romance Hardcover,13.27,2020-08-28 00:00:00
"The Scarlet Letter by Nathaniel Hawthorne (2002, Trade Paperback, Revised...",4.8,2020-08-28 00:00:00
Bird In Bough Cross Stitch Chart By The Scarlet Letter,15.0,2020-08-29 00:00:00
Antique Book The Scarlet Letter By Nathaniel Hawthorne Hardcover W.B. Conkey Co.,15.8,2020-08-30 00:00:00
The Scarlet Letter by Nathaniel Hawthorne 1963 - Rare Vintage Book,4.32,2020-08-31 00:00:00
"The Scarlet Letter, Abeka ",10.33,2020-09-02 00:00:00
"The Red Pony (Steinbeck,) The Scarlet Letter (Hawthorne,) & Green on Blue",11.98,2020-09-03 00:00:00
The Scarlet Letter (1984),3.25,2020-09-04 00:00:00
Vintage The Scarlet Letter A Now Age Illustrated Series Library Book Poster 1973,15.44,2020-09-05 00:00:00
4-In-1 Romance Collection: The Scarlet Letter/Washington Square/Jefferson in...,5.39,2020-09-05 00:00:00
The Scarlet Letter the Jennings band sampler NEW,33.69,2020-09-09 00:00:00
THE SCARLET LETTER - RUTHY LONG POOR - SAMPLER - FROM 1991 - CHART ONLY,9.25,2020-09-09 00:00:00
Abeka High School Literary Classics - The Scarlet Letter,4.53,2020-09-09 00:00:00
The Scarlet Letter By Nathaniel Hawthorne The Library Of Literature 1963 PB,4.79,2020-09-10 00:00:00
"The Scarlet Letter ""Sarah brown 1834 A Memorial Sampler"" Cross Stitch Chart NIP ",14.8,2020-09-10 00:00:00
FRANKLIN LIBRARY LIMITED EDITION 1976 THE SCARLET LETTER BY NATHANIEL HAWTHORNE,11.5,2020-09-10 00:00:00
THE SCARLET LETTER HAWTHORNE FRANKLIN LIBRARY,15.0,2020-09-11 00:00:00
The Scarlet Letter John Morris TV Soundtrack CD,14.7,2020-09-11 00:00:00
FRANKLIN LIBRARY THE SCARLET LETTER BY NATHANIEL HAWTHORNE  100 GREATEST BOOKS O,20.0,2020-09-13 00:00:00
"Barnes and Noble Classics Ser.: The Scarlet Letter by Nathaniel Hawthorne (2004,",4.3,2020-09-13 00:00:00
"The Scarlet Letter, hardbound World's Best Reading - Reader's Digest, new",4.99,2020-09-13 00:00:00
Easton Press ~ The Scarlet Letter Nathaniel Hawthorne ~ Full Leather ~ Pre Owned,19.36,2020-09-17 00:00:00
"The Scarlet Letter ""The Hannah Breed Sampler"" Cross Stitch Chart NIP",9.8,2020-09-19 00:00:00
The Scarlet Letter - Barnes and Noble Leather bound Classic Collection,11.94,2020-09-19 00:00:00
THE SCARLET LETTER Limited Edition 1976 Leather Nanthaniel Hawthorne a2,15.0,2020-09-19 00:00:00
the scarlet letter book,4.32,2020-09-20 00:00:00
"The Scarlet Letter ""Mary Ann Hutton's sampler"" Cross Stitch Pattern NEW",22.58,2020-09-21 00:00:00
Franklin Mint The Scarlet Letter,6.0,2020-09-24 00:00:00
1886 SCARLET LETTER Yearbook of RUTGERS COLLEGE -- By the Fraternities,83.0,2020-09-24 00:00:00
"Hand dyed 36  ct linen ""The Scarlet Letter""",52.8,2020-09-25 00:00:00
Vintage The Scarlet Letter The Hunt Sampler Kit - Silk Thread - Unused,56.95,2020-09-27 00:00:00
The Scarlet Letter Betsy Davis 1797 Reproduction Sampler X Stitch Chart + Fabric,32.7,2020-09-28 00:00:00
Gorgeous Book! The Scarlet Letter | Easton Press 100 Greatest Books Ever Written,32.5,2020-09-28 00:00:00
The Franklin Library - The Scarlet Letter by Nathaniel Hawthorne (1979) VG,10.02,2020-09-30 00:00:00
Easton Press ~THE SCARLET LETTER  By Hawthorne w/ Replacement Bookplate,24.36,2020-10-01 00:00:00
Easton Press ~THE SCARLET LETTER  By Hawthorne w/ Replacement Bookplate,20.5,2020-10-01 00:00:00
SCARLET LETTER Audiobook 5 Cassettes Narrator Flo Gibson 9 Hours - NEW,15.14,2020-10-02 00:00:00
SCARLET LETTER Audiobook 5 Cassettes Narrator Flo Gibson 9 Hours - NEW,36.69,2020-10-02 00:00:00
Franklin Library • THE SCARLET LETTER • Nathaniel Hawthorne • Best-Loved Books,14.91,2020-10-03 00:00:00
The Scarlet Letter By Nathaniel Hawthorne - Paperback - NEW condition,4.47,2020-10-03 00:00:00
"The Scarlet Letter ""The Elizabeth Irwin Sampler"" Cross Stitch Chart",9.8,2020-10-03 00:00:00
"The Scarlet Letter ""The Ann Greanawalt Sampler"" Cross Stitch Chart NIP",7.8,2020-10-03 00:00:00
"1975 EASTON PRESS - THE SCARLET LETTER By Nathaniel Hawthorne, Leather, Like New",30.9,2020-10-03 00:00:00
Franklin Library • THE SCARLET LETTER • Nathaniel Hawthorne • Best-Loved Books,9.99,2020-10-03 00:00:00
The Scarlet Letter By Nathaniel Hawthorne - Paperback - NEW condition,23.99,2020-10-03 00:00:00
"The Scarlet Letter ""The Elizabeth Irwin Sampler"" Cross Stitch Chart",20.45,2020-10-03 00:00:00
"The Scarlet Letter ""The Ann Greanawalt Sampler"" Cross Stitch Chart NIP",18.45,2020-10-03 00:00:00
"1975 EASTON PRESS - THE SCARLET LETTER By Nathaniel Hawthorne, Leather, Like New",26.95,2020-10-03 00:00:00
THE SCARLET LETTER 1975 Easton Press Collectors Edition Leather Bound,29.86,2020-10-04 00:00:00
Vintage The Scarlet Letter by Nathaniel Hawthorne  1878,18.33,2020-10-04 00:00:00
THE SCARLET LETTER 1975 Easton Press Collectors Edition Leather Bound,49.0,2020-10-04 00:00:00
Vintage The Scarlet Letter by Nathaniel Hawthorne  1878,40.0,2020-10-04 00:00:00
The Scarlet Letter and Other Writings by Nathaniel Hawthorne (2005),4.58,2020-10-06 00:00:00
The Scarlet Letter and Other Writings by Nathaniel Hawthorne (2005),1.25,2020-10-06 00:00:00
"The Scarlet Letter by Nathaniel Hawthorne pocket book Riverside Press, 1892",5.3,2020-10-07 00:00:00
The Scarlet Letter by Nathaniel Hawthorne — Easton Press,29.33,2020-10-07 00:00:00
"The Scarlet Letter by Nathaniel Hawthorne pocket book Riverside Press, 1892",2.5,2020-10-07 00:00:00
The Scarlet Letter by Nathaniel Hawthorne — Easton Press,26.0,2020-10-07 00:00:00
THE SCARLET LETTER Collector's Edition by Nathaniel Hawthorne USA,8.51,2020-10-08 00:00:00
THE SCARLET LETTER Collector's Edition by Nathaniel Hawthorne USA,27.5,2020-10-08 00:00:00
THE FRANKLIN LIBRARY Leather Book THE SCARLET LETTER 1976 NATHANIEL HAWTHORNE ++,16.86,2020-10-10 00:00:00
THE FRANKLIN LIBRARY Leather Book THE SCARLET LETTER 1976 NATHANIEL HAWTHORNE ++,40.0,2020-10-10 00:00:00
EASTON PRESS THE SCARLET LETTER BY NATHANIEL HAWTHORNE 100 GREATEST BOOKS NEW!,28.5,2020-10-12 00:00:00
"The Scarlet Letter in comic book form--62 pages, lots of illustrations",3.79,2020-10-12 00:00:00
EASTON PRESS THE SCARLET LETTER BY NATHANIEL HAWTHORNE 100 GREATEST BOOKS NEW!,59.0,2020-10-12 00:00:00
"The Scarlet Letter in comic book form--62 pages, lots of illustrations",0.99,2020-10-12 00:00:00
EASTON PRESS Collector's Edition HAWTHORNE'S THE SCARLET LETTER Leather Bound,22.5,2020-10-13 00:00:00
EASTON PRESS Collector's Edition HAWTHORNE'S THE SCARLET LETTER Leather Bound,61.5,2020-10-13 00:00:00
Hawthorne (1878/Illustrated/Decorated) The Scarlet Letter,66.99,2020-10-15 00:00:00
THE GREAT IS THE STEADINESS OF SOUL by The Scarlet Letter,20.0,2020-10-15 00:00:00
Hawthorne (1878/Illustrated/Decorated) The Scarlet Letter,91.0,2020-10-15 00:00:00
Nathaniel Hawthorne - The Scarlet Letter and The Blithedale Romance - 1875,15.98,2020-10-16 00:00:00
The Scarlet Letter The Unicorn Bell Pull Sampler Needlework Kit New Sealed,33.45,2020-10-16 00:00:00
Nathaniel Hawthorne - The Scarlet Letter and The Blithedale Romance - 1875,42.99,2020-10-16 00:00:00
The Scarlet Letter The Unicorn Bell Pull Sampler Needlework Kit New Sealed,49.5,2020-10-16 00:00:00
The scarlet letter  book,8.0,2020-10-17 00:00:00
"Hawthorne, Nathaniel THE SCARLET LETTER Franklin Library 1st Edition Illustrated",14.42,2020-10-17 00:00:00
The scarlet letter  book,6.0,2020-10-17 00:00:00
"Hawthorne, Nathaniel THE SCARLET LETTER Franklin Library 1st Edition Illustrated",41.5,2020-10-17 00:00:00
Franklin Library The Scarlet Letter Nathaniel Hawthorne 1976 First Edit Leather,13.84,2020-10-18 00:00:00
Franklin Library The Scarlet Letter Nathaniel Hawthorne 1976 First Edit Leather,10.51,2020-10-18 00:00:00
Classics Illustrated The Scarlet Letter #6 NM Berkeley First Publishing 1990,9.14,2020-10-19 00:00:00
The Scarlet Letter SARAH SELF 1784 An Ackworth Quaker School Sampler Primitive,14.7,2020-10-19 00:00:00
The Scarlet Letter SARAH SELF 1784 An Ackworth Quaker School Sampler Primitive,33.7,2020-10-19 00:00:00
"The Scarlet Letter by Nathaniel Hawthorne (2012, Trade Paperback)",4.33,2020-10-21 00:00:00
THE SCARLET LETTER Nathaniel Hawthorne Trident Press Deluxe 2 Edition Gold Gilt,6.57,2020-10-21 00:00:00
Nathaniel Hawthorne The Scarlet Letter Time Warner Libraries Leather Bound,7.77,2020-10-21 00:00:00
"The Scarlet Letter by Nathaniel Hawthorne (2012, Trade Paperback)",1.0,2020-10-21 00:00:00
THE SCARLET LETTER Nathaniel Hawthorne Trident Press Deluxe 2 Edition Gold Gilt,3.24,2020-10-21 00:00:00
Nathaniel Hawthorne The Scarlet Letter Time Warner Libraries Leather Bound,28.77,2020-10-21 00:00:00
The Scarlet Letter RACHEL ALLEN SAMPLER Pattern 1986 CHART ONLY,8.99,2020-10-22 00:00:00
The Scarlet Letter RACHEL ALLEN SAMPLER Pattern 1986 CHART ONLY,29.99,2020-10-22 00:00:00
"Easton Press ""The Scarlet Letter""",19.36,2020-10-23 00:00:00
"Hand dyed 36  ct linen ""The scarlet letter""",53.5,2020-10-23 00:00:00
"Easton Press ""The Scarlet Letter""",42.5,2020-10-23 00:00:00
"Hand dyed 36  ct linen ""The scarlet letter""",25.5,2020-10-23 00:00:00
 Easton Press The Scarlet Letter by Nathaniel Hawthorne collectors edition,25.54,2020-10-24 00:00:00
"THE SCARLET LETTER Nathaniel Hawthorne 1898 2ND ED 6"" x 4 1/8 inches Green Gold ",6.05,2020-10-25 00:00:00
"THE SCARLET LETTER Nathaniel Hawthorne 1898 2ND ED 6"" x 4 1/8 inches Green Gold ",25.25,2020-10-25 00:00:00
"the scarlet letter,  copyright 1883, by Nathaniel Hawthorne Houghton miffon co. ",15.0,2020-10-27 00:00:00
THE SCARLET LETTER    MEG FOSTER    JOHN HEARD   BRAND NEW/SEALED DVD,17.8,2020-10-27 00:00:00
THE SCARLET LETTER    MEG FOSTER    JOHN HEARD   BRAND NEW/SEALED DVD,38.95,2020-10-27 00:00:00
Easton Press The Scarlet Letter Hawthorne Leather excellent,11.5,2020-10-28 00:00:00
THE SCARLET LETTER - ABCD 1817 - A MINIATURE SAMPLER - FROM 1991 - CHART ONLY,6.25,2020-10-28 00:00:00
THE SCARLET LETTER - RUTHY LONG POOR - SAMPLER - FROM 1991 - CHART ONLY,9.25,2020-10-28 00:00:00
"The Scarlet Letter/Jane Eyre (DVD, 2004) Sealed",2.25,2020-10-28 00:00:00
Easton Press The Scarlet Letter Hawthorne Leather excellent,39.0,2020-10-28 00:00:00
THE SCARLET LETTER - ABCD 1817 - A MINIATURE SAMPLER - FROM 1991 - CHART ONLY,27.0,2020-10-28 00:00:00
THE SCARLET LETTER - RUTHY LONG POOR - SAMPLER - FROM 1991 - CHART ONLY,32.0,2020-10-28 00:00:00
"The Scarlet Letter/Jane Eyre (DVD, 2004) Sealed",21.25,2020-10-28 00:00:00
The Scarlet Letter/Nathaniel Hawthorne/Easton Press 1st/1975/Unread condition,21.5,2020-10-29 00:00:00
Ann Scutt Sampler 1675 The Scarlet Letter Kit  Linen Cross Stitch Reproduction ,33.25,2020-10-29 00:00:00
Anne Depauw Cross Stitch Sampler 1714 Scarlet Letter Kit Includes SILK Floss ,43.6,2020-10-29 00:00:00
The Scarlet Letter/Nathaniel Hawthorne/Easton Press 1st/1975/Unread condition,17.5,2020-10-29 00:00:00
Ann Scutt Sampler 1675 The Scarlet Letter Kit  Linen Cross Stitch Reproduction ,24.95,2020-10-29 00:00:00
Anne Depauw Cross Stitch Sampler 1714 Scarlet Letter Kit Includes SILK Floss ,34.95,2020-10-29 00:00:00
Ann Greanawalt Sampler THE SCARLET LETTER - new,17.0,2020-10-31 00:00:00
Ann Greanawalt Sampler THE SCARLET LETTER - new,36.0,2020-10-31 00:00:00
"Original Soundtrack to: The Scarlet Letter, John Barry (Epic 1995) EK 67451",6.49,2020-11-01 00:00:00
The Scarlet Letter/Nathaniel Hawthorne/Easton Press 1st/1975/Unread condition,17.0,2020-11-01 00:00:00
"Original Soundtrack to: The Scarlet Letter, John Barry (Epic 1995) EK 67451",27.49,2020-11-01 00:00:00
The Scarlet Letter/Nathaniel Hawthorne/Easton Press 1st/1975/Unread condition,11.0,2020-11-01 00:00:00
"The Scarlet Letter  Collectors Edition, Leather Bound, ©1975 Easton Press",21.85,2020-11-04 00:00:00
"The Scarlet Letter  Collectors Edition, Leather Bound, ©1975 Easton Press",17.99,2020-11-04 00:00:00
 DEL PRADO MINIATURE BOOK - THE SCARLET LETTER II - NATHANIEL HAWTHORNE - NEW,12.46,2020-11-05 00:00:00
 DEL PRADO MINIATURE BOOK - THE SCARLET LETTER II - NATHANIEL HAWTHORNE - NEW,12.79,2020-11-05 00:00:00
The Scarlet Letter. Ann Corrie 1831,25.5,2020-11-07 00:00:00
The Scarlet Letter.  Mary Ogleed sampler,25.4,2020-11-07 00:00:00
The Scarlet Letter. Rhoda Ann 1814. ,27.5,2020-11-07 00:00:00
The Scarlet Letter. Ann Kirby Sampler. chart only,22.75,2020-11-07 00:00:00
"THE SCARLET LETTER,1885,Nathaniel Hawthorne",35.0,2020-11-07 00:00:00
The Scarlet Letter. Ann Corrie 1831,19.5,2020-11-07 00:00:00
The Scarlet Letter.  Mary Ogleed sampler,19.4,2020-11-07 00:00:00
The Scarlet Letter. Rhoda Ann 1814. ,21.5,2020-11-07 00:00:00
The Scarlet Letter. Ann Kirby Sampler. chart only,17.0,2020-11-07 00:00:00
"THE SCARLET LETTER,1885,Nathaniel Hawthorne",31.0,2020-11-07 00:00:00
"""THE SCARLET LETTER"" BY NATHANIEL HAWTHORNE REVIEWED Indepth! 1850 N.Y NEWSPAPER",17.35,2020-11-08 00:00:00
SCARLET LETTER Sampler SARAH DUTNEL Sampler 1818 Limited Edition NEW,58.8,2020-11-08 00:00:00
THE SCARLET LETTER- NATHANIEL HAWTHORNE- FRANKLIN LIBRARY-1979- LEATHER BOUND,13.99,2020-11-08 00:00:00
The Scarlet Letter by Nathaniel Hawthorne  on 8 CDs,3.25,2020-11-08 00:00:00
"""THE SCARLET LETTER"" BY NATHANIEL HAWTHORNE REVIEWED Indepth! 1850 N.Y NEWSPAPER",7.5,2020-11-08 00:00:00
SCARLET LETTER Sampler SARAH DUTNEL Sampler 1818 Limited Edition NEW,54.0,2020-11-08 00:00:00
THE SCARLET LETTER THE MRS IE SAMPLER REPRODUCTION SAMPLER KIT SEALED NIP ,38.0,2020-11-10 00:00:00
The Scarlet Letter Hardback 1980 Signet Classic Nathaniel Hawthorne,33.99,2020-11-10 00:00:00
The Scarlet Letter - Nathaniel Hawthorne 1979 The Franklin Library,42.5,2020-11-12 00:00:00
"1877,  2nd Edition - THE SCARLET LETTER BY NATHANIEL HAWTHORNE, Illust. Osgood",50.95,2020-11-12 00:00:00
The Scarlet Letter ~ by Nathaniel Hawthorne 1947/48 Russell Classics Hardcover ,29.55,2020-11-13 00:00:00
The Scarlet Letter Nathaniel Hawthorne Easton Press 1975 Collectors Edition,46.5,2020-11-14 00:00:00
The Scarlet Letter. Abigail Ann Fleming 1816.  chart only,11.5,2020-11-14 00:00:00
1975 The Scarlet Letter The Easton Press Collector's Edition,86.25,2020-11-16 00:00:00
The Scarlet Letter (2004 DVD) Colleen Moore Digiview 1934 Black & White,2.39,2020-11-19 00:00:00
"#2047, Nathaniel Hawthorne - The Scarlet Letter, Collins FDC",3.45,2020-11-20 00:00:00
The Scarlet Letter Japan Movie Flyer 1995 Demi Moore Roland Joffé Gary Oldman,2.99,2020-11-22 00:00:00
Easton Press - New - The Scarlet Letter,11.49,2020-11-27 00:00:00
Franklin Library The Scarlet Letter ,40.0,2020-11-29 00:00:00
1900 Antique Book The Scarlet Letter By Nathaniel Hawthorne Hardcover Conkey NR,45.5,2020-11-29 00:00:00
"Lot Of Franklin Library The Scarlet Letter, The Red & Black, Henrik Ibsen Plays",65.99,2020-11-30 00:00:00
THE SCARLET LETTER by Nathaniel Hawthorne - Easton Press Leather - 100 GREATEST,75.8,2020-12-02 00:00:00
" Scarlet Letter,Nathaniel Hawthorne Collection EDITION Leather EASTON PRESS 1975",15.5,2020-12-02 00:00:00
1900 BOOK THE SCARLET LETTER BY NATHANIEL HAWTHORNE,35.0,2020-12-03 00:00:00
THE SCARLET LETTER Nathaniel Hawthorne FRANKLIN LIBRARY Leather Edition 1976,53.99,2020-12-03 00:00:00
"Dover Thrift Editions Ser.: The Scarlet Letter by Nathaniel Hawthorne (1994,...",0.99,2020-12-04 00:00:00
"The Scarlet Letter, Nathaniel Hawthorne         [The Folio Society] London 1992",20.0,2020-12-04 00:00:00
The Scarlet Letter by Nathaniel Hawthorne Collector's Edition Vintage,9.0,2020-12-05 00:00:00
1959 The Scarlet Letter by Nathaniel Hawthorne Signet Classic 11th Edition  ,1.49,2020-12-05 00:00:00
the scarlet letter hawthorn 1892 the salem edition vg,35.0,2020-12-05 00:00:00
Vintage The Scarlet Letter by Nathaniel Hawthorne Hurst And Company HC,33.0,2020-12-07 00:00:00
"The Scarlet Letter - Nathaniel Hawthorne, Easton Press 100 Greatest Books, MINT",19.5,2020-12-07 00:00:00
Easton Press; Nathaniel Hawthorne: THE SCARLET LETTER: BOSTON SINNER: HESTER ,24.95,2020-12-08 00:00:00
"THE SCARLET LETTER - A Romance, by Nathaniel Hawthorne, 1893, Henry Altemus",30.0,2020-12-09 00:00:00
FRANKLIN LIBRARY THE SCARLET LETTER by NATHANIEL HAWTHORNE 1979c Illust Leather,11.99,2020-12-10 00:00:00
"THE SCARLET LETTER, by Nathaniel Hawthorne, International Collectors Library",5.0,2020-12-10 00:00:00
The Scarlet Letter H. K. SMITH 1822 pair English Quaker reproduction Samplers ,19.99,2020-12-10 00:00:00
The Scarlet Letter THE ESTHER CHARLTON SAMPLER reproduction chart,19.99,2020-12-10 00:00:00
The Scarlet Letter THE CHIMNEYPIECE Chimney Piece sampler chart 1995,19.99,2020-12-10 00:00:00
THE SCARLET LETTER. By Nathaniel Hawthorne: Ticknor & Fields 1852,31.0,2020-12-11 00:00:00
The Scarlet Letter Book Nathaniel Hawthorne Franklin Library (1979),44.99,2020-12-12 00:00:00
Franklin Library THE SCARLET LETTER by Nathaniel Hawthorne Leather Excellent,21.0,2020-12-13 00:00:00
"3 Vintage Pocket Books, The Man with the Golden Arm, O,Henry,The Scarlet Letter",32.02,2020-12-14 00:00:00
Oxford World's Classics Ser.: The Scarlet Letter by Nathaniel Hawthorne...,23.75,2020-12-14 00:00:00
"Manga Classics: the Scarlet Letter Softcover ,2015",32.5,2020-12-16 00:00:00
The Scarlet Letter Abbie Lucas Reproduction Sampler Cross Stitch Chart + Fabric,50.5,2020-12-16 00:00:00
The Scarlet Letter THE IDEAL LANDSCAPE SAMPLER ,19.99,2020-12-17 00:00:00
THE SCARLET LETTER BARNES AND NOBLE LEATHER BOUND CLASSIC BRAND NEW,39.5,2020-12-18 00:00:00
THE SCARLET LETTER by Nathaniel Hawthorne Easton Press Leather Bound,54.95,2020-12-19 00:00:00
The Scarlet Letter hardcover 1850 2nd edition published by Charles E. Brown,36.0,2020-12-20 00:00:00
THE SCARLET LETTER *Pub. By Charles Scribner & Sons-1919* By Nathaniel Hawthorne,9.95,2020-12-23 00:00:00
The Scarlet Letter - Hawthorne 1st Ed Facsimile Charles Winthrope. No Card,71.0,2020-12-25 00:00:00
