title,price,date
LEGO Pirates 70411 Treasure Island - NEW - SEALED - RETIRED,134.5,2020-08-11 00:00:00
"Treasure Island (VHS, 1997, Fantastic Adventures Series, Walt Disney) New Sealed",32.0,2020-08-11 00:00:00
ACNH Animal Crossing: TREASURE Island: 5000+ Catalog & Loot 🔥 UNLIMITED TRIPS!,8.99,2020-08-11 00:00:00
ACNH Animal Crossing: TREASURE Island: 5000+ Catalog & Loot 🔥  UNLIMITED 2 Hour,33.99,2020-08-11 00:00:00
ACNH Animal Crossing: TREASURE Island: 5000+ Catalog & Loot 🔥  UNLIMITED 1 HOUR,17.99,2020-08-11 00:00:00
Treasure Island Music Festival 2014 Crew Shirt Black XL,33.0,2020-08-11 00:00:00
Companion Library Gullivers's Travels and Treasure Island Classics,65.2,2020-08-11 00:00:00
Retired Lego Duplo Dora's Explorer Treasure Island 7330 Playset Blocks Boat,57.99,2020-08-11 00:00:00
Treasure Island Music Festival 2012 Crew Shirt Black XL,32.0,2020-08-11 00:00:00
ACNH Animal Crossing: TREASURE Island: 5000+ Catalog & Loot 🔥  UNLIMITED TRIPS!,33.99,2020-08-11 00:00:00
ACNH Animal Crossing: TREASURE Island: 5000+ Catalog & Loot 🔥 UNLIMITED RUNS!,8.99,2020-08-11 00:00:00
ACNH Animal Crossing: TREASURE Island: 5000+ Catalog & Loot 🔥  UNLIMITED TRIPS,17.99,2020-08-11 00:00:00
"78🆕sealed-Treasure Island (DVD, 2004) R4 Rare",10.35,2020-08-11 00:00:00
MUPPETS: TREASURE ISLAND (Golden SOUND STORY) By Golden Books - New Sealed,50.0,2020-08-11 00:00:00
Priory Classics - Treasure Island hardcover Robert L Stevenson,37.12,2020-08-11 00:00:00
McDonald's 1996 MUPPET TREASURE ISLAND Jim Henson BATH TUB  COMPLETE SET OF 4,36.0,2020-08-11 00:00:00
TREASURE ISLAND BLU-ray 65th Anniversary Edition DISNEY EXCLUSIVE NEW,47.24,2020-08-11 00:00:00
LEGO Pirates 70411 Treasure Island - NEW - SEALED - RETIRED,123.5,2020-08-11 00:00:00
"Treasure Island (VHS, 1997, Fantastic Adventures Series, Walt Disney) New Sealed",27.0,2020-08-11 00:00:00
ACNH Animal Crossing: TREASURE Island: 5000+ Catalog & Loot 🔥 UNLIMITED TRIPS!,8.99,2020-08-11 00:00:00
ACNH Animal Crossing: TREASURE Island: 5000+ Catalog & Loot 🔥  UNLIMITED 2 Hour,33.99,2020-08-11 00:00:00
ACNH Animal Crossing: TREASURE Island: 5000+ Catalog & Loot 🔥  UNLIMITED 1 HOUR,17.99,2020-08-11 00:00:00
Treasure Island Music Festival 2014 Crew Shirt Black XL,29.0,2020-08-11 00:00:00
Treasure Island / In Search Of The Castaways 2-Movie Collection,8.6,2020-08-11 00:00:00
Companion Library Gullivers's Travels and Treasure Island Classics,58.55,2020-08-11 00:00:00
Retired Lego Duplo Dora's Explorer Treasure Island 7330 Playset Blocks Boat,48.99,2020-08-11 00:00:00
Treasure Island Music Festival 2012 Crew Shirt Black XL,28.0,2020-08-11 00:00:00
ACNH Animal Crossing: TREASURE Island: 5000+ Catalog & Loot 🔥  UNLIMITED TRIPS!,33.99,2020-08-11 00:00:00
ACNH Animal Crossing: TREASURE Island: 5000+ Catalog & Loot 🔥 UNLIMITED RUNS!,8.99,2020-08-11 00:00:00
ACNH Animal Crossing: TREASURE Island: 5000+ Catalog & Loot 🔥  UNLIMITED TRIPS,17.99,2020-08-11 00:00:00
MUPPETS: TREASURE ISLAND (Golden SOUND STORY) By Golden Books - New Sealed,41.0,2020-08-11 00:00:00
2 Muppety Adventures:  The Great Muppet Caper / Muppet Treasure Island Of Pirate,10.08,2020-08-11 00:00:00
Priory Classics - Treasure Island hardcover Robert L Stevenson,29.12,2020-08-11 00:00:00
McDonald's 1996 MUPPET TREASURE ISLAND Jim Henson BATH TUB  COMPLETE SET OF 4,31.0,2020-08-11 00:00:00
TREASURE ISLAND BLU-ray 65th Anniversary Edition DISNEY EXCLUSIVE NEW,46.49,2020-08-11 00:00:00
1967 Treasure Island - Robert Louis Stevenson (Josef Hochman Illust)Paul Hamlyn,28.91,2020-08-12 00:00:00
Treasure Island at the Mirage Pirate Bear 3D Magnet Souvenir Travel Refrigerator,23.38,2020-08-12 00:00:00
"Christopher L. Stone ""TREASURE ISLAND THE ADVENTURE BEGINS"" promo score CD",51.99,2020-08-12 00:00:00
IN HAND MSCHF Branded Books Treasure Island by Robert Louis Stevenson 1000 Made,62.25,2020-08-12 00:00:00
"Muppet Show, It's the Muppets!, Muppet Movie, Treasure Island Lot of 9 TESTED",19.99,2020-08-12 00:00:00
TREASURE ISLAND AND MIDSUMMER NIGHT'S DREAM - PAIR OF CLASSICS 1915/1922,28.99,2020-08-12 00:00:00
Muppet Treasure Island / The Great Muppet Caper (Blu-ray & DVD) **NEW SEALED**,37.99,2020-08-12 00:00:00
"ORIGINAL ANTIQUE / VINTAGE INGRAHAM ""TREASURE ISLAND"" BANJO CLOCK",425.0,2020-08-12 00:00:00
Treasure Island Classic Library #1 1968 by Robert Louis Stevenson Illust/Hardcov,39.99,2020-08-12 00:00:00
1942 Treasure Island Stevenson N.C. Wyeth Color Plates w/ Pg 23 Error Hardcover ,69.5,2020-08-12 00:00:00
1924 Treasure Island by Robert Stevenson Published by John Winston Company,34.95,2020-08-12 00:00:00
MUPPET TREASURE ISLAND glass BEER MUG ,53.99,2020-08-12 00:00:00
TREASURE ISLAND 🌴 BY ROBERT LOUIS STEVENSON AUDIOBOOK CASSETTE LIKE NEW ,36.99,2020-08-12 00:00:00
ACNH Animal Crossing: TREASURE Island: 5000+ Catalog & Loot 🔥 MULTIPLE TRIPS!,8.99,2020-08-12 00:00:00
Treasure Island Robert Luis Stevenson hardcover HCDJ book,47.09,2020-08-12 00:00:00
""" ROCKSTEADY. "" phyllis dillon. TREASURE ISLAND RECORDS 7in.",13.41,2020-08-12 00:00:00
TREASURE ISLAND by Robert Louis Stevenson (2014) PB,33.0,2020-08-12 00:00:00
Treasure Island by Robert Louis Stevenson,3.8,2020-08-12 00:00:00
Muppet Treasure Island--1996 Pin--Walt Disney/Jim Henson Productions,22.74,2020-08-12 00:00:00
Treasure Island Camp 75th Anniversary Program Booklet 1988,9.95,2020-08-12 00:00:00
Unami Lodge OA 65th Anniversary Celebration Program Book Treasure Island ,12.95,2020-08-12 00:00:00
Unami Lodge OA 75th Anniversary Celebration Program Book Treasure Island ,9.95,2020-08-12 00:00:00
ACNH Animal Crossing: TREASURE Island: 5000+ Catalog & Loot 🔥 UNLIMITED TRIPS!,8.99,2020-08-12 00:00:00
ACNH Animal Crossing: TREASURE Island: 5000+ Catalog & Loot 🔥 UNLIMITED 1 HOUR!,17.99,2020-08-12 00:00:00
ENID BLYTON FAMOUS FIVE ON A TREASURE ISLAND 1947 WHITE SPINE DUSTWRAPPER RARE,95.56,2020-08-12 00:00:00
TREASURE ISLAND Classic NEW PICTURE Story BOOK Robert Louis Stevenson KIDS,27.95,2020-08-12 00:00:00
TREASURE ISLAND Robert Louis Stevenson EDMUND DULAC Illustrated GARDEN CITY ,45.99,2020-08-12 00:00:00
"Treasure Island (VHS, 1997, Fantastic Adventure Series)",26.15,2020-08-12 00:00:00
1967 Treasure Island - Robert Louis Stevenson (Josef Hochman Illust)Paul Hamlyn,28.91,2020-08-12 00:00:00
Kermit The Frog Muppets Treasure Island 18” Plush Capt. Smollet 1995 Vintage ,33.99,2020-08-13 00:00:00
Treasure Island By R.L. Stevenson   1920's Version Classic Story Telling,46.5,2020-08-13 00:00:00
"Treasure Island (DVD, 2001, Scott King, Nick Offerman) OOP, rare",34.99,2020-08-13 00:00:00
Robert Louis Stevenson TREASURE ISLAND Illustrations by Louis Rhead Harper 1915,43.95,2020-08-13 00:00:00
TREASURE ISLAND CAPTN LEVASSEUR PIRATE FIGURINE TREASURE CHEST THE MIRAGE VEGAS,39.99,2020-08-13 00:00:00
TREASURE ISLAND CAPTAIN MORGAN PIRATE FIGURINE TREASURE CHEST THE MIRAGE VEGAS,39.99,2020-08-13 00:00:00
"Treasure Island (DVD, Movie, Drama, Adventure, Widescreen, 2012) New, Sealed",19.89,2020-08-13 00:00:00
Treasure Island Stevenson ~ Easton Press 100 Greatest Books ~ Collectors Edition,61.0,2020-08-13 00:00:00
Treasure Island Robert Louis Stevenson Color Plate Illustrations N C Wyeth 1952,124.0,2020-08-13 00:00:00
Classics Illustrated Deluxe Graphic Novel: Treasure Island by Robert...,34.5,2020-08-13 00:00:00
MARVEL ILLUSTRATED TREASURE ISLAND HC Hardcover Robert Louis Stevenson NEW,33.99,2020-08-13 00:00:00
Treasure Island CATALOG / Loot POCKET UNLIMITED Trips - Animal Crossing (ACNH),6.99,2020-08-13 00:00:00
 TREASURE Island Catalog/ loot Wearable Items Animal Crossing:ACNH,9.99,2020-08-13 00:00:00
TREASURE ISLAND TI HOTEL CASINO - $1 GAMING CHIP - LAS VEGAS NEVADA,5.65,2020-08-13 00:00:00
"7 Reader's Digest Best Loved Books for Young Readers, Treasure Island, EX,  HCs ",16.99,2020-08-13 00:00:00
Vintage Tumblers Glasses in Treasure Island by Libbey - Rock Sharpe Set Of 2,12.0,2020-08-13 00:00:00
"Vtg TREASURE ISLAND CAUSEWAY,  Florida TRANSIT TOKEN - One Way Toll",6.99,2020-08-13 00:00:00
"Treasure Island, Kidnapped, Around the World in 80 Days",11.87,2020-08-13 00:00:00
"Treasure Island (Knickerbocker Classics), Stevenson, Robert Louis, Excellent Boo",7.49,2020-08-13 00:00:00
B006NZAQ9Q Treasure Island  Dover Thrift Editions ,10.97,2020-08-13 00:00:00
Treasure Island Robert Stevenson New Unabridged  Illustrated Hardcover Gift Ed,41.56,2020-08-13 00:00:00
Treasure Island Leather Back Book By Robert Louis Stevenson.,39.0,2020-08-13 00:00:00
Postcard FL The Penguin ADVERTISING Restaurant Rib House Florida Treasure Island,8.55,2020-08-13 00:00:00
Treasure Island (Puffin Classics),31.49,2020-08-13 00:00:00
Treasure Island Robert Louis Stevenson Illustrated Junior Library HCDJ 1947,35.37,2020-08-13 00:00:00
Disney VHS Lot All New/Sealed Sleeping Beauty Snow White Treasure Island 101 Dal,53.99,2020-08-14 00:00:00
Antique Treasure Island Book By Robert Louis Stevenson The Mershon Co Publishing,53.0,2020-08-14 00:00:00
Mickey Mouse Sails For Treasure Island Big Little Book 750 1933 Walt Disney,39.95,2020-08-14 00:00:00
Yarmouth ME Treasure Island Seal Pond on Route 1 Real Photo Postcard,9.74,2020-08-14 00:00:00
New/Sealed Disney Treasure Island and Blackbeard's Ghost Blu-Ray Lot Movies,72.0,2020-08-14 00:00:00
1951 Kentucky Tavern Whiskey Treasure Island Gift Decanter Bottle Glasses 50s Ad,9.89,2020-08-14 00:00:00
Vintage Florida Postcard Treasure Island Kingfish Restaurant John's,2.49,2020-08-14 00:00:00
"2 Great Illustrated Classics by Robert Louis Stevenson: Treasure Island, Jeckyll",28.99,2020-08-14 00:00:00
Antique Treasure Island Book,39.5,2020-08-14 00:00:00
2 Muppety Adventures:  The Great Muppet Caper / Muppet Treasure Island Of Pirate,4.95,2020-08-14 00:00:00
"LEGO 70411 Treasure Island Pirates 100% Complete w box, manual and minifigures",50.0,2020-08-14 00:00:00
"Treasure Island, Paperback by Stevenson, Robert Louis; Colfer, Eoin (INT), Li...",21.39,2020-08-14 00:00:00
Vintage 1975 Weebles Look Out Tower for Treasure Island Set by Hasbro,19.42,2020-08-14 00:00:00
Vintage Hasbro 1975 Weebles Treasure Island Pirate Ship Boat AS IS,72.99,2020-08-14 00:00:00
Vintage Lot  of 15 Best in Children's Books 1957-1960's & 1954 Treasure Island,90.95,2020-08-14 00:00:00
Ingraham banjo wall clock Treasure Island,350.0,2020-08-14 00:00:00
Treasure Island - Robert Louis Stevenson - Folio Society 2006 (#10) 1st Printing,38.92,2020-08-14 00:00:00
"Treasure Island - Robert Louis Stevenson, 1949 Random House ",7.0,2020-08-14 00:00:00
Lot Of 3 Junior Classics For Young Readers Tom Sawyer Huck Finn Treasure Island,10.0,2020-08-14 00:00:00
Set of 3 Sealed Enchanted Collection VHS Tapes Treasure Island Tom Sawyer Ali Ba,3.89,2020-08-14 00:00:00
Muppet Treasure Island/The Great Muppet Caper w/ Slipcover (Blu-ray 2-Disc Set),13.5,2020-08-14 00:00:00
RETURN TO TREASURE ISLAND NEW DVD,26.95,2020-08-14 00:00:00
Muppet Treasure Island / The Great Muppet Caper (Blu-ray & DVD),30.0,2020-08-15 00:00:00
Treasure Island Las Vegas Large Glass Mermaid Mug,70.95,2020-08-15 00:00:00
Muppet Treasure Island/The Great Muppet Caper  (Blu-Ray ),30.95,2020-08-15 00:00:00
treasure island trip ACNH,5.0,2020-08-15 00:00:00
"Children's Classics Books-Hardcover Lot 4 Peter Pan, Treasure Island, Swiss",51.0,2020-08-15 00:00:00
"Muppet Treasure Island (VHS, 1996)",3.99,2020-08-15 00:00:00
"4 Vintage Casino Coin Cups - Excalibur, Treasure Island, Orleans, MGM Grand",7.5,2020-08-15 00:00:00
Treasure Island Illustrated Junior Library By Robert Louis Stevenson,36.5,2020-08-15 00:00:00
LOT OF 8 BSA BOY SCOUTS TREASURE ISLAND PHILA COUNCIL 1990-92 CERAMIC MUGS CUPS,40.0,2020-08-15 00:00:00
Walt Disney Fantastic Adventures Series Treasure Island VHS NEW SEALED,28.99,2020-08-15 00:00:00
Treasure Island by Robert Louis Stevenson 1948 1st ed Dent HB 8 Colour Plates.,45.49,2020-08-15 00:00:00
Treasure Island - Robert Louis Stevenson LEATHERBOUND Easton Press MINT,98.69,2020-08-15 00:00:00
Muppet Treasure Island/The Great Muppet Caper w/ Slipcover (Blu-ray 2-Disc Set),43.0,2020-08-15 00:00:00
"Treasure Island & 20,000 Leagues Under The Sea. Educator Classic Library 1968 HC",64.0,2020-08-15 00:00:00
Animal crossing New Horizons 💥Treasure Island💥 ALL YOU CAN TAKE/30 MINS!,11.55,2020-08-15 00:00:00
Great Illustrated Classics 11 Book Lot Hardcover Treasure Island Robin Hood,59.99,2020-08-15 00:00:00
Treasure Island-Stevenson-1947 Jr. Library Ed.-HCDJ-Illustrated by Norman Price,10.5,2020-08-15 00:00:00
Junior Great Books Series 3 Volumes 1 to 12 Softcover Treasure Island Fables ,53.02,2020-08-15 00:00:00
Sloppy Joe's T Shirt Treasure Island Florida Skull Blue Size Large,9.95,2020-08-15 00:00:00
Mens TREASURE ISLAND at Mirage Las Vegas Navy Blue Golf Shirt NWT size L,39.99,2020-08-15 00:00:00
Treasure Island DVD VG++ Wallace Beery-Jackie Cooper,34.0,2020-08-15 00:00:00
Muppet Treasure Island Original Motion Picture Soundtrack,40.22,2020-08-15 00:00:00
Playmobil Treasure Island playset 6679 - nearly complete,17.0,2020-08-16 00:00:00
DVD EX RENTAL Treasure Island Kids The Battle Of Treasure Island FREE POST #V2 ,39.91,2020-08-19 00:00:00
Walt Disney World Postcard Mickey Mouse & Goofy on Treasure Island Unused,2.5,2020-08-20 00:00:00
Long John Silver`s Return To Treasure Island -- Digitally Remastered DVD NEW,12.01,2020-08-20 00:00:00
"[Five on a Treasure Island] (By: Enid Blyton) [published: March, 1997] By Enid ",10.04,2020-08-20 00:00:00
Saddleback Classics Audio Cassette/Book/Study Guide Treasure Island,6.99,2020-08-20 00:00:00
"Michael Miller HTF Treasure Island, pirates craft,quilt,cotton fabric BTHY",20.5,2020-08-20 00:00:00
Robert Louis Stevenson's Treasure Island: A Radio Dramatization by Stevenson,6.69,2020-08-20 00:00:00
Great Illustrated Classics series - Treasure Island by Robert Louis...,20.0,2020-08-20 00:00:00
"Treasure Island [Dover Thrift Editions] by Robert Louis Stevenson , Paperback",18.87,2020-08-20 00:00:00
Vintage Walt Disney's The Story of Treasure Island Vinyl Record 1964,30.98,2020-08-20 00:00:00
Animal Crossing New Horizon: CATALOG LOOT 5000+ TREASURE ISLAND | Multiple Runs!,8.99,2020-08-20 00:00:00
Treasure Island Catalog + Loot Animal Crossing Unlimited Trips,19.99,2020-08-20 00:00:00
TREASURE ISLAND BIG BEAR LAKE  CALIFORNIA POSTCARD,2.99,2020-08-20 00:00:00
Animal Crossing Treasure Island All You Can Loot Unlimited Trips,19.99,2020-08-20 00:00:00
Vintage 90s Treasure Island At The Mirage Stitched Black Sweat Shorts Sz M Faded,47.0,2020-08-20 00:00:00
"Robinson Crusoe, King Arthur & Treasure Island ~ Beautiful Illustrations c1900's",64.0,2020-08-20 00:00:00
"Las Vegas Treasure Island Souvenir 3D MERMAID Glass Mug/Beer Stein 7.5"" Tall",42.99,2020-08-20 00:00:00
Treasure Island Pirate Skull Glass Mugs Beer,46.0,2020-08-20 00:00:00
Animal Crossing New Horizons: CATALOG LOOT 5000+ TREASURE ISLAND | Multiple Trip,8.99,2020-08-20 00:00:00
Decowall Pirates & Treasure Island Kids Removable Wall Stickers Decal DS-8010,14.39,2020-08-20 00:00:00
"Treasure Island/In Search Of the Castaways (DVD, 2009, 2-Disc Set) Walt Disney's",23.49,2020-08-20 00:00:00
ALL Wearable Items Catalog/ Loot Treasure Island - Animal Crossing (ACNH),6.99,2020-08-20 00:00:00
Treasure Island  Catalog / Pocket Any : Animal Crossing (ACNH),9.99,2020-08-20 00:00:00
Treasure Island/ Resource: Catalog / Loot Any - Animal Crossing (ACNH),9.99,2020-08-20 00:00:00
Muppet Treasure Island - Kermit's 50th Anniversary Edition,7.99,2020-08-21 00:00:00
3 PACK Vtg Treasure Island 70s WHITE Tank Top Undershirt MEN'S Size 44 Free Ship,18.01,2020-08-21 00:00:00
"Treasure Island (DVD, 2003) (b43)",21.95,2020-08-21 00:00:00
SEALED!! Jim Henson Muppet Treasure Island Soundtrack Cassette 1996 Walt Disney,42.99,2020-08-21 00:00:00
"2 Walt Disney Home Video  Laser Videodisc Winnie The Pooh, Treasure Island",37.99,2020-08-21 00:00:00
HALLMARK - VELVET COVERS  Classics - Black Beauty Alice Adventures - Tom Sawyer,39.98,2020-08-21 00:00:00
Animal Crossing New Horizon: CATALOG LOOT 5000+ TREASURE ISLAND | Unlimited Trip,8.99,2020-08-21 00:00:00
"RPPC, San Francisco, Golden Gate International Exposition, Treasure Island,1939 ",9.23,2020-08-21 00:00:00
Treasure Island by Robert Louis Stevenson. The Franklin library 1984,43.0,2020-08-21 00:00:00
"Muppet Treasure Island (PC CD Activision) Big Box complete, HTF/Rare, Jim Henson",53.72,2020-08-21 00:00:00
Treasure Island Vegas Orange Skull Mug Pirate Poolside Pineapple,26.99,2020-08-21 00:00:00
"Treasure Island, Hardcover by Stevenson, Robert Louis; Wyeth, N. C. (ILT), Li...",34.35,2020-08-21 00:00:00
$5 Las Vegas Treasure Island Mystere Casino Chip - Mint,29.99,2020-08-21 00:00:00
"Treasure Island (DVD, 2003)  New Sealed",21.0,2020-08-21 00:00:00
The Great Writers Library Treasure Island By Robert Louis Stevenson - HB Book,46.45,2020-08-21 00:00:00
VTG View-Master Reels Treasure Island BB432 Sealed 1958,34.0,2020-08-22 00:00:00
LEGO Pirates 6235-1 Buried Treasure vintage complete circa 1989,26.99,2020-08-22 00:00:00
Nintendo Gameboy Game The Flintstones King Rock Treasure Island Loose,48.39,2020-08-22 00:00:00
Animal Crossing New Horizon: CATALOG & LOOT TREASURE ISLAND | 5000+ Items Today!,8.99,2020-08-22 00:00:00
"Robert Louis Stevenson, TREASURE ISLAND  - Easton Press - Full Leather ",28.99,2020-08-22 00:00:00
Marvelous Another Treasure Island SFC Nintendo Super Famicom SNES Japan F/S,32.0,2020-08-22 00:00:00
Conte Pirate accessory 54mm Treasure Island Playset Rat on a Barrel o Rum barzso,19.99,2020-08-22 00:00:00
TREASURE ISLAND “Mr. Henry” PEG LEG PIRATE FIGURINE TREASURE CHEST Mirage Vegas,58.99,2020-08-22 00:00:00
Animal crossing New Horizons🎉Treasure Island🎉Get ANYTHING YOU WANT In 60MINS!,16.45,2020-08-22 00:00:00
Mia Secret Gelux Nail Polish 0.5 Oz UV GEL-SOAK OFF GEL POLISH - NEW COLORS ! ,9.99,2020-08-22 00:00:00
"Treasure Island, St. Petersburg, Florida - El Ray/El Nor, Apartment Motels-1957",19.2,2020-08-22 00:00:00
Vintage Florida Chrome Postcard St Petersburg Treasure Island Tahitian Motel,3.49,2020-08-22 00:00:00
"Keith Jarrett - Treasure Island (UHQCD) [New CD] Ltd Ed, HqCD Remaster",36.26,2020-08-22 00:00:00
"Flintstones King Rock Treasure Island ""RARE"" For Nintendo Gameboy",54.5,2020-08-22 00:00:00
LUMINARC USA TREASURE ISLAND CASINO GLASS PIRATE SKULL 30 OZ CUP HEAVY MUG STEIN,38.99,2020-08-22 00:00:00
Hot Tub Spa Balboa ML700 Top Side Controller Overlay Treasure Island 8 Button,31.25,2020-08-22 00:00:00
Animal Crossing New Horizon: CATALOG & LOOT TREASURE ISLAND | 5000+ Unlimited!,8.99,2020-08-22 00:00:00
"Treasure Island Inn Daytona Beach, FL Vintage Postcard",5.49,2020-08-22 00:00:00
Florida Postcard Daytona Beached Shores Treasure Island Inn Long Card,3.82,2020-08-22 00:00:00
Vtg Muppet Treasure Island Full Bed Sheets Double Set Pillowcases Fitted Flat,63.64,2020-08-22 00:00:00
Best Loved Classics 10 Books Set Treasure Island 1963 Instant Library In Blue,49.99,2020-08-22 00:00:00
"Muppet Treasure Island (PC CD-ROM, 1996) ~ Complete w/ Manual",19.95,2020-08-22 00:00:00
"5"" NAVY STATION TREASURE ISLAND CA GATEWAY TO THE PACIFIC EMBROIDERED PATCH ",29.74,2020-08-23 00:00:00
Classic Starts: Treasure Island [Classic Starts Series],3.74,2020-08-23 00:00:00
Animal Crossing New Horizons: CATALOG & LOOT TREASURE ISLAND | 5000+ Items FAST!,8.99,2020-08-23 00:00:00
"$10 TREASURE ISLAND 2004 ""SIRENS"" .999 SILVER STRIKE",32.0,2020-08-23 00:00:00
TREASURE ISLAND Robert Louis Stevenson paperback book & coloring book lot x 2 ,2.99,2020-08-23 00:00:00
Walt Disney's Treasure Island 11x14 Theatrical Movie Lobby Card Set of 5 Vintage,30.74,2020-08-23 00:00:00
Vintage Tom Sawyer Treasure Island Call of the Wild Award Books Inc Lot of 3,16.99,2020-08-23 00:00:00
🔥Treasure Island 2 hours unlimited 🔥 Animal Crossing New Horizons & Raymond,20.0,2020-08-23 00:00:00
MICKEY MOUSE: Trapped on Treasure Island (HC) LIKE NEW,26.0,2020-08-23 00:00:00
Animal Crossing New Horizons: CATALOG & LOOT TREASURE ISLAND | 5000+ Items FAST,8.99,2020-08-23 00:00:00
Muppet Treasure Island / The Great Muppet Caper Blu-ray + DVD Brand New Sealed!!,22.99,2020-08-23 00:00:00
Marvelous - Another Treasure Island Super Nintendo Famicom SNES NTSC J English !,73.0,2020-08-23 00:00:00
Treasure Island Las Vegas Vintage Shot Glass,20.99,2020-08-23 00:00:00
Treasure Island DVD WB Victor Fleming Lionel Barrymore Wallace Berry New OOP,32.98,2020-08-23 00:00:00
"Treasure Island (DVD 2011) DISC LIKE NEW ""FAST SHIPPING"" b6",21.3,2020-08-23 00:00:00
Animal Crossing New Horizon: CATALOG & LOOT TREASURE ISLAND | 5000+ Items FAST!,8.99,2020-08-23 00:00:00
Unused Pre-1980 TREASURE ISLAND INN MOTEL Daytona Beach Shores FL c5880-34,4.63,2020-08-23 00:00:00
"Antique 1906 Treasure Island Book Robert L. Stevenson Pub by The Judge Co, NY",23.67,2020-08-23 00:00:00
Vtg Hawaiian Shirt Tiki Aloha TREASURE ISLAND Beaches Button Up Polynesian Blue,54.79,2020-08-23 00:00:00
"CHITON CONFOSSA 24.86mm BEAUTIFUL RARE SPECIMEN Treasure Island, Fiji",32.0,2020-08-23 00:00:00
"Treasure Island (DVD, 2003) Disney Classic",25.99,2020-08-23 00:00:00
"The  Adventure Collection : Treasure Island, the Jungle Book, White Fang, .....",109.0,2020-08-23 00:00:00
TREASURE ISLAND by Robert Louis Stevenson & Illustrated by Edmund Dulac c. 1935,29.99,2020-08-23 00:00:00
True Adventures Diane Webber Guayaquil Lord Kilbracken Treasure Island 1969,42.49,2020-08-24 00:00:00
Animal Crossing New Horizons: CATALOG & LOOT TREASURE ISLAND | 5000+ Items FAST!,8.99,2020-08-24 00:00:00
TREASURE ISLAND-MIRAGE LIMITED EDITION TEN DOLLAR GAMING TOKEN .999 SILVER COIN.,42.95,2020-08-24 00:00:00
PEEK little peanut TREASURE ISLAND t-shirt 12/18 M olive PIECES OF EIGHT tee 1,23.99,2020-08-24 00:00:00
"The Greatest Tales Ever Told (4-DVD Set) Treasure Island, Moby Dick",9.55,2020-08-24 00:00:00
Treasure Island Robert Louis Stevenson Illustrated Hardback Companion  BX3,44.65,2020-08-24 00:00:00
TREASURE ISLAND  $1 GAMING TOKEN LAS VEGAS NEVADA NV CASINO CHIP TOKENS NEV ,23.99,2020-08-24 00:00:00
Animal Crossing New Horizons: CATALOG & LOOT TREASURE ISLAND | 5000+ Items!,12.99,2020-08-24 00:00:00
Treasure Island [Puffin Classics],4.01,2020-08-24 00:00:00
"Walt Disney 1950 BOBBY DRISCOLL-Treasure Island-Orignl Mexican Lobby Card 16""x12",42.99,2020-08-24 00:00:00
Animal Crossing New Horizons: CATALOG & LOOT TREASURE ISLAND | 5000+ Items FAST,8.99,2020-08-24 00:00:00
Animal Crossing: New Horizons Treasure Island UNLIMITED trips HOUR TUT ,15.99,2020-08-24 00:00:00
".999 FINE SILVER Limited Edition $10.00 Gaming Tokens, SET Of 6, Treasure Island",111.99,2020-08-24 00:00:00
Vtg Mirage Casino Treasure Island Reversible Satin Jacket 3XL Embroidered 90s,85.99,2020-08-24 00:00:00
The Muppets Treasure Island Used Scope 35mm Film Trailer,30.99,2020-08-24 00:00:00
"Treasure Island, Easton Press, Full Leatherbound",40.0,2020-08-24 00:00:00
Treasure Island Robert Louis Stevenson Hardback Book,4.0,2020-08-24 00:00:00
Treasure Island by Stevenson Robert Louis,24.94,2020-08-24 00:00:00
Royal Doulton England Porcelain Figurine HN 2243 Treasure Island ,51.0,2020-08-24 00:00:00
Obsolete Vintage Treasure Island Las Vegas Nevada $1 Token Coin. This Lot For 4,27.5,2020-08-24 00:00:00
Hardback Five On A Treasure Island  Enid Blyton 1965 17th Impression ,51.76,2020-08-24 00:00:00
$1 Las Vegas Treasure Island Casino Chip - Near Mint - Textured,22.99,2020-08-24 00:00:00
KEITH JARRETT - Treasure Island - CD Album *NEW & SEALED* *Digipak*,13.46,2020-08-24 00:00:00
"DISNEY: MUPPET TREASURE ISLAND - KERMIT'S 50TH ANNIVERSARY ED. DVD MOVIE, FS/WS",24.44,2020-08-25 00:00:00
🏝️ ACNH 🏝️ MATERIALS TREASURE ISLAND 🏝️ LOOT IT ALL & TAKE A FREE VILLAGER,10.99,2020-08-25 00:00:00
Las Vegas Treasure Island All Over Graphic Pink T Shirt Womens L Bedazzled,5.0,2020-08-25 00:00:00
Treasure Island FRIDGE MAGNET movie poster,16.93,2020-08-25 00:00:00
"Five On A Treasure Island by Enid Blyton,PB Book,Good-Shape,1978.",4.6,2020-08-25 00:00:00
"The Return to Treasure Island (DVD, 2001) (AMAZING DVD IN PERFECT CONDITION!!DIS",16.95,2020-08-25 00:00:00
"SEALED, Treasure Island by Robert Louis Stevenson, Easton Press Full Leather NEW",50.99,2020-08-25 00:00:00
Treasure Island (Treasure Island: Recorded Books Unabridged Classics) NEW!,32.99,2020-08-25 00:00:00
Great Illustrated Classics books Wind Willows Treasure Island Anne Green Gables,28.95,2020-08-25 00:00:00
TREASURE ISLAND by Stevenson Robert Louis 1947,18.84,2020-08-25 00:00:00
Treasure Island Add-On Listing (Custom),6.0,2020-08-25 00:00:00
Treasure Island [Little Golden Book],21.6,2020-08-25 00:00:00
"Treasure Island (DVD, 2003)",23.99,2020-08-25 00:00:00
Treasure Island by Stevenson New Ultimate Gift Hardcover Gold Gilt Edge & Ribbon,61.99,2020-08-25 00:00:00
Animal Crossing New Horizons: CATALOG & LOOT TREASURE ISLAND | 5000+ Items FAST,8.99,2020-08-25 00:00:00
Hear It Read It Classics Treasure Island Peter Pan King Arthur Tom Sawyer Books,30.99,2020-08-25 00:00:00
vtg 90s Treasure Island at the Mirage Las Vegas T-Shirt Casino poker skull sz. L,33.0,2020-08-25 00:00:00
"Collectible Florida Police Patch,Treasure Island,New",19.99,2020-08-25 00:00:00
$1 BRASS SLOT TOKEN COIN TREASURE ISLAND CASINO 1993 GDC MINT LAS VEGAS PIRATE ,13.18,2020-08-25 00:00:00
🔥Treasure Island 2 hours unlimited 🔥 Animal Crossing New Horizons & Raymond,20.0,2020-08-25 00:00:00
MSCHF Branded Books - Treasure Island By Robert Louis Stevenson (Only 1000 Made),65.0,2020-08-25 00:00:00
