title,price,dateTreasure Island by Robert Louis Stevenson • Like New • Free Postage,9.82,2020-09-08 00:00:00
CATALOG & LOOT TREASURE ISLAND | 5000+ Animal Crossing Items | 1 HOUR OF TRIPS,13.99,2020-09-08 00:00:00
LOOT & CATALOG TREASURE ISLAND | 5000+ Animal Crossing Items | UNLIMITED RUNS,7.99,2020-09-08 00:00:00
CATALOG & LOOT TREASURE ISLAND | 5000+ Animal Crossing Items | 1 HOUR TRIPS!,13.99,2020-09-11 00:00:00
CATALOG & LOOT TREASURE ISLAND | 5000+ Animal Crossing Items | 2 HOURS TRIPS!,28.99,2020-09-11 00:00:00
LOOT & CATALOG TREASURE ISLAND | 5000+ Animal Crossing Items | MULTIPLE TRIPS!,8.99,2020-09-11 00:00:00
Robert Louis Stevenson 5 Story Masterpieces Treasure Island Black Arrow Rare,90.88,2020-09-11 00:00:00
CATALOG & LOOT TREASURE ISLAND | 5000+ Animal Crossing Items | 1 Hour For 5,29.99,2020-09-11 00:00:00
LOOT & CATALOG TREASURE ISLAND | 5000+ Animal Crossing Items | One Extra,5.99,2020-09-11 00:00:00
Muppet Treasure Island / The Great Muppet Caper (Blu-ray & DVD),9.99,2020-09-11 00:00:00
"Treasure Island Kids - Pirates Of Treasure Island (DVD, 2007)(F13)",6.79,2020-09-11 00:00:00
Treasure Island by Robert Louis Stevenson illustrations by N.C. Wyeth 1937,100.0,2020-09-11 00:00:00
CATALOG & LOOT TREASURE ISLAND | 5000+ Animal Crossing Items | 3 HOURS OF TRIPS,35.99,2020-09-12 00:00:00
1995 Muppets Treasure Island McDonald's Happy Meal Tub Toy - Fozzie Bear #4,3.95,2020-09-12 00:00:00
"Muppet Treasure Island (DVD, 2005, 50th Anniversary Edition)",18.49,2020-09-12 00:00:00
Treasure Island Robert Louis Stevenson Whole Story Series Francois Place EXC,15.83,2020-09-12 00:00:00
Walt Disney's Race to Death Valley & Trapped on Treasure Island Mickey Mouse,30.16,2020-09-12 00:00:00
"Muppet Treasure Island (DVD, 2005, 50th Anniversary Edition) Tim Curry ##NEW##",15.63,2020-09-12 00:00:00
$1 Las Vegas Treasure Island 1st issue Casino Chip - Near Mint,11.88,2020-09-12 00:00:00
ANTIQUE BOOKS INSTANT LIBRARY 31 VOLS. R L STEVENSON 1923 TREASURE ISLAND + VGC,50.0,2020-09-12 00:00:00
set of 6 libbey treasure island 5 in size pirate theme tumblers 1960s era,26.0,2020-09-12 00:00:00
Treasure Island Las Vegas “Its A Gamble” T-Shirt Pin Up Girl Dice M B1,12.79,2020-09-12 00:00:00
1993 TREASURE ISLAND MIRAGE CASINO $10 GAMING TOKEN .999 SILVER STRIKE  220938,24.99,2020-09-12 00:00:00
Animal crossing New Horizons:Treasure Island-RAYMOND/UNLIMITED TRIPS IN 1 HOUR,18.99,2020-09-12 00:00:00
Kermit Frog Muppets Muppet Babies Treasure Island Pirate Piggy Bank 1989 HENSON,12.5,2020-09-12 00:00:00
Robert Louis Stevenson - Treasure Island (Edmund Dulac) - 1st (1927 First Ed),183.36,2020-09-12 00:00:00
1999 Barzso “Giant“ Treasure Island Playset. Complete. None Finer. Mint In Box.,697.8,2020-09-12 00:00:00
Vintage Robert L. Stevenson Treasure Island HC Grosset & Dunlap New York Pitz,14.85,2020-09-12 00:00:00
1939 Golden Gate International Exposition Guide Book map of Treasure Island VG,27.8,2020-09-12 00:00:00
LOOT & CATALOG TREASURE ISLAND | 5000+ Animal Crossing Items | MULTIPLE TRIPS,8.99,2020-09-12 00:00:00
"Treasure Island ~ Las Vegas, Nevada One Dollar Gaming Token",5.56,2020-09-12 00:00:00
TREASURE ISLAND tank-top XL pirate Mirage sleeveless tee Las Vegas gambling,16.0,2020-09-12 00:00:00
Treasure Island by Robert Louis Stevenson (1917 Hardcover) Good+ / Box Shipped,34.0,2020-09-12 00:00:00
"Folio Society - TREASURE ISLAND by Robert Louis Stevenson 1994, HC, Slipcase",71.86,2020-09-12 00:00:00
Easton Press Treasure Island ~ Robert Louis Stevenson 100 Greatest Series,26.6,2020-09-13 00:00:00
"Treasure Island Las Vegas, NV Pewter Pirate Skull - Swords Piece Of Eight Spoon",14.99,2020-09-13 00:00:00
Easton Press-Treasure Island-Stevenson-1994-leather bound collectors' ed-MINT ,45.0,2020-09-13 00:00:00
Jim Henson's Muppet Treasure Island Anniversary Edition(DVD 1996),8.79,2020-09-13 00:00:00
 Real Photo Postcard Treasure Island Golden Gate Exposition San Francisco CA ,6.0,2020-09-13 00:00:00
"Vintage POPEYE Comics, 1967-1969 ""Ghost Ship to Treasure Island & Danger, ahoy!""",7.99,2020-09-13 00:00:00
Muppets of Pirates and Pigs:Treasure Island / The Great Muppet Caper  Disney NEW,11.95,2020-09-13 00:00:00
CATALOG & LOOT TREASURE ISLAND | 5000+ Animal Crossing Items | 1 HR TRIPS FAST!,14.99,2020-09-13 00:00:00
Vintage Treasure Island Las Vegas Jacket Unisex Bomber Denim Large 100% Cotton,55.78,2020-09-13 00:00:00
Treasure Island #1 2 3 4 5 6 COMPLETE SERIES SET - Marvel Comics 2007 Roy Thomas,14.99,2020-09-13 00:00:00
CATALOG & LOOT TREASURE ISLAND | 5000+ Animal Crossing Items | Bring Friend,5.99,2020-09-13 00:00:00
"Muppet Treasure Island (DVD, 2005, 50th Anniversary Edition)",7.45,2020-09-13 00:00:00
LOOT & CATALOG TREASURE ISLAND | 5000+ Animal Crossing Items | UNLIMITED TRIPS!,8.99,2020-09-13 00:00:00
"Treasure Island by Barb Hendee and Robert Louis Stevenson (2016, Paperback)",5.57,2020-09-13 00:00:00
SERIAL /DON TERRY/THE SECRET OF TREASURE ISLAND /L16JU/belgium poster,214.0,2020-09-13 00:00:00
"Long John Silver (Return to Treasure Island) (1954) Action, Adventure Movie DVD",9.99,2020-09-13 00:00:00
Treasure Island (Penguin Classics) by Robert Louis Stevenson ,4.49,2020-09-13 00:00:00
"Charlie Chan at Treasure Island (DVD, 2007) OOP  w/ insert   BEWARE OF COPIES",8.95,2020-09-13 00:00:00
Treasure Island Hardcover Robert Louis Stevenson,5.4,2020-09-13 00:00:00
Classic Starts Books Lot : Peter Pan & Treasure Island ,8.99,2020-09-13 00:00:00
Treasure Island and The Amazing Zorro : 2 Full Length Features : New & Fast Ship,4.98,2020-09-13 00:00:00
"Treasure Island Stevenson Tom Sawyer Clemens Companion Library, 1963 2 books",17.6,2020-09-13 00:00:00
Animal Crossing New Horizons  2 Hours ! Catalog & Loot Treasure Island!,30.0,2020-09-13 00:00:00
LOOT & CATALOG TREASURE ISLAND | 5000+ Animal Crossing Items | UNLIMITED TRIPS,8.99,2020-09-13 00:00:00
Trolls on Treasure Island - NES (Nintendo Entertainment System) Tested! ,27.21,2020-09-14 00:00:00
"CLASSICS ILLUSTRATED #64 G, TREASURE ISLAND, 1ST PRINT. Gilberton Comics 1949",13.49,2020-09-14 00:00:00
Takarajima Treasure Island TV Anime Original BGM Collection CD OST,52.07,2020-09-14 00:00:00
Treasure Island,4.8,2020-09-14 00:00:00
Vintage Treasure Island TI Las Vegas Heavy Clear Glass (2) Skull Mugs 32 oz. ,34.0,2020-09-14 00:00:00
lego pirates Treasure Island 70411 complete with instructions ,49.5,2020-09-14 00:00:00
TREASURE ISLAND by Robert Louis Stevenson - Easton Press Leather - D1,37.5,2020-09-14 00:00:00
Animal Crossing New Horizons * Treasure Island! Read Description!,3.99,2020-09-14 00:00:00
TAKARAJIMA Treasure Island Japan Anime Roman Album 1979  ,94.98,2020-09-14 00:00:00
"Treasure Island (Blu-ray Disc, 65th Anniversary Disney Movie Club Exclusive) NEW",28.18,2020-09-14 00:00:00
2005 Barzso Treasure Island Playset American Revolution Militia 54 mm MIP,70.05,2020-09-14 00:00:00
Muppet Treasure Island 1996 Happy Meal Bathtub Toys Set of 4 McDonalds Kermit,16.98,2020-09-14 00:00:00
Asmodee Treasure Island Board Game Blacklight Markers Black Light Promo Gen Con,6.05,2020-09-14 00:00:00
"4 Vol Robert Louis Stevenson Kidnapped, Treasure Island, Arabian, Ballantrae HC",19.5,2020-09-14 00:00:00
Vintage Weebles Treasure Island Pirate Figures 1975 Hasbro,19.9,2020-09-14 00:00:00
Vintage Set Of FOUR Libbey Treasure Island Pirate Tumblers-Excellent Condition,21.49,2020-09-14 00:00:00
"Animal Crossing New Horizons 🏆 Treasure Island 🏆 1 trip, 1hr, 2hrs options",9.95,2020-09-14 00:00:00
Illustrated Junior Library Treasure Island H/C ,8.61,2020-09-14 00:00:00
Animal Crossing New Horizons 1 Hour ! Loot Treasure Island! Any Villager in box,13.0,2020-09-14 00:00:00
Kiss imPRESS Press-On Nails TREASURE ISLAND Halloween Ghost Spider Candy Corn!!!,15.18,2020-09-14 00:00:00
The Amazing Zorro / Treasure Island (Double Feature) - DVD - VERY GOOD,3.88,2020-09-14 00:00:00
LOOT & CATALOG TREASURE ISLAND | 5000+ Animal Crossing Items | BIG TRIPS FAST,8.99,2020-09-14 00:00:00
CATALOG & LOOT TREASURE ISLAND | 5000+ Animal Crossing Items | 2 HRS TRIPS FAST!,28.99,2020-09-14 00:00:00
Classics Illustrated lot of 17 Comics Treasure Island 1949 1952 1953 Ungraded,46.69,2020-09-14 00:00:00
The Art of Treasure Island 1939 Edition / Eugen Neuhaus,32.02,2020-09-14 00:00:00
Animal Crossing Treasure Island All You Can Loot Unlimited Trips Bell,19.95,2020-09-14 00:00:00
Sharon Lois & Bram's Elephant Show TREASURE ISLAND & SLEEP OVER ( 2 RARE VHS ),22.98,2020-09-14 00:00:00
Vintage Libbey Footed Cordial or Shot Glass Treasure Island Pirate Ship ,10.5,2020-09-14 00:00:00
Playmobil Pirates Treasure Island Playset 5728,25.69,2020-09-14 00:00:00
"Treasure Island (Barnes & Noble Classics) by Stevenson, Robert Louis",3.99,2020-09-14 00:00:00
  TREASURE ISLAND  ROBERT LOUIS STEVENSON  /  FRANKLIN LIBRARY Illustrated,17.0,2020-09-14 00:00:00
VTG 1950s Treasure Island Pirate Glasses Libbey Disney Pilsner Beer Glass LOT 4,28.94,2020-09-14 00:00:00
Florida FL Treasure Island John's Pass Kingfish Over the Water Postcard Old View,2.0,2020-09-14 00:00:00
Vintage Junior Deluxe Editions Treasure Island 1954 Hardcover Book,7.8,2020-09-14 00:00:00
Vintage Treasure Island Hotel Casino Vegas 2 Keno tickets / 3 booklets   HTF,11.77,2020-09-15 00:00:00
vintage treasure island book,7.8,2020-09-15 00:00:00
Treasure Island and The Ebb-Tide by Robert Louis Stevenson (English) Paperback B,10.48,2020-09-15 00:00:00
Animal Crossing New Horizons * Treasure Island! * 30min Loot! Read Description!,20.0,2020-09-15 00:00:00
VINTAGE AMAZON' FRUIT MUPPET TREASURE ISLAND YELLOW BOOMBOX RADIO,28.99,2020-09-15 00:00:00
Usborne Illustrated Originals Treasure Island Robert Louis Stevenson (Paperback),18.48,2020-09-15 00:00:00
$1 Las Vegas Treasure Island Casino Chip - Near Mint - Textured,9.88,2020-09-15 00:00:00
6 pc Muppet Treasure Island McDonalds Paper Happy Meal Bags 1996 Party Favors ,13.98,2020-09-15 00:00:00
"1916-""Stevenson's Treasure Island"" (Twentieth Century Text-Books), Hardcover ",15.33,2020-09-15 00:00:00
Easton Press Treasure Island Robert Louis Stevenson Hardcover Book 100 Greatest,33.45,2020-09-15 00:00:00
2 Muppety Adventures: The Great Muppet Caper / Muppet Treasure Island Of Pirates,5.74,2020-09-15 00:00:00
Treasure Island - Easton Press - Robert Louis Stevenson - Leather Coll. Edition,32.5,2020-09-15 00:00:00
Treasure Island Casino $10 Silver Striken Siren Coin ,29.0,2020-09-15 00:00:00
CATALOG & LOOT TREASURE ISLAND | 5000+ Animal Crossing Items | 1 HR OF TRIPS!,14.99,2020-09-15 00:00:00
Treasure Island Vegas Skull Pirate Large Beer Mug Stein Heavy Glass Mancave Bar,33.99,2020-09-15 00:00:00
"Animal Treasure Island (DVD, 2005)",63.74,2020-09-15 00:00:00
EASTON PRESS - Treasure Island by Robert Louis Stevenson Collectors Edition 1977,33.33,2020-09-15 00:00:00
Tropic Terrace Apartment Motel Treasure Island Florida Brochure,12.29,2020-09-15 00:00:00
Treasure Island and Blackbeard's Ghost Blu-Ray Movies Disney Movie Club Ex,56.49,2020-09-15 00:00:00
Antique Book ~ Treasure Island by Robert Louis Stevenson,7.33,2020-09-15 00:00:00
Walt Disney World Florida Treasure Island 1970S Postcard,12.59,2020-09-15 00:00:00
Vintage Hasbro 1975 Weebles Treasure Island Ship Boat w Pirate,26.2,2020-09-15 00:00:00
LOOT & CATALOG TREASURE ISLAND | 5000+ Animal Crossing Items | FAST & BIG TRIPS!,8.99,2020-09-15 00:00:00
Franklin D Roosevelt Visit To Treasure Island San Francisco 1938!,11.0,2020-09-16 00:00:00
1926 US Treasure Island Doubloon,5.79,2020-09-16 00:00:00
1939 GOLDEN GATE INTERNATIONAL EXPOSITION World's Fair coin Treasure Island,19.93,2020-09-16 00:00:00
Treasure Island (All You Can Loot) - 1 Hour Unlimited Trips | ANIMAL CROSSING,21.05,2020-09-16 00:00:00
Muppet Treasure Island DVD Brian Henson(DIR) 1996,6.49,2020-09-16 00:00:00
"Classic Starts: Treasure Island (Classic Starts Series) by Stevenson, Robert Lo",3.99,2020-09-16 00:00:00
Treasure Island SC Now Age Books Illustrated 1ST VG 1973 Stock Image Low Grade,7.6,2020-09-16 00:00:00
 Folio Society lot R.L. STEVENSON TREASURE ISLAND JEKYLL & HYDE KIDNAPPED others,211.52,2020-09-16 00:00:00
Treasure Island by Louis Stevenson,3.99,2020-09-16 00:00:00
Disney DVD Lot - Muppet Treasure Island (Used) The Great Muppet Caper (New),15.99,2020-09-16 00:00:00
Treasure Island San Francisco’s Exposition Years,13.81,2020-09-16 00:00:00
Kermit The Frog as Capt Smollett Muppets Treasure Island 17” Plush 1995 Vintage ,25.0,2020-09-16 00:00:00
Treasure Island Robert Louis Stevenson Junior Illustrated Library HC 1947,13.99,2020-09-16 00:00:00
Adventure on Treasure Island (PokÃ©mon Alola Chapter Book #3) - Paperback - GOOD,3.78,2020-09-16 00:00:00
TREASURE ISLAND FL POLICE DEPT PIRATE CHEST SHIP PALM TREE BLACK BEARD (FIRE),5.98,2020-09-16 00:00:00
Mickey Mouse Sails For Treasure Island Big Little Book 750 1933 Walt Disney,37.8,2020-09-16 00:00:00
45U*JAMAICAN* ALTON ELLIS WILLOW TREE / DANCE CRASHER ON TREASURE ISLAND RECORDS,19.0,2020-09-16 00:00:00
Treasure Island Robert Louis Stevenson Vtg Grosset & Dunlap Wartime Edition w/DJ,17.79,2020-09-16 00:00:00
LOt of 2 The Muppet Christmas Carol AND Muppet Treasure Island SEALED Disney,30.3,2020-09-16 00:00:00
CATALOG & LOOT TREASURE ISLAND | 5000+ Animal Crossing Items | 2 HR TRIPS FAST,24.99,2020-09-16 00:00:00
CATALOG & LOOT TREASURE ISLAND | 5000+ Animal Crossing Items | 1 HR TRIPS FAST!,14.99,2020-09-16 00:00:00
LOOT & CATALOG TREASURE ISLAND | 5000+ Animal Crossing Items | FAST TRIPS TODAY!,8.99,2020-09-16 00:00:00
Muppet Treasure Island DVD 50th Anniversary Edition JIM HENSON Walt Disney NEW,8.5,2020-09-16 00:00:00
Muppet Treasure Island/The Great Muppet Caper  (Blu-Ray ) 3 disc,11.99,2020-09-16 00:00:00
Treasure Island Robert Louis Stevenson Vintage 1924 Saalfield Publishing HB,19.99,2020-09-16 00:00:00
LEGO 70411 Pirates Treasure Island 100% Complete w/ minifigures - No box or inst,48.0,2020-09-16 00:00:00
Treasure Island by Robert Louis Stevenson Illustrated by N.C. Wyeth 1956 HC/DJ,32.86,2020-09-16 00:00:00
DISNEY TREASURE PLANET PACK OF 8 LOOT BAGS-BRAND NEW-RARE,6.4,2020-09-16 00:00:00
Treasure Island Casino 6 Shot Glasses Set Circus Circus NIB Gift Idea,18.98,2020-09-16 00:00:00
Oak Island Lunenburg  Halifax antique map photo keychain treasure island 🎁gift,12.99,2020-09-16 00:00:00
U.S. NAVAL STATION TREASURE ISLAND,1.99,2020-09-16 00:00:00
Treasure Island 1949 Robert Louis Stephenson Illustrated William Sharp Vintage,9.99,2020-09-16 00:00:00
1911 TREASURE ISLAND Book Robert Louis Stevenson First Edition 1st,102.86,2020-09-16 00:00:00
"Treasure Island, Las Vegas $1.00 Casino chip ",7.5,2020-09-16 00:00:00
Real Photo Postcard Treasure Island San Francisco CA,9.0,2020-09-16 00:00:00
Piggott Real Photo Postcard Treasure Island San Francisco Bay CA  ,7.0,2020-09-16 00:00:00
Piggott Real Photo Postcard Aerial View Treasure Island San Francisco Bay  CA ,7.45,2020-09-16 00:00:00
Real Photo Postcard Treasure Island Golden Gate Int'l Expo San Francisco CA,7.45,2020-09-16 00:00:00
Treasure Island by Robert Louis Stevenson - Electronic Book,1.09,2020-09-17 00:00:00
Think Geek Treasure Island Pillow Blue Think Geek Bibliophile Book Lover ,25.99,2020-09-17 00:00:00
"Treasure Island, Robert Louis Stevenson, Companion Library, 1963",17.79,2020-09-17 00:00:00
CATALOG & LOOT TREASURE ISLAND | 5000+ Animal Crossing Items | 2 Hours of Trips!,24.99,2020-09-17 00:00:00
LOOT & CATALOG TREASURE ISLAND | 5000+ Animal Crossing Items | FAST FULL TRIPS,8.99,2020-09-17 00:00:00
1996 McDonalds - Muppet Treasure Island set of 4+U3 *MIP*,17.11,2020-09-17 00:00:00
Muppet Treasure Island DVD Brian Henson(DIR) 1996,7.99,2020-09-17 00:00:00
"Treasure Island by Robert Louis Stevenson (1999, Paperback)",4.3,2020-09-17 00:00:00
Of Pirates  Pigs Collection: Muppet Treasure Island/The Great Muppet Caper (Blu…,14.5,2020-09-17 00:00:00
"Disney: Treasure Island (Blu-ray, 65th Anniversary)",28.99,2020-09-17 00:00:00
Older R/E Treasure Island Camp Patch BSA Yellow Bdr,8.2,2020-09-17 00:00:00
Vintage Treasure Island by Robert Louis Stevenson Scholastic Paperback Book,7.07,2020-09-17 00:00:00
Muppet Treasure Island DVD Brian Henson(DIR) 1996 Very good Good ,6.5,2020-09-17 00:00:00
Muppet Treasure Island Vintage Viewmaster Reels Blisterpacks 3 Pc Set,10.54,2020-09-17 00:00:00
"Avett Brothers Poster Treasure Island Resort & Casino Welch, MN 9/21/19",160.0,2020-09-17 00:00:00
TREASURE ISLAND by Robert Louis Stevenson ,3.8,2020-09-17 00:00:00
Treasure Island & Kidnapped Hardcover Book 1924 Robert Louis Stevenson   B07,44.87,2020-09-17 00:00:00
(5) Vintage SAN FRANCISCO TREASURE ISLAND PUBLIC SAFETY Patches Patch CALIFORNIA,37.0,2020-09-17 00:00:00
Avon Muppet Treasure Island Ring Miss Piggy,11.33,2020-09-17 00:00:00
CATALOG & LOOT TREASURE ISLAND | 5000+ Animal Crossing Items | 1 HR FULL TRIPS,14.99,2020-09-17 00:00:00
LOOT & CATALOG TREASURE ISLAND | 5000+ Animal Crossing Items | FAST FULL TRIPS!,8.99,2020-09-17 00:00:00
Nautilus Apartments Treasure Island St Petersburg Florida Joe Maddock,1.54,2020-09-17 00:00:00
"RPPC San Francisco,CA Treasure Island & the Golden Gate Bridge California",12.7,2020-09-17 00:00:00
Think Geek Treasure Island Book Blue Decorative Pillow,34.99,2020-09-17 00:00:00
"Treasure Island Inn Daytona Beach, FL Vintage Postcard",3.99,2020-09-18 00:00:00
CATALOG & LOOT TREASURE ISLAND | 5000+ Animal Crossing Items | 2 HRS OF TRIPS,24.99,2020-09-18 00:00:00
LOOT & CATALOG TREASURE ISLAND | 5000+ Animal Crossing Items | FAST READY TRIPS!,8.99,2020-09-18 00:00:00
Treasure Island (Puffin Classics) by Robert Louis Stevenson ,4.49,2020-09-18 00:00:00
"Hart Scout Reservation, Eagle Island, & Treasure Island Hard Hat  1960-70's   ",29.95,2020-09-18 00:00:00
Treasure Island Hardcover Book 1965,13.0,2020-09-18 00:00:00
Vintage Book - TREASURE ISLAND - Robert Louis Stevenson 1924 Saalfield ,14.99,2020-09-18 00:00:00
Vintage Old Postcard NEW JERSEY Treasure Island Campfire Boy Scout Camp Bonfire ,7.5,2020-09-18 00:00:00
Disney's Muppet Treasure Island (50th Anniversary Edition) Movie Film DVD -- NEW,11.99,2020-09-18 00:00:00
Treasure Island by Robert Louis Stevenson; Unabridged Audiobook on CD 2007,19.99,2020-09-18 00:00:00
"MUPPET TREASURE ISLAND (NEW DVD, 2005, 50th Anniv. Edit.) Disney. FAST FREE S&H.",9.99,2020-09-18 00:00:00
RED WING POTTERY SALT & PEPPER SET Treasure Island 2009 New,25.99,2020-09-18 00:00:00
Treasure Island - Retro Audio - digitally remastered - CD *NEW SEALED*,23.93,2020-09-18 00:00:00
Keith Jarrett / Treasure Island (CD Used) Impulse! MCAD-39106 (A9),9.5,2020-09-18 00:00:00
Vintage Whitman Big Little Book POPEYE GHOST SHIP TO TREASURE ISLAND ,8.99,2020-09-18 00:00:00
"Sharon, Lois & Bram's Elephant Show - Treasure Island (VHS, 1989)",20.0,2020-09-18 00:00:00
treasure island robert louis stevenson antique ,7.62,2020-09-18 00:00:00
" Treasure Island (VHS, 1992) NEW",6.99,2020-09-18 00:00:00
"Unique! Federal Law Forbids Sale ""Treasure Island"" 12"" Decanter Alcohol Bottle",20.98,2020-09-18 00:00:00
"Treasure Island, Big Little Book # 720, 1st printing 1933, Softcover Very Good",17.8,2020-09-18 00:00:00
"Vintage Surfing Florida Sun Coast Surf Shop Treasure Island, Fl Promo Patch",9.99,2020-09-19 00:00:00
RARE 1/6 BOOK ROBERT LOUIS STEVENSON-TREASURE ISLAND -1927 EDMUND DULAC 1ST ED!!,208.97,2020-09-19 00:00:00
CATALOG & LOOT TREASURE ISLAND | 5000+ Animal Crossing Items | 2 HRS FAST TRIPS,24.99,2020-09-19 00:00:00
CATALOG & LOOT TREASURE ISLAND | 5000+ Animal Crossing Items | 1 HR TRIPS FAST!,14.99,2020-09-19 00:00:00
CATALOG & LOOT TREASURE ISLAND | 5000+ Animal Crossing Items | 2 HRS FAST TRIPS!,24.99,2020-09-19 00:00:00
LOOT & CATALOG TREASURE ISLAND | 5000+ Animal Crossing Items | FAST & READY,8.99,2020-09-19 00:00:00
"Treasure Island (DVD, 2003) Complete Used Great Shape",9.79,2020-09-19 00:00:00
Lot Of 5 - Small Vintage Hardcover Books Farmhouse Decor  Treasure Island,15.86,2020-09-19 00:00:00
Lot Of 4 N.C. Wyeth Hardcover Books Robin Hood Robinson Crusoe Treasure Island,14.99,2020-09-19 00:00:00
Las Vegas Treasure Island Casino Vintage Pens - Lot of 2,6.88,2020-09-19 00:00:00
Robert Louis Stevenson Treasure Island Hard Back Book Folio Society.,68.86,2020-09-19 00:00:00
JACKIE COOPER SIGNED 3x5 INDEX CARD AUTOGRAPH - TREASURE ISLAND,13.99,2020-09-19 00:00:00
"Las Vegas Treasure Island Casino Vintage 10"" x 4"" Door Hanger",13.88,2020-09-19 00:00:00
Disney's treasure island    LaserDisc,9.92,2020-09-19 00:00:00
Treasure Island Robert Louis Stevenson Easton 100 Greatest Books w/ bookplate,39.99,2020-09-19 00:00:00
TREASURE ISLAND AT THE MIRAGE 550 Piece Puzzle with Collectable Tin COMPLETE ,16.63,2020-09-19 00:00:00
TREASURE ISLAND LAS VEGAS CARD DECK USED IN ACTUAL CASINO PLAY,6.49,2020-09-19 00:00:00
Animal Crossing New Horizons Treasure Island UNLIMITED trips 30min AVAILABLE NOW,13.5,2020-09-19 00:00:00
Treasure Island,8.8,2020-09-19 00:00:00
Vintage Robert Stevenson 1949 World's Greatest Literature TREASURE ISLAND Book ,17.5,2020-09-19 00:00:00
Pirate Ship Treasure Island Wall Art Sticker Mural Decal Kids Bedroom Decor BD59,37.7,2020-09-19 00:00:00
"The Amazing Zorro/ Treasure Island (DVD, 2005) WORLD SHIP AVAIL",4.24,2020-09-19 00:00:00
Treasure Island (Great Illustrated Classics (Abdo)) - Library Binding - GOOD,3.99,2020-09-19 00:00:00
"FLORIDA, TREASURE ISLAND MOTEL BEACH VIEW (FL-T*)",3.65,2020-09-19 00:00:00
"Treasure Island 1950 film (Blu-ray, 2015) Disney Movie Club Exclusive - NEW",28.09,2020-09-19 00:00:00
Hollow Book Safe Hidden Secret Stash Storage Box Treasure Island Stevenson 8x6x2,34.99,2020-09-19 00:00:00
Vintage Libby Treasure Island Theme Glasses Tumblers (4) Estate Pirate Swords,36.97,2020-09-19 00:00:00
Animal Treasure Island All you can Loot Crossing - Rare items -NH - see detail,3.99,2020-09-20 00:00:00
Walt Disney 1964 Treasure Island  33 1/3 RPM Disneyland Record,7.99,2020-09-20 00:00:00
Treasure Island Junior Deluxe Edition,6.55,2020-09-20 00:00:00
Trolls on Treasure Island Nintendo NES Vintage classic original game cartridge ,32.99,2020-09-20 00:00:00
Naval Station Treasure Island California Patch,12.74,2020-09-20 00:00:00
Muppet Treasure Island / The Great Muppet Caper Blu-ray/DVD 3 discs near mint!,14.99,2020-09-20 00:00:00
"""Treasure Island"",  from Alexander Henry Fabrics, ",13.25,2020-09-20 00:00:00
GAF VIEW MASTER PACKET REF B 432 TREASURE ISLAND + BOOKLET  AS PHOTOS,14.13,2020-09-20 00:00:00
Vintage Treasure Island by Robert Louis Stevenson 1943 Illustrated LOUIS RHEAD ,13.99,2020-09-20 00:00:00
CATALOG & LOOT TREASURE ISLAND | 5000+ Animal Crossing Items | 1 HR MULTI TRIPS,14.99,2020-09-20 00:00:00
CATALOG & LOOT TREASURE ISLAND | 5000+ Animal Crossing Items | 2 HRS TRIPS!,24.99,2020-09-20 00:00:00
LOOT & CATALOG TREASURE ISLAND | 5000+ Animal Crossing Items | FAST & READY!,8.99,2020-09-20 00:00:00
Treasure Island 1950 Blu Ray DMC Disney Movie Club Exclusive 65th Anniversary,30.0,2020-09-20 00:00:00
Playmobil Pirate Island Take Along 5737 Treasure Chest And 5728 Treasure Island,49.99,2020-09-20 00:00:00
CATALOG & LOOT TREASURE ISLAND | 5000+ Animal Crossing Items | 1 HR Discount,12.99,2020-09-20 00:00:00
Easton Press Treasure Island Robert Louis Stevenson Collector's Edition Leather,20.0,2020-09-20 00:00:00
1 trip Treasure Island Animal Crossing 🏝️ catalog island🍃 ,5.9,2020-09-20 00:00:00
"VINTAGE LOT CLASSICS ILLUSTRATED LOUIS RHEAD BOOKS, INC TREASURE ISLAND AND MORE",38.94,2020-09-20 00:00:00
Treasure Island Animal Crossing 1 Hour Of Unlimited Trips Catalog/Loot,14.99,2020-09-21 00:00:00
TREASURE ISLAND -by Robert Louis Stevenson readers digest Hardback 1987 ,11.0,2020-09-21 00:00:00
Silver: Return to Treasure Island,4.49,2020-09-21 00:00:00
Treasure Island 1st Edtion by Robert Louis Stevenson,45.0,2020-09-21 00:00:00
Book Shaped Trinket Box with Clock Treasure Island by Robert Louis Stevenson,29.0,2020-09-21 00:00:00
US SC# 852 FDC / Crosby Treasure Island Cachet - Z20132,7.74,2020-09-21 00:00:00
2005 Print Ad Treasure Island Las Vegas ~ TANGERINE Bawdy Burlesque Strip Club,8.74,2020-09-21 00:00:00
"Treasure Island (DVD, 2002)",6.0,2020-09-21 00:00:00
"Treasure Island (DVD 1950) Bobby Driscoll, Robert Newton",7.3,2020-09-21 00:00:00
"Treasure Island (DVD, 2003)",9.6,2020-09-21 00:00:00
Franklin Library Treasure Island-Robert Louis Stevenson Leather Bound (1RG5400),35.24,2020-09-21 00:00:00
Animal Crossing New Horizons Treasure Island Loot ALL Overnight 11 HRS🔥8p-7aPST,67.45,2020-09-21 00:00:00
ROBERT LOUIS STEVENSON Cassette Album & Book - TREASURE ISLAND,18.37,2020-09-21 00:00:00
2 Muppety Adventures:  The Great Muppet Caper / Muppet Treasure Island Of Pirate,6.26,2020-09-21 00:00:00
Selected Works of Robert Louis Stevenson : Treasure Island; Kidnapped; The...,9.86,2020-09-21 00:00:00
Lego Duplo Jake & the Neverland Pirates 10604 Treasure Island 95% COMPLETE Izzy,20.24,2020-09-21 00:00:00
"Treasure Island (Puffin + Pantone), Stevenson, Robert Louis",4.49,2020-09-21 00:00:00
1939 East Shore and Treasure Island Daily Special Exposition Train Service ,17.99,2020-09-21 00:00:00
"Walt Disney, 1997, Fantastic Adventure Series ~ Treasure Island ~ VHS Tape ~ New",10.0,2020-09-21 00:00:00
Vintage 1968 TREASURE ISLAND By Robert Louis Stevenson Hardcover Classic Press,7.54,2020-09-21 00:00:00
"Los cinco y el tesoro de la isla/ Five On A Treasure Island, Hardcover by Bly...",16.72,2020-09-21 00:00:00
Treasure Island - Robert Louis Stevenson - Folio Society 2014 (F) New and Sealed,98.72,2020-09-21 00:00:00
