title,price,dateANIMAL CROSSING TREASURE ISLAND 🎁🎄2-TRIPS  2-TRIPS🎁UPDATE🎄ForSketch,9.98,2020-11-28 00:00:00
ANIMAL CROSSING TREASURE ISLAND 🎁2-TRIPS 2-TRIPS🎁WINTER AMAZING🎄ForSketch,9.91,2020-11-28 00:00:00
Vintage Jigsaws Famous Five On A Treasure Island + Demon’s Rocks COMPLETE Bundle,5.38,2020-11-28 00:00:00
Vintage Pocket Book Treasure Island by Robert Louis Stevenson (Hardback) Used,34.3,2020-11-28 00:00:00
Playmobil ® Pirates Pirates-Treasure Island Treasure Island (6679) NEW & OVP,47.74,2020-11-28 00:00:00
Lot of 6 MUPPETS VHS Christmas Carol The Movie Space Caper Treasure Island Best,31.99,2020-12-01 00:00:00
Wooderful Life Wooden Treasure Island Pirate Treasure Music Box -Wonderful Life ,19.99,2020-12-01 00:00:00
TREASURE ISLAND Enchanted Tales VHS Tape 1996 Cartoon Animation Sony Wonder,19.99,2020-12-01 00:00:00
1947 Treasure Island Robert Louis Stevenson,37.0,2020-12-01 00:00:00
**Currently Offline** Animal Crossing Treasure Island 1 Hour Of Trips,15.0,2020-12-01 00:00:00
VINTAGE SHELL PORCELAIN GAS OIL TREASURE ISLAND GOLDEN GATE SERVICE STATION SIGN,249.57,2020-12-01 00:00:00
Treasure Island Disneyland LP 3997 1970 with Illustrated Book Cover G Vinyl VG+,14.99,2020-12-01 00:00:00
2005 90th Anniversary Rededication Treasure Island Order of the Arrow OA Patch,15.99,2020-12-01 00:00:00
Treasure Island (Franklin Library 1984) Robert Louis Stevenson,19.99,2020-12-01 00:00:00
LEGO Duplo 10604 Jake Never Land Pirates Treasure Island set (missing slide) ,27.99,2020-12-01 00:00:00
"TREASURE ISLAND & KIDNAPPED, Stevenson, International Collectors Library",26.99,2020-12-01 00:00:00
Animal Crossing 🌴 Catalog & Treasure Island 🌴 Short Trips  🌴 Private Sessions,4.99,2020-12-01 00:00:00
Lego Duplo Jake & the Neverland Pirates 10604 Treasure Island,14.99,2020-12-01 00:00:00
Treasure Island Robert louis Stevenson Lowell Press Worlds Library Masterpieces ,41.04,2020-12-01 00:00:00
"Treasure Island (A Stepping Stone Book(TM)) - Paperback By Norby, Lisa - GOOD",20.67,2020-12-01 00:00:00
MUPPET TREASURE ISLAND LetterBoxLASERDISC 1996 ,22.0,2020-12-01 00:00:00
Pirate Treasure Island Themed BOOK END Boat Yacht Sailor ⛵ Nautical Decor Gift,71.71,2020-12-01 00:00:00
1ST / 1ST EDITION of TREASURE ISLAND ACCORDING TO SPIKE MILLIGAN. FIRST. H/BACK.,45.52,2020-12-01 00:00:00
Treasure Island Prediction Mentalism Bizarre Magic Card Trick Easy,9.43,2020-12-01 00:00:00
Treasure Island Robert Louis Stevenson Vintage Paperback Very good,21.0,2020-12-01 00:00:00
Five on a Treasure Island (Famous Five),11.47,2020-12-01 00:00:00
"Bring the Classics to Life: Treasure Island by Robert Louis Stevenson (2008,New",20.82,2020-12-01 00:00:00
Easton Press Treasure Island Robert Louis Stevenson Leather Sealed   ,65.99,2020-12-01 00:00:00
"Muppet Treasure Island (DVD, 2005, 50th Anniversary Edition)",1.99,2020-12-01 00:00:00
Treasure Island - Robert Louis Stevenson - Folio Society 1994 (#32) 2005 Ptg,97.34,2020-12-01 00:00:00
Stevenson Robert Louis/ Sco...-Treasure Island BOOK NEW,6.16,2020-12-01 00:00:00
Treasure Island by Robert Louis Stevenson Saalfield Publishing 1924 Illustrated,20.0,2020-12-01 00:00:00
"Stevenson- 4 Leather Set: Kidnapped, Treasure Island, David Balfour & Ballantrae",45.0,2020-12-01 00:00:00
VINTAGE JIMMY BUFFET T-SHIRT TREASURE ISLAND MARGARITAVILLE RARE SIZE LARGE,29.0,2020-12-01 00:00:00
Treasure Island by Robert Louis Stevenson 2018 Paper Mill Press suede cover ,22.99,2020-12-01 00:00:00
Robert Louis Stevenson / Dulac - TREASURE ISLAND 1927 + Copyright sticker,58.01,2020-12-01 00:00:00
"Muppet Treasure Island (PC CD-ROM, 1996) ~ Complete w/ Manual",35.95,2020-12-01 00:00:00
Mega House John Silver - Treasure Island ,900.0,2020-12-02 00:00:00
Stevenson Treasure Island Easton Press Leather Book UNUSED COND,46.0,2020-12-02 00:00:00
"PIRATE: TREASURE ISLAND MOTEL & RESTAURANT (WEBSTER, MASSACHUSETTS) -F27",4.48,2020-12-02 00:00:00
"Updated: Catalog And Treasure Island 1 Hr, New holiday items.. DA attached.",19.99,2020-12-02 00:00:00
TREASURE ISLAND Robert Louis Stevenson 9 Color illus by Edmund Dulac & M Lee1930,21.99,2020-12-02 00:00:00
Video Game PC Pirates of Treasure Island eGames NEW SEALED,9.98,2020-12-02 00:00:00
Easton Press Collector’s Edition Treasure Island by Robert Louis Stevenson 1977,49.98,2020-12-02 00:00:00
"$10 .999 Silver Strike Casino Token. Treasure Island, Las Vegas, NV. SS12.",21.5,2020-12-02 00:00:00
"Walt Disney's Treasure Island~(DVD, 1950)~Bobby Driscoll Movie Kids BRAND NEW!",9.49,2020-12-02 00:00:00
Material Island & Treasure Island ,2.96,2020-12-02 00:00:00
Treasure Island by Robert Stevenson Illustrated New Cloth Bound Deluxe Hardcover,38.99,2020-12-02 00:00:00
VINTAGE 1989 BANK-KERMIT The FROG IN TREASURE ISLAND Jim HENSON CHARACTERS GUC,45.74,2020-12-02 00:00:00
2005 90th Anniversary Rededication Treasure Island Order of the Arrow OA Patch,17.99,2020-12-02 00:00:00
TREASURE ISLAND SAN FRANCISCO Postcard,5.0,2020-12-02 00:00:00
B004NXWXKU Treasure Island Publisher: Dover Publications; Unabridged edition,10.93,2020-12-02 00:00:00
REP. OF CHINA TAIWAN 2016 PHILATAIPEI WSC EXHIBITION (TREASURE ISLAND) 2 STAMPS,4.79,2020-12-03 00:00:00
REP. OF CHINA TAIWAN 2016 PHILATAIPEI WSC EXH. (TREASURE ISLAND) SOUVENIR SHEET,7.79,2020-12-03 00:00:00
Treasure Island/Captains Courageous - J.J. Little & Ives - 1953 -Hardcover -GP11,18.99,2020-12-03 00:00:00
Treasure Island by Robert Louis Stevenson: Used,1.45,2020-12-03 00:00:00
"Disney: Treasure Island (Blu-ray, 65th Anniversary)",42.99,2020-12-03 00:00:00
Treasure Island,57.0,2020-12-03 00:00:00
"Charades Men's Treasure Island Pirate Jacket, Black,, Black, Size X-Large GOCi",22.99,2020-12-03 00:00:00
"Animal Crossing New Horizons treasure island, infinite trips, + turkey/toy day",10.0,2020-12-03 00:00:00
Muppets Show Treasure Island Palisades Mr Samuel Arrow Figure Sam Eagle Series 4,15.0,2020-12-03 00:00:00
12 Custom Printed bright light pens. Name pens. Personalized pens. Stylus pen,33.95,2020-12-03 00:00:00
GREAT ILLUSTRATED CLASSICS Hardcover Books for Children - Lot of 20,48.99,2020-12-03 00:00:00
Vintage 1938 Treasure Island By Robert Louis Stevenson HC,9.95,2020-12-03 00:00:00
"Muppet Treasure Island (DVD, 2005, 50th Anniversary Edition)",2.5,2020-12-03 00:00:00
"Treasure Island,Robert L.Stevenson, h/c, Hebrew edit., Keter,Israel,70's. cs3592",26.95,2020-12-03 00:00:00
"Federal Theatre Project,Swing Mikado,Treasure Island,San Francisco,California",17.99,2020-12-03 00:00:00
"""Treasure Island"" N. C. Wyeth, illus. by Robert L. Stevenson For Young Readers",5.4,2020-12-03 00:00:00
Treasure Island Junior Classics for Young Readers,0.99,2020-12-03 00:00:00
Treasure Island Confectionery Cards 1957 - Full set of 25,22.83,2020-12-03 00:00:00
Treasure Island Florida - Adjustable Ball Cap Hat - Easy Close  FL USA,29.9,2020-12-03 00:00:00
Easton Press- Treasure Island by Stevenson-100 Greatest Books Written-SEALED,72.99,2020-12-03 00:00:00
Vintage Art N C Wyeth Ben Gunn 1911 Treasure Island Hermit Pirate Wilderness Man,27.59,2020-12-03 00:00:00
"Charlie Chan At Treasure Island [Used Very Good DVD] Full Frame, Mono Sound, N",38.19,2020-12-03 00:00:00
"Lot 40 CLASSIC STARTS Series Sterling_Heidi, Secret Garden, Treasure Island (HC)",109.0,2020-12-03 00:00:00
"Classic Starts: Treasure Island [Classic Starts Series] by Stevenson, Robert Lou",18.87,2020-12-03 00:00:00
Oversized postcard Florida FL St. Petersburg Trails End Motel Treasure Island,7.49,2020-12-03 00:00:00
KENTUCKY TAVERN--{Orig.Magazine Product Ad}---<1951>--TREASURE ISLAND DECANTER,17.7,2020-12-03 00:00:00
KENTUCKY TAVERN WHISKEY Treasure Island Gift Decanter 1951 Magazine Print Ad,2.95,2020-12-03 00:00:00
Animal Crossing Treasure Island Turkey/Christmas Update Loot/ Catalog 1 HR🌷🦋🐙,17.49,2020-12-03 00:00:00
 Treasure Island Casino Las Vegas Nevada Playing Cards,19.16,2020-12-03 00:00:00
Vintage Treasure Island Hotel Casino Vegas unsealed deck of playing cards HTF,7.77,2020-12-03 00:00:00
TREASURE ISLAND CASINO LAS VEGAS $1 ONE DOLLAR GAMING TOKEN ,22.0,2020-12-03 00:00:00
"Muppet Treasure Island (DVD, 2005, 50th Anniversary Edition)",18.45,2020-12-03 00:00:00
Treasure Island Prediction Mentalism Bizarre Magic Card Trick Easy,9.43,2020-12-03 00:00:00
"Animal Crossing:New Horizons Bells, Nook Miles Tickets, Fish Bait Fast Delivery",0.99,2020-12-03 00:00:00
"Russ Troll Doll Pink Hair 5"" Pirate Treasure Island Mirage Casino Las Vegas ",5.0,2020-12-04 00:00:00
"The Children’s Classics 6 Book Lot! Robin Hood, Black Beauty, Treasure Island +",22.0,2020-12-04 00:00:00
TREASURE ISLAND US NAVAL STATION PATCH USS ET PIN UP US NAVY AIR FACILITY SCHOOL,25.84,2020-12-04 00:00:00
"Treasure Island✨UNLIMITED 60 MINS!4000+ items,NMT,gold,DIY Recipes,Halloween",21.31,2020-12-04 00:00:00
Treasure Island Casino Glass Skull Pirate Mug Cup Las Vegas ,36.99,2020-12-04 00:00:00
Treasure Island by Robert L Stevenson Illustrated Junior Library HC 1947,33.0,2020-12-04 00:00:00
Treasure Island!!! by Sara Levine,16.99,2020-12-04 00:00:00
Treasure Island By Robert Louis Stevenson ,5.0,2020-12-04 00:00:00
VINTAGE EASTON PRESS LEATHER TREASURE ISLAND ROBERT LOUIS STEVENSON LIKE NEW,40.5,2020-12-04 00:00:00
Treasure Island (Little Golden Book) HARDCOVER 2017,34.4,2020-12-04 00:00:00
Playmobil Pirate Treasure Island Action Figures Rafts Assorted Weapons Building,14.99,2020-12-04 00:00:00
Vintage Dell .10 Cent Comic Book - Walt Disney’s Treasure island # 624,10.0,2020-12-04 00:00:00
Treasure Island VHS  Adventure Pirates kids family Disney Clamshell,3.99,2020-12-04 00:00:00
Treasure Island by Robert Louis Stevenson 1911 excellent 1st ed. ,106.99,2020-12-04 00:00:00
Treasure Island FL Bilmar Beach Resort Postcard unused 1960s,7.74,2020-12-04 00:00:00
"Lot Of 4 Moby Illustrated Classic Editions Treasure Island, Black Beauty, ",23.99,2020-12-04 00:00:00
Treasure Island Audiobook CD Set,38.95,2020-12-04 00:00:00
NEW 1995 Set of 2 Toy Biz Muppets Treasure Island Pirate Kermit and Miss Piggy,19.99,2020-12-04 00:00:00
🌞 Online Now 🌞 Toy Day Treasure Island Animal Crossing 1 Hour Of Trips,18.99,2020-12-04 00:00:00
"EASTON PRESS, Treasure Island, Leather Hardcover Collector's Edition",56.0,2020-12-04 00:00:00
DELUXE RD EDITION OF TREASURE ISLAND BY STEVENSON,29.5,2020-12-04 00:00:00
The Secret of Treasure Island - Cliffhanger Serial Movie DVD Don Terry,17.99,2020-12-04 00:00:00
"Treasure Island, R L Stevenson, Rand McNally, 1916",35.0,2020-12-04 00:00:00
MisLeDx's Treasure Island,11.99,2020-12-04 00:00:00
Muppet Treasure Island/The Great Muppet Caper (Blu-ray),18.0,2020-12-04 00:00:00
1982 - Walt Disney's Story of TREASURE ISLAND - #361,25.0,2020-12-04 00:00:00
$5 Las Vegas Treasure Island Millennium Casino Chip - UNCIRCULATED,26.99,2020-12-04 00:00:00
Turkey & Toy Day Update Animal Crossing Treasure Island 1 HR Unlimited Trips,12.0,2020-12-05 00:00:00
Classics Boxed Set: TREASURE ISLAND & TALES FROM KING ARTHUR: Wordsworth Edition,5.49,2020-12-05 00:00:00
1920’s TREASURE ISLAND by Robert Louis Stevenson Illustrated by Frank Godwin HC,11.99,2020-12-05 00:00:00
Muppet Treasure Island/The Great Muppet Caper (Blu-ray/DVD &Slip Very Good Cond,9.99,2020-12-05 00:00:00
Turkey & Toy Day Update Animal Crossing Treasure Island 1 HR Unlimited Trips,12.0,2020-12-05 00:00:00
Classic Starts Treasure Island King Arthur Dr Jekyll and Mr Hyde Bundle Lot Of 6,16.77,2020-12-05 00:00:00
Turkey & Toy Day Update Animal Crossing Treasure Island 1 HR Unlimited Trips,25.0,2020-12-05 00:00:00
Classics Boxed Set: TREASURE ISLAND & TALES FROM KING ARTHUR: Wordsworth Edition,5.49,2020-12-05 00:00:00
1920’s TREASURE ISLAND by Robert Louis Stevenson Illustrated by Frank Godwin HC,11.99,2020-12-05 00:00:00
Muppet Treasure Island/The Great Muppet Caper (Blu-ray/DVD &Slip Very Good Cond,25.99,2020-12-05 00:00:00
Turkey & Toy Day Update Animal Crossing Treasure Island 1 HR Unlimited Trips,25.0,2020-12-05 00:00:00
Classic Starts Treasure Island King Arthur Dr Jekyll and Mr Hyde Bundle Lot Of 6,31.77,2020-12-05 00:00:00
Turkey & Toy Day Update Animal Crossing Treasure Island 1 Trip (40 Pockets),16.0,2020-12-05 00:00:00
Vintage Moby Books 1970s Sherlock Holmes & Treasure Island Illustrated Editions,21.5,2020-12-05 00:00:00
"Treasure Island by Robert Louis Stevenson 2005, 6-CD Unabridged AUDIOBOOK!",31.0,2020-12-05 00:00:00
Turkey & Toy Day Update Animal Crossing Treasure Island 1 HR Unlimited Trips,25.0,2020-12-05 00:00:00
"$3 Treasure Island Raid 5 trips DIYs, Materials, Villager Photos and New Items",3.0,2020-12-05 00:00:00
SAILORS MAIL WORLD WAR 2 1944 MACHINE CANC ARMED GUARD PACIFIC NO CONTENTS (1541,8.25,2020-12-05 00:00:00
"Muppet Treasure Island (DVD, 2005, 50th Anniversary Edition)",20.98,2020-12-05 00:00:00
Glam and glits Nail Acrylic Powder - Color Pop Collection 1oz - Choose Colors,22.6,2020-12-05 00:00:00
"Disney Treasure Island, starring Mickey Mouse (Graphic Novel) by Disney, Radice",6.49,2020-12-05 00:00:00
TREASURE ISLAND Robert Louis Stevenson Vintage 1950 Paperback Book Illustrated,18.99,2020-12-05 00:00:00
"Strawberry ""Treasure Island F1""",4.78,2020-12-05 00:00:00
c1895 Treasure Island by Robert Louis Stevenson Henry Altemus Pirates Rare Blue,75.99,2020-12-05 00:00:00
"Muppet Treasure Island (VHS, 1996)",5.99,2020-12-05 00:00:00
Treasure Island Leather 1994 Easton Press Illustrated,19.99,2020-12-05 00:00:00
Walt Disney MUPPET TREASURE ISLAND Movie Promo Button Pin Video Release Pinback,29.95,2020-12-05 00:00:00
Treasure Island,15.92,2020-12-05 00:00:00
1936 Hardback-Spencer Press-Worlds Greatest Literature-Vol 12-Treasure Island-VG,8.0,2020-12-05 00:00:00
Treasure Island - Robert Louis Stevenson - Folio Society - Out of Print,132.81,2020-12-05 00:00:00
Jim Henson's Muppet Treasure Island Anniversary Edition(DVD 1996),22.99,2020-12-05 00:00:00
MUPPET TREASURE ISLAND MOVIE POSTER 2 Sided RARE ORIGINAL 27x40 DREW STRUZAN,29.0,2020-12-05 00:00:00
Animal crossing new horizons treasure island unlimited trips take all you can,6.12,2020-12-05 00:00:00
1939 GOLDEN GATE INTERNATIONAL EXPOSITION TOKEN COIN Treasure Island 32mm,10.0,2020-12-06 00:00:00
Five on a Treasure Island (Famous Five 70th Anniversary),11.37,2020-12-06 00:00:00
Franklin Library TREASURE ISLAND Robert Louis Stevenson Deluxe Leatherbound 1975,19.99,2020-12-06 00:00:00
🌞 Online Now 🌞 Toy Day Treasure Island Animal Crossing 1 Hour Of Trips,18.99,2020-12-06 00:00:00
Treasure Island--Robert Louis Stevenson--1968 Large Print Paperback,22.97,2020-12-06 00:00:00
Disney Muppet Treasure Island View-master Reels Pack sealed MOC,14.99,2020-12-06 00:00:00
Easton Press TREASURE ISLAND Robert Louis Stevenson Collector’s Limited Edition ,57.39,2020-12-06 00:00:00
HUGE LOT OF 50 TREASURE ISLAND  REAL  CASINO CHIPS; 6  DIFFERENT COLORS; LOT 12A,14.99,2020-12-06 00:00:00
VHS Walt Disney Classic Adventure Series Bobby Driscoll Treasure Island,2.99,2020-12-06 00:00:00
KERMIT the Frog Pirate MUPPETS Plush Treasure Island NANCO NWT-- Free Shipping!,18.0,2020-12-06 00:00:00
ROYAL DOULTON FIGURINES -TREASURE ISLAND HN2243 & ALICE HN2158 - MADE IN ENGLAND,34.0,2020-12-06 00:00:00
TREASURE ISLAND DVD Brand NEW FACTORY Sealed WALT Disney 1950 PIRATES CLASSIC,12.95,2020-12-06 00:00:00
"Treasure Island (Blu-ray Disc, 2012)",10.15,2020-12-06 00:00:00
Royal Doulton Treasure Island figurine boy reading book,19.95,2020-12-06 00:00:00
1947 TREASURE ISLAND BY ROBERT LOUIS STEVENSON,6.99,2020-12-06 00:00:00
Materials Animal Crossing Treasure Island 1 Trip CHEAP,3.0,2020-12-06 00:00:00
Muppet Treasure Island/The Great Muppet Caper Blu-ray/DVD,27.48,2020-12-06 00:00:00
TREASURE ISLAND NEW DVD,18.01,2020-12-06 00:00:00
Treasure Island RL Stevenson (Franklin Library - Collector's Best-Loved) leather,199.6,2020-12-06 00:00:00
"Vintage Treasure Island California Travel Decal T-Shirt - San Francisco, Popeye",31.49,2020-12-06 00:00:00
"Classics Illustrated Treasure Island, The Iliad, Men Of Iron Books Lot Of 3",19.99,2020-12-06 00:00:00
1939 GOLDEN GATE INTERNATIONAL EXPOSITION TOKEN COIN Treasure Island 32mm,10.0,2020-12-06 00:00:00
Five on a Treasure Island (Famous Five 70th Anniversary),9.37,2020-12-06 00:00:00
Franklin Library TREASURE ISLAND Robert Louis Stevenson Deluxe Leatherbound 1975,19.99,2020-12-06 00:00:00
🌞 Online Now 🌞 Toy Day Treasure Island Animal Crossing 1 Hour Of Trips,18.99,2020-12-06 00:00:00
Treasure Island--Robert Louis Stevenson--1968 Large Print Paperback,17.47,2020-12-06 00:00:00
Disney Muppet Treasure Island View-master Reels Pack sealed MOC,27.99,2020-12-06 00:00:00
Easton Press TREASURE ISLAND Robert Louis Stevenson Collector’s Limited Edition ,73.39,2020-12-06 00:00:00
HUGE LOT OF 50 TREASURE ISLAND  REAL  CASINO CHIPS; 6  DIFFERENT COLORS; LOT 12A,14.99,2020-12-06 00:00:00
VHS Walt Disney Classic Adventure Series Bobby Driscoll Treasure Island,19.99,2020-12-06 00:00:00
KERMIT the Frog Pirate MUPPETS Plush Treasure Island NANCO NWT-- Free Shipping!,18.0,2020-12-06 00:00:00
ROYAL DOULTON FIGURINES -TREASURE ISLAND HN2243 & ALICE HN2158 - MADE IN ENGLAND,34.0,2020-12-06 00:00:00
"Treasure Island  / In Search Of The Castaways 2-Movie Collection DVD, Sanders, G",13.08,2020-12-06 00:00:00
TREASURE ISLAND DVD Brand NEW FACTORY Sealed WALT Disney 1950 PIRATES CLASSIC,25.95,2020-12-06 00:00:00
"Treasure Island (Blu-ray Disc, 2012)",10.15,2020-12-06 00:00:00
Royal Doulton Treasure Island figurine boy reading book,42.95,2020-12-06 00:00:00
1947 TREASURE ISLAND BY ROBERT LOUIS STEVENSON,6.99,2020-12-06 00:00:00
Materials Animal Crossing Treasure Island 1 Trip CHEAP,16.0,2020-12-06 00:00:00
Muppet Treasure Island/The Great Muppet Caper Blu-ray/DVD,24.63,2020-12-06 00:00:00
TREASURE ISLAND NEW DVD,18.01,2020-12-06 00:00:00
Treasure Island RL Stevenson (Franklin Library - Collector's Best-Loved) leather,199.6,2020-12-06 00:00:00
"Vintage Treasure Island California Travel Decal T-Shirt - San Francisco, Popeye",31.49,2020-12-06 00:00:00
"Classics Illustrated Treasure Island, The Iliad, Men Of Iron Books Lot Of 3",19.99,2020-12-06 00:00:00
"Treasure Island by Robert Louis Stevenson, illustrated Milo Winter, HC, NY 1986",11.99,2020-12-07 00:00:00
Usborne Illustrated Originals Black Beauty AND Treasure Island (Brand New!),26.0,2020-12-07 00:00:00
🌞 Online Now 🌞 Toy Day Treasure Island Animal Crossing 1 Hour Of Trips,18.99,2020-12-07 00:00:00
The Great American Classics for Children: Treasure Island - Hardcover,1.99,2020-12-07 00:00:00
Materials Animal Crossing Treasure Island 1 HR Unlimited Trips CHEAP,12.0,2020-12-07 00:00:00
Treasure Island Dig and Play Dig for Pirate Treasure and Board Game,10.99,2020-12-07 00:00:00
C.P.O. Mess Treasure Island Season's Greetings Matchbook San Francisco,4.95,2020-12-07 00:00:00
1913 Treasure Island Camp Patch Unami Lodge 1 Cradle of Liberty Council,18.24,2020-12-07 00:00:00
TREASURE ISLAND original 27X41 DISNEY one sheet movie poster ROBERT NEWTON,88.94,2020-12-07 00:00:00
Oak Island Nova Scotia antique map photo keychain famous treasure island 🎁gift,28.24,2020-12-07 00:00:00
Treasure Island Delivery 40 Slots Recipes Material Funitrue Animal ;: CROSSING,3.51,2020-12-07 00:00:00
Treasure Island (Puffin Classics) by Robert Louis Stevenson ,16.47,2020-12-07 00:00:00
$10 .999 SILVER TREASURE ISLAND LAS VEGAS LIMITED EDITION CASINO TOKEN Lot#AB57,29.0,2020-12-07 00:00:00
Treasure Island Delivery 40 Slots Recipes Material Funitrue Animal ;: CROSSING,3.51,2020-12-07 00:00:00
Vintage Treasure Island Beach Towel,30.0,2020-12-07 00:00:00
LEGO Pirates Treasure Island 70411 - BRAND NEW FACTORY SEALED,64.99,2020-12-07 00:00:00
Vintage Hardback ‘Treasure Island’ By Robert Louis Stevenson,22.93,2020-12-07 00:00:00
Explorations & Adventures 3-in-1 (DVD Movie) Treasure Island  ****DISC ONLY*****,52.42,2020-12-07 00:00:00
1971 Walt Disney TREASURE ISLAND Read Along Book And 33 1/3 Vinyl Record #361,12.75,2020-12-07 00:00:00
Paul Morris Treasure Island Media Black Tank Top Gay Medium Ribbed Jolly Roger,25.0,2020-12-07 00:00:00
Antique Treasure Island Childs Coin Bank Book,14.99,2020-12-07 00:00:00
Lot of 10 Moby Books Illustrated Classic Mini Books Wizard Oz Treasure Island ,29.99,2020-12-07 00:00:00
Playmobil 6679 - Pirate Treasure Island - Pirates - Sealed,129.99,2020-12-07 00:00:00
1940 Golden Gate Exposition Treasure Island Sew-Journers Club Drawing Ticket,25.48,2020-12-07 00:00:00
"Treasure Island Las Vegas Collectible Spoon, solid pewter",10.0,2020-12-07 00:00:00
Barnes & Noble Leather bound Classic Treasure Island Stevenson ,20.0,2020-12-07 00:00:00
Turkey & Toy Day Update Animal Crossing Treasure Island 1 HR Unlimited Trips,12.0,2020-12-07 00:00:00
"Treasure Island by Robert Louis Stevenson, illustrated Milo Winter, HC, NY 1986",25.99,2020-12-07 00:00:00
Usborne Illustrated Originals Black Beauty AND Treasure Island (Brand New!),26.0,2020-12-07 00:00:00
🌞 Online Now 🌞 Toy Day Treasure Island Animal Crossing 1 Hour Of Trips,18.99,2020-12-07 00:00:00
The Great American Classics for Children: Treasure Island - Hardcover,1.99,2020-12-07 00:00:00
Materials Animal Crossing Treasure Island 1 HR Unlimited Trips CHEAP,25.0,2020-12-07 00:00:00
Return to Treasure Island -  EACH DVD $2 BUY AT LEAST 4,19.98,2020-12-07 00:00:00
Treasure Island Dig and Play Dig for Pirate Treasure and Board Game,10.99,2020-12-07 00:00:00
C.P.O. Mess Treasure Island Season's Greetings Matchbook San Francisco,4.95,2020-12-07 00:00:00
1913 Treasure Island Camp Patch Unami Lodge 1 Cradle of Liberty Council,15.99,2020-12-07 00:00:00
TREASURE ISLAND original 27X41 DISNEY one sheet movie poster ROBERT NEWTON,88.94,2020-12-07 00:00:00
Oak Island Nova Scotia antique map photo keychain famous treasure island 🎁gift,25.24,2020-12-07 00:00:00
Treasure Island Delivery 40 Slots Recipes Material Funitrue Animal ;: CROSSING,3.51,2020-12-07 00:00:00
Treasure Island (Puffin Classics) by Robert Louis Stevenson ,11.47,2020-12-07 00:00:00
$10 .999 SILVER TREASURE ISLAND LAS VEGAS LIMITED EDITION CASINO TOKEN Lot#AB57,29.0,2020-12-07 00:00:00
Treasure Island Delivery 40 Slots Recipes Material Funitrue Animal ;: CROSSING,3.51,2020-12-07 00:00:00
Vintage Treasure Island Beach Towel,55.0,2020-12-07 00:00:00
LEGO Pirates Treasure Island 70411 - BRAND NEW FACTORY SEALED,64.99,2020-12-07 00:00:00
Vintage Hardback ‘Treasure Island’ By Robert Louis Stevenson,56.93,2020-12-07 00:00:00
Explorations & Adventures 3-in-1 (DVD Movie) Treasure Island  ****DISC ONLY*****,40.73,2020-12-07 00:00:00
1971 Walt Disney TREASURE ISLAND Read Along Book And 33 1/3 Vinyl Record #361,25.75,2020-12-07 00:00:00
Lego Duplo Dora The Explorer 7330 Dora's Treasure Island Complete No Box,44.99,2020-12-07 00:00:00
Paul Morris Treasure Island Media Black Tank Top Gay Medium Ribbed Jolly Roger,25.0,2020-12-07 00:00:00
Antique Treasure Island Childs Coin Bank Book,35.99,2020-12-07 00:00:00
Lot of 10 Moby Books Illustrated Classic Mini Books Wizard Oz Treasure Island ,48.99,2020-12-07 00:00:00
Playmobil 6679 - Pirate Treasure Island - Pirates - Sealed,129.99,2020-12-07 00:00:00
1940 Golden Gate Exposition Treasure Island Sew-Journers Club Drawing Ticket,22.63,2020-12-07 00:00:00
"Treasure Island Las Vegas Collectible Spoon, solid pewter",28.0,2020-12-07 00:00:00
Barnes & Noble Leather bound Classic Treasure Island Stevenson ,20.0,2020-12-07 00:00:00
Turkey & Toy Day Update Animal Crossing Treasure Island 1 HR Unlimited Trips,25.0,2020-12-07 00:00:00
"Treasure Island (Barnes & Noble Classics) Stevenson, Robert Louis Paperback Use",20.89,2020-12-07 00:00:00
Treasure Island by Stevenson & Illustrated N.C. Wyeth Sealed Leather Hardback,19.99,2020-12-08 00:00:00
Muppet Treasure Island 1994 & Muppets From Space 1999 New Factory Sealed DVD's,12.95,2020-12-08 00:00:00
"Franklin Library TREASURE ISLAND by Robert Louis Stevenson 1st Thus, W Paget Pic",29.99,2020-12-08 00:00:00
"EC 1953 MAD No. 7 FN- 5.5 Shermlock Shomes, Treasure Island!, Smilin' Melvin",169.25,2020-12-08 00:00:00
Vintage Walt Disney Children's Records LP Vinyl Collection - You Pick!,6.0,2020-12-08 00:00:00
Men's VTG Mirage Casino Reversible Satin Treasure Island Bomber Jacket Sz Small,35.0,2020-12-08 00:00:00
"Updated: Catalog And Treasure Island 2 Hrs, Holidays items. DA attached!",29.99,2020-12-08 00:00:00
1936 WORLD'S GREATEST LITERATURE TREASURE ISLAND STEVENSON HARDCOVER VOL 12,12.75,2020-12-08 00:00:00
VINTAGE WHITMAN BIG LITTLE BOOK POPEYE GHOST SHIP TO TREASURE ISLAND 1967 ,9.0,2020-12-08 00:00:00
New Playmobil 6679 - Pirate Treasure Island,117.18,2020-12-08 00:00:00
$1 SLOT Gaming TOKEN - Treasure Island CASINO - Las Vegas NV Nevada,3.99,2020-12-08 00:00:00
"Treasure Island (DVD, 2006)",31.24,2020-12-08 00:00:00
Vintage Order of the Arrow OA Treasure Island 1915 BSA Boy Scout Medallion Coin,32.99,2020-12-08 00:00:00
"Treasure Island by Robert Louis Stevenson (Paperback, 2003)",24.36,2020-12-08 00:00:00
Franklin Library: ROBERT LOUIS STEVENSON: TREASURE ISLAND: LONG JOHN SILVER,44.95,2020-12-08 00:00:00
"PIRATE: TREASURE ISLAND NIGHTCLUB (WASHINGTON, DC) (1950s) -F27",6.98,2020-12-08 00:00:00
Disney Treasure Island (LP Vinyl Record Album) DQ-1251,7.99,2020-12-08 00:00:00
$25 SENOR FROGS LAS VEGAS RESTAURANT GIFT CERTIFICATE VOUCHER @ TREASURE ISLAND,3.0,2020-12-08 00:00:00
Muppet Treasure Island - Kermit's 50th Anniversary Edition,4.69,2020-12-08 00:00:00
1939 SAN FRANCISCO TREASURE ISLAND BOOK WORLD'S FAIR EXPOSITION GOLDEN GATE ,28.5,2020-12-08 00:00:00
